id,created_at,edit_history_tweet_ids,text,clean_text,non_english
1.484210069399036e+18,2022-01-20 17:03:50+00:00,['1484210069399035904'],"@evilangela @nikiw @CandaceMQZ It's a tricky one. I see that side but I also think that given the number of women that do change their mind, it would be better to have access to good, free contraception (as we do in UK). There are also potential risks with surgery. I can see why a doctor would advise against.",tricky one see side also think given number woman change mind would better access good free contraception also potential risk surgery see doctor would advise,False
1.484162497301164e+18,2022-01-20 13:54:48+00:00,['1484162497301164033'],"@GwendoPo @cabey001 @BootstrapCook Luxury items have increased in price. (everything in M&amp;S costs more than it did three years ago- I was lucky enough to get luxuries then but now don't bother as it's too much). Jack's right in pointing out that percentage wise, it's a smaller difference than the cheapest foods.",luxury item increased price everything mamps cost three year ago lucky enough get luxury bother much jack's right pointing percentage wise smaller difference cheapest food,False
1.4841563283229983e+18,2022-01-20 13:30:17+00:00,['1484156328322998273'],"@volpagirl @JournalistJill @SocialMediaTodd Hopefully there will be more flexibility on work from home, at least for office workers who don't actually need to be there. I find it bizarre that people choose to come in when sick though. (Happened in my last office with a WFH policy.)",hopefully flexibility work home least office worker actually need find bizarre people choose come sick though happened last office wfh policy,False
1.4841423789025075e+18,2022-01-20 12:34:51+00:00,['1484142378902507526'],"@evilangela @nikiw @CandaceMQZ It's more the issue of it being permanent I think. I know many people who (at the age of 22) never wanted children and have since changed their minds. Of course that won't be the case for everyone, but keeping options open at such a young age is important.",issue permanent think know many people age never wanted child since changed mind course case everyone keeping option open young age important,False
1.484141780845146e+18,2022-01-20 12:32:29+00:00,['1484141780845146117'],@nikiw @CandaceMQZ Yes it seems very unlikely. Many 22 year olds don't want children but later change their mind. Highly unlikely she'd be sterilised. (Mother sounds nuts though!),yes seems unlikely many year old want child later change mind highly unlikely she'd sterilised mother sound nut though,False
1.4841370197396234e+18,2022-01-20 12:13:34+00:00,['1484137019739623427'],@JournalistJill @GeorgieR30 I'll carry on wearing one on the tube. I absolutely HATED being coughed and sneezed on during winter and always wished it was more socially acceptable to wear masks. They don't bother me in the slightest and the evidence suggests they offer some protection against viruses.,i'll carry wearing one tube absolutely hated coughed sneezed winter always wished socially acceptable wear mask bother slightest evidence suggests offer protection virus,False
1.4841363425943306e+18,2022-01-20 12:10:52+00:00,['1484136342594330624'],@volpagirl @JournalistJill @SocialMediaTodd I agree we should have time off. But let's say you have a cold and have to travel for unavoidable reasons. Why not wear a mask on busy transport? It works well in Japan and is considered basic courtesy. Worth noting what is a mild cold to one person might not be mild for another.,agree time let's say cold travel unavoidable reason wear mask busy transport work well japan considered basic courtesy worth noting mild cold one person might mild another,False
1.4838734461572424e+18,2022-01-19 18:46:13+00:00,['1483873446157242376'],@Missives0fASub How about the cheese barge!?,cheese barge,False
1.483799876156674e+18,2022-01-19 13:53:52+00:00,['1483799876156674058'],@Missives0fASub Oh I will fight you on it. But I'd start by tackling all the processed crap and takeouts. 😂,fight i'd start tackling processed crap takeout,False
1.4837616780555264e+18,2022-01-19 11:22:05+00:00,['1483761678055526403'],@Missives0fASub There are so many food related things I'd fight you on I'm not even sure I'd start with the mayo...,many food related thing i'd fight i'm even sure i'd start mayo,False
1.4834964353709384e+18,2022-01-18 17:48:06+00:00,['1483496435370938369'],"@pjsouthall @parthaskar He's into a lot of woowoo shit by the looks of it. He and his wife make a tidy income selling vagina steamers to ""detox"" the womb for better fertility.",he's lot woowoo shit look wife make tidy income selling vagina steamer detox womb better fertility,False
1.4833878966400246e+18,2022-01-18 10:36:49+00:00,['1483387896640024576'],"@MissMaxine Overall I meet far fewer people in London because people don't talk to each other, but more people that I share common ground and values with. I think that's the biggest thing for me- my values clashed a lot with people in Dubai. But the same could be true in another part of UK",overall meet far fewer people london people talk people share common ground value think that's biggest thing value clashed lot people dubai could true another part,False
1.4833875098538967e+18,2022-01-18 10:35:17+00:00,['1483387509853896704'],"@MissMaxine Yep. I've heard so many people say they found it easier to meet people in Dubai than London. I did too, and met a few wonderful people. But I also found it hard work dealing with certain types of expat there. There seemed to be a greater proportion of dickheads per sq metre. 😂",yep i've heard many people say found easier meet people dubai london met wonderful people also found hard work dealing certain type expat seemed greater proportion dickhead per metre,False
1.483379548947456e+18,2022-01-18 10:03:38+00:00,['1483379548947456005'],@MissMaxine Dubai but perhaps not with same interests as me? I've always been more liberal academic/politico journo type and I found Dubai quite business/sales focussed. That's not necessarily a criticism but possibly why I didn't fit in.,dubai perhaps interest i've always liberal academicpolitico journo type found dubai quite businesssales focussed that's necessarily criticism possibly fit,False
1.483379148664058e+18,2022-01-18 10:02:03+00:00,['1483379148664057858'],@MissMaxine Yeah. I found it really hard to keep my mouth shut. But I also never felt fully at home in Dubai. I spoke to so many people when I was out but always struggled to make connections. I'm not sure why I just feel I fit in better in London. There's a lot of successful people in,yeah found really hard keep mouth shut also never felt fully home dubai spoke many people always struggled make connection i'm sure feel fit better london there's lot successful people,False
1.4833652054511944e+18,2022-01-18 09:06:39+00:00,['1483365205451194370'],"@MissMaxine That said in terms of the exploitation- I think it's bad everywhere in the West. This isn't unique to Dubai, it's just more on display there and there's no apology for it. UK benefits from slave labour but we brush it under the carpet.",said term exploitation think bad everywhere west unique dubai display there's apology benefit slave labour brush carpet,False
1.4833648617698796e+18,2022-01-18 09:05:17+00:00,['1483364861769879553'],@MissMaxine I'm a journalist and have grown up around politics. My gut instinct is to expose and debate. It felt uncomfortable being in a place where you don't have the option to criticise the government. I was also concerned about women's rights. If anything happened to me I'd be powerless.,i'm journalist grown around politics gut instinct expose debate felt uncomfortable place option criticise government also concerned women's right anything happened i'd powerless,False
1.4833554185670984e+18,2022-01-18 08:27:45+00:00,['1483355418567098368'],"@MissMaxine I lived there for a while. (The weather was great.) I think exploitation happens everywhere in the world, but it's more obvious (and almost celebrated) in Dubai which made me uncomfortable. Also lack of democracy &amp; having a voice was challenging. Interesting experience overall.",lived weather great think exploitation happens everywhere world obvious almost celebrated dubai made uncomfortable also lack democracy amp voice challenging interesting experience overall,False
1.4833542994092564e+18,2022-01-18 08:23:19+00:00,['1483354299409256449'],@naomi_rovnick @MarksLarks I don't think you'll get planning permission as they make a bit of noise. I'm going for an Eco Vaillant- recommended by every person I've spoken to while planning my flat refurbishment.,think get planning permission make bit noise i'm going eco vaillant recommended every person i've spoken planning flat refurbishment,False
1.483163006011945e+18,2022-01-17 19:43:11+00:00,['1483163006011944966'],@jabberwock951 @FurlongMick No I didn't. I said that if addiction was a problem (which it isn't clear it is) then putting someone in contact with organisations who may be able to support long-term/help someone into treatment is a better option.,said addiction problem clear putting someone contact organisation may able support longtermhelp someone treatment better option,False
1.4831212843430257e+18,2022-01-17 16:57:23+00:00,['1483121284343025665'],"@jabberwock951 @FurlongMick I wasn't saying it was and I didn't say the person was addicted. Just pointing out that the best avenue is for people to get support from the right services, through referrals like No Second Night Out. I used to do outreach work &amp; it's a good way to get people on pathways.",saying say person addicted pointing best avenue people get support right service referral like second night used outreach work amp good way get people pathway,False
1.4830886572549202e+18,2022-01-17 14:47:45+00:00,['1483088657254920202'],"@naomi_rovnick Definitely an interesting perspective. I'm not too bad with getting places on time (but only because I give myself loads of time). That said I did just once abandon my car in a panic, sprint to a class and spend two hours looking for said abandoned car afterwards... 🙈",definitely interesting perspective i'm bad getting place time give load time said abandon car panic sprint class spend two hour looking said abandoned car afterwards,False
1.4830802578339471e+18,2022-01-17 14:14:22+00:00,['1483080257833947142'],@naomi_rovnick Also directions. I once got on a train from Nottingham to Crewe and ended up in Skegness. I can piece together a complex story with sensitive interviews but when it comes to getting from A to B I'm useless.,also direction got train nottingham crewe ended skegness piece together complex story sensitive interview come getting i'm useless,False
1.4830796261215273e+18,2022-01-17 14:11:51+00:00,['1483079626121527307'],"@naomi_rovnick My mum has always thought I was dyspraxic and my sister (an additional needs teacher) thinks I have ADHD. Never had any diagnosis though so I just crack on. I'm not sure if it would help to know or if still be chaotic, clumsy and chronically disorganised? 🙈",mum always thought dyspraxic sister additional need teacher think adhd never diagnosis though crack i'm sure would help know still chaotic clumsy chronically disorganised,False
1.4830778457274696e+18,2022-01-17 14:04:47+00:00,['1483077845727469571'],"@naomi_rovnick Also anything too technical or practical is also beyond me. It took over 120 lessons, four failed tests and several ""major incidents"" before I learnt to drive. (I'm still awful). DIY is a non-starter unless I wish to lose an arm.",also anything technical practical also beyond took lesson four failed test several major incident learnt drive i'm still awful diy nonstarter unless wish lose arm,False
1.483071135759618e+18,2022-01-17 13:38:07+00:00,['1483071135759618048'],@FurlongMick Neither right or wrong- I get the logic. But generally homeless charities recommended buying food or donating to services that can help. Ultimately (if addiction is a problem which isn't clear from your interaction) it would better to treat it than fuel it.,neither right wrong get logic generally homeless charity recommended buying food donating service help ultimately addiction problem clear interaction would better treat fuel,False
1.4830481387725578e+18,2022-01-17 12:06:44+00:00,['1483048138772557828'],@naomi_rovnick Never been diagnosed as neurodiverse but I'm very similar. Plough through stuff then feel exhausted. I'm either incredibly focused on something or can't concentrate for more than 20 seconds. I'm much better at tasks I can dig my heels into but admin is near enough impossible.,never diagnosed neurodiverse i'm similar plough stuff feel exhausted i'm either incredibly focused something can't concentrate second i'm much better task dig heel admin near enough impossible,False
1.4828107669149983e+18,2022-01-16 20:23:30+00:00,['1482810766914998273'],@notgavin @ashleyfryer I was eating around 9pm most nights and it caught up with me as I was going to bed an hour or two later. It's probably genetic too though.,eating around night caught going bed hour two later probably genetic though,False
1.4828085737930793e+18,2022-01-16 20:14:47+00:00,['1482808573793079302'],@notgavin @ashleyfryer I used to do this all the time but then developed severe acid reflux so those days are over. 😭,used time developed severe acid reflux day,False
1.482808217788985e+18,2022-01-16 20:13:23+00:00,['1482808217788985352'],@EloquentJay @JuliaHB1 Journalism can't be truly and fully independent if there's adverts. It's not just about entertainment shows but also news reporting.,journalism can't truly fully independent there's advert entertainment show also news reporting,False
1.4828025686487e+18,2022-01-16 19:50:56+00:00,['1482802568648699910'],@Jenaveve86 Cervical cancer is caused by a strain of HPV. Women who don't carry the virus aren't at risk of developing cervical cancer. Those who are positive (and at risk) will be screened more regularly for abnormal cells.,cervical cancer caused strain hpv woman carry virus risk developing cervical cancer positive risk screened regularly abnormal cell,False
1.482790352545362e+18,2022-01-16 19:02:23+00:00,['1482790352545361924'],"@ededward16 @CaraLevasseur @carolineplayle @Salfanackerpan My mum would have told me I could either invite the whole class (or equivalent) or not have a party if I wanted to leave one kid out. It's fine if it's just a few guests, but leaving one child out is cruel. It's likely an oversight from the mum who made assumptions tbh.",mum would told could either invite whole class equivalent party wanted leave one kid fine guest leaving one child cruel likely oversight mum made assumption tbh,False
1.482774131808551e+18,2022-01-16 17:57:56+00:00,['1482774131808550912'],@ededward16 @CaraLevasseur @carolineplayle @Salfanackerpan I'm not sure I agree a child's choice should be respected in these circumstances. When I was a kid there's no way my mum would have allowed me to leave one child out. She'd sooner have cancelled my party.,i'm sure agree child's choice respected circumstance kid there's way mum would allowed leave one child she'd sooner cancelled party,False
1.4827249429197414e+18,2022-01-16 14:42:28+00:00,['1482724942919741440'],"@jonathanteacher It took me a long time to put my face in the water, even longer to jump in. I had lots of classes and parents just peservered. By the age of 13 I could swim like a fish so it paid off. Equally if he really hates it, maybe promise he can quit after he gets to a certain level?",took long time put face water even longer jump lot class parent peservered age could swim like fish paid equally really hate maybe promise quit get certain level,False
1.482723260018176e+18,2022-01-16 14:35:47+00:00,['1482723260018176010'],"@CaraLevasseur @carolineplayle @Salfanackerpan I'd have just asked the mother why he wasn't invited, explained how upsetting it would be and asked if he could come along. It may have been the child's choice but doesn't mean that choice should be respected.",i'd asked mother invited explained upsetting would asked could come along may child's choice mean choice respected,False
1.4826778991782666e+18,2022-01-16 11:35:32+00:00,['1482677899178266626'],"@Jenny19712201 That's true, they're very undervalued.  What I meant with tax for nannies is  employer's NI rather than the nanny's personal tax- the woman in the article is talking about cost to household not what the nanny actually earns. I don't begrudge them a decent salary though.",that's true they're undervalued meant tax nanny employer's rather nanny's personal tax woman article talking cost household nanny actually earns begrudge decent salary though,False
1.4826695697730191e+18,2022-01-16 11:02:26+00:00,['1482669569773019138'],@LemLems @thetimes If done properly it should basically be £200 a week or so pocket money for working part-time. I don't doubt there's exploitation that goes on but technically the two jobs are very different. Most working mums can't have an au pair as they need more childcare.,done properly basically week pocket money working parttime doubt there's exploitation technically two job different working mum can't pair need childcare,False
1.4826692763393477e+18,2022-01-16 11:01:16+00:00,['1482669276339347456'],@LemLems @thetimes Au pairs don't pay living costs. They're meant to have all their rent and board covered by the family and then they support with childcare for 30 hours a week. (Maximum but sometimes less.) They're not a substitute for a nanny who is actually responsible for children.,pair pay living cost they're meant rent board covered family support childcare hour week maximum sometimes they're substitute nanny actually responsible child,False
1.482668447750312e+18,2022-01-16 10:57:59+00:00,['1482668447750311939'],"@Jenny19712201 That's what the family pays (taxes, NI etc..) not nec what the nanny earns. While some of the stuff in the article is silly, there's clearly a childcare crisis nobody wants to acknowledge. Zero support &amp; nursery fees in London can be £3k or more a month.",that's family pay tax etc nec nanny earns stuff article silly there's clearly childcare crisis nobody want acknowledge zero support amp nursery fee london month,False
1.4826673550418944e+18,2022-01-16 10:53:38+00:00,['1482667355041894401'],"@Nike07213152 @JimMFelton @CrednesCodPeace They don't. They get rent and board and they can only work 30 hours a week and help with childcare, rather than be solely responsible. A lot of young students from Europe used to do it as an excuse to travel. The same way young British people go to work on Aussie farms for a visa",get rent board work hour week help childcare rather solely responsible lot young student europe used excuse travel way young british people work aussie farm visa,False
1.482495872659247e+18,2022-01-15 23:32:14+00:00,['1482495872659247106'],@ShaynSays @AntacsB @Qoo_Kumba @OwenJones84 @TheGreenParty I didn't like Corbyn but voted Labour in a (failed) attempt to keep the Tories out. I'd rather have an imperfect Labour party than live with the current shower of shits any longer.,like corbyn voted labour failed attempt keep tory i'd rather imperfect labour party live current shower shit longer,False
1.4824467834145178e+18,2022-01-15 20:17:10+00:00,['1482446783414517760'],"@fliceverett Agreed. It's great to like the way you look but realistically a tiny percentage of people are genuinely beautiful. We don't call ourselves athletes because we go to the gym, why do we use such gushing descriptions when anyone puts on a dab of lipstick and a dress?",agreed great like way look realistically tiny percentage people genuinely beautiful call athlete gym use gushing description anyone put dab lipstick dress,False
1.482362574557565e+18,2022-01-15 14:42:33+00:00,['1482362574557564930'],@jviddy @yoffy2909 Also it costs the employer that much but after employer's NI and other taxes I'm not sure how much the nanny actually gets.,also cost employer much employer's tax i'm sure much nanny actually get,False
1.4823618709672591e+18,2022-01-15 14:39:45+00:00,['1482361870967259136'],"@HuguenotHouse @EmmaDent76 @LeahEStalker Au pairs only work a few hours a week and the children either go nursery or have parental care the rest of the time. They're usually students who help out, rather than highly qualified nannies. It's cheaper though in some cases than fulltime nursery fees, especially in London",pair work hour week child either nursery parental care rest time they're usually student help rather highly qualified nanny cheaper though case fulltime nursery fee especially london,False
1.4823603676239503e+18,2022-01-15 14:33:47+00:00,['1482360367623950337'],"@LeahEStalker God I love reading stuff like this. So much more interesting than ""buy supermarket own brand beans instead of Heinz"".",god love reading stuff like much interesting buy supermarket brand bean instead heinz,False
1.4819517034528236e+18,2022-01-14 11:29:54+00:00,['1481951703452823563'],@hannahfearn @NCTJ_news @Media_Trust Congratulations what a great gig!,congratulation great gig,False
1.4819513735288177e+18,2022-01-14 11:28:35+00:00,['1481951373528817664'],"@ambuss @drummersark @SadiqKhan Surely it's even more efficient not to drive? How many people out driving couldn't have done the same journey on public transport? Cars are a necessity for people with disabilities, delivery drivers etc but I bet the majority of people could use cars much less.",surely even efficient drive many people driving done journey public transport car necessity people disability delivery driver etc bet majority people could use car much,False
1.4816428679866327e+18,2022-01-13 15:02:41+00:00,['1481642867986632709'],@MoreSocialism @hannahfearn @theipaper I think some people genuinely choose to rent (certainly in the Netherlands where my partner is from because it's much cheaper and the quality is much higher). I just question it in big cities like London because I suspect it's less of a choice- more necessity.,think people genuinely choose rent certainly netherlands partner much cheaper quality much higher question big city like london suspect choice necessity,False
1.48160275862938e+18,2022-01-13 12:23:19+00:00,['1481602758629380101'],"@ennaacissej @szennyezett She looks going now at 22 but the condition presumably won't stop her skin from ageing. She will always be small, but there are plenty of adults (who like adults) who have restricted growth due to a wide range of conditions.",look going condition presumably stop skin ageing always small plenty adult like adult restricted growth due wide range condition,False
1.481252638016553e+18,2022-01-12 13:12:03+00:00,['1481252638016552962'],"@Missives0fASub Oh fine. It was at about 10 miles an hour just after Christmas. Someone made a sudden stop at a zebra crossing. Car was old and cheap so not worth fixing- new (old, cheap) car it is!",fine mile hour christmas someone made sudden stop zebra crossing car old cheap worth fixing new old cheap car,False
1.481247066210906e+18,2022-01-12 12:49:55+00:00,['1481247066210906113'],@Missives0fASub One too many ls? Maybe giving it an extra l will make it nicer?,one many maybe giving extra make nicer,False
1.4812405433886556e+18,2022-01-12 12:24:00+00:00,['1481240543388655621'],Relationships are all well and good until your boyfriend writes off the car and now you have to spend the weekend going to Illford to look at secondhand Vauxhall Corsas.,relationship well good boyfriend writes car spend weekend going illford look secondhand vauxhall corsas,False
1.4811989882379387e+18,2022-01-12 09:38:52+00:00,['1481198988237938688'],@CorinneRedfern @abbyyoungpowell Yes because people can sue up to a year later. 😂,yes people sue year later,False
1.4811748975441224e+18,2022-01-12 08:03:09+00:00,['1481174897544122373'],Live footage of me trying to get up on winter mornings. https://t.co/4iDAjdNidi,live footage trying get winter morning,False
1.4809947876879114e+18,2022-01-11 20:07:27+00:00,['1480994787687911427'],"@CorinneRedfern @abbyyoungpowell See also, the article when I file it.",see also article file,False
1.4809664953164554e+18,2022-01-11 18:15:02+00:00,['1480966495316455425'],January is the month for booking yourself into lots of exercises classes then cancelling 25 minutes before when faced with the hideous reality of actually leaving the house.,january month booking lot exercise class cancelling minute faced hideous reality actually leaving house,False
1.480959967247147e+18,2022-01-11 17:49:05+00:00,['1480959967247147013'],"@lucydougtweets @elle_hunt @guardiang2 I agree with this. On the dating front don't look for what you want in a partner and try to tick boxes, look for what you need in a partner. The two can be very different. If you don't know what you need, it's worth determining your attachment style before you date.",agree dating front look want partner try tick box look need partner two different know need worth determining attachment style date,False
1.480883308129104e+18,2022-01-11 12:44:28+00:00,['1480883308129103872'],"@hannahfearn @theipaper It's a great idea in countries where the cost of renting is much cheaper. In the UK (especially London) renting is basically robbery. I know many people can't afford to own property because of the deposits needed, but I can't see the logic to renting here if you have the cash.",great idea country cost renting much cheaper especially london renting basically robbery know many people can't afford property deposit needed can't see logic renting cash,False
