id,created_at,edit_history_tweet_ids,text,clean_text,non_english
1.4174806730829742e+18,2021-07-20 13:45:02+00:00,['1417480673082974217'],"@LecaAndrew @rhiannon_arian @savemesaveyou @TiceRichard One in four pregnancies ends in miscarriage usually so of the millions who have been vaccinated, it's likely some have had miscarriages. There's zero evidence to suggest the vaccine increases the risk though.",one four pregnancy end miscarriage usually million vaccinated likely miscarriage there's zero evidence suggest vaccine increase risk though,False
1.4174798430049649e+18,2021-07-20 13:41:44+00:00,['1417479843004964865'],@Mullies @lukechilts Frozen hot water bottles to hug in bed are the way forward.,frozen hot water bottle hug bed way forward,False
1.4174762861890888e+18,2021-07-20 13:27:36+00:00,['1417476286189088770'],@RavenloftGM What does it mean? Saw it trending but no clue what it's supposed to mean.,doe mean saw trending clue supposed mean,False
1.4174669096463647e+18,2021-07-20 12:50:21+00:00,['1417466909646364672'],@CassidyGavin It depends. But not 900 in 700 days about emotional intelligence!,depends day emotional intelligence,False
1.4174663203843113e+18,2021-07-20 12:48:00+00:00,['1417466320384311321'],"You've got to hand it to the Brits, they really know how to make a drama out of a heatwave.",got hand brit really know make drama heatwave,False
1.4174185653225267e+18,2021-07-20 09:38:14+00:00,['1417418565322526738'],@graceholliday Knowing British weather it won't last... (Heatwave set to break this wknd.) But you can buy plenty of cooling blankets now (and similar) that can go in the freezer and be used to cool beds/linen etc. Try Amazon!,knowing british weather last heatwave set break wknd buy plenty cooling blanket similar freezer used cool bedslinen etc try amazon,False
1.4172184265992684e+18,2021-07-19 20:22:58+00:00,['1417218426599268357'],"@LinnyJackson @BlackM1710 @DrRosemaryL Better sanitation was certainly a factor in improved health but so were vaccines. We eradicated Polio &amp; managed outbreaks of measles, whooping cough &amp; other diseases that killed children. The proof is in the figures &amp; the rapid decline in illness.",better sanitation certainly factor improved health vaccine eradicated polio amp managed outbreak measles whooping cough amp disease killed child proof figure amp rapid decline illness,False
1.4172169340226273e+18,2021-07-19 20:17:02+00:00,['1417216934022627331'],"@LinnyJackson @BlackM1710 @DrRosemaryL If your theory was true, we would have lived longer years ago when there was much less intervention. The reality is that more diseases (that were previously a death sentence) are treatable. (Like HIV for example.)",theory true would lived longer year ago much intervention reality disease previously death sentence treatable like hiv example,False
1.417216502277689e+18,2021-07-19 20:15:19+00:00,['1417216502277689362'],"@LinnyJackson @BlackM1710 @DrRosemaryL Sometimes Diabetes 2 can be cured with diet, Type 1 isn't though, it needs to be managed with insulin or you die. Some illnesses can be improved with natural remedies but not all. Many require intervention with medicine. Advances in medicine are why we live longer than ever.",sometimes diabetes cured diet type though need managed insulin die illness improved natural remedy many require intervention medicine advance medicine live longer ever,False
1.4172152004287652e+18,2021-07-19 20:10:09+00:00,['1417215200428765187'],"@LinnyJackson @BlackM1710 @DrRosemaryL The data speaks for itself and for the vast maj of adults, the benefits of the vaccine far outweighs the risks",data speaks vast maj adult benefit vaccine far outweighs risk,False
1.4172149990433915e+18,2021-07-19 20:09:21+00:00,['1417214999043391488'],"@LinnyJackson @BlackM1710 @DrRosemaryL Secondly I've spent several months researching the impact of long covid, which has affected hundreds of thousands (if not millions) of previously healthy people.",secondly i've spent several month researching impact long covid affected hundred thousand million previously healthy people,False
1.4172147880615117e+18,2021-07-19 20:08:30+00:00,['1417214788061511691'],@LinnyJackson @BlackM1710 @DrRosemaryL This isn't always the case. Many ppl live with long-term conditions and have years of life ahead of them. Diabetes for example? Arthritis? Colitis? The disease still results in higher deaths even among the youngish &amp; healthy. (I know people who've lost previously healthy family.),always case many ppl live longterm condition year life ahead diabetes example arthritis colitis disease still result higher death even among youngish amp healthy know people who've lost previously healthy family,False
1.4172131392471122e+18,2021-07-19 20:01:57+00:00,['1417213139247112193'],@LinnyJackson @BlackM1710 @DrRosemaryL These stats might look scary but you need to consider that nearly 90 million doses have been given. The deaths are miniscule compared to the effects of the disease.,stats might look scary need consider nearly million dos given death miniscule compared effect disease,False
1.4172115301191967e+18,2021-07-19 19:55:33+00:00,['1417211530119196675'],"American reaction: you GO Prince Harry, live your authentic truth.

British reaction: *mumbles something about needing a vomit bucket for this saccharine bullshit and heads back to deal with neverending plague/flood damage/overheated toddler who just threw ice cream at the dog* https://t.co/wLuQb0luX9",american reaction prince harry live authentic truth british reaction mumble something needing vomit bucket saccharine bullshit head back deal neverending plagueflood damageoverheated toddler threw ice cream dog,False
1.4171870312313856e+18,2021-07-19 18:18:12+00:00,['1417187031231385605'],@dannyrogers2001 @DQStuff I have zero faith in the government to do anything right. Just saying that the vaccine was never going to stop the disease completely and it was never suggested by scientists that it would or could.,zero faith government anything right saying vaccine never going stop disease completely never suggested scientist would could,False
1.4171829595142922e+18,2021-07-19 18:02:02+00:00,['1417182959514292230'],@dannyrogers2001 @DQStuff I don't think we were led to believe that. There's a 96% protection from death and serious illness but less in some older people and those with serious autoimmune conditions. Hospitaliation is low considering how many cases there are. Some will slip through the net as they rise.,think led believe there's protection death serious illness older people serious autoimmune condition hospitaliation low considering many case slip net rise,False
1.4171727052379464e+18,2021-07-19 17:21:17+00:00,['1417172705237946372'],"@graceholliday @xenatheworrier And hopefully he won't be positive. My sister is a school teacher with young kids who have additional needs. It's not as important as giving birth but she's meant to be marrying her girlfriend this Friday - we have all been stressed about getting ""pinged"".",hopefully positive sister school teacher young kid additional need important giving birth meant marrying girlfriend friday stressed getting pinged,False
1.4171723349774254e+18,2021-07-19 17:19:49+00:00,['1417172334977425410'],@graceholliday @xenatheworrier It's a tricky one. Are you double vaxxed now? (And do they know if your baby has some protection?) If so could you plan a back up (like your mum) to come in for the section if he was covid positive at the time? Then he would still have four weeks with her post sick leave.,tricky one double vaxxed know baby protection could plan back like mum come section covid positive time would still four week post sick leave,False
1.4171302348691333e+18,2021-07-19 14:32:31+00:00,['1417130234869133316'],@graceholliday @xenatheworrier In that case maybe lots of testing and testing of his work mates too? I know it could be spread by customers but guessing he is in closer contact with colleagues? So stressful for you both.,case maybe lot testing testing work mate know could spread customer guessing closer contact colleague stressful,False
1.4171044412249334e+18,2021-07-19 12:50:01+00:00,['1417104441224933382'],@xenatheworrier @graceholliday Mask and face shield to protect him from others? (As close to proper PPE quality as you are able to get?),mask face shield protect others close proper ppe quality able get,False
1.4170959370638868e+18,2021-07-19 12:16:14+00:00,['1417095937063886850'],@graceholliday @xenatheworrier Could he ask to work from home for two weeks? Or to distance himself/colleagues to be extra careful?,could ask work home two week distance himselfcolleagues extra careful,False
1.4170894510928443e+18,2021-07-19 11:50:28+00:00,['1417089451092844545'],@little_emmabird I agree. I've loved previous series but it's not been the same since Caroline Flack left. A lot of the contestants are in it for money (understandably) but she genuinely believed in the love story angle rather than the brand partnerships. It gave the show a different feel.,agree i've loved previous series since caroline flack left lot contestant money understandably genuinely believed love story angle rather brand partnership gave show different feel,False
1.4170538696963318e+18,2021-07-19 09:29:04+00:00,['1417053869696331783'],"@BreadCrusader @Jon_Chalk1 @SusanPearson50 @rachelburden I suppose that's the point- we don't know enough about long covid and its impacts to risk everyone getting infected with the disease. It could wreak havoc on the future healthcare system, so better to be cautious than not, surely?",suppose that's point know enough long covid impact risk everyone getting infected disease could wreak havoc future healthcare system better cautious surely,False
1.4170534402457477e+18,2021-07-19 09:27:22+00:00,['1417053440245747724'],"@little_emmabird I am definitely not a fan of empty people. 😂 I mean none of them are exactly rocket scientists, but some have more personality. My favourite is Liberty because she just seems sweet. Other years have been better though, in general it's not a great crowd.",definitely fan empty people mean none exactly rocket scientist personality favourite liberty seems sweet year better though general great crowd,False
1.4170349536998728e+18,2021-07-19 08:13:54+00:00,['1417034953699872772'],@BreadCrusader @SusanPearson50 @rachelburden Long covid is impacting anything up to one in five people infected (though could be less due to asymptomatic cases). It's not possible to tell yet if vaccine prevents long covid as it hasn't been in use long enough yet. Hopefully it does but it's not proven yet.,long covid impacting anything one five people infected though could due asymptomatic case possible tell yet vaccine prevents long covid use long enough yet hopefully doe proven yet,False
1.4168846351251003e+18,2021-07-18 22:16:36+00:00,['1416884635125100552'],Freezing a hot water bottle to cuddle in bed tonight was nothing short of genius. https://t.co/vfHOO6D6Uo,freezing hot water bottle cuddle bed tonight nothing short genius,False
1.416858012531241e+18,2021-07-18 20:30:48+00:00,['1416858012531240961'],The obsession with Lucinda is a damning indictment of straight culture. I'd rather have a conversation with my dishwasher. #LoveIsland,obsession lucinda damning indictment straight culture i'd rather conversation dishwasher,False
1.416736701507162e+18,2021-07-18 12:28:45+00:00,['1416736701507162113'],@DrewLawDesign Earliest memory is 1989- starting reception class. Also My Little Ponies but pretty sure that was the 90s.,earliest memory starting reception class also little pony pretty sure,False
1.4165010516504123e+18,2021-07-17 20:52:22+00:00,['1416501051650412544'],@MichaelYartys @postyourtoast @CathNoakes Yes. Hand sanitizer doesn't work either it's the devil's virus.,yes hand sanitizer work either devil's virus,False
1.416458794016596e+18,2021-07-17 18:04:27+00:00,['1416458794016595973'],@MichaelYartys @postyourtoast @CathNoakes UV doesn't kill noro unfortunately. It's very hardy. Only bleach kills it.,kill noro unfortunately hardy bleach kill,False
1.416439221603246e+18,2021-07-17 16:46:41+00:00,['1416439221603246080'],This person is here to prove acid isn't for everyone https://t.co/T4JhbYh5t6,person prove acid everyone,False
1.4164051064599224e+18,2021-07-17 14:31:07+00:00,['1416405106459922436'],@LiberalinTrench @i_petersen @apsmunro I'm not sure if viruses make your immune system stronger? Even before covid I was super cautious about viruses and very rarely caught one. When I did I usually seemed to get less sick (for less time) than others who caught the same thing. Not sure why.,i'm sure virus make immune system stronger even covid super cautious virus rarely caught one usually seemed get sick time others caught thing sure,False
1.4163961782084608e+18,2021-07-17 13:55:38+00:00,['1416396178208460809'],Everyone needs to be reading this- it's an incredibly interesting account of the early days of the pandemic. https://t.co/SHyarRyNpW,everyone need reading incredibly interesting account early day pandemic,False
1.4163619285663498e+18,2021-07-17 11:39:33+00:00,['1416361928566349825'],"The terrible buskers are back in Hammersmith. I trod on a used condom walking down the high street. LONDON IS COMING BACK TO LIFE, LADS.",terrible busker back hammersmith trod used condom walking high street london coming back life lad,False
1.4163134351393178e+18,2021-07-17 08:26:51+00:00,['1416313435139317762'],@emmakatmcdonald @CleaRomeo @susiemesure You could try pharmacies (if you can find one doing it) apparently they are less strict. I was only a few days off so just waited.,could try pharmacy find one apparently strict day waited,False
1.4160170690076795e+18,2021-07-16 12:49:12+00:00,['1416017069007679488'],"@CassidyGavin I ALREADY POINTED OUT THE ERROR, GAV. Stupid autocorrect.",already pointed error gav stupid autocorrect,False
1.4160026321923072e+18,2021-07-16 11:51:50+00:00,['1416002632192307200'],@kevbentley @alisonm21446550 @RandyAn37461639 @AdamJKucharski Pubs loos it would make less sense as you're all breathing the same air in the pub anyway. I can't see it making a huge difference.,pub loo would make sense breathing air pub anyway can't see making huge difference,False
1.41598814215544e+18,2021-07-16 10:54:15+00:00,['1415988142155440129'],"@little_emmabird Actually working well. I've heard Scandinavian countries are good, but the populations there are smaller and spending per head higher. I think (sadly) the situation is only going to get worse in UK. 😢",actually working well i've heard scandinavian country good population smaller spending per head higher think sadly situation going get worse,False
1.4159879180621988e+18,2021-07-16 10:53:22+00:00,['1415987918062198786'],@little_emmabird The only system I know to compare to was UAE. I found the diagnostic access really good but the people I knew with chronic conditions had to go back to their home countries when insurance ran out. It would be really interesting to compare systems around the world to see what is,system know compare uae found diagnostic access really good people knew chronic condition back home country insurance ran would really interesting compare system around world see,False
1.415984890454098e+18,2021-07-16 10:41:20+00:00,['1415984890454097920'],"Work listings are so valuable to freelancers, not just for pitching but discovering new publications, ideas and potential contacts. Editors, we love detailed instructions on how/what to pitch, but hate public rants about the size of your inbox &amp; how worthless freelancers are. https://t.co/kTE5syxTUs",work listing valuable freelancer pitching discovering new publication idea potential contact editor love detailed instruction howwhat pitch hate public rant size inbox amp worthless freelancer,False
1.415983106549506e+18,2021-07-16 10:34:14+00:00,['1415983106549506050'],"@little_emmabird Are there any countries where it's freely available to all patients under free healthcare? Or is it a global problem? Up my taxes, I don't mind.",country freely available patient free healthcare global problem tax mind,False
1.4159735841289093e+18,2021-07-16 09:56:24+00:00,['1415973584128909319'],@alisonm21446550 @RandyAn37461639 @kevbentley @AdamJKucharski Think I'll keep mine for the tube. I've always thought they would be a good idea on public transport to be honest (even before pandemic). I absolutely hate being coughed and sneezed all over on my journey into work in winter. Don't miss it at all!,think i'll keep mine tube i've always thought would good idea public transport honest even pandemic absolutely hate coughed sneezed journey work winter miss,False
1.4159722835507405e+18,2021-07-16 09:51:14+00:00,['1415972283550740481'],@Shumbakadzi11 Thank you.,thank,False
1.4159498515740877e+18,2021-07-16 08:22:06+00:00,['1415949851574087681'],"@Shumbakadzi11 Hi, would you consider pitches from non-residents for later in the year? (If they could cover travel costs to the country.)",would consider pitch nonresident later year could cover travel cost country,False
1.4157115811791913e+18,2021-07-15 16:35:18+00:00,['1415711581179191310'],@Nicola_Slawson How awful. I followed her and knew she had some health issues but didn't realise how serious they were. This is so sad.,awful followed knew health issue realise serious sad,False
1.415687818165293e+18,2021-07-15 15:00:52+00:00,['1415687818165293056'],@NRafter @RandyAn37461639 @kevbentley @AdamJKucharski Why would they be banned? I can't imagine anywhere would ban them. I suspect in time it will become optional not mandatory.,would banned can't imagine anywhere would ban suspect time become optional mandatory,False
1.4156841193133548e+18,2021-07-15 14:46:10+00:00,['1415684119313354763'],@CleaRomeo @DollyDeighton @susiemesure What's the reasoning for turning people away before 8 weeks then? I'd understand if they were mad busy trying to get others done but it was dead. They were all stood out having a chat. (We have one of the lowest vaccine rates in the country too.),what's reasoning turning people away week i'd understand mad busy trying get others done dead stood chat one lowest vaccine rate country,False
1.4156809096305746e+18,2021-07-15 14:33:25+00:00,['1415680909630574602'],"@DollyDeighton @CleaRomeo @susiemesure Apparently there is some evidence to say waiting increases your immunity, but I'm not sure how conclusive it is. With a highly infectious variant knocking around I'd just like to get the second dose asap really. I'll be eight weeks tomo so eligible this wknd.",apparently evidence say waiting increase immunity i'm sure conclusive highly infectious variant knocking around i'd like get second dose asap really i'll eight week tomo eligible wknd,False
1.415676911183749e+18,2021-07-15 14:17:32+00:00,['1415676911183749149'],@flamingnora @OWoollard Just testing the men folk of course...,testing men folk course,False
1.4156766766928773e+18,2021-07-15 14:16:36+00:00,['1415676676692877312'],@flamingnora @OWoollard I am actually wrong. I wrote it's instead of it. 😂,actually wrong wrote instead,False
1.4156715060303995e+18,2021-07-15 13:56:03+00:00,['1415671506030399489'],It's doesn't matter what you say on the internet. There will always be a man on hand to tell you you're wrong.,matter say internet always man hand tell wrong,False
1.4156713372851569e+18,2021-07-15 13:55:23+00:00,['1415671337285156878'],@NRafter @RandyAn37461639 @kevbentley @AdamJKucharski I know that. I was talking about the future in general- it would be nice if ppl collectively changed their attitudes towards hygiene and sickness. Also happy with face masks to stay encouraged generally in busy spaces until cases drop.,know talking future general would nice ppl collectively changed attitude towards hygiene sickness also happy face mask stay encouraged generally busy space case drop,False
1.4156703768776294e+18,2021-07-15 13:51:34+00:00,['1415670376877629447'],@DavidNWriter I love this. Really want to see what was on Dexter's now.,love really want see dexter's,False
1.4156651838469325e+18,2021-07-15 13:30:56+00:00,['1415665183846932483'],@susiemesure I was turned away from a walk in a few days ago for being a few days off the eight week mark. Empty centre too.,turned away walk day ago day eight week mark empty centre,False
1.41565608959352e+18,2021-07-15 12:54:48+00:00,['1415656089593520129'],"@RandyAn37461639 @kevbentley @AdamJKucharski I don't find masks an infringement- a minor annoyance at worst. Being advised to do something isn't an infringement either. And yes, I'd like to see us  use masks like they do in Japan. It would be great to have a cultural shift where ppl cover their faces/stay home when sick.",find mask infringement minor annoyance worst advised something infringement either yes i'd like see use mask like japan would great cultural shift ppl cover facesstay home sick,False
1.4156520734467727e+18,2021-07-15 12:38:50+00:00,['1415652073446772736'],@JuLlewellyn Its opening to pedestrians this weekend.,opening pedestrian weekend,False
1.4156344799646966e+18,2021-07-15 11:28:55+00:00,['1415634479964696580'],@fliceverett I don't know the context behind this (I'm sure there's a drama linked to it) but on face value I'd say dressing in a fat suit is different to blacking up because skin colour isn't something anyone can control. Weight is (rightly or wrongly) considered within a person's control.,know context behind i'm sure there's drama linked face value i'd say dressing fat suit different blacking skin colour something anyone control weight rightly wrongly considered within person's control,False
1.415593680572928e+18,2021-07-15 08:46:48+00:00,['1415593680572928003'],"@kevbentley @AdamJKucharski I agree closing down businesses long-term is unsustainable, but I think there are measures we (as a society) could take. Better public health campaigns for example (which have lapsed in recent years). In general British hygiene is dire.",agree closing business longterm unsustainable think measure society could take better public health campaign example lapsed recent year general british hygiene dire,False
1.4155933653249024e+18,2021-07-15 08:45:33+00:00,['1415593365324902402'],@kevbentley @AdamJKucharski It depends what they are. Encouraging people to wear masks in crowded spaces isn't an infringement. (They do it in Japan.) I think there just needs to be cultural change around spreading infection. It would have been the norm to quarantine with all sorts of diseases 70 years ago.,depends encouraging people wear mask crowded space infringement japan think need cultural change around spreading infection would norm quarantine sort disease year ago,False
1.415591940888961e+18,2021-07-15 08:39:53+00:00,['1415591940888961024'],"@JournalistJill @LeahFHardy @msloobylou I have found exercise to be better as a weight gain preventer rather than for losing it. To lose weight I have to eat less, but exercise is great for building muscle which means I can increase my calorie intake a bit.",found exercise better weight gain preventer rather losing lose weight eat exercise great building muscle mean increase calorie intake bit,False
1.415590146003587e+18,2021-07-15 08:32:45+00:00,['1415590146003587074'],@CuriouslyEmily @Jen_Bur This would be ideal. Hot for winter and cold for the rare days I need that in summer. (When it reaches over 27 inside my flat...),would ideal hot winter cold rare day need summer reach inside flat,False
1.415583894502613e+18,2021-07-15 08:07:55+00:00,['1415583894502612994'],@lottiecgross Were you working with him? That's insane.,working that's insane,False
1.4155775704399913e+18,2021-07-15 07:42:47+00:00,['1415577570439991298'],@CuriouslyEmily @Jen_Bur I need the heated version of this. I nearly made a hot water bottle last night...,need heated version nearly made hot water bottle last night,False
1.4153072752716145e+18,2021-07-14 13:48:44+00:00,['1415307275271614464'],@tash_wynarczyk @jonbir90 Oh my god the fear is real. I have my sister's (mini) wedding in two weeks!,god fear real sister's mini wedding two week,False
1.4153025230497178e+18,2021-07-14 13:29:51+00:00,['1415302523049717766'],"@GeorginaLawton I love it. Also Superstore (again comedy, but touches on lots of cultural issues about working class life in America.)",love also superstore comedy touch lot cultural issue working class life america,False
1.4153019213725737e+18,2021-07-14 13:27:27+00:00,['1415301921372573702'],"@GeorginaLawton Have you watched Brooklyn 99, a police comedy? It's not a drama but very good.",watched brooklyn police comedy drama good,False
1.4152851248710984e+18,2021-07-14 12:20:43+00:00,['1415285124871098371'],@JosephVenables @AndrewAllsop I was turned away with a few days to go until I reached the eight week mark.,turned away day reached eight week mark,False
1.4152596971715502e+18,2021-07-14 10:39:40+00:00,['1415259697171550211'],@little_emmabird https://t.co/00traUKqjl,,
1.415259415293436e+18,2021-07-14 10:38:33+00:00,['1415259415293435906'],"@little_emmabird I don't have a source, that's just what people who support foreign aid (like me) believe. It does benefit wealthy countries though (reduces war, famine, improves agriculture where we buy crops, decreases spread of diseases like Ebola). From a fiscal perspective that plays a role.",source that's people support foreign aid like believe doe benefit wealthy country though reduces war famine improves agriculture buy crop decrease spread disease like ebola fiscal perspective play role,False
1.4152223621869486e+18,2021-07-14 08:11:19+00:00,['1415222362186948609'],@little_emmabird It's about rich nations (which often exploit the labour of poorer countries through capitalism) making some effort to redistribute wealth.,rich nation often exploit labour poorer country capitalism making effort redistribute wealth,False
