id,created_at,edit_history_tweet_ids,text,clean_text,non_english
1.4457089384863212e+18,2021-10-06 11:14:05+00:00,['1445708938486321159'],"@thedalstonyears I'm not a huge fan of the overly done brows look. Especially not on fair women. Blonde hair and fierce, dramatic black eyebrows is not going to be a trend that time treats kindly.",i'm huge fan overly done brow look especially fair woman blonde hair fierce dramatic black eyebrow going trend time treat kindly,False
1.4456897812208722e+18,2021-10-06 09:57:58+00:00,['1445689781220872202'],@little_emmabird I had blood tests too which were all fine. My granny was hospitalised with pancreatitis as a result of gallstones when she was a few years older than me. It was one of the first things my new GP wanted to check for. I will ALWAYS check GP CQC results from now on.,blood test fine granny hospitalised pancreatitis result gallstone year older one first thing new wanted check always check cqc result,False
1.4456892902943212e+18,2021-10-06 09:56:01+00:00,['1445689290294321152'],@little_emmabird Yeah I know. To be fair I haven't had classic symptoms but my first doctor never bothered with referrals when I failed to respond to reflux treatment. I switched GPs in August and she immediately got me an endoscopy (clear) and an ultrasound (which is how they found the stones).,yeah know fair classic symptom first doctor never bothered referral failed respond reflux treatment switched gps august immediately got endoscopy clear ultrasound found stone,False
1.4454787259785216e+18,2021-10-05 19:59:18+00:00,['1445478725978521603'],Almost 2 years since my first attack of colic &amp; I've finally been diagnosed with gallstones. NHS dietary advice might be more painful than 20 months of indigestion. TINNED FRUIT IS NOT DESSERT is the hill I will die on. (possibly literally now.),almost year since first attack colic amp i've finally diagnosed gallstone dietary advice might painful month indigestion tinned fruit dessert hill die possibly literally,False
1.4453847448757944e+18,2021-10-05 13:45:51+00:00,['1445384744875794442'],@katieharr1988 Choosing to sit in the same seat too often in a hot desking office.,choosing sit seat often hot desking office,False
1.445282029206188e+18,2021-10-05 06:57:42+00:00,['1445282029206188035'],@HiImLatifah @_biffy @manymenbahbah Ah yes. Some relationships are never acceptable. (Eg 13 and 45) but I think there's a blurry line in the late teens where it's situation dependent. In the UK 15 and 17 is technically illegal but wouldn't necessarily have to be abusive.,yes relationship never acceptable think there's blurry line late teen situation dependent technically illegal necessarily abusive,False
1.4452732774973317e+18,2021-10-05 06:22:55+00:00,['1445273277497331712'],"@HiImLatifah @_biffy @manymenbahbah In my experience it's rare for people to be all good or all bad. Plus in relationships even the most ""perfect"" looking partnership can be abusive. I agree some couplings are more likely to abusive elements (eg very young woman) but I'm not sure there's ever hard and fast rules.",experience rare people good bad plus relationship even perfect looking partnership abusive agree coupling likely abusive element young woman i'm sure there's ever hard fast rule,False
1.4451250704693494e+18,2021-10-04 20:34:00+00:00,['1445125070469349378'],"Me to parents: I just thought I'd call to say hel-

Parents: the internet's dead isn't it",parent thought i'd call say hel parent internet's dead,False
1.4450512843740324e+18,2021-10-04 15:40:48+00:00,['1445051284374032387'],@HiImLatifah @_biffy @manymenbahbah Interesting. So my relationship aged 17 would be illegal in most states. (He was 22.) It's the healthiest one I had up to age 36. He was a really great and respectful guy.,interesting relationship aged would illegal state healthiest one age really great respectful guy,False
1.4449329335597548e+18,2021-10-04 07:50:31+00:00,['1444932933559754752'],@HiImLatifah @_biffy @manymenbahbah In the UK it's legal from age 16 so depends where you are and the couple.,legal age depends couple,False
1.444932044467974e+18,2021-10-04 07:46:59+00:00,['1444932044467974144'],@manymenbahbah My first boyfriend when I was 17 was a (very young) 22. He was kind and  respectful. I was more mature and outgrew him faster by going off to uni. It took until age 36 to meet anyone as nice as him. It really depends on the situation.,first boyfriend young kind respectful mature outgrew faster going uni took age meet anyone nice really depends situation,False
1.4449312554731602e+18,2021-10-04 07:43:51+00:00,['1444931255473160192'],@just_j0 Hard to say but it can take a long time to build evidence. They're keen not to charge until there's a reasonably strong chance of conviction. It can take years to gather enough evidence in these cases.,hard say take long time build evidence they're keen charge there's reasonably strong chance conviction take year gather enough evidence case,False
1.4445871411121605e+18,2021-10-03 08:56:28+00:00,['1444587141112160257'],"@just_j0 And for non violent, unwanted advances it's about entitlement. Men think they're entitled to our bodies.",non violent unwanted advance entitlement men think they're entitled body,False
1.4444236079088148e+18,2021-10-02 22:06:38+00:00,['1444423607908814851'],@naomi_rovnick If you need more space for your family and day to day living then yes. If you need more space for entertaining then no. All the benefits of a nice area are worth having slightly squashed dinner parties.,need space family day day living yes need space entertaining benefit nice area worth slightly squashed dinner party,False
1.4444075220775977e+18,2021-10-02 21:02:43+00:00,['1444407522077597696'],Watching a very drunk woman trying to snog a guy on the tube through his mask might be the most 2021 thing I've seen.,watching drunk woman trying snog guy tube mask might thing i've seen,False
1.4444023516039537e+18,2021-10-02 20:42:10+00:00,['1444402351603953667'],@DollyDeighton Like the dog hating psychopath you are?,like dog hating psychopath,False
1.444205121559216e+18,2021-10-02 07:38:27+00:00,['1444205121559216128'],@DollyDeighton Wasn't that New York before the pandemic too?,new york pandemic,False
1.443973963680555e+18,2021-10-01 16:19:55+00:00,['1443973963680555024'],@hannahfearn Didn't he mean subjected to that? She should never have been subjected to that abuse?,mean subjected never subjected abuse,False
1.4439733120702628e+18,2021-10-01 16:17:19+00:00,['1443973312070262801'],@JosephVenables I would hope that not to be the case.,would hope case,False
1.443868191403479e+18,2021-10-01 09:19:37+00:00,['1443868191403479040'],@StarmerBanal @Samfr Well he was unelectable because he didn't get elected. Not even close. Boris won by a landslide.,well unelectable get elected even close boris landslide,False
1.4438677512826266e+18,2021-10-01 09:17:52+00:00,['1443867751282626560'],"Here is an idea. Instead of asking women to flag down buses if they're stopped, the Met takes a zero tolerance approach within its forces. Immediate dismissal for anyone found guilty of sharing inappropriate images, messages &amp; all the other 'misdemeanors' swept under the carpet.",idea instead asking woman flag bus they're stopped met take zero tolerance approach within force immediate dismissal anyone found guilty sharing inappropriate image message amp 'misdemeanors' swept carpet,False
1.4435766052641382e+18,2021-09-30 14:00:57+00:00,['1443576605264138248'],@JosephVenables I couldn't find mention of the indecent exposure incident a few days prior...,find mention indecent exposure incident day prior,False
1.4435586215734927e+18,2021-09-30 12:49:30+00:00,['1443558621573492739'],"To lose someone you love under these circumstances is truly the worst thing a parent, sibling or friend could imagine. A fitting sentence. https://t.co/oaEFB6zEOk",lose someone love circumstance truly worst thing parent sibling friend could imagine fitting sentence,False
1.443486654182957e+18,2021-09-30 08:03:31+00:00,['1443486654182957056'],@Nicola_Slawson @meghamohan 😢,,
1.4432642302753096e+18,2021-09-29 17:19:41+00:00,['1443264230275309576'],"@RoseStokes @DrPragyaAgarwal I think I would intervene if I saw something that looked dodgy but I've never witnessed anyone being arrested. I've seen people chatting to police (after a car accident) and once they almost banged down my door to speak to my neighbour, but nothing else.",think would intervene saw something looked dodgy i've never witnessed anyone arrested i've seen people chatting police car accident almost banged door speak neighbour nothing else,False
1.4431689999410545e+18,2021-09-29 11:01:17+00:00,['1443168999941054465'],@naomi_rovnick @sarahoconnor_ I started in Dubai on £18k (magazines) in 2008. My second job in London (2010) was £22k. I think £25k is ok for a graduate salary- and it's well paid if you live out of London. My sister is still only on about £22k after 10 years in teaching. (She specialises in additional needs),started dubai magazine second job london think graduate salary well paid live london sister still year teaching specialises additional need,False
1.4431584526422303e+18,2021-09-29 10:19:22+00:00,['1443158452642230279'],"@fliceverett @Caitrionakelly4 Same here and I look crap in jumpsuits, and long swishy dresses. But I never bang my head on showerheads so swings and roundabouts.",look crap jumpsuit long swishy dress never bang head showerhead swing roundabout,False
1.443143469816496e+18,2021-09-29 09:19:50+00:00,['1443143469816496130'],"@Caitrionakelly4 @fliceverett I've always thought that tall, slim women look good. It's not necessarily a better body type to have but clothes tend to hang better on tall, slim women. Hence why catwalk models exist I guess... (I am a very short woman which has other advantages, but not for fashion)",i've always thought tall slim woman look good necessarily better body type clothes tend hang better tall slim woman hence catwalk model exist guess short woman advantage fashion,False
1.4429071050196296e+18,2021-09-28 17:40:36+00:00,['1442907105019629571'],"I let my bin get too full so the bag split and now I've spent the past 20 minutes cleaning rotting food from my kitchen floor. If ever there was an incentive to take the bins out more frequently, this might have been the sign from the gods I needed.",let bin get full bag split i've spent past minute cleaning rotting food kitchen floor ever incentive take bin frequently might sign god needed,False
1.4429026536341094e+18,2021-09-28 17:22:55+00:00,['1442902653634109440'],@just_j0 Is there a landline anywhere she could use? Hopefully she gets better soon. I remember having awful Freshers flu when I started university. So many bugs going around and this year the fear of covid on top!,landline anywhere could use hopefully get better soon remember awful fresher flu started university many bug going around year fear covid top,False
1.4428660272896614e+18,2021-09-28 14:57:22+00:00,['1442866027289661454'],@abbybeall @lucydougtweets But everyone is talking about it so I guess it had the desired effect. I suppose the news itself is nothing new- being overweight raises the risk of Type 2 Diabetes.,everyone talking guess desired effect suppose news nothing new overweight raise risk type diabetes,False
1.4428548260947722e+18,2021-09-28 14:12:52+00:00,['1442854826094772225'],@RoseStokes Crazy Ex Girlfriend.,crazy girlfriend,False
1.4427910035561308e+18,2021-09-28 09:59:15+00:00,['1442791003556130818'],"@naomi_rovnick @IsabelBerwick I've always hated commuting. Love office culture (perhaps not every day) but the actual act of getting out of bed (especially on a cold, dark day) and being squashed in a tube carriage for 40 minutes with a bunch of people is hell.",i've always hated commuting love office culture perhaps every day actual act getting bed especially cold dark day squashed tube carriage minute bunch people hell,False
1.44255859686946e+18,2021-09-27 18:35:45+00:00,['1442558596869459970'],@vfxoperator @Plungingforward @waitmanb @beth_kitson Me and virtually every other woman who has responded to the thread...,virtually every woman responded thread,False
1.4425174301615227e+18,2021-09-27 15:52:10+00:00,['1442517430161522690'],"@vfxoperator @Plungingforward @waitmanb @beth_kitson Yep. And if he had any awareness about women he would have made that clear in his answer. Also the response just makes him sound like a dick in general (even if there were no kids to look after). But then, a lot of celebs are totally out of touch.",yep awareness woman would made clear answer also response make sound like dick general even kid look lot celebs totally touch,False
1.4425155997085942e+18,2021-09-27 15:44:54+00:00,['1442515599708594177'],@vfxoperator @Plungingforward @waitmanb @beth_kitson I meant the lack of awareness in the response he gave...,meant lack awareness response gave,False
1.4425152664794726e+18,2021-09-27 15:43:34+00:00,['1442515266479472641'],@harriet1marsden Google doesn't mean much tbh. If you type in your practice name and CQC rating it should show up. If it's not good or better yet outstanding I'd look for one in your area that is and switch to them.,google mean much tbh type practice name cqc rating show good better yet outstanding i'd look one area switch,False
1.4425125447242588e+18,2021-09-27 15:32:45+00:00,['1442512544724258822'],"@harriet1marsden Your practice sounds terrible. Does it get a decent CQC rating? I just changed mine after realising my last one had been reviewed as needing ""significant improvement"".",practice sound terrible doe get decent cqc rating changed mine realising last one reviewed needing significant improvement,False
1.4424759886553784e+18,2021-09-27 13:07:30+00:00,['1442475988655378432'],"@mattybones8 @Plungingforward @waitmanb @beth_kitson It's just the tone and indication. You'll see many, many women on the thread querying the same thing...",tone indication see many many woman thread querying thing,False
1.4424673251402588e+18,2021-09-27 12:33:04+00:00,['1442467325140258818'],"@mattybones8 @Plungingforward @waitmanb @beth_kitson There's no need to swear. I clearly stated ""unless there's a trade off later"". There might be a trade off in this situation, it's just quite telling that it's not mentioned. Statistically most couples are not equally balanced in terms of domestic labour and childcare.",there's need swear clearly stated unless there's trade later might trade situation quite telling mentioned statistically couple equally balanced term domestic labour childcare,False
1.4424207338843914e+18,2021-09-27 09:27:56+00:00,['1442420733884391424'],@Plungingforward @waitmanb @beth_kitson It's more the lack of awareness. I need more sleep than my boyfriend but I wouldn't let him get up alone and do all the work (unless there's a big trade off later where he gets to relax). Perhaps there is in this household but it's telling he doesn't mention it.,lack awareness need sleep boyfriend let get alone work unless there's big trade later get relax perhaps household telling mention,False
1.4423916363282022e+18,2021-09-27 07:32:19+00:00,['1442391636328202243'],I'm keen to speak to women who have been celibate for several years due to issues with dating (especially misogyny on apps). It's for a national paper and will explore the non-extremist side of involuntary celibacy. You can be anon. DMs open or email is lizzie.cernik@gmail.com.,i'm keen speak woman celibate several year due issue dating especially misogyny apps national paper explore nonextremist side involuntary celibacy anon open email lizziecernikcom,False
1.4423826924697723e+18,2021-09-27 06:56:46+00:00,['1442382692469772291'],@LeahFHardy @sianushka Can't you ask for a sedative? I asked for one for a recent endoscopy.,can't ask sedative asked one recent endoscopy,False
1.4423823588214497e+18,2021-09-27 06:55:27+00:00,['1442382358821449729'],Coughing in public places is back in fashion and I'm really not here for it.,coughing public place back fashion i'm really,False
1.442202908603388e+18,2021-09-26 19:02:22+00:00,['1442202908603387908'],"@Samfr Anything over £50k is rich really. It's top 10% in the UK which is already incredibly rich compared to (much of) the rest of the world. Wealthy and very comfortable people have started identifying ""rich ppl"" as ""Elon Musk"" and not much else.",anything rich really top already incredibly rich compared much rest world wealthy comfortable people started identifying rich ppl elon musk much else,False
1.441319894327255e+18,2021-09-24 08:33:35+00:00,['1441319894327255043'],"@thediyora @MeghanJG I don't withhold empathy for privileged women. Every life lost is a tragedy. What I do notice is increased interest, media activity and upset around any tragedy involving a white, middle class woman. This shouldn't be the case. All women's lives are valuable.",withhold empathy privileged woman every life lost tragedy notice increased interest medium activity upset around tragedy involving white middle class woman case women's life valuable,False
1.4413049069761454e+18,2021-09-24 07:34:02+00:00,['1441304906976145410'],"I don't know if it's because it's funnier to joke about the worst parts of motherhood, but precisely zero parents make it sound appealing. It just sounds like an endless hellscape of viruses, domestic chores and cleaning up a wide variety of bodily fluids.",know funnier joke worst part motherhood precisely zero parent make sound appealing sound like endless hellscape virus domestic chore cleaning wide variety bodily fluid,False
1.4409470563282575e+18,2021-09-23 07:52:04+00:00,['1440947056328257538'],"@celialgould @Peachyfruitcake @kathdiggle This is it. Although I was very sad about it, I wasn't scared at all.  Homeless women, sex workers, ppl in controlling relationships etc are far more at risk of violence than affluent professional women living in nice areas, but ppl don't identify with them in the same way.",although sad scared homeless woman sex worker ppl controlling relationship etc far risk violence affluent professional woman living nice area ppl identify way,False
1.440930864842543e+18,2021-09-23 06:47:44+00:00,['1440930864842543107'],"@celialgould @Peachyfruitcake @kathdiggle It was shocking because the circumstances too, but definitely her demographic played a role. I remember my friends being horrified and saying ""it could have been any of us"". It clearly resonated more for them because her background was identical to ours.",shocking circumstance definitely demographic played role remember friend horrified saying could clearly resonated background identical,False
1.4407508456502968e+18,2021-09-22 18:52:24+00:00,['1440750845650296841'],"@SjBarrister @food_digger05 @Peachyfruitcake @kathdiggle The media (like many other industries) is predominantly controlled by white, middle class people. Being honest about racial bias (including our own in many cases) is a really important first step towards change.",medium like many industry predominantly controlled white middle class people honest racial bias including many case really important first step towards change,False
1.440749978742186e+18,2021-09-22 18:48:57+00:00,['1440749978742185986'],@SjBarrister @food_digger05 @Peachyfruitcake @kathdiggle Why do white people get so defensive about this? It's not about blaming people or specific journalists. It's about society accepting that racial bias exists and that (collectively) we need to take steps towards ensuring better representation and diversity in every area of life.,white people get defensive blaming people specific journalist society accepting racial bias exists collectively need take step towards ensuring better representation diversity every area life,False
1.4407474485367603e+18,2021-09-22 18:38:54+00:00,['1440747448536760324'],@SjBarrister @food_digger05 @Peachyfruitcake @kathdiggle There's no way it would have had the same level of attention if she'd been a black working class woman. Even if it had been an identical scenario.,there's way would level attention she'd black working class woman even identical scenario,False
1.4406278307069583e+18,2021-09-22 10:43:35+00:00,['1440627830706958341'],@Peachyfruitcake @kathdiggle The coverage was because a white middle class woman disappeared one night. She was well connected so word spread on social media very quickly and it spiralled from there as a high profile case. I've seen more on Gabby Petito (a US woman) this week than I have about this case.,coverage white middle class woman disappeared one night well connected word spread social medium quickly spiralled high profile case i've seen gabby petito woman week case,False
1.4405835061579244e+18,2021-09-22 07:47:27+00:00,['1440583506157924357'],@Peachyfruitcake @kathdiggle That's not true. Sarah was all over the headlines before the police officer was even questioned.,that's true sarah headline police officer even questioned,False
1.4405834278545367e+18,2021-09-22 07:47:08+00:00,['1440583427854536707'],"@rushmute @kathdiggle @PlanetWriter @BBCNews @Independent The answer is to value the lives of non-white, non-middle class people as much as you value wealthy white people. The media is predominantly white and middle class so there's a bias towards stories that impact people from this background.",answer value life nonwhite nonmiddle class people much value wealthy white people medium predominantly white middle class there's bias towards story impact people background,False
1.4399801920181494e+18,2021-09-20 15:50:05+00:00,['1439980192018149379'],@jbrandonlowry @clothfromstring @DinasaurusD I have a washer dryer combo for space reasons. It's in my kitchen because there is nowhere else for it to go in a one bed flat. I think flat owners in the US have shared laundry rooms on a different floor? That would drive me bonkers.,washer dryer combo space reason kitchen nowhere else one bed flat think flat owner shared laundry room different floor would drive bonkers,False
1.4398415884029174e+18,2021-09-20 06:39:20+00:00,['1439841588402917376'],@FalcondaleJan @DinasaurusD @raekennedy_ I don't think people in the US are richer though? I suspect overall there is a similar distribution of wealth. Plenty of ppl have washers/dryers/utility rooms and plenty don't. I'm sure there will be people in the US without space for a laundry room too. What about trailers?,think people richer though suspect overall similar distribution wealth plenty ppl washersdryersutility room plenty i'm sure people without space laundry room trailer,False
1.4396144597193974e+18,2021-09-19 15:36:48+00:00,['1439614459719397385'],"@msloobylou @fliceverett Ha ha me too. I'll be 40 in three years and the countryside is my living nightmare. I plan to be an old biddy living in a capital city dressed head to toe in (faux) fur, drinking cocktails for lunch at every fancy ass place in town and spa hopping on my OAP bus pass.",i'll three year countryside living nightmare plan old biddy living capital city dressed head toe faux fur drinking cocktail lunch every fancy place town spa hopping oap bus pas,False
1.4395350144761897e+18,2021-09-19 10:21:07+00:00,['1439535014476189701'],Why do we have advent calendars that cost £500? It's more than all the presents I would get under the tree combined.,advent calendar cost present would get tree combined,False
1.43933478838571e+18,2021-09-18 21:05:29+00:00,['1439334788385710084'],@JennieTetreault Nope. They need to come back when they're 40. Then I'm all ears.,nope need come back they're i'm ear,False
1.439191752317997e+18,2021-09-18 11:37:07+00:00,['1439191752317997057'],My mum came this week to look after me after a hospital appointment. She put a few clothes that had come out of the dryer on my bed and I thought it was new things. Turns out I just don't know what my clothes look like when they're folded.,mum came week look hospital appointment put clothes come dryer bed thought new thing turn know clothes look like they're folded,False
1.4391577726046126e+18,2021-09-18 09:22:05+00:00,['1439157772604612612'],"I love Hadley's writing, but I'm also a big believer that columns from one person shouldn't last more than a few years before going to someone else. This isn't because Hadley (&amp; others) aren't great writers, it's because new voices generate fresh perspective &amp; diversity in media. https://t.co/y91vVddBbV",love hadley's writing i'm also big believer column one person last year going someone else hadley amp others great writer new voice generate fresh perspective amp diversity medium,False
1.4391283964795372e+18,2021-09-18 07:25:22+00:00,['1439128396479537154'],@chadxt__ @guardian Thank you for being so candid and open in your interview! You were great.,thank candid open interview great,False
1.4388072556763013e+18,2021-09-17 10:09:16+00:00,['1438807255676301317'],@lucydougtweets @theadegallier I don't believe anyone would pay £429k for that. It's more than my one bed flat (in an actual house) in Hammersmith. You can get more for your money in E9.,believe anyone would pay one bed flat actual house hammersmith get money,False
1.438753319506301e+18,2021-09-17 06:34:56+00:00,['1438753319506300931'],"@RoseStokes When I was single in my late twenties I was mega jealous of friends getting engaged/married/going on honeymoon. Now late 30s and couldn't be happier to have the freedom of being childfree. I was intoxicated by the romance of romance, but run a mile from settled family life. 🤣",single late twenty mega jealous friend getting engagedmarriedgoing honeymoon late happier freedom childfree intoxicated romance romance run mile settled family life,False
1.43875050082082e+18,2021-09-17 06:23:44+00:00,['1438750500820819972'],@vixssmith Awww thanks Vix xx,awww thanks vix,False
