id,created_at,edit_history_tweet_ids,text,clean_text,non_english
1.204858332558905e+18,2019-12-11 20:19:46+00:00,['1204858332558905344'],"I mean I'm usually a ""glass half full"" kind of fan. It's just that in this case, my glass is half-full of crap. #dcfc",mean i'm usually glass half full kind fan case glass halffull crap,False
1.204856891660231e+18,2019-12-11 20:14:02+00:00,['1204856891660230656'],"And indeed it’s 0-1. Individually and collectively, we are just awful. Blame Cocu if you want, but I don’t see how anyone gets this squad winning games https://t.co/BxcneFXFnm",indeed individually collectively awful blame cocu want dont see anyone get squad winning game,False
1.204852852717437e+18,2019-12-11 19:57:59+00:00,['1204852852717436933'],"This... is not going to end well.

#DCFCvSWFC #dcfc",going end well,False
1.204845364551078e+18,2019-12-11 19:28:14+00:00,['1204845364551077888'],@petesherlock79 Appears fairly civilised!,appears fairly civilised,False
1.2047893112390492e+18,2019-12-11 15:45:30+00:00,['1204789311239049216'],"@JBP_41 We're displaying the results in a map, but have taken the (perhaps over-cautious) approach of not showing predictions for a group of seats until 5% of that group of seats have declared. But I'll certainly be tweeting sooner than that, as will @michaelgoodier",we're displaying result map taken perhaps overcautious approach showing prediction group seat group seat declared i'll certainly tweeting sooner,False
1.204788095259943e+18,2019-12-11 15:40:40+00:00,['1204788095259942913'],"@JBP_41 Well, you can never be sure! It's just a model, and it makes assumptions that people in certain areas and types of seats will all swing the same way. They have in the past. They might not in the future.",well never sure model make assumption people certain area type seat swing way past might future,False
1.2047866305125622e+18,2019-12-11 15:34:51+00:00,['1204786630512562176'],@ColinGeorgeBBC And even then there's are assumptions in how we are choosing to group seats (e.g. our model makes assumptions about seats in Brexit areas voting more mutually-sympathetically than those in non-Brexit areas. Those assumptions could be wrong!,even there's assumption choosing group seat model make assumption seat brexit area voting mutuallysympathetically nonbrexit area assumption could wrong,False
1.2047861666895995e+18,2019-12-11 15:33:00+00:00,['1204786166689599488'],"@ColinGeorgeBBC Yeah but that could just be blind luck; the important thing is to test it with different elections and scenarios, to try to establish it's generally a decent model.",yeah could blind luck important thing test different election scenario try establish generally decent model,False
1.2047854891291484e+18,2019-12-11 15:30:19+00:00,['1204785489129148416'],@michaelgoodier @davidhiggerson THAT'S ALSO A JOKE MICHAEL,that's also joke michael,False
1.2047850880782705e+18,2019-12-11 15:28:43+00:00,['1204785088078270464'],"@michaelgoodier Of course not!

(What I actually told @davidhiggerson was that you'd know after the first five seats)",course actually told know first five seat,False
1.2047825286426337e+18,2019-12-11 15:18:33+00:00,['1204782528642633728'],"This was all @michaelgoodier's work and I'm currently scaring him stupid by pretending that I've told all the Reach senior management, ""Of course Michael says he'll know the final result by midnight.""",work i'm currently scaring stupid pretending i've told reach senior management course michael say he'll know final result midnight,False
1.2047823084793938e+18,2019-12-11 15:17:40+00:00,['1204782308479393794'],"This year the election results gadget we've made will include a predictions tab. This uses results as they come in, measuring and projecting swings in different (geographic, demographic) groups of seats. Tested it using 2015 election data and it was pretty good, pretty quickly. https://t.co/lAHo1JmWo5",year election result gadget we've made include prediction tab result come measuring projecting swing different geographic demographic group seat tested using election data pretty good pretty quickly,False
1.204549763812737e+18,2019-12-10 23:53:37+00:00,['1204549763812737024'],@anngripper @DailyMirror @MirrorTom @NadaFarhoud @Mirror_Editor @FionaDuffyWrite @smith_louie Brilliant.,brilliant,True
1.2044138002013266e+18,2019-12-10 14:53:21+00:00,['1204413800201326593'],James is a great editor of a great paper. He shouldn't have to make these points; they should be obvious. They should be something we all know and celebrate.,james great editor great paper make point obvious something know celebrate,False
1.204412968114348e+18,2019-12-10 14:50:03+00:00,['1204412968114348033'],"This is why it is so irresponsible for people who should know better to stoke the narrative that everything that calls itself ""journalism"" is the same, &amp; everyone who calls themselves a journalist is either a politically-motivated manipulator, or an idiot
https://t.co/s4oQqoJtXK",irresponsible people know better stoke narrative everything call journalism amp everyone call journalist either politicallymotivated manipulator idiot,False
1.204398856143815e+18,2019-12-10 13:53:58+00:00,['1204398856143814657'],"@andycrane64 Yep, statistics* show 97% of soap opera characters were born in highly dramatic circumstances on Christmas Day.

*Probably.",yep statistic show soap opera character born highly dramatic circumstance christmas day probably,False
1.2043985432026522e+18,2019-12-10 13:52:43+00:00,['1204398543202652170'],"In short: there was actually only a fairly small window, between about 2007 and 2013, when we were creating more homes for social rent than we were selling off under Right to Buy.",short actually fairly small window creating home social rent selling right buy,False
1.204397054476378e+18,2019-12-10 13:46:49+00:00,['1204397054476378112'],"...and of those that _are_ available for rent, the majority aren't for _social_ rent. They only satisfy the government's definition of ""affordable rent"" - 80% of the local private-sector rate - which is, in most places, considerably more expensive than social rent. (2/2)",available rent majority social rent satisfy government's definition affordable rent local privatesector rate place considerably expensive social rent,False
1.2043970520394424e+18,2019-12-10 13:46:48+00:00,['1204397052039442437'],"Reasons for the housing crisis, continued: Right to Buy. 

Since 2005/06, we've been creating more new ""affordable homes"" than we've been selling off. That's good, right? 

Yes and no. Quite a lot of these affordable homes are intended for sale. They aren't for renting. (1/2) https://t.co/RTbNGwn2Kv",reason housing crisis continued right buy since we've creating new affordable home we've selling that's good right yes quite lot affordable home intended sale renting,False
1.204379941263024e+18,2019-12-10 12:38:48+00:00,['1204379941263024130'],"@kraxiz (Yes, I could and possibly should have done average births per year and included Feb 29!)",yes could possibly done average birth per year included feb,False
1.204379566371795e+18,2019-12-10 12:37:19+00:00,['1204379566371794944'],"@kraxiz By leaving them out... there were 10,796, or an average of 1,799 a year, which is roughly in line with the days immediately before and after.",leaving average year roughly line day immediately,False
1.2043788761111347e+18,2019-12-10 12:34:34+00:00,['1204378876111134720'],"Least common birthdays of children born since 2000:
December 26 - 25,985
December 25 - 27,307
January 1 - 30,090
December 27 - 32,188
April 1 - 32,468",least common birthday child born since december december january december april,False
1.2043787515445453e+18,2019-12-10 12:34:05+00:00,['1204378751544545280'],"Most common birthdays of children born since 2000:
September 26 - 38,123
September 27 - 38,106
September 19 - 37,979
September 25 - 37,826
September 28 - 37,696",common birthday child born since september september september september september,False
1.2043783624389878e+18,2019-12-10 12:32:32+00:00,['1204378362438987776'],"Just adding up all the live births in England and Wales since 2000... Most common birthdays are all in September. Least common are December 25, 26 and 31 - presumably because if it's a planned birth doctors avoid those dates. Data from https://t.co/maPoAU7JG1 https://t.co/uqw4LKnAfS",adding live birth england wale since common birthday september least common december presumably planned birth doctor avoid date data,False
1.204006680637399e+18,2019-12-09 11:55:36+00:00,['1204006680637399040'],"@clairemilleruk And also - there are many reasons why these awards are terrific, but with Claire and also brilliant @maevemcc on the news reporter of the year list, that's great recognition for the ""mainstreaming"" of data driven journalism and investigations, too.",also many reason award terrific claire also brilliant news reporter year list that's great recognition mainstreaming data driven journalism investigation,False
1.2040047578006733e+18,2019-12-09 11:47:58+00:00,['1204004757800673281'],"@clairemilleruk Also - what a great list, and what brilliant company to be keeping.",also great list brilliant company keeping,False
1.2040046705843692e+18,2019-12-09 11:47:37+00:00,['1204004670584369153'],"Fantastic to see @clairemilleruk in this list - the best data journalist in the UK, producing splash after splash for titles across the country while also running major interactive projects and news editing the UK's biggest data journalism team. https://t.co/T8rDSSoiUQ",fantastic see list best data journalist producing splash splash title across country also running major interactive project news editing uk's biggest data journalism team,False
1.204003739482415e+18,2019-12-09 11:43:55+00:00,['1204003739482415105'],@clairemilleruk Completely well deserved!,completely well deserved,False
1.2037345647299625e+18,2019-12-08 17:54:19+00:00,['1203734564729962497'],@AndrewStuart Cheers Andrew,cheer andrew,False
1.2037290100412047e+18,2019-12-08 17:32:14+00:00,['1203729010041204741'],December evenings in Manchester (II) https://t.co/bt5pHFYWHR,december evening manchester,True
1.2037285657092342e+18,2019-12-08 17:30:28+00:00,['1203728565709234176'],December evenings in Manchester https://t.co/mTqkYy8KOu,december evening manchester,True
1.2033480036601938e+18,2019-12-07 16:18:15+00:00,['1203348003660193792'],"@Deb_Aru @dubasfisher Sober, not boring",sober boring,True
1.2026714520272732e+18,2019-12-05 19:29:53+00:00,['1202671452027273227'],Happy Christmas do from a slightly-drunk-at-seven-thirty Data Unit https://t.co/M3CnG5j8lj,happy christmas slightlydrunkatseventhirty data unit,False
1.202594870709379e+18,2019-12-05 14:25:34+00:00,['1202594870709379075'],"(Deleted a previous, identical, post because Google cut region names from the y axis. Grrr.)",deleted previous identical post google cut region name axis grrr,False
1.2025947156962714e+18,2019-12-05 14:24:58+00:00,['1202594715696271361'],"There's a lot of truth in this, sadly. In nearly three quarters of seats in 2017 (73%), the winner got more than 50 per cent of votes cast. All the votes for all the other parties put together would have made no difference to the result. https://t.co/Q57BgR4DcG https://t.co/SYz2b3janD",there's lot truth sadly nearly three quarter seat winner got per cent vote cast vote party put together would made difference result,False
1.2023102611867156e+18,2019-12-04 19:34:38+00:00,['1202310261186715648'],@JamesDBeecher @Stuart_numbers Ha! Deal!,deal,True
1.2023069235734487e+18,2019-12-04 19:21:23+00:00,['1202306923573448709'],"@JamesDBeecher @Stuart_numbers They do. You might wonder if you made all commuter trains free for ever in the West Midlands on Friday, what % of people would arrive at work on Monday via their local railway station? And what jobs would they have? But I do take your points, which are well made",might wonder made commuter train free ever west midland friday people would arrive work monday via local railway station job would take point well made,False
1.2023059029399675e+18,2019-12-04 19:17:19+00:00,['1202305902939967489'],"@JamesDBeecher @Stuart_numbers I’m not sure we can agree on this policy in the world we have. I think though we’d agree that a clean, expanded high-capacity rail network - with low fares - serving communities across the UK that really need public transport would be a great thing.",sure agree policy world think though wed agree clean expanded highcapacity rail network low fare serving community across really need public transport would great thing,False
1.202304413945254e+18,2019-12-04 19:11:24+00:00,['1202304413945253891'],"@JamesDBeecher @Stuart_numbers I’m really not. I’m saying that outside of London the main reason people don’t use rail is that there is no rail to use. It simply isn’t an option, regardless of price",really saying outside london main reason people dont use rail rail use simply isnt option regardless price,False
1.2023039893180826e+18,2019-12-04 19:09:43+00:00,['1202303989318082561'],@JamesDBeecher @Stuart_numbers I’m saying if you have money to improve public transport there are much better things to spend it on than lower rail fares - things that will have much more impact on those who need public transport most.,saying money improve public transport much better thing spend lower rail fare thing much impact need public transport,False
1.2022987163020698e+18,2019-12-04 18:48:46+00:00,['1202298716302069762'],"That’s Middlesborough in Teeside, folks https://t.co/BVctOM4fnH",thats middlesborough teeside folk,False
1.2022982084514693e+18,2019-12-04 18:46:45+00:00,['1202298208451469313'],"@JamesDBeecher @Stuart_numbers Well, fine. But if we accept there is a limited amount of money to improve public transport, and our aim is to improve public transport for all, this is not the best way to do it. Do I wish we had better, fairer rail infrastructure? Yes. We don’t.",well fine accept limited amount money improve public transport aim improve public transport best way wish better fairer rail infrastructure yes dont,False
1.2022890891369882e+18,2019-12-04 18:10:30+00:00,['1202289089136988162'],"@JamesDBeecher @Stuart_numbers But surely you have to do that _first_? Otherwise the rail price cut doesn't have the effect you want it to have, doesn't help the people you want it to help.",surely first otherwise rail price cut effect want help people want help,False
1.2022886616745e+18,2019-12-04 18:08:49+00:00,['1202288661674500096'],@petejleonard I would genuinely love to see a public transport revolution in the UK.,would genuinely love see public transport revolution,False
1.2022884732286853e+18,2019-12-04 18:08:04+00:00,['1202288473228685313'],"@petejleonard @HannahSmeth1 @TomChivers Okay, I think I see what you are driving at. So let's say we set up a ""rail NTS"". Free at the point of use. In order for this to benefit everyone, surely you'll need to build lines in the north? Increase capacity? Buy new trains? Only once you've done that does it help everyone",okay think see driving let's say set rail free point use order benefit everyone surely need build line north increase capacity buy new train done doe help everyone,False
1.202287349033558e+18,2019-12-04 18:03:36+00:00,['1202287349033558016'],@petejleonard I think we're probably not that far apart in terms of our aims; we are disagreeing about the best means of achieving those aims. My dream UK has an extensive well-stocked rail network as it's a fantastic way of moving people around. But sadly that is now an expensive dream.,think we're probably far apart term aim disagreeing best mean achieving aim dream extensive wellstocked rail network fantastic way moving people around sadly expensive dream,False
1.2022870047693005e+18,2019-12-04 18:02:14+00:00,['1202287004769300481'],"@petejleonard Okay, so it would help you personally. It would help a lot of people. But there are far more people who would benefit more if we made the public transport they can actually access (chiefly, buses) more extensive, cheaper, and reliable.",okay would help personally would help lot people far people would benefit made public transport actually access chiefly bus extensive cheaper reliable,False
1.2022867129547205e+18,2019-12-04 18:01:04+00:00,['1202286712954720257'],@petejleonard @HannahSmeth1 @TomChivers I'm saying we have a limited amount of money to make better public transport for everyone. Cutting rail fares is a bad place to start.,i'm saying limited amount money make better public transport everyone cutting rail fare bad place start,False
1.2022865421752975e+18,2019-12-04 18:00:23+00:00,['1202286542175297539'],"@petejleonard @HannahSmeth1 @TomChivers I think I've lost you here. I don't see how my position implies I don't want a brilliant, well-funded NHS or state school sector?",think i've lost see position implies want brilliant wellfunded state school sector,False
1.2022858627315712e+18,2019-12-04 17:57:41+00:00,['1202285862731571201'],"@petejleonard There have to be the trains, services, etc in the first place! It's not that hard to find an overcrowded peak-time commuter service in the north west. If you wanted to make (say) 15% of people in (say) Greater Manchester take the train to work, prices aren't your first problem",train service etc first place hard find overcrowded peaktime commuter service north west wanted make say people say greater manchester take train work price first problem,False
1.2022853681057178e+18,2019-12-04 17:55:43+00:00,['1202285368105717761'],"@petejleonard Within London: well if that's your goal, what about means-testing, subsidies for less well off, etc? The ones who will _definitely_ benefit from this need it less.

Outside London, price is only a small part of the equation - often the trains, lines, stations simply don't exist.",within london well that's goal meanstesting subsidy well etc one definitely benefit need outside london price small part equation often train line station simply exist,False
1.2022620856961802e+18,2019-12-04 16:23:12+00:00,['1202262085696180225'],"There is a good case for Bob Willis being England's greatest post-war bowler. Some had a lower average, but none who took so many wickets. 

(Analysis includes all England bowlers active after 1945. Minimum 150 test wickets.) https://t.co/HloVuIhOgG",good case bob willis england's greatest postwar bowler lower average none took many wicket analysis includes england bowler active minimum test wicket,False
1.202253961786536e+18,2019-12-04 15:50:55+00:00,['1202253961786535938'],"@J_Bloodworth @unherd (..and if it doesn't force change then maybe there's some moral obligation to choose the least-worst of, as you see it, the various bad things that could happen.)",force change maybe there's moral obligation choose leastworst see various bad thing could happen,False
1.202253438593241e+18,2019-12-04 15:48:51+00:00,['1202253438593241093'],"@J_Bloodworth @unherd The problem I have with ballot-spoiling is that even if 51% of people did it, someone would still be in Number 10 the next day. Maybe it forces a better politics; maybe it just makes it easy for bad politics to succeed.",problem ballotspoiling even people someone would still number next day maybe force better politics maybe make easy bad politics succeed,False
1.2021925781725962e+18,2019-12-04 11:47:00+00:00,['1202192578172596230'],"@JaneRockHouse @BhamCityCouncil I could have phrased the initial tweet better, and you were right to pick me up on it. Some people on lower incomes would definitely benefit from this policy!",could phrased initial tweet better right pick people lower income would definitely benefit policy,False
1.2021857891463086e+18,2019-12-04 11:20:02+00:00,['1202185789146308608'],"@JaneRockHouse @BhamCityCouncil ...and if you've got the money to spend on this, there are other public transport priorities you should probably look at first, if your overall aim is to provide good public transport for all.",got money spend public transport priority probably look first overall aim provide good public transport,False
1.2021855191338394e+18,2019-12-04 11:18:57+00:00,['1202185519133839360'],"@JaneRockHouse @BhamCityCouncil Let me put it this way then: overall it will disproportionately benefit those who are a) already fairly well off, b) living in or near London. If the aim is just to get the less-well-off on the train, there were other policy choices...",let put way overall disproportionately benefit already fairly well living near london aim get lesswelloff train policy choice,False
1.202182135483961e+18,2019-12-04 11:05:31+00:00,['1202182135483961344'],@JamesDBeecher We can definitely agree on that.,definitely agree,False
1.202180808251003e+18,2019-12-04 11:00:14+00:00,['1202180808251002881'],@JamesDBeecher And the fact is it's a lot cheaper to put in new bus routes than to build new rail infrastructure.,fact lot cheaper put new bus route build new rail infrastructure,False
1.2021804069903114e+18,2019-12-04 10:58:39+00:00,['1202180406990311425'],"@JamesDBeecher It's more than twice as many using the bus in the NW and Yorkshire, five times more in the East Midlands, seven times more in the NE... these are large numbers.",twice many using bus yorkshire five time east midland seven time large number,False
1.202180083651416e+18,2019-12-04 10:57:22+00:00,['1202180083651416064'],"@JamesDBeecher Fair enough - the evidence suggests you are very much in a minority, though. I'm not saying reducing fares is bad. I'm saying it's worth considering who exactly it's going to help, compared with e.g. ""50% off fares for low incomes, everyone else pays same as now.""",fair enough evidence suggests much minority though i'm saying reducing fare bad i'm saying worth considering exactly going help compared fare low income everyone else pay,False
1.2021795290301522e+18,2019-12-04 10:55:09+00:00,['1202179529030152192'],"@HannahSmeth1 @TomChivers Reducing cost of season tickets would open it up, as a commuting option, to some people who currently can't afford it. It would also benefit _all_ those who currently use the train daily. 

Compare with this: Those earning less than £25k a year get 50% off. Others pay full price",reducing cost season ticket would open commuting option people currently can't afford would also benefit currently use train daily compare earning year get others pay full price,False
1.2021784389892628e+18,2019-12-04 10:50:49+00:00,['1202178438989262850'],"@JamesDBeecher (Although as we are discovering in Manchester, easier to do in principle than in practice. We're still waiting...)",although discovering manchester easier principle practice we're still waiting,False
1.2021782694471803e+18,2019-12-04 10:50:09+00:00,['1202178269447180289'],@JamesDBeecher And regulating them everywhere. Which is a _fantastic_ policy!,regulating everywhere fantastic policy,False
1.2021776141164667e+18,2019-12-04 10:47:33+00:00,['1202177614116466688'],"@JamesDBeecher And data about how things should be has to use data about how things are as a base. And trains are a good example: cutting fares is of no use to people where lines don't exist, who aren't on a train route, who don't have interchanges with other public transport.",data thing use data thing base train good example cutting fare use people line exist train route interchange public transport,False
1.20217731621607e+18,2019-12-04 10:46:22+00:00,['1202177316216070145'],"@JamesDBeecher My argument is to build new public transport infrastructure and in the meantime focusing on making those forms of public transport which the majority of people actually have access to - generally the bus - affordable, regular, and regulated.",argument build new public transport infrastructure meantime focusing making form public transport majority people actually access generally bus affordable regular regulated,False
1.202177000745644e+18,2019-12-04 10:45:07+00:00,['1202177000745644033'],"@JamesDBeecher I'm not disputing that. I'm saying reducing prices will help all those who currently use the train, as well as however many choose to use the train in future. It can't be ""saving money for the average family"" if they aren't _already_ using the train.",i'm disputing i'm saying reducing price help currently use train well however many choose use train future can't saving money average family already using train,False
1.2021748513493975e+18,2019-12-04 10:36:34+00:00,['1202174851349397504'],"@psmith Ha. 

(He laughs, bitterly)",laugh bitterly,False
1.2021744775824548e+18,2019-12-04 10:35:05+00:00,['1202174477582454791'],"@thisisrammysite The expanded tram network in Greater Manchester is a good example - it was a battle against a (then-Labour) government to pay for it to be built, because they baulked at the cost. But it was built. It's made a real difference. But there's so much more to be done.",expanded tram network greater manchester good example battle thenlabour government pay built baulked cost built made real difference there's much done,False
1.2021741554724209e+18,2019-12-04 10:33:48+00:00,['1202174155472420865'],"@thisisrammysite This is the problem. If we want a really great public transport network across the country, there's going to be a _huge_ amount of infrastructure work needed, and it's going to cost a fortune. And, at the end of all that, whatever we build, we need to make it affordable.",problem want really great public transport network across country there's going huge amount infrastructure work needed going cost fortune end whatever build need make affordable,False
