id,created_at,edit_history_tweet_ids,text,clean_text,non_english
1.2678667356145828e+18,2020-06-02 17:12:40+00:00,['1267866735614582791'],"Deaths in the last 10 weeks of 2020 (well, up to May 22) compared to deaths in the first 10 weeks of 2020. Map shows % increase. https://t.co/X2PVbd94CV",death last week well may compared death first week map show increase,False
1.266383680966099e+18,2020-05-29 14:59:32+00:00,['1266383680966098945'],Are Airbnb's Covid-19 struggles potentially good news for urban renters? By @nicucalcea https://t.co/m9F6OUHSHA https://t.co/C1m9aKSRNl,airbnb's covid struggle potentially good news urban renter,False
1.2663831874434376e+18,2020-05-29 14:57:34+00:00,['1266383187443437569'],Is it too soon for the UK to be leaving lockdown? @spreadsheetben on warning signs based on data from other countries around the world https://t.co/VdzXz9Sr1z https://t.co/Xodsb0Lbqp,soon leaving lockdown warning sign based data country around world,False
1.2634523010475786e+18,2020-05-21 12:51:17+00:00,['1263452301047578624'],"@glynmottershead Any excuse to crack out MS paint, Glyn...",excuse crack paint glyn,False
1.2634501743677071e+18,2020-05-21 12:42:49+00:00,['1263450174367707138'],"Also new today: quarterly long-term immigration estimates up to Q4 2019 showing that, even pre-Brexit, the majority of net immigration was from outside the EU. (Spikes are students arriving in Q3.) https://t.co/T7SVVm4wo0",also new today quarterly longterm immigration estimate showing even prebrexit majority net immigration outside spike student arriving,False
1.2634496175990047e+18,2020-05-21 12:40:37+00:00,['1263449617599004672'],@glynmottershead https://t.co/2OS9UyidNF,,
1.26344333361306e+18,2020-05-21 12:15:39+00:00,['1263443333613060099'],Away from Covid-19: just looking through the latest population figures. It's striking how much more cosmopolitan the London boroughs (orange) are than the rest of England and Wales (even other major cities). https://t.co/jxBDpw9HYb,away covid looking latest population figure striking much cosmopolitan london borough orange rest england wale even major city,False
1.2634314649951642e+18,2020-05-21 11:28:29+00:00,['1263431464995164161'],"@ValuedComment @jimwaterson Yeah I meant more ""What's going on there, then?""",yeah meant what's going,False
1.2634290346308854e+18,2020-05-21 11:18:49+00:00,['1263429034630885382'],@jimwaterson FT?,,True
1.2627021723635343e+18,2020-05-19 11:10:32+00:00,['1262702172363534346'],"Unemployment figures out today: biggest year-on-year increases in claimant count in April were in tourist parts of Cumbria, Devon and Snowdonia, where numbers have tripled. https://t.co/FkMIdneSbt",unemployment figure today biggest yearonyear increase claimant count april tourist part cumbria devon snowdonia number tripled,False
1.2617690365028393e+18,2020-05-16 21:22:35+00:00,['1261769036502839296'],@J_CD_T Fantastic work and fantastic gesture.,fantastic work fantastic gesture,False
1.261235248857301e+18,2020-05-15 10:01:30+00:00,['1261235248857300992'],"The ONS calculates
-33% of the total workforce are ""key workers""
-14% of key workers are BAME (11% of non-key workers are BAME)
-58% of key workers are female (42% of non-key workers are female)",ons calculates total workforce key worker key worker bame nonkey worker bame key worker female nonkey worker female,False
1.261234493475754e+18,2020-05-15 09:58:30+00:00,['1261234493475753984'],"Key workers in health and social care, food, and utilities are more likely than non-key workers to have been born outside the UK. Adapted from this new dataset: https://t.co/te3bPuATKX https://t.co/hOLqVrhWXd",key worker health social care food utility likely nonkey worker born outside adapted new dataset,False
1.2612310292155474e+18,2020-05-15 09:44:44+00:00,['1261231029215547394'],Data also shows the main (but not necessarily only) pre-existing medical conditions of care home residents dying Covid-19-related deaths. Some 11% (one in nine or so) had no pre-existing conditions. https://t.co/RfTERNSJnK,data also show main necessarily preexisting medical condition care home resident dying covidrelated death one nine preexisting condition,False
1.2612289508875756e+18,2020-05-15 09:36:29+00:00,['1261228950887575558'],Most of the deaths (of care homes residents) that are being attributed to Covid-19 are taking place _in care homes_ (72%) rather than in hospital.  Care home residents very ill with Covid-19 generally aren't taken to hospital for treatments that they probably would not survive.,death care home resident attributed covid taking place care home rather hospital care home resident ill covid generally taken hospital treatment probably would survive,False
1.261227243201876e+18,2020-05-15 09:29:41+00:00,['1261227243201875968'],"New data out on deaths a) in care homes, and b) of care home residents (ie including deaths in hospital). We can use this to plots this frankly shocking graph of deaths per day of care home residents since 2017. https://t.co/kQQxpJ7S9r",new data death care home care home resident including death hospital use plot frankly shocking graph death per day care home resident since,False
1.2609778810202358e+18,2020-05-14 16:58:49+00:00,['1260977881020235782'],"@mikeysmith Also, it's not a city v country thing. The country figured out the whole ""bed and walls"" thing some time ago.",also city country thing country figured whole bed wall thing time ago,False
1.2609777431829135e+18,2020-05-14 16:58:16+00:00,['1260977743182913541'],"@mikeysmith It's terrible. There is literally no time ever when I find myself lying in bed and think: ""Do you know what would make this better? No bed. And no walls.""",terrible literally time ever find lying bed think know would make better bed wall,False
1.2609590479997665e+18,2020-05-14 15:43:59+00:00,['1260959047999766534'],(Also there's something weird going on with the count in Camden...) https://t.co/jdrRUgm7BW,also there's something weird going count camden,False
1.2609580072042168e+18,2020-05-14 15:39:51+00:00,['1260958007204216833'],"Picking over the regional data on Covid-19 outbreaks in care homes and a couple of things stand out:
1) Huge surge in care homes in the North West with cases at the start of April
2) North East diverged in April and now has by far highest % of homes affected https://t.co/4e48phClMX",picking regional data covid outbreak care home couple thing stand huge surge care home north west case start april north east diverged april far highest home affected,False
1.2609379584561644e+18,2020-05-14 14:20:11+00:00,['1260937958456164352'],Data here: https://t.co/jsJymcRDx9,data,True
1.260937855540527e+18,2020-05-14 14:19:46+00:00,['1260937855540527104'],"New infection survey pilot suggests 148,000* people in England had Covid-19 in two weeks to May 10. ""Official"" figures picked up 21,341 cases in that time.

*Big caveat - first wave of survey has a small sample size; 95% confidence interval that number is between 94,000-222,000",new infection survey pilot suggests people england covid two week may official figure picked case time big caveat first wave survey small sample size confidence interval number,False
1.2609040539592622e+18,2020-05-14 12:05:27+00:00,['1260904053959262209'],"New OBR report makes frightening reading, with budget deficit at levels not seen since the second world war. Via @michaelgoodier https://t.co/E0Lweaoh23",new obr report make frightening reading budget deficit level seen since second world war via,False
1.2608955578679296e+18,2020-05-14 11:31:41+00:00,['1260895557867929600'],"@AlexSelbyB @Bobby_Seagull The headings are ""NO WAY"" and ""DOES THIS WORK""",heading way doe work,False
1.260893827356922e+18,2020-05-14 11:24:49+00:00,['1260893827356921857'],@fiddleBrain AGH YOU NOTICED I THOUGHT I'D GOT AWAY WITH IT,agh noticed thought i'd got away,False
1.2608885542527631e+18,2020-05-14 11:03:52+00:00,['1260888554252763136'],"(I have an entirely personal and unevidenced suspicion that this determination to find positives in a crisis has some bearing on national opinion polls. ""We will pull together/emerge stronger and better!"" tends to favour the incumbent party.) 
https://t.co/tPBweIUHL1",entirely personal unevidenced suspicion determination find positive crisis bearing national opinion poll pull togetheremerge stronger better tends favour incumbent party,False
1.2608883534000292e+18,2020-05-14 11:03:04+00:00,['1260888353400029184'],https://t.co/Gf1Sn6A1hB,,
1.2608883519782584e+18,2020-05-14 11:03:03+00:00,['1260888351978258432'],https://t.co/t341DmbugU,,
1.26088835042637e+18,2020-05-14 11:03:03+00:00,['1260888350426370050'],"One fascinating aspect of the Covid-19 crisis is our sheer optimism that Britain will emerge a fairer, kinder and more united place. Data from today's edition of the ongoing survey of social impacts published weekly by the ONS.) https://t.co/DImkHiH1AI",one fascinating aspect covid crisis sheer optimism britain emerge fairer kinder united place data today's edition ongoing survey social impact published weekly ons,False
1.2608766339694387e+18,2020-05-14 10:16:30+00:00,['1260876633969438725'],"Really just a taste of what's to come: by the end of March alone, the number of people waiting 6+ weeks for diagnostic tests in England (MRIs, heart scans, colonoscopies, ultrasounds etc) had more than doubled. From: https://t.co/rvMqFDUot0 https://t.co/rtkieUoimR",really taste what's come end march alone number people waiting week diagnostic test england mri heart scan colonoscopy ultrasound etc doubled,False
1.2608642602189906e+18,2020-05-14 09:27:20+00:00,['1260864260218990592'],https://t.co/5CHQWPfaKa,,
1.2608629234901484e+18,2020-05-14 09:22:01+00:00,['1260862923490148353'],Nearly a quarter of homes in London have no private outdoor space (ie gardens) at all. The figure rises well above a quarter in central London. From new ONS data out today https://t.co/hPn1RG5QQz https://t.co/mn8PrZBW8L,nearly quarter home london private outdoor space garden figure rise well quarter central london new ons data today,False
1.2601578975368684e+18,2020-05-12 10:40:30+00:00,['1260157897536868352'],@aimaz @BenHattonJourno Live,live,True
1.2601574571097907e+18,2020-05-12 10:38:45+00:00,['1260157457109790720'],@de_monstrorum https://t.co/7Sip83Wb6g,,
1.260154455498031e+18,2020-05-12 10:26:49+00:00,['1260154455498031104'],Cycling and walking to work. A good thing? Yes. an option for everyone? No. https://t.co/TU27LR0tun,cycling walking work good thing yes option everyone,False
1.2601502760251884e+18,2020-05-12 10:10:12+00:00,['1260150276025188352'],"@janinewat Yeah I guess I meant: ""Why it wasn't something we could reasonably foresee, and take stronger measures to prevent or mitigate.""",yeah guess meant something could reasonably foresee take stronger measure prevent mitigate,False
1.2601332616338227e+18,2020-05-12 09:02:36+00:00,['1260133261633822721'],Data https://t.co/rEod9hrrNa,data,True
1.260133121888002e+18,2020-05-12 09:02:03+00:00,['1260133121888002049'],"Two key lines from ONS death statistics for England and Wales this morning: deaths (from all causes) fell in the week to May 1; but for the first time there were more deaths in care homes than in hospitals. The ""first wave"" in care homes peaked later: we should be asking why. https://t.co/iKGMIZAe8g",two key line ons death statistic england wale morning death cause fell week may first time death care home hospital first wave care home peaked later asking,False
1.2599115888589988e+18,2020-05-11 18:21:45+00:00,['1259911588858998788'],@adj4life72 @PBOprof @ONS!,,
1.2598465277465395e+18,2020-05-11 14:03:13+00:00,['1259846527746539530'],"Here are all the jobs with more than 10 Covid-19 related deaths in England and Wales, sorted by the highest death rate. Pretty much all of these are jobs that people _have had to keep doing_ during lockdown. https://t.co/rDm8rB5WW8",job covid related death england wale sorted highest death rate pretty much job people keep lockdown,False
1.2597754129027932e+18,2020-05-11 09:20:38+00:00,['1259775412902793217'],https://t.co/52FvvfnYCY,,
1.2597751696414925e+18,2020-05-11 09:19:40+00:00,['1259775169641492480'],@lowwintersun That's a very good point.,that's good point,False
1.2597713996961546e+18,2020-05-11 09:04:41+00:00,['1259771399696154624'],"There were 76 Covid-19 deaths of (male) cab drivers in the dataset. The virus accounted for nearly _half_ of all deaths among working age cab drivers over that time. These are people that have no choice but to work, who others _expect_ to work.",covid death male cab driver dataset virus accounted nearly half death among working age cab driver time people choice work others expect work,False
1.259767720591098e+18,2020-05-11 08:50:04+00:00,['1259767720591097861'],"As evidence this is about exposure, not just demographics - here are Covid death rates for different types of driver. It's the ""exposed"" ones - taxi/bus drivers - who are dying. These are key workers. These are people risking their lives. https://t.co/E6Eids6p8u",evidence exposure demographic covid death rate different type driver exposed one taxibus driver dying key worker people risking life,False
1.2597670869115535e+18,2020-05-11 08:47:33+00:00,['1259767086911553538'],"(This is something that really annoyed me about that ""Brexit voters are ignoring lockdown and still going to the workplace!"" narrative from a while ago. Real story is: low-paid, low-skilled workers are the ones still expected to go to work, and they are more likely to die)",something really annoyed brexit voter ignoring lockdown still going workplace narrative ago real story lowpaid lowskilled worker one still expected work likely die,False
1.2597666046462853e+18,2020-05-11 08:45:38+00:00,['1259766604646285313'],"Here are the death rates for men. Basically managers and professionals have seen far fewer deaths; there are many factors here, some demographic/health related, but also those people are far more able to do their jobs from home. https://t.co/sB0APaUBtm",death rate men basically manager professional seen far fewer death many factor demographichealth related also people far able job home,False
1.259766055209177e+18,2020-05-11 08:43:27+00:00,['1259766055209177089'],"This seems to have quite a lot to do with exposure: the people in the most affected individual jobs are generally those who have had no choice but to keep working, and keep being exposed to members of the public. (And these ""exposed"" jobs are not well-paid jobs, by and large.) https://t.co/PVhim0300U",seems quite lot exposure people affected individual job generally choice keep working keep exposed member public exposed job wellpaid job large,False
1.259765458250629e+18,2020-05-11 08:41:05+00:00,['1259765458250629121'],"Important new data from the ONS out today looking at Covid-19 deaths by occupation. Key findings: social care workers seeing significantly raised levels of deaths, and people working in lowest-skilled jobs generally are the most vulnerable. https://t.co/wCTXlHL0P8",important new data ons today looking covid death occupation key finding social care worker seeing significantly raised level death people working lowestskilled job generally vulnerable,False
1.257227440751104e+18,2020-05-04 08:35:54+00:00,['1257227440751104001'],Quote is one of many (sobering) reflections in the piece by @mayor_anderson,quote one many sobering reflection piece,False
1.2572248829176873e+18,2020-05-04 08:25:44+00:00,['1257224882917687296'],“If Liverpool has to pay £33m on top of £30m cuts it has found it will be looking at bankruptcy.” &gt; on a cases-per-capita basis many places have been hit as hard as London; and those places may be much less economically resilient. By @michaelgoodier https://t.co/6GWFEJUZEW https://t.co/GwV4viKJEK,liverpool pay top cut found looking bankruptcy casespercapita basis many place hit hard london place may much economically resilient,False
1.2561895448625684e+18,2020-05-01 11:51:41+00:00,['1256189544862568448'],"@UKandEU @benwansell @NuffieldCollege @C_BruceLockhart @BruceReuters @EdConwaySky @Ashley_J_Kirk @caelainnbarr Interesting. I do think an important question to ask though is about what _types_ of jobs people have in different areas, as @michaelgoodier has done. Whether you work in a supermarket or as an accountant seems a more likely _causal_ factor than your attitude to Brexit! https://t.co/hEc5idIdEz",interesting think important question ask though type job people different area done whether work supermarket accountant seems likely causal factor attitude brexit,False
1.2558340311885742e+18,2020-04-30 12:18:59+00:00,['1255834031188574208'],"(Diesels do appear to be very much on the way out, though.) Data for 2019 published today, here: https://t.co/NtpXXClLIJ",diesel appear much way though data published today,False
1.2558338102074204e+18,2020-04-30 12:18:07+00:00,['1255833810207420416'],https://t.co/GJQTCDedZ1,,
1.2558338087771177e+18,2020-04-30 12:18:06+00:00,['1255833808777117697'],Plotting the number of new hybrid and electric cars on British roads is really encouraging... right up until you add in petrol and diesel cars too (see first reply) https://t.co/eE0O1IkWj5,plotting number new hybrid electric car british road really encouraging right add petrol diesel car see first reply,False
1.2554289319661855e+18,2020-04-29 09:29:16+00:00,['1255428931966185473'],"@HMAnderson39 (""Have to"" is a bit tendentious - FOI officers are generally good people and they are simply applying the law, which means lots of information is exempt from the act for generally good reasons.)",bit tendentious foi officer generally good people simply applying law mean lot information exempt act generally good reason,False
1.255428593334866e+18,2020-04-29 09:27:56+00:00,['1255428593334865920'],"@HMAnderson39 The process is roughly: a) do we have the data, and then b) do we have to give it to you?",process roughly data give,False
1.2554281853086966e+18,2020-04-29 09:26:18+00:00,['1255428185308696579'],Data at https://t.co/i9qEIZpjSQ,data,True
1.2554281221970043e+18,2020-04-29 09:26:03+00:00,['1255428122197004294'],"The claim that time is being wasted on ""vexatious"" requests by journalists fishing for silly non-stories seems over-cooked. Barely any ""resolvable"" requests to government departments are rejected as vexatious (and they can be - it's a legitimate exemption). (3/3) https://t.co/u8TPBXlKbI",claim time wasted vexatious request journalist fishing silly nonstories seems overcooked barely resolvable request government department rejected vexatious legitimate exemption,False
1.2554278258611036e+18,2020-04-29 09:24:53+00:00,['1255427825861103616'],"2) Long-term, a growing proportion of ""resolvable"" requests - ie ones which could in theory be answered, because the information exists - are being refused in full. (2/3) https://t.co/XOO7FpoFIV",longterm growing proportion resolvable request one could theory answered information exists refused full,False
1.2554274201040325e+18,2020-04-29 09:23:16+00:00,['1255427420104032256'],"Couple of interesting snippets from the annual report into use of the Freedom of Information Act. 
1) Despite lots of mutterings about workload, total requests to government departments fell in 2019 and has been broadly static for nearly a decade (1/3) https://t.co/F9lNeFYINe",couple interesting snippet annual report use freedom information act despite lot muttering workload total request government department fell broadly static nearly decade,False
1.254045997401092e+18,2020-04-25 13:53:59+00:00,['1254045997401092096'],@RobynVinter American recipes that say 'one cup of x' are the worst. Which cup? I have many.,american recipe say 'one cup worst cup many,False
1.2532664116292854e+18,2020-04-23 10:16:11+00:00,['1253266411629285376'],"@clairemilleruk Yep, think that's basically it",yep think that's basically,False
1.2532655256203223e+18,2020-04-23 10:12:40+00:00,['1253265525620322306'],"@dtoher Fair point - and it's unclear, but suggests not.",fair point unclear suggests,True
1.2532571836026593e+18,2020-04-23 09:39:31+00:00,['1253257183602659328'],And there's a serious point here: https://t.co/nAinoICRmP,there's serious point,False
1.2532553729005322e+18,2020-04-23 09:32:19+00:00,['1253255372900532225'],"There's always one, and it's generally a man. https://t.co/xeRvT9t8GL https://t.co/lgpPBJNEOP",there's always one generally man,False
1.2515235532892652e+18,2020-04-18 14:50:41+00:00,['1251523553289265154'],@petesherlock79 @michaelgoodier Thanks Pete!,thanks pete,False
1.2514565657203425e+18,2020-04-18 10:24:30+00:00,['1251456565720342529'],"Data thread for those living in areas with a high % of middle-class jobs that can be done from home or are non-essential. Worth reading before you criticise those living in areas with a high % of production/caring/delivery jobs for ""flouting lockdown"".  https://t.co/fL5fMe6kOx",data thread living area high middleclass job done home nonessential worth reading criticise living area high productioncaringdelivery job flouting lockdown,False
1.2514535110842655e+18,2020-04-18 10:12:22+00:00,['1251453511084265473'],Anyway great investigative work by the band: @michaelgoodier on words and scraping and @joshrayman on viz.,anyway great investigative work band word scraping viz,False
1.2514531939026084e+18,2020-04-18 10:11:06+00:00,['1251453193902608387'],"In some areas people don't have a choice about working from home, or being able to choose not to work. Those tend to be areas with high level of ""producing"" jobs done in factories etc; more middle-class professional areas have locked down more, because they can.",area people choice working home able choose work tend area high level producing job done factory etc middleclass professional area locked,False
1.2514528330036838e+18,2020-04-18 10:09:40+00:00,['1251452833003683841'],"I suspect that even if there's a correlation between e.g. Brexit voting (which I saw somewhere) and lower drops in workplace movement, the _causal_ factor is more likely to be something like this.",suspect even there's correlation brexit voting saw somewhere lower drop workplace movement causal factor likely something like,False
1.2514523580868567e+18,2020-04-18 10:07:47+00:00,['1251452358086856704'],"At the other end of the scale: workplace movement has dropped _least_ in areas with lots of skilled trades, elementary manual jobs, factory jobs and caring jobs. https://t.co/lFG0TyTkf0",end scale workplace movement dropped least area lot skilled trade elementary manual job factory job caring job,False
1.2514520071158948e+18,2020-04-18 10:06:24+00:00,['1251452007115894785'],"Places with lots of professional, technical roles have seen workplace movement drop more. That make sense: these are often jobs that can be done at home, or aren't ""essential"" in the same way as e.g. producing and delivering food. https://t.co/vQA8hgdoXy",place lot professional technical role seen workplace movement drop make sense often job done home essential way producing delivering food,False
1.2514517707374838e+18,2020-04-18 10:05:27+00:00,['1251451770737483777'],"The higher in the chart a dot is, the more workplace mobility has reduced during the lockdown.",higher chart dot workplace mobility reduced lockdown,False
1.2514516504447918e+18,2020-04-18 10:04:58+00:00,['1251451650444791809'],"On these charts: dots are cities/conurbations/counties. The further to the right a ""dot"" is, the more reliant that area is on that type of job.",chart dot citiesconurbationscounties right dot reliant area type job,False
1.2514512981316076e+18,2020-04-18 10:03:34+00:00,['1251451298131607553'],Why has movement around workplaces dropped in some places more than others during lockdown? Suggest it has nothing to do with people's beliefs/choices but rather to do with the jobs they have. @michaelgoodier plots movement levels v job types across the UK https://t.co/IXwmiFJi9t https://t.co/NZ6T8rLTg6,movement around workplace dropped place others lockdown suggest nothing people's beliefschoices rather job plot movement level job type across,False
1.2507567860612915e+18,2020-04-16 12:03:50+00:00,['1250756786061291520'],"@RandEnoch @georgeeaton @nicucalcea @michaelgoodier @spreadsheetben Surely not just that though? e.g. 2017 there were 16,338 female deaths from lung cancer in the UK and 18,810 male deaths.",surely though female death lung cancer male death,False
1.250753802464047e+18,2020-04-16 11:51:59+00:00,['1250753802464047105'],"I know it's been mentioned before but the extent to which Covid-19 is killing men more than women is remarkable. From new ONS figures out this morning, via @nicucalcea. Read more data news and analysis from him @michaelgoodier and @spreadsheetben at https://t.co/pYK3kXlKtS https://t.co/LVpvTVEkLo",know mentioned extent covid killing men woman remarkable new ons figure morning via read data news analysis,False
1.250077874071253e+18,2020-04-14 15:06:05+00:00,['1250077874071252998'],Welcoming @nicucalcea and @michaelgoodier to the New Statesman Media Group data team today. Very excited to be working with them,welcoming new statesman medium group data team today excited working,False
1.2500275209609257e+18,2020-04-14 11:46:00+00:00,['1250027520960925696'],"The effect is particularly clear in regions at the heart of the early outbreak - and particularly, London. https://t.co/x9UGanx4fr",effect particularly clear region heart early outbreak particularly london,False
1.2500273200496148e+18,2020-04-14 11:45:12+00:00,['1250027320049614852'],"To put the ONS death figures in perspective - and remembering this is only up to April 3, when reported Covid-19 deaths were lower than now - this tracks weekly all-cause deaths in England and Wales since January 2019. https://t.co/W3LJZeQSHm",put ons death figure perspective remembering april reported covid death lower track weekly allcause death england wale since january,False
