id,created_at,edit_history_tweet_ids,text,clean_text,non_english
1.1695978517621555e+18,2019-09-05 13:07:12+00:00,['1169597851762155520'],"How does an international spinner bowl a no ball?

How?",doe international spinner bowl ball,False
1.1695773633210532e+18,2019-09-05 11:45:47+00:00,['1169577363321053185'],"@RobinKwong @FinancialTimes Brilliant idea, brilliant execution.

To summarise: brilliant",brilliant idea brilliant execution summarise brilliant,False
1.1695758734120468e+18,2019-09-05 11:39:52+00:00,['1169575873412046850'],I mean the strategy _might_ be as bad as it looks right now. But we won’t know until we get that election.,mean strategy might bad look right wont know get election,False
1.1695749129625477e+18,2019-09-05 11:36:03+00:00,['1169574912962547712'],@LancscricketMEN Bloody work,bloody work,True
1.169573651366187e+18,2019-09-05 11:31:02+00:00,['1169573651366187008'],"@LancscricketMEN What’s a good score on this pitch, Chris? Not been watching",whats good score pitch chris watching,False
1.1695712232584888e+18,2019-09-05 11:21:23+00:00,['1169571223258488832'],(More terrifying: it might well work.),terrifying might well work,False
1.169565372321796e+18,2019-09-05 10:58:08+00:00,['1169565372321796096'],"Break everything that isn't already broken, in order to say to the people:

""Everything is now so broken than only a maverick can build things up anew.""

It's a strategy, I guess.",break everything already broken order say people everything broken maverick build thing anew strategy guess,False
1.169309036375937e+18,2019-09-04 17:59:33+00:00,['1169309036375937024'],https://t.co/TAFQjwlpVi,,
1.1693073967134065e+18,2019-09-04 17:53:02+00:00,['1169307396713406465'],*Featuring my famous complete inability to straighten photographs correctly.,featuring famous complete inability straighten photograph correctly,False
1.1693070492404777e+18,2019-09-04 17:51:39+00:00,['1169307049240477699'],A few recent pictures of Manchester in the evening/night time on a soon-to-be-wiped memory card https://t.co/ArCKACC1pO,recent picture manchester eveningnight time soontobewiped memory card,False
1.169280149273174e+18,2019-09-04 16:04:46+00:00,['1169280149273174016'],"@danwainwright @robertcuffe Yeah, I think that's basically it. RDEL doesn't include Annually Managed Expenditure, but Total Managed Expenditure _does_ include AME. 

I think. https://t.co/I5huDxKtfi",yeah think that's basically rdel include annually managed expenditure total managed expenditure doe include ame think,False
1.1692756103902904e+18,2019-09-04 15:46:44+00:00,['1169275610390290432'],(e.g. would be fascinating to see Donald Trump similarly held to account by a lower house.) https://t.co/IJYJgCArc1,would fascinating see donald trump similarly held account lower house,False
1.1692711988297318e+18,2019-09-04 15:29:12+00:00,['1169271198829731840'],Smith and Labuschagne are responsible for 43% of Australia's runs this series. https://t.co/w3btqps9C7,smith labuschagne responsible australia's run series,False
1.1692665320960655e+18,2019-09-04 15:10:39+00:00,['1169266532096065537'],"Given that anyone above the diagonal line is essentially a bottom half team, this isn't great for Derby. #dcfc https://t.co/1Jte1sId8S",given anyone diagonal line essentially bottom half team great derby,False
1.1692448974482227e+18,2019-09-04 13:44:41+00:00,['1169244897448222720'],Average male pay peaks at £662 a week at the age of 44; female pay peaks at £419 a week at the age of 31. Adapted from data in https://t.co/Uh31tFAiNm https://t.co/Z4avry0Y2S,average male pay peak week age female pay peak week age adapted data,False
1.1692364091584594e+18,2019-09-04 13:10:57+00:00,['1169236409158459392'],Data unit's @clairemilleruk and @alicecachia https://t.co/lhpGBgFhWp,data unit's,False
1.1692257330064015e+18,2019-09-04 12:28:32+00:00,['1169225733006401537'],@GedRobinson I asked my friend who drove to Middlesbrough to do a seminar only to find they were a day early and he said that’s fine,asked friend drove middlesbrough seminar find day early said thats fine,False
1.168903379126575e+18,2019-09-03 15:07:37+00:00,['1168903379126575105'],"Today is a good illustration of why being a president and being a prime minister are different things, and require different strategies.",today good illustration president prime minister different thing require different strategy,False
1.16889791958553e+18,2019-09-03 14:45:55+00:00,['1168897919585529858'],"But I do think people tend to overestimate how many seats are prima facie ""marginal"" when elections come round.

10/10",think people tend overestimate many seat prima facie marginal election come round,False
1.1688979176394383e+18,2019-09-03 14:45:55+00:00,['1168897917639438339'],"None of this suggests that a potential 2019 election wouldn't be dominated by Brexit, or that large majorities won't be overturned - particularly given how much has changed since 2017, when Brexit had receded as an issue in many people's post-referendum minds.

9/x",none suggests potential election dominated brexit large majority overturned particularly given much changed since brexit receded issue many people's postreferendum mind,False
1.1688979154247844e+18,2019-09-03 14:45:54+00:00,['1168897915424784387'],"What do those scatterplots look like as total? Well, in short: there aren't _that_ many seats which voted strongly to leave, and which can be classed as very marginal.

8/x https://t.co/jV3NGHnpz9",scatterplots look like total well short many seat voted strongly leave classed marginal,False
1.1688979072207995e+18,2019-09-03 14:45:52+00:00,['1168897907220799489'],"(For completeness, here are the Lib Dems and the SNP.)

7/x https://t.co/2VBvsUe70B",completeness lib dems snp,False
1.168897898496635e+18,2019-09-03 14:45:50+00:00,['1168897898496634880'],"...And now Labour.

6/x https://t.co/UtQYUBXYXA",labour,False
1.1688978804988887e+18,2019-09-03 14:45:46+00:00,['1168897880498888709'],"Here are the charts for each party. Firstly seats won by the Conservatives in 2017:

5/x https://t.co/21onB8OKAj",chart party firstly seat conservative,False
1.1688978694468608e+18,2019-09-03 14:45:43+00:00,['1168897869446860807'],"...While these would be ""weaker leave, fairly marginal""

4/x https://t.co/Y7zojOQK5X",would weaker leave fairly marginal,False
1.1688978581516165e+18,2019-09-03 14:45:41+00:00,['1168897858151616513'],"In that case, these are the seats which can be described as ""strong leave, very marginal""
3/x https://t.co/Ew5kyT2viX",case seat described strong leave marginal,False
1.1688978468647526e+18,2019-09-03 14:45:38+00:00,['1168897846864752646'],"So we start with this scatterplot and a couple of arbitrary definitions: 
Marginal = &lt;10,000 majority
Very marginal = &lt;5,000 majority
Strong leave = &gt;60% voted to leave
Weaker leave = 50% to 60% voted to leave
2/x",start scatterplot couple arbitrary definition marginal majority marginal majority strong leave voted leave weaker leave voted leave,False
1.1688978445033062e+18,2019-09-03 14:45:37+00:00,['1168897844503306243'],"Decided to take a quick look at how many seats held by each party are a) marginal and b) pro-Brexit. 

(A quick visual thread)

1/x https://t.co/Zoqzu3nuwv",decided take quick look many seat held party marginal probrexit quick visual thread,False
1.16887125708288e+18,2019-09-03 12:59:58+00:00,['1168871257082880000'],"(Among other things, this shows the importance of building and maintaining city parks and playgrounds: for many children from more deprived families, they are the _only_ place they regularly get out to with their parents.)  https://t.co/eLGTdZKrjE",among thing show importance building maintaining city park playground many child deprived family place regularly get parent,False
1.1688687293100646e+18,2019-09-03 12:49:56+00:00,['1168868729310064640'],"Children in higher social classes are far more likely to visit forests, beaches, parks, playgrounds and playing fields with their parents, or another adult in their household. https://t.co/7FMeTkkwkQ https://t.co/LbBKZt4mOr",child higher social class far likely visit forest beach park playground playing field parent another adult household,False
1.168846254677418e+18,2019-09-03 11:20:37+00:00,['1168846254677417987'],"How difficult is it to get into your preferred school? @clairemilleruk's ""Race for a Place"" gadget is another example of a really useful tool based on public data. https://t.co/ybOH1v3gij https://t.co/3JvwkqSj5J",difficult get preferred school race place gadget another example really useful tool based public data,False
1.1688340577546117e+18,2019-09-03 10:32:09+00:00,['1168834057754611713'],"You can find out what patients think of any surgery in England (the received sufficient responses in the Patient Survey) at any Reach site, e.g. here: https://t.co/h10B3v7IVa https://t.co/LpeH63jlUA",find patient think surgery england received sufficient response patient survey reach site,False
1.1688336101217116e+18,2019-09-03 10:30:23+00:00,['1168833610121711618'],"Great to see our annual ""best GP surgeries, according to patients"" doing so well across the Reach group. The GP Patient Survey is a terrific resource for journalists and patients alike; essentially we're just picking the bits we think readers think most important. https://t.co/ANAO4Vncsg",great see annual best surgery according patient well across reach group patient survey terrific resource journalist patient alike essentially we're picking bit think reader think important,False
1.1688223013805548e+18,2019-09-03 09:45:26+00:00,['1168822301380554753'],"As is usual, today's figures show suicide rates tend to be highest in relatively remote, often coastal parts of England and Wales. Data from https://t.co/uF3wtQPA70 https://t.co/PXVx4OhvqC",usual today's figure show suicide rate tend highest relatively remote often coastal part england wale data,False
1.1688098556851569e+18,2019-09-03 08:55:59+00:00,['1168809855685156864'],Figures out this morning show an increase in suicides among women and (particularly) men in 2018. ONS says the exact reasons are unknown by the overall pattern since the 1980s is still one of overall decline. https://t.co/xlNFZwi7PA https://t.co/hKEGIHJJXz,figure morning show increase suicide among woman particularly men ons say exact reason unknown overall pattern since still one overall decline,False
1.1685536422800507e+18,2019-09-02 15:57:53+00:00,['1168553642280050688'],"@p_j_chappell Yep, I think that's clearly the gamble, as far as Johnson is concerned. Sound entirely ready for No Deal Brexit; hoover up the No Deal Brexit votes from BP; and only afterwards face the fact a No Deal Brexit might actually be terrible for the country.",yep think that's clearly gamble far johnson concerned sound entirely ready deal brexit hoover deal brexit vote afterwards face fact deal brexit might actually terrible country,False
1.1685528838534144e+18,2019-09-02 15:54:52+00:00,['1168552883853414401'],"""It's a two-horse race.""
""It's a one-horse race.""
""We're still reasonably sure there are some horses, and they are racing.""",twohorse race onehorse race we're still reasonably sure horse racing,False
1.1685485674784072e+18,2019-09-02 15:37:43+00:00,['1168548567478407168'],"Polling in the three months before the 2015 and 2017 elections were called, versus the last three months of polling in 2019 https://t.co/ZmCFJ9lnMP",polling three month election called versus last three month polling,False
1.168520509618819e+18,2019-09-02 13:46:14+00:00,['1168520509618819073'],@JonnElledge PS this is useful https://t.co/SOK64UyDhH,useful,False
1.16852035984862e+18,2019-09-02 13:45:38+00:00,['1168520359848620033'],@JonnElledge Didn't Greece have two in 2012 and two in 2015? Might have dreamed that...,greece two two might dreamed,False
1.1685172144016837e+18,2019-09-02 13:33:08+00:00,['1168517214401683456'],This is also reflected in jobs: https://t.co/8IvMUbqfUU,also reflected job,False
1.1685168347374756e+18,2019-09-02 13:31:38+00:00,['1168516834737475587'],"This is such an important chart in understanding the UK economy. We are - &amp; will remain - a service economy which does some other stuff. The extent to which we do ""other stuff"" (high-tech manufacturing, say) may change, but it will remain ""other stuff"" https://t.co/U6afvKrhYN https://t.co/yYxLkvcb3A",important chart understanding economy amp remain service economy doe stuff extent stuff hightech manufacturing say may change remain stuff,False
1.168485858967728e+18,2019-09-02 11:28:32+00:00,['1168485858967728129'],Someone give me 500 words on why all those _other_ journalists writing about the dog are ensuring a no deal Brexit,someone give word journalist writing dog ensuring deal brexit,False
1.1684828003470336e+18,2019-09-02 11:16:23+00:00,['1168482800347033600'],Thank god I have twitter to tell me whether I should or should not be interested in the dog,thank god twitter tell whether interested dog,False
1.1684786616972657e+18,2019-09-02 10:59:56+00:00,['1168478661697265664'],"Respect to this county council's FOI department for their highly-exacting definition of ""approximate"" https://t.co/Z90Um6xHju",respect county council's foi department highlyexacting definition approximate,False
1.167482964986536e+18,2019-08-30 17:03:24+00:00,['1167482964986535937'],"@thomasforth @GarethDennis @stejormur Clearly indexing will show where we have been going, but yeah: if the question is where _should_ we be (relative to other countries), it's not going to help with that. Will be interested to read your thoughts on the blog.",clearly indexing show going yeah question relative country going help interested read thought blog,False
1.1674825765226127e+18,2019-08-30 17:01:51+00:00,['1167482576522612737'],"@thomasforth @GarethDennis @stejormur Even in absolute km terms though, France is a pretty high bar to set; it might just be that both France _and_ the UK have done well! https://t.co/mUrErBFEEM",even absolute term though france pretty high bar set might france done well,False
1.1674811707387617e+18,2019-08-30 16:56:16+00:00,['1167481170738761728'],"@thomasforth @GarethDennis @stejormur Ah. Well, there are things it helps show and things it might obscure, but I think if we're asking if privatisation has been a success then the comparison has to be with UK in the 1990s as well as e.g. France. (But I take the point.)",well thing help show thing might obscure think we're asking privatisation success comparison well france take point,False
1.167479007874605e+18,2019-08-30 16:47:40+00:00,['1167479007874605056'],"@thomasforth @GarethDennis @stejormur Hmm though, even from the data source you linked to I think in terms of sheer passenger km it _has_ done well. I just downloaded the data and indexed performance so 1998 (earliest available) = 100. I got this: https://t.co/kaUEZjiWV2",hmm though even data source linked think term sheer passenger done well downloaded data indexed performance earliest available got,False
1.1674633529578865e+18,2019-08-30 15:45:28+00:00,['1167463352957886464'],"@ChrisMusson Scottish crimes are definitely the best crimes. 

Horse Identification (Scotland) Regulations 2009 R5 - Failure to identify horse",scottish crime definitely best crime horse identification scotland regulation failure identify horse,False
1.1674632438556713e+18,2019-08-30 15:45:02+00:00,['1167463243855671297'],@martinaustwick Ha!,,True
1.1674631366617784e+18,2019-08-30 15:44:36+00:00,['1167463136661778432'],Horse Identification (Scotland) Regulations 2009 R5 - Failure to identify horse,horse identification scotland regulation failure identify horse,False
1.167462317677777e+18,2019-08-30 15:41:21+00:00,['1167462317677776896'],"@martinaustwick Yeah, I'd say so. I guess it's referring to pretty young children, since drawstrings aren't uncommon on hoodies these days...",yeah i'd say guess referring pretty young child since drawstring uncommon hoodies day,False
1.1674614525900431e+18,2019-08-30 15:37:55+00:00,['1167461452590043137'],Dentists Act 1984 S39(2) - Not registered as a dentist but using title implying you were a dentist,dentist act registered dentist using title implying dentist,False
1.1674601817746885e+18,2019-08-30 15:32:52+00:00,['1167460181774688256'],"I'm baffled by this one too. 

The Children's Clothing (Hood Cords) Regulations 1976 R3 - Supply/offer supply etc outer garment which was designed to be secured by means of cord drawn through material",i'm baffled one children's clothing hood cord regulation supplyoffer supply etc outer garment designed secured mean cord drawn material,False
1.167457025556697e+18,2019-08-30 15:20:19+00:00,['1167457025556697089'],"@ChrisMusson Never mind that. I've just learned that you have an offence of ""hamesucken"". https://t.co/h4H40RrJd2",never mind i've learned offence hamesucken,False
1.1674560574694154e+18,2019-08-30 15:16:29+00:00,['1167456057469415425'],"Did not know it was against the law to walk the wrong way up an escalator.

Transport Act 2000 S219 - Use an escalator except by standing or walking on it in the direction intended for travel",know law walk wrong way escalator transport act use escalator except standing walking direction intended travel,False
1.167448427824898e+18,2019-08-30 14:46:09+00:00,['1167448427824898055'],Trout (Scotland) Act 1933 S2(1)(a) - Purchase/sell/expose/consign for sale trout under 8 inches in length,trout scotland act purchasesellexposeconsign sale trout inch length,False
1.1674473457154703e+18,2019-08-30 14:41:51+00:00,['1167447345715470336'],"Data unit currently going through this list of statutory and common law offences. Our favourites so far:

-Drop article or animal from small unmanned aircraft
-Possess food containing scallops with intent to supply to others
-Conspiracy to utter

https://t.co/yNdYgsi5Fc",data unit currently going list statutory common law offence favourite far drop article animal small unmanned aircraft posse food containing scallop intent supply others conspiracy utter,False
1.167081368662225e+18,2019-08-29 14:27:36+00:00,['1167081368662224904'],"@shanwilkinson2 That's true, and maybe something I'd underestimated: it's useful (with the graph) to have all the different times at once, so to speak, so you can see the speed of change at a glance.",that's true maybe something i'd underestimated useful graph different time speak see speed change glance,False
1.1670811146048348e+18,2019-08-29 14:26:35+00:00,['1167081114604834816'],@shanwilkinson2 We're basically crowdsourcing an award-winning (if terrifying) data visualisation....,we're basically crowdsourcing awardwinning terrifying data visualisation,False
1.1670538144673546e+18,2019-08-29 12:38:06+00:00,['1167053814467354625'],@Patrick_E_Scott Oh no.,,True
1.167033187396141e+18,2019-08-29 11:16:08+00:00,['1167033187396141056'],"19 boys were called ""Thor"" in England and Wales in 2018.

Boys names that are now less popular than ""Thor"":

Gary (17)
Howard (17)
Derek (16)
Geoffrey (16)
Trevor (16)
Dale (15)
Lance (15)
Neil (15)
Roger (15)
Grant (14)
Kelvin (14) 

Check yours: https://t.co/cDEVM5231V https://t.co/W7T4gGxtWI",boy called thor england wale boy name popular thor gary howard derek geoffrey trevor dale lance neil roger grant kelvin check,False
1.1670291072695378e+18,2019-08-29 10:59:56+00:00,['1167029107269537792'],"@patkarney @TFitzgeraldMEN @helenpidd ""Patrick"" has been holding fairly steady in recent years. Sadly the mini-revival of ""David"" seems to have passed... https://t.co/tLZ1Gnfpsc",patrick holding fairly steady recent year sadly minirevival david seems passed,False
1.1670282218351903e+18,2019-08-29 10:56:25+00:00,['1167028221835190273'],"@pdgallagher Yes, exactly; the ""bar chart races"" were so popular partly because they are so easy to grasp, visually speaking.",yes exactly bar chart race popular partly easy grasp visually speaking,False
1.1670277746719826e+18,2019-08-29 10:54:38+00:00,['1167027774671982592'],"@TFitzgeraldMEN @helenpidd 22 Todds in 2018.

There's no easy way to put this but your name is about to be overtaken by Thor. 

https://t.co/cDEVM5231V https://t.co/Xbs4idhVig",todd there's easy way put name overtaken thor,False
1.1670265405944996e+18,2019-08-29 10:49:44+00:00,['1167026540594499584'],@michaelgoodier @dubasfisher Exactly. Standing in a room. After six months May's room is so crowded someone has to open a window!,exactly standing room six month may's room crowded someone open window,False
1.1670263052857057e+18,2019-08-29 10:48:48+00:00,['1167026305285705728'],"@umarhassan96 Animating the line is one solution but my general point is if we're animating, we don't need a _line_ at all. We represent time not as an x-axis, but as time (e.g. a one second delay = passing of one month). So we can do e.g. this (or something much better!) https://t.co/kmuMWE6zr0",animating line one solution general point we're animating need line represent time xaxis time one second delay passing one month something much better,False
1.1670258317278126e+18,2019-08-29 10:46:55+00:00,['1167025831727812609'],And that's our job.,that's job,False
1.167025769975079e+18,2019-08-29 10:46:40+00:00,['1167025769975078912'],"In general people shy away from this kind of presentation not just because it's a bit harder to do, but also there's a weird bias: IT'S TOO EASY TO UNDERSTAND! IT DOESN'T LOOK AS COMPLEX AND MATHS-Y AS A GRAPH!
...It's _exactly_ the same information, just accessible to all. #ddj",general people shy away kind presentation bit harder also there's weird bias easy understand look complex mathsy graph exactly information accessible,False
1.167024885681578e+18,2019-08-29 10:43:09+00:00,['1167024885681577984'],@dubasfisher @michaelgoodier https://t.co/GjmN4iz4H6,,
1.1670248589680517e+18,2019-08-29 10:43:03+00:00,['1167024858968051712'],@dubasfisher @michaelgoodier Basically this but instead of xs you could have something a bit more visually telling. Personally I'd want a small animated graphic of the _actual person who resigned_ walking over to an increasingly large pile beside the relevant PM's name.,basically instead could something bit visually telling personally i'd want small animated graphic actual person resigned walking increasingly large pile beside relevant pm's name,False
1.1670244905109873e+18,2019-08-29 10:41:35+00:00,['1167024490510987264'],"@dubasfisher @michaelgoodier Yeah but I think we could get away from line graphs completely here. Because we don't need the x axis. It's time, and we can represent time with... TIME!!!",yeah think could get away line graph completely need axis time represent time time,False
1.16702412142481e+18,2019-08-29 10:40:07+00:00,['1167024121424809984'],"@michaelgoodier Yeah, more like that, although potentially not a bar graph at all.",yeah like although potentially bar graph,False
1.1670238741832417e+18,2019-08-29 10:39:08+00:00,['1167023874183241734'],"ie something more like this, where the X's keep getting added to, as the red number ticks upwards. https://t.co/rCawQfpxUk",something like x's keep getting added red number tick upwards,False
1.1670232295522222e+18,2019-08-29 10:36:34+00:00,['1167023229552222208'],"*SKIP IF BORED BY MUSING ABOUT CHARTS*
This chart got me thinking. The x axis is time. Most media is now digital &amp; it's increasingly easy to publish animations. So: would readers find this easier/harder to decode as a animation with one axis, and time rendered _as time_? #ddj https://t.co/JYYqck0s1B",skip bored musing chart chart got thinking axis time medium digital amp increasingly easy publish animation would reader find easierharder decode animation one axis time rendered time,False
1.1670205411877765e+18,2019-08-29 10:25:53+00:00,['1167020541187776512'],@Effy_Yeomans (But yeah: prima facie it's _really_ baffling.),yeah prima facie really baffling,False
1.1670202551658004e+18,2019-08-29 10:24:45+00:00,['1167020255165800448'],"@Effy_Yeomans I've passed the story and analysis we've done to the MEN; will be interesting to see what the council say if the MEN decide to use the story, and approach them for comment. Many councils argue they already take large numbers of refugees and asylum seekers under other programmes.",i've passed story analysis we've done men interesting see council say men decide use story approach comment many council argue already take large number refugee asylum seeker programme,False
1.167019058367271e+18,2019-08-29 10:20:00+00:00,['1167019058367270912'],"It's also important to point out this is only one scheme - introduced in response to the Syrian crisis - by which refugees can enter the UK. Many councils already host large numbers of refugees from around the world under e.g. the government's preferred ""dispersal"" model.",also important point one scheme introduced response syrian crisis refugee enter many council already host large number refugee around world government's preferred dispersal model,False
1.1670184509691412e+18,2019-08-29 10:17:35+00:00,['1167018450969141248'],"The scheme is voluntary - councils don't have to participate at all. The aim of the VPRS was to resettle 20,000 refugees by the time the scheme closes in 2020. By March this year the achieved figure was 17,051.",scheme voluntary council participate aim vprs resettle refugee time scheme close march year achieved figure,False
1.1670180810314588e+18,2019-08-29 10:16:07+00:00,['1167018081031458816'],I've been doing some analysis on the number of refugees from the Syrian conflict resettled in the UK under the Vulnerable Persons Resettlement Scheme since 2014. It's fair to say some cities have embraced the scheme more enthusiastically than others. https://t.co/HXkVHBKXeI,i've analysis number refugee syrian conflict resettled vulnerable person resettlement scheme since fair say city embraced scheme enthusiastically others,False
