id,created_at,edit_history_tweet_ids,text,clean_text,non_english
1.5200176775862436e+18,2022-04-29 12:30:29+00:00,['1520017677586243584'],"These ""compositional"" reasons were a significant factor in average wage growth during the pandemic, but that is no longer the case. (In fact, in the most recent figures, compositional factors were a drag on average earnings.) More at https://t.co/ShotkXI2OO https://t.co/D1GxLSqeyt",compositional reason significant factor average wage growth pandemic longer case fact recent figure compositional factor drag average earnings,False
1.5200176737568522e+18,2022-04-29 12:30:28+00:00,['1520017673756852224'],"It's fairly simple to understand: if people at the lowest end of the earnings scale lose their jobs, but people at the top don't, the _average_ wage goes up despite no one being paid more than before. 2/3",fairly simple understand people lowest end earnings scale lose job people top average wage despite one paid,False
1.5200176717854843e+18,2022-04-29 12:30:28+00:00,['1520017671785484288'],"A big reason for the rise in _average_ wages during the pandemic lockdown was simply that there were fewer jobs around for those with low skills, and in traditionally low-skilled economic sectors 1/3 https://t.co/Vgv2E6369W",big reason rise average wage pandemic lockdown simply fewer job around low skill traditionally lowskilled economic sector,False
1.518928284255404e+18,2022-04-26 12:21:37+00:00,['1518928284255404032'],@JackShawLPC Ah good! It strikes me very much as one of those situations where abundant data which _should_ enable better decisions could end up leading to injustices/terrible policy if used in the wrong way. A clearer government definition of levelling up would have helped...,good strike much one situation abundant data enable better decision could end leading injusticesterrible policy used wrong way clearer government definition levelling would helped,False
1.518926422466777e+18,2022-04-26 12:14:14+00:00,['1518926422466777088'],@JackShawLPC (The other one that bothers me = distance to key services. Giving weight to this is essentially just saying rural areas need levelling up and urban ones don't. Here green=Scilly Isles. Does this show levelling up need and how on earth would you improve it anyway?) https://t.co/GN5G8a4MOG,one bother distance key service giving weight essentially saying rural area need levelling urban one greenscilly isle doe show levelling need earth would improve anyway,False
1.518925877437948e+18,2022-04-26 12:12:04+00:00,['1518925877437947910'],"@JackShawLPC ...or how they should be interpreted, or weighted against each other, or what constitutes a pattern such that a place should be a levelling up priority. https://t.co/pfseoEA7ys",interpreted weighted constitutes pattern place levelling priority,False
1.5189257032904417e+18,2022-04-26 12:11:22+00:00,['1518925703290441730'],"@JackShawLPC I'm also worried about other subjective metrics that are measured &amp; have been mentioned around levelling-up, e.g. self-reported happiness. Here Chichester=green, West Devon=yellow. Chichester is an urgent levelling-up priority? No real discussion of which are good/bad LU metrics https://t.co/meRlWBokH6",i'm also worried subjective metric measured amp mentioned around levellingup selfreported happiness chichestergreen west devonyellow chichester urgent levellingup priority real discussion goodbad metric,False
1.5188932941006602e+18,2022-04-26 10:02:35+00:00,['1518893294100660230'],VAT receipts also up as spending on goods and services surged. https://t.co/LmjcMLK8l5,vat receipt also spending good service surged,False
1.5188927935649956e+18,2022-04-26 10:00:36+00:00,['1518892793564995585'],"Payroll taxes (National Insurance, Income Tax) were a significant factor in the scale of the increase https://t.co/TL96E88tEP",payroll tax national insurance income tax significant factor scale increase,False
1.5188921072971407e+18,2022-04-26 09:57:52+00:00,['1518892107297140737'],"HMRC collected £718.2 billion in taxes in 2021-22, up 22.9% on a Covid-hit 2020. https://t.co/uGQjkXoTRr https://t.co/nrQOPYf6jt",hmrc collected billion tax covidhit,False
1.518520952417575e+18,2022-04-25 09:23:02+00:00,['1518520952417574913'],"Cost of living increases really beginning to bite - and particularly for those with the least. 34% of adults in most deprived areas finding it difficult to pay bills, up from 25% in just four months. https://t.co/QQrBjiZQB6 https://t.co/Ll71V5ameN",cost living increase really beginning bite particularly least adult deprived area finding difficult pay bill four month,False
1.5185199248382523e+18,2022-04-25 09:18:57+00:00,['1518519924838252545'],"In other words - if you live in one of the most deprived parts of the UK, you are likely to become unhealthy long before the statutory retirement age. https://t.co/sZivtt21i5",word live one deprived part likely become unhealthy long statutory retirement age,False
1.5185191363720684e+18,2022-04-25 09:15:49+00:00,['1518519136372068352'],"There is a near 20-year gap in the _healthy_ life you can expect, depending on whether you are very rich or very poor - new data out this morning https://t.co/BOOwUUwhTQ https://t.co/nMkfDbZXw9",near year gap healthy life expect depending whether rich poor new data morning,False
1.5167171594681836e+18,2022-04-20 09:55:24+00:00,['1516717159468183552'],"@timcrane102 @oliverburkeman ...When you zoom out, the Great Mitton label disappears but Great Britain remains until about this point. Very odd indeed! https://t.co/Cz1IDjRTYC",zoom great mitton label disappears great britain remains point odd indeed,False
1.516716619845845e+18,2022-04-20 09:53:16+00:00,['1516716619845844994'],@timcrane102 @oliverburkeman Hmm it seems when you zoom in you get a map with both. https://t.co/D7lpwADkfS,hmm seems zoom get map,False
1.5166998702744084e+18,2022-04-20 08:46:42+00:00,['1516699870274408456'],"...but on the other it depends entirely on what subject you are studying (and to some extent where you are studying). Full study here, well worth a read https://t.co/0WDhAKhPaU https://t.co/I57UmhkLcG",depends entirely subject studying extent studying full study well worth read,False
1.5166998665163612e+18,2022-04-20 08:46:41+00:00,['1516699866516361220'],New study into the value (in salary terms) of getting a better class of degree - on the one hand getting a first or 2.1 seems to make a big difference to your earnings... 1/2 https://t.co/KCXRbkHRlg,new study value salary term getting better class degree one hand getting first seems make big difference earnings,False
1.515026102015697e+18,2022-04-15 17:55:45+00:00,['1515026102015696906'],@Jgibbins Ah but was it SEQUENTIAL or did you look both ways at the same time?,sequential look way time,False
1.5146000020766228e+18,2022-04-14 13:42:35+00:00,['1514600002076622851'],"This is a remarkable finding - young people have a completely different conception of class, tied (I guess) much more closely to the £ you earn than the family you come from. https://t.co/DlQ3kzASql",remarkable finding young people completely different conception class tied guess much closely earn family come,False
1.51455757836535e+18,2022-04-14 10:54:00+00:00,['1514557578365349889'],"@henrylau_ONS +10 for being first
-10 for pdf https://t.co/2Hz2TTeMNG",first pdf,True
1.5145489915387003e+18,2022-04-14 10:19:53+00:00,['1514548991538700294'],(The new regional figures are here by the way and yep you guessed it) https://t.co/AghZhqsBSs https://t.co/vXLbgh3XwI,new regional figure way yep guessed,False
1.5145486770245632e+18,2022-04-14 10:18:38+00:00,['1514548677024563203'],"(By the by, we need far better ways of defining and measuring the value of what we'd want to call ""clean jobs"", ""clean growth"", etc, as the existing definitions are very narrow.)",need far better way defining measuring value we'd want call clean job clean growth etc existing definition narrow,False
1.5145486753804943e+18,2022-04-14 10:18:37+00:00,['1514548675380494346'],"First regional estimates of the value of the low-carbon and renewable energy energy have been released today, which gives me an excuse to repost the ONS's incredibly depressing summary of the national situation. https://t.co/KMPpyuTwmx",first regional estimate value lowcarbon renewable energy energy released today give excuse repost ons's incredibly depressing summary national situation,False
1.5145463426008433e+18,2022-04-14 10:09:21+00:00,['1514546342600843267'],@sanelynch The mid-blue line is for all _conceptions_ in 2020.,midblue line conception,False
1.5145454179371172e+18,2022-04-14 10:05:41+00:00,['1514545417937117191'],"(The same data shows the continuation of one of the big public/sexual health successes of the last 15 years, which probably still doesn't get talked about enough.) https://t.co/80qqHaGzk2",data show continuation one big publicsexual health success last year probably still get talked enough,False
1.5145448996008796e+18,2022-04-14 10:03:37+00:00,['1514544899600879620'],"There was however one interesting change: an increase in conception rates for 30-34 year olds and 35-39 year olds, which are notable upticks in the ONS graphs. https://t.co/XSDHNmDgEP",however one interesting change increase conception rate year old year old notable uptick ons graph,False
1.5145448955827446e+18,2022-04-14 10:03:36+00:00,['1514544895582744581'],"Okay so after all those think-pieces about how Covid lockdown was going to radically increase/radically decrease the number of babies, it turns out today it didn't have much overall effect. https://t.co/A1LhXHpMR8 https://t.co/UUDp3SqG0t",okay thinkpieces covid lockdown going radically increaseradically decrease number baby turn today much overall effect,False
1.5145427155596288e+18,2022-04-14 09:54:56+00:00,['1514542715559628805'],Major northern/midlands cities are generally a fair way behind. Problem with a sponsorship scheme is that most people don't live lifestyles where they not only have the capacity to help (large property) but are likely to already know lots of people from Ukraine who now need help. https://t.co/OfF0wSBRW0,major northernmidlands city generally fair way behind problem sponsorship scheme people live lifestyle capacity help large property likely already know lot people ukraine need help,False
1.5145423420316877e+18,2022-04-14 09:53:27+00:00,['1514542342031687680'],Followed by (affluent) London boroughs: 2/3 https://t.co/gnF2SpreoN,followed affluent london borough,False
1.514542338516861e+18,2022-04-14 09:53:26+00:00,['1514542338516860930'],"Data out this morning shows 17625 Homes for Ukraine visas issues in Eng by 12 April. Sco 1618, Wal 697, NI 199. Quick per-capita calculation shows highest rates in (affluent) southern areas:  1/3 https://t.co/lX09XSXSuw https://t.co/fZZ6SBhYFv",data morning show home ukraine visa issue eng april sco wal quick percapita calculation show highest rate affluent southern area,False
1.5142832705230356e+18,2022-04-13 16:44:00+00:00,['1514283270523035652'],"@cjayanetti Just seen it, and very hard to disagree.",seen hard disagree,True
1.514282431943168e+18,2022-04-13 16:40:40+00:00,['1514282431943168009'],@thomasforth Yeah just did a quick per-capita and this seems... not entirely the best distribution of funds: https://t.co/EE2KcWlus3,yeah quick percapita seems entirely best distribution fund,False
1.5142810459396956e+18,2022-04-13 16:35:09+00:00,['1514281045939695618'],"@Smyth_Chris Remarkable when you see it in the numbers like this, and can't disagree with DP.",remarkable see number like can't disagree,False
1.5142808290438062e+18,2022-04-13 16:34:18+00:00,['1514280829043806214'],@thomasforth I didn't realise it was essentially pattern-matching EU funding - ie that so much was going to Cornwall and West Wales.,realise essentially patternmatching funding much going cornwall west wale,False
1.5142802903232102e+18,2022-04-13 16:32:09+00:00,['1514280290323210244'],@civetta Yeah I'm just slightly surprised by the _scale_. But maybe I've not been paying attention.,yeah i'm slightly surprised scale maybe i've paying attention,False
1.51427886471288e+18,2022-04-13 16:26:29+00:00,['1514278864712880132'],It appears to be more than all the councils of Greater Manchester and Merseyside put together and nearly as much as all the boroughs of London. Is that right? Someone tell me what I've missed! [2/2] https://t.co/XF01dz0Htq,appears council greater manchester merseyside put together nearly much borough london right someone tell i've missed,False
1.513822949744255e+18,2022-04-12 10:14:51+00:00,['1513822949744254979'],"Anyway there is loads more, great job by the @ONS and very well worth a browse: https://t.co/Dx4zNcypvt",anyway load great job well worth browse,False
1.5138229480455578e+18,2022-04-12 10:14:50+00:00,['1513822948045557772'],"And the general population pyramids with a very obvious gap, particularly in urban, younger areas (e.g. this is London): https://t.co/hbeSaNS1jV",general population pyramid obvious gap particularly urban younger area london,False
1.5138229445264876e+18,2022-04-12 10:14:50+00:00,['1513822944526487564'],Percentage of children who had lost one (or both) parents in different areas: https://t.co/VjMlxb2PEc,percentage child lost one parent different area,False
1.513822940994982e+18,2022-04-12 10:14:49+00:00,['1513822940994981891'],"New digitised records from the 1921 Census showing impact of WW1 and ""Spanish"" Flu. Some of the visualisations are incredibly sobering, e,g. number of widows/widowers by age: [1/4] https://t.co/HbEyXQLcM7",new digitised record census showing impact spanish flu visualisation incredibly sobering number widowswidowers age,False
1.5120342440544625e+18,2022-04-07 11:47:10+00:00,['1512034244054462468'],"@michaelgoodier Just by the by, I am so proud to see you use the phrase 'a government source told me'...",proud see use phrase government source told me',False
1.509104665090302e+18,2022-03-30 09:46:04+00:00,['1509104665090301963'],"I've written about this in the context of Andy Burnham winning powers to regulate the GM bus network here - and pointed out the big increase in bus use in London came with an injection of money, and not because London was protected from deregulation. [9/9] https://t.co/8y2iQQVkjy",i've written context andy burnham winning power regulate bus network pointed big increase bus use london came injection money london protected deregulation,False
1.5091046636348785e+18,2022-03-30 09:46:04+00:00,['1509104663634878470'],"Anyway, for me, levelling up has to including providing (central) funding to promote economic development which aims to create more robust, flourishing local economies where local taxes _do_ make more sense. [8/9]",anyway levelling including providing central funding promote economic development aim create robust flourishing local economy local tax make sense,False
1.5091046623052513e+18,2022-03-30 09:46:03+00:00,['1509104662305251334'],Would Manchester hike its council tax by 70% to create parity with Barnet - and a major new revenue stream - if it had the power to do so? Of course not. People couldn't afford to pay. [7/9],would manchester hike council tax create parity barnet major new revenue stream power course people afford pay,False
1.509104660896002e+18,2022-03-30 09:46:03+00:00,['1509104660896002049'],"But council tax is based largely on property values, and most properties in Manchester are worth much less than most properties in Barnet. The average council tax paid per dwelling in Manchester will be £1,042
. In Barnet it will be £1,731. [6/9]",council tax based largely property value property manchester worth much property barnet average council tax paid per dwelling manchester barnet,False
1.5091046594615583e+18,2022-03-30 09:46:03+00:00,['1509104659461558272'],"Look at council tax bills for example. These are often quoted on a Band D basis. On that basis, Manchester's Band D council tax will be £1,873 for 2022/23. In Barnet - which pursued aggressive outsourcing to cut council tax bills - Band D bills will be £1,746. [5/9]",look council tax bill example often quoted band basis basis manchester's band council tax barnet pursued aggressive outsourcing cut council tax bill band bill,False
1.5091046579641467e+18,2022-03-30 09:46:02+00:00,['1509104657964146689'],"Take somewhere like Manchester - seen as something as a poster-child for economic growth. Yes, it's developing a health tax base in terms of city centre businesses. But that doesn't make it a rich city. [4/9]",take somewhere like manchester seen something posterchild economic growth yes developing health tax base term city centre business make rich city,False
1.5091046564793672e+18,2022-03-30 09:46:02+00:00,['1509104656479367170'],"""Fine, so let's have more local tax raising powers"". How much money is there to tax? If there's so much, why do places need to be ""levelled up"" in the first place? [3/9]",fine let's local tax raising power much money tax there's much place need levelled first place,False
1.5091046550701097e+18,2022-03-30 09:46:02+00:00,['1509104655070109696'],Having power to make and implement local strategy is important: but power without _money_ is likely only to scratch the surface of what needs to be done. [2/9],power make implement local strategy important power without money likely scratch surface need done,False
1.509104653581095e+18,2022-03-30 09:46:01+00:00,['1509104653581094914'],"Been thinking a lot recently about how ""local devolution"" is often accepted - on all political sides - as something of a panacea for regional inequality, a major lever to ""level up"", etc. A thread! [1/9]",thinking lot recently local devolution often accepted political side something panacea regional inequality major lever level etc thread,False
1.508406003909419e+18,2022-03-28 11:29:50+00:00,['1508406003909419013'],"Overall, ""the gap in avoidable mortality between the most and least deprived areas widened to its highest level since 2004 for males, and highest since the data began in 2001 for females"", says Chris White, head of health inequalities at the Office for National Statistics.",overall gap avoidable mortality least deprived area widened highest level since male highest since data began female say chris white head health inequality office national statistic,False
1.5084056349952696e+18,2022-03-28 11:28:22+00:00,['1508405634995269641'],"But avoidable deaths from alcohol and drugs also spiked in 2020 in the most deprived areas, exacerbating a recent trend. https://t.co/qhVu72Pzo5",avoidable death alcohol drug also spiked deprived area exacerbating recent trend,False
1.5084053714293391e+18,2022-03-28 11:27:20+00:00,['1508405371429339137'],Important data out today on how avoidable deaths are far more common in the most deprived areas. The data is for 2020 and Covid was a major contributory factor. https://t.co/eOd9tjmdq3 https://t.co/LG9sziKKDj,important data today avoidable death far common deprived area data covid major contributory factor,False
1.5066807066673644e+18,2022-03-23 17:14:07+00:00,['1506680706667364357'],"And it isn't just that (Greater) London is the only ""purely urban"" region: in Greater Manchester, for every person commuting by train/tram at the last Census (most comprehensive figures available), three commuted by bus and 17 by car. Will be better now, but not that much!",greater london purely urban region greater manchester every person commuting traintram last census comprehensive figure available three commuted bus car better much,False
1.5066792248658534e+18,2022-03-23 17:08:14+00:00,['1506679224865853451'],"This, but also: of those who _don't_ use the car, the vast majority use the bus. (In London more people commute by train or tube than bus.) 
https://t.co/QN92NFP6o7",also use car vast majority use bus london people commute train tube bus,False
1.505319829271634e+18,2022-03-19 23:06:29+00:00,['1505319829271633924'],@KieranMaguire @Inquis_chap @derbycountyblog (Although what are the terms of the security? If the club is liquidated what happens to the stadium etc?),although term security club liquidated happens stadium etc,False
1.5053194348477194e+18,2022-03-19 23:04:55+00:00,['1505319434847719436'],"@KieranMaguire @Inquis_chap @derbycountyblog In which case, if club is liquidated he ends up paying £25m (in kind) while also being blamed by Derby fans for liquidation. Rather than simply settling the debt now to facilitate a sale, and being hailed as a hero. Be interesting to see what he does when this goes to the wire.",case club liquidated end paying kind also blamed derby fan liquidation rather simply settling debt facilitate sale hailed hero interesting see doe wire,False
1.505311823599489e+18,2022-03-19 22:34:40+00:00,['1505311823599489025'],"@Inquis_chap @derbycountyblog @KieranMaguire 'Mel will gift stadium if buyer takes on £25m MSD debt' is just another way of saying Mel wants £25m for the stadium. If so, only a buyer who _doesn't_ buy the stadium is going to touch the important debts.",'mel gift stadium buyer take msd debt' another way saying mel want stadium buyer buy stadium going touch important debt,False
1.5037074399920824e+18,2022-03-15 12:19:25+00:00,['1503707439992082433'],"(And that's before talk about the need to integrate different modes with fast, cheap electronic ticketing.)",that's talk need integrate different mode fast cheap electronic ticketing,False
1.5037068800527196e+18,2022-03-15 12:17:12+00:00,['1503706880052719620'],"Basically: it's great that Greater Manchester now has effective power to franchise/regulate its buses, but it's going to need money, too, in order to build a system that works. [3/3]",basically great greater manchester effective power franchiseregulate bus going need money order build system work,False
1.503706875505881e+18,2022-03-15 12:17:11+00:00,['1503706875505881088'],"...Similarly, Nottingham (where the council owns the company that runs most buses, services are planned city-wide and there's a workplace parking levy generating £) has kept higher passenger levels during a difficult 2010s. [2/3] https://t.co/y8KLk42qFL",similarly nottingham council owns company run bus service planned citywide there's workplace parking levy generating kept higher passenger level difficult,False
1.503706869512249e+18,2022-03-15 12:17:09+00:00,['1503706869512249345'],"Couple more bus musings after the GM court decision. London's major ""bus boost"" came not with deregulation itself, but when subsidy started pouring in when the elected mayorship was created in 2000/01 [1/3] https://t.co/rPQVSWa1Eg",couple bus musing court decision london's major bus boost came deregulation subsidy started pouring elected mayorship created,False
1.5033951948420956e+18,2022-03-14 15:38:40+00:00,['1503395194842095627'],@_BvdM @NewStatesman Hurrah! Very well deserved.,hurrah well deserved,False
1.5033396444565094e+18,2022-03-14 11:57:56+00:00,['1503339644456509443'],And here's a simpler version of the above https://t.co/QBuzy9FBWe,here's simpler version,False
1.5033389652896072e+18,2022-03-14 11:55:14+00:00,['1503338965289607169'],"Obviously there are lots of factors at play here but I'm fairly sure deregulation of the buses everywhere _except_ London in 1986 wasn't a roaring success. (Flat fares and integrated ticketing in London - made possible by regulation - was a success, however.) https://t.co/vo8IDrPEUC",obviously lot factor play i'm fairly sure deregulation bus everywhere except london roaring success flat fare integrated ticketing london made possible regulation success however,False
1.502268725365461e+18,2022-03-11 13:02:29+00:00,['1502268725365460993'],"@CharlotteGRose Yep - I think that has been a great initiative, and I know some really excellent LDR reporters.",yep think great initiative know really excellent ldr reporter,False
1.50226367784781e+18,2022-03-11 12:42:26+00:00,['1502263677847810050'],@thomasforth Absolutely - or that it might be that doing the former might increase their ability to do the latter.,absolutely might former might increase ability latter,False
1.5022598700278948e+18,2022-03-11 12:27:18+00:00,['1502259870027894786'],"I don't have any easy solutions to any of this. I don't believe they exist. I do believe local news remains vital, that there are brilliant and highly-committed people working in the industry, and that there aren't obvious villains here.",easy solution believe exist believe local news remains vital brilliant highlycommitted people working industry obvious villain,False
1.502259868648022e+18,2022-03-11 12:27:17+00:00,['1502259868648022020'],"In a situation where a small number of people pay for subscription-based news services that cover a limited range of stories that matter to them and are perfectly happy, I worry about the other people: the majority who won't or can't pay. Where are they getting their news?",situation small number people pay subscriptionbased news service cover limited range story matter perfectly happy worry people majority can't pay getting news,False
1.5022598672009871e+18,2022-03-11 12:27:17+00:00,['1502259867200987136'],"True ""clickbait"" headlines - where the story doesn't deliver on the promise of the headline - are less common than you'd think, and organisations know they are counter-productive in the long term. Headlines which slightly oversell or under-inform are much more common.",true clickbait headline story deliver promise headline common think organisation know counterproductive long term headline slightly oversell underinform much common,False
