id,created_at,edit_history_tweet_ids,text,withheld,clean_text,nouns
1.3404381737516646e+18,2020-12-19 23:25:39+00:00,['1340438173751664642'],@Veronica_Strain Been at it now 15 years. System is wholly corrupted and terminal. Integrity has been sold for a handful of paper credits,, been at it now years system is wholly corrupted and terminal integrity has been sold for a handful of paper credits,year system integrity handful paper credit
1.340427004995367e+18,2020-12-19 22:41:16+00:00,['1340427004995366913'],@VinegarStrokes That'll be nickel reaction..... Dont worry #billgates vaccine should sort that out,, that'll be nickel reaction dont worry  vaccine should sort that out,reaction dont vaccine
1.3404264906772152e+18,2020-12-19 22:39:13+00:00,['1340426490677215235'],@mobiolab It's a fucking #portacabin Cashing in on covid 🤣🤣,, it's a fucking  cashing in on covid ,fucking covid
1.3404250802376786e+18,2020-12-19 22:33:37+00:00,['1340425080237678592'],@VinegarStrokes Stop nibbling of the edges,, stop nibbling of the edges,stop nibbling edge
1.340424698346287e+18,2020-12-19 22:32:06+00:00,['1340424698346287105'],How will we know the vaccine is working? Will the survival rate go from 99.7% to 99.8? #covid #vaccine #secondwave Maybe #billgates can answer?,,how will we know the vaccine is working will the survival rate go from to    maybe  can answer,vaccine survival rate
1.340413064974279e+18,2020-12-19 21:45:53+00:00,['1340413064974278658'],@russgreeno Yeah the amazing normalizing vaccine....... Youd have to be insane or forced at gun point to take it,, yeah the amazing normalizing vaccine youd have to be insane or forced at gun point to take it,normalizing vaccine youd insane point
1.3403717421293527e+18,2020-12-19 19:01:40+00:00,['1340371742129352712'],What's the chances of finding a new #superstrain of #covid just before #christmas #pantomime season for sure,,what's the chances of finding a new  of  just before   season for sure,chance season
1.3403630116352082e+18,2020-12-19 18:26:59+00:00,['1340363011635208194'],"@campbellclaret To be fair Alistair, you and #blair dug the foundations for corrupt government #iraqwar #wmd #DrKelly",, to be fair alistair you and  dug the foundations for corrupt government   ,alistair foundation government
1.3402107690325688e+18,2020-12-19 08:22:01+00:00,['1340210769032568833'],Just a sordid glimpse into British policing culture. Dont think for one second its confined to this pack of clowns https://t.co/3Ve2UyZReL,,just a sordid glimpse into british policing culture dont think for one second its confined to this pack of clowns ,glimpse culture dont think pack clown
1.339833929667375e+18,2020-12-18 07:24:36+00:00,['1339833929667375105'],Walkies for Coco and Peggy ❤ https://t.co/0gUv9zFgjt,,walkies for coco and peggy  ,walkies coco
1.33950455261841e+18,2020-12-17 09:35:46+00:00,['1339504552618409984'],"“I live for those who love me, for those who know me true; for the heaven that smiles above me and awaits my spirit too. For the cause that lacks assistance, for the wrong that needs resistance, for the future in the distance......and the good that I can do.” #GeorgeLinnaeus",,i live for those who love me for those who know me true for the heaven that smiles above me and awaits my spirit too for the cause that lacks assistance for the wrong that needs resistance for the future in the distanceand the good that i can do ,heaven awaits spirit cause assistance resistance future distanceand
1.339327489399722e+18,2020-12-16 21:52:11+00:00,['1339327489399721984'],@VinegarStrokes As ex aircraft engineer I'd agree bad idea having aircraft sit idle for extended periods. Tough they'll be cycling systems on ground during this time to lessen impact,, as ex aircraft engineer i'd agree bad idea having aircraft sit idle for extended periods tough they'll be cycling systems on ground during this time to lessen impact,aircraft engineer idea idle period system ground time impact
1.339318461248508e+18,2020-12-16 21:16:19+00:00,['1339318461248507906'],Has the Queen of England had her #CovidVaccination yet,,has the queen of england had her  yet,queen england
1.339188206089212e+18,2020-12-16 12:38:43+00:00,['1339188206089211904'],I suppose just an inkling into the vast suffering caused by police criminality being swept under the carpet. Cases like #Iantomlinson killed by thug in uniform #simonharper just one example https://t.co/cAEOUubNZm,,i suppose just an inkling into the vast suffering caused by police criminality being swept under the carpet cases like  killed by thug in uniform  just one example ,inkling suffering police criminality carpet case thug example
1.3391219009587077e+18,2020-12-16 08:15:15+00:00,['1339121900958707713'],"@RoryTingle1 are you doing any follow ups on the #iicsa inquiry into the Catholic Church. Just got some hard evidence they're still at it, putting reputation management up front and centre whilst covering up abuse. DM if interested",, are you doing any follow ups on the  inquiry into the catholic church just got some hard evidence they're still at it putting reputation management up front and centre whilst covering up abuse dm if interested,inquiry church evidence reputation management whilst
1.338844988487111e+18,2020-12-15 13:54:54+00:00,['1338844988487110656'],@russgreeno Pre covid times...... 🤣,, pre covid times ,covid time
1.3387967059160883e+18,2020-12-15 10:43:02+00:00,['1338796705916088322'],"Injustice and corruption is rife I've seen it all my adult life Time to stamp it on the head End corruption, put it to bed",,injustice and corruption is rife i've seen it all my adult life time to stamp it on the head end corruption put it to bed,injustice corruption adult life time corruption
1.3385906490257654e+18,2020-12-14 21:04:15+00:00,['1338590649025765378'],Banned from @Facebook for posting a Leonard Cohen album..... #censorship #facebookCensorship https://t.co/KHKLEV5S6C,,banned from  for posting a leonard cohen album   ,leonard cohen album
1.338382744607404e+18,2020-12-14 07:18:06+00:00,['1338382744607404032'],@MattWillGrant @Ed_Oldfield Surely the only party wasting public funds is the council and this #blm pandering pointless posturing?,,  surely the only party wasting public funds is the council and this  pandering pointless posturing,party fund council pandering pointless posturing
1.3381249070839153e+18,2020-12-13 14:13:33+00:00,['1338124907083915267'],@mism_2020 Why is retweet function disabled on this tweet by @mism_2020 https://t.co/91nO4a8ayO,, why is retweet function disabled on this tweet by  ,function tweet
1.3376535326028718e+18,2020-12-12 07:00:29+00:00,['1337653532602871809'],"In universal context we are a tiny spec in the blink of an eye, yet our existence cam be hugely illuminating. Time to find a different way",,in universal context we are a tiny spec in the blink of an eye yet our existence cam be hugely illuminating time to find a different way,context spec blink existence time
1.337426676058362e+18,2020-12-11 15:59:02+00:00,['1337426676058361856'],@MrCrazee They are not currently using same process as Plymouth council. Seems this is going to a full consultation. But yes if they try to use 1925 public health act then they cant,, they are not currently using same process as plymouth council seems this is going to a full consultation but yes if they try to use public health act then they cant,process plymouth council consultation health
1.3373431942085386e+18,2020-12-11 10:27:18+00:00,['1337343194208538624'],@yevaDmaS @MrCrazee Is this a more recent photo Sam? Quite a change from your current profile picture. https://t.co/8byErt6J5Y,,  is this a more recent photo sam quite a change from your current profile picture ,photo change picture
1.3373424009440993e+18,2020-12-11 10:24:09+00:00,['1337342400944099328'],@yevaDmaS @MrCrazee Oh how the hypocrisy pervades the politics of Labour Cllr's - happy to hold the sword of Drake whilst pulling down the name of Hawkins. https://t.co/2wZjkKOICo,,  oh how the hypocrisy pervades the politics of labour cllr's  happy to hold the sword of drake whilst pulling down the name of hawkins ,hypocrisy politics labour sword drake whilst name hawkins
1.3373413094016492e+18,2020-12-11 10:19:49+00:00,['1337341309401649153'],@yevaDmaS @MrCrazee How does that mean I'm detached from anything? I respect the choice of the electorate unlike you 🤣🤣,,  how does that mean i'm detached from anything i respect the choice of the electorate unlike you ,anything choice electorate
1.3373115556801454e+18,2020-12-11 08:21:35+00:00,['1337311555680145408'],@Starmist_ @yevaDmaS Younger voters might not know this but Britain simply didn’t have food before 1973. Past generations used to live off a diet of pebbles and muddy rainwater.,,  younger voters might not know this but britain simply didn’t have food before past generations used to live off a diet of pebbles and muddy rainwater,voter food generation diet pebble muddy rainwater
1.3370456104579277e+18,2020-12-10 14:44:49+00:00,['1337045610457927687'],@Starmist_ @yevaDmaS @MrCrazee Sam the saboteur is proud of his ill will to the electorate,,   sam the saboteur is proud of his ill will to the electorate,saboteur electorate
1.3370452593359544e+18,2020-12-10 14:43:25+00:00,['1337045259335954432'],@yevaDmaS @MrCrazee You're rational on brexit is like finding out you got on the wrong boat so you blow the hull to prevent it reaching the destination those more intelligent passengers desire. #Brexit does not mean anti europe,,  you're rational on brexit is like finding out you got on the wrong boat so you blow the hull to prevent it reaching the destination those more intelligent passengers desire  does not mean anti europe,rational brexit boat hull destination passenger europe
1.3370447383530988e+18,2020-12-10 14:41:21+00:00,['1337044738353098753'],@yevaDmaS @MrCrazee Detached from reality and the electorate - clearly you have no idea why over half the country voted to leave EU,,  detached from reality and the electorate  clearly you have no idea why over half the country voted to leave eu,reality electorate idea country
1.3370193706488545e+18,2020-12-10 13:00:33+00:00,['1337019370648854528'],@yevaDmaS @MrCrazee The question for this threatened high court action will be: 1. Was renaming Hawkins Square racist 2. Does supporting that decision make you a racist? In my humble opinion the answer to both questions is a resounding YES,,  the question for this threatened high court action will be was renaming hawkins square racist does supporting that decision make you a racist in my humble opinion the answer to both questions is a resounding yes,question court action hawkins racist decision racist opinion answer question
1.337018133241094e+18,2020-12-10 12:55:38+00:00,['1337018133241094148'],@yevaDmaS @MrCrazee Sam the kind of Cllr that seeks with all his heart to subvert democracy. Sam has a passion to see #Brexit fail What a twat https://t.co/CDv9DDz8mJ,,  sam the kind of cllr that seeks with all his heart to subvert democracy sam has a passion to see  fail what a twat ,kind cllr heart democracy passion twat
1.3370083378299658e+18,2020-12-10 12:16:42+00:00,['1337008337829965825'],@MrCrazee Credit where credit due,, credit where credit due,credit credit
1.3369919431261143e+18,2020-12-10 11:11:34+00:00,['1336991943126114305'],"Clowns to the tight, jokers to the left #coronaCon",,clowns to the tight jokers to the left ,clown joker left
1.3369917975292068e+18,2020-12-10 11:10:59+00:00,['1336991797529206784'],"""So, to be clear...There’s no ‘flu this year because you’ve been wearing masks and obeying the ‘rules’. YET... Coronavirus is increasing because you haven’t been wearing masks and obeying the ‘rules’. Clowns to the tight, jokers to the left",,so to be cleartheres no flu this year because you’ve been wearing masks and obeying the rules yet coronavirus is increasing because you haven’t been wearing masks and obeying the rules clowns to the tight jokers to the left,cleartheres year mask rule mask rule joker left
1.3369881391480873e+18,2020-12-10 10:56:27+00:00,['1336988139148087296'],"Greater Manchester police let 80,100 crimes go unrecorded in year Inspectors find force failing to put 1/4 violent crimes in the book and closing cases, including domestic abuse, with little inquiry https://t.co/b0sNS5EDV6",,greater manchester police let crimes go unrecorded in year inspectors find force failing to put violent crimes in the book and closing cases including domestic abuse with little inquiry ,manchester police crime year inspector force failing crime book closing case abuse inquiry
1.3369818353861345e+18,2020-12-10 10:31:24+00:00,['1336981835386134528'],@VivianoVoltaire Sadly high number just like this and accepted as ok by police organisation,, sadly high number just like this and accepted as ok by police organisation,number police organisation
1.3369791095037583e+18,2020-12-10 10:20:34+00:00,['1336979109503758338'],@JAngelthorn @YouTube Apparently being a no masker is enough for them to beat you into submission,,  apparently being a no masker is enough for them to beat you into submission,masker submission
1.3364122934379848e+18,2020-12-08 20:48:14+00:00,['1336412293437984772'],@Nigel_Farage Have you seen campaign by #DannyBamping to stop #Plymouth Council renaming #SirHawkins square after footballer? This one going all the way https://t.co/ktlAQKMBk0,, have you seen campaign by  to stop  council renaming  square after footballer this one going all the way ,campaign council square footballer
1.3363780326055076e+18,2020-12-08 18:32:06+00:00,['1336378032605507588'],What's your prediction for global financial meltdown? #December21st,,what's your prediction for global financial meltdown ,prediction meltdown
1.3362252268924518e+18,2020-12-08 08:24:54+00:00,['1336225226892451843'],@footydi199 thanks for follow Diane. The cover up in the murder of your boys is horrific - as you know Hillingdon police have form in criminality and coverup https://t.co/OV8SoTGL5c,, thanks for follow diane the cover up in the murder of your boys is horrific  as you know hillingdon police have form in criminality and coverup ,thanks diane cover murder police criminality coverup
1.3362182521507922e+18,2020-12-08 07:57:11+00:00,['1336218252150792193'],@asbLBL this new outstanding book on policing and public trust includes many important case studies including your story. A must read https://t.co/ZLLb7ON44Q,, this new outstanding book on policing and public trust includes many important case studies including your story a must read ,book policing trust case study story
1.3359893027198935e+18,2020-12-07 16:47:25+00:00,['1335989302719893507'],@Cornubian2 No vaccine no job - utterly dystopian future,, no vaccine no job  utterly dystopian future,vaccine future
1.3358654971670282e+18,2020-12-07 08:35:28+00:00,['1335865497167028224'],@mrchrisjohn @MailOnline Yes a strong signal that vile conduct like this acceptable in British policing,,  yes a strong signal that vile conduct like this acceptable in british policing,signal conduct policing
1.3358449793448796e+18,2020-12-07 07:13:56+00:00,['1335844979344879618'],Police officers who joked about raping crime victims spared the sack https://t.co/YOXirrFzjl via @MailOnline,,police officers who joked about raping crime victims spared the sack  via ,police officer crime victim sack
1.3349908107067433e+18,2020-12-04 22:39:46+00:00,['1334990810706743297'],#fakenews agenda laden https://t.co/c63EKi9U3c,, agenda laden ,agenda laden
1.3349552013133332e+18,2020-12-04 20:18:16+00:00,['1334955201313333248'],@JennyKumah is it normal that you repeatedly misreport this case? Mr Bamping has NOT been ordered to pay any costs at today's hearing. An immediate correction and apology would be welcome. https://t.co/Bie8xUEw5i,, is it normal that you repeatedly misreport this case mr bamping has not been ordered to pay any costs at today's hearing an immediate correction and apology would be welcome ,case bamping cost correction apology
1.3347484773986386e+18,2020-12-04 06:36:50+00:00,['1334748477398638592'],Man drinking coffee in Hyde Park violently arrested by HORDE of police s... https://t.co/3bxSHwbogf via @YouTube,,man drinking coffee in hyde park violently arrested by horde of police s  via ,coffee hyde park horde police
1.3300674324599194e+18,2020-11-21 08:36:02+00:00,['1330067432459919368'],@lulinspector William Tell,, william tell,william tell
1.3268694734422794e+18,2020-11-12 12:48:29+00:00,['1326869473442279425'],@survivorstrong3 Police professional standards Police watchdog British crown Prosecutor A trilogy of public institutional corruption - covering police criminality and perverting justice,, police professional standards police watchdog british crown prosecutor a trilogy of public institutional corruption  covering police criminality and perverting justice,police standard police crown prosecutor trilogy corruption police criminality perverting justice
1.3260877954594488e+18,2020-11-10 09:02:22+00:00,['1326087795459448842'],"Thinks #trump is dumb, then posts video of destroying votes and posts in public. @BirdsOf82640463 https://t.co/mhUyInPuk3",,thinks  is dumb then posts video of destroying votes and posts in public  ,think video vote post
1.324981186935087e+18,2020-11-07 07:45:06+00:00,['1324981186935087104'],@RaheemKassam Must be the mountain spring water 🤣,, must be the mountain spring water ,mountain spring water
1.3242541709380362e+18,2020-11-05 07:36:12+00:00,['1324254170938036225'],@DarknTwisty74 @realDonaldTrump The profanity of the left,,  the profanity of the left,profanity left
1.3238401499863818e+18,2020-11-04 04:11:02+00:00,['1323840149986381824'],@BasildonCoverUp interesting stats coming from Hertfordshire police confirming in last 5 years not one female prosecuted for domestic violence offence,, interesting stats coming from hertfordshire police confirming in last years not one female prosecuted for domestic violence offence,stats hertfordshire police year female violence offence
1.3238379671448123e+18,2020-11-04 04:02:21+00:00,['1323837967144812544'],@piersmorgan check out this wokeness from #plymouth the renaming of road in #BLM virtue signalling Luckily @MrCrazee has challenged and will win https://t.co/HivdMVWYZ9,, check out this wokeness from  the renaming of road in  virtue signalling luckily  has challenged and will win ,wokeness renaming road virtue
1.321524669548241e+18,2020-10-28 18:50:08+00:00,['1321524669548240897'],@MrCrazee @PlymouthChaz @NKelly_IFA @DarrenPlymouth @PlymouthDome Done deal for the doomed dome,,     done deal for the doomed dome,deal dome
1.3208324934409585e+18,2020-10-26 20:59:40+00:00,['1320832493440958465'],I will readily admit my life experience has taught me not to trust the government Am I wrong?,,i will readily admit my life experience has taught me not to trust the government am i wrong,life experience government
1.320687808286204e+18,2020-10-26 11:24:45+00:00,['1320687808286203904'],A passage from #untouchables circa 2004 It confirms the reality that there is no such thing as policing accountability. Be under no illusion that the police are the boot boys of the state and the state protects its thugs even in the face of total corruption. @metpoliceuk https://t.co/yRR5bFIWvZ,,a passage from  circa it confirms the reality that there is no such thing as policing accountability be under no illusion that the police are the boot boys of the state and the state protects its thugs even in the face of total corruption  ,passage circa reality thing accountability illusion police state state thug face corruption
1.3197501516453724e+18,2020-10-23 21:18:50+00:00,['1319750151645372416'],Albany Trust and #MIND relationship with Paedophile Information Exchange #PIE All funded by government and looking to remove the age of consent so that paedophiles wouldn't be criminalised #SaveOurChildren,,albany trust and  relationship with paedophile information exchange  all funded by government and looking to remove the age of consent so that paedophiles wouldn't be criminalised ,trust relationship information exchange government consent
1.3195629613845957e+18,2020-10-23 08:55:00+00:00,['1319562961384595456'],@BreesAnna great video Anna https://t.co/rbXoAephhl,, great video anna ,video anna
1.3193485288969462e+18,2020-10-22 18:42:56+00:00,['1319348528896946184'],@zingonathome Its staggering the levels they went to try cover their tracks. Including Met Commander emailing series of false allegations about me to put a politician off supporting my efforts. Caught them red handed - stupid and corrupt is a dangerous combination,, its staggering the levels they went to try cover their tracks including met commander emailing series of false allegations about me to put a politician off supporting my efforts caught them red handed  stupid and corrupt is a dangerous combination,level track commander series allegation politician effort corrupt combination
1.319346773140394e+18,2020-10-22 18:35:57+00:00,['1319346773140393984'],@zingonathome Met Kit Malthouse in street near Westminster - took his hand to shake then brought up police corruption. As usual he couldn't get away fast enough,, met kit malthouse in street near westminster  took his hand to shake then brought up police corruption as usual he couldn't get away fast enough,malthouse street westminster hand police corruption
1.319346104132055e+18,2020-10-22 18:33:18+00:00,['1319346104132055041'],"@zingonathome It was this case, police covering up paedophiles by trying to frame me and silence me. Start at Michael Doherty section https://t.co/6lCFCfBJZP",, it was this case police covering up paedophiles by trying to frame me and silence me start at michael doherty section ,case police paedophile doherty section
1.3193454618080092e+18,2020-10-22 18:30:45+00:00,['1319345461808009218'],@zingonathome Presided over serious corruption in met police and even funded their defence of indefensible criminal prosecution to tune of 70k,, presided over serious corruption in met police and even funded their defence of indefensible criminal prosecution to tune of,corruption police defence prosecution tune
1.3193451071251003e+18,2020-10-22 18:29:20+00:00,['1319345107125100545'],@sufc15 @StuartHydeQPM @ianpuddick I want commander grade now - 12 years dealing with them,,   i want commander grade now  years dealing with them,commander grade year
1.3184417374472315e+18,2020-10-20 06:39:40+00:00,['1318441737447231488'],"#youtube bans this video in UK Unlawful seizure of my child Detained her to enable a nefarious #socialService investigation Listen to her state shes 'just following orders' and lies through her teeth to claim that I was 'very angry"" https://t.co/fP3eBlGv7e",, bans this video in uk unlawful seizure of my child detained her to enable a nefarious  investigation listen to her state shes just following orders and lies through her teeth to claim that i was very angry ,video seizure child investigation listen state shes order teeth
1.3166331456729047e+18,2020-10-15 06:52:58+00:00,['1316633145672904704'],Police inundated with calls to arrest government 🤣 https://t.co/tnHasNDoE3,,police inundated with calls to arrest government  ,police call government
1.3158849215719014e+18,2020-10-13 05:19:47+00:00,['1315884921571901442'],@BirdsOf82640463 @BillClinton To be fair they're thick as thieves,,  to be fair they're thick as thieves,thick thief
1.314110339055866e+18,2020-10-08 07:48:14+00:00,['1314110339055865857'],@ianpuddick @churchofengland @MarkWatts_1 No different to every British institution like the @metpoliceuk whose corruption and abuse knows no bounds. Of course in their case the cover ups are administered by state body @IOPC_Help,,   no different to every british institution like the  whose corruption and abuse knows no bounds of course in their case the cover ups are administered by state body ,institution corruption abuse bound course case cover state body
1.3140987960166113e+18,2020-10-08 07:02:22+00:00,['1314098796016611329'],@louisetickle how MP john McDonnell call for independent inquiry fell on deaf ears of the Catholic Church https://t.co/h6viADt62d,, how mp john mcdonnell call for independent inquiry fell on deaf ears of the catholic church ,john mcdonnell call inquiry deaf church
1.3140984896688415e+18,2020-10-08 07:01:09+00:00,['1314098489668841472'],@louisetickle web of lies - the state cover up of child online grooming https://t.co/54PG98e2xy,, web of lies  the state cover up of child online grooming ,state grooming
1.3137604775378657e+18,2020-10-07 08:38:00+00:00,['1313760477537865729'],"@RT_com's account has been withheld in Portugal, Finland, Sweden, Ireland, Slovenia, Czech Republic, Poland, Slovakia, Hungary, Italy, Malta, Germany, Greece, Romania, Netherlands, Bulgaria, Austria, Luxembourg, Latvia, United Kingdom, Denmark, Lithuania, Croatia, Estonia, Cyprus, France, Spain, Belgium in response to a legal demand. Learn more.","{'copyright': False, 'country_codes': ['AT', 'BE', 'BG', 'CY', 'CZ', 'DE', 'DK', 'EE', 'ES', 'FI', 'FR', 'GB', 'GR', 'HR', 'HU', 'IE', 'IT', 'LT', 'LU', 'LV', 'MT', 'NL', 'PL', 'PT', 'RO', 'SE', 'SI', 'SK'], 'scope': 'user'}",s account has been withheld in portugal finland sweden ireland slovenia czech republic poland slovakia hungary italy malta germany greece romania netherlands bulgaria austria luxembourg latvia united kingdom denmark lithuania croatia estonia cyprus france spain belgium in response to a legal demand learn more,account finland sweden ireland slovenia czech poland slovakia italy malta germany greece romania austria kingdom denmark lithuania croatia cyprus france spain belgium response demand
