id,created_at,edit_history_tweet_ids,text,withheld,clean_text,nouns
1.2837270504282972e+18,2020-07-16 11:35:53+00:00,['1283727050428297217'],@BBCNews How the police watchdog @IOPC_Help covered up online #childabuse Complicit and corrupt in their web of lies https://t.co/d8RE4ZNppu,, how the police watchdog  covered up online  complicit and corrupt in their web of lies ,police complicit corrupt
1.2837266978425856e+18,2020-07-16 11:34:29+00:00,['1283726697842585602'],@BBCNews Is it any wonder childabuse is endemic in the UK? #Oldham #rotherham #JimnySavile #PrinceAndrew #BBC #BishopBall #EalingAbbey When i reported my child being groomed it led to a violent police raid on my home on false allegations to silence me. https://t.co/Lec8uTAkhD,, is it any wonder childabuse is endemic in the uk        when i reported my child being groomed it led to a violent police raid on my home on false allegations to silence me ,wonder childabuse child police raid home allegation
1.28372484697591e+18,2020-07-16 11:27:08+00:00,['1283724846975909891'],@Lumpnuggin I will never forget the crimes of the police. They will face justice,, i will never forget the crimes of the police they will face justice,crime police justice
1.2837168851550577e+18,2020-07-16 10:55:30+00:00,['1283716885155057665'],@IWFhotline @BBCLookEast Calls for a public inquiry into tue case have so far fallen on deaf ears https://t.co/Us5v95BnEQ,,  calls for a public inquiry into tue case have so far fallen on deaf ears ,inquiry case deaf
1.28371665803776e+18,2020-07-16 10:54:36+00:00,['1283716658037760003'],@IWFhotline @BBCLookEast Indeed not only did I face false allegations form police but the @IOPC_Help covered up the childabuse with lies as documentes https://t.co/M0qTwsEsKz,,  indeed not only did i face false allegations form police but the  covered up the childabuse with lies as documentes ,face allegation police childabuse documentes
1.2837128784204145e+18,2020-07-16 10:39:35+00:00,['1283712878420414464'],And this detailing police watchdog cover up of the child abuse https://t.co/SNs1njteeE,,and this detailing police watchdog cover up of the child abuse ,police watchdog child abuse
1.2837124345791488e+18,2020-07-16 10:37:49+00:00,['1283712434579148802'],Is it any wonder childabuse is endemic in the UK? #Oldham #rotherham #JimnySavile #PrinceAndrew #BBC #BishopBall #EalingAbbey My own experience following reporting my child being groomed led to a violent police raid on my home on false allegations to silence me https://t.co/Lec8uTAkhD,,is it any wonder childabuse is endemic in the uk        my own experience following reporting my child being groomed led to a violent police raid on my home on false allegations to silence me ,wonder childabuse experience child police raid home allegation
1.283498398633648e+18,2020-07-15 20:27:19+00:00,['1283498398633648141'],@globalrichard I'm.qualified to say so after my experience following reporting my child being groomed https://t.co/6lCFCfBJZP,, imqualified to say so after my experience following reporting my child being groomed ,experience child
1.2826074116149535e+18,2020-07-13 09:26:51+00:00,['1282607411614953482'],"@4S0cialJustice I know why, the system is incapable of delivering justice and holding their agents to account injustice is endemic",, i know why the system is incapable of delivering justice and holding their agents to account injustice is endemic,system justice agent injustice
1.2824242370143724e+18,2020-07-12 21:18:59+00:00,['1282424237014372352'],Andrew Mitchell letter to Met Commisioner asking the simple question: Was the deputy chair of the police watchdog #IOPC under criminal investigation by the @metpoliceuk whilst simultaneously investigating them for what was commonly known as #plebgate @gurpalsvirdi @ianpuddick https://t.co/pUYODIBFNf,,andrew mitchell letter to met commisioner asking the simple question was the deputy chair of the police watchdog  under criminal investigation by the  whilst simultaneously investigating them for what was commonly known as    ,letter commisioner question chair police investigation whilst
1.280638589370618e+18,2020-07-07 23:03:27+00:00,['1280638589370617862'],"@clairedethan Thanks for the very late reply, can the written evidence be accessed?",, thanks for the very late reply can the written evidence be accessed,thanks reply evidence
1.2806381456258294e+18,2020-07-07 23:01:41+00:00,['1280638145625829377'],@CommonsJustice My experience following reporting my child being groomed and wholesale police corruption required criminal prosecution. Once commenced the conduct of the CPS was nothing other than assisting the cover up of crininality https://t.co/xsihjua5mD,, my experience following reporting my child being groomed and wholesale police corruption required criminal prosecution once commenced the conduct of the cps was nothing other than assisting the cover up of crininality ,experience child police corruption prosecution conduct nothing cover crininality
1.280635621292327e+18,2020-07-07 22:51:39+00:00,['1280635621292326912'],"@clspjhw Interesting debate today, however really lacking in the key aspect of PP - the ability to hold state actors to account My experience is significant in this area https://t.co/lhbVkBxOSf",, interesting debate today however really lacking in the key aspect of pp  the ability to hold state actors to account my experience is significant in this area ,debate today aspect ability state actor experience area
1.280634490541441e+18,2020-07-07 22:47:10+00:00,['1280634490541441029'],"@clairedethan Interesting debate today, however really lacking in the key aspect of PP - the ability to hold state actors to account My experience is significant in this area. https://t.co/XP8670WyfJ",, interesting debate today however really lacking in the key aspect of pp  the ability to hold state actors to account my experience is significant in this area ,debate today aspect ability state actor experience area
1.2801019713751286e+18,2020-07-06 11:31:07+00:00,['1280101971375128577'],@MrCrazee On your bike bamping,, on your bike bamping,bike bamping
1.279920554628219e+18,2020-07-05 23:30:14+00:00,['1279920554628218882'],How father reported a paedophile and found himself being interrogated by the police @NickFerrariLBC this is a common theme in policing ihttps://youtu.be/siRpimbTzY0,,how father reported a paedophile and found himself being interrogated by the police  this is a common theme in policing i,paedophile police theme
1.2799197366425518e+18,2020-07-05 23:26:59+00:00,['1279919736642551810'],"How father reported a paedophile and found himself being interrogated by the police This is a common theme, british police protecting the child abusers...... ihttps://youtu.be/siRpimbTzY0",,how father reported a paedophile and found himself being interrogated by the police this is a common theme british police protecting the child abusers i,paedophile police theme police child abuser
1.2799056600004037e+18,2020-07-05 22:31:03+00:00,['1279905660000403457'],@M_Steeples @BotanistSW1 Brazen thief,,  brazen thief,brazen thief
1.2791525863613112e+18,2020-07-03 20:38:36+00:00,['1279152586361311232'],As our PM played a role in this he has a great opportunity to put things right. What say you @BorisJohnson agreeing to the #publicinquiry that @johnmcdonnellMP has called for?,,as our pm played a role in this he has a great opportunity to put things right what say you  agreeing to the  that  has called for,role opportunity thing
1.2791506214305587e+18,2020-07-03 20:30:48+00:00,['1279150621430558720'],"The story of how @metpoliceuk and @IOPC_Help covered up #childabuse and tried to silence me with false allegations It's how they roll, with impunity and no shame #weboflies https://t.co/5v4DVJiud6",,the story of how  and  covered up  and tried to silence me with false allegations it's how they roll with impunity and no shame  ,story allegation impunity shame
1.2784343875169403e+18,2020-07-01 21:04:44+00:00,['1278434387516940288'],Chief Coroner guidance 'could frustrate investigations' into frontline workers' deaths from Covid-19 https://t.co/3yf3QrbL7z via @simonisrael,,chief coroner guidance could frustrate investigations into frontline workers deaths from covid  via ,coroner guidance investigation worker death
1.2777065671781253e+18,2020-06-29 20:52:38+00:00,['1277706567178125314'],"@celebrityradio saw your video, same tactics used in my case. Here's part of the story https://t.co/6lCFCfBJZP",, saw your video same tactics used in my case here's part of the story ,tactic case part story
1.2775415306020127e+18,2020-06-29 09:56:51+00:00,['1277541530602012672'],@SocialistVoice @vvicario78 He who pays the piper calls the tune,,  he who pays the piper calls the tune,piper tune
1.2775387614721843e+18,2020-06-29 09:45:50+00:00,['1277538761472184321'],@BBC can you explain why you published a picture with this fear mongering article which was not taken in 2020 ? https://t.co/nKl4B6Fd9k,, can you explain why you published a picture with this fear mongering article which was not taken in  ,picture fear article
1.2757855740587336e+18,2020-06-24 13:39:18+00:00,['1275785574058733572'],@Nigel_Farage now you've left @LBC what's your view on this presenter saying 'Old White Male dont call my show' https://t.co/KCtFQvFFjI,, now you've left  what's your view on this presenter saying old white male dont call my show ,view presenter male dont show
1.2757604578492293e+18,2020-06-24 11:59:30+00:00,['1275760457849229313'],"@sarewaddington @MrCrazee Sarah what exactly is he being reported for? Whilst you may not agree with his view, as a reporter surely you still value #FreeSpeech ?",,  sarah what exactly is he being reported for whilst you may not agree with his view as a reporter surely you still value  ,whilst view reporter value
1.2757200022310543e+18,2020-06-24 09:18:44+00:00,['1275720002231054337'],In the garden today how cute ❤ https://t.co/qfkwtoGeb4,,in the garden today how cute  ,garden today
1.2757170199844495e+18,2020-06-24 09:06:53+00:00,['1275717019984449539'],This matter was raised in complaint to @LBC on 25/4/2020 - there has been complete silence from them. This is a clear racist statement by your presenter yet you do nothing https://t.co/ubidn4VV4F,,this matter was raised in complaint to  on  there has been complete silence from them this is a clear racist statement by your presenter yet you do nothing ,matter complaint silence racist statement presenter nothing
1.274465413674537e+18,2020-06-20 22:13:27+00:00,['1274465413674536962'],@eddygraham39 @onyxkendyl Maybe a nazi on hola,,  maybe a nazi on hola,nazi hola
1.2737270923379057e+18,2020-06-18 21:19:38+00:00,['1273727092337905667'],"@onyxkendyl I completely agree racism is wrong, needs to be stamped out where it impacts- i have not changed my view",, i completely agree racism is wrong needs to be stamped out where it impacts i have not changed my view,racism need view
1.2733544756343316e+18,2020-06-17 20:38:59+00:00,['1273354475634331648'],@pot_red @GHGrainger @mism_2020 @gurpalsvirdi As a police officer your understanding of the requirement to produce at roadside is patently wrong,,    as a police officer your understanding of the requirement to produce at roadside is patently wrong,officer understanding requirement roadside
1.2733541081629778e+18,2020-06-17 20:37:31+00:00,['1273354108162977797'],"@onyxkendyl I've known about BLM for years. Laudable aim to stop deaths in police custody, but why stop at one group #AllLivesMattter",, i've known about blm for years laudable aim to stop deaths in police custody but why stop at one group ,year death police custody stop group
1.2732149273193144e+18,2020-06-17 11:24:28+00:00,['1273214927319314434'],"@onyxkendyl And always will, but not under a banner that had different agendas",, and always will but not under a banner that had different agendas,banner agenda
1.273214737065685e+18,2020-06-17 11:23:43+00:00,['1273214737065684992'],"@pot_red @GHGrainger @mism_2020 @gurpalsvirdi I'll video the interaction if I do and share it up, you may learn something. Thought I think the precise set of circumstances is unlikely to present. That of being stopped for no offence",,    i'll video the interaction if i do and share it up you may learn something thought i think the precise set of circumstances is unlikely to present that of being stopped for no offence,video interaction share something circumstance offence
1.2731950682209812e+18,2020-06-17 10:05:33+00:00,['1273195068220981249'],@onyxkendyl You always have my total respect. What you have achieved against their utter corruption evil racism is unprecedented. No one should suffer as your family have endured. One case that illustrates what's wrong in UK,, you always have my total respect what you have achieved against their utter corruption evil racism is unprecedented no one should suffer as your family have endured one case that illustrates what's wrong in uk,respect corruption racism family case
1.2725422693049754e+18,2020-06-15 14:51:34+00:00,['1272542269304975367'],@MrCrazee @onyxkendyl @IOPC_Help Justice for those who have died in police custody is non existent - this justice void is what concerns me. I cannot apologise that for me ALL deaths matter irrespective of the victims ethnicity. Many suffering beyond the black community,,   justice for those who have died in police custody is non existent  this justice void is what concerns me i cannot apologise that for me all deaths matter irrespective of the victims ethnicity many suffering beyond the black community,justice police custody justice void apologise death irrespective victim community
1.2724234626662195e+18,2020-06-15 06:59:28+00:00,['1272423462666219520'],"@pot_red @GHGrainger @mism_2020 @gurpalsvirdi You're wrong, cannot be stopped for simply driving on the road",,    you're wrong cannot be stopped for simply driving on the road,cannot road
1.272256979596202e+18,2020-06-14 19:57:55+00:00,['1272256979596201984'],"@onyxkendyl @MrCrazee @IOPC_Help I'm terrified of my brain, will book appointment with psychiatrist and get reprogrammed first thing",,   i'm terrified of my brain will book appointment with psychiatrist and get reprogrammed first thing,brain book appointment psychiatrist thing
1.2722564669598597e+18,2020-06-14 19:55:53+00:00,['1272256466959859712'],@pot_red @mism_2020 @gurpalsvirdi In 35yrs of driving i have NEVER had to hand my licence over on request. Request being the operative word,,   in of driving i have never had to hand my licence over on request request being the operative word,hand licence request request word
1.2720787978153943e+18,2020-06-14 08:09:54+00:00,['1272078797815394304'],"@onyxkendyl @MrCrazee Firstly where have I mentioned anything in this tweet about protests? These are figures and raw data, source is BBC article taken from @IOPC_Help data",,  firstly where have i mentioned anything in this tweet about protests these are figures and raw data source is bbc article taken from  data,anything tweet protest figure data source article data
1.2720760082927862e+18,2020-06-14 07:58:49+00:00,['1272076008292786178'],"Asian @lbc says #OldWhiteMale dont call my show. What on earth does it have anything to do with the callers skin colour....... Imagine he said Old Black Male dont call my show, would his feet touch the floor on the way out? Racism anywhere is abhorent https://t.co/ubidn4VV4F",,asian  says  dont call my show what on earth does it have anything to do with the callers skin colour imagine he said old black male dont call my show would his feet touch the floor on the way out racism anywhere is abhorent ,dont call show earth anything caller imagine male dont show foot floor racism
1.2720750073641288e+18,2020-06-14 07:54:50+00:00,['1272075007364128768'],Still no reply from @LBC to my complaint,,still no reply from  to my complaint,reply complaint
1.271931732372185e+18,2020-06-13 22:25:31+00:00,['1271931732372185089'],"@GHGrainger @pot_red @mism_2020 @gurpalsvirdi They can 'ask' to see your licence - anyone can ask for anything, does not require you to satisfy their curiosity https://t.co/11eGSWGQRz",,    they can ask to see your licence  anyone can ask for anything does not require you to satisfy their curiosity ,licence anyone anything curiosity
1.2719305793831936e+18,2020-06-13 22:20:56+00:00,['1271930579383193603'],"@GHGrainger @pot_red @mism_2020 @gurpalsvirdi I'm interested too, because there is no requirement to produce driving licence on demand",,    i'm interested too because there is no requirement to produce driving licence on demand,requirement licence demand
1.2719301879875092e+18,2020-06-13 22:19:22+00:00,['1271930187987509250'],Joint enterprise arrests should follow https://t.co/QNVhWJdE7n,,joint enterprise arrests should follow ,enterprise arrest
1.2719008033396204e+18,2020-06-13 20:22:36+00:00,['1271900803339620357'],@MrCrazee @DailyMirror If the glove dont fit ya got to acquit,,  if the glove dont fit ya got to acquit,glove dont
1.271543901367808e+18,2020-06-12 20:44:24+00:00,['1271543901367808000'],@mism_2020 @gurpalsvirdi They have no right to demand a driving licence unless the driver is suspect or committed s driving offence. We're not nazi germany yet #papersplease,,  they have no right to demand a driving licence unless the driver is suspect or committed s driving offence we're not nazi germany yet ,right licence driver offence germany
1.271195755341103e+18,2020-06-11 21:41:00+00:00,['1271195755341103113'],@Nigel_Farage No excuse for abuse - from either public or police They will rightly be prosecuted,, no excuse for abuse  from either public or police they will rightly be prosecuted,excuse abuse police
1.2711951794338245e+18,2020-06-11 21:38:43+00:00,['1271195179433824258'],@BirdsOf82640463 @dbongino @realTrumpForce My God the sheer terror instilled in her from civil conservation! Imagine coming home late from the pub to that 🤣🤣🤣,,   my god the sheer terror instilled in her from civil conservation imagine coming home late from the pub to that ,sheer terror conservation imagine
1.27065758400188e+18,2020-06-10 10:02:30+00:00,['1270657584001880068'],@TheRealOJ32 Yes it'll change when murderers are put behind bars for life. All murderers....,, yes it'll change when murderers are put behind bars for life all murderers,change murderer life murderer
1.2696004264559002e+18,2020-06-07 12:01:44+00:00,['1269600426455900160'],@Gemini_Court @_20EffectChange @gurpalsvirdi @YvetteCooperMP @lizziedearden We abolished the IPCC - no real reform just an acronym change.,,     we abolished the ipcc  no real reform just an acronym change,ipcc reform change
1.2695997677446554e+18,2020-06-07 11:59:07+00:00,['1269599767744655360'],@gurpalsvirdi @YvetteCooperMP @lizziedearden Without an inquiry I can tell the answer is 'yes',,   without an inquiry i can tell the answer is yes,inquiry answer
1.269598998018564e+18,2020-06-07 11:56:03+00:00,['1269598998018564096'],"Cressida Dick said officers have 'made a number of arrests and justice will follow'; Isnt this the issue? The two speed system, instant justice for wronged cops and no justice when cops wrong... https://t.co/4aRiLRgp8S",,cressida dick said officers have made a number of arrests and justice will follow isnt this the issue the two speed system instant justice for wronged cops and no justice when cops wrong ,cressida dick officer number arrest justice isnt issue speed system justice justice
1.2684602661586862e+18,2020-06-04 08:31:08+00:00,['1268460266158686208'],@gurpalsvirdi Utter nonsense - unacceptable unaccountable and unequivocal corruption #Metpolice,, utter nonsense  unacceptable unaccountable and unequivocal corruption ,nonsense corruption
1.2684596585467412e+18,2020-06-04 08:28:44+00:00,['1268459658546741249'],@MaxChevkin @daraobriain @NatTenaLady The reality is very few 'white dudes' get killed by police. #ThomasOrchard was one in UK - no accountability no rioting for him,,   the reality is very few white dudes get killed by police  was one in uk  no accountability no rioting for him,reality dude police accountability
1.26787704778487e+18,2020-06-02 17:53:38+00:00,['1267877047784869888'],@realDonaldTrump Robert Nixon's words during vietnam.,, robert nixon's words during vietnam,robert word vietnam
1.2675613396749394e+18,2020-06-01 20:59:08+00:00,['1267561339674939392'],@GodnotDOG1 @gurpalsvirdi @RehmanKaiser @GoogleExpertUK @RandolphTrent @handy_oscar @TruthsayerOdet1 @EndRapeCampaign @MinoguePat @ashall_julie @PeteJacksonGMP @lisam2301 @AndyBurnhamGM @Whistleblowerat @MaggieOliverUK @Neil_Wilby @Open_Veritas @PendleburyRick @stopkn1fecrime @recusant_raja @Veronica_Strain @GrahamMani @HaighVictoria @EyeOldham @MCRGazette @PrivateEyeNews @Adam97049190 @SarahChampionMP @BreesAnna @Christian4BuryS @wedger_jon @Jes123tia456 @PriscieYan @endrapeoncampus @EndChildAbuse @afneil @MayorofGM @ManMetUni @DrUmeshPrabhu @beforethestars @pritipatel @MailOnline @ashleydITV I'm good and I pursue the wicked till they face justice,,                                           i'm good and i pursue the wicked till they face justice,wicked justice
1.267209324276986e+18,2020-05-31 21:40:21+00:00,['1267209324276985867'],@gurpalsvirdi @RehmanKaiser @GodnotDOG1 @GoogleExpertUK @RandolphTrent @handy_oscar @TruthsayerOdet1 @EndRapeCampaign @MinoguePat @ashall_julie @PeteJacksonGMP @lisam2301 @AndyBurnhamGM @Whistleblowerat @MaggieOliverUK @Neil_Wilby @Open_Veritas @PendleburyRick @stopkn1fecrime @recusant_raja @Veronica_Strain @GrahamMani @HaighVictoria @EyeOldham @MCRGazette @PrivateEyeNews @Adam97049190 @SarahChampionMP @BreesAnna @Christian4BuryS @wedger_jon @Jes123tia456 @PriscieYan @endrapeoncampus @EndChildAbuse @afneil @MayorofGM @ManMetUni @DrUmeshPrabhu @beforethestars @pritipatel @MailOnline @ashleydITV Yes in my case all started when I reported my 13yr old daughter targeted my paedophiles Read some of the story here https://t.co/6lCFCfBJZP,,                                           yes in my case all started when i reported my old daughter targeted my paedophiles read some of the story here ,case daughter paedophile story
1.2637697335282033e+18,2020-05-22 09:52:38+00:00,['1263769733528203266'],@MaggieOliverUK @MailOnline Sadly never a truer or more profound statement ever uttered #Manchester #rotherham #Oldham #Oxford #Hillingdon #JimmySaville #Rochdale #Kincora #NorthWales #Plymouth #Islington #Nottingham #Telford #Banbury #Bristol #Peterborough #Halifax #Medomsley #EalingAbbey And on and on. https://t.co/euPzl1BXtA,,  sadly never a truer or more profound statement ever uttered                    and on and on ,truer statement
1.263769287686267e+18,2020-05-22 09:50:52+00:00,['1263769287686266882'],@MaggieOliverUK @MailOnline Sadly never a truer or more profound statement ever uttered #Manchester #Rohterham #Oldham #Oxford #Hillingdon #JimmySaville #Rochdale #Kincora #NorthWales #Plymouth #Islington #Nottingham #Telford #Banbury #Bristol #Peterborough #Halifax #Medomsley #EalingAbbey And on and on.. https://t.co/zsVcMqX8jm,,  sadly never a truer or more profound statement ever uttered                    and on and on ,truer statement
1.2637331606947635e+18,2020-05-22 07:27:19+00:00,['1263733160694763521'],@MaggieOliverUK @MailOnline It's a pattern of behaviour by police to charge those reporting crimes of child grooming. This is what happened to me when I reported https://t.co/fR0kLYyVOw,,  it's a pattern of behaviour by police to charge those reporting crimes of child grooming this is what happened to me when i reported ,pattern behaviour police crime child
1.2633913078479176e+18,2020-05-21 08:48:55+00:00,['1263391307847917568'],@ianpuddick Very easy to sit on sideline and throw in criticism,, very easy to sit on sideline and throw in criticism,sideline throw criticism
1.2623033085109002e+18,2020-05-18 08:45:35+00:00,['1262303308510900230'],Life changing moments: 'Reporting the online grooming of my daughter' @metpoliceuk made false allegations tried desperately to silence me.... The question remains - who exactly were they trying to.protect ? https://t.co/o5P39GYYTx,,life changing moments reporting the online grooming of my daughter  made false allegations tried desperately to silence me the question remains  who exactly were they trying toprotect  ,life moment grooming daughter allegation question
1.2619381450855877e+18,2020-05-17 08:34:34+00:00,['1261938145085587457'],@j_chapman2 @flamencobug @joshual951 @DaveHodgson00 @botany_beck @BSBIbotany Probably Covid contamination - everything else getting blamed on it,,      probably covid contamination  everything else getting blamed on it,contamination everything
1.261937759897477e+18,2020-05-17 08:33:02+00:00,['1261937759897477121'],@football_mumble Great sport for lockdown fun in the living room 🤣,, great sport for lockdown fun in the living room ,sport living room
1.2619371149854966e+18,2020-05-17 08:30:28+00:00,['1261937114985496577'],@Robertgaskelly1 The sort of dickhead who uses profanity in reply and reads something into post that's not there. Go back to sleep enjoy the tyranny when the boot stomps in your face,, the sort of dickhead who uses profanity in reply and reads something into post that's not there go back to sleep enjoy the tyranny when the boot stomps in your face,sort dickhead profanity reply something post tyranny boot stomp face
1.261771056299344e+18,2020-05-16 21:30:37+00:00,['1261771056299343872'],Do as we say not as we do... Police Chief caught breaching lockdown rules... https://t.co/TC9YwYmwC7,,do as we say not as we do police chief caught breaching lockdown rules ,caught rule
1.2617702426840433e+18,2020-05-16 21:27:23+00:00,['1261770242684043265'],Irony alert... Police out enforcing #lockdown rules they dont follow.... Today's hyde park #antilockdown protest #Covid_19 https://t.co/j3aCXCHWq2,,irony alert police out enforcing  rules they dont follow today's hyde park  protest  ,irony police rule hyde park protest
