id,created_at,edit_history_tweet_ids,text,clean_text,non_english,nouns
1.5406404451342991e+18,2022-06-25 10:18:00+00:00,['1540640445134299136'],"Someone pass @Kimmygee8 her 👑 

What she told me earlier in the week for my @fox_netball preliminary preview.

#VIXvGIA https://t.co/UueHMYICQo",someone pas told earlier week preliminary preview,False,someone pas week preview 
1.540638373781459e+18,2022-06-25 10:09:46+00:00,['1540638373781458945'],"@blueshellme You know what position she plays, right? 😉",know position play right,False,position play right 
1.5406366000564838e+18,2022-06-25 10:02:43+00:00,['1540636600056483840'],Sophie Dwyer take a bow. Absolutely went missing in first but standing up now. #VIXvGIA,sophie dwyer take bow absolutely went missing first standing,False,bow 
1.5406325166875812e+18,2022-06-25 09:46:30+00:00,['1540632516687581185'],"That's the design. It's always been about rewarding one skill over all others. Every other speciality oncourt matters less. That's why it's roundly despised, because netball is proudly, passionately, a true team sport, where everyone matters. https://t.co/BBK9p66wDX",that's design always rewarding one skill others every speciality oncourt matter that's roundly despised netball proudly passionately true team sport everyone matter,False,design skill speciality matter team sport everyone matter 
1.5406281439033467e+18,2022-06-25 09:29:07+00:00,['1540628143903346695'],The sooner we get timing tech in Super Netball the better. Honestly. #VIXvGIA,sooner get timing tech super netball better honestly,False,sooner super netball 
1.5406270824634204e+18,2022-06-25 09:24:54+00:00,['1540627082463420416'],"She's a WD, the stats system is designed to leave her unrewarded. #VIXvGIA",stats system designed leave unrewarded,False,system 
1.5406266868399063e+18,2022-06-25 09:23:20+00:00,['1540626686839906304'],"I chatted to Kim Green about the Giants ""rigid seven"", as she's been saying all year it would be great to see more variety in the line-up, and she said it doesn't matter ... until it does. Dwyer has to find something here. Lots of netball left. #VIXvGIA",chatted kim green giant rigid seven saying year would great see variety lineup said matter doe dwyer find something lot netball left,False,kim year variety lineup matter doe dwyer something lot 
1.540624573955072e+18,2022-06-25 09:14:56+00:00,['1540624573955072000'],Brandley will get bored of bumping before Samason will care. #VIXvGIA,brandley get bored bumping samason care,False,brandley get samason care 
1.540624454031577e+18,2022-06-25 09:14:27+00:00,['1540624454031577088'],"When you're not at the game, you have one job. https://t.co/qNBOXAVByZ",game one job,False,game job 
1.5404750567860677e+18,2022-06-24 23:20:48+00:00,['1540475056786067456'],"I'm going to avoid Twitter for foreseeable future given I need to be function &amp; not be overwhelmed with rage &amp; sadness for my US sisters, but this piece is worth breaking that to share. Thanks @battledinosaur Women's voices matter. Women's lives matter. Women's choices matter. https://t.co/vSSbAZUDJV",i'm going avoid twitter foreseeable future given need function amp overwhelmed rage amp sadness sister piece worth breaking share thanks women's voice matter women's life matter women's choice matter,False,i avoid twitter future function amp rage amp sadness sister piece worth share voice matter life matter choice matter 
1.540344285383381e+18,2022-06-24 14:41:10+00:00,['1540344285383380994'],Under his eye. https://t.co/QSWxjetWAp,eye,True,eye 
1.5402314974030807e+18,2022-06-24 07:12:59+00:00,['1540231497403080709'],@aaron_s_fox @Torin It's certainly worth an examination given @joannamweston herself mentioned it on Insta today. #tacklingthebigissues,certainly worth examination given mentioned insta today,False,examination today 
1.540225009343275e+18,2022-06-24 06:47:12+00:00,['1540225009343275010'],The Plumm! https://t.co/KuspviM1DC,plumm,False,plumm 
1.5400952914785772e+18,2022-06-23 22:11:45+00:00,['1540095291478577154'],INBOX: England defender Eboni Usoro-Brown is returning home to the UK after season with the Queensland Firebirds.,inbox england defender eboni usorobrown returning home season queensland firebird,False,inbox england defender home season queensland firebird 
1.5399324000749115e+18,2022-06-23 11:24:29+00:00,['1539932400074911746'],@bek_35 @georgiadoyle258 @aaron_s_fox I love the slow burn of this ... @MelbourneVixens marketing gurus did well.,love slow burn marketing guru well,False,burn marketing guru 
1.5399157014098289e+18,2022-06-23 10:18:08+00:00,['1539915701409828864'],"@aaron_s_fox @FiCrowey @Kimmygee8 @DanRyan84 @natmedhurst @CathCoxy @madibrowne__ @SharniNorder I'm glad we understand each other, Aaron.",i'm glad understand aaron,False,i understand aaron 
1.5399155384652964e+18,2022-06-23 10:17:29+00:00,['1539915538465296386'],"@FiCrowey @Kimmygee8 @DanRyan84 @natmedhurst @CathCoxy @madibrowne__ @SharniNorder @aaron_s_fox WA, w no snark intended. If you have a defence end that can turn over ball, a WA-less frontline can retain it, even w a 2-on-1.",snark intended defence end turn ball wales frontline retain even,False,snark end 
1.5398614883532964e+18,2022-06-23 06:42:42+00:00,['1539861488353296384'],"@beneltham ""I've got my scarf, got my old coat ... """,i've got scarf got old coat,False,i coat 
1.5398517287989207e+18,2022-06-23 06:03:55+00:00,['1539851728798920704'],@northcoasteels @RenInOz I'd just got off a plane from Europe and watched that in a Fitzroy pub... I was so excited ...,i'd got plane europe watched fitzroy pub excited,False,i europe pub 
1.539849020562375e+18,2022-06-23 05:53:10+00:00,['1539849020562374658'],@northcoasteels @RenInOz Guess which one in the 2000s I went to?,guess one went,False,guess 
1.5398376279896392e+18,2022-06-23 05:07:53+00:00,['1539837627989639168'],@RenInOz I was at 92 too. I treat it like a beheading video. What good will come of me watching it?,treat like beheading video good come watching,False,treat come watching 
1.5398147917575987e+18,2022-06-23 03:37:09+00:00,['1539814791757598721'],KIERA AUSTIN TO MISS PRELIM. Outs don't come much bigger than this ahead of the @SuperNetball prelim final between @MelbourneVixens and @GIANTS_Netball at John Cain Arena on Saturday night. Covid strikes again. #SSNVixensGiants #VIXvGIA https://t.co/Kvf6PBwbbf,kiera austin miss prelim come much bigger ahead prelim final john cain arena saturday night covid strike,False,kiera austin prelim john cain arena saturday night covid strike 
1.5397866917704786e+18,2022-06-23 01:45:29+00:00,['1539786691770478592'],Still haven't watched the second half of this game. Mum took us kids for a *big* walk at half-time and we got home just in time to see Dad wiping the VHS of the recording. https://t.co/HBnn4mj97J,still watched second half game mum took kid big walk halftime got home time see dad wiping vhs recording,False,half game kid walk halftime time vhs 
1.5397752144854057e+18,2022-06-23 00:59:53+00:00,['1539775214485405698'],"Good to see common sense come to the fore. Put them in a cot, don't waste money on stupid devices. Not rocket science. https://t.co/SL6XrZOfCq",good see common sense come fore put cot waste money stupid device rocket science,False,see sense waste money device rocket science 
1.5397530983062733e+18,2022-06-22 23:32:00+00:00,['1539753098306273280'],"@englandnetballs @ANZPremiership I don't have any informed insights obviously, but as a rule, demographics are the driver for social media/marketing teams with (I assumed) limited resources.",informed insight obviously rule demographic driver social mediamarketing team assumed limited resource,False,insight driver mediamarketing team resource 
1.539746458412675e+18,2022-06-22 23:05:37+00:00,['1539746458412675072'],"INBOX: Jane Watson, who gave birth to daughter Tia last month, will be back with @ANZPremiership side Tactix in 2023.",inbox jane watson gave birth daughter tia last month back side tactix,False,inbox jane watson daughter tia month side tactix 
1.5397448683096842e+18,2022-06-22 22:59:18+00:00,['1539744868309684224'],"Sorry teachers, but ... https://t.co/8SQRBJpwQ6",sorry teacher,False,sorry teacher 
1.5397438910623908e+18,2022-06-22 22:55:25+00:00,['1539743891062390784'],"@MrTimCallanan I didn't want to share the details of the survey, but ...",want share detail survey,False,share detail survey 
1.539743425444352e+18,2022-06-22 22:53:34+00:00,['1539743425444352002'],"@MrTimCallanan This tweet reveals you ... 

... as awesome!",tweet reveals awesome,False,tweet 
1.5395430193636516e+18,2022-06-22 09:37:13+00:00,['1539543019363651584'],@AnnieSargeant @MeganHustwaite @SharelleMcMahon @laurenej15 How special!,special,False,
1.53944155432226e+18,2022-06-22 02:54:02+00:00,['1539441554322259968'],@flippy_me @MeganHustwaite STOP,stop,True,stop 
1.5393899081416049e+18,2022-06-21 23:28:49+00:00,['1539389908141604864'],"@MeganHustwaite Here's the story, sorry! https://t.co/Hk3f0HSngA",here's story sorry,False,story sorry 
1.5393885969854054e+18,2022-06-21 23:23:36+00:00,['1539388596985405440'],@pidgeo Dang close. I sat in awe. The way she *kept* the foot on the throat too ...,dang close sat awe way kept foot throat,False,dang way foot throat 
1.5393873390884618e+18,2022-06-21 23:18:36+00:00,['1539387339088461825'],@LukeDennehy @MeganHustwaite Excuse me Luke ... You don't get to reply without naming a netballer you want to see back in the court! ;),excuse luke get reply without naming netballer want see back court,False,excuse reply netballer court 
1.539386642678829e+18,2022-06-21 23:15:50+00:00,['1539386642678829056'],"@pidgeo I was in the media box, hoping my copy was OK.",medium box hoping copy,False,medium box copy 
1.539386240851911e+18,2022-06-21 23:14:14+00:00,['1539386240851910656'],"My friend and freelance sister @MeganHustwaite has broken the biggest story in sport today -- that 41yo Lauren Jackson is BACK (baby!) for the Opals ahead of the World Cup later this year -- and I wonder, what would be netball's equivalent? Laura Geitz sprang to my mind. Go!",friend freelance sister broken biggest story sport today lauren jackson back baby opal ahead world cup later year wonder would netball's equivalent laura geitz sprang mind,False,friend freelance sister story sport today jackson baby world cup year wonder laura geitz sprang mind 
1.5393852310224896e+18,2022-06-21 23:10:14+00:00,['1539385231022489600'],@OnMyWhistle_18 @ANZPremiership Nail. Head.,nail head,False,head 
1.539385089255088e+18,2022-06-21 23:09:40+00:00,['1539385089255088130'],"@OnMyWhistle_18 Endless ifs for sure, but 2018 and 2019 *could* have been very different.

Re Geitz ... You and me both, you and me both. 😔",endless ifs sure could different geitz,False,sure 
1.5393838335139553e+18,2022-06-21 23:04:40+00:00,['1539383833513955328'],@pidgeo More guns than an army. https://t.co/yvbBllw3aU,gun army,False,gun army 
1.539383094679339e+18,2022-06-21 23:01:44+00:00,['1539383094679339008'],INBOX: England international Laura Malcolm has signed with @ANZPremiership side the Tactix for 2023 season.,inbox england international laura malcolm signed side tactix season,False,inbox laura malcolm side tactix season 
1.5393784247999652e+18,2022-06-21 22:43:11+00:00,['1539378424799965184'],"@OnMyWhistle_18 As a general principle, I understand that, but there has been a unique set of circumstances since 2015 and now w Diamonds. We've 'brought on' players sooner than historically so (for a range of reasons) and results have suffered as a result.",general principle understand unique set circumstance since diamond we've 'brought on' player sooner historically range reason result suffered result,False,principle understand unique circumstance diamond player reason result result 
1.5393616342624748e+18,2022-06-21 21:36:28+00:00,['1539361634262474752'],@rgell1 How the team has been managed was more my point.,team managed point,False,team point 
1.5392192152776212e+18,2022-06-21 12:10:32+00:00,['1539219215277621248'],"@dcoppel @SuperNetball @GIANTS_Netball @MelbourneVixens If not best, dang close.",best dang close,False,dang close 
1.5391270422893036e+18,2022-06-21 06:04:17+00:00,['1539127042289303552'],""" ... and Der Spiegel in Germany collaborated with WikiLeaks in the name of public interest journalism, to expose what governments were doing on behalf of their citizens. None of these media outlets, their publishers or editors, are being pursued; Assange alone is."" 3/3",der spiegel germany collaborated wikileaks name public interest journalism expose government behalf citizen none medium outlet publisher editor pursued assange alone,False,der germany interest journalism government behalf none medium outlet publisher editor assange 
1.539127039986643e+18,2022-06-21 06:04:16+00:00,['1539127039986642944'],"""It’s important to note outlets around the world worked with WikiLeaks to publish the same material for which he is being punished. In Nov 2010, Australia’s Sydney Morning Herald &amp; The Age, The Guardian in UK, The New York Times in US, El Pais in Spain, Le Monde in France ... 2/3",important note outlet around world worked wikileaks publish material punished nov australia sydney morning herald amp age guardian new york time pais spain monde france,False,note outlet world material sydney morning herald amp age york time spain monde france 
1.5391270376294646e+18,2022-06-21 06:04:16+00:00,['1539127037629464576'],"Federal president of @withMEAA's media section @PercyKaren has written to PM Albanese &amp; Foreign Minister Wong urging them to press the US to drop espionage charges against WikiLeaks publisher Julian Assange. ""The decision to uphold extradition imperils journalism everywhere."" 1/2",federal president medium section written albanese amp foreign minister wong urging press drop espionage charge wikileaks publisher julian assange decision uphold extradition imperils journalism everywhere,False,president medium section minister press drop espionage charge publisher assange decision extradition journalism 
1.539111810967941e+18,2022-06-21 05:03:45+00:00,['1539111810967941121'],"@jessjoynetball @BLT_86 Gotcha, was just quick reaction sorry.",gotcha quick reaction sorry,False,gotcha reaction sorry 
1.5391101982035476e+18,2022-06-21 04:57:21+00:00,['1539110198203547649'],"@BLT_86 I beg YOUR pardon, you're not expecting context and nuance on Twitter? Boy are you in the wrong place. ;) Def more to it.",beg pardon expecting context nuance twitter boy wrong place def,False,beg pardon nuance twitter boy place def 
1.5391002610543206e+18,2022-06-21 04:17:51+00:00,['1539100261054320640'],SOCIAL MEDIA: Megan Anderson has stepped down as @FirebirdsQld coach. Details: https://t.co/XjXkEa1ZC8,social medium megan anderson stepped coach detail,False,medium anderson coach detail 
1.5390753910629417e+18,2022-06-21 02:39:02+00:00,['1539075391062941696'],"Why, sadly in some ways, raising good men will be my greatest feminist act. 👇👇 https://t.co/FmOBam2aHu",sadly way raising good men greatest feminist act,False,way feminist act 
1.5390369431239066e+18,2022-06-21 00:06:15+00:00,['1539036943123906560'],"@KellieKing6 Contacts + obs pretty even until half-time (when both teams had had both ends), blew out 20/12 in third, then 25/11 in last (when Vixens were chasing). Gotta adjust.",contact pretty even halftime team end blew third last vixen chasing gotta adjust,False,contact team end vixen adjust 
1.5390328339223388e+18,2022-06-20 23:49:56+00:00,['1539032833922338817'],@KellieKing6 Yeah 74/47 is just extraordinary.,yeah extraordinary,False,yeah 
1.539031872927576e+18,2022-06-20 23:46:06+00:00,['1539031872927576065'],@AJMithen Rotten luck.,rotten luck,True,luck 
1.5390310664761876e+18,2022-06-20 23:42:54+00:00,['1539031066476187649'],"It was out of business, a ""financial burden to owners"", was being towed ""to an undisclosed location"" and sank in waters too deep for salvage operations. 👀

Floating Hong Kong restaurant capsizes in South China Sea
 https://t.co/C5qaNMIrNG",business financial burden owner towed undisclosed location sank water deep salvage operation floating hong kong restaurant capsizes south china sea,False,business burden owner location water salvage operation kong restaurant sea 
1.539028685319471e+18,2022-06-20 23:33:27+00:00,['1539028685319471104'],@SuperNetball @GIANTS_Netball @MelbourneVixens I realise they wore the traditional orange last time they came to John Cain Arena (Rd3) but a girl can dream.,realise wore traditional orange last time came john cain arena girl dream,False,realise orange time girl dream 
1.539027224330117e+18,2022-06-20 23:27:38+00:00,['1539027224330117120'],"I know ya'll are worried about frivolous things such as line-ups, tactics &amp; psychological preparation ahead of Saturday night's @SuperNetball preliminary final between @GIANTS_Netball &amp; @MelbourneVixens but the BIG question is; will the Giants wear that UNREAL black clash dress?",know ya'll worried frivolous thing lineup tactic amp psychological preparation ahead saturday night's preliminary final amp big question giant wear unreal black clash dress,False,thing lineup amp preparation night amp question giant wear clash dress 
1.539025185520898e+18,2022-06-20 23:19:32+00:00,['1539025185520898050'],"Unfortunately, we won't have an ep of #TheFoxHuntPod this week, but if the Melbourne Vixens make the Super Netball grand final, we'll release a bumper ""big dance"" preview next Tuesday; June 28.",unfortunately week melbourne vixen make super netball grand final we'll release bumper big dance preview next tuesday june,False,week dance preview tuesday june 
1.5390205171305226e+18,2022-06-20 23:00:59+00:00,['1539020517130522624'],INBOX: Shooter Aliyah Dunn to switch from Pulse to Tactix for next year's @ANZPremiership.,inbox shooter aliyah dunn switch pulse tactix next year's,False,inbox shooter aliyah dunn switch pulse tactix year 
1.5390154922532823e+18,2022-06-20 22:41:01+00:00,['1539015492253282305'],"Also interesting to realise Paige Hadley is the only Diamond to be carried over from 2015 World Cup gold in Sydney. From memory, Roses have *six* ... Harten, Housby, Francis-Bayman, Mentor, EUB &amp; Clarke. https://t.co/rU082jwQIc",also interesting realise paige hadley diamond carried world cup gold sydney memory rose six harten housby francisbayman mentor eub amp clarke,False,realise paige hadley diamond world cup gold sydney memory francisbayman mentor eub amp clarke 
1.5390139326894162e+18,2022-06-20 22:34:49+00:00,['1539013932689416195'],"My man with the 🤯 stats. Extraordinary to think just Liz Watson, Steph Wood, Jo Weston &amp; Courtney Bruce have been to a Commonwealth Games. https://t.co/rU082jwQIc",man stats extraordinary think liz watson steph wood weston amp courtney bruce commonwealth game,False,man think watson steph wood weston courtney bruce commonwealth game 
1.5388600668575498e+18,2022-06-20 12:23:25+00:00,['1538860066857549824'],@KateAllman_ Hours waiting for ambulance par for the course in regional Vic sadly.,hour waiting ambulance par course regional vic sadly,False,hour ambulance par course 
1.5388443926474465e+18,2022-06-20 11:21:08+00:00,['1538844392647446528'],*Thirlby,thirlby,False,thirlby 
1.5388442730930176e+18,2022-06-20 11:20:39+00:00,['1538844273093017601'],"Reserves: Imogen Allison, Funmi Fadoju, George Fisher &amp; 
Hannah Joseph. Jess Trilby banking on experience, big time. This team looks VERY different at World Cup, me thinks. Details: https://t.co/Oo89LU7nsp 2/2",reserve imogen allison funmi fadoju george fisher amp hannah joseph jess trilby banking experience big time team look different world cup think detail,False,reserve imogen allison funmi fadoju george fisher amp hannah joseph jess trilby banking experience time team world cup detail 
1.5388442705764393e+18,2022-06-20 11:20:39+00:00,['1538844270576439297'],"INBOX: @EnglandNetball's squad for Commonwealth Games: Eleanor Cardwell, Jade Clarke, Beth Cobden, Sophie Drakeford-Lewis, Stacey Francis-Bayman, Layla Guscoth, Jo Harten (VC), Helen Housby, Laura Malcolm, Geva Mentor, Natalie Metcalf (*new C*) &amp; Eboni Usoro-Brown. 1/2",inbox squad commonwealth game eleanor cardwell jade clarke beth cobden sophie drakefordlewis stacey francisbayman layla guscoth harten helen housby laura malcolm geva mentor natalie metcalf new amp eboni usorobrown,False,inbox squad commonwealth game eleanor cardwell jade clarke sophie drakefordlewis stacey francisbayman helen housby laura malcolm geva mentor amp 
1.5384256947529523e+18,2022-06-19 07:37:22+00:00,['1538425694752952320'],Behold the absolute MAJESTY of the super shot. #GIAvMAG,behold absolute majesty super shot,False,super shot 
1.5384252709981676e+18,2022-06-19 07:35:41+00:00,['1538425270998167552'],The cruelty of that task. Poor Sinclair. But ... yah the super shot! #GIAvMAG,cruelty task poor sinclair yah super shot,False,cruelty task sinclair shot 
1.538424770751959e+18,2022-06-19 07:33:42+00:00,['1538424770751959040'],Watch every Giants contact in Pies cirlce be in one-point zone. Will umps be wise to it? #GIAvMAG,watch every giant contact pie cirlce onepoint zone ump wise,False,watch contact pie cirlce onepoint wise 
1.5384226977087693e+18,2022-06-19 07:25:28+00:00,['1538422697708769280'],Dwyer feeling much more comfortable with more traditional defensive style of Newton. #GIAvMAG,dwyer feeling much comfortable traditional defensive style newton,False,dwyer style newton 
1.5384214918800138e+18,2022-06-19 07:20:40+00:00,['1538421491880013824'],@collingwoodsn @GIANTS_Netball Try to breath.,try breath,False,breath 
1.5384212354988974e+18,2022-06-19 07:19:39+00:00,['1538421235498897409'],"Thank goodness we have the super shot. Jo Harten never shot like this until 2020. Oh, hang on ... #GIAvMAG",thank goodness super shot harten never shot like hang,False,thank goodness super shot hang 
1.5384201291128054e+18,2022-06-19 07:15:15+00:00,['1538420129112805376'],How you doing @GIANTS_Netball and @collingwoodsn fans? #GIAvMAG,fan,False,fan 
1.5384113319082926e+18,2022-06-19 06:40:18+00:00,['1538411331908292608'],"Harten CAN NOT unravel here if the Giants are to have a chance here.
#GIAvMAG",harten unravel giant chance,False,chance 
1.5384109889064837e+18,2022-06-19 06:38:56+00:00,['1538410988906483712'],Dwyer has been worked out - and is being worked over - by Ward and Pies. Shades of what Turner and Swifts did in 2019 grand final. #GIAvMAG,dwyer worked worked ward pie shade turner swift grand final,False,dwyer ward pie turner swift 
1.5384082955593318e+18,2022-06-19 06:28:14+00:00,['1538408295559331840'],"Nelson absolutely loses that in every season except this one. This game is defining - one way or the other - for her I reckon.
#GIAvMAG",nelson absolutely loses every season except one game defining one way reckon,False,season game way reckon 
1.5384034625510236e+18,2022-06-19 06:09:02+00:00,['1538403462551023616'],Chances of Nelson being called for the 'arm extension' to push off her defender as she splits? About the same of Fowler being called for her arm bar push offs every match ... Exactly zero. #GIAvMAG,chance nelson called 'arm extension' push defender split fowler called arm bar push offs every match exactly zero,False,chance nelson extension defender split fowler bar push match 
1.538402973029544e+18,2022-06-19 06:07:05+00:00,['1538402973029543936'],"Nah, looked like a ... step.
#GIAvMAG",nah looked like step,True,step 
1.5384027314921595e+18,2022-06-19 06:06:07+00:00,['1538402731492159488'],"Haaaaaaayyyyyy
#GIAvMAG",haaaaaaayyyyyy,True,haaaaaaayyyyyy 
1.5384024088076042e+18,2022-06-19 06:04:51+00:00,['1538402408807604225'],Anything Renae Ingles can do ... #GIAvMAG,anything renae ingles,False,anything 
1.5384013946542572e+18,2022-06-19 06:00:49+00:00,['1538401394654257152'],"Elite female athletes don't have to smile &amp; curtsy. Don't have to be a certain way. Or even liked. NB If you're messaging an athlete who's just lost their contract &amp; has been open about their mental health struggles, telling them their demeanour is to blame, you're an *ahole* 2/2",elite female athlete smile amp curtsy certain way even liked messaging athlete who's lost contract amp open mental health struggle telling demeanour blame ahole,False,athlete smile amp curtsy way athlete contract health struggle blame ahole 
1.5384013927416095e+18,2022-06-19 06:00:48+00:00,['1538401392741609472'],"I've only interviewed axed Adelaide Thunderbirds shooter Lenize Potgieter a few times, once a longer chat for my upcoming book, and her Instagram story this afternoon about her oncourt demeanour rings so true. It's her ""beast mode"" and anyone who knows her knows that. 1/2",i've interviewed axed adelaide thunderbird shooter lenize potgieter time longer chat upcoming book instagram story afternoon oncourt demeanour ring true beast mode anyone know know,False,i thunderbird shooter potgieter time book story afternoon beast mode anyone 
1.538396956162044e+18,2022-06-19 05:43:11+00:00,['1538396956162043904'],Don't forget there is #GIAvMAG commentary on @CluchRadio too. https://t.co/5ekVIrJRby,forget commentary,False,forget commentary 
1.5383954831225446e+18,2022-06-19 05:37:19+00:00,['1538395483122544645'],"""We've got a fantastic group of people now"" -- Geva Mentor. It's the now for me. #GIAvMAG",we've got fantastic group people geva mentor,False,group mentor 
1.5383713682232484e+18,2022-06-19 04:01:30+00:00,['1538371368223248384'],@summerhill1003 @AB_AmandaBasu She was HUGE.,huge,False,
1.538340111892353e+18,2022-06-19 01:57:18+00:00,['1538340111892353024'],@annieexcuse @ejwato88 @rgell1 @georgjar @Jess_M_Currie @MelkiTaylah @ellepee1 Oh right. Netball is meant to be ladylike remember! 🙄,right netball meant ladylike remember,False,netball 
