id,created_at,edit_history_tweet_ids,text,clean_text,non_english,nouns
1.512944643062698e+18,2022-04-10 00:04:46+00:00,['1512944643062697989'],What's the point of multiple channels? https://t.co/J6JvfYgccj,what's point multiple channel,False,point channel 
1.5127431440973414e+18,2022-04-09 10:44:05+00:00,['1512743144097341441'],@xLurch I could barely contain myself.,could barely contain,False,
1.512742762525127e+18,2022-04-09 10:42:34+00:00,['1512742762525126656'],The pure magic of the super shot in action. Remember netball was fatally flawed and had to be changed to incorporate this. #SSNSwiftsMagpies https://t.co/hmR7f1zOv0,pure magic super shot action remember netball fatally flawed changed incorporate,False,pure action incorporate 
1.5127408314672128e+18,2022-04-09 10:34:54+00:00,['1512740831467212800'],Behold the CHAMPAGNE netball the super shot delivers. #SSNSwiftsMagpies,behold champagne netball super shot delivers,False,behold champagne shot 
1.512740145409106e+18,2022-04-09 10:32:10+00:00,['1512740145409105921'],Advantage out of court? #SSNSwiftsMagpies,advantage court,False,advantage court 
1.5127329126675743e+18,2022-04-09 10:03:26+00:00,['1512732912667574279'],Treacle canoe areas. #SSNSwiftsMagpies,treacle canoe area,False,treacle area 
1.5127326098847867e+18,2022-04-09 10:02:14+00:00,['1512732609884786691'],I can visualise @biancachatfield fist bumping the air with these minutes from Sophie Garbin at GS. She told me in an interview last week it's exactly what the Pies need to do. #SSNSwiftsMagpies,visualise fist bumping air minute sophie garbin told interview last week exactly pie need,False,visualise fist air minute sophie garbin interview week 
1.5127054679060275e+18,2022-04-09 08:14:22+00:00,['1512705467906027523'],"The man's a genius, folks. Listening via streamed commentary in my car on way home from netball. https://t.co/3D1TisGuXj",man's genius folk listening via streamed commentary car way home netball,False,man folk car way home netball 
1.511977079583445e+18,2022-04-07 08:00:01+00:00,['1511977079583444995'],@Jess_M_Currie @xLurch A-dore. And a replay of @fox_netball Centre Circle to look forward to when you get home!,adore replay centre circle look forward get home,False,replay circle get home 
1.5119725475666657e+18,2022-04-07 07:42:01+00:00,['1511972547566665729'],@jeremypeterrich @jem_o97 What else could it mean?,else could mean,False,
1.5119722562470707e+18,2022-04-07 07:40:51+00:00,['1511972256247070726'],A note to all the laaaaadies. https://t.co/v5rDVGu5kp,note laaaaadies,False,note 
1.5119719305342157e+18,2022-04-07 07:39:33+00:00,['1511971930534215682'],"@bentyers Oh, look, a picture of heaven!",look picture heaven,False,look picture heaven 
1.5118506350835466e+18,2022-04-06 23:37:34+00:00,['1511850635083546629'],"All hail netball's stat gurus, people. https://t.co/EGsYa2aWaf",hail netball's stat guru people,False,hail guru 
1.5116497064135557e+18,2022-04-06 10:19:09+00:00,['1511649706413555717'],Don't look away. https://t.co/8PzmCkUGyi,look away,True,
1.511646835949306e+18,2022-04-06 10:07:45+00:00,['1511646835949305856'],@meganmaurice @Kate_ohalloran @DanielleWarby @PrideinSportAU Thanks legend!,thanks legend,False,
1.5116467658331382e+18,2022-04-06 10:07:28+00:00,['1511646765833138179'],@JessMacartney24 @Kate_ohalloran @meganmaurice @DanielleWarby @PrideinSportAU Thanks so much Jessica.,thanks much jessica,False,jessica 
1.5115788603701453e+18,2022-04-06 05:37:38+00:00,['1511578860370145283'],"But NO ONE wants to watch women's sport ... Yeah?

*Waits for inevitable re-fashioned argument about *how* much people will pay to watch women's sport, as if 90,000 people (full stop) wanting to watch women play is no big deal at all* https://t.co/embybsOlAd",one want watch women's sport yeah wait inevitable refashioned argument much people pay watch women's sport people full stop wanting watch woman play big deal,False,watch sport yeah wait sport wanting watch woman deal 
1.5115549358294385e+18,2022-04-06 04:02:34+00:00,['1511554935829438466'],@ElizaJBarr Surry Hills coffee shop,surry hill coffee shop,False,surry shop 
1.5115379550135542e+18,2022-04-06 02:55:06+00:00,['1511537955013554180'],@sportznut67 @aaron_s_fox @AdelaideTBirds And a long way back from not winning a game in 2018 (was it?),long way back winning game,False,way game 
1.5115320249471631e+18,2022-04-06 02:31:32+00:00,['1511532024947163137'],"@alliecollyer @RivSport @tylermaher5 @JoshuaHuntly @tom_king79 @megsaultry @countryfooty @AFL_GM It is absolutely happening in a few leagues, $250/game plus petrol isn't uncommon. Of course nothing like footy.",absolutely happening league game plus petrol uncommon course nothing like footy,False,game petrol course nothing footy 
1.5115274624042476e+18,2022-04-06 02:13:24+00:00,['1511527462404247556'],@alliecollyer @aaron_s_fox @AdelaideTBirds Not sure about that! ;),sure,False,sure 
1.51152536010163e+18,2022-04-06 02:05:03+00:00,['1511525360101629954'],"Trawling through stats for a story (thanks @aaron_s_fox!) &amp; it occurs to me how perfect it is that Rd3 is heritage round for @AdelaideTBirds. Why? Against Lightning on Sunday, TBirds are aiming to win third game in a row - a feat they've *never* achieved in the Super Netball era.",trawling stats story thanks amp occurs perfect heritage round lightning sunday tbirds aiming win third game row feat they've never achieved super netball era,False,story heritage round game row feat era 
1.5115133784305336e+18,2022-04-06 01:17:26+00:00,['1511513378430533635'],"It's the sipping of the water for me.
NB The team is called the Gamecocks. https://t.co/Aa27So0xQg",sipping water team called gamecock,False,water team gamecock 
1.5115117502226885e+18,2022-04-06 01:10:58+00:00,['1511511750222688256'],"@mphippard10 @RivSport @tylermaher5 @JoshuaHuntly @tom_king79 @megsaultry @countryfooty @AFL_GM I don't want to break the club, Michelle! ;)
Sadly, no, in reality.",want break club michelle sadly reality,False,break club reality 
1.5115014960344228e+18,2022-04-06 00:30:13+00:00,['1511501496034422787'],"@tylermaher5 @RivSport @JoshuaHuntly @tom_king79 @megsaultry @countryfooty @AFL_GM True, but a few getting x4/5 times that + fuel.",true getting time fuel,False,time fuel 
1.5115013520103916e+18,2022-04-06 00:29:39+00:00,['1511501352010391555'],@keiraw7 @RivSport @tylermaher5 @JoshuaHuntly @tom_king79 @megsaultry @countryfooty @AFL_GM Thanks Keira,thanks keira,True,
1.511498581987201e+18,2022-04-06 00:18:38+00:00,['1511498581987201024'],"@tom_king79 @RivSport @tylermaher5 @JoshuaHuntly @megsaultry @countryfooty @AFL_GM Thanks, Kingy. So netball payments are essentially unregulated?",thanks kingy netball payment essentially unregulated,False,payment 
1.5114980577285366e+18,2022-04-06 00:16:33+00:00,['1511498057728536578'],@tylermaher5 @RivSport @JoshuaHuntly @tom_king79 @megsaultry @countryfooty @AFL_GM Oh very patchy for sure. Absolutely agree. Envelopes for all I say.,patchy sure absolutely agree envelope say,False,
1.5114973364592312e+18,2022-04-06 00:13:41+00:00,['1511497336459231234'],@tylermaher5 @RivSport @JoshuaHuntly @tom_king79 @megsaultry @countryfooty @AFL_GM Interesting given we all know come netballers are absolutely getting paid at both minor and major league these days.,interesting given know come netballers absolutely getting paid minor major league day,False,league day 
1.5114964330690765e+18,2022-04-06 00:10:06+00:00,['1511496433069076482'],"Hey country footy/netball peeps; As a general rule, does a league's salary cap *include* any payments to netballers? Does it differ from league to league? @RivSport @tylermaher5 @JoshuaHuntly @tom_king79 @megsaultry @countryfooty @AFL_GM",hey country footynetball peep general rule doe league's salary cap include payment netballers doe differ league league,False,country rule league cap payment league league 
1.5114625671216292e+18,2022-04-05 21:55:32+00:00,['1511462567121629186'],Or AFL coaches ... https://t.co/PgaemqsCWK,afl coach,False,coach 
1.511285359518249e+18,2022-04-05 10:11:22+00:00,['1511285359518248960'],@alliecollyer @xLurch Thanks Allie!,thanks allie,False,
1.5112853050215877e+18,2022-04-05 10:11:09+00:00,['1511285305021587460'],@AJMithen Don't make me tap the sign.,make tap sign,False,tap sign 
1.511281520014549e+18,2022-04-05 09:56:07+00:00,['1511281520014549002'],Twas the Tuesday before round 1 and the only thing stirring was the shooter at the post ... Gotta give them some love sometimes. #yearofthetiger https://t.co/7cy6HEarmH,twas tuesday round thing stirring shooter post gotta give love sometimes,False,twas thing shooter post love 
1.5112482366058906e+18,2022-04-05 07:43:51+00:00,['1511248236605890564'],@xLurch @Jess_M_Currie This is the BEST! I'd so wear this.,best i'd wear,False,i 
1.5112466509912924e+18,2022-04-05 07:37:33+00:00,['1511246650991292417'],@xLurch @Jess_M_Currie Oh HELL yes!!!,hell yes,True,hell 
1.5112363898701414e+18,2022-04-05 06:56:47+00:00,['1511236389870141440'],"@starkidlacy I feel very seen, thank you, Emily. #bursting",feel seen thank emily,False,feel 
1.5112275176207892e+18,2022-04-05 06:21:32+00:00,['1511227517620789251'],Oh this is magnificent! 🥰👩‍⚖️ https://t.co/oWVv5DHlHh,magnificent,False,magnificent 
1.5112220681339085e+18,2022-04-05 05:59:52+00:00,['1511222068133908481'],@waihue @baileymes @ANZPremiership Also ... that shot. 🙌,also shot,False,shot 
1.511220972963385e+18,2022-04-05 05:55:31+00:00,['1511220972963385350'],"🧑‍⚖️"" ... after taking out best-on for a dominant performance at the weekend, Firebirds defender Ruby Bakewell-Doran might have earned the moniker of “The Notorious RBD”, a-la US feminist litigator Ruth Bader Ginsburg."" Hat tip to @xLurch for this one. 
https://t.co/Wd3VTQQQkR",taking beston dominant performance weekend firebird defender ruby bakewelldoran might earned moniker notorious rbd ala feminist litigator ruth bader ginsburg hat tip one,False,beston performance weekend firebird defender ruby bakewelldoran moniker rbd feminist litigator ruth bader ginsburg 
1.5112074687515566e+18,2022-04-05 05:01:52+00:00,['1511207468751556610'],"The 'triangular scoring trend' emerging in @SuperNetball  since introduction of super shot, adaptability of Rahni Samason &amp; the ""Sophies of the Swifts"". This week's ep of @MelbourneVixens #TheFoxHuntPod has it all. Come marvel at the brain of @aaron_s_fox! https://t.co/H7NMcw9xPY https://t.co/0jK0ebN2t1",'triangular scoring trend' emerging since introduction super shot adaptability rahni samason amp sophies swift week's come marvel brain,False,trend introduction super shot adaptability samason amp week marvel brain 
1.5109582456824873e+18,2022-04-04 12:31:32+00:00,['1510958245682487301'],@alliecollyer @mphippard10 @MConallin @jessjoynetball Creepy? Yep. Effective? Damn straight.,creepy yep effective damn straight,False,creepy damn 
1.5109581730413404e+18,2022-04-04 12:31:15+00:00,['1510958173041340418'],"@candi9burns_b @mphippard10 @MConallin @jessjoynetball @alliecollyer I actually did it without really thinking, because I'm evil obviously (was sick of seeing the back of her head in my face!) Ump didn't pick up on it. Tucked it away for future sparing use. ;)",actually without really thinking i'm evil obviously sick seeing back head face ump pick tucked away future sparing use,False,i face pick sparing use 
1.5109476286282097e+18,2022-04-04 11:49:21+00:00,['1510947628628209666'],"@mphippard10 @MConallin @jessjoynetball @alliecollyer In a grand final, the GS would always step in front of me when I was out of play (smart if you're a balanced shooter as it gives you good rebound position). Did it a few times in the game. A gentle little blow on the back of her neck was enough to put her off a shot in key moment",grand final would always step front play smart balanced shooter give good rebound position time game gentle little blow back neck enough put shot key moment,False,shooter rebound position time game blow moment 
1.510849405556908e+18,2022-04-04 05:19:03+00:00,['1510849405556908039'],"Such important, powerful storytelling. https://t.co/jZKw6geUCl",important powerful storytelling,False,storytelling 
1.5108435966850294e+18,2022-04-04 04:55:58+00:00,['1510843596685029378'],".@withMEAA will soon start the search for a new chief executive to replace Paul Murphy, who has advised the MEAA board he won't be seeking to renew his contract when it expires in February 2023.",soon start search new chief executive replace paul murphy advised meaa board seeking renew contract expires february,False,search executive murphy board contract 
1.510790884056793e+18,2022-04-04 01:26:30+00:00,['1510790884056793092'],@Bleekster @aaron_s_fox @BLT_86 Don't  be stealing my talent now ;) #TheFoxHuntPod,stealing talent,False,talent 
1.5105145031713423e+18,2022-04-03 07:08:16+00:00,['1510514503171342336'],"""Obviously this is very foreign to you.""
Not just to Chelsea, Jules.
Not just to Chelsea.
What unbelievably strange times.
#SSNThunderbirdsGiants",obviously foreign chelsea jules chelsea unbelievably strange time,False,chelsea chelsea time 
1.510501108367573e+18,2022-04-03 06:15:02+00:00,['1510501108367572992'],"@northcoasteels ATN didn't play for Fever.
Pitman 'would' have been elevated.
But she is playing as top-up for Giants.",atn play fever pitman 'would' elevated playing topup giant,False,play fever pitman playing topup giant 
1.5104762676024525e+18,2022-04-03 04:36:20+00:00,['1510476267602452480'],"And now ... The contracted West Coast Fever player who Chelsea Pitman WOULD replace in the side, Alice Teague-Neeld is now out of the side's game v Pies under Covid protocols, so Pitman is playing for the Giants when she could be playing for HER team. Keeping up? https://t.co/CIgB3mCLIY",contracted west coast fever player chelsea pitman would replace side alice teagueneeld side's game pie covid protocol pitman playing giant could playing team keeping,False,coast fever player chelsea pitman alice side game pie covid protocol pitman giant 
1.5103946722160435e+18,2022-04-02 23:12:06+00:00,['1510394672216043525'],This is cool comms from Pies. https://t.co/OxDRKRTqft,cool comms pie,False,comms pie 
1.5103932817078725e+18,2022-04-02 23:06:34+00:00,['1510393281707872258'],@SamPoolman The names are just 🌟🌟🌟🌟🌟🌟🌟 top to bottom.,name top bottom,False,name bottom 
1.5103926578596004e+18,2022-04-02 23:04:06+00:00,['1510392657859600389'],@alliecollyer You're so right.,right,False,right 
1.5103923606428303e+18,2022-04-02 23:02:55+00:00,['1510392360642830336'],Loving GKs since way back. Three intercepts and just one penalty in the last. Ping @SamPoolman https://t.co/nGhRjaGDZ5,loving gks since way back three intercept one penalty last ping,False,gks way penalty ping 
1.5103904216873943e+18,2022-04-02 22:55:12+00:00,['1510390421687394322'],@lexilegs99 It gets plenty of practice ... a muscle we build over our whole lives.,get plenty practice muscle build whole life,False,practice muscle life 
1.5103886229727764e+18,2022-04-02 22:48:04+00:00,['1510388622972776451'],"@lexilegs99 'HWG' gut drop is very real. Yesterday afternoon, see guy strutting towards lift ... ""he's gonna say something creepy"" and he did. The reality of moving through the world as a woman.",'hwg' gut drop real yesterday afternoon see guy strutting towards lift he's gonna say something creepy reality moving world woman,False,drop yesterday afternoon something reality world woman 
1.5103878591312978e+18,2022-04-02 22:45:01+00:00,['1510387859131297793'],@BennettLibs Gosh I can imagine.,gosh imagine,True,
1.510387667384496e+18,2022-04-02 22:44:16+00:00,['1510387667384496128'],"@EmilyGreenaway7 If you're bitten by a brown, you're gonna wand an ambulance I reckon. They do realise they can ... wait for it ... turn the phone off if they like?",bitten brown gonna wand ambulance reckon realise wait turn phone like,False,gon ambulance reckon realise wait phone 
1.5103848065503314e+18,2022-04-02 22:32:54+00:00,['1510384806550331392'],"@lexilegs99 But, but Lexy, they're not all bad. 🙄 I'm really sorry you had to deal with that. Also furious that it's such a routine thing that lots of women wouldn't even be surprised.",lexy they're bad i'm really sorry deal also furious routine thing lot woman even surprised,False,lexy deal thing lot woman 
1.5103841884693094e+18,2022-04-02 22:30:26+00:00,['1510384188469309440'],"Important thread. 
As a total minuscule aside, I once broke down between Echuca and Bendigo (in the north of Australia's second-most populated state) and couldn't call for help. It ain't about bloody Netflix. https://t.co/xMc05Yxpdf",important thread total minuscule aside broke echuca bendigo north australia's secondmost populated state call help ain't bloody netflix,False,thread minuscule north australia secondmost state call help 
1.5103631467367055e+18,2022-04-02 21:06:50+00:00,['1510363146736705548'],"Indeed. Every woman I know has a story of her pain being trivialised, downplayed, even ignored by male health professions. https://t.co/xjkzCmmf8V",indeed every woman know story pain trivialised downplayed even ignored male health profession,False,woman story pain male health profession 
1.5101658233817334e+18,2022-04-02 08:02:44+00:00,['1510165823381733381'],@aaron_s_fox @starkidlacy I have to be true to myself Aaron &amp; Emily.,true aaron amp emily,False,aaron amp 
1.510157814366634e+18,2022-04-02 07:30:54+00:00,['1510157814366633984'],"""Contact, advantage off-side"" within last two minutes with game in the balance in a BIG call from the umpire.  #SSNSwiftsVixens",contact advantage offside within last two minute game balance big call umpire,False,contact advantage game balance call umpire 
1.5101576085395333e+18,2022-04-02 07:30:05+00:00,['1510157608539533313'],@mjanebourne Ha! Love it.,love,False,love 
1.510157522388537e+18,2022-04-02 07:29:45+00:00,['1510157522388537346'],"""Causing the contact to give her defenders a break."" Such a simple explanation from Kim Green, but something new fans might not understand. Can't love Kim's call anymore today.  #SSNSwiftsVixens",causing contact give defender break simple explanation kim green something new fan might understand can't love kim's call anymore today,False,contact defender break explanation something fan kim call today 
1.5101566128662856e+18,2022-04-02 07:26:08+00:00,['1510156612866285571'],"Oh Kim Green. Such a brilliant call. ""The best thing the Swifts can do it STAY IN PLAY."" Such brilliant insights from someone who has been in the game very recently. #SSNSwiftsVixens",kim green brilliant call best thing swift stay play brilliant insight someone game recently,False,kim brilliant call thing swift play brilliant someone game 
1.5101554457802342e+18,2022-04-02 07:21:30+00:00,['1510155445780234245'],Stand by for Simone McKinnis' head to explode courtside.  #SSNSwiftsVixens,stand simone mckinnis' head explode courtside,False,simone mckinnis head courtside 
1.5101551976913633e+18,2022-04-02 07:20:31+00:00,['1510155197691363329'],Reckon we might see Olivia Lewis soon. Give Fawns a new challenge. #SSNSwiftsVixens,reckon might see olivia lewis soon give fawn new challenge,False,reckon challenge 
1.5101545321517752e+18,2022-04-02 07:17:52+00:00,['1510154532151775233'],"@dstanno Don't say journeywoman
Don't say journeywoman 
;)",say journeywoman say journeywoman,False,journeywoman 
1.5101543739803894e+18,2022-04-02 07:17:14+00:00,['1510154373980389378'],"And if they win it, one for the ages, I might add! #SSNSwiftsVixens",win one age might add,False,age 
1.5101538937871032e+18,2022-04-02 07:15:20+00:00,['1510153893787103232'],Ok. Why does Sophie Fawns have the same Tupperware drink bottle as my team mates? Relatable AF. #SSNSwiftsVixens,doe sophie fawn tupperware drink bottle team mate relatable,False,doe sophie fawn tupperware team mate relatable 
1.510153398582399e+18,2022-04-02 07:13:22+00:00,['1510153398582398979'],"@jessamy_sesame How did @mphippard10 so famously phrase it? ""Not interested, goal attack"". All aside, she is absolute superstar.",famously phrase interested goal attack aside absolute superstar,False,phrase goal attack superstar 
1.510152911032324e+18,2022-04-02 07:11:25+00:00,['1510152911032324104'],"Regardless of the result here, the Swifts can hold their heads high with this performance. Unwomaned, multiple debuts, late changes and showed real grit. #SSNSwiftsVixens",regardless result swift hold head high performance unwomaned multiple debut late change showed real grit,False,result swift head performance debut change grit 
1.510152660271661e+18,2022-04-02 07:10:26+00:00,['1510152660271661057'],I would pay A LOT of money to see Helen Housby play one quarter in defence and see what getting the rough end of the stick from umpires is *actually* like. #SSNSwiftsVixens,would pay lot money see helen housby play one quarter defence see getting rough end stick umpire actually like,False,lot money play quarter defence end stick 
1.5101523376960965e+18,2022-04-02 07:09:09+00:00,['1510152337696096257'],"""On the land"" = you obstructed on the fourth second. #SSNSwiftsVixens",land obstructed fourth second,False,land 
1.5101479872675553e+18,2022-04-02 06:51:52+00:00,['1510147987267555330'],"Ready? West Coast Fever training partner Chelsea Pitman - who won World Cup gold w Australia in 2011, then played for England (through UK-born dad) &amp; won Commonwealth gold 2018 - is playing for *another* team, the Giants this round, against team who cut her, Adelaide Thunderbirds",ready west coast fever training partner chelsea pitman world cup gold australia played england ukborn dad amp commonwealth gold playing another team giant round team cut adelaide thunderbird,False,coast training partner chelsea pitman world cup gold australia england dad amp commonwealth gold playing team giant round team cut thunderbird 
1.5101452561758577e+18,2022-04-02 06:41:00+00:00,['1510145256175857664'],"@sgardnerdrummon Twoooooooooooooo
Haaaaaaaaaaaaands",twoooooooooooooo haaaaaaaaaaaaands,True,twoooooooooooooo 
1.5101436999548436e+18,2022-04-02 06:34:49+00:00,['1510143699954843649'],"Liz Watson looked like she was waiting for a bus on a Saturday afternoon just then. She knew Samason was coming, her Myki was full and was chill AF. #SSNSwiftsVixens",liz watson looked like waiting bus saturday afternoon knew samason coming myki full chill,False,liz watson bus afternoon chill 
1.51014273794091e+18,2022-04-02 06:31:00+00:00,['1510142737940910080'],"""Am I asking too much for two hands on that?"" Kim Green and every grassroots coach EVER. Too good. #SSNSwiftsVixens",asking much two hand kim green every grassroots coach ever good,False,hand grassroots coach 
1.5101424976534282e+18,2022-04-02 06:30:03+00:00,['1510142497653428224'],Swifts are GRITTING their teeth here. Great to watch. #SSNSwiftsVixens,swift gritting teeth great watch,False,swift watch 
1.5101422185518572e+18,2022-04-02 06:28:56+00:00,['1510142218551857156'],"If you don't think shooters get a second to gather than three to shoot, you're either not paying attention or can't count, honestly. #SSNSwiftsVixens",think shooter get second gather three shoot either paying attention can't count honestly,False,gather shoot attention 
1.5101418425069896e+18,2022-04-02 06:27:26+00:00,['1510141842506989568'],I love how close to the sun Jo Weston is flying today. Making her mate Em Mannix's job easier every entry. #SSNSwiftsVixens,love close sun weston flying today making mate mannix's job easier every entry,False,love weston today mannix job entry 
1.510140551232123e+18,2022-04-02 06:22:19+00:00,['1510140551232122881'],@heyycourtt Arm bars! Screens! Elbows! I want 'em all.,arm bar screen elbow want 'em,False,arm bar screen elbow 
1.5101398432755507e+18,2022-04-02 06:19:30+00:00,['1510139843275550720'],"I'm not sure what TV people call those little vignettes of highlights at the end of each quarter, but I swear, they're getting better and better each round. LOVE how it captures the physicality and what happens off the ball. #SSNSwiftsVixens",i'm sure people call little vignette highlight end quarter swear they're getting better better round love capture physicality happens ball,False,i vignette quarter round capture physicality ball 
1.5101389753398395e+18,2022-04-02 06:16:03+00:00,['1510138975339839492'],"@Brittttttt93 Effect mic in one spot, camera in another I'd assume.",effect mic one spot camera another i'd assume,False,effect spot camera i 
1.510137687638147e+18,2022-04-02 06:10:56+00:00,['1510137687638147074'],Training drill areas there by Vixens. #SSNSwiftsVixens,training drill area vixen,False,training area vixen 
1.5101374922926326e+18,2022-04-02 06:10:09+00:00,['1510137492292632581'],"I absolutely love how up for the contest Tayla Fraser is. Rides every play. And always looks like she just LOVES being out there, bit like a little kid. And I mean that as a compliment. #SSNSwiftsVixens",absolutely love contest tayla fraser ride every play always look like love bit like little kid mean compliment,False,contest ride play love bit kid mean compliment 
1.5101372158667284e+18,2022-04-02 06:09:03+00:00,['1510137215866728456'],@jessamy_sesame 'I BEG your pardon' faces all around ;),beg pardon' face around,False,beg pardon face 
1.5101371126494126e+18,2022-04-02 06:08:39+00:00,['1510137112649412608'],Audio of Simone McKinnis over vision of Swifts is shades of Echuca/Moama. #SSNSwiftsVixens,audio simone mckinnis vision swift shade echucamoama,False,simone mckinnis vision swift echucamoama 
1.5101367799991828e+18,2022-04-02 06:07:19+00:00,['1510136779999182849'],@NZ_Orlena Out under Covid protocols.,covid protocol,False,covid protocol 
