id,created_at,edit_history_tweet_ids,text,clean_text,non_english,nouns
1.5256271050436198e+18,2022-05-15 00:00:21+00:00,['1525627105043619840'],"In the cold light of day, is this incident any less ugly? The arm bar action isn't uncommon from defenders (or attackers) in modern game, but it's the proximity to the post that's key here. Every player knows where it is. #SSNGIANTSVixens #GIAvVIX 
https://t.co/BUjtQiEy0T",cold light day incident ugly arm bar action uncommon defender attacker modern game proximity post that's key every player know,False,day bar action defender attacker game proximity post player 
1.525429198596153e+18,2022-05-14 10:53:56+00:00,['1525429198596153344'],@TheBroadbean Very good call Melissa.,good call melissa,False,call melissa 
1.5254290155483382e+18,2022-05-14 10:53:13+00:00,['1525429015548338176'],@jeremypeterrich Can you file for me this week please Jeremy?,file week please jeremy,False,file week please jeremy 
1.525428300473983e+18,2022-05-14 10:50:22+00:00,['1525428300473982976'],@Jess_M_Currie Last week was for the agggggges.,last week agggggges,False,week 
1.5254280153913836e+18,2022-05-14 10:49:14+00:00,['1525428015391383553'],@Jess_M_Currie I don't know what you mean Jess.,know mean jess,False,mean jess 
1.5254276120251802e+18,2022-05-14 10:47:38+00:00,['1525427612025180160'],"I write for a living &amp; I struggle to articulate just *how* good Liz Watson is at netball; what she's able to do, how composed she is, how she takes hit after hit without flinching, her placement &amp; touch on the feed. She's just like, really, really good. #SSNGIANTSVixens #GIAvVIX",write living amp struggle articulate good liz watson netball able composed take hit hit without flinching placement amp touch feed like really really good,False,living amp struggle articulate liz watson hit placement amp feed 
1.5254243233258578e+18,2022-05-14 10:34:34+00:00,['1525424323325857792'],Quality call from Anne Sargeant. We're not worthy. #SSNGIANTSVixens #GIAvVIX,quality call anne sargeant we're worthy,False,quality call anne sargeant 
1.525423262963888e+18,2022-05-14 10:30:21+00:00,['1525423262963888128'],Comeback for the ages on cards for Giants without captain Jo Harten. #SSNGIANTSVixens #GIAvVIX,comeback age card giant without captain harten,False,comeback age card giant captain harten 
1.5254227597354885e+18,2022-05-14 10:28:21+00:00,['1525422759735488514'],@KateWalther6 I was begging for Covid TBH.,begging covid tbh,False,covid tbh 
1.5254226427143987e+18,2022-05-14 10:27:53+00:00,['1525422642714398720'],"Oridnary from Brandley there. And that is being very, very kind. No accident there. #SSNGiantsVixens #GIAvVIX",oridnary brandley kind accident,False,brandley kind accident 
1.52542215511398e+18,2022-05-14 10:25:57+00:00,['1525422155113979904'],@Jess_M_Currie Do I need to find the tweet?,need find tweet,False,need tweet 
1.525419658316161e+18,2022-05-14 10:16:02+00:00,['1525419658316161026'],"Once again, isn't it just wonderful how one skill, and one skill only, matters more than any other in the best netball league in the world?
#SSNGIANTSVixens #GIAvVIX",wonderful one skill one skill matter best netball league world,False,skill skill matter world 
1.5254192611075195e+18,2022-05-14 10:14:27+00:00,['1525419261107519489'],The composure being shown by Matisse Letherbarrow is *chef's kiss*. #SSNGiantsVixens #GIAvVIX,composure shown matisse letherbarrow chef's kiss,False,composure letherbarrow chef kiss 
1.525418845967487e+18,2022-05-14 10:12:48+00:00,['1525418845967486977'],"Imagine if Liz Watson's opponent *wasnt* having a great game, as, it's hard to believe ... Amy Parmenter actually is! Pure, error-free class. #worldclassasLAlovestosay 
#SSNGIANTSVixens #GIAvVIX",imagine liz watson's opponent wasnt great game hard believe amy parmenter actually pure errorfree class,False,imagine watson wasnt game parmenter class 
1.525417286596604e+18,2022-05-14 10:06:36+00:00,['1525417286596603904'],"Stacey Marinkovich won't be hating this game from Watson + Austin.
#SSNGIANTSVixens #GIAvVIX",stacey marinkovich hating game watson austin,False,stacey game watson austin 
1.5254140848159498e+18,2022-05-14 09:53:53+00:00,['1525414084815949824'],Imagine. https://t.co/D7NJCZ8JiP,imagine,True,imagine 
1.5254139212171264e+18,2022-05-14 09:53:14+00:00,['1525413921217126400'],"For anyone wondering, a chest infection + influenza A is *not* fun. Only emerging a week later. Zero stars. Do not recommend.",anyone wondering chest infection influenza fun emerging week later zero star recommend,False,anyone infection influenza fun week star recommend 
1.5254130360051098e+18,2022-05-14 09:49:43+00:00,['1525413036005109760'],@Mark_Heydon I've not been but have been told as much.,i've told much,False,i 
1.5254129484154225e+18,2022-05-14 09:49:22+00:00,['1525412948415422465'],@KateWalther6 That's bloody brilliant.,that's bloody brilliant,False,
1.5254124946630328e+18,2022-05-14 09:47:34+00:00,['1525412494663032832'],@RedfernMichelle @fleabag So late! But it's utterly magnificent.,late utterly magnificent,False,magnificent 
1.52541075325927e+18,2022-05-14 09:40:38+00:00,['1525410753259270144'],"Is it another disappointingly small KRA crowd or does it just look that way on TV?
#SSNGIANTSVixens #GIAvVIX",another disappointingly small kra crowd doe look way,False,kra crowd doe way 
1.5254097142672466e+18,2022-05-14 09:36:31+00:00,['1525409714267246592'],"Liz Watson is TAKING NAMES. And Kate EDDY is over Covid.
#SSNGIANTSVixens #GIAvVIX",liz watson taking name kate eddy covid,False,liz watson kate eddy covid 
1.525097978435842e+18,2022-05-13 12:57:47+00:00,['1525097978435842048'],@AndyMaherDFA But seeing JdG face a consequence ... *searches for chef's kiss emoji*,seeing jdg face consequence search chef's kiss emoji,False,jdg face consequence search chef emoji 
1.5249977140809605e+18,2022-05-13 06:19:22+00:00,['1524997714080960512'],"@BronwynSimpso12 Yep, another thing defenders just don't even bother trying.",yep another thing defender even bother trying,False,thing defender 
1.5249387873310515e+18,2022-05-13 02:25:13+00:00,['1524938787331051521'],The 👑 speaks ... https://t.co/lwWeQIVguW,speaks,False,
1.524937432889561e+18,2022-05-13 02:19:50+00:00,['1524937432889561088'],"Yep! As I've often rage-tweeted ... a defender IS allowed to exit the court, to follow, but you're just not allowed to DEFEND. But, like every other defender on the planet, I've been pinged so many times I stopped bothering. #unityticket https://t.co/8vK2j9kOP3",yep i've often ragetweeted defender allowed exit court follow allowed defend like every defender planet i've pinged many time stopped bothering,False,yep i defender court follow defender planet i time 
1.524929569190314e+18,2022-05-13 01:48:35+00:00,['1524929569190313984'],"If you can watch this and think ""yeah that's fair"" I don't know what to tell ya. One rule for one, another for the other.

https://t.co/MBOg1yVOVK",watch think yeah that's fair know tell one rule one another,False,watch rule 
1.524929278734766e+18,2022-05-13 01:47:26+00:00,['1524929278734766080'],"By any objective measure it's unfair. A shooter &amp; defender can be running step for step, attacker can step off-court, use outside of court as part of game craft, leave, change direction/speed &amp; re-enter, but if a mm of defenders' foot leaves the court, penalty. Absolute nonsense. https://t.co/IHMWmSt967",objective measure unfair shooter amp defender running step step attacker step offcourt use outside court part game craft leave change directionspeed amp reenter defenders' foot leaf court penalty absolute nonsense,False,measure shooter amp defender step step offcourt use court part game craft change directionspeed reenter foot leaf court penalty absolute nonsense 
1.5246612253169664e+18,2022-05-12 08:02:17+00:00,['1524661225316966402'],@pidgeo She simply MUST wear a bun!,simply must wear bun,False,bun 
1.5245188004727644e+18,2022-05-11 22:36:20+00:00,['1524518800472764417'],"In video footage of the incident, Abu Akleh can be seen wearing a blue flak jacket clearly marked with the word ""PRESS"". https://t.co/0at6ZEolEC",video footage incident abu akleh seen wearing blue flak jacket clearly marked word press,False,video footage incident abu akleh flak jacket word press 
1.5244441613524214e+18,2022-05-11 17:39:45+00:00,['1524444161352421378'],@jeremypeterrich Imagine if shooters got pinged for attitude or backchat in our league @BattramTiff,imagine shooter got pinged attitude backchat league,False,imagine shooter attitude league 
1.5244438145674158e+18,2022-05-11 17:38:22+00:00,['1524443814567415809'],"@jeremypeterrich ""Not out of play if your girl has had dissent paid and lost the penalty pass or shot, Rob."" Thx for sharing, been offline, so missed this magnificence, sorry, issue.",play girl dissent paid lost penalty pas shot rob thx sharing offline missed magnificence sorry issue,False,play dissent penalty pas shot rob thx offline magnificence sorry issue 
1.5243434034622917e+18,2022-05-11 10:59:22+00:00,['1524343403462291456'],"""He's a man."" #anatomyofascandal",he's man,False,man 
1.524227307577086e+18,2022-05-11 03:18:03+00:00,['1524227307577085953'],"Independent candidate for Kooyong Dr Monique Ryan &amp; Greens candidate Piers Mitchem have signed @withMEAA ""candidate’s pledge"". It calls for restoration of ABC &amp; SBS funding &amp; local content requirements for free-to-air &amp; pay TV and more. Read it here https://t.co/xImnCQHEWK",independent candidate kooyong monique ryan amp green candidate pier mitchem signed candidate pledge call restoration abc amp funding amp local content requirement freetoair amp pay read,False,candidate kooyong monique ryan amp candidate pier mitchem candidate pledge call restoration abc content requirement freetoair pay read 
1.5241693966707876e+18,2022-05-10 23:27:56+00:00,['1524169396670787585'],".@MediaDiverseAU is calling for expressions of interest from mid-career, women journalists of First Nations/CALD backgrounds to undertake a 12-month program to help pave a pathway for them into leadership roles. https://t.co/QPY8HIywU5",calling expression interest midcareer woman journalist first nationscald background undertake month program help pave pathway leadership role,False,expression interest midcareer woman journalist background month program help leadership role 
1.5241684689620255e+18,2022-05-10 23:24:15+00:00,['1524168468962025472'],Hey #netballtwitter Can you recommend a Victorian/southern NSW-based provider to deliver a shooting clinic? From juniors to seniors. DMs open.,hey recommend victoriansouthern nswbased provider deliver shooting clinic junior senior open,False,provider deliver 
1.5239769654342246e+18,2022-05-10 10:43:17+00:00,['1523976965434224640'],@jascambler @ranahuss Do you have anything even remotely interesting to tell me?,anything even remotely interesting tell,False,anything tell 
1.5239533687202406e+18,2022-05-10 09:09:31+00:00,['1523953368720240640'],@ranahuss Point Break. That's it.,point break that's,False,point break 
1.5235987163256668e+18,2022-05-09 09:40:15+00:00,['1523598716325666816'],"@Crowey14 @FiCrowey Oh, this is brilliant. My GD got one at weekend and I felt VERY righteous to not be the one in trouble for once.",brilliant got one weekend felt righteous one trouble,False,brilliant weekend trouble 
1.5235978963350364e+18,2022-05-09 09:37:00+00:00,['1523597896335036418'],@Taylaoo1 Membership definitely required.,membership definitely required,False,membership 
1.5235946080007332e+18,2022-05-09 09:23:56+00:00,['1523594608000733184'],Someone made a meme about me. Sweet. https://t.co/aHd3qeEOU5,someone made meme sweet,False,someone 
1.523559769076015e+18,2022-05-09 07:05:29+00:00,['1523559769076015110'],@georgjar Sorry! Haven't seen ACL but an ankle bad enough to not play.,sorry seen acl ankle bad enough play,False,sorry play 
1.5235544182849536e+18,2022-05-09 06:44:14+00:00,['1523554418284953600'],@georgjar ACL in the warm-up.,acl warmup,False,acl warmup 
1.523542943608746e+18,2022-05-09 05:58:38+00:00,['1523542943608745984'],"@meganmaurice Look, if you ask me, the GK is already winning. Has the front space! Too cute.",look ask already winning front space cute,False,look space cute 
1.523540928887419e+18,2022-05-09 05:50:38+00:00,['1523540928887418880'],@lexilegs99 The look of utter disdain from the shooter is *chef's kiss*,look utter disdain shooter chef's kiss,False,look disdain shooter chef kiss 
1.523540755176108e+18,2022-05-09 05:49:56+00:00,['1523540755176108034'],Oh my stone-cold GK heart ... https://t.co/gHgkOFAjtk,stonecold heart,False,heart 
1.5235260017285734e+18,2022-05-09 04:51:19+00:00,['1523526001728573440'],@heyycourtt 'twas alright,'twas alright,False,'t 
1.523234975432147e+18,2022-05-08 09:34:53+00:00,['1523234975432146944'],@aaron_s_fox @georgiadoyle258 @MelbourneVixens I wondered if that was correct TBH,wondered correct tbh,False,tbh 
1.523175743735296e+18,2022-05-08 05:39:31+00:00,['1523175743735296000'],What a ferocious win by Fever to hold onto top spot. #SSNFeverMagpies #FEVvMAG,ferocious win fever hold onto top spot,False,win fever spot 
1.5231743354851205e+18,2022-05-08 05:33:55+00:00,['1523174335485120516'],Dan Ryan's plan to use SFB to ruffle Garbin's feathers at the end where umpiring is allowing it has worked to perfection. #SSNFeverMagpies #FEVvMAG,dan ryan's plan use sfb ruffle garbin's feather end umpiring allowing worked perfection,False,dan ryan plan ruffle garbin end perfection 
1.5231739593357722e+18,2022-05-08 05:32:25+00:00,['1523173959335772160'],Isn't it *awesome* how one skill is the only one that matters in Super Netball now? #SSNFeverMagpies #FEVvMAG,awesome one skill one matter super netball,False,skill matter super netball 
1.5231731611513446e+18,2022-05-08 05:29:15+00:00,['1523173161151344641'],"@georgjar We had one yesterday (oppo did it) and I squealed. No one else cared, sadly.",one yesterday oppo squealed one else cared sadly,False,yesterday 
1.5231726175275786e+18,2022-05-08 05:27:05+00:00,['1523172617527578624'],SEE IT? @georgjar,see,True,
1.5231721780819845e+18,2022-05-08 05:25:21+00:00,['1523172178081984514'],"One of my favourite umpiring quirks is when one calls something CLEARY in the others half then INSISTS it be taken ""back, back, back here."" Sure, honey. 😂 #SSNFeverMagpies #FEVvMAG",one favourite umpiring quirk one call something cleary others half insists taken back back back sure honey,False,favourite call something half honey 
1.5231699978533888e+18,2022-05-08 05:16:41+00:00,['1523169997853388800'],"*Such* a difference between two straight wins and three, isn't there? Two can be explained away, but three? Not so much. Pies showing such discipline in sticking to game plan. The silly errors/brain fades seem to have been banished.  #SSNFeverMagpies #FEVvMAG",difference two straight win three two explained away three much pie showing discipline sticking game plan silly errorsbrain fade seem banished,False,difference straight pie discipline game plan 
1.5231681163305615e+18,2022-05-08 05:09:12+00:00,['1523168116330561536'],Prays to netball gods that Mentor and Ward pull off that lift. #SSNFeverMagpies #FEVvMAG,prays netball god mentor ward pull lift,False,god mentor pull lift 
1.5231604852348314e+18,2022-05-08 04:38:53+00:00,['1523160485234831362'],VISION from Braz.  #SSNFeverMagpies #FEVvMAG,vision braz,False,vision braz 
1.5231598885866332e+18,2022-05-08 04:36:31+00:00,['1523159888586633217'],*with a broken rib.,broken rib,False,rib 
1.5231591241289892e+18,2022-05-08 04:33:28+00:00,['1523159124128989185'],I wish we heard more about the super shot. #SSNFeverMagpies #FEVvMAG,wish heard super shot,False,heard super shot 
1.5231586158464532e+18,2022-05-08 04:31:27+00:00,['1523158615846453248'],"Is one successful shot in 22 minutes from your GA sustainable? Can you win a premiership with that approach? NB Nat Medhurst shot 6 goals in Fever's losing 2018 grand final, Fowler 53/55. #SSNFeverMagpies #FEVvMAG",one successful shot minute sustainable win premiership approach nat medhurst shot goal fever's losing grand final fowler,False,shot minute win premiership approach shot goal fever fowler 
1.523153649446568e+18,2022-05-08 04:11:43+00:00,['1523153649446567936'],"Important coverage.
Tax office move to 'license' journalists risks extending government control over corporate information via @crikey_news https://t.co/jaxRV4ZqtV",important coverage tax office move 'license' journalist risk extending government control corporate information via,False,coverage tax office move journalist risk government control information 
1.523104404856918e+18,2022-05-08 00:56:02+00:00,['1523104404856918016'],"Take a bow, Jenna O'Hea. Some truth, finally. #Offsiders",take bow jenna o'hea truth finally,False,bow jenna truth 
1.523095005694374e+18,2022-05-08 00:18:41+00:00,['1523095005694373888'],Nicholls isn't JUST Shepparton and water ISN'T the only issue. Love the usual oversimplification of country seats. Let me grab my wheat to chew on. 🙄 #insiders,nicholls shepparton water issue love usual oversimplification country seat let grab wheat chew,False,water issue oversimplification country wheat chew 
1.522064032794288e+18,2022-05-05 04:01:58+00:00,['1522064032794288128'],"Just waiting for transcript to come back from online provider. Hopefully, the AI corrects each time the talent 'misspoke' so my quotes are accurate.",waiting transcript come back online provider hopefully corrects time talent 'misspoke' quote accurate,False,transcript provider time quote accurate 
1.52203384204732e+18,2022-05-05 02:02:00+00:00,['1522033842047320064'],Imagine ... just a moment ... if he was talking about AFLM.  People would be apoplectic. You wouldn't be reading/seeing anything else in the sports media. Don't tell me the women aren't treated as second-class citizens. https://t.co/Ja1lWosCqJ,imagine moment talking aflm people would apoplectic readingseeing anything else sport medium tell woman treated secondclass citizen,False,moment anything medium tell woman secondclass citizen 
1.5219987292719964e+18,2022-05-04 23:42:29+00:00,['1521998729271996417'],Concern as hundreds flee violence in NT community of Wadeye https://t.co/wT5yVvb7Qr,concern hundred flee violence community wadeye,False,concern violence community wadeye 
1.521995969784877e+18,2022-05-04 23:31:31+00:00,['1521995969784877057'],"If, as a woman, you *don't* get angrier, and more radicalised in your feminism as you grow older ... you're just not paying attention.",woman get angrier radicalised feminism grow older paying attention,False,woman feminism grow attention 
1.5217564830834033e+18,2022-05-04 07:39:53+00:00,['1521756483083403264'],"No journalist should be economically sanctioned for alleged ‘insubordination’ involving a dispute over editorial balance or be terminated for taking industrial action in support of a colleague in these circumstances.
https://t.co/z6ipLRc18S 3/3",journalist economically sanctioned alleged insubordination involving dispute editorial balance terminated taking industrial action support colleague circumstance,False,journalist insubordination balance action support colleague circumstance 
1.5217564811497513e+18,2022-05-04 07:39:52+00:00,['1521756481149751296'],#MEAAmedia has called on EMTV to reinstate the journalists on full pay and guarantee editorial independence. 2/3,called emtv reinstate journalist full pay guarantee editorial independence,False,emtv reinstate journalist pay guarantee editorial independence 
1.521756478054355e+18,2022-05-04 07:39:51+00:00,['1521756478054354944'],".@withMEAA, through Media Safety &amp; Solidarity Fund, has been supporting 25 journalists @ EMTV in Papua New Guinea who were sacked in Feb after they walked off the job in solidarity w colleague, amid allegations management had engaged in intimidation &amp; political interference. 1/3 https://t.co/wKSWXaFzbC",medium safety amp solidarity fund supporting journalist emtv papua new guinea sacked feb walked job solidarity colleague amid allegation management engaged intimidation amp political interference,False,medium safety solidarity fund journalist emtv guinea job solidarity colleague allegation management intimidation interference 
1.5217003875686318e+18,2022-05-04 03:56:58+00:00,['1521700387568631808'],@lanasciberras Do we need the graphic close-ups?,need graphic closeup,False,need closeup 
1.5217001817163776e+18,2022-05-04 03:56:09+00:00,['1521700181716377600'],"@alliecollyer This is three separate places. It's maddening. I did give  feedback to one and was basically told there was nothing they could do - but that I *wasn't* to hang anything up, which of course I did, because ... sleep.",three separate place maddening give feedback one basically told nothing could hang anything course sleep,False,place feedback nothing anything course sleep 
1.5216601462035784e+18,2022-05-04 01:17:04+00:00,['1521660146203578371'],Indeed. https://t.co/WDLwWjILX0,indeed,True,
1.5216594550287524e+18,2022-05-04 01:14:19+00:00,['1521659455028752385'],"@chryssieswarbs Or the Easter raffle version where you donate the eggs, have to find time to sell tickets for said raffle, give up &amp; then buy them all yourself. Just it add to the bloody school fees, not my already crushingly overloaded plate.",easter raffle version donate egg find time sell ticket said raffle give amp buy add bloody school fee already crushingly overloaded plate,False,easter raffle version donate egg time sell ticket amp school fee plate 
1.5216539596810117e+18,2022-05-04 00:52:29+00:00,['1521653959681011713'],"@chryssieswarbs My personal favourite is being asked to DONATE things for the Mothers' Day stall, then asked to take time off to WORK on the Mothers' Day stall, so kids can buy things you already paid for, with money you gave them. Happy fucking Mothers' Day!",personal favourite asked donate thing mothers' day stall asked take time work mothers' day stall kid buy thing already paid money gave happy fucking mothers' day,False,favourite thing day time work day stall thing money fucking day 
1.5216524233490063e+18,2022-05-04 00:46:23+00:00,['1521652423349006338'],These are all bedrooms/connected to bedrooms. Tend to ... sleep ... in bedrooms.,bedroomsconnected bedroom tend sleep bedroom,False,bedroom tend sleep bedroom 
1.5216520767527526e+18,2022-05-04 00:45:00+00:00,['1521652076752752640'],"Introducing a new series entitled ""Why the Eff Don't AirBnBs Have Decent Friggin Curtains or Any At All?"" Please enjoy the ingenuity. 1/6 https://t.co/2HpZAnUDHB",introducing new series entitled eff airbnbs decent friggin curtain please enjoy ingenuity,False,series decent friggin curtain please ingenuity 
1.521650833821401e+18,2022-05-04 00:40:04+00:00,['1521650833821401088'],"@meganmaurice @natmedhurst @codesportsau Then a year later, after the Kristiana Manu’a incident, I got in on the action ... 

https://t.co/bhE5QmcSBH",year later kristiana manua incident got action,False,year incident action 
1.5216478713170862e+18,2022-05-04 00:28:18+00:00,['1521647871317086208'],"@maddyoby @jessjoynetball @georgiadoyle258 @MelbourneVixens @aaron_s_fox It's pretty good, hey? All credit goes to the @MelbourneVixens marketing team geniuses.",pretty good hey credit marketing team genius,False,hey credit marketing team genius 
1.521441706658308e+18,2022-05-03 10:49:04+00:00,['1521441706658308096'],@Jess_M_Currie @candi9burns_b @georgjar @aaron_s_fox @MelbourneVixens @xLurch I stole if off him for my Rd2 column. https://t.co/T50JctMlZk,stole column,False,column 
1.5214396420751032e+18,2022-05-03 10:40:52+00:00,['1521439642075103232'],@Jess_M_Currie @candi9burns_b @georgjar @aaron_s_fox @MelbourneVixens @xLurch Definitely @xLurch's work.,definitely work,False,work 
1.5213779045671404e+18,2022-05-03 06:35:32+00:00,['1521377904567140358'],"I *know* there are different types of yo-yo tests, but I recall @DanRyan84 telling me his PB was 20.2 - putting him in Poi territory. Still do a 20.2, Dan? https://t.co/khW3XljX4D",know different type yoyo test recall telling putting poi territory still dan,False,type yoyo test recall poi territory 
1.5213700559922422e+18,2022-05-03 06:04:21+00:00,['1521370055992242177'],@GPBinNL Filed under things I learned today. #youngboomer,filed thing learned today,False,thing today 
1.5213583894185247e+18,2022-05-03 05:18:00+00:00,['1521358389418524672'],"In this week's #TheFoxHuntPod we talk turnovers, if *anyone* can replace Kate Eddy, the Magpies' win/loss quirk (it's something to do with half-time) &amp; a question from @georgjar *nearly* stumps @aaron_s_fox in Fox Answers the Fans. Get it in your ears @MelbourneVixens fans! https://t.co/fxr147IFfh",week's talk turnover anyone replace kate eddy magpies' winloss quirk something halftime amp question nearly stump fox answer fan get ear fan,False,week talk anyone kate eddy winloss quirk something question answer fan fan 
1.521342015413588e+18,2022-05-03 04:12:56+00:00,['1521342015413587968'],... and will die as a result. https://t.co/IN0KOcGI7d,die result,False,die result 
1.5213175242891223e+18,2022-05-03 02:35:37+00:00,['1521317524289122304'],@itsdanibrown @Brittttttt93 Glad I'm not the only one!,glad i'm one,False,glad i 
1.5213153250313503e+18,2022-05-03 02:26:52+00:00,['1521315325031350273'],Can someone point me to some great/smart analysis of ALP's help to buy housing policy? #auspoll2022,someone point greatsmart analysis alp's help buy housing policy,False,someone point greatsmart analysis alp help housing policy 
1.5213150330864558e+18,2022-05-03 02:25:43+00:00,['1521315033086455808'],"@sportznut67 As my mum would day ""you're a card, you need to be dealt with!"" 😂",mum would day card need dealt,False,mum day need dealt 
