id,created_at,edit_history_tweet_ids,text,clean_text
1.4157328972820193e+18,2021-07-15 18:00:00+00:00,['1415732897282019328'],"Our tours are getting a whole lotta love from 
@Tripadvisor: ""3 members of my group all with different levels of interest in music and it was enjoyable for everyone!"" 
Whatcha waiting for? Walk'n'roll with us: https://t.co/PGBi9fk79E
@scottishmusic @peoplemakeGLA @Glasgow_Live https://t.co/51eFU9Bh7I",tour getting whole lotta love member group different level interest music enjoyable everyone whatcha waiting walk'n'roll
1.4157126648405563e+18,2021-07-15 16:39:36+00:00,['1415712664840556551'],"@1007CRN Thanks for this Mark, can't quite place that, where is it?",thanks mark can't quite place
1.415312488896385e+18,2021-07-14 14:09:27+00:00,['1415312488896385026'],"Fancy a bite to eat after our Merchant City tour? We have some cool suggestions; including 
@VanWinkleBar
 
Our latest blog: https://t.co/kkwb7nK7Db
#PeopleMakeGlasgow #CoolGlasgowRestaurants https://t.co/ZBrDlJsdPK",fancy bite eat merchant city tour cool suggestion including latest blog
1.413812229804372e+18,2021-07-10 10:47:57+00:00,['1413812229804371970'],"A Good Read and a great listen with @FranMacdonald and @Lloyd_Cole
https://t.co/qxU9f5LhPj",good read great listen
1.413565552933671e+18,2021-07-09 18:27:45+00:00,['1413565552933670919'],"Fancy a bite to eat after our Merchant City tour? We have some cool suggestions; including @mharsanta 
Our latest blog: https://t.co/kkwb7nK7Db
#PeopleMakeGlasgow #CoolGlasgowRestaurants https://t.co/6baeUQOX2F",fancy bite eat merchant city tour cool suggestion including latest blog
1.4135510196618076e+18,2021-07-09 17:30:00+00:00,['1413551019661807617'],"Our music tours are getting a whole lotta love from @Tripadvisor: ""Thank you Phil for a wonderful tour! Well worth the money and we enjoyed finding out so many different facts about the music scene. Go on - book a tour!!!""
Walk'n'roll with us: https://t.co/PGBi9fk79E
@kingtuts https://t.co/ODPxGE76Q3",music tour getting whole lotta love thank phil wonderful tour well worth money enjoyed finding many different fact music scene book tour walk'n'roll
1.4131961900075008e+18,2021-07-08 18:00:02+00:00,['1413196190007500811'],"Euros? Schmeuros! Feel the local love from @Tripadvisor: ""This tour deserves a Hampden roar of approval!""
Walk'n'roll with us: https://t.co/PGBi9fk79E
@ScotsPostPunk @scottishmusic @HelloGlasgowist @WhatsOnGlasgow @peoplemakeGLA @Glasgow_Live https://t.co/rGY8851ie0",euro schmeuros feel local love tour deserves hampden roar approval walk'n'roll
1.4117167253311857e+18,2021-07-04 16:01:10+00:00,['1411716725331185664'],Our guide Fiona is one of the nominators this year - delighted to be celebrating #TenYearsofSAY https://t.co/nipcP6vvza,guide fiona one nominator year delighted celebrating
1.411274751583175e+18,2021-07-03 10:44:55+00:00,['1411274751583174656'],"@1007CRN Thanks Mark, that must be the wild flowers that were planted by @BarrasParkFans a couple of years ago coming through again, lovely!",thanks mark must wild flower planted couple year ago coming lovely
1.411014306875986e+18,2021-07-02 17:30:00+00:00,['1411014306875985927'],"Looking to book a family day trip? Here's the gen on our tours from @Tripadvisor: ""Booked the tour for a family of four day out and we loved every step of it. If you think you know your Glasgow music history, then think again.""
Walk'n'roll: https://t.co/PGBi9fBIye
@peoplemakeGLA https://t.co/hxbYNRIRmo",looking book family day trip here's gen tour booked tour family four day loved every step think know glasgow music history think walk'n'roll
1.4106594722430523e+18,2021-07-01 18:00:01+00:00,['1410659472243052547'],"Planning a catch up with mates? Our tours are just the ticket - but don't take our word for it. Here's the word from @Tripadvisor: ""Full of history and little gems of information this was a brilliant way to spend time with friends.""
Walk'n'roll with us: https://t.co/PGBi9fBIye https://t.co/S2KWQl38WF",planning catch mate tour ticket take word here's word full history little gem information brilliant way spend time friend walk'n'roll
1.4099346914241577e+18,2021-06-29 18:00:00+00:00,['1409934691424157699'],"Check out our latest blog - an interview with Glasgow gal @sharspiteri of @texastheband on life in lockdown and new album Hi: https://t.co/os4CqMjJse
Walk'n'roll with us: https://t.co/PGBi9fBIye
@WhatsOnGlasgow @HelloGlasgowist @Glasgow_Live @VisitScotland @peoplemakeGLA https://t.co/hMLEu3taMq",check latest blog interview glasgow gal life lockdown new album walk'n'roll
1.4084775903153193e+18,2021-06-25 17:30:00+00:00,['1408477590315319301'],"Euros? Schmeuros! Feel the local love from @Tripadvisor: ""This tour deserves a Hampden roar of approval!""
Walk'n'roll with us: https://t.co/PGBi9fBIye
@ScotsPostPunk @scottishmusic @MusicNewsScot @HelloGlasgowist @Glasgow_Live @scotgigsrelived @rabjourno @WhatsOnGlasgow https://t.co/vGoJHp8yVn",euro schmeuros feel local love tour deserves hampden roar approval walk'n'roll
1.4083945451387372e+18,2021-06-25 12:00:00+00:00,['1408394545138737156'],"Check out our latest blog - an interview with Glasgow gal @sharspiteri of @texastheband on life in lockdown and new album Hi: https://t.co/os4CqMjJse
Walk'n'roll with us https://t.co/PGBi9fBIye
@regularmusicuk @VisitScotland @MusicNewsScot @rabjourno @peoplemakeGLA @scottishmusic https://t.co/bMiDyNSbyO",check latest blog interview glasgow gal life lockdown new album walk'n'roll
1.4081227558207078e+18,2021-06-24 18:00:01+00:00,['1408122755820707840'],"Latest from @Tripadvisor: ""Thank you Phil for a wonderful tour. Well worth the money and we all enjoyed finding out so many different facts about the music scene, past and present. Go on - book a tour!!!!"" Couldn't say it better ourselves...
Walk'n'roll: https://t.co/PGBi9fBIye https://t.co/DoV8zfZZfZ",latest thank phil wonderful tour well worth money enjoyed finding many different fact music scene past present book tour say better walk'n'roll
1.4076924184728412e+18,2021-06-23 13:30:00+00:00,['1407692418472841222'],"Check out our latest blog - an interview with Glasgow gal @sharspiteri of @texastheband on life in lockdown and new album Hi: https://t.co/os4CqMBkjM
Walk'n'roll with us: https://t.co/PGBi9fk79E
@scottishmusic @peoplemakeGLA @WhatsOnGlasgow @Glasgow_Live @HelloGlasgowist https://t.co/0DXVlZyrND",check latest blog interview glasgow gal life lockdown new album walk'n'roll
1.4072763703134822e+18,2021-06-22 09:56:47+00:00,['1407276370313482241'],https://t.co/12eg0WmWWg,
1.40620511911322e+18,2021-06-19 11:00:01+00:00,['1406205119113220108'],"Check out what's going on at #Barras100 this weekend on our blog: https://t.co/Mk5VO2DjY7
@BarrasParkFans @MusicNewsScot @scottishmusic @WhatsOnGlasgow @TheBarrowlands @peoplemakeGLA @Glasgow_Live @LostGlasgow @HelloGlasgowist 
Walk'n'roll with us: https://t.co/PGBi9fk79E https://t.co/mhG0XkjoKD",check what's going weekend blog walk'n'roll
1.405948427972776e+18,2021-06-18 18:00:01+00:00,['1405948427972775944'],"Left #FathersDay2021 to the last minute? Our tours make great presents for music-daft dads. Feel the love from @Tripadvisor: ""I found the tour really interesting and a good, fun, different way to spend a Saturday in Glasgow.""
Walk'n'roll: https://t.co/PGBi9fBIye
@peoplemakeGLA https://t.co/L5ZHdWzwbT",left last minute tour make great present musicdaft dad feel love found tour really interesting good fun different way spend saturday glasgow walk'n'roll
1.405857834730885e+18,2021-06-18 12:00:02+00:00,['1405857834730885120'],"Check out what's going on at #Barras100 this weekend on our blog: https://t.co/Mk5VO2DjY7
@BarrasParkFans @MusicNewsScot @scottishmusic @WhatsOnGlasgow @TheBarrowlands @peoplemakeGLA @Glasgow_Live @LostGlasgow @PeterAlanRoss 
Walk'n'roll with us: https://t.co/PGBi9fk79E https://t.co/QTUk0N2Pbj",check what's going weekend blog walk'n'roll
1.4055784886109637e+18,2021-06-17 17:30:00+00:00,['1405578488610963456'],"Looking for a last minute gift for #FathersDay2021? Our tours make great presents for the music loving dad in your life - feel the love from @Tripadvisor: ""Great quirky tour of Glasgow from a different perspective. Highly recommended.""
Walk'n'roll: https://t.co/PGBi9fBIye https://t.co/eKF4Gzfb80",looking last minute gift tour make great present music loving dad life feel love great quirky tour glasgow different perspective highly recommended walk'n'roll
1.405481700122112e+18,2021-06-17 11:05:24+00:00,['1405481700122112001'],"Check out what's going on at the #Barras100 this coming weekend on our blog https://t.co/Mk5VO2lJ6z
@BarrasParkFans @MusicNewsScot @scottishmusic @WhatsOnGlasgow @TheBarrowlands 
Walk'n'roll with us: https://t.co/PGBi9fBIye https://t.co/4wMCxzQkNP",check what's going coming weekend blog walk'n'roll
1.404482618234704e+18,2021-06-14 16:55:24+00:00,['1404482618234703872'],"@drygatechris @emmaemma53 We are, thanks Chris!",thanks chris
1.40341171414247e+18,2021-06-11 18:00:01+00:00,['1403411714142470145'],"Our tours make great gifts for #FathersDay2021 - feel the love from @Tripadvisor: ""A delightful personal reminder of the real music scene in Glasgow over the years.""
Walk'n'roll with us: https://t.co/PGBi9fk79E
@scottishmusic @scotgigsrelived @ScotsPostPunk @LostGlasgow https://t.co/cEorLUgDbB",tour make great gift feel love delightful personal reminder real music scene glasgow year walk'n'roll
1.4030417714168095e+18,2021-06-10 17:30:00+00:00,['1403041771416809478'],"Our tours make great gifts for #FathersDay2021 - feel the love from @Tripadvisor: ""A Glasgow local but found out things about the city's music scene that I didn't know. Highly recommend the tour.""
Walk'n'roll with us: https://t.co/PGBi9fk79E
@peoplemakeGLA @Glasgow_Live https://t.co/6l4b7ie8CU",tour make great gift feel love glasgow local found thing city's music scene know highly recommend tour walk'n'roll
1.400867444558766e+18,2021-06-04 17:30:00+00:00,['1400867444558766081'],"Latest love from @Tripadvisor: ""I bought tickets as a gift for my friends birthday. We are both big music fans so it was perfect. Found out things I never knew and fab to just walk round the city. Would defo recommend it!!
Rock level 2 with us: https://t.co/PGBi9fk79E
@rabjourno https://t.co/OcwaOsFFD9",latest love bought ticket gift friend birthday big music fan perfect found thing never knew fab walk round city would defo recommend rock level
1.400787525099217e+18,2021-06-04 12:12:26+00:00,['1400787525099216899'],https://t.co/XoHOS4lLeB West End Today,west end today
1.4005126123041464e+18,2021-06-03 18:00:01+00:00,['1400512612304146436'],"Level 2, here we come! Check out the local love from @Tripadvisor: ""This was a wonderful afternoon of music history, insights and memories. Phil has a real passion for Glasgow. I'll definitely be back to book the morning tour."" 
Walk'n'roll: https://t.co/PGBi9fBIye
@scottishmusic https://t.co/sSo91e3mbG",level come check local love wonderful afternoon music history insight memory phil real passion glasgow i'll definitely back book morning tour walk'n'roll
1.4003807742815887e+18,2021-06-03 09:16:09+00:00,['1400380774281588736'],"@AlFraser13 Hi Alastair, we tweeted about this and will take a peek. We did have major Paisley plans until you-know-what happened.",alastair tweeted take peek major paisley plan youknowwhat happened
1.400138284400005e+18,2021-06-02 17:12:34+00:00,['1400138284400005125'],"@AlFraser13 Just a bit, but we have fond memories of the Bungalow Bar, sounds like a great book. 😀",bit fond memory bungalow bar sound like great book
1.4000435629690102e+18,2021-06-02 10:56:11+00:00,['1400043562969010183'],"On Saturday, Glasgow is in level 2. Which means you can do our music walking tours &amp; then go for a pint or meal indoors. With friends. Imagine!
Tix for tours here: https://t.co/PGBi9fBIye
Our chums @mharsanta will be happy to book you in for a bite after our Merchant City tour. https://t.co/q0iAV5VJXf",saturday glasgow level mean music walking tour amp pint meal indoors friend imagine tix tour chum happy book bite merchant city tour
1.3997500321994015e+18,2021-06-01 15:29:48+00:00,['1399750032199401479'],"On Saturday, Glasgow is in level 2. Which means you can do our music walking tours &amp; then go for a pint or meal indoors. With friends. Imagine!
Tix for tours here: https://t.co/c2nHCESGx9
Our chums @mharsanta will be happy to book you in for a bite after our Merchant City tour.",saturday glasgow level mean music walking tour amp pint meal indoors friend imagine tix tour chum happy book bite merchant city tour
1.399697236800553e+18,2021-06-01 12:00:01+00:00,['1399697236800552973'],"Check out our guide Fiona on @BBCRSAfternoons today discussing @NatGeoGenius, @MaskedSingerUK and the new memoir by #SineadOConnor for #TuesdayReview
@MagdaDavitt77 @halinarifai @JaniceForsyth @Nicola_Meighan https://t.co/anvRvetKiR",check guide fiona today discussing new memoir
1.3996971073558323e+18,2021-06-01 11:59:30+00:00,['1399697107355832326'],Looks like our guide Fiona will be busy this afternoon. https://t.co/sYNAxhGn5J,look like guide fiona busy afternoon
1.3996301060297032e+18,2021-06-01 07:33:15+00:00,['1399630106029703171'],https://t.co/gTJpIF7MqQ,
1.3983382829167493e+18,2021-05-28 18:00:01+00:00,['1398338282916749313'],"Locals love our music tours as much as visitors to the city - feel the love from @TripAdvisor: ""Great day, would highly recommend. Phil was full of information and funny stories about all the venues and bands. Can't wait to go again.""
Walk'n'roll with us: https://t.co/PGBi9fk79E https://t.co/thkgmrkQ2a",local love music tour much visitor city feel love great day would highly recommend phil full information funny story venue band can't wait walk'n'roll
1.398240785875837e+18,2021-05-28 11:32:36+00:00,['1398240785875836929'],"@basilatwork @Chem19Studios @alisoneales @ButcherBoyMusic It certainly is, a wonderful piece of work",certainly wonderful piece work
1.397613510935384e+18,2021-05-26 18:00:02+00:00,['1397613510935384067'],"Locals love our music tours as much as visitors to the city - feel the love from @TripAdvisor: ""Thought I knew the Glasgow music scene inside out but learned some history about some of my favourite venues. Fantastic value for money.""
Walk'n'roll: https://t.co/PGBi9fBIye
@kingtuts https://t.co/T41likg62X",local love music tour much visitor city feel love thought knew glasgow music scene inside learned history favourite venue fantastic value money walk'n'roll
1.3958015742664458e+18,2021-05-21 18:00:02+00:00,['1395801574266445825'],"Our music tours are up and running! Get in the mood by checking out our lead guide Fiona in conversation with Keith @scottishmusic for their #InTune podcast:
https://t.co/xjxds0mBYF
And walk this way with us: https://t.co/PGBi9fk79E
@ScotsPostPunk @peoplemakeGLA @glasgowlife https://t.co/2bWVY6fqR3",music tour running get mood checking lead guide fiona conversation keith podcast walk way
1.3957092700968591e+18,2021-05-21 11:53:15+00:00,['1395709270096859136'],"Here's our fab guide, Phil, in rather good company...@mister_p6 https://t.co/dantUdtK3b",here's fab guide phil rather good company
1.3954316270570988e+18,2021-05-20 17:30:00+00:00,['1395431627057098754'],"Our tours are not just for visitors. Lots of Glasgow residents have enjoyed them too - here's some love from @TripAdvisor: ""This was an excellent afternoon that also made you appreciate the sights and sounds of Glasgow!""
Walk'n'roll: https://t.co/PGBi9fk79E
@peoplemakeGLA https://t.co/3HgWZPAkqA",tour visitor lot glasgow resident enjoyed here's love excellent afternoon also made appreciate sight sound glasgow walk'n'roll
1.3954059685870756e+18,2021-05-20 15:48:02+00:00,['1395405968587075585'],"'Glasgow’s wide-open outdoor spaces, architecture and full-throttle nightlife could still steal your heart in 2021.' So says Condé Nast Traveller UK as Glasgow tops its list of Best UK City Breaks. Are we surprised? No. https://t.co/WXnDPV2XIr",'glasgows wideopen outdoor space architecture fullthrottle nightlife could still steal heart say cond nast traveller glasgow top list best city break surprised
1.3936258199567892e+18,2021-05-15 17:54:22+00:00,['1393625819956789260'],@ScotsPostPunk @steelpulse @ropoem @urbancrofter62 @jcwthoms @soundofyoungsco @HistoryofSMC @GCPunkNewWave @NewWaveAndPunk saw the Au Pairs and wish we'd seen Nick Lowe,saw pair wish we'd seen nick lowe
1.3932648527146312e+18,2021-05-14 18:00:01+00:00,['1393264852714631168'],"Our music tours are up and running! Get in the mood by checking out our lead guide Fiona in conversation with Keith @scottishmusic for their #InTune podcast:
https://t.co/xjxds05177
And walk this way with us: https://t.co/PGBi9fBIye
@VisitScotland @MusicNewsScot @BritPanopticon https://t.co/Ip3Y2H5Lnm",music tour running get mood checking lead guide fiona conversation keith podcast walk way
1.393230323543126e+18,2021-05-14 15:42:48+00:00,['1393230323543126024'],"@AlFraser13 It's a great picture and brilliant story, isn't it? @LostGlasgow is a treasure trove.",great picture brilliant story treasure trove
1.3931805167325755e+18,2021-05-14 12:24:53+00:00,['1393180516732575749'],"Many thanks to Étáin Sweeney from @HM_Scot for a great blog on the invaluable work &amp; service that Help Musicians provide, spread the word! Read all about it here: https://t.co/DksIrOychq
@HelpMusiciansUK @MusicNewsScot @scottishmusic 
@GlasgowJazzFest @ScotWim https://t.co/3h32hi0VJC",many thanks tin sweeney great blog invaluable work amp service help musician provide spread word read
1.3931784697444844e+18,2021-05-14 12:16:45+00:00,['1393178469744484356'],@AlFraser13 Thanks Alastair for such a wonderful photo and a truly great thread.,thanks alastair wonderful photo truly great thread
1.3925400778600366e+18,2021-05-12 18:00:01+00:00,['1392540077860036611'],"Our tours are not just for visitors. Local residents enjoy them too - here's love from @TripAdvisor: ""Even if you think you know these places and their stories you’ll be amazed at what you learn! Great fun!""
Walk'n'roll: https://t.co/PGBi9fBIye
@BritPanopticon @WhatsOnGlasgow https://t.co/3DqEXYN6bW",tour visitor local resident enjoy here's love even think know place story youll amazed learn great fun walk'n'roll
1.3914646349731062e+18,2021-05-09 18:46:35+00:00,['1391464634973106178'],"@angelabdc Thanks Angela, delighted to hear you enjoyed it.",thanks angela delighted hear enjoyed
1.390720583969624e+18,2021-05-07 17:30:00+00:00,['1390720583969624066'],"Our music tours are up and running! Get in the mood by checking out our lead guide Fiona in conversation with Keith @scottishmusic for their #InTune podcast:
https://t.co/xjxds0mBYF
And walk this way with us: https://t.co/PGBi9fk79E
@peoplemakeGLA @rabjourno @Glasgow_Live https://t.co/Hi5IDBAhBw",music tour running get mood checking lead guide fiona conversation keith podcast walk way
1.3899958096476529e+18,2021-05-05 17:30:00+00:00,['1389995809647652874'],"Our music tours are up and running! Get in the mood by checking out our lead guide Fiona in conversation with Keith @scottishmusic for their #InTune podcast:
https://t.co/xjxds0mBYF
And walk this way with us: https://t.co/PGBi9fk79E
@ScotsPostPunk @scotgigsrelived @glasgowlife https://t.co/PAILJkHxtx",music tour running get mood checking lead guide fiona conversation keith podcast walk way
1.3895739843086336e+18,2021-05-04 13:33:49+00:00,['1389573984308633601'],"@sunnymilton32 Hey Angie, glad it got there safe and sound, we look forward to meeting you at one point in the not too distant.",hey angie glad got safe sound look forward meeting one point distant
1.3888352721845084e+18,2021-05-02 12:38:26+00:00,['1388835272184508417'],The shoe leather has had a long enough holiday. https://t.co/rsVBL34mxf,shoe leather long enough holiday
1.38852285132245e+18,2021-05-01 15:56:59+00:00,['1388522851322449920'],"Cheers, Douglas! https://t.co/af5TdE8B4s",cheer douglas
1.3885107046643016e+18,2021-05-01 15:08:43+00:00,['1388510704664301570'],Our tours restarted today. Great to be taking guests out again and delighted that Claire and family enjoyed their spin around the East End and Merchant City. Glad to be back. https://t.co/8TJ15O2j7I,tour restarted today great taking guest delighted claire family enjoyed spin around east end merchant city glad back
1.3881914228645233e+18,2021-04-30 18:00:01+00:00,['1388191422864523264'],"One sleep to go before we restart our music tours! Check out our blog on what to expect from our Covid-safe al fresco tours: https://t.co/rrSFu5hOyT and walk'n'roll this way for tix: https://t.co/PGBi9fk79E #GoodToGo 
@VisitScotland @WhatsOnGlasgow @ScotsPostPunk @rabjourno https://t.co/Sghlf6FHyA",one sleep restart music tour check blog expect covidsafe fresco tour walk'n'roll way tix
1.3881008274458255e+18,2021-04-30 12:00:01+00:00,['1388100827445825538'],"Our music tours resume tomorrow! Get in the mood by checking out our lead guide Fiona in conversation with Keith @scottishmusic for their #InTune podcast:
https://t.co/xjxds0mBYF
And walk this way with us: https://t.co/PGBi9fk79E
@peoplemakeGLA @HelloGlasgowist @Glasgow_Live https://t.co/CYRHZGNv2w",music tour resume tomorrow get mood checking lead guide fiona conversation keith podcast walk way
1.387829031114924e+18,2021-04-29 18:00:00+00:00,['1387829031114924033'],"Our tours are not just for visitors. Local residents enjoy them too - here's love from @TripAdvisor: ""There is a lot to see in Glasgow, but if you're looking for something a little different, this tour is great.""
Walk'n'roll: https://t.co/PGBi9fk79E
@scottishmusic @peoplemakeGLA https://t.co/eZ6WkqOGMZ",tour visitor local resident enjoy here's love lot see glasgow looking something little different tour great walk'n'roll
1.3877185700045824e+18,2021-04-29 10:41:04+00:00,['1387718570004582401'],Thanks for the menshy @peoplemakeGLA Very excited about taking guests on tour from Saturday! #LoveGlasgow https://t.co/41Ist1lUMt,thanks menshy excited taking guest tour saturday
1.387459093321769e+18,2021-04-28 17:30:00+00:00,['1387459093321768963'],"We're #GoodToGo and counting down to the resumption of our music tours this Saturday. Check out our blog on what to expect from our Covid-safe al fresco tours: https://t.co/rrSFu5hOyT and walk'n'roll this way for tix: https://t.co/PGBi9fk79E
@peoplemakeGLA @HelloGlasgowist https://t.co/9yHka6Tr83",we're counting resumption music tour saturday check blog expect covidsafe fresco tour walk'n'roll way tix
1.3873760464633897e+18,2021-04-28 12:00:00+00:00,['1387376046463389696'],"In anticipation of restarting our music tours on Saturday, we took a wander past the new Shuggie Bain mural @TheBarrowlands - another great addition to the city's Mural Trail.
@peoplemakeGLA @HelloGlasgowist @Glasgow_Live @Doug_D_Stuart @picadorbooks @BarrasParkFans @glasgowlife https://t.co/7bZqX0sL4m",anticipation restarting music tour saturday took wander past new shuggie bain mural another great addition city's mural trail
1.3871042594144952e+18,2021-04-27 18:00:01+00:00,['1387104259414495234'],"Our tours are not just for visitors. Local residents enjoy them too - here's love from @TripAdvisor: ""We had actually been inside some of the venues which no longer exist so it was lovely to take a trip down memory lane."" 
Walk'n'roll: https://t.co/PGBi9fk79E
@ScotsPostPunk https://t.co/yQ4xC0WpVv",tour visitor local resident enjoy here's love actually inside venue longer exist lovely take trip memory lane walk'n'roll
1.3867418729163735e+18,2021-04-26 18:00:01+00:00,['1386741872916373505'],"We're #GoodToGo and counting down the days to restart our music tours this Saturday 1st May. Check out our blog on what to expect from our Covid-safe al fresco tours: https://t.co/rrSFu5zpXt and walk'n'roll this way for tix: https://t.co/PGBi9fBIye
@scottishmusic @scotgigsrelived https://t.co/XK8w9BNd6g",we're counting day restart music tour saturday may check blog expect covidsafe fresco tour walk'n'roll way tix
1.3866346373137818e+18,2021-04-26 10:53:54+00:00,['1386634637313781760'],Brilliant to see the city come back to life. We can't wait to restart and are looking forward to welcoming our first guests on Sat 1st May. https://t.co/WS51PTNeei,brilliant see city come back life can't wait restart looking forward welcoming first guest sat may
1.3866184547409633e+18,2021-04-26 09:49:36+00:00,['1386618454740963331'],Good luck to everyone who is welcoming customers back today. We're back in action on Saturday 1st May. https://t.co/9LeeotUnj7,good luck everyone welcoming customer back today we're back action saturday may
1.3863341828304814e+18,2021-04-25 15:00:00+00:00,['1386334182830481413'],"Our tours are not just for visitors. Local residents enjoy them too - here's love from @TripAdvisor: ""Full of history and little gems of information this was a brilliant way to spend time with friends.""
Walk'n'roll: https://t.co/PGBi9fBIye
@BritPanopticon @scotgigsrelived https://t.co/QgUxHI3FCI",tour visitor local resident enjoy here's love full history little gem information brilliant way spend time friend walk'n'roll
1.386288889116115e+18,2021-04-25 12:00:01+00:00,['1386288889116114947'],"In anticipation of restarting our music tours on Saturday, we took a wander past the new Shuggie Bain mural @TheBarrowlands - another great addition to the city's Mural Trail.
@peoplemakeGLA @HelloGlasgowist @Glasgow_Live @Doug_D_Stuart @picadorbooks @BarrasParkFans @glasgowlife https://t.co/zaobCOvRgK",anticipation restarting music tour saturday took wander past new shuggie bain mural another great addition city's mural trail
