id,created_at,edit_history_tweet_ids,text,clean_text
1.5645837173009736e+18,2022-08-30 12:00:01+00:00,['1564583717300973568'],"Only 4 Saturday tours left! Thanks for the fab 5 star reviews from our guests so far:""I had a cracking day as part of tour party.Tour guide's historical knowledge of Glasgow music,art and political scene was fabulous as was his passion for the city..."" tix https://t.co/c2nHCFahoH https://t.co/AzvAhpT7Mn",saturday tour left thanks fab star review guest fari cracking day part tour partytour guide's historical knowledge glasgow musicart political scene fabulous passion city tix
1.564313035770106e+18,2022-08-29 18:04:25+00:00,['1564313035770105856'],We host so many Simple Minds fans from home and abroad on our tours...this looks right up their street. We're looking fwd to it... get your tix while you can. @WhatsOnGlasgow @simplemindscom https://t.co/IVVNhEg5nr,host many simple mind fan home abroad toursthis look right street we're looking fwd get tix
1.5643078888390492e+18,2022-08-29 17:43:58+00:00,['1564307888839049217'],Once More Into the Vaults: Blondie on the Music That Defined Its Legacy https://t.co/hoyrnUGyhg,vault blondie music defined legacy
1.5642827036959867e+18,2022-08-29 16:03:54+00:00,['1564282703695986688'],‘I went from the outskirts of Glasgow to LA and stretch limos’: Altered Images on making Don’t Talk to Me About Love https://t.co/OFQlb0pQf1,went outskirt glasgow stretch limo altered image making dont talk love
1.5642213244063212e+18,2022-08-29 12:00:00+00:00,['1564221324406321153'],"We're into the last month of our scheduled Saturday tours already! So happy with the generous 5 star reviews our guests have left this year:""Learned a lot...Would thoroughly recommend this as a great activity."" 
Tix: https://t.co/c2nHCFahoH
@WhatsOnGlasgow https://t.co/22jym9kznU",we're last month scheduled saturday tour already happy generous star review guest left yearlearned lotwould thoroughly recommend great activity tix
1.5642097080802673e+18,2022-08-29 11:13:50+00:00,['1564209708080267264'],"Rose,a play about the inspirational footballer Rose Reilly, is touring this autumn. It's written by Lorna Martin &amp; directed by Maureen Carr: There's some more info on our blog: Get a ticket while you can...
https://t.co/K1eSG6g5c5
@LynnieCarson @Detroit67Book @PeterAlanRoss https://t.co/ySnfZDQoyJ",rosea play inspirational footballer rose reilly touring autumn written lorna martin amp directed maureen carr there's info blog get ticket
1.5634786343711252e+18,2022-08-27 10:48:49+00:00,['1563478634371125251'],@ScotsPostPunk @LunaTheGreyTuna @lapsedvinylgod1 @planetmairi He is the most beautiful boy...,beautiful boy
1.5625757532541624e+18,2022-08-24 23:01:05+00:00,['1562575753254162432'],Sky full of fireworks at tonight's @coldplay extravaganza @HampdenPark @DFConcerts #ColdplayGlasgow https://t.co/TDcRsa8Bat,sky full firework tonight's extravaganza
1.562170256382214e+18,2022-08-23 20:09:47+00:00,['1562170256382214144'],"‘If there are death threats, don’t tell me’ – how Rock Against Racism fought fascism https://t.co/lFrSpEMEL5",death threat dont tell rock racism fought fascism
1.5620189069817815e+18,2022-08-23 10:08:22+00:00,['1562018906981781504'],On Sat 10th @TheAdmiralBar Stuart Cosgrove chats with Fiona Shepherd about his fab new book Hey America! Hosted by @AndrewDivine there's a soul club night later. Tix go fast so don't hang about: https://t.co/2D8WGCL47Y Excerpt here https://t.co/lD191yA48G @WhatsOnGlasgow,sat stuart cosgrove chat fiona shepherd fab new book hey america hosted there's soul club night later tix fast hang excerpt
1.561393362497704e+18,2022-08-21 16:42:41+00:00,['1561393362497703936'],"Thanks to our guest, David, from our tour yesterday who took the time to write about it. There's lots of interesting things on his blog...have a wee look...
https://t.co/RMWNjdcliR",thanks guest david tour yesterday took time write there's lot interesting thing bloghave wee look
1.560053789608104e+18,2022-08-17 23:59:42+00:00,['1560053789608103938'],Willie Nelson’s Long Encore https://t.co/kgMFtoYcTP,willie nelson long encore
1.5599481792436142e+18,2022-08-17 17:00:03+00:00,['1559948179243614208'],"""What a fantastic afternoon out!!...partly a trip down memory lane to my teenage years at The Apollo,Tiffany’s &amp; Barrowland...also the more recent discoveries who made their debuts in Glasgow...A thoroughly enjoyable tour.""
tix: https://t.co/c2nHCFahoH
@WhatsOnGlasgow @kingtuts https://t.co/cN9rBLpNB1",fantastic afternoon outpartly trip memory lane teenage year apollotiffanys amp barrowlandalso recent discovery made debut glasgowa thoroughly enjoyable tour tix
1.5595933300396564e+18,2022-08-16 17:30:00+00:00,['1559593330039656448'],"Seems like only yesterday our new season  started &amp; we're finishing end September. Walk &amp; roll with us while you can!""Guide's historical knowledge of Glasgow music,art &amp; political scene fabulous as was his passion for the city...""
Tix: https://t.co/fPQtpnLWKf
@WhatsOnGlasgow https://t.co/1k91r2xZqH",seems like yesterday new season started amp we're finishing end september walk amp roll canguide's historical knowledge glasgow musicart amp political scene fabulous passion city tix
1.5595857797346757e+18,2022-08-16 17:00:00+00:00,['1559585779734675458'],"New review:""What a fantastic afternoon out!!...partly a trip down memory lane to my teenage years at The Apollo,Tiffany’s &amp; Barrowland...also the more recent discoveries who made their debuts in Glasgow...A thoroughly enjoyable tour.""
Tix:https://t.co/fPQtpo3y8P @WhatsOnGlasgow https://t.co/Yjb29jok6O",new reviewwhat fantastic afternoon outpartly trip memory lane teenage year apollotiffanys amp barrowlandalso recent discovery made debut glasgowa thoroughly enjoyable tour tix
1.557644024198087e+18,2022-08-11 08:24:09+00:00,['1557644024198086656'],https://t.co/czEa5LSGnN,
1.557335960362242e+18,2022-08-10 12:00:01+00:00,['1557335960362242049'],"New review:""What a fantastic afternoon out!!...partly a trip down memory lane to my teenage years at The Apollo,Tiffany’s &amp; Barrowland...also the more recent discoveries who made their debuts in Glasgow...A thoroughly enjoyable tour.""
Tix:https://t.co/c2nHCFahoH @WhatsOnGlasgow https://t.co/51QgG5WLyQ",new reviewwhat fantastic afternoon outpartly trip memory lane teenage year apollotiffanys amp barrowlandalso recent discovery made debut glasgowa thoroughly enjoyable tour tix
1.5566872812930376e+18,2022-08-08 17:02:24+00:00,['1556687281293037570'],"A brilliant review for our Saturday tours.""I had a cracking day as part of tour party...Tour guide's historical knowledge of Glasgow music, art and political scene fabulous as was his passion for the city. Highly recommended""
Tix: https://t.co/fPQtpo3y8P
@WhatsOnGlasgow https://t.co/wbhnWMbg9o",brilliant review saturday toursi cracking day part tour partytour guide's historical knowledge glasgow music art political scene fabulous passion city highly recommended tix
1.5537954656819692e+18,2022-07-31 17:31:21+00:00,['1553795465681969153'],@GLAfootballtour @Hampdeners Congratulations to you from us. Well done.,congratulation well done
1.553793144348676e+18,2022-07-31 17:22:08+00:00,['1553793144348676098'],@DaniGaravelli1 Thank you @DaniGaravelli1 we're so pleased you had a good time.,thank we're pleased good time
1.5537043021154222e+18,2022-07-31 11:29:06+00:00,['1553704302115422208'],Aww! Thanks Vanessa. Glad you enjoyed the tour. https://t.co/vdB9nM9I82,aww thanks vanessa glad enjoyed tour
1.55298753870873e+18,2022-07-29 12:00:56+00:00,['1552987538708729856'],"We've an update on Barrowland Park over on our blog courtesy of @BarrasParkFans
 who are campaigning to improve the condition of the park &amp; see it used for outdoor events
https://t.co/FRckCFO9in @GlasgowTourism @coworkglasgow @UofGlasgowMusic @mogwaiband @nickcave @TheBarrowlands https://t.co/sjxlTsq0zv",we've update barrowland park blog courtesy campaigning improve condition park amp see used outdoor event
1.5527195417923912e+18,2022-07-28 18:16:01+00:00,['1552719541792391168'],@adamlondontours @VisitScotland Thank you @adamlondontours As soon as we get a chance we'll be heading down and coming out with you on one of your fabulous tours.,thank soon get chance we'll heading coming one fabulous tour
1.552700418261672e+18,2022-07-28 17:00:02+00:00,['1552700418261671936'],"We've an update on Barrowland Park over on our blog courtesy of @BarrasParkFans who are campaigning to improve the condition of the park &amp; see it used for outdoor events
https://t.co/FRckCFO9in
@JimLambie2 @Monorail_Music @Monoglasgow @TheBarrowlands @PeterAlanRoss @moirajeffrey https://t.co/f5V7bH2cKe",we've update barrowland park blog courtesy campaigning improve condition park amp see used outdoor event
1.5520454764841574e+18,2022-07-26 21:37:31+00:00,['1552045476484157442'],Looking forward to showing delegates around Glasgow tomorrow as part of this. https://t.co/pg5ZmJ8knd,looking forward showing delegate around glasgow tomorrow part
1.5501423099159224e+18,2022-07-21 15:35:01+00:00,['1550142309915922433'],"@ETimsNet Thanking you kindly, much appreciated.",thanking kindly much appreciated
1.5500881978366607e+18,2022-07-21 12:00:00+00:00,['1550088197836660737'],"A brilliant review for our Saturday tours.""I had a cracking day as part of tour party...Tour guide's historical knowledge of Glasgow music, art and political scene fabulous as was his passion for the city. Highly recommended""
Tix: https://t.co/c2nHCFahoH
@WhatsOnGlasgow https://t.co/5L7whcDrqW",brilliant review saturday toursi cracking day part tour partytour guide's historical knowledge glasgow music art political scene fabulous passion city highly recommended tix
1.5494125304639324e+18,2022-07-19 15:15:08+00:00,['1549412530463932419'],"Here's our blog for @BarrasParkFans for the park's 7th birthday last year, with an intro from Bobby Gillespie. 8th birthday blog coming soon.
https://t.co/2upkYOrdme
@glasgowtour @glasmusiccity @TheBarrowlands @stlukesglasgow @226Gallowgate @BrawWee @BarrasGlasgow @coworkglasgow",here's blog park's birthday last year intro bobby gillespie birthday blog coming soon
1.54940623188181e+18,2022-07-19 14:50:06+00:00,['1549406231881809922'],"@BarrasParkFans Our guests love the park, it's a shame it's so grubby. Here's shinier pics! https://t.co/vP1vf7xUdb",guest love park shame grubby here's shinier pic
1.5486393125514772e+18,2022-07-17 12:02:39+00:00,['1548639312551477249'],@colinphoenix Lemonade Fizz,lemonade fizz
1.5486386550483067e+18,2022-07-17 12:00:02+00:00,['1548638655048306690'],"Our Trad Trail Tour returns Jul 30th:an hour-long folk-music themed tour followed by delish 2-course meal @mharsanta The evening includes a folk music session from a rotating line-up of Glasgow's up-and-coming talent tix: https://t.co/cU1Bqw26xe
 @WhatsOnGlasgow @GlasgowWEToday https://t.co/iRW9QjSAw6",trad trail tour return jul hourlong folkmusic themed tour followed delish course meal evening includes folk music session rotating lineup glasgow's upandcoming talent tix
1.5483293331602186e+18,2022-07-16 15:30:54+00:00,['1548329333160218625'],"@ETimsNet Hiya, thanks so much for your very kind feedback, we will pass your comments on to Phil, who will be super chuffed. We appreciate you coming out with us, thank you. 😀",hiya thanks much kind feedback pas comment phil super chuffed appreciate coming thank
1.5479138747618875e+18,2022-07-15 12:00:01+00:00,['1547913874761887745'],"Looking fwd to taking our guests out tomorrow &amp; still some tix left. ""Rock aye the noo...So much history and so many tales, told in entertaining fashion by our brilliant guide."" ""a MUST do"" 
C'mon walk'n'roll with us!
Tix https://t.co/c2nHCFahoH
@WhatsOnGlasgow @GlasgowWEToday https://t.co/WdpVWJXVST",looking fwd taking guest tomorrow amp still tix left rock aye nooso much history many tale told entertaining fashion brilliant guide must c'mon walk'n'roll tix
1.547720869148971e+18,2022-07-14 23:13:05+00:00,['1547720869148971008'],Dig these #WomenInMusic... The righteous and rocking @HAIMtheband charmed the @OVOHydro massive earlier tonight... https://t.co/YkQ2rCVXgc,dig righteous rocking charmed massive earlier tonight
1.5468748670935777e+18,2022-07-12 15:11:22+00:00,['1546874867093577731'],"@flang100 @WhatsOnGlasgow @glasgowtour Thanks for your kind comment, much appreciated.",thanks kind comment much appreciated
1.546826709030273e+18,2022-07-12 12:00:00+00:00,['1546826709030273027'],"""As a music lover and proud Glaswegian I am absolutely thrilled to have been gifted this tour as a present...our tour guide was a walking encyclopedia of the Glasgow music scene""
Walk'n'roll with us on our Saturday tours: tix https://t.co/c2nHCESGx9
@WhatsOnGlasgow @glasgowtour https://t.co/7ZJLizgDZx",music lover proud glaswegian absolutely thrilled gifted tour presentour tour guide walking encyclopedia glasgow music scene walk'n'roll saturday tour tix
1.546527223305347e+18,2022-07-11 16:09:57+00:00,['1546527223305347072'],"@ankush83 @GlasgowWEToday @WhatsOnGlasgow That's lovely to hear, thank you!😀",that's lovely hear thank
1.5464643285214618e+18,2022-07-11 12:00:02+00:00,['1546464328521461760'],"Thanks to our guests for the fab reviews.""Lots of memories revived of seeing bands in Glasgow back in the 70s/80s- definitely a lovely trip down memory lane!...great entertainment.""
Tix:https://t.co/c2nHCFahoH
@WhatsOnGlasgow @GlasgowWEToday https://t.co/QEIZ1v7H0N",thanks guest fab reviewslots memory revived seeing band glasgow back definitely lovely trip memory lanegreat entertainment tix
1.546463883602305e+18,2022-07-11 11:58:16+00:00,['1546463883602305024'],@lesclarkart1 @ScotsPostPunk Just gorgeous!,gorgeous
1.546457043367764e+18,2022-07-11 11:31:05+00:00,['1546457043367763968'],@ScotsPostPunk He's a beauty.,he's beauty
1.5464524354802852e+18,2022-07-11 11:12:46+00:00,['1546452435480285186'],"@ScotsPostPunk Music tour cat Oscar says ""Good Morning it's too hot"" to Monkey Man https://t.co/M8KMwKFBrw",music tour cat oscar say good morning hot monkey man
1.5453771594635717e+18,2022-07-08 12:00:01+00:00,['1545377159463571463'],"The Rise and Fall of T in the Park. ""It was a rite of passage for every Scottish teen...So, what happened to T in the Park?"" Our head guide, Fiona Shepherd, contributes to this BBC Radio 1 Podcast. Parts 1-4 available, with 4 tf Jul 18th.https://t.co/tqup2C6wo1 @MusicNewsScot https://t.co/sxYIycluqx",rise fall park rite passage every scottish teenso happened park head guide fiona shepherd contributes bbc radio podcast part available jul
1.5446523856157204e+18,2022-07-06 12:00:01+00:00,['1544652385615720450'],"Lovely new reviews for our Saturday tours on @Tripadvisor  ""a MUST do for any music lovers visiting Glasgow or even music loving Glaswegians!""""definitely a lovely trip down memory lane"" ""Brilliant tour"" Big thanks to our fab guides Fiona &amp; Phil  
Tix  https://t.co/c2nHCFahoH https://t.co/9N1YxXUqfV",lovely new review saturday tour must music lover visiting glasgow even music loving glaswegiansdefinitely lovely trip memory lane brilliant tour big thanks fab guide fiona amp phil tix
1.5442899972217733e+18,2022-07-05 12:00:01+00:00,['1544289997221773312'],"The fab reviews for our Saturday tours keep on coming:
""Rock aye the noo...So much history and so many tales, told in entertaining fashion by our brilliant guide Fiona. No stone was left unrolled in this rattle through decades of music history"" @WhatsOnGlasgow
 @GlasgowWEToday https://t.co/bU95P4QWtH",fab review saturday tour keep coming rock aye nooso much history many tale told entertaining fashion brilliant guide fiona stone left unrolled rattle decade music history
1.5439276092932137e+18,2022-07-04 12:00:01+00:00,['1543927609293213699'],"Explore the musical heritage of Glasgow while raising vital money for musicians, by joining a new walking event in aid of Help Musicians. Read more over on our blog https://t.co/AHuJPv4AUn @WhatsOnGlasgow @HM_Scot @scottishmusic @kingtuts @nice_n_sleazy @TheBarrowlands https://t.co/JOhzrZnr6h",explore musical heritage glasgow raising vital money musician joining new walking event aid help musician read blog
1.5418287845335204e+18,2022-06-28 17:00:02+00:00,['1541828784533520384'],"Another 5 star review for our Saturday tours.""Great stories, a good walk taking in venues I’d never noticed, and the guide seemed delighted when others on the tour contributed their stories. Can’t recommend this enough"" Tix https://t.co/c2nHCESGx9
@WhatsOnGlasgow @kingtuts https://t.co/bus3rtJ2RX",another star review saturday toursgreat story good walk taking venue never noticed guide seemed delighted others tour contributed story cant recommend enough tix
1.5414675307490058e+18,2022-06-27 17:04:33+00:00,['1541467530749005826'],"The fab reviews for our Saturday tours keep on coming:
""Rock aye the noo...So much history and so many tales, told in entertaining fashion by our brilliant guide Fiona.""  Tix: https://t.co/fPQtpo3y8P @WhatsOnGlasgow @GlasgowWEToday https://t.co/DvvpX8rHdp",fab review saturday tour keep coming rock aye nooso much history many tale told entertaining fashion brilliant guide fiona tix
1.540788204361683e+18,2022-06-25 20:05:09+00:00,['1540788204361682945'],"@starman_1888 Thank you for coming out with us, delighted to hear you enjoyed it. x",thank coming delighted hear enjoyed
1.540748272213676e+18,2022-06-25 17:26:28+00:00,['1540748272213676033'],@monotonous65 Thank you! x,thank
1.5403037310314332e+18,2022-06-24 12:00:01+00:00,['1540303731031433217'],"The fab reviews for our Saturday tours keep on coming:
""Rock aye the noo...So much history and so many tales, told in entertaining fashion by our brilliant guide Fiona."" Still places available on both tours tomorrow Tix: https://t.co/c2nHCESGx9 @WhatsOnGlasgow @GlasgowWEToday https://t.co/zWMG6lfkiz",fab review saturday tour keep coming rock aye nooso much history many tale told entertaining fashion brilliant guide fiona still place available tour tomorrow tix
1.5401004229580308e+18,2022-06-23 22:32:09+00:00,['1540100422958030848'],"He writes the songs that make the whole world sing...apart from that one, which was written by @TheBeachBoys Bruce Johnston...but all hail @barrymanilow for his @OVOHydro masterclass in showbiz professionalism and top drawer balladry...we are Fanilows... https://t.co/NiKfTBOk9Q",writes song make whole world singapart one written bruce johnstonbut hail masterclass showbiz professionalism top drawer balladrywe fanilows
1.5392165687181804e+18,2022-06-21 12:00:01+00:00,['1539216568718180352'],"Our Trad Trail Tour is this Sat 25th:an hour-long folk-music themed tour followed by delish 2-course meal @mharsanta The evening includes a folk music session from a rotating line-up of Glasgow's up-and-coming talent tix:https://t.co/cU1Bqw26xe @WhatsOnGlasgow
 @GlasgowWEToday https://t.co/fUDNbk9rVE",trad trail tour sat hourlong folkmusic themed tour followed delish course meal evening includes folk music session rotating lineup glasgow's upandcoming talent tix
1.5391961370554327e+18,2022-06-21 10:38:50+00:00,['1539196137055432710'],@PeterAlanRoss Happy summer solstice to you Pete. x,happy summer solstice pete
1.5386525016959222e+18,2022-06-19 22:38:37+00:00,['1538652501695922176'],"Last night of the 2022 @GlasgowJazzFest and this magnificent ensemble are celebrating the music of @felakuti at the @RebeccaVasmant curated With Love, From Glasgow event @OranMorGlasgow 
@glasgowlife @Glasgow_Live @rabjourno https://t.co/SCIVoUCu9g",last night magnificent ensemble celebrating music curated love glasgow event
1.53820607225054e+18,2022-06-18 17:04:40+00:00,['1538206072250540042'],"At 80, Paul McCartney still makes genius look effortless https://t.co/fZ5PcQ2Y1r",paul mccartney still make genius look effortless
1.538107854644826e+18,2022-06-18 10:34:23+00:00,['1538107854644826112'],https://t.co/LbHqgVbRJe,
1.537924045508817e+18,2022-06-17 22:24:00+00:00,['1537924045508816897'],Thinking out loud that that was pretty impressive for a one man band... @edsheeran aces night two at @HampdenPark https://t.co/ksVIrHoSGy,thinking loud pretty impressive one man band ace night two
1.537392526667264e+18,2022-06-16 11:11:56+00:00,['1537392526667264000'],@brucerisk Lovely pic Bruce and great to see Mr Hogg looking fine and dandy.,lovely pic bruce great see hogg looking fine dandy
1.537042234830295e+18,2022-06-15 12:00:00+00:00,['1537042234830295040'],"The fab reviews for our Saturday tours keep on coming:
""Rock aye the noo...So much history and so many tales, told in entertaining fashion by our brilliant guide Fiona. No stone was left unrolled in this rattle through decades of music history"" @WhatsOnGlasgow
 @GlasgowWEToday https://t.co/jQNh12iIBe",fab review saturday tour keep coming rock aye nooso much history many tale told entertaining fashion brilliant guide fiona stone left unrolled rattle decade music history
1.5370180277656453e+18,2022-06-15 10:23:48+00:00,['1537018027765645312'],"@LostGlasgow Wonderful photograph, thank you for sharing",wonderful photograph thank sharing
1.536400505877975e+18,2022-06-13 17:30:00+00:00,['1536400505877975041'],"Had a wee jaunt to the East to see Madness last night. Of course, tickets for our Glasgow walking tours are always available: https://t.co/c2nHCESGx9 https://t.co/Pad7ZdP9g4",wee jaunt east see madness last night course ticket glasgow walking tour always available
1.5357532828654633e+18,2022-06-11 22:38:10+00:00,['1535753282865463296'],"Harry Stylish rocking Ukrainian colours tonight at Ibrox
#LoveOnTour @Harry_Styles @DFConcerts https://t.co/7gfNEVHSVs",harry stylish rocking ukrainian colour tonight ibrox
1.535230300925616e+18,2022-06-10 12:00:01+00:00,['1535230300925616128'],"The fab reviews for our Saturday tours keep on coming:
""Rock aye the noo...So much history and so many tales, told in entertaining fashion by our brilliant guide Fiona. No stone was left unrolled in this rattle through decades of music history"" @WhatsOnGlasgow @GlasgowWEToday https://t.co/Jmnf2GPBI4",fab review saturday tour keep coming rock aye nooso much history many tale told entertaining fashion brilliant guide fiona stone left unrolled rattle decade music history
1.534970797701333e+18,2022-06-09 18:48:51+00:00,['1534970797701332992'],"We also managed to smuggle Jill into the inner sanctum that is @kingtuts legendary dressing room. Big thanks to Geoff Ellis and the team @DFConcerts NB photo by us, not Jill! https://t.co/33OM517m9a",also managed smuggle jill inner sanctum legendary dressing room big thanks geoff elli team photo jill
1.5349688395025408e+18,2022-06-09 18:41:04+00:00,['1534968839502540802'],"We were absolutely thrilled to show legendary rock photographer, Jill Furmanovsky, around some of Glasgow's music venues today. Here's Jill at work @TheBarrowlands Huge thanks to Tom and the team. @Rockarchive @scottishmusic @StreetLevel_ @MusicNewsScot https://t.co/IWq9svOgKe",absolutely thrilled show legendary rock photographer jill furmanovsky around glasgow's music venue today here's jill work huge thanks tom team
1.5345080181503877e+18,2022-06-08 12:09:55+00:00,['1534508018150387716'],"We're loving 'Saints &amp; Sinners' the fab new photo book from Chris Brickley. Its focus is the punk period in Glasgow &amp; Paisley, a real trip down memory lane. Read more over on our blog: https://t.co/GRW4Cj7bc8
@scotgigsrelived @MusicNewsScot @scottishmusic @WhatsOnGlasgow https://t.co/iKv7hlgmVw",we're loving 'saints amp sinners' fab new photo book chris brickley focus punk period glasgow amp paisley real trip memory lane read blog
1.5338624319901942e+18,2022-06-06 17:24:36+00:00,['1533862431990194177'],Archive film shows Belfast kids going wild to Hippy Hippy Shake in 1964 https://t.co/GB3sdTocok,archive film show belfast kid going wild hippy hippy shake
1.5332087816723988e+18,2022-06-04 22:07:13+00:00,['1533208781672398848'],@flang100 Thank you! We will pass your comments on to our Phil. We're really pleased to hear you enjoyed the tour &amp; look forward to seeing you on our other tour.,thank pas comment phil we're really pleased hear enjoyed tour amp look forward seeing tour
1.5319688154241638e+18,2022-06-01 12:00:02+00:00,['1531968815424163840'],"Lovely reviews keep on coming for our Saturday tours: ""Fabulous memories of Glasgow's music scene""""Great insight into the music history of Glasgow""""Thoroughly enjoyable"" tix https://t.co/fPQtpnLWKf 
Walk'n'roll! @WhatsOnGlasgow
 @GlasgowWEToday https://t.co/DyTHuMcvhP",lovely review keep coming saturday tour fabulous memory glasgow's music scenegreat insight music history glasgowthoroughly enjoyable tix walk'n'roll
1.5310397428752794e+18,2022-05-29 22:28:14+00:00,['1531039742875279362'],They were never being boring...all killer no filler tonight from @petshopboys on their #Dreamworld tour @OVOHydro https://t.co/Yr5VQAEENu,never boringall killer filler tonight tour
1.5304971773651436e+18,2022-05-28 10:32:17+00:00,['1530497177365143558'],"Human statue weirdness en route to today's #MerchantCityMusic tour....
@BritPanopticon @peoplemakeGLA https://t.co/2sE78GgI2n",human statue weirdness route today's tour
1.530480973133099e+18,2022-05-28 09:27:53+00:00,['1530480973133099008'],"Looking for something to do this afternoon? The weather's decent &amp; we've still got some tix left for our Music Mile Tour. 5 stars on Trip Advisor.""""Fabulous memories of Glasgow's music scene"" ""Thoroughly enjoyable""""Highly recommended""
Tix https://t.co/0ARMz0nl6E  @WhatsOnGlasgow https://t.co/ZbvOdiDzkX",looking something afternoon weather's decent amp we've still got tix left music mile tour star trip advisorfabulous memory glasgow's music scene thoroughly enjoyablehighly recommended tix
