id,created_at,edit_history_tweet_ids,text,clean_text
1.3628393698332795e+18,2021-02-19 19:00:00+00:00,['1362839369833279488'],"We love sharing stories with our tour guests - and the tale telling cuts both ways. Here's a blog about the infamous @StranglersSite gig which resulted in a city ban on punk, with photographic and eye witness input from one of our customers: https://t.co/AOAgBty5l2
@GCHalls https://t.co/Fqybs6FbLs",love sharing story tour guest tale telling cut way here's blog infamous gig resulted city ban punk photographic eye witness input one customer
1.3621145954569748e+18,2021-02-17 19:00:01+00:00,['1362114595456974848'],"While we cannot visit our favourite venues, we are consoling ourselves with a look through our back pages. Check out this blog from 2015 by @BritPanopticon director Judith Bowers on this magical music hall: https://t.co/ozLhj3POrZ
@BirlinnBooks @JudithB12347088 @Glasgow_Live https://t.co/ZbHCLOpCay",cannot visit favourite venue consoling look back page check blog director judith bower magical music hall
1.3620493953326449e+18,2021-02-17 14:40:56+00:00,['1362049395332644871'],"Lots of love for the mighty Mr Brian Hogg on twitter just now, Brian wrote a blog for us on his brilliant book, Cosmopolitan Scum @JonSavage1966 https://t.co/QZuA3XD6Jv",lot love mighty brian hogg twitter brian wrote blog brilliant book cosmopolitan scum
1.36175220693291e+18,2021-02-16 19:00:00+00:00,['1361752206932910081'],"If, like us, you are sore missing live music, we hope that our classic @TheBarrowlands blog by @PeterAlanRoss with atmospheric pics by Anne Ward might keep you going until we can all meet again. Walk this way: https://t.co/hz9tScubCy
@glasgowlife @MusicNewsScot @BarrasArtDesign https://t.co/Yp0shpmIRX",like sore missing live music hope classic blog atmospheric pic anne ward might keep going meet walk way
1.361399479350485e+18,2021-02-15 19:38:24+00:00,['1361399479350484995'],How we made: Nick Lowe on Cruel to Be Kind https://t.co/TR433rY9G5,made nick lowe cruel kind
1.3609519387628175e+18,2021-02-14 14:00:02+00:00,['1360951938762817541'],"While we cannot visit our favourite venues, we are consoling ourselves with a look through our back pages. Check out this blog from 2015 by @BritPanopticon director Judith Bowers on this magical music hall: https://t.co/ozLhj3POrZ
@BirlinnBooks @JudithB12347088 @peoplemakeGLA https://t.co/HQxpWtZD0p",cannot visit favourite venue consoling look back page check blog director judith bower magical music hall
1.3603026551642276e+18,2021-02-12 19:00:00+00:00,['1360302655164227584'],"If, like us, you are sore missing live music, we hope that our classic @TheBarrowlands blog by @PeterAlanRoss with atmospheric pics by Anne Ward might keep you going until we can all meet again. Walk this way: https://t.co/hz9tSccAdY
@peoplemakeGLA @VisitScotland @Glasgow_Live https://t.co/mRdZttgKcN",like sore missing live music hope classic blog atmospheric pic anne ward might keep going meet walk way
1.3595778798985134e+18,2021-02-10 19:00:00+00:00,['1359577879898513408'],"If, like us, you are sore missing live music, we hope that our classic @TheBarrowlands blog by @PeterAlanRoss with atmospheric pics by Anne Ward might keep you going until we can all meet again. Walk this way: https://t.co/hz9tSccAdY
@BarrasParkFans @scottishmusic @rabjourno https://t.co/EMI4uvAY1U",like sore missing live music hope classic blog atmospheric pic anne ward might keep going meet walk way
1.356634370740793e+18,2021-02-02 16:03:33+00:00,['1356634370740793348'],Haste ye back @ccfest and congratulations on a quality online #ccfest2021 programme. We look forward to hitting the Trad Trail face to face in 2022! https://t.co/eefwN2B4i3,haste back congratulation quality online programme look forward hitting trad trail face face
1.3565750664279572e+18,2021-02-02 12:07:54+00:00,['1356575066427957248'],Blue skies over the Hebrides...just the thing to brighten up a dreich Tuesday in Glasgow....@colinmacleod_ singing to his sheep... https://t.co/dhKQZsUrlY,blue sky hebridesjust thing brighten dreich tuesday glasgow singing sheep
1.3552141311927583e+18,2021-01-29 18:00:02+00:00,['1355214131192758273'],"Invest while stocks last! Congrats to all @ccfest for putting together a wonderful programme for #ccfest2021
We have so missed guiding our Trad Trail tour this year and all our fantastic partners @scottishmusic @BritPanopticon @GCHalls @TheScotiaBar Hope to see you all next year! https://t.co/fdbHPkBToL",invest stock last congrats putting together wonderful programme missed guiding trad trail tour year fantastic partner hope see next year
1.3537494719816868e+18,2021-01-25 17:00:00+00:00,['1353749471981686785'],"Happy Burns Night from all at Glasgow Music City Tours. To get you in the Bard-ish mood, head over to our blog to read the wonderful singer and broadcaster @cerysmatthews on her love of #robertburns 
Ae fond Cerys: https://t.co/CzZEDEKIlV
@BBC6Music @BBCRadio2 @ccfest https://t.co/lKaUIeOQO9",happy burn night glasgow music city tour get bardish mood head blog read wonderful singer broadcaster love fond cerys
1.3526925133755433e+18,2021-01-22 19:00:01+00:00,['1352692513375543296'],"Head over to our blog to read the wonderful singer and broadcaster @cerysmatthews on her love of #robertburns 
Ae fond Cerys: https://t.co/CzZEDEt6Xl
@BBC6Music @BBCRadio2 @scottishmusic @kingtuts @peoplemakeGLA https://t.co/aXzFjVD1Ht",head blog read wonderful singer broadcaster love fond cerys
1.352235739279405e+18,2021-01-21 12:44:58+00:00,['1352235739279405056'],"@jalfrezijamie @LostGlasgow Yes, It’s claimed that he played his own gig in the Victoria bar and later wrote a song about his time in the city, called Going Up The Clyde.",yes claimed played gig victoria bar later wrote song time city called going clyde
1.351975009154171e+18,2021-01-20 19:28:55+00:00,['1351975009154170881'],@cerysmatthews You're welcome!,welcome
1.35196018396305e+18,2021-01-20 18:30:00+00:00,['1351960183963049986'],"Head over to our blog to read the wonderful singer and broadcaster @cerysmatthews on her love of #robertburns 
Ae fond Cerys: https://t.co/CzZEDEKIlV
@BBC6Music @BBCRadio2 @scottishmusic @Glasgow_Live @HelloGlasgowist https://t.co/EPz0AYmnfJ",head blog read wonderful singer broadcaster love fond cerys
1.3519381904966943e+18,2021-01-20 17:02:37+00:00,['1351938190496694272'],More from the magnificent @cerysmatthews over on our blog: https://t.co/CzZEDEKIlV https://t.co/kXsMuZ3A2N,magnificent blog
1.351846760428294e+18,2021-01-20 10:59:18+00:00,['1351846760428294144'],Start the day right with this gorgeous winter song from the wonderful @Madrigirls featuring our guide @alisoneales https://t.co/RL2XdcMroU,start day right gorgeous winter song wonderful featuring guide
1.350155792314495e+18,2021-01-15 19:00:00+00:00,['1350155792314494980'],"Head over to our blog for our Q&amp;A with 2020 #SAYAward winner @novascotiatruth on lockdown, female MCs and drawing inspiration from the Glasgow music scene: https://t.co/EIKT7b3PGo
@SAYaward @ScotWim @vaj_power @Glasgow_Live @peoplemakeGLA @TheSMIA @scottishmusic @HelloGlasgowist https://t.co/WfIJLRrSuK",head blog qampa winner lockdown female drawing inspiration glasgow music scene
1.3490686311879393e+18,2021-01-12 19:00:00+00:00,['1349068631187939329'],"Head over to our blog for our Q&amp;A with 2020 #SAYAward winner @novascotiatruth on lockdown, female MCs and drawing inspiration from the Glasgow music scene: https://t.co/EIKT7blqxW
@SAYaward @ScotWim @vaj_power @Glasgow_Live @peoplemakeGLA @TheSMIA @scottishmusic @halina1979 https://t.co/bRKtGIezkW",head blog qampa winner lockdown female drawing inspiration glasgow music scene
1.3489629348363878e+18,2021-01-12 12:00:00+00:00,['1348962934836387840'],A star in the making. Read more from @novascotiatruth on our blog: https://t.co/EIKT7b3PGo https://t.co/Qf4L3g5ARA,star making read blog
1.3476190826364682e+18,2021-01-08 19:00:01+00:00,['1347619082636468225'],"Head over to our blog to read @barrowballads author @AlisonMIrvine on her new book Cat Step and the music which inspired it: https://t.co/vltWrF68Ty plus beat the January blues with our Facebook competition to win a copy: https://t.co/y49sTp3Fxa
@scottishmusic @peoplemakeGLA https://t.co/1Pw8WRhG2h",head blog read author new book cat step music inspired plus beat january blue facebook competition win copy
1.3465319188047053e+18,2021-01-05 19:00:01+00:00,['1346531918804705282'],"Head over to our blog to read @barrowballads author @AlisonMIrvine on her new book Cat Step and the music which inspired it: https://t.co/vltWrF68Ty plus beat the January blues with our Facebook competition to win a copy: https://t.co/y49sTp3Fxa
@TheBarrowlands @BarrasParkFans https://t.co/QxQbbHzQlD",head blog read author new book cat step music inspired plus beat january blue facebook competition win copy
1.3464666061430292e+18,2021-01-05 14:40:29+00:00,['1346466606143029249'],@soulboydaveybee @BorisJohnson @michaelgove you forgot Michael Fabricant!,forgot michael fabricant
1.3421757094611476e+18,2020-12-24 18:30:00+00:00,['1342175709461147649'],So you've left it a bit late with the Christmas shopping - we're not ones to judge... How about a gift voucher to walk'n'roll with us on our music tours in 2021? The ideal last minute pressie for music lovers and a snip at £28 for two.  (Don't) walk on by: https://t.co/91aYMUievn https://t.co/OT3HZDoGNZ,left bit late christmas shopping we're one judge gift voucher walk'n'roll music tour ideal last minute pressie music lover snip two walk
1.341813322526552e+18,2020-12-23 18:30:00+00:00,['1341813322526552065'],"Two more sleeps to go...get sorted for Christmas with our gift vouchers, ideal for the fans of music and walking in your life and a snip at £28 for two. No wonder Santa's got a twinkle on his shades. Walk this way: https://t.co/91aYMU0D6N https://t.co/SgLp3Ry3xk",two sleep goget sorted christmas gift voucher ideal fan music walking life snip two wonder santa's got twinkle shade walk way
1.3417148564587274e+18,2020-12-23 11:58:44+00:00,['1341714856458727431'],"Ahead of the release of its limited edition box set devoted to the work of the cult singer Paul Quinn, a Christmas message to you from Postcard Records https://t.co/ASIMBJf8fu",ahead release limited edition box set devoted work cult singer paul quinn christmas message postcard record
1.341450933692113e+18,2020-12-22 18:30:00+00:00,['1341450933692112897'],"Big on Bowie? Fond of Franz Ferdinand? Our gift vouchers make ideal last minute Christmas presents for the music lover in your life. It's £28 for two to join us on our music tours when they resume in 2021, just walk this way: https://t.co/91aYMU0D6N https://t.co/3C9npCw0WY",big bowie fond franz ferdinand gift voucher make ideal last minute christmas present music lover life two join music tour resume walk way
1.3410885463592755e+18,2020-12-21 18:30:00+00:00,['1341088546359275520'],"Four more sleeps to go...if you're still short of a present for the music lover in your life, our gift vouchers make thoughtful - and convenient - presents. It's £28 for two to join us on our music tours when they resume in 2021, just walk this way: https://t.co/91aYMUievn https://t.co/Ib996yOSLJ",four sleep goif still short present music lover life gift voucher make thoughtful convenient present two join music tour resume walk way
1.3407337076158136e+18,2020-12-20 19:00:00+00:00,['1340733707615813635'],"Santa baby, you can skip the sable, yacht and convertible - how about a gift voucher for two to walk'n'roll on our music tours next season? £28 for two, a neat saving of £8 on two full price adult tickets. Hurry down the chimney: https://t.co/cEzwe5ZvtN
@Glasgow_Live @glasgowlife https://t.co/JnFlnODmc0",santa baby skip sable yacht convertible gift voucher two walk'n'roll music tour next season two neat saving two full price adult ticket hurry chimney
1.340643113446994e+18,2020-12-20 13:00:00+00:00,['1340643113446993923'],"Santa baby, you can skip the sable, yacht and convertible - how about a gift voucher for two to walk'n'roll on our music tours next season? £28 for two, a neat saving of £8 on two full price adult tickets. Hurry down the chimney: https://t.co/cEzwe5ZvtN
@HelloGlasgowist @ccfest https://t.co/vWbGQIM9rz",santa baby skip sable yacht convertible gift voucher two walk'n'roll music tour next season two neat saving two full price adult ticket hurry chimney
1.340371324502483e+18,2020-12-19 19:00:01+00:00,['1340371324502482944'],"Less than a week until C-day but fear not, our gift vouchers are the ideal gift for the music lover in your life - £28 for two to walk'n'roll with us on our music tours in 2021, plus flexibility on booking and validity. Fill your (walking) boots: https://t.co/91aYMUievn https://t.co/T9f83bNQrJ",week cday fear gift voucher ideal gift music lover life two walk'n'roll music tour plus flexibility booking validity fill walking boot
1.3403317909433426e+18,2020-12-19 16:22:55+00:00,['1340331790943342594'],"More details on the first Postcard Records release in 25 years! The Paul Quinn box includes The Independent Group's 2 Postcard LPs (one a double), and a fistful of rare and unreleased tracks (including many live) spread across another double LP + EP ...plus a 144 page(!!) book... https://t.co/ov65Ir3Mgb",detail first postcard record release year paul quinn box includes independent group's postcard one double fistful rare unreleased track including many live spread across another double plus page book
1.3402731743955397e+18,2020-12-19 12:30:00+00:00,['1340273174395539458'],"Less than a week until C-day but fear not, our gift vouchers are the ideal gift for the music lover in your life - £28 for two to walk'n'roll with us on our music tours in 2021, plus flexibility on booking and validity. Fill your (walking) boots: https://t.co/91aYMU0D6N https://t.co/cmeS2wm5yp",week cday fear gift voucher ideal gift music lover life two walk'n'roll music tour plus flexibility booking validity fill walking boot
1.3400013830435226e+18,2020-12-18 18:30:00+00:00,['1340001383043522560'],"Stop the cavalry! Did you say £28 for two to walk'n'roll on our music tours in 2021? That's one deal we can all sign up to... Walk this way to buy our Christmas vouchers: https://t.co/cEzwe6h6Sn
@BritPanopticon @GCHalls @cluthavictoria @nice_n_sleazy  @TheBarrowlands @glasgowlife https://t.co/NYu1NycDTG",stop cavalry say two walk'n'roll music tour that's one deal sign walk way buy christmas voucher
1.339982667677397e+18,2020-12-18 17:15:38+00:00,['1339982667677396992'],"The Return Of Postcard Records!
Yikes. Scotland's legendary independent label just announced its first release in 25 years –a lavish, very limited box devoted to cult singer Paul Quinn and his work with Postcard's in-house superband The Independent Group. See @dubh185 for details https://t.co/uKpfCLeVft",return postcard record yikes scotland's legendary independent label announced first release year lavish limited box devoted cult singer paul quinn work postcard's inhouse superband independent group see detail
1.3399811107559096e+18,2020-12-18 17:09:27+00:00,['1339981110755909633'],"The Return Of Postcard Records!
Yikes. Scotland's legendary independent label just announced its first release in 25 years –a lavish, very limited box devoted to cult singer Paul Quinn and his work with Postcard's in-house superband The Independent Group. See @dubh185 for details https://t.co/F8hEid29hD",return postcard record yikes scotland's legendary independent label announced first release year lavish limited box devoted cult singer paul quinn work postcard's inhouse superband independent group see detail
1.339924298170024e+18,2020-12-18 13:23:41+00:00,['1339924298170023937'],"The Curious Return of Postcard Records...???

Something coming soon... it says here. Eyes peeled. https://t.co/FTFhV9ilgp",curious return postcard record something coming soon say eye peeled
1.3396389955636838e+18,2020-12-17 18:30:00+00:00,['1339638995563683841'],"Santa baby, you can skip the sable, yacht and convertible - how about a gift voucher for two to walk'n'roll on our music tours next season? £28 for two, a neat saving of £8 on two full price adult tickets.
Hurry down the chimney: https://t.co/cEzwe5ZvtN
@scottishmusic @ccfest https://t.co/c7HNJUCHK1",santa baby skip sable yacht convertible gift voucher two walk'n'roll music tour next season two neat saving two full price adult ticket hurry chimney
1.3396319295791923e+18,2020-12-17 18:01:55+00:00,['1339631929579192321'],"Great stuff from Jared - the first winner of @SCBursary 
@scottishmusic @GillMaxwell https://t.co/yLJ8b95s7n",great stuff jared first winner
1.3392766075638415e+18,2020-12-16 18:30:00+00:00,['1339276607563841538'],"Stop the cavalry! Did you say £28 for two to walk'n'roll on our music tours in 2021? That's one deal we can all sign up to... Walk this way to buy our Christmas vouchers: https://t.co/cEzwe5ZvtN
@Glasgow_Live @rabjourno @scottishmusic @peoplemakeGLA @VisitScotland @Monorail_Music https://t.co/9qqbSKAX2y",stop cavalry say two walk'n'roll music tour that's one deal sign walk way buy christmas voucher
1.33920866537139e+18,2020-12-16 14:00:01+00:00,['1339208665371389953'],"We're making a human demand that you head over to our blog to read our Q&amp;A with @amy__macdonald on recording her album during the pandemic and winning @NordoffRobbins1 #ScottishMusicAwards
https://t.co/VTvaVOTU7X
#glasgowmusic #glasgowsingers #AmyMacdonald https://t.co/wAeI5YGN7l",we're making human demand head blog read qampa recording album pandemic winning
1.338921774000595e+18,2020-12-15 19:00:01+00:00,['1338921774000594946'],"We're making a human demand that you head over to our blog here https://t.co/tirIpQfZhc to read our Q&amp;A with @Amy__Macdonald on recording her album during the pandemic and winning @NordoffRobbins1 #ScottishMusicAwards
@DFConcerts @scottishmusic @ScotWim @peoplemakeGLA https://t.co/7WoyBEfk4d",we're making human demand head blog read qampa recording album pandemic winning
1.3385535239450337e+18,2020-12-14 18:36:43+00:00,['1338553523945033729'],"The Curious Return Of Postcard Records...??? (Continued)

The mystery thickens about some new activity from the fabled label of the kitten with the drum...but new details emerge:

""ON FIVE LONG PLAYING VINYL ALBUMS
and a 10” for EXTENDED PLAY
COMING SOON"" https://t.co/A5iW6EG2zi",curious return postcard record continued mystery thickens new activity fabled label kitten drumbut new detail emerge five long playing vinyl album extended play coming soon
1.338196993202598e+18,2020-12-13 19:00:00+00:00,['1338196993202597891'],"Santa baby, you can skip the sable, yacht and convertible - how about a gift voucher for two to walk'n'roll on our music tours next season? £28 for two, a neat saving of £8 on two full price adult tickets.
Hurry down the chimney: https://t.co/cEzwe6h6Sn https://t.co/l6PlsQGdpA",santa baby skip sable yacht convertible gift voucher two walk'n'roll music tour next season two neat saving two full price adult ticket hurry chimney
1.3381365961100575e+18,2020-12-13 15:00:00+00:00,['1338136596110057479'],"We're making a human demand that you head over to our blog here https://t.co/tirIpQfZhc to read our Q&amp;A with @Amy__Macdonald on recording her album during the pandemic and winning @NordoffRobbins1 #ScottishMusicAwards
@peoplemakeGLA @TheBarrowlands @BarrasParkFans https://t.co/MnlAWkRG3q",we're making human demand head blog read qampa recording album pandemic winning
1.338106399377797e+18,2020-12-13 13:00:01+00:00,['1338106399377797120'],"Santa baby, you can skip the sable, yacht and convertible - how about a gift voucher for two to walk'n'roll on our music tours next season? £28 for two, a neat saving of £8 on two full price adult tickets.
Hurry down the chimney: https://t.co/cEzwe6h6Sn https://t.co/biPW32O48M",santa baby skip sable yacht convertible gift voucher two walk'n'roll music tour next season two neat saving two full price adult ticket hurry chimney
1.33783460948523e+18,2020-12-12 19:00:01+00:00,['1337834609485230081'],"Stop the cavalry! Did you say £28 for two to walk'n'roll on our music tours in 2021? That's one deal we can all sign up to... Walk this way to buy our Christmas vouchers: https://t.co/91aYMUievn
@HelloGlasgowist @kingtuts @TheBarrowlands @BarrasParkFans @ScotsPostPunk @ccfest https://t.co/FC9iYBwy3d",stop cavalry say two walk'n'roll music tour that's one deal sign walk way buy christmas voucher
1.337728909366993e+18,2020-12-12 12:00:00+00:00,['1337728909366992899'],"Stop the cavalry! Did you say £28 for two to walk'n'roll on our music tours in 2021? That's one deal we can all sign up to... Walk this way to buy our Christmas vouchers: https://t.co/91aYMUievn
@scottishmusic @peoplemakeGLA @rabjourno @Glasgow_Live @BritPanopticon @nice_n_sleazy https://t.co/dVTko9lGIp",stop cavalry say two walk'n'roll music tour that's one deal sign walk way buy christmas voucher
1.3377193303694008e+18,2020-12-12 11:21:56+00:00,['1337719330369400833'],"The Curious Return Of Postcard Records...???

Today's headline has to be the growing rumours that Glasgow's fabled independent record label has woken up and is up to...something. Clues to be followed:

https://t.co/oCRflYhLO3

https://t.co/K3h1fqA7zh

https://t.co/poDHxa4jy7 https://t.co/h9CXF2pjYr",curious return postcard record today's headline growing rumour glasgow's fabled independent record label woken tosomething clue followed
1.337464668122534e+18,2020-12-11 18:30:00+00:00,['1337464668122533888'],"Santa baby, you can skip the sable, yacht and convertible - how about a gift voucher for two to walk'n'roll on our music tours next season? £28 for two, a neat saving of £8 on two full price adult tickets.
Hurry down the chimney: https://t.co/91aYMU0D6N https://t.co/pooGdTJWbx",santa baby skip sable yacht convertible gift voucher two walk'n'roll music tour next season two neat saving two full price adult ticket hurry chimney
1.3373665226924237e+18,2020-12-11 12:00:00+00:00,['1337366522692423680'],"We're making a human demand that you head over to our blog here https://t.co/tirIpQxA8K to read our Q&amp;A with @Amy__Macdonald on recording her album during the pandemic and winning @NordoffRobbins1 #ScottishMusicAwards
@scotsman_arts @TheBarrowlands @stlukesglasgow @DFConcerts https://t.co/1X9e1fHxnK",we're making human demand head blog read qampa recording album pandemic winning
1.3371098364843336e+18,2020-12-10 19:00:01+00:00,['1337109836484333568'],"Santa baby, you can skip the sable, yacht and convertible - how about a gift voucher for two to walk'n'roll on our music tours next season? £28 for two, a neat saving of £8 on two full price adult tickets.
Hurry down the chimney: https://t.co/91aYMU0D6N https://t.co/YZE0M8nFBW",santa baby skip sable yacht convertible gift voucher two walk'n'roll music tour next season two neat saving two full price adult ticket hurry chimney
1.3367398933938586e+18,2020-12-09 18:30:00+00:00,['1336739893393858561'],"Jingle bell rock alert! Our Christmas vouchers are the ideal gift for the walk'n'rollers in your life - £28 for two to join us on tour in our 2021 season, with lots of flexibility around booking and validity.
Buy here: https://t.co/91aYMU0D6N
#XmasGiftIdeas #ThingsToDoInGlasgow https://t.co/8Cidm9vH5i",jingle bell rock alert christmas voucher ideal gift walk'n'rollers life two join tour season lot flexibility around booking validity buy
1.3366568453232435e+18,2020-12-09 13:00:00+00:00,['1336656845323243520'],"We're making a human demand that you head over to our blog here https://t.co/tirIpQfZhc to read our Q&amp;A with @Amy__Macdonald on recording her album during the pandemic and winning @NordoffRobbins1 #ScottishMusicAwards
@scottishmusic @Scottish_M_N @ScotWim @scotsman_arts https://t.co/hqmQsnLv4f",we're making human demand head blog read qampa recording album pandemic winning
1.3366428087284e+18,2020-12-09 12:04:13+00:00,['1336642808728399874'],Grand stuff - and Amy's on our blog too: https://t.co/tirIpQfZhc https://t.co/dah8gPqGtj,grand stuff amy's blog
1.336385056810672e+18,2020-12-08 19:00:01+00:00,['1336385056810672131'],"We're making a human demand that you head over to our blog here https://t.co/tirIpQfZhc to read our Q&amp;A with @Amy__Macdonald on recording her album during the pandemic and winning @NordoffRobbins1 #ScottishMusicAwards
@peoplemakeGLA @Glasgow_Live @Shout_edin @MusikScottish https://t.co/5qLvphtvSW",we're making human demand head blog read qampa recording album pandemic winning
1.336294458086736e+18,2020-12-08 13:00:00+00:00,['1336294458086735873'],"Head over to our blog here https://t.co/tirIpQxA8K to read our Q&amp;A with @Amy__Macdonald on recording her album during the pandemic and winning @NordoffRobbins1 #ScottishMusicAwards
@Infectious_uk @HelloGlasgowist @TheBarrowlands @MusicNewsScot https://t.co/KftWJf7afy",head blog read qampa recording album pandemic winning
1.336025018854224e+18,2020-12-07 19:09:21+00:00,['1336025018854223873'],"Head over to our blog here https://t.co/tirIpQfZhc to read our Q&amp;A with @Amy__Macdonald on recording her album during the pandemic and winning @NordoffRobbins1 #ScottishMusicAwards
@scottishmusic @TheSMIA  @peoplemakeGLA @Glasgow_Live @Infectious_uk https://t.co/lXzAxK2cYN",head blog read qampa recording album pandemic winning
1.3356602813143572e+18,2020-12-06 19:00:01+00:00,['1335660281314357253'],"For those about to rock around the Christmas tree, we salute you...and urge you to make use of our Christmas voucher offer of £28 for two to walk'n'roll on our music tours in 2021. These boots were made for walking: https://t.co/91aYMUievn Okay, that's enough song titles for now. https://t.co/OHYCxs4jay",rock around christmas tree salute youand urge make use christmas voucher offer two walk'n'roll music tour boot made walking okay that's enough song title
