id,created_at,edit_history_tweet_ids,text,clean_text,non_english,nouns
1.4327381578045932e+18,2021-08-31 16:12:50+00:00,['1432738157804593155'],@elitebandwagon Go to work.,work,True,work 
1.4327296235409408e+18,2021-08-31 15:38:55+00:00,['1432729623540940801'],"@MsiDouglas @JoeStephenson96 Also, what is it with Chris Beech's weird arm cross pose thing? Very Brentian.",also chris beech's weird arm cross pose thing brentian,False,beech arm cross thing brentian 
1.432707566539264e+18,2021-08-31 14:11:16+00:00,['1432707566539264015'],Lyse Doucet is an absolute pro. https://t.co/AXarguYHKD,lyse doucet absolute pro,True,lyse doucet pro 
1.43269221770616e+18,2021-08-31 13:10:17+00:00,['1432692217706160134'],@Mendelpol His wife's American,wife's american,False,wife 
1.4326772556044943e+18,2021-08-31 12:10:50+00:00,['1432677255604494338'],@RossMcCaff Yeah that was the aim haha,yeah aim haha,False,yeah aim haha 
1.432673795823874e+18,2021-08-31 11:57:05+00:00,['1432673795823874055'],@RossMcCaff AND STILLLLLLL https://t.co/bgOrcskOm3,stilllllll,True,stilllllll 
1.4326611415583703e+18,2021-08-31 11:06:48+00:00,['1432661141558370305'],Me during this entire alpaca saga: https://t.co/bQZg1GLFFf,entire alpaca saga,False,alpaca saga 
1.4326377712697876e+18,2021-08-31 09:33:56+00:00,['1432637771269787650'],@oliver_todd Nerd,nerd,True,nerd 
1.432454180116091e+18,2021-08-30 21:24:24+00:00,['1432454180116090883'],@RMMJourno He was extremely withering and I loved it,extremely withering loved,False,
1.4324535417723372e+18,2021-08-30 21:21:52+00:00,['1432453541772337157'],"So far, I have high hopes 🤞🏼 https://t.co/z8OLWVLM8k",far high hope,False,hope 
1.4317327765213755e+18,2021-08-28 21:37:48+00:00,['1431732776521375761'],"@NickMurphy1995 With PMac in your side, you’ll be there and there abouts.",pmac side youll abouts,False,side youll 
1.4311711491577856e+18,2021-08-27 08:26:06+00:00,['1431171149157785601'],"@alexeptable @Beardynoise @RossMcCaff @ThatChris1209 @EwaSR @tom_usher_ Primrose Hill best view in Ldn. Hampstead and Highgate Woods beaut. Friern Country Park in Southgate expansive.

You have a bit of grass in Brixton with a shit lido that hipsters orgasm over.

I’m quite passionate about this debate.",primrose hill best view ldn hampstead highgate wood beaut friern country park southgate expansive bit grass brixton shit lido hipster orgasm quite passionate debate,False,view ldn hampstead highgate wood beaut country park bit brixton hipster debate 
1.4311690200620485e+18,2021-08-27 08:17:38+00:00,['1431169020062048257'],@RossMcCaff @ThatChris1209 @alexeptable @Beardynoise @EwaSR @tom_usher_ I don’t make the rules,dont make rule,False,rule 
1.4311677616240148e+18,2021-08-27 08:12:38+00:00,['1431167761624014848'],@ThatChris1209 @RossMcCaff @alexeptable @Beardynoise @EwaSR @tom_usher_ There’s a Morley’s 5 mins from ne in NW10. There’s really no excuse for South London to exist anymore.,morley min really excuse south london exist anymore,False,morley exist 
1.430904303791743e+18,2021-08-26 14:45:45+00:00,['1430904303791742988'],@fkcowdrey He'd have taken 70 at the start of the day!,he'd taken start day,False,day 
1.430900144170365e+18,2021-08-26 14:29:13+00:00,['1430900144170364933'],@ADSutherland_ I am well aware.,well aware,True,
1.4308997262919025e+18,2021-08-26 14:27:34+00:00,['1430899726291902475'],@ADSutherland_ Adam.,adam,True,adam 
1.430838611730174e+18,2021-08-26 10:24:43+00:00,['1430838611730173954'],@jackhardwick93 What in god's name is this,god's name,False,god name 
1.430664331507667e+18,2021-08-25 22:52:11+00:00,['1430664331507666948'],"@KerynSeal4 Yes I think I did, but with added improvement",yes think added improvement,False,think improvement 
1.4306490890168607e+18,2021-08-25 21:51:37+00:00,['1430649089016860674'],@jrgdutton Almost certainly,almost certainly,False,
1.4306423229209436e+18,2021-08-25 21:24:44+00:00,['1430642322920943619'],Narrator: Fred did not jinx Hameed,narrator fred jinx hameed,False,narrator 
1.4305625263251003e+18,2021-08-25 16:07:39+00:00,['1430562526325100545'],"@nickcricket @Mendelpol Given his lack of red ball innings this year, he may start tentative and then grow in, presuming he stays in. Hoping he does really well obv.",given lack red ball inning year may start tentative grow presuming stay hoping doe really well obv,False,lack ball year grow stay doe 
1.4305608990986854e+18,2021-08-25 16:01:11+00:00,['1430560899098685444'],"@nickcricket @Mendelpol Haha nah, I'm enjoying Haseeb too much for that.",haha nah i'm enjoying haseeb much,False,haha nah i haseeb 
1.4305604557648855e+18,2021-08-25 15:59:25+00:00,['1430560455764885512'],"Big jinx incoming, but Haseeb Hameed looks born to open the batting for England.",big jinx incoming haseeb hameed look born open batting england,False,jinx batting england 
1.430542978377003e+18,2021-08-25 14:49:58+00:00,['1430542978377003016'],@amarjourno Virat's face when Ishant threw one down on about 12th stump line &gt;&gt;&gt;&gt;,virat's face ishant threw one stump line gtgtgtgt,False,virat face ishant stump line gtgtgtgt 
1.4305213412712325e+18,2021-08-25 13:24:00+00:00,['1430521341271232514'],@Roisin_OConnor @heidistephens Loads of millennials discovering that 80s music is the best is a good thing IMO &gt;&gt;&gt;&gt;,load millennials discovering music best good thing imo gtgtgtgt,False,load music thing imo gtgtgtgt 
1.4304759654157926e+18,2021-08-25 10:23:41+00:00,['1430475965415792645'],@ScarlettSport Padded cells,padded cell,True,cell 
1.4304757978659348e+18,2021-08-25 10:23:01+00:00,['1430475797865934850'],"James Michael Anderson, OBE",james michael anderson obe,True,obe 
1.430468995329794e+18,2021-08-25 09:55:59+00:00,['1430468995329794054'],"@NinjaDave13 @JimmyECiego Absolutely, massively rooting.",absolutely massively rooting,False,
1.4304649587106652e+18,2021-08-25 09:39:57+00:00,['1430464958710665221'],@benjonescricket I think he's on a bit of a hiding to nothing/no win sitch so I hope he gets a run from Silverwood.,think he's bit hiding nothingno win sitch hope get run silverwood,False,think bit win sitch silverwood 
1.4304648378055557e+18,2021-08-25 09:39:28+00:00,['1430464837805555712'],"@benjonescricket Hmmm. I guess if he fails you take him to Aus in squad, knowing there's a proven Away Ashes performer to call on. But it's a tricky one you're right.",hmmm guess fails take squad knowing there's proven away ash performer call tricky one right,False,hmmm guess performer call right 
1.430463822419071e+18,2021-08-25 09:35:26+00:00,['1430463822419070976'],"@benjonescricket Been trying to fathom if this is a pick with Aus in mind, or just to salvage the India series. Or a bit of both. Would be dumb to not take him to Aus where we know he can perform, having picked him now.",trying fathom pick mind salvage india series bit would dumb take know perform picked,False,fathom pick mind salvage series bit perform 
1.430281865269846e+18,2021-08-24 21:32:24+00:00,['1430281865269846017'],"@Alexanderjrose1 I quite like James, but I was mainly focusing on Happe being dogshit",quite like james mainly focusing happe dogshit,False,happe dogshit 
1.4302809289585009e+18,2021-08-24 21:28:41+00:00,['1430280928958500867'],"@Alexanderjrose1 Of all the players on that pitch, I’m not sure deserves the criticism",player pitch sure deserves criticism,False,player pitch criticism 
1.4302390756849992e+18,2021-08-24 18:42:22+00:00,['1430239075684999171'],Back home 🌚 https://t.co/A6QnHODLg9,back home,False,home 
1.430207225105199e+18,2021-08-24 16:35:49+00:00,['1430207225105199110'],A true legend https://t.co/MyFivis5ct,true legend,True,legend 
1.4302056298183598e+18,2021-08-24 16:29:28+00:00,['1430205629818359820'],"@aidanmccartney @DomBooth19 @_joebray Oh here he is, Twitter's one Scunny fan.",twitter's one scunny fan,False,twitter scunny fan 
1.430205070017286e+18,2021-08-24 16:27:15+00:00,['1430205070017286157'],@DomBooth19 @_joebray Get that man a Pulitzer Prize.,get man pulitzer prize,True,man pulitzer 
1.430203622994944e+18,2021-08-24 16:21:30+00:00,['1430203622994944005'],@DomBooth19 @_joebray What a gig.,gig,False,gig 
1.4301916661961073e+18,2021-08-24 15:33:59+00:00,['1430191666196107267'],"@DamonMartin Cheers, have sent a DM.",cheer sent,False,cheer 
1.43018982788719e+18,2021-08-24 15:26:41+00:00,['1430189827887190017'],@DamonMartin Hi Damon can you follow me so I can DM? Thanks.,damon follow thanks,False,damon 
1.4301517680134103e+18,2021-08-24 12:55:27+00:00,['1430151768013410311'],"@JimmyECiego He's on a bit of a hiding to nothing really, what a time to be dropped in the deep end. I just hope they persevere with the Ashes in view.",he's bit hiding nothing really time dropped deep end hope persevere ash view,False,bit nothing time end hope ash view 
1.430150262342275e+18,2021-08-24 12:49:28+00:00,['1430150262342275092'],@JimmyECiego Reckon people are hoping he fails?,reckon people hoping fails,False,reckon 
1.4299183007131402e+18,2021-08-23 21:27:44+00:00,['1429918300713140225'],@BabatundeComedy It was deffo an afterthought from Liam haha,deffo afterthought liam haha,False,deffo haha 
1.4299177846795182e+18,2021-08-23 21:25:41+00:00,['1429917784679518216'],@kierandoody RIP,rip,True,rip 
1.4297737357463142e+18,2021-08-23 11:53:17+00:00,['1429773735746314243'],@ADSutherland_ What's he done?,what's done,False,
1.4297612660721009e+18,2021-08-23 11:03:44+00:00,['1429761266072100866'],@izzywestbury @telecricket Love this Izzy,love izzy,False,love izzy 
1.4295685178802872e+18,2021-08-22 22:17:49+00:00,['1429568517880287232'],Saw The Streets tonight. 10/10 would recommend https://t.co/ZnOqpO3EoJ,saw street tonight would recommend,False,street tonight 
1.429396302215979e+18,2021-08-22 10:53:30+00:00,['1429396302215979012'],@Mendelpol what's the issue?,what's issue,False,issue 
1.4291845484710257e+18,2021-08-21 20:52:03+00:00,['1429184548471025671'],@Ankaman616 My spirit animal cricketer. Doing the Lord’s work while looking like a ringer for my Sunday team,spirit animal cricketer lord work looking like ringer sunday team,False,spirit cricketer lord work ringer sunday team 
1.4291641363117097e+18,2021-08-21 19:30:57+00:00,['1429164136311709701'],"Tim David, the boy https://t.co/fyIzQjsv5p",tim david boy,False,tim david boy 
1.4291638288608911e+18,2021-08-21 19:29:44+00:00,['1429163828860891136'],OMG CRICKET,omg cricket,False,omg cricket 
1.4291538276771635e+18,2021-08-21 18:49:59+00:00,['1429153827677163522'],@benjonescricket Exactly. Get in the national curriculum.,exactly get national curriculum,False,curriculum 
1.4291525385620234e+18,2021-08-21 18:44:52+00:00,['1429152538562023425'],@benjonescricket I feel like the phrase “Stirlo hitting bombs” should be understood by every person on this planet without any context. You just know.,feel like phrase stirlo hitting bomb understood every person planet without context know,False,feel phrase stirlo bomb person planet context know 
1.4291452721148928e+18,2021-08-21 18:15:59+00:00,['1429145272114892810'],@ScarlettSport Can’t believe no one picked him earlier. Hope he gets an IPL gif,cant believe one picked earlier hope get ipl gif,False,gif 
1.429144637177045e+18,2021-08-21 18:13:28+00:00,['1429144637177044997'],@JimmyECiego My hero,hero,False,hero 
1.4291436038304727e+18,2021-08-21 18:09:22+00:00,['1429143603830472706'],"You come for the King 👑, you’d better not miss https://t.co/qJuuOr5oIU",come king youd better miss,False,king youd miss 
1.42913770822878e+18,2021-08-21 17:45:56+00:00,['1429137708228780038'],Imagine any franchise not picking Paul Stirling from the start,imagine franchise picking paul stirling start,False,franchise picking paul start 
1.42913345957496e+18,2021-08-21 17:29:03+00:00,['1429133459574960130'],We be Hundreding 🏏 https://t.co/kZKcpP69Cg,hundreding,True,
1.4291194679766016e+18,2021-08-21 16:33:27+00:00,['1429119467976601612'],Martin Allen inbound in 5…4…3…. https://t.co/LgXESvGLnW,martin allen inbound,False,martin allen inbound 
1.4291188443044946e+18,2021-08-21 16:30:58+00:00,['1429118844304494596'],@JoeStephenson96 Yeah normal O’s teams wouldn’t have come back from what sounded like a woeful first half. He’s the boy and I think we should be there and there about this season.,yeah normal team wouldnt come back sounded like woeful first half boy think season,False,yeah team half boy season 
1.4291138959318098e+18,2021-08-21 16:11:19+00:00,['1429113895931809796'],@cricket_badger Oh such a shame https://t.co/qK4O1cTh4a,shame,False,shame 
1.4291086310106767e+18,2021-08-21 15:50:23+00:00,['1429108631010676740'],"I present, I am mostly excited about John Yems’ post match interview today. https://t.co/RxSbTAam7v",present mostly excited john yems post match interview today,False,john match interview today 
1.4291080655681864e+18,2021-08-21 15:48:09+00:00,['1429108065568186379'],@JoeStephenson96 I’ve not seen him play yet cos he’s been injured but my all accounts he’s a huge shithouse and that is something I am extremely on board with,ive seen play yet injured account huge shithouse something extremely board,False,play account shithouse something board 
1.429104983274922e+18,2021-08-21 15:35:54+00:00,['1429104983274921988'],@JoeStephenson96 Ah the big talk prick has scored 😊,big talk prick scored,False,talk prick 
1.429102585483563e+18,2021-08-21 15:26:22+00:00,['1429102585483563009'],@JoeStephenson96 I’m not really following as I’m at Lords but I’d bite you hand off right now for a draw,really following lord bite hand right draw,False,lord hand draw 
1.4291004476342682e+18,2021-08-21 15:17:52+00:00,['1429100447634268162'],"@JoeStephenson96 First ever start, clearly a baptism of fire. First choice LB injured. Surprised abt first half as we’ve been great so far this season. Read your pen was harsh by rumoured dog botherer Bobby Madley.",first ever start clearly baptism fire first choice injured surprised abt first half weve great far season read pen harsh rumoured dog botherer bobby madley,False,baptism fire choice half season harsh botherer bobby madley 
1.42906649083e+18,2021-08-21 13:02:56+00:00,['1429066490830000131'],@NickHowson Happy days 🙏🏼,happy day,True,day 
1.4290657344753705e+18,2021-08-21 12:59:56+00:00,['1429065734475370498'],@NickHowson Nice one. Is it clearing up a bit?,nice one clearing bit,False,clearing bit 
1.4290622592009093e+18,2021-08-21 12:46:07+00:00,['1429062259200909312'],@NickHowson Is the wicket bang central. Working out which stand to sit in when I get there,wicket bang central working stand sit get,False,wicket stand sit 
1.428997684526977e+18,2021-08-21 08:29:32+00:00,['1428997684526977025'],@cricket_badger Pathetic,pathetic,False,
1.4288414883733873e+18,2021-08-20 22:08:52+00:00,['1428841488373387267'],@JamieTurley5 Awesome news and richly deserved,awesome news richly deserved,False,news 
1.428836971644871e+18,2021-08-20 21:50:55+00:00,['1428836971644870658'],@MrHarryCole @ChiefEditorMG Please tell,please tell,False,please 
1.428697800754221e+18,2021-08-20 12:37:54+00:00,['1428697800754221058'],"@JElgott This is bloody awesome, always my dream to read the news. Well done mate.",bloody awesome always dream read news well done mate,False,news mate 
1.4286789149190922e+18,2021-08-20 11:22:51+00:00,['1428678914919092226'],"@DanAuton2590 Agree, Wilkinson is the one that baffles me most. Reckon Jackett would've got him purring, but I equally don't miss him.",agree wilkinson one baffle reckon jackett would've got purring equally miss,False,wilkinson baffle reckon jackett 
1.4286775928744264e+18,2021-08-20 11:17:36+00:00,['1428677592874426376'],@DanAuton2590 The upgrades we've made over the summer are frightening.,upgrade we've made summer frightening,False,upgrade summer frightening 
1.4286609247773696e+18,2021-08-20 10:11:22+00:00,['1428660924777369602'],@nickcricket @BerbaSpinCric Middlesex are a unique county in this regard. Always perceived to be rich but I'm pretty sure without the MCC/Lords they'd be poorer than Derbyshire.,middlesex unique county regard always perceived rich i'm pretty sure without mcclords they'd poorer derbyshire,False,middlesex county regard i sure derbyshire 
1.428659980102742e+18,2021-08-20 10:07:37+00:00,['1428659980102742017'],"@BerbaSpinCric Apparently we were in for Jordan and Salt, and ended up with Mark bloody Stoneman",apparently jordan salt ended mark bloody stoneman,False,salt mark bloody stoneman 
1.428644755358036e+18,2021-08-20 09:07:07+00:00,['1428644755358035969'],Gary Cahill to Bournemouth is one of those transfers you feel like has already happened 13 times in history.,gary cahill bournemouth one transfer feel like already happened time history,False,gary cahill transfer feel time history 
1.4282992056307016e+18,2021-08-19 10:14:01+00:00,['1428299205630701571'],@elitebandwagon @TheBarmyArmy Why aren't you playing?,playing,False,
1.4280245720378e+18,2021-08-18 16:02:44+00:00,['1428024572037799944'],@awinehouse1 Ode Spice.,ode spice,True,ode spice 
1.4280141037008364e+18,2021-08-18 15:21:08+00:00,['1428014103700836355'],@HrryBtlr @annoynya Don’t disrespect the king,dont disrespect king,False,dont disrespect king 
1.4280118245579858e+18,2021-08-18 15:12:04+00:00,['1428011824557985794'],@annoynya He really did have to be dropped. But I hope he comes back one day.,really dropped hope come back one day,False,hope day 
1.4280116126492344e+18,2021-08-18 15:11:14+00:00,['1428011612649234437'],@annoynya I love it.,love,True,love 
1.428011084066304e+18,2021-08-18 15:09:08+00:00,['1428011084066304000'],"@benjonescricket Do you think they've picked him with Ashes in mind so he has a run up of games, or purely for this series?",think they've picked ash mind run game purely series,False,mind game series 
1.4280109672423547e+18,2021-08-18 15:08:40+00:00,['1428010967242354690'],@JimmyECiego Cricket Twitter must be fuming,cricket twitter must fuming,False,cricket twitter 
1.427732663474004e+18,2021-08-17 20:42:47+00:00,['1427732663474003978'],@thecricketmen Hahahaha I’m usually decent at detecting lols but I wasn’t sure. I sincerely hope they never consider Livingstone for tests.,hahahaha usually decent detecting lols wasnt sure sincerely hope never consider livingstone test,False,hahahaha detecting test 
1.4277313921888952e+18,2021-08-17 20:37:44+00:00,['1427731392188895233'],@thecricketmen 😂 it’s not April 1st,april,False,april 
1.4276208216867062e+18,2021-08-17 13:18:22+00:00,['1427620821686706191'],"@JoeStephenson96 You could easily take a hammer to it, for the right price",could easily take hammer right price,False,price 
1.4275848151513866e+18,2021-08-17 10:55:17+00:00,['1427584815151386630'],"@thecricketmen He's scored runs galore in red ball (domestically) since being dropped, and his game clearly suited to Aus. Do we want to win the Ashes, or be whitewashed?",he's scored run galore red ball domestically since dropped game clearly suited want win ash whitewashed,False,run ball game ash 
1.4275846477903176e+18,2021-08-17 10:54:37+00:00,['1427584647790317577'],"@Cricketjim84 @thecricketmen And I think I read that he's averaged over 50 for Middlesex and Yorkshire in red ball since being dropped from the test side. He hasn't played as much granted, but gone away and scored the runs Ed Smith asked him to do,",think read he's averaged middlesex yorkshire red ball since dropped test side played much granted gone away scored run smith asked,False,think middlesex yorkshire ball side smith 
1.4275833427241247e+18,2021-08-17 10:49:26+00:00,['1427583342724124676'],"@thecricketmen But looking ahead to an away Ashes, he averaged 40 last Ashes down under, so logically would be far better suited/not be as much of a rabbit in the headlights than the rest of the top 3. And has got better as a player since his last test run.",looking ahead away ash averaged last ash logically would far better suitednot much rabbit headlight rest top got better player since last test run,False,ash rabbit rest top player test run 
1.427408194243076e+18,2021-08-16 23:13:28+00:00,['1427408194243076104'],@TheRunOutBlog1 @HazNicoll @cricket_badger Averaged 40 last time down under. What England wouldn’t give for that now,averaged last time england wouldnt give,False,time england 
1.4272832138279526e+18,2021-08-16 14:56:50+00:00,['1427283213827952649'],"@hansmollman That's business, Lord Sugar.",that's business lord sugar,False,business lord sugar 
1.4272827626256916e+18,2021-08-16 14:55:02+00:00,['1427282762625691650'],"@hansmollman Best customer until now, but soon to be second best when Jai speaks to his next one.",best customer soon second best jai speaks next one,False,customer jai 
1.427261745622618e+18,2021-08-16 13:31:32+00:00,['1427261745622618120'],@BabatundeComedy Same energy https://t.co/guErVAgQKu,energy,True,energy 
1.4272573470643528e+18,2021-08-16 13:14:03+00:00,['1427257347064352769'],"@TomDavidson09 @Jonny_Singer Short in time, long in feels.",short time long feel,False,time feel 
1.4272571564417106e+18,2021-08-16 13:13:17+00:00,['1427257156441710596'],It’s gonna be a long afternoon @Jonny_Singer https://t.co/r78Cc635p3,gonna long afternoon,False,gon afternoon 
1.4272553663965637e+18,2021-08-16 13:06:11+00:00,['1427255366396563461'],@SamuelRobertW We're looking at the L at this rate,we're looking rate,False,rate 
1.4272546801958994e+18,2021-08-16 13:03:27+00:00,['1427254680195899399'],@SamuelRobertW Funny though,funny though,False,
1.4272541879230587e+18,2021-08-16 13:01:30+00:00,['1427254187923058690'],Should've opened with Buttler and Bairstow in T20 mode.,opened buttler bairstow mode,False,buttler bairstow mode 
1.4272517754642227e+18,2021-08-16 12:51:54+00:00,['1427251775464222725'],Dom Sibley 12 (124) in this chase IMO.,dom sibley chase imo,False,dom sibley chase imo 
1.427251501433557e+18,2021-08-16 12:50:49+00:00,['1427251501433556992'],"Whack on some Eau de Sauvage to call in the players, you truly love to see it.",whack eau sauvage call player truly love see,False,whack eau sauvage call player see 
1.42725096616491e+18,2021-08-16 12:48:42+00:00,['1427250966164910087'],Was Virat just applying aftershave?,virat applying aftershave,False,virat aftershave 
1.4272396547141304e+18,2021-08-16 12:03:45+00:00,['1427239654714130432'],Why don't England's bowlers simply just bowl some Yorkers or some balls at the stumps against two tail enders? #ENGvIND,england's bowler simply bowl yorkers ball stump two tail enders,False,england bowler tail 
1.4272389168564265e+18,2021-08-16 12:00:49+00:00,['1427238916856426497'],@NikhilSaglani Do you remember a single yorker being bowled this morn?,remember single yorker bowled morn,False,yorker 
1.4272376455837983e+18,2021-08-16 11:55:46+00:00,['1427237645583798273'],@NikhilSaglani Pain,pain,True,pain 
1.4272375501508485e+18,2021-08-16 11:55:23+00:00,['1427237550150848513'],@DomBooth19 @willis_macp I take my helmet off and salute when I get to 15 tbf.,take helmet salute get tbf,False,helmet salute tbf 
1.4269583721973432e+18,2021-08-15 17:26:02+00:00,['1426958372197343234'],Why don’t Manchester City simply sign some more players ?,dont manchester city simply sign player,False,manchester city player 
1.4269581214408786e+18,2021-08-15 17:25:02+00:00,['1426958121440878595'],@AndreasHale Murica,murica,True,murica 
1.4269573970342134e+18,2021-08-15 17:22:09+00:00,['1426957397034213381'],Spurs couldn’t beat Leyton Orient in pre-season. Massive club.,spur couldnt beat leyton orient preseason massive club,False,spur couldnt orient preseason club 
1.4265741050217144e+18,2021-08-14 15:59:05+00:00,['1426574105021714441'],"Without getting carried away, we’re going up as champions with a record points tally and are also going to win the FA Cup and the JPT #lofc https://t.co/pRK2TwtsEq",without getting carried away going champion record point tally also going win cup jpt,False,champion record point cup jpt 
1.4265683932604252e+18,2021-08-14 15:36:23+00:00,['1426568393260425223'],That goal was an absolutely brilliant team effort from back to front. Pure class #lofc,goal absolutely brilliant team effort back front pure class,False,goal team effort pure class 
1.426543641544233e+18,2021-08-14 13:58:02+00:00,['1426543641544232961'],Home 🏠 https://t.co/4OfsoIz0QE,home,True,home 
1.4265305846507848e+18,2021-08-14 13:06:09+00:00,['1426530584650784773'],A shoutout to the absolutely outstanding Karen behind Andrew Strauss at the cricket yesterday. https://t.co/RuzEWQSz4O,shoutout absolutely outstanding karen behind andrew strauss cricket yesterday,False,shoutout strauss cricket yesterday 
1.4262832083002368e+18,2021-08-13 20:43:10+00:00,['1426283208300236800'],@KeejayOV3 @WhatsApp Kwame seems like a geezer,kwame seems like geezer,True,kwame geezer 
1.4262230777346826e+18,2021-08-13 16:44:14+00:00,['1426223077734682629'],"@RajSark65028156 Hi Raj, can you follow so I can DM? Thanks!",raj follow thanks,False,raj 
1.426193266656125e+18,2021-08-13 14:45:46+00:00,['1426193266656124933'],@benjonescricket The purists all over it though.,purist though,False,purist 
1.4261819009269228e+18,2021-08-13 14:00:37+00:00,['1426181900926922754'],@DannyCollins89 Don’t do it,dont,True,dont 
1.426175970768302e+18,2021-08-13 13:37:03+00:00,['1426175970768302087'],@DannyCollins89 Daniel.,daniel,True,daniel 
1.4261279049001083e+18,2021-08-13 10:26:03+00:00,['1426127904900108290'],"I’m sure Frankie Dettori isn’t Andy Murray’s new father-in-law, but if that was the case I would *love* to see that documentary. https://t.co/rnha3VS5vd",sure frankie dettori isnt andy murray new fatherinlaw case would love see documentary,False,frankie dettori isnt fatherinlaw case 
1.426115824436269e+18,2021-08-13 09:38:03+00:00,['1426115824436269060'],@miller_cricket That's inadvertently a very poignant photo. terrific stuff.,that's inadvertently poignant photo terrific stuff,False,photo terrific stuff 
