id,created_at,edit_history_tweet_ids,text,clean_text,nouns
1.3824196804056228e+18,2021-04-14 19:45:10+00:00,['1382419680405622788'],@The_Dark_Horse But not Caribbean quails eggs and caviar?, but not caribbean quails eggs and caviar,quail caviar
1.3824167817724723e+18,2021-04-14 19:33:39+00:00,['1382416781772472324'],I've never seen Luther. Does Idris Elba spend a lot of time eating in it?,i've never seen luther does idris elba spend a lot of time eating in it,luther time
1.3820494610698322e+18,2021-04-13 19:14:03+00:00,['1382049461069832199'],This must be about the 1000th time that thing that apparently never happens in unisex toilets/changing rooms has happened. https://t.co/gizsBFpkkK,this must be about the time that thing that apparently never happens in unisex toiletschanging rooms has happened ,time thing toiletschanging room
1.3818906917653135e+18,2021-04-13 08:43:09+00:00,['1381890691765313538'],"@sport_simon Daft thing is, he would have been furious about it.", daft thing is he would have been furious about it,daft thing
1.3818902887136297e+18,2021-04-13 08:41:33+00:00,['1381890288713629699'],"Saw a wonderful documentary last night on Sky Arts, Glen Campbell: I'll Be Me. About his final tour and his battle with Alzheimer's. Tough watch at times, but very moving.",saw a wonderful documentary last night on sky arts glen campbell i'll be me about his final tour and his battle with alzheimers tough watch at times but very moving,documentary night campbell tour battle alzheimers watch time
1.3813732072912937e+18,2021-04-11 22:26:51+00:00,['1381373207291293697'],Hang on a minute!,hang on a minute,hang minute
1.381365483539202e+18,2021-04-11 21:56:10+00:00,['1381365483539202054'],"@gkeegs75 Just makes you have evil thoughts, almost willing Matsuyama to top it into Rae's Creek, take his shoes and socks off and take six to get it out.", just makes you have evil thoughts almost willing matsuyama to top it into rae's creek take his shoes and socks off and take six to get it out,thought matsuyama shoe sock
1.3813566399582085e+18,2021-04-11 21:21:01+00:00,['1381356639958208514'],There are few things more anticlimactic in life than a one horse race on the final day of a golf major. And presumably disastrous for viewing figures.,there are few things more anticlimactic in life than a one horse race on the final day of a golf major and presumably disastrous for viewing figures,thing life horse race golf figure
1.38098453402871e+18,2021-04-10 20:42:25+00:00,['1380984534028709901'],"@RussHill9 It did used to happen, in Germany and Italy, and it was always said that we were above all that. Not any more.", it did used to happen in germany and italy and it was always said that we were above all that not any more,germany italy
1.3809842651486167e+18,2021-04-10 20:41:20+00:00,['1380984265148616706'],"@Sam_B180 That's not the point. When you get a scorecard like that, you know she never stood a chance. She might as well have bowed out in round one, the whole thing was a charade.", that's not the point when you get a scorecard like that you know she never stood a chance she might as well have bowed out in round one the whole thing was a charade,point scorecard chance round thing charade
1.380983268980441e+18,2021-04-10 20:37:23+00:00,['1380983268980441090'],"When foreign boxers keep coming to the UK - week after week, month after month - and getting cheated on the scorecards, at what point do you call it cheating?",when foreign boxers keep coming to the uk  week after week month after month  and getting cheated on the scorecards at what point do you call it cheating,boxer week week month month scorecard point
1.3806618820093133e+18,2021-04-09 23:20:18+00:00,['1380661882009313285'],@KKMUFC2020 I'd imagine there was pressure applied from the highest level., i'd imagine there was pressure applied from the highest level,imagine pressure level
1.3806605933890929e+18,2021-04-09 23:15:11+00:00,['1380660593389092865'],"The BBC can't seem to do anything right at the moment. All they had to do was have one channel broadcasting 24-hour Philip, and only a lunatic would have complained. It's like they're intent on irritating people.",the bbc can't seem to do anything right at the moment all they had to do was have one channel broadcasting philip and only a lunatic would have complained it's like they're intent on irritating people,anything moment channel broadcasting philip intent people
1.380608455396954e+18,2021-04-09 19:48:00+00:00,['1380608455396954114'],"@smorrison85 He married into it in 1947, when the empire was crumbling. As for the Commonwealth, it's voluntary.", he married into it in when the empire was crumbling as for the commonwealth it's voluntary,empire commonwealth
1.3806034692754678e+18,2021-04-09 19:28:12+00:00,['1380603469275467793'],"@smorrison85 Yes, because Stalin - who was responsible for the deaths of tens of millions of people - is just like Prince Philip, who said some dodgy things now and again.", yes because stalin  who was responsible for the deaths of tens of millions of people  is just like prince philip who said some dodgy things now and again,stalin death million people prince philip thing
1.3805911854593516e+18,2021-04-09 18:39:23+00:00,['1380591185459351557'],It must tear these people up inside when they discover that Prince Philip actually did something worthwhile in his youth - as in fighting actual Nazis - while they're spending theirs crouched over a laptop saying horrible things about an old bloke who's just died.,it must tear these people up inside when they discover that prince philip actually did something worthwhile in his youth  as in fighting actual nazis  while they're spending theirs crouched over a laptop saying horrible things about an old bloke who's just died,people prince something worthwhile youth nazi spending thing bloke
1.3802707574906143e+18,2021-04-08 21:26:07+00:00,['1380270757490614273'],"I must admit, I'm not that impressed with Elephant Man's range of superpowers.",i must admit i'm not that impressed with elephant man's range of superpowers,range superpower
1.3799246024245944e+18,2021-04-07 22:30:37+00:00,['1379924602424594433'],"BBC news bosses have lost it. No mention of Belfast on Newsnight, but a big chat about voting rights in Georgia, which I think I can safely say is a fringe issue for most of the British public. They seem to think we're America.",bbc news bosses have lost it no mention of belfast on newsnight but a big chat about voting rights in georgia which i think i can safely say is a fringe issue for most of the british public they seem to think we're america,news boss mention belfast newsnight chat right georgia issue public america
1.379767820544774e+18,2021-04-07 12:07:37+00:00,['1379767820544774147'],"If everything people said 'should be on the school curriculum' was on the school curriculum, a term would last about 25 years.",if everything people said should be on the school curriculum was on the school curriculum a term would last about years,everything people school curriculum school curriculum term year
1.379560755738055e+18,2021-04-06 22:24:49+00:00,['1379560755738054656'],"@MarcDavenant Excellent article all about that photo here. A year later, one of the Harrovians was dead. Within a few years, the rest of them were fighting in WW2. https://t.co/UtjDfh6OYu", excellent article all about that photo here a year later one of the harrovians was dead within a few years the rest of them were fighting in ww ,article photo year harrovians year rest
1.3792234682401464e+18,2021-04-06 00:04:34+00:00,['1379223468240146433'],@mclyons4 @The_GetawayGirl @theregoesrichie A part of me dies whenever I hear a British person say 'period' instead of 'full stop'.,   a part of me dies whenever i hear a british person say period instead of full stop,part person period stop
1.3791839017683067e+18,2021-04-05 21:27:20+00:00,['1379183901768306690'],@JMPSimor @philosophybites Johnny Ball.,  johnny ball,johnny ball
1.3791621333893243e+18,2021-04-05 20:00:50+00:00,['1379162133389324298'],Textbook trophy lift by Rout. Well done that man.,textbook trophy lift by rout well done that man,textbook trophy lift rout
1.379161378045497e+18,2021-04-05 19:57:50+00:00,['1379161378045497344'],@Bobby_Seagull Sad to see. Like watching a man blast the ball over from two yards out., sad to see like watching a man blast the ball over from two yards out,ball yard
1.3791607432879145e+18,2021-04-05 19:55:19+00:00,['1379160743287914498'],Davies will be haunted by the name Campbell-Bannerman until his dying days. The man's broken.,davies will be haunted by the name campbellbannerman until his dying days the man's broken,davy name campbellbannerman broken
1.3791588061486203e+18,2021-04-05 19:47:37+00:00,['1379158806148620290'],"@tomhamiltonespn As soon as I hear a woodwind instrument, I go Grieg. It's my system and I'm sticking with it.", as soon as i hear a woodwind instrument i go grieg it's my system and i'm sticking with it,woodwind instrument grieg system
1.379156020849705e+18,2021-04-05 19:36:33+00:00,['1379156020849704962'],I very much enjoy Rout's angry thinking face.,i very much enjoy rout's angry thinking face,enjoy thinking face
1.3791553053308314e+18,2021-04-05 19:33:42+00:00,['1379155305330831364'],"The heart says Warwick, the head says Magdalene. I fear the all-round game of Magdalene might be too much for the Braid-Rout strike partnership.",the heart says warwick the head says magdalene i fear the allround game of magdalene might be too much for the braidrout strike partnership,heart head magdalene allround game magdalene braidrout strike partnership
1.3791324115319194e+18,2021-04-05 18:02:44+00:00,['1379132411531919367'],@Smith227Steve It crossed my mind. I feared it would detract from the gravity of my argument., it crossed my mind i feared it would detract from the gravity of my argument,mind gravity argument
1.3791127334514196e+18,2021-04-05 16:44:32+00:00,['1379112733451419649'],"@TrivPursuits @Oliver___Brett I don't make my dog jump over massive fences that might scare, injure or kill her. These conversations about my dog are just weird.",  i don't make my dog jump over massive fences that might scare injure or kill her these conversations about my dog are just weird,jump fence injure conversation
1.3791124399130624e+18,2021-04-05 16:43:23+00:00,['1379112439913062400'],"@rupertcollier @RDC_87 What's my dog's taste in food got to do with horses being made to jump over fences? We know dogs like raw meat, which is what I give her, because they're descended from wolves. And wolves eat meat.",  what's my dog's taste in food got to do with horses being made to jump over fences we know dogs like raw meat which is what i give her because they're descended from wolves and wolves eat meat,taste food horse fence meat wolf wolf meat
1.3791082292890255e+18,2021-04-05 16:26:39+00:00,['1379108229289025540'],@Oliver___Brett But you don't actually know. You're just assuming. And did you ask all the horses at the meeting if they enjoyed themselves?, but you don't actually know you're just assuming and did you ask all the horses at the meeting if they enjoyed themselves,horse meeting
1.379089869436285e+18,2021-04-05 15:13:41+00:00,['1379089869436284932'],"@RDC_87 I didn't say that. But intuition isn't the same as concrete knowledge. The fact is, we will never really know if they enjoy it or not, people are just guessing. Although I suspect advances in brain scanning will give us a better idea.", i didn't say that but intuition isn't the same as concrete knowledge the fact is we will never really know if they enjoy it or not people are just guessing although i suspect advances in brain scanning will give us a better idea,concrete fact people advance brain scanning idea
1.3790865318146253e+18,2021-04-05 15:00:26+00:00,['1379086531814625283'],"@RDC_87 David Attenborough, at least as far as I know, has never sat on a gorilla's back and made it jump over massive fences while whipping it.", david attenborough at least as far as i know has never sat on a gorilla's back and made it jump over massive fences while whipping it,david attenborough jump fence
1.379085348580565e+18,2021-04-05 14:55:43+00:00,['1379085348580564993'],@RDC_87 How does anyone know what their behaviour really means? They're not horses., how does anyone know what their behaviour really means they're not horses,anyone behaviour horse
1.3790839677863322e+18,2021-04-05 14:50:14+00:00,['1379083967786332165'],"Until someone shows me a racehorse that can talk, I will find the claim that horses 'enjoy' racing laughable. And I say that as someone who enjoys the Grand National.",until someone shows me a racehorse that can talk i will find the claim that horses enjoy racing laughable and i say that as someone who enjoys the grand national,someone show racehorse claim someone
1.3787963359068815e+18,2021-04-04 19:47:17+00:00,['1378796335906881539'],Movie trivia: Grease's director deliberately cast an older woman as Rizzo because an original sub-plot (later cut) had her failing and re-sitting her home economics exam 16 years in a row.,movie trivia grease's director deliberately cast an older woman as rizzo because an original subplot later cut had her failing and resitting her home economics exam years in a row,movie trivia director woman rizzo subplot failing home economics year
1.3784608542455562e+18,2021-04-03 21:34:12+00:00,['1378460854245556224'],I've got a very bad feeling about that Herring uppercut.,i've got a very bad feeling about that herring uppercut,herring uppercut
1.3741037340541747e+18,2021-03-22 21:00:34+00:00,['1374103734054174723'],"Looks like Wong's having some kind of breakdown, trying to eat his plastic cup down the stretch.",looks like wong's having some kind of breakdown trying to eat his plastic cup down the stretch,look kind breakdown plastic stretch
1.3741034829873807e+18,2021-03-22 20:59:34+00:00,['1374103482987380743'],"Kohn will have to go directly to his masseur after this, poor bloke carried his team-mates for 30 minutes.",kohn will have to go directly to his masseur after this poor bloke carried his teammates for minutes,kohn masseur bloke teammate minute
1.3740996416676168e+18,2021-03-22 20:44:18+00:00,['1374099641667616779'],"@Chris18152986 A formidable strike partnership, no doubt.", a formidable strike partnership no doubt,strike partnership doubt
1.3740981235769713e+18,2021-03-22 20:38:16+00:00,['1374098123576971277'],"@TonahN Defo, it's all on Kohn for Imperial.", defo it's all on kohn for imperial,defo kohn
1.3740975211574764e+18,2021-03-22 20:35:53+00:00,['1374097521157476353'],"Set to be one of the great University Challenge semi-finals, I see Kohn taking Warwick to the cleaners.",set to be one of the great university challenge semifinals i see kohn taking warwick to the cleaners,university challenge semifinal warwick cleaner
1.3733994198156247e+18,2021-03-20 22:21:52+00:00,['1373399419815624716'],"Brilliant Ben MacIntyre doc on BBC4 at 1035, Double Agent: The Eddie Chapman Story (best watched with a packet of Choco Leibniz).",brilliant ben macintyre doc on bbc at double agent the eddie chapman story best watched with a packet of choco leibniz,macintyre agent story packet choco leibniz
1.3733972088050934e+18,2021-03-20 22:13:05+00:00,['1373397208805093382'],"By the way, Sam Warburton is a very good pundit. Seems almost too nice to have been a captain. Not like Martin Johnson, he's still got an evil glint. He's good too.",by the way sam warburton is a very good pundit seems almost too nice to have been a captain not like martin johnson he's still got an evil glint he's good too,warburton pundit captain martin johnson glint
1.3733955719527383e+18,2021-03-20 22:06:35+00:00,['1373395571952738313'],"Interesting fact about Jamie Roberts - his neck is so thick, he is the only man in Wales to use a shirt horn.",interesting fact about jamie roberts  his neck is so thick he is the only man in wales to use a shirt horn,fact jamie robert neck wale shirt horn
1.3733919610512384e+18,2021-03-20 21:52:14+00:00,['1373391961051238400'],How can you send two men to the bin and then warn the third bloke for doing the same thing?,how can you send two men to the bin and then warn the third bloke for doing the same thing,bloke thing
1.373389314160214e+18,2021-03-20 21:41:43+00:00,['1373389314160214016'],"Modern defences are just ludicrously good. Once upon a time, when a player got over the line, he usually scored a try. Nowadays, five 16st maniacs appear from nowhere and assault him.",modern defences are just ludicrously good once upon a time when a player got over the line he usually scored a try nowadays five maniacs appear from nowhere and assault him,defence time player line maniac
1.373379294781698e+18,2021-03-20 21:01:54+00:00,['1373379294781698048'],"@jamespeacock79 Haha. I actually just thought to myself, 'Shit, people might be worrying about me after that.' Don't worry, I sometimes mix it up and get some Jaffa Cakes.", haha i actually just thought to myself shit people might be worrying about me after that don't worry i sometimes mix it up and get some jaffa cakes,people jaffa cake
1.373376007563051e+18,2021-03-20 20:48:50+00:00,['1373376007563051011'],"I must say this rugby makes a pleasant change from my usual Saturday night lockdown routine, which consists of a lonely trudge to Spar, in the forlorn hope that eating an entire packet of Choco Leibniz will lift the mood.",i must say this rugby makes a pleasant change from my usual saturday night lockdown routine which consists of a lonely trudge to spar in the forlorn hope that eating an entire packet of choco leibniz will lift the mood,rugby change night lockdown routine trudge hope packet choco leibniz mood
1.373348043060314e+18,2021-03-20 18:57:43+00:00,['1373348043060314113'],@TulsenTollett You too mate! Hope all well. Stand by for a rugby league book in the summer!, you too mate hope all well stand by for a rugby league book in the summer,hope stand rugby league book summer
1.3733446363543716e+18,2021-03-20 18:44:11+00:00,['1373344636354371585'],@TulsenTollett And presumably you risk getting a horrible big knee to the temple!, and presumably you risk getting a horrible big knee to the temple,knee temple
1.3733440209451213e+18,2021-03-20 18:41:44+00:00,['1373344020945121293'],"@TulsenTollett As a former pro, Tulsen, is it also not the case that if you go low rather than stand tall, you risk someone like Vunipola running straight over the top of you?", as a former pro tulsen is it also not the case that if you go low rather than stand tall you risk someone like vunipola running straight over the top of you,tulsen case someone vunipola
1.3733069287225467e+18,2021-03-20 16:14:21+00:00,['1373306928722546689'],@SquidgeRugby @Damage_13 @mackayac It's irrelevant how much better Italy are than the rest. Those other teams aren't going to close the gap unless you offer them incentives. It would also improve the competition. Any Italy game is stale and inevitable.,   it's irrelevant how much better italy are than the rest those other teams aren't going to close the gap unless you offer them incentives it would also improve the competition any italy game is stale and inevitable,italy rest team competition game
1.3733053767671603e+18,2021-03-20 16:08:11+00:00,['1373305376767160321'],"@mackayac @SquidgeRugby @Damage_13 Unless you give them something to aim for, they're not going to get any better. It's a self-fulfilling prophesy.",   unless you give them something to aim for they're not going to get any better it's a selffulfilling prophesy,something selffulfilling prophesy
1.3733046849460756e+18,2021-03-20 16:05:26+00:00,['1373304684946075654'],"@SquidgeRugby @Damage_13 @mackayac Why should other aspiring countries have to hang about on the sidelines for a decade, waiting for some Italian kids to maybe come good some day?",   why should other aspiring countries have to hang about on the sidelines for a decade waiting for some italian kids to maybe come good some day,country sideline decade
1.3732979369736233e+18,2021-03-20 15:38:37+00:00,['1373297936973623299'],If after this game the pundits don't address the question a lot of fans are asking - What is the point of Italy in the Six Nations? - they're not doing their job properly.,if after this game the pundits don't address the question a lot of fans are asking  what is the point of italy in the six nations  they're not doing their job properly,game pundit question point italy nation
1.3722751612028396e+18,2021-03-17 19:54:28+00:00,['1372275161202839554'],"Excellent art fraud doc on Netflix, Made You Look. Reveals the absurdity of the art market, that a painting can be a masterpiece worth $10m one day and a piece of junk the next, even though it hasn't changed a single stroke.",excellent art fraud doc on netflix made you look reveals the absurdity of the art market that a painting can be a masterpiece worth m one day and a piece of junk the next even though it hasn't changed a single stroke,fraud netflix absurdity market painting worth piece junk stroke
1.371925656754299e+18,2021-03-16 20:45:40+00:00,['1371925656754298882'],"I watched Mank, on Netflix. It was very good.",i watched mank on netflix it was very good,mank netflix
1.371590126585979e+18,2021-03-15 22:32:23+00:00,['1371590126585978888'],"Mank, Netflix - worth watching?",mank netflix  worth watching,mank netflix
1.3711914999840932e+18,2021-03-14 20:08:23+00:00,['1371191499984093187'],@danroan Thanks Dan! I hate reading old articles of mine. But you know? This one's not bad., thanks dan i hate reading old articles of mine but you know this one's not bad,thanks article mine
1.371146179103363e+18,2021-03-14 17:08:18+00:00,['1371146179103363078'],@sport_simon Went berserk on the wireless!, went berserk on the wireless,berserk wireless
1.3707501720918385e+18,2021-03-13 14:54:42+00:00,['1370750172091838466'],"What's the point? Of Italy, not of life.",what's the point of italy not of life,point life
1.3682994006284698e+18,2021-03-06 20:36:13+00:00,['1368299400628469760'],"Nothing on the box? Two-hour documentary about Poly Styrene (the punk musician, not the synthetic polymer) on Sky Arts at 9. Meant to be very good.",nothing on the box twohour documentary about poly styrene the punk musician not the synthetic polymer on sky arts at meant to be very good,nothing twohour documentary styrene punk musician polymer meant
1.3679939774300242e+18,2021-03-06 00:22:34+00:00,['1367993977430024195'],"People sticking up for Meghan Markle are almost as weird as people slagging her off. You've never met her. She might be lovely, she might be a prick. What's the point?",people sticking up for meghan markle are almost as weird as people slagging her off you've never met her she might be lovely she might be a prick what's the point,people meghan markle people point
1.3679816906610033e+18,2021-03-05 23:33:45+00:00,['1367981690661003265'],"Just off a Zoom call. Arsenal fan, on Spurs: 'You can't just when nothing ever. It's just silly.' It hurts, but wise words.",just off a zoom call arsenal fan on spurs you can't just when nothing ever it's just silly it hurts but wise words,zoom call spur nothing wise word
1.3679441795323167e+18,2021-03-05 21:04:42+00:00,['1367944179532316680'],"@HJoyceGender It's one of the reasons I stopped coming on here as much. Every day, I'd be utterly dumbfounded that so many apparently intelligent people could be so stupid.", it's one of the reasons i stopped coming on here as much every day i'd be utterly dumbfounded that so many apparently intelligent people could be so stupid,reason people
1.3675844875638743e+18,2021-03-04 21:15:24+00:00,['1367584487563874311'],"It's World Book Day, or so I'm led to believe. If indeed it is, make sure you pre-order this beauty from @Rob7Burrow https://t.co/nCzsCHdQDM",it's world book day or so i'm led to believe if indeed it is make sure you preorder this beauty from  ,world book beauty
1.367258924760658e+18,2021-03-03 23:41:44+00:00,['1367258924760657922'],"Just read another excellent book by Ben MacIntyre - he doesn't write bad ones - Agent Sonya: Lover, Mother, Soldier, Spy. Coming to your screens soon, no doubt.",just read another excellent book by ben macintyre  he doesn't write bad ones  agent sonya lover mother soldier spy coming to your screens soon no doubt,book macintyre agent sonya mother soldier screen doubt
1.3649492960853688e+18,2021-02-25 14:44:06+00:00,['1364949296085368834'],"Modern Test cricket is just a bit daft. People keep saying England have problems against top-class spin. Of course they do, they never play against it apart from in Tests.",modern test cricket is just a bit daft people keep saying england have problems against topclass spin of course they do they never play against it apart from in tests,test cricket people england problem topclass spin course test
1.3649109590605292e+18,2021-02-25 12:11:46+00:00,['1364910959060529155'],"I imagine Hell to be losing various games against Virat Kohli for eternity - chess, Monopoly, Game of Life - and him roaring in your face every time he beats you.",i imagine hell to be losing various games against virat kohli for eternity  chess monopoly game of life  and him roaring in your face every time he beats you,hell game virat kohli eternity chess monopoly game life face time
1.3649071764232724e+18,2021-02-25 11:56:44+00:00,['1364907176423272450'],"Thing is, a lead of 15 might be enough on this pitch.",thing is a lead of might be enough on this pitch,thing lead pitch
1.3646797580810977e+18,2021-02-24 20:53:03+00:00,['1364679758081097732'],"Apparently, in medieval times, people used to walk about with fake wooden noses, because syphilis made them fall off. That's all.",apparently in medieval times people used to walk about with fake wooden noses because syphilis made them fall off that's all,time people nose syphilis
