id,created_at,edit_history_tweet_ids,text,clean_text,nouns
1.5091392768685957e+18,2022-03-30 12:03:36+00:00,['1509139276868595714'],Lovely @JoeMarlerShow with my old mate @robmuz - everything you wanted to know about opera but were afraid to ask. https://t.co/pItn9y0V4U,lovely  with my old mate   everything you wanted to know about opera but were afraid to ask ,mate everything opera
1.5022561878317302e+18,2022-03-11 12:12:40+00:00,['1502256187831730181'],"My brother speaks the lingo, so take his word for it. https://t.co/XgSCXNx7fJ",my brother speaks the lingo so take his word for it ,brother lingo word
1.4977275201620787e+18,2022-02-27 00:17:21+00:00,['1497727520162078720'],If you're in any way involved in boxing and think that was ok you're bent as houses.,if you're in any way involved in boxing and think that was ok you're bent as houses,bent house
1.494009192461615e+18,2022-02-16 18:02:03+00:00,['1494009192461615110'],"He's got one or two other things on his plate, but @Rob7Burrow has still been lovely enough to send me one of his old England jerseys. What a fella! https://t.co/D3mCFHxFTU",he's got one or two other things on his plate but  has still been lovely enough to send me one of his old england jerseys what a fella ,thing plate england fella
1.4897272900324598e+18,2022-02-04 22:27:18+00:00,['1489727290032459792'],@dpcoverdale @Rob7Burrow Thanks David! Glad you enjoyed it.,  thanks david glad you enjoyed it,thanks glad
1.4770066741709783e+18,2021-12-31 20:00:07+00:00,['1477006674170978304'],Not the Hootenanny. Never the Hootenanny. You're better than that.,not the hootenanny never the hootenanny you're better than that,hootenanny hootenanny
1.466499725163647e+18,2021-12-02 20:09:15+00:00,['1466499725163646983'],"The little big man @Rob7Burrow came up short in the William Hill Sports Book of the Year, but won a leather bound book (like a Blankety Blank cheque book and pen). Rob, it was wonderful working with you. https://t.co/jBBinb1Ygs",the little big man  came up short in the william hill sports book of the year but won a leather bound book like a blankety blank cheque book and pen rob it was wonderful working with you ,william hill sport book year leather bound book blankety blank cheque book
1.4660091552742523e+18,2021-12-01 11:39:54+00:00,['1466009155274252293'],Happy Campion Day! Auctore Deo (came 96th*) * Private Campion School gag.,happy campion day auctore deo came  private campion school gag,campion campion school
1.459238576399528e+18,2021-11-12 19:16:02+00:00,['1459238576399527942'],"@TerryGeorge Of course mate, have followed.", of course mate have followed,course mate
1.454077156519293e+18,2021-10-29 13:26:24+00:00,['1454077156519292933'],@donaldgmcrae @BookiePrize @Rob7Burrow Cheers Don! Hope all well.,   cheers don hope all well,cheer well
1.4536934958148037e+18,2021-10-28 12:01:52+00:00,['1453693495814803457'],"You little bastard @Rob7Burrow! You're shortlisted for the William Hill Sports Book Of The Year, gonna have to shell out for a new suit. @BookiePrize",you little bastard  you're shortlisted for the william hill sports book of the year gonna have to shell out for a new suit ,william hill sport book year gonna suit
1.4472828883875348e+18,2021-10-10 19:28:24+00:00,['1447282888387534855'],I'm convinced they've started taking the piss out of Attenborough and making these animals up.,i'm convinced they've started taking the piss out of attenborough and making these animals up,piss attenborough animal
1.4448151351016612e+18,2021-10-04 00:02:26+00:00,['1444815135101661187'],"Has a ball ever been sweeter hit, in any sport? https://t.co/kThhlVxfgv",has a ball ever been sweeter hit in any sport ,ball sport
1.4440868139714355e+18,2021-10-01 23:48:20+00:00,['1444086813971435524'],@MattCBoxingNews The second worst boxer to hold the heavyweight crown after Charles Martin., the second worst boxer to hold the heavyweight crown after charles martin,boxer crown charles
1.4440811780850524e+18,2021-10-01 23:25:57+00:00,['1444081178085052420'],"Was always gonna be a dull fight, two southpaws. #rocky3",was always gonna be a dull fight two southpaws ,fight southpaw
1.4435308436627292e+18,2021-09-30 10:59:07+00:00,['1443530843662729222'],"Congrats @Rob7Burrow, Too Many Reasons to Live longlisted for the William Hill Sports Book of the Year. @BookiePrize Some crackers on that list.",congrats  too many reasons to live longlisted for the william hill sports book of the year  some crackers on that list,congrats reason william hill sport book year cracker list
1.443356566611243e+18,2021-09-29 23:26:36+00:00,['1443356566611243013'],Nice Ken Buchanan doc on BBC iPlayer. That is all.,nice ken buchanan doc on bbc iplayer that is all,buchanan iplayer
1.4418967540608778e+18,2021-09-25 22:45:49+00:00,['1441896754060877834'],"Problem with modern boxers is, they always go on about how they have to improve after a defeat etc. But how can that happen when they only box a couple of times a year? After losing to Frazier in 1971, Ali boxed 13 times before fighting him again in 1974.",problem with modern boxers is they always go on about how they have to improve after a defeat etc but how can that happen when they only box a couple of times a year after losing to frazier in ali boxed times before fighting him again in,problem boxer defeat couple time year time
1.44188652672025e+18,2021-09-25 22:05:11+00:00,['1441886526720249857'],"Big shout out for Ronald McIntosh. Love Mike Costello, Ron is a top man. Brilliant job tonight.",big shout out for ronald mcintosh love mike costello ron is a top man brilliant job tonight,shout ronald mcintosh mike costello tonight
1.4418842388532716e+18,2021-09-25 21:56:06+00:00,['1441884238853271552'],"A question: is boxing the only sport that hasn't necessarily advanced in the last 50 years? I mean, you watch cricket or football from 1970 and it's obviously ancient. Watch some boxing, and it looks better.",a question is boxing the only sport that hasn't necessarily advanced in the last years i mean you watch cricket or football from and it's obviously ancient watch some boxing and it looks better,question sport year cricket football boxing
1.4418832087616758e+18,2021-09-25 21:52:00+00:00,['1441883208761675777'],There was some talk a couple of years ago that we were in some kind of golden age of heavyweight boxing. Can you imagine some of the '70s boys against these lads?,there was some talk a couple of years ago that we were in some kind of golden age of heavyweight boxing can you imagine some of the s boys against these lads,talk couple year kind boxing
1.4418797591186432e+18,2021-09-25 21:38:18+00:00,['1441879759118643203'],"@senornunes Ha. Yes, Hector, this is the problem with wild, sweeping statements!", ha yes hector this is the problem with wild sweeping statements,hector problem statement
1.4418791473666744e+18,2021-09-25 21:35:52+00:00,['1441879147366674434'],"There is no sport the public are more ignorant about than boxing. Not even football. If you thought Joshua would find this easy, frankly, you're a ruddy idiot.",there is no sport the public are more ignorant about than boxing not even football if you thought joshua would find this easy frankly you're a ruddy idiot,sport public football joshua ruddy idiot
1.4415212197826765e+18,2021-09-24 21:53:35+00:00,['1441521219782676480'],@juliansheasport @Rob7Burrow Thanks mate! Hope all well.,  thanks mate hope all well,thanks hope
1.4415124505624822e+18,2021-09-24 21:18:44+00:00,['1441512450562482179'],"@juliansheasport Erm, if you a metal fan you'd probably know quite a lot about him. But metal is quite weird like that, in that it's massive but quite niche at the same time.", erm if you a metal fan you'd probably know quite a lot about him but metal is quite weird like that in that it's massive but quite niche at the same time,metal niche time
1.441509748055044e+18,2021-09-24 21:08:00+00:00,['1441509748055044103'],"@juliansheasport No can do, Julian. I can say it's nothing to do with Stryper.", no can do julian i can say it's nothing to do with stryper,nothing stryper
1.4415085217202463e+18,2021-09-24 21:03:08+00:00,['1441508521720246275'],"My latest ghost writing project is with a heavy metal legend. Can't say who it is, but we've only reached 1974 and every member of the band has almost died at least twice. He keeps telling me how much fun it was.",my latest ghost writing project is with a heavy metal legend can't say who it is but we've only reached and every member of the band has almost died at least twice he keeps telling me how much fun it was,ghost writing project metal member band
1.4410840666404577e+18,2021-09-23 16:56:30+00:00,['1441084066640457734'],"Highly recommend Bob Mortimer's memoir. Obviously very funny, but also quite melancholy. Quite lovely, actually. Really struck some chords and made me think about things, like all good memoirs should.",highly recommend bob mortimer's memoir obviously very funny but also quite melancholy quite lovely actually really struck some chords and made me think about things like all good memoirs should,memoir chord thing memoir
1.4388578873805414e+18,2021-09-17 13:30:27+00:00,['1438857887380541444'],"@sport_simon Can't reay justify the price, al I realy d is write stuff in Wrd", can't reay justify the price al i realy d is write stuff in wrd,price stuff
1.4388569199602033e+18,2021-09-17 13:26:37+00:00,['1438856919960203266'],@sport_simon I thught yu were always moaning abut yurs?, i thught yu were always moaning abut yurs,abut yurs
1.43885665210359e+18,2021-09-17 13:25:33+00:00,['1438856652103589892'],"Sme f the keys on my aptp have stpped working prpery, making writing bks quite difficult. Is there anything I can do t fix it?! r do I just have t shel ut fr a new ne?",sme f the keys on my aptp have stpped working prpery making writing bks quite difficult is there anything i can do t fix it r do i just have t shel ut fr a new ne,aptp prpery anything shel
1.4344628250245734e+18,2021-09-05 10:26:03+00:00,['1434462825024573443'],And again! @Rob7Burrow Number 1 Sunday Times bestseller two weeks on the trot. And two Leeds books in the top 3 - congrats @PhilHay_ https://t.co/MXMg8rE2eh,and again  number sunday times bestseller two weeks on the trot and two leeds books in the top  congrats  ,number time week trot leeds book congrats
1.4318916407765445e+18,2021-08-29 08:09:05+00:00,['1431891640776544256'],"You did it again, @Rob7Burrow - Sunday Times bestseller. One day, someone will go, 'There goes Rob Burrow. I must remember to thank him...' https://t.co/anMSrwN5xJ",you did it again   sunday times bestseller one day someone will go there goes rob burrow i must remember to thank him ,time someone burrow
1.4305968361217925e+18,2021-08-25 18:23:59+00:00,['1430596836121792521'],@tanyaarnold @Rob7Burrow Thanks Tanya!,  thanks tanya,thanks tanya
1.4305882986411622e+18,2021-08-25 17:50:04+00:00,['1430588298641162246'],"@Rob7Burrow Mate, it was a huge pleasure. A wonderful experience, in fact. And the real work is all yours, I just put your deeds down on paper. As for you not being able to speak, if you want the rainbow, you’ve got to put up with the rain. Do you know which ‘philosopher’ said that?", mate it was a huge pleasure a wonderful experience in fact and the real work is all yours i just put your deeds down on paper as for you not being able to speak if you want the rainbow you’ve got to put up with the rain do you know which philosopher said that,mate pleasure experience fact work deed paper rainbow rain philosopher
1.4284993250559058e+18,2021-08-19 23:29:13+00:00,['1428499325055905792'],"@tanyaarnold @Rob7Burrow Thanks Tanya! And for your help, much appreciated.",  thanks tanya and for your help much appreciated,thanks tanya help
1.4284691817003213e+18,2021-08-19 21:29:27+00:00,['1428469181700321291'],"Can confirm Rob Burrow retains his sense of humour. Tonight he told me opposition fans should sing: 'Oh, Lindsey Burrow, the only wife in Cas who wipes her husband's arse.' What a man. What a woman.",can confirm rob burrow retains his sense of humour tonight he told me opposition fans should sing oh lindsey burrow the only wife in cas who wipes her husband's arse what a man what a woman,burrow sense humour tonight opposition wife arse woman
1.4279901826121523e+18,2021-08-18 13:46:04+00:00,['1427990182612152333'],"@rob7burrow's Too Many Reasons to Live has lift-off. It was lovely to help a great man, his beautiful family and his loyal mates tell his story. It might make you cry, but it will also make you giggle. Please buy - and (I almost never say this) PLEASE RT! https://t.co/46dGYB8ZRT",s too many reasons to live has liftoff it was lovely to help a great man his beautiful family and his loyal mates tell his story it might make you cry but it will also make you giggle please buy  and i almost never say this please rt ,reason liftoff family mate story please
1.4275464764403958e+18,2021-08-17 08:22:57+00:00,['1427546476440395780'],"Another fine feature with @Rob7Burrow, his wife Lindsey and his dad Geoff in The Times. Rob's book, Too Many Reasons to Live, is officially out this Thursday. Order it! https://t.co/0VCCozXvtF",another fine feature with  his wife lindsey and his dad geoff in the times rob's book too many reasons to live is officially out this thursday order it ,feature wife lindsey geoff time book reason order
1.4252177518666506e+18,2021-08-10 22:09:25+00:00,['1425217751866650625'],"I just wish superstar footballers at the end of their careers would show a bit more imagination. I mean, they're already richer than Croesus, why not go and play for Southend or someone for a season, just for the craic?",i just wish superstar footballers at the end of their careers would show a bit more imagination i mean they're already richer than croesus why not go and play for southend or someone for a season just for the craic,superstar footballer career imagination croesus southend someone season craic
1.4244608156468388e+18,2021-08-08 20:01:38+00:00,['1424460815646838789'],"Slag off the BBC all you like, but those clever bastards can still do one hell of a sporting montage.",slag off the bbc all you like but those clever bastards can still do one hell of a sporting montage,slag bastard hell sporting montage
1.42407849451076e+18,2021-08-07 18:42:25+00:00,['1424078494510759937'],"Kids don't know how good they've got it. Growing up, I'd sit through hour after hour, day after day of Olympics coverage without a sniff of a GB medal of any sort.",kids don't know how good they've got it growing up i'd sit through hour after hour day after day of olympics coverage without a sniff of a gb medal of any sort,hour hour olympics coverage sniff medal sort
1.4240655639370957e+18,2021-08-07 17:51:02+00:00,['1424065563937095681'],"On this evidence, rugby is in danger of becoming like snooker, a sport you have on in the background while doing other stuff.",on this evidence rugby is in danger of becoming like snooker a sport you have on in the background while doing other stuff,evidence rugby danger snooker sport background stuff
1.4240631539739077e+18,2021-08-07 17:41:28+00:00,['1424063153973907467'],I worry about rugby. There's fuck all going on for great chunks of the 80 minutes.,i worry about rugby there's fuck all going on for great chunks of the minutes,rugby chunk minute
1.4233603104932946e+18,2021-08-05 19:08:37+00:00,['1423360310493294593'],"Question: can carpet fitters work around furniture? (in my case, one wardrobe). Thanks.",question can carpet fitters work around furniture in my case one wardrobe thanks,question fitter furniture case wardrobe thanks
1.42250924685645e+18,2021-08-03 10:46:48+00:00,['1422509246856450051'],"Exciting times, @Rob7Burrow, finally got my hands on Too Many Reasons to Live. In all good book shops 19 August. Order it now! (please) https://t.co/fnMAJf5hoX",exciting times  finally got my hands on too many reasons to live in all good book shops august order it now please ,time hand reason book shop order
1.4204695535496763e+18,2021-07-28 19:41:47+00:00,['1420469553549676549'],A common feature of these videos with medallists' families is a slightly haunted looking brother.,a common feature of these videos with medallists families is a slightly haunted looking brother,feature video medallist family brother
1.4198011249582572e+18,2021-07-26 23:25:41+00:00,['1419801124958257154'],"@juliansheasport I like it. Like Springtime for Hitler, except with a cast of thousands and for an audience of billions.", i like it like springtime for hitler except with a cast of thousands and for an audience of billions,springtime hitler cast thousand audience billion
1.4197937793856348e+18,2021-07-26 22:56:30+00:00,['1419793779385634819'],This commentator has got to let the firebombing of Tokyo go.,this commentator has got to let the firebombing of tokyo go,commentator firebombing tokyo
1.419735542858752e+18,2021-07-26 19:05:05+00:00,['1419735542858752002'],Clare Balding makes this live broadcasting lark look like she's got a few mates round her gaff for a natter. You half expect someone to walk onto the set with a pot of tea and a tray of custard creams. Effortless.,clare balding makes this live broadcasting lark look like she's got a few mates round her gaff for a natter you half expect someone to walk onto the set with a pot of tea and a tray of custard creams effortless,clare broadcasting look mate gaff natter someone tray custard cream
1.418984439120552e+18,2021-07-24 17:20:28+00:00,['1418984439120551941'],This SA team is brutal. Must be like wrestling a bloody great gorilla.,this sa team is brutal must be like wrestling a bloody great gorilla,team gorilla
1.4131739035062518e+18,2021-07-08 16:31:28+00:00,['1413173903506251777'],Had my driving theory test today. Kept thinking of the classic exam scene from Cinema Paradiso. https://t.co/GnyF2VWIhC,had my driving theory test today kept thinking of the classic exam scene from cinema paradiso ,test today thinking scene cinema paradiso
1.4128490054245253e+18,2021-07-07 19:00:27+00:00,['1412849005424525316'],Just the cheapness of the ITV team line-up graphics make me think we might lose.,just the cheapness of the itv team lineup graphics make me think we might lose,cheapness team lineup graphic
1.412510712769958e+18,2021-07-06 20:36:11+00:00,['1412510712769957893'],Danny Murphy's commentary style is that of a man making occasional observations while helping his mate on the pub fruit machine.,danny murphy's commentary style is that of a man making occasional observations while helping his mate on the pub fruit machine,style observation mate fruit machine
1.411012162110251e+18,2021-07-02 17:21:29+00:00,['1411012162110251022'],Lee Dixon's commentary style is that of an old lady grumbling about life in a hospital waiting room.,lee dixon's commentary style is that of an old lady grumbling about life in a hospital waiting room,style lady life hospital waiting room
1.4107389609938616e+18,2021-07-01 23:15:53+00:00,['1410738960993861633'],"@BenRigbyJourno My hair has been staging a race between grey and bald for many years now. Currently, bald is leading by a nose.", my hair has been staging a race between grey and bald for many years now currently bald is leading by a nose,hair race grey bald year
1.4107377834094633e+18,2021-07-01 23:11:12+00:00,['1410737783409463296'],All the sports stars from when I was a kid are starting to look like old men and women.,all the sports stars from when i was a kid are starting to look like old men and women,sport star woman
1.4103229359785288e+18,2021-06-30 19:42:45+00:00,['1410322935978528772'],"The Ken Burns series on Ernest Hemingway is rather wonderful, all episodes available now on BBC4. Begs the question, did people lead more interesting lives back then?",the ken burns series on ernest hemingway is rather wonderful all episodes available now on bbc begs the question did people lead more interesting lives back then,series hemingway episode question people life
1.409894679747965e+18,2021-06-29 15:21:00+00:00,['1409894679747964933'],"Still think he's gonna score. Head in hands every time, even 25 years later.",still think he's gonna score head in hands every time even years later,gonna score head hand time year
1.4098781385790423e+18,2021-06-29 14:15:17+00:00,['1409878138579042305'],"Bloody hell, I fear for Southgate if England lose with that starting XI. It's going to be really quite ugly.",bloody hell i fear for southgate if england lose with that starting xi it's going to be really quite ugly,bloody hell southgate england
1.4096309817919283e+18,2021-06-28 21:53:10+00:00,['1409630981791928324'],I imagine Hell to be sat in a changing room listening to the wild celebrations of a team that have just knocked you out of a tournament on a penalty shootout. For eternity.,i imagine hell to be sat in a changing room listening to the wild celebrations of a team that have just knocked you out of a tournament on a penalty shootout for eternity,hell room celebration team tournament penalty shootout eternity
1.4074403074955182e+18,2021-06-22 20:48:12+00:00,['1407440307495518210'],"I'm sure someone will pop up and tell me it was a professional performance, but, and you might call me an old romantic, I quite like to be entertained of an evening.",i'm sure someone will pop up and tell me it was a professional performance but and you might call me an old romantic i quite like to be entertained of an evening,someone performance evening
1.4074079200741786e+18,2021-06-22 18:39:31+00:00,['1407407920074178563'],I'm slightly confused by Jack Grealish. How has he suddenly become some kind of folk hero? I hope he does well.,i'm slightly confused by jack grealish how has he suddenly become some kind of folk hero i hope he does well,jack kind folk hero
1.407081125038768e+18,2021-06-21 21:00:57+00:00,['1407081125038768129'],Shades of Johnny Metgod in that third Denmark goal.,shades of johnny metgod in that third denmark goal,shade johnny metgod denmark goal
1.4060018512591462e+18,2021-06-18 21:32:18+00:00,['1406001851259146244'],"@Muzzsport To be fair, I think I said that in the context of Celtic winning nine straight league titles!", to be fair i think i said that in the context of celtic winning nine straight league titles,context league title
1.405994518529327e+18,2021-06-18 21:03:09+00:00,['1405994518529327104'],Souness is seconds away from going full Begbie.,souness is seconds away from going full begbie,souness begbie
1.405992662419841e+18,2021-06-18 20:55:47+00:00,['1405992662419841027'],"I don't follow football that closely anymore, so you know who I'm most annoyed at? The people who kept telling me we had a chance of winning this bloody tournament!",i don't follow football that closely anymore so you know who i'm most annoyed at the people who kept telling me we had a chance of winning this bloody tournament,football people chance tournament
1.4059803980568453e+18,2021-06-18 20:07:03+00:00,['1405980398056845312'],"I don't understand why a manager would wait until the 70th minute. If it's not working, why not change it now?",i don't understand why a manager would wait until the minute if it's not working why not change it now,manager minute
1.4041828131303342e+18,2021-06-13 21:04:05+00:00,['1404182813130334208'],"I do enjoy the habit Roy Keane has of going on a rant before glaring at his fellow pundits, as if to say, 'Dare you to fucking disagree with me.'",i do enjoy the habit roy keane has of going on a rant before glaring at his fellow pundits as if to say dare you to fucking disagree with me,habit keane rant pundit dare disagree
1.4041585191301407e+18,2021-06-13 19:27:33+00:00,['1404158519130140679'],"Ally McCoist must be every commentator's dream wingman. Makes it sound like him and his partner, whoever that is, are sat side by side in armchairs.",ally mccoist must be every commentator's dream wingman makes it sound like him and his partner whoever that is are sat side by side in armchairs,dream wingman partner side side armchair
1.4040598765533307e+18,2021-06-13 12:55:35+00:00,['1404059876553330690'],@DanEtchells I couldn't care less. I just want him to win football matches., i couldn't care less i just want him to win football matches,care football match
1.4040596171900887e+18,2021-06-13 12:54:33+00:00,['1404059617190088711'],"@sport_simon Niceness, integrity, whatever you call it. It's utterly meaningless unless he wins big games.", niceness integrity whatever you call it it's utterly meaningless unless he wins big games,integrity meaningless game
1.4040585656194253e+18,2021-06-13 12:50:22+00:00,['1404058565619425285'],@DanEtchells I forgot it was Gareth and Idi Amin on the FA shortlist., i forgot it was gareth and idi amin on the fa shortlist,amin shortlist
1.4040582624928768e+18,2021-06-13 12:49:10+00:00,['1404058262492876804'],@sport_simon Surely integrity isn't the same as being a nice bloke? And it's all meaningless anyway if Croatia beat us. I'd rather have a ruthless bastard in charge., surely integrity isn't the same as being a nice bloke and it's all meaningless anyway if croatia beat us i'd rather have a ruthless bastard in charge,integrity bloke meaningless ruthless bastard charge
1.404057313795887e+18,2021-06-13 12:45:24+00:00,['1404057313795887106'],Does anyone actually care how nice a man Southgate is? This modern preoccupation with 'kindness' makes me quite queasy.,does anyone actually care how nice a man southgate is this modern preoccupation with kindness makes me quite queasy,anyone southgate preoccupation kindness
1.4037313705900524e+18,2021-06-12 15:10:13+00:00,['1403731370590052359'],"@paddygearey Even with them. Decent England teams get battered in Australia, this isn't one of them.", even with them decent england teams get battered in australia this isn't one of them,england team australia
