,0,1,2,3,4
0,episode occasion,film bond movie cinema,service driver route twitter idea lack driver wale service,fact history history claudia jones grave,vogue history photography miller occupation paris wwii
1,episode show,trinket james bond anyone hero mine stop hand,tweeps please person world,cemetery drive parade,photo today thing thing
2,episode show,centrepiece bond movie credit trick,tweet time,work chapel road cemetery exhibition neurodiversity space,photo shoot
3,week well,cartoon creepy,brother blue,protest pageantry mark duke duchess platinum jubilee visit,kingston thames
4,time week shouldnt week time anything,muppets wizard,brother blue,rumour jubilee,source river thames today poke plenty footpath area
5,week week,favourite cartoon,brother blue,oxford name jubilee,memory windsurfing breeze thames chime evening
6,movie tier,wait wait holy shit,thread insight survey,thanks session,photo london kingdom
7,tier content,wait tick,shot thread manager help legality,afternoon session check release hope right,photo london kingdom
8,mononoke tier,wait omfg ahhh,thread offer independent look,thanks session,science class video trash picture sculpturesdisplays thames
9,karen matheson think session series,thank youuuu,twitter watch britney spear thanks,simpler time,classic london kingdom
10,series part,thank youuu,thanks tweet government,simpler time,chatslove london
11,series question,thank youuu,thank tweet chenel,time time,living surrey
12,group john legend legend,bath scene chapter,emom date,facebook hmmm,anyone dahlia song video weekend match song dahlia murder lord land glasgow
13,legend need division,episode bare people bath,date chiropractor,facebook service,glasgow sound scotland soundtrack today
14,legend time,fopp bath,period date,post facebook,love twin temple stereo glasgow
15,peep flooding tonight,bleek album album year,account account,time kitchen venue folkgrass session tune facebook page addition music tonight time,tuts glasgow kingdom
16,flooding home,lana album year,account post something,folkgrass session anniversary session,glasgow kingdom
17,crikey target guaranteeing river road canal year well,andrew john album year,account enjoy,edition folkgrass session thing tomorrow,glasgow kingdom
18,spotify whole mine,billie mariah carey hundred police reform letter variety,kanye trump helper,james thats,hell zitkala google today yeah
19,audio spotify,billie forever carrie fisher character booksmart icon compliment,kanye documentary,james situation,google repair revolution valley alphabet peer
20,review friday check thought spotify,billie life today decision america america power dare power,support supporter spoiler alert kanye,home james,google colab
21,easter sunday,album gtgtgt,decade month post tweet conversation today caitlin change,inch nail,edinburgh folk depot meantime ticket
22,easter treat time,album lord,server check discord community shitshow twitter year work,masc face nail,ticket glasgow show night ticket
23,easter weekend,album ditto revisit,pencil year tweet convince,ticket inch nail apollo,glasgow rubber ticketz
24,mark playlist,city jack,twitter usage discord server show scotland music,thanks jane,land land clearing
25,playlist buggsy,feel jack doeshes,retweet music publishing assistant,thanks jackson,hunt john truecrime documentary
26,fight gamecore playlist playlist,departure jack,music tweet please,thanks clare,show development idea forward land islander
27,call tune,need government point someone poverty others jack inspiration,shit timeline,anyone earworm freddy,zoom comedy lesson
28,tune yall,poverty shaun place,timeline moist today,sunrise earworm wednesday killer earworm project phone weekend earworms sunrise facebook group,anall yesterday zoom
29,remoulds tune orbitshe star,correction push people poverty poverty poverty line,timeline time,seat stony sunrise tomorrow earworm wednesday abba earworm tune text,savage mass zoom prof people
30,logo project time,mccartney moment,follower question needing,anything learnt lockdown,chance manage cobra meeting
31,macbar logo,installment mccartney please,follower awal someone person thing release,step lockdown,option meeting powerpoint meeting powerpoint slide meeting
32,company logo,thank beatles plaque,phone follower proud,lock parody,join march meeting collaboration port
33,food bank,idiot shower,please wave thismore feed member community feeling,servidores facebook instagram experimentando servidor inscripcin,university chichester conservatoire
34,food appeal campaign donate support cause,baby shower love,rule anyone faken feed unfollow care decade stop crap,instagram space,scholar event yesterday conservatoire hope share story year
35,alright food bank thanks,cancer anything shower,something wanna feed,look instagram,sample university chichester conservatoire
36,shadow puppet,list item list,parody account conservative,shout photo,labour councillor royal greenwich time
37,shadow photo,list work,parody account obvs,shout legend,week mean family saloon today dislike driving london work price
38,rasmus shadow,list thing,parody account,fred shout,surprise trip week london minute role home nightmare people share
39,monday script today head,part control monopoly right,britney spear side story,page sure,katie requirement
40,monday hurray,monopoly force,hearing news decides britney spear,page week,anyone anyone feel sorry katie
41,hour monday,monopolist design sense,britney bitch,page treat,blooper show week everyone katie love
42,kind survey,please paul animal paul,funny turner elvis impersonator,diamond fave wait remake sword flaw side thing,bristol vote
43,kind tysm,paul life advice,elvis presley version,plan diamond area,trade bristol week night
44,kind work,paul well,elvis maybe,bear circle diamond stuff,bristol tonight
45,substitute bank holiday,scarlet violet trailer,view lake malawi,afternoon park sunshine,year photo
46,option bank holiday,aaah yeah heard heard rosey,confidence consigliere book precision paul lake cross creation take,list sunshine,jamais photo year
47,yday bank holiday respite,rose violet scotland,route lake,sunshine weather,picture none year
48,mention data design people,middle update review site,stockport blue evening houseband blue musician,morning jane weekend,photogs show elliot smith tribute finsbury london waterparks glasgow
49,option skip survey bitch,review riot blurb youbube,pleasure stockport blue society night blue musician night thanks swann music venue,morning plotting planning maggie jenny grace work,glasgow show patter return
50,data analyst fiancee rolld teenager survey answer,standard review protocol site cannot nest site review,night stockport blue thanks everyone rain music,morning jane nothing moment weekend,claim video video recap glasgow show week something spot
51,anyone holiday,magazine cover mean monster scmit eagle williams cachao band,people term slippage,parry today rehearsal david presentation class,jeff opportunity
52,holiday time lool,fleece gooooood cover part compilation album,cover slipper,efron showman show rehearsal,nature jeff tobias john edward tonight
53,hols holiday,chill thing earring lioness bangle middle album cover back market,person slip sliccccc,rehearsal show,jeff hanneman
54,thank kind,thanks list,neck wood congratulation person,thing kitchen,goddamn academy glasgow
55,thank kind,holy list thank,thread expense virgin,kitchen collect bwoy sponsor,university glasgow copy loan someone page
56,kind thank,list thanks,look neoprene neck wood,kitchen today,academy glasgow glasgow kingdom
57,people okay money club merch sale support,gangggg alllll sense,nothing workout minute meditation round hour,government conspiracy theory,garage glasgow kingdom
58,merch folk someone merch night nothing,friday gang,mind series history holism wellness yoga theme nazi qanon influencers,capability anyone conspiracy,studio warehouse glasgow kingdom
59,merch thisthis genius,need gangsta joint contrast,meditation emergency,love conspiracy antivaxxer thing,peak garage glasgow kingdom
60,enemy give presave,knack profound thanks review post,buildingbrick brick,mainstream medium israel whats people land,hydro glasgow kingdom
61,enemy race,thanks surprise post today thanks signature review,brick life plan,weve quarrel attempt israeli saudi scapegoat instability word mandy ricedavies,hydro glasgow kingdom
62,thank enemy,thank review,type practises trial place legoland juncture people choice face,people russophobia people antisemitism,ghost hydro glasgow
63,movie watch,career mercury prize brit award award gold platinum disc career goal,season greeting hubby deckchair design,raini love maggie rogers,wander middle edinburgh
64,something watch,mercury prize artist matt shortlist,deck screen,body maggie rogers,hand edinburgh city
65,tissue watch everyone,context mercury,deck love,maggie rogers time ground,cave edinburgh kingdom
66,rock tune band week music line accompaniment part,everyone knew decade care,reddit discord ltatm reddit,thanks shout,croatia printwork london
67,project swing week music song thanks,help decade,update discord,thanks shout,sheet cartridge message grrr printer guess problem
68,week musical heron,decade launch september,opinion argument front centre cycle medium discord,thanks shout,work wifi printer cuppa
69,ting nobody word skillibeng grimey,whilst bucket,brother connection,woop president,blog standard hobgoblin reach beery delicacy
70,grime feel pity nitwit,people bucket,andersoncohen brother shot,woot woot,treble blog stuff
71,pnegrve suggestion grim,bucket party,brother slipper bathroom bathroom light hour brother loss prank time,woop thing,mention today blog
72,thanks playlist,release consideration,button stats,individual experience carnival,aaaw thank yorkshire station mean heart finger
73,thank seagull playlist,hype medium release alpha,disinformation button,experience carnival ride,yorkshire country manoeuvre
74,thanks playlist,release meant industry thing,button life cruel,year carnival,yorkshire terrier show type
75,home today tune meanwood tune,crab suit girl,0,sheer gall,cool picture
76,tune powerhouse tonight information action world politics area state,gotta stop crab mentality,0,page sheerness time today,hooray picture
77,tune tonight midnight selection tune theme jazz movie popcorn,lobster load indie film bruges blockbuster stuff minority report,0,blink dome sheerness time,thanks photo
78,thanks nice,duck duckling today,0,glyn grace death,cold shit jackson saint
79,yippee thank,duck quack duck,0,grace creek,anyone something saint
80,thanks thanks,runnin duckin payback squalie nothing,0,thing grace grace,saint spot
81,holy gonna,ditto thing smudge natch award,0,show mayth stony sunrise zendog album launchjoe,example composer woman reply anyone carlos isnt
82,yougov tellum,bean year performance award,0,show tuesday stony,composery name
83,gonna kinda,award cowper,0,lunch school house stony stratford team roast team sunrise show,look composer colleague habitat
84,thanks weekend matt hancock,daughter tattoo,0,0,indieterria friend
85,mathew parris truth,tattoo dayyyy,0,0,indieterria meet maddon
86,proof hancock life world,book tattoo saturday adult money,0,0,indieterria meet
87,technology issue payment time solution,ityiwey cover unwritten,0,0,0
88,today thanks payment plan money switch,concept cover tolerate tswift,0,0,0
89,payment plan,cover ittt,0,0,0
90,press play guestmix,wolf show slap,0,0,0
91,guest host show friday,wolf alice tonight,0,0,0
92,webinar week round guest,wolf stuff,0,0,0
93,proud week week ebook resilience guide business,mistress wait till valentine outfit,0,0,0
94,week edition show,romantic element,0,0,0
95,week edition,volume romanticism,0,0,0
96,year matt sparkle wish,text gtgtgtgt,0,0,0
97,legacy matt,feature london gtgtgt,0,0,0
98,tell grieving matt,group gtgtgtgt,0,0,0
99,thanks week,serotonin tattoo depression,0,0,0
100,thanks flood monday week,night serotonin,0,0,0
101,thanks week,thank contribution serotonin,0,0,0
102,plot plot,wait album,0,0,0
103,chapter plot twist,wait month neighbourhood album,0,0,0
104,site plot,wait placebo album tomorrow christmas,0,0,0
105,yesterday book bloody people,wheat cracker,0,0,0
106,saul bloody,change cracker dumpling,0,0,0
107,purdie bloody spellcheck,opportunity plate chance gang prick droll book cracker,0,0,0
108,live till,podium someone saltire,0,0,0
109,till title,tweet woman ceremony paper pointless contract,0,0,0
110,watch till,corner ceremony,0,0,0
111,handkerchief code friday night,cannot wait,0,0,0
112,tier friday,cant wait,0,0,0
113,friday solid second,canny wait,0,0,0
114,opportunity hour deadline,night film,0,0,0
115,oooh dycp deadline,stillscene keep night,0,0,0
116,deadline watch thing cherry,night film,0,0,0
117,preorder link customer wait wage handsome shoein title year,bean heart,0,0,0
118,preorders asap,bean icon,0,0,0
119,preorders everything merch bandcamp store code dreamgirl,bean yeeaaarsssss,0,0,0
120,gonna sims sims computer unit,year debut album string quartet hand shoulder butler street foot,0,0,0
121,sims something world donkey,string quartet,0,0,0
122,daughter sims character evil,decade year music september string quartet,0,0,0
123,loan spot,string sunbeam,0,0,0
124,anyone loan time,string winner,0,0,0
125,dzeko city loan,thanks stringsers,0,0,0
126,hashtag start tree disinterest star,pond mess weather,0,0,0
127,study weekend hashtag character conference,loss prayer pond,0,0,0
128,hashtag game,story breeding water pond region,0,0,0
129,hunt dolphin whale petition,structure winning post,0,0,0
130,assertion cetacean,somehow feel consolation prize race,0,0,0
131,news shell blasting coast africa whale dolphin turtle laurel shell decision pressure,prize leaf tekna worth information tsampcs,0,0,0
132,game reboot gonna,second half mess,0,0,0
133,intro reboot medium network,fucking mess holy shit,0,0,0
134,reboot carrie,fucking mess,0,0,0
135,home sick city silver kind version teri hall river,holy shit,0,0,0
136,river everyone life,holy shit,0,0,0
137,north river stay,holy shit,0,0,0
138,font genre sacking,0,0,0,0
139,time font,0,0,0,0
140,anyone story font android cache update effect,0,0,0,0
141,stick hoodie twat,0,0,0,0
142,someone mate girl hoody,0,0,0,0
143,nhood hood thought woman cloak,0,0,0,0
144,yeah henry,0,0,0,0
145,backwards henry,0,0,0,0
146,continent henry,0,0,0,0
147,winner woman case employer stonewall shield clause employer relationship stonewall thank,0,0,0,0
148,discrimination something stonewall,0,0,0,0
149,allison employer stonewalls advice case employer country relationship stonewall stonewall,0,0,0,0
