Unnamed: 0,id,created_at,edit_history_tweet_ids,text,clean_text,non_english,whitespace
689,1.4947995936194765e+18,2022-02-18 22:22:49+00:00,['1494799593619476481'],"@ScottPughsley Shhh...Covid is gone, remember? https://t.co/uijDNrQWqy", shhhcovid is gone remember ,True,False
690,1.4947244416659374e+18,2022-02-18 17:24:12+00:00,['1494724441665937410'],@SwailesRuth Really pleased to hear this Ruth! Enjoy your holiday., really pleased to hear this ruth enjoy your holiday,True,False
692,1.4945739567954125e+18,2022-02-18 07:26:13+00:00,['1494573956795412486'],@JPMIDB It will keep changing throughout the day and that's why it's concerning. Some areas have woken up this morning in the red zone but were amber yesterday., it will keep changing throughout the day and thats why its concerning some areas have woken up this morning in the red zone but were amber yesterday,True,False
693,1.4945703989183242e+18,2022-02-18 07:12:05+00:00,['1494570398918324241'],@physics_jamie Exactly. Other areas could change throughout the day., exactly other areas could change throughout the day,True,False
694,1.4944096288510935e+18,2022-02-17 20:33:14+00:00,['1494409628851093506'],@thatteacherguy_ @jonnym62 I assumed everyone was still doing it.,  i assumed everyone was still doing it,True,False
695,1.4944066716318843e+18,2022-02-17 20:21:29+00:00,['1494406671631884295'],@thatteacherguy_ We have to. Just in case anyone is off isolating., we have to just in case anyone is off isolating,True,False
696,1.4944065422249943e+18,2022-02-17 20:20:59+00:00,['1494406542224994304'],@chrisdysonHT Children walking to and from school in 70mph winds is surely unsafe though. That's the amber area. Higher in red., children walking to and from school in 70mph winds is surely unsafe though thats the amber area higher in red,True,False
697,1.494406216310739e+18,2022-02-17 20:19:41+00:00,['1494406216310738945'],@thatteacherguy_ Surely red and amber should be closing. I think in terms of set up if we knew early enough it would be doable. We set work each day anyway for those who might need to isolate., surely red and amber should be closing i think in terms of set up if we knew early enough it would be doable we set work each day anyway for those who might need to isolate,True,False
698,1.4944056513422828e+18,2022-02-17 20:17:26+00:00,['1494405651342282758'],@herefordteacher I'm in the Amber zone. Forecast is currently 60-70mph winds., im in the amber zone forecast is currently 6070mph winds,True,False
699,1.4944038412064932e+18,2022-02-17 20:10:15+00:00,['1494403841206493188'],@skecksi That's so dangerous!, thats so dangerous,True,False
700,1.4943993855596052e+18,2022-02-17 19:52:32+00:00,['1494399385559605248'],@thatteacherguy_ @_MissieBee I'm astounded more schools aren't closing. Many children walk to school!,  im astounded more schools arent closing many children walk to school,True,False
701,1.4943991489336607e+18,2022-02-17 19:51:36+00:00,['1494399148933660681'],@_MissieBee I meant to type 60mph. Really nervous about that! 80mph and still having to go out in it? Wow!, i meant to type 60mph really nervous about that 80mph and still having to go out in it wow,True,False
702,1.4943941190824591e+18,2022-02-17 19:31:37+00:00,['1494394119082459137'],Darrell's work at our amazing infant school. These are great @DarrellWakelam! Looking forward to seeing this when I next pop over to Infants. #edutwitter https://t.co/oawaDkfMH7,darrells work at our amazing infant school these are great  looking forward to seeing this when i next pop over to infants  ,True,False
703,1.494365529368408e+18,2022-02-17 17:38:00+00:00,['1494365529368408066'],@_MrLevick Yep. Lots of gaps to try and plug!, yep lots of gaps to try and plug,True,False
704,1.4943486283616338e+18,2022-02-17 16:30:51+00:00,['1494348628361633792'],"I'm SO proud of my class's Georgia O'Keeffe inspired flower paintings. They worked really hard on them! A couple of finishing touched needed on some, &amp; some children were away so need to finish, but otherwise complete &amp; ready for display. #edutwitter #art #painting https://t.co/6Uun8D6hao",im so proud of my classs georgia okeeffe inspired flower paintings they worked really hard on them a couple of finishing touched needed on some amp some children were away so need to finish but otherwise complete amp ready for display    ,True,False
705,1.49407057358823e+18,2022-02-16 22:05:57+00:00,['1494070573588230145'],@CensoredHead Yes. All the time., yes all the time,True,False
706,1.4938926521646572e+18,2022-02-16 10:18:58+00:00,['1493892652164657153'],Oh these are just fab! Well done Year 5. https://t.co/dsneYuGyRe,oh these are just fab well done year 5 ,True,False
707,1.4929594343976018e+18,2022-02-13 20:30:41+00:00,['1492959434397601795'],@alisonvaughan20 @MrWithersAHT It's definitely a lot and you're spread very thin.,  its definitely a lot and youre spread very thin,True,False
708,1.4929587538801705e+18,2022-02-13 20:27:59+00:00,['1492958753880170498'],"@MrAllington I usually only hear about Facebook if someone has used one of my ideas or shared my resources, as someone on Twitter usually tells me. Otherwise I don't go on it. I find Twitter much more friendly and if people use/share your ideas they are more likely to credit you.", i usually only hear about facebook if someone has used one of my ideas or shared my resources as someone on twitter usually tells me otherwise i dont go on it i find twitter much more friendly and if people useshare your ideas they are more likely to credit you,True,False
709,1.492955509594501e+18,2022-02-13 20:15:05+00:00,['1492955509594501122'],@MrAllington Facebook is an odd place I think. I tend to avoid it as best I can. I don't think what you said was negative at all., facebook is an odd place i think i tend to avoid it as best i can i dont think what you said was negative at all,True,False
710,1.4929548830703045e+18,2022-02-13 20:12:36+00:00,['1492954883070304258'],@Sarah14143695 @MrsGormanEYFS @MrsAEYFS @MrMcofficial86 But covid happened and it's still here. Ignoring it is ludicrous. Also these percentages are strange to me because each cohort is different.,    but covid happened and its still here ignoring it is ludicrous also these percentages are strange to me because each cohort is different,True,False
713,1.4929496787988193e+18,2022-02-13 19:51:55+00:00,['1492949678798819328'],@DarrellWakelam @RobertMorrisse3 We still have the dodo we made as staff in the ICT suite that needs finishing at some point.,  we still have the dodo we made as staff in the ict suite that needs finishing at some point,True,False
714,1.492949042220843e+18,2022-02-13 19:49:23+00:00,['1492949042220843009'],"@DarrellWakelam @RobertMorrisse3 Haha I'm not sure he gets a look in with the biscuits. Hence the weight loss. 

I heard! Hope you have fun. When are you due to come to Juniors? I'm sure Rob said March.","  haha im not sure he gets a look in with the biscuits hence the weight loss 

i heard hope you have fun when are you due to come to juniors im sure rob said march",True,False
715,1.4929462406272246e+18,2022-02-13 19:38:16+00:00,['1492946240627224588'],@DarrellWakelam @RobertMorrisse3 Haha good one Darrell! 👍  We find this skeleton everywhere. It was in the staff room this week. https://t.co/BzBr5WkdI3,  haha good one darrell   we find this skeleton everywhere it was in the staff room this week ,True,False
716,1.4928891881732342e+18,2022-02-13 15:51:33+00:00,['1492889188173234179'],"@reads_and_draws Yes, I've done the progression document.", yes ive done the progression document,True,False
717,1.49287088495625e+18,2022-02-13 14:38:49+00:00,['1492870884956250114'],@ekirogers We do D&amp;T weeks. 1 each term., we do dampt weeks 1 each term,True,False
718,1.4928582853971026e+18,2022-02-13 13:48:45+00:00,['1492858285397102593'],This rainy Sunday morning was spent creating &amp; updating our Art overviews (a work in progress). I'm now spending the afternoon bowling with my 6yr old. Hope you're all enjoying your Sunday. #edutwitter https://t.co/HIxUTmYtuz,this rainy sunday morning was spent creating amp updating our art overviews a work in progress im now spending the afternoon bowling with my 6yr old hope youre all enjoying your sunday  ,True,False
719,1.4928226397773988e+18,2022-02-13 11:27:07+00:00,['1492822639777398784'],"@nadhimzahawi @educationgovuk @TheSun I'm a Y6 teacher. I've never shared political views with children, nor opened up conversation about government. Ever. Yet children have plenty to say about current issues. This comes from home. Are parents going to be told not to sway them too or is it just us you're focused on?",   im a y6 teacher ive never shared political views with children nor opened up conversation about government ever yet children have plenty to say about current issues this comes from home are parents going to be told not to sway them too or is it just us youre focused on,True,False
720,1.4922128598702694e+18,2022-02-11 19:04:04+00:00,['1492212859870269452'],"@JosephOak35 Just finished Percentages. But I'll definitely need to go back to reinforce FDPs. Then choosing where to get next will be difficult. Not sure whether to go for a whole block, or key parts of a range of blocks. No idea! So much to do &amp; so many gaps.", just finished percentages but ill definitely need to go back to reinforce fdps then choosing where to get next will be difficult not sure whether to go for a whole block or key parts of a range of blocks no idea so much to do amp so many gaps,True,False
721,1.492202136960176e+18,2022-02-11 18:21:27+00:00,['1492202136960176129'],@JKitch90 Maths &amp; writing have been badly affected., maths amp writing have been badly affected,True,False
723,1.4911413564626903e+18,2022-02-08 20:06:18+00:00,['1491141356462690304'],@emmccatt I had this yesterday! 😂, i had this yesterday ,True,False
724,1.4911100217654354e+18,2022-02-08 18:01:47+00:00,['1491110021765435392'],@MathsImpact It's such a difficult one. It's heartbreaking when children approach you who are so fed up with behaviour affecting their learning and making them feel unsafe., its such a difficult one its heartbreaking when children approach you who are so fed up with behaviour affecting their learning and making them feel unsafe,True,False
725,1.490779413784449e+18,2022-02-07 20:08:04+00:00,['1490779413784449029'],@WhistleblowingT Utter madness. Just when you think you've heard it all something like this comes along., utter madness just when you think youve heard it all something like this comes along,True,False
726,1.4907775174306447e+18,2022-02-07 20:00:32+00:00,['1490777517430644745'],@chrismann755 @janeconsidine @guruteaching @WritingRocks_17 Ohhhhh I love this. Whenever I've done work on atmosphere I just have the two paragraphs side by side to compare. Never thought to use post-its like this. Genius!,    ohhhhh i love this whenever ive done work on atmosphere i just have the two paragraphs side by side to compare never thought to use postits like this genius,True,False
727,1.4907559245412923e+18,2022-02-07 18:34:43+00:00,['1490755924541292545'],@JennyCroft76 We give ours pen licences when they transition from Infants to Juniors. They all get them at the same time at the beginning of the year. This avoids the feelings of being left out like you describe., we give ours pen licences when they transition from infants to juniors they all get them at the same time at the beginning of the year this avoids the feelings of being left out like you describe,True,False
728,1.490754320475865e+18,2022-02-07 18:28:21+00:00,['1490754320475865099'],"This was the next couple of lessons of Art (first lesson is previous post). We did some scaling up to draw a chosen flower and then did some colour work on tints, tones and shades based on the chosen images. #edutwitter https://t.co/glcgyzHMYp",this was the next couple of lessons of art first lesson is previous post we did some scaling up to draw a chosen flower and then did some colour work on tints tones and shades based on the chosen images  ,True,False
729,1.4907520142084096e+18,2022-02-07 18:19:11+00:00,['1490752014208409605'],My class are loving exploring Georgia O'Keeffe in Art at the moment. This first lesson involved exploring her art work &amp; reading information about her based on this fabulous book. #edutwitter https://t.co/M0exScLW4E,my class are loving exploring georgia okeeffe in art at the moment this first lesson involved exploring her art work amp reading information about her based on this fabulous book  ,True,False
730,1.4907513271268923e+18,2022-02-07 18:16:27+00:00,['1490751327126892544'],We've loved studying The Lighthouse and children retold the story. It was lovely to see them bringing in ideas and characters from Letters From The Lighthouse. #edutwitter https://t.co/EzBNRGqI0D,weve loved studying the lighthouse and children retold the story it was lovely to see them bringing in ideas and characters from letters from the lighthouse  ,True,False
731,1.4907504859046953e+18,2022-02-07 18:13:07+00:00,['1490750485904695302'],It's been a bit of a double page spread couple of weeks. These are our explanation texts on the heart from our Science books. #edutwitter https://t.co/cohkDiUmYX,its been a bit of a double page spread couple of weeks these are our explanation texts on the heart from our science books  ,True,False
732,1.4904185819385815e+18,2022-02-06 20:14:15+00:00,['1490418581938581505'],"@MrsVRE I've always said male-strom, but that could be wrong.", ive always said malestrom but that could be wrong,True,False
733,1.4904165341660652e+18,2022-02-06 20:06:07+00:00,['1490416534166065153'],@LTeacher123 We used to have one book for writing &amp; one for reading. Then it was decided all English &amp; Humanities would go together (not my choice) &amp; we would have a separate book for reading. I'd prefer to go back to what we had before personally., we used to have one book for writing amp one for reading then it was decided all english amp humanities would go together not my choice amp we would have a separate book for reading id prefer to go back to what we had before personally,True,False
734,1.490415372851417e+18,2022-02-06 20:01:30+00:00,['1490415372851417097'],@KarlDuke8 @smithsmm @PaulWat5 @f33lthesun @i_teach_things @MissC_1717 @MissBTeaches_ @Teacherglitter @RobCrossley4 Reading across the curriculum is key if children are to a) continually practise their reading skills; b) develop their understanding of the world further (through reading non-fiction mostly); and c) understand how themes and values can be explored in stories &amp; poetry.,         reading across the curriculum is key if children are to a continually practise their reading skills b develop their understanding of the world further through reading nonfiction mostly and c understand how themes and values can be explored in stories amp poetry,True,False
735,1.4903724808334008e+18,2022-02-06 17:11:03+00:00,['1490372480833400832'],"@jude_teacher This was taken before school started, I should add. It was on their display board of work they'd been doing that week.", this was taken before school started i should add it was on their display board of work theyd been doing that week,True,False
736,1.4903611158380708e+18,2022-02-06 16:25:54+00:00,['1490361115838070785'],"Thank you @Suchmo83 for a fantastic read. In my humble opinion, your book was accessible, clear, concise, and useful for anyone, regardless of prior knowledge of reading. One that I'd say should be in school CPD libraries. #edutwitter https://t.co/kTQOkWepu5",thank you  for a fantastic read in my humble opinion your book was accessible clear concise and useful for anyone regardless of prior knowledge of reading one that id say should be in school cpd libraries  ,True,False
737,1.4903437681843036e+18,2022-02-06 15:16:58+00:00,['1490343768184303622'],@MrsMentore @MichaelT1979 @_MissieBee @MissKhan__ Our Y5 did this. They used Arabian Nights &amp; The Boy At The Back of The Class in English/reading. I don't know much of the history side that they taught but I know they studied Islamic patterns &amp; Zaha Hadid in Art. They looked at Nadiya Hussain in D&amp;T &amp; made samosas. https://t.co/feDY1MX7a6,    our y5 did this they used arabian nights amp the boy at the back of the class in englishreading i dont know much of the history side that they taught but i know they studied islamic patterns amp zaha hadid in art they looked at nadiya hussain in dampt amp made samosas ,True,False
738,1.490342119759831e+18,2022-02-06 15:10:25+00:00,['1490342119759831045'],"@Mat_at_Brookes On the flip side, having a high following can be daunting as people sometimes assume you know what you're talking about &amp; your work/ideas are best. Reality is that some with lower followings have more expertise etc. Likes are odd too. All about algorithms that I don't understand.", on the flip side having a high following can be daunting as people sometimes assume you know what youre talking about amp your workideas are best reality is that some with lower followings have more expertise etc likes are odd too all about algorithms that i dont understand,True,False
739,1.4903356635935048e+18,2022-02-06 14:44:45+00:00,['1490335663593504774'],@MissBTeaches_ We're using this book next half term when we study her in Art. Looking forward to it!, were using this book next half term when we study her in art looking forward to it,True,False
740,1.4902948307690906e+18,2022-02-06 12:02:30+00:00,['1490294830769090572'],@JoeBarnesMoran1 @JosephOak35 Not sure yet. It was done virtually for us and we couldn't discuss it with each other. I do know the head of moderation for our LA was going to contact STA about it.,  not sure yet it was done virtually for us and we couldnt discuss it with each other i do know the head of moderation for our la was going to contact sta about it,True,False
741,1.4902933433974456e+18,2022-02-06 11:56:36+00:00,['1490293343397445633'],@JosephOak35 @JoeBarnesMoran1 I know which one you're referring to. Went through this last week.,  i know which one youre referring to went through this last week,True,False
742,1.490037523166511e+18,2022-02-05 19:00:03+00:00,['1490037523166511119'],Love this @Suchmo83!  #edutwitter https://t.co/T5LdXEsiDJ,love this    ,True,False
743,1.4900208878521958e+18,2022-02-05 17:53:57+00:00,['1490020887852195840'],@twinklresources @KidsBloomsbury I'm torn...so I'll go by my favourite colour and pick Ravenclaw.,  im tornso ill go by my favourite colour and pick ravenclaw,True,False
744,1.489707510625878e+18,2022-02-04 21:08:42+00:00,['1489707510625878020'],@Rosemarycalm @_Reading_Rocks_ @theliteracytree We're studying the same book from next week. Our next topic is The Changing Roles of Women. So excited to teach it!,   were studying the same book from next week our next topic is the changing roles of women so excited to teach it,True,False
745,1.4897038232707195e+18,2022-02-04 20:54:03+00:00,['1489703823270719488'],@lifeatthenest @Suchmo83 As soon as it came out I wanted it but I tried to be good and get my TBR pile down first!,  as soon as it came out i wanted it but i tried to be good and get my tbr pile down first,True,False
746,1.489699051578798e+18,2022-02-04 20:35:05+00:00,['1489699051578798086'],@emmccatt Haha I feel seen. 🤣, haha i feel seen ,True,False
747,1.489675017587671e+18,2022-02-04 18:59:35+00:00,['1489675017587671052'],@smithsmm So glad someone else is saying this Simon. It's unbelievable that they think it's the right time to bring SATs back. So many children still off and so many gaps to fill. I just want to teach and get those basics right so they can move on to secondary prepared., so glad someone else is saying this simon its unbelievable that they think its the right time to bring sats back so many children still off and so many gaps to fill i just want to teach and get those basics right so they can move on to secondary prepared,True,False
748,1.4896672892177367e+18,2022-02-04 18:28:53+00:00,['1489667289217736710'],I broke my 'no buying CPD books until you've fully read all the others' rule. I couldn't wait any longer to get this one. @Suchmo83 #edutwitter https://t.co/N1Re4joZCw,i broke my no buying cpd books until youve fully read all the others rule i couldnt wait any longer to get this one   ,True,False
749,1.4893630969258394e+18,2022-02-03 22:20:07+00:00,['1489363096925839363'],@FakeHeadteacher Ridiculously full., ridiculously full,True,False
750,1.4893410518946488e+18,2022-02-03 20:52:32+00:00,['1489341051894648838'],@Thinkingschool2 I can't stand homework. I just want my class to read &amp; practise times tables. That's it. Not Maths &amp; English tasks each week. They're young &amp; some are busy enough with clubs. Others are in after school childcare until late. Family time &amp; reading is so important., i cant stand homework i just want my class to read amp practise times tables thats it not maths amp english tasks each week theyre young amp some are busy enough with clubs others are in after school childcare until late family time amp reading is so important,True,False
751,1.4893347737094758e+18,2022-02-03 20:27:35+00:00,['1489334773709475843'],"@UnofficialOA Finding similar with house viewings.
'We have a block viewing Monday morning.'
'Can't make that as I'm a teacher &amp; no on can cover me.'
'Sorry we're only doing Monday.'
😫"," finding similar with house viewings
we have a block viewing monday morning
cant make that as im a teacher amp no on can cover me
sorry were only doing monday
",True,False
752,1.4893179573648138e+18,2022-02-03 19:20:45+00:00,['1489317957364813831'],"Signed up! @Suchmo83 is a fountain of knowledge when it comes to reading. Looking forward to this! Free too, which is wonderfully generous.  #edutwitter https://t.co/9uOtm7pDFN",signed up  is a fountain of knowledge when it comes to reading looking forward to this free too which is wonderfully generous   ,True,False
753,1.4889604036694958e+18,2022-02-02 19:39:58+00:00,['1488960403669495812'],@OonaghKelleher It's the 'we know they've missed time from school but we're not adapting the tests' attitude that gets me. Why set children up like this?! How can government claim to care about the impact of the pandemic on children yet let them sit tests they know they'll struggle with?, its the we know theyve missed time from school but were not adapting the tests attitude that gets me why set children up like this how can government claim to care about the impact of the pandemic on children yet let them sit tests they know theyll struggle with,True,False
754,1.4889346097022444e+18,2022-02-02 17:57:28+00:00,['1488934609702244365'],@Oates27 @educatorabroad @jdurran Yes I've tried this myself a few times.,   yes ive tried this myself a few times,True,False
755,1.488932042725335e+18,2022-02-02 17:47:16+00:00,['1488932042725335049'],@MrsSmanwar I agree. Children need time to explore text type with lots of high quality examples., i agree children need time to explore text type with lots of high quality examples,True,False
756,1.4889313241068462e+18,2022-02-02 17:44:25+00:00,['1488931324106846211'],@PieCorbett @educatorabroad I find the issue with tickable SC is that children throw features into writing rather than just focusing on the content. The only criteria I ever give mine is to remember the purpose &amp; who they are writing for. Only exception is if we 'slow write' to practise skills as a class.,  i find the issue with tickable sc is that children throw features into writing rather than just focusing on the content the only criteria i ever give mine is to remember the purpose amp who they are writing for only exception is if we slow write to practise skills as a class,True,False
757,1.488928061298987e+18,2022-02-02 17:31:27+00:00,['1488928061298987015'],@J_P_Hawkins @cjaneteach @MrTs_NQTs @ITTinfo @EnserMark @UnofficialOA @greeborunner @teacherhead @MissBTeaches_ @DoWise @ArticuLaight @son1bun @Emma_Turner75 @thosethatcan @AdrianBethune Cheers cuz!,               cheers cuz,True,False
759,1.4885550711807877e+18,2022-02-01 16:49:19+00:00,['1488555071180787713'],@educatorabroad I've planned writing in a variety of ways depending on what the piece is. I'll have a look and see if I have any examples to hand., ive planned writing in a variety of ways depending on what the piece is ill have a look and see if i have any examples to hand,True,False
760,1.488264627859325e+18,2022-01-31 21:35:12+00:00,['1488264627859324930'],"@primaryteach_rs We don't record written evidence in all lessons in foundation subjects. Sometimes we have debates, discussions, drama activities etc so these aren't recorded.", we dont record written evidence in all lessons in foundation subjects sometimes we have debates discussions drama activities etc so these arent recorded,True,False
761,1.4877216379737948e+18,2022-01-30 09:37:33+00:00,['1487721637973794821'],@mrlockyer Trying to determine what every loud noise past 8pm might be. Was it a car exhaust? Was it a firework? Who would make such a racket at this time?, trying to determine what every loud noise past 8pm might be was it a car exhaust was it a firework who would make such a racket at this time,True,False
762,1.4877168038581248e+18,2022-01-30 09:18:21+00:00,['1487716803858124802'],@MrsCakeTeaches @MrsSpalding Ditto for me in Year 6.,  ditto for me in year 6,True,False
763,1.4873868779173435e+18,2022-01-29 11:27:20+00:00,['1487386877917343745'],@smithsmm Oh this is really sad. I hope it wasn't actually given to children. 🙈, oh this is really sad i hope it wasnt actually given to children ,True,False
764,1.4873581969016832e+18,2022-01-29 09:33:22+00:00,['1487358196901683200'],@dannyteaching Oh wow! That's a lot off., oh wow thats a lot off,True,False
765,1.4871810139860296e+18,2022-01-28 21:49:18+00:00,['1487181013986029568'],@missh2710 @mr_spayne @JosephOak35 That's madness.,   thats madness,True,False
