Unnamed: 0,id,created_at,edit_history_tweet_ids,text,clean_text,non_english,whitespace
2046,1.4007613164202394e+18,2021-06-04 10:28:17+00:00,['1400761316420239363'],@Dan22007920 You're assuming that I'd let the children read this. This is for me as a teacher to help answer questions. It also goes without saying that in RE we always say things like 'Christians believe...', youre assuming that id let the children read this this is for me as a teacher to help answer questions it also goes without saying that in re we always say things like christians believe,True,False
2047,1.4007608113883464e+18,2021-06-04 10:26:16+00:00,['1400760811388346368'],@josawtell I'd always do that., id always do that,True,False
2048,1.4007600674907136e+18,2021-06-04 10:23:19+00:00,['1400760067490713601'],@rebecca_teach @palepins @misscteachre I would always say 'Christians believe that...' That's why this was bought for me and not for the book corner.,   i would always say christians believe that thats why this was bought for me and not for the book corner,True,False
2049,1.4007354595595878e+18,2021-06-04 08:45:32+00:00,['1400735459559587843'],"@VickyIsaac6 Picasso, yes. Not Gaudi.", picasso yes not gaudi,True,False
2050,1.4005337741658522e+18,2021-06-03 19:24:07+00:00,['1400533774165852160'],"@TJGriffiths @Suey2chaussures @ClareCampbell7 @fidsta77 @TeacherPaul1978 @SlatteryMr @teacher_mr_r @Teacherglitter @awnorthumbria @BexHeadTeacher @ProudHeadTeach1 @MrWithersAHT @MrHtheteacher I've posted a few today if you want to take a look. Also a couple of days ago I asked for poetry recommendations and got great suggestions from Michael Rosen, Pie Corbett and other poets/tweeters.",             ive posted a few today if you want to take a look also a couple of days ago i asked for poetry recommendations and got great suggestions from michael rosen pie corbett and other poetstweeters,True,False
2051,1.4005316748746465e+18,2021-06-03 19:15:46+00:00,['1400531674874646528'],@michjay1 Haha how Jeremy Kyle., haha how jeremy kyle,True,False
2052,1.4005314108433203e+18,2021-06-03 19:14:43+00:00,['1400531410843320331'],@B4Suzan Definitely one to select from rather than to leave in a book corner for children to peruse., definitely one to select from rather than to leave in a book corner for children to peruse,True,False
2053,1.400522411699757e+18,2021-06-03 18:38:58+00:00,['1400522411699757065'],@DarrellWakelam @Teacherglitter Emotions in cardboard form could be a thing. 😄 https://t.co/gCwsO5FYEX,  emotions in cardboard form could be a thing  ,True,False
2054,1.400521497161175e+18,2021-06-03 18:35:20+00:00,['1400521497161175044'],@Teacherglitter I also have Emotionary that I use with Y6. https://t.co/GZ6CMiTX8X, i also have emotionary that i use with y6 ,True,False
2055,1.4005189692792545e+18,2021-06-03 18:25:17+00:00,['1400518969279254532'],"Sometimes I choose books not to read fully, but to dip into to inspire writing. This is one of those books I've chosen for RE. It'll be lovely to use select pages for discussion &amp; it could prompt reflections in a similar style. Beautiful illustrations too. #edutwitter https://t.co/8ocjGOAJdw",sometimes i choose books not to read fully but to dip into to inspire writing this is one of those books ive chosen for re itll be lovely to use select pages for discussion amp it could prompt reflections in a similar style beautiful illustrations too  ,True,False
2056,1.4005118506561905e+18,2021-06-03 17:57:00+00:00,['1400511850656190469'],"@Mr_S_Cains Definitely for older children and a book that I would select from, rather than leaving in the book corner.", definitely for older children and a book that i would select from rather than leaving in the book corner,True,False
2057,1.4005046766725407e+18,2021-06-03 17:28:29+00:00,['1400504676672540678'],"This book is a gem! Two poets have created a dictionary of poems based on different themes (hope, diversity, peace etc). Each double page is a poem (all different types), an anecdote from the poet, a quote &amp; an action for the reader. #edutwitter https://t.co/H1hyqcth1s",this book is a gem two poets have created a dictionary of poems based on different themes hope diversity peace etc each double page is a poem all different types an anecdote from the poet a quote amp an action for the reader  ,True,False
2058,1.4005015126615736e+18,2021-06-03 17:15:55+00:00,['1400501512661573632'],This book is gorgeous. A chronological look at the birth of the suffragette movement. Perfect for exploring with older children the changing roles of women. #edutwitter https://t.co/QDDVU6komN,this book is gorgeous a chronological look at the birth of the suffragette movement perfect for exploring with older children the changing roles of women  ,True,False
2059,1.4004988076081234e+18,2021-06-03 17:05:10+00:00,['1400498807608123396'],@Justnomor 🤣🤣🤣 I'm so glad you didn't.,  im so glad you didnt,True,False
2061,1.4004983473587896e+18,2021-06-03 17:03:20+00:00,['1400498347358789633'],Thanks @Justnomor for spotting my typo in the first posting of this book. (Damn phone!) This is a lovely book of ANIMAL themed shape poems. 😅 #edutwitter https://t.co/acWxgj8qPW,thanks  for spotting my typo in the first posting of this book damn phone this is a lovely book of animal themed shape poems   ,True,False
2062,1.4004979209112166e+18,2021-06-03 17:01:38+00:00,['1400497920911216642'],@Justnomor hahaha I'll retweet!, hahaha ill retweet,True,False
2063,1.4004923078168453e+18,2021-06-03 16:39:20+00:00,['1400492307816845314'],As soon as I saw this I had to have it. A beautiful book of poems that personify emotions. Definitely a nice way to link poetry with PSHE.   #edutwitter https://t.co/m7cVdg2CuP,as soon as i saw this i had to have it a beautiful book of poems that personify emotions definitely a nice way to link poetry with pshe    ,True,False
2064,1.4004897040810516e+18,2021-06-03 16:28:59+00:00,['1400489704081051653'],"@MissM_KS2 @CND_UKteach Almost 36, so not too young. 😅",  almost 36 so not too young ,True,False
2065,1.4004888087270769e+18,2021-06-03 16:25:26+00:00,['1400488808727076864'],"@Missymusician81 Today I have mostly been trying my hardest but to be the best of my dream. 
(Mine is quite profound! 😅)"," today i have mostly been trying my hardest but to be the best of my dream 
mine is quite profound ",True,False
2066,1.400488487296639e+18,2021-06-03 16:24:09+00:00,['1400488487296638976'],"This book of poems to read aloud is lovely. I bought it for my boys, but it could also be used in lower KS2. I've already found one that will be perfect for Y3. #edutwitter https://t.co/ROT0Ttv8VV",this book of poems to read aloud is lovely i bought it for my boys but it could also be used in lower ks2 ive already found one that will be perfect for y3  ,True,False
2067,1.4004861323920794e+18,2021-06-03 16:14:48+00:00,['1400486132392079369'],I bought a book called Humans recently that I tweeted about. This one is similar but charts the journey of early humans across the world. #edutwitter https://t.co/eNr3g2vT5T,i bought a book called humans recently that i tweeted about this one is similar but charts the journey of early humans across the world  ,True,False
2068,1.400485003528659e+18,2021-06-03 16:10:19+00:00,['1400485003528658952'],"Thank you @lottiefox13 for recommending this! Ideas on how to write poetry, with examples and 'your turn' activities. #edutwitter https://t.co/6a5y0uyhIn",thank you  for recommending this ideas on how to write poetry with examples and your turn activities  ,True,False
2069,1.4004829744419144e+18,2021-06-03 16:02:15+00:00,['1400482974441914371'],This is an excellent book of shape poems based on inspirational people. I like that each poem comes with information about each person. This way children will see why the shapes have been chosen. #edutwitter https://t.co/seFi4SrS1O,this is an excellent book of shape poems based on inspirational people i like that each poem comes with information about each person this way children will see why the shapes have been chosen  ,True,False
2070,1.4004791776194232e+18,2021-06-03 15:47:10+00:00,['1400479177619423237'],I've been looking at how to get books and reading into other areas of the curriculum. This is lovely for Art. #edutwitter https://t.co/ZX4jcHPAfq,ive been looking at how to get books and reading into other areas of the curriculum this is lovely for art  ,True,False
2071,1.400476533245059e+18,2021-06-03 15:36:39+00:00,['1400476533245059075'],"This picture book is beautiful! It explains, using song and sound as a theme, that children are all unique and all have rights. Just lovely! #edutwitter https://t.co/NuDXmLmD9T",this picture book is beautiful it explains using song and sound as a theme that children are all unique and all have rights just lovely  ,True,False
2072,1.400474584835629e+18,2021-06-03 15:28:55+00:00,['1400474584835629059'],Very much looking forward to reading this @MichaelRosenYes. Thank you for drawing my attention to it. #edutwitter https://t.co/jsd83aFBE9,very much looking forward to reading this  thank you for drawing my attention to it  ,True,False
2073,1.4004736975138734e+18,2021-06-03 15:25:23+00:00,['1400473697513873413'],@CND_UKteach Haha I'm that teacher who didn't. Until now! 😅, haha im that teacher who didnt until now ,True,False
2074,1.4004735989308498e+18,2021-06-03 15:25:00+00:00,['1400473598930849800'],@rachkenny79 @PieCorbett I already have that one. It's great!,  i already have that one its great,True,False
2075,1.4004722445188055e+18,2021-06-03 15:19:37+00:00,['1400472244518805505'],Next up I have this book containing poems on the theme of our planet. These is separated into sections and interspersed with images. #edutwitter https://t.co/gwW6ZlxYUb,next up i have this book containing poems on the theme of our planet these is separated into sections and interspersed with images  ,True,False
2076,1.4004705446891233e+18,2021-06-03 15:12:51+00:00,['1400470544689123329'],Today has been a great day for books. I'm about to do some book spamming - sorry! Kicking off with this one that I can't believe I'd not bought earlier. This is a huge compendium of poems of every type! #edutwitter https://t.co/SGJxH1LvM7,today has been a great day for books im about to do some book spamming  sorry kicking off with this one that i cant believe id not bought earlier this is a huge compendium of poems of every type  ,True,False
2077,1.4004675520991273e+18,2021-06-03 15:00:58+00:00,['1400467552099127309'],@KayteWriteDream 1980, 1980,True,False
2078,1.4004291597850624e+18,2021-06-03 12:28:25+00:00,['1400429159785062404'],"I've not started reading this yet, but already the introduction and beautiful illustrations have grabbed me. What I also like about this, is that it features girls from different countries &amp; cultures. #edutwitter https://t.co/WRxqcR3YC0",ive not started reading this yet but already the introduction and beautiful illustrations have grabbed me what i also like about this is that it features girls from different countries amp cultures  ,True,False
2079,1.4004169888208036e+18,2021-06-03 11:40:03+00:00,['1400416988820803584'],"What a gem this is! I've only dipped in so far but it is a whistle-stop tour of poetry teaching, with different types explored and poetry game ideas. #edutwitter https://t.co/gKZbGJZnsi",what a gem this is ive only dipped in so far but it is a whistlestop tour of poetry teaching with different types explored and poetry game ideas  ,True,False
2080,1.4000721097585582e+18,2021-06-02 12:49:37+00:00,['1400072109758558213'],@SkyNews I've never worked in a school that finishes at 2:45. Where are these schools? Yet again showing how out of touch he is., ive never worked in a school that finishes at 245 where are these schools yet again showing how out of touch he is,True,False
2081,1.3999638917283226e+18,2021-06-02 05:39:36+00:00,['1399963891728322561'],@eenalol Yep! I had a school dream last night and the night before., yep i had a school dream last night and the night before,True,False
2082,1.3998474702602772e+18,2021-06-01 21:56:59+00:00,['1399847470260277248'],@Teacherglitter @jonnybid Yep here too.,  yep here too,True,False
2083,1.399847397975548e+18,2021-06-01 21:56:42+00:00,['1399847397975547911'],@jonnybid I don't often go on Facebook anymore. The messages were unreal! Some people were really quite demanding or rude. Nothing at all like Twitter., i dont often go on facebook anymore the messages were unreal some people were really quite demanding or rude nothing at all like twitter,True,False
2084,1.399840283664302e+18,2021-06-01 21:28:26+00:00,['1399840283664302084'],@mr_spayne Love it!, love it,True,False
2086,1.3998182023104922e+18,2021-06-01 20:00:41+00:00,['1399818202310492160'],@julie_trudgill We have no comment boxes for subjects anymore. Just general comment., we have no comment boxes for subjects anymore just general comment,True,False
2087,1.3998148015226266e+18,2021-06-01 19:47:10+00:00,['1399814801522626563'],I just put all the names on the front of my school reports. Winning! #edutwitter https://t.co/kdXYFfVglL,i just put all the names on the front of my school reports winning  ,True,False
2088,1.399791424384684e+18,2021-06-01 18:14:17+00:00,['1399791424384684037'],"@PieCorbett @MichaelRosenYes @JulieAnnaPoetry Pie, you're a star! Thank you.",   pie youre a star thank you,True,False
2089,1.3997676585019187e+18,2021-06-01 16:39:50+00:00,['1399767658501918721'],@jonnybid I just can't understand why the government doesn't do things that make sense. I almost feel sometimes that they don't want the gap to close., i just cant understand why the government doesnt do things that make sense i almost feel sometimes that they dont want the gap to close,True,False
2090,1.39975448532557e+18,2021-06-01 15:47:30+00:00,['1399754485325570049'],@MissM_KS2 It's good., its good,True,False
2092,1.3996812026641818e+18,2021-06-01 10:56:18+00:00,['1399681202664181768'],@PieCorbett @MichaelRosenYes @nealzetterpoet @joshuaseigal Thank you!,    thank you,True,False
2093,1.3996794567976591e+18,2021-06-01 10:49:21+00:00,['1399679456797659136'],@MissC_1717 Yes. And has a huge knock on effect., yes and has a huge knock on effect,True,False
2094,1.399678263606317e+18,2021-06-01 10:44:37+00:00,['1399678263606317061'],@MissC_1717 I used to have the same problem when working in Y3. A fair few difficult conversations with parents each year which unfortunately damaged relationships before they even got started., i used to have the same problem when working in y3 a fair few difficult conversations with parents each year which unfortunately damaged relationships before they even got started,True,False
2095,1.399677276980134e+18,2021-06-01 10:40:42+00:00,['1399677276980133890'],@deputygrocott @Mr_AlmondED Yep. One school's expected standard in Y3 can be quite different in another depending on the tracking system used and what value is placed on certain objectives from the NC.,  yep one schools expected standard in y3 can be quite different in another depending on the tracking system used and what value is placed on certain objectives from the nc,True,False
2096,1.399676385543737e+18,2021-06-01 10:37:09+00:00,['1399676385543737344'],@Mr_AlmondED Unfortunately it depends on where you work. I know my LA use those terms for all year groups. I've never understood it for years 3-5. Also parents expect it. They want to know where their children are., unfortunately it depends on where you work i know my la use those terms for all year groups ive never understood it for years 35 also parents expect it they want to know where their children are,True,False
2097,1.399667344088121e+18,2021-06-01 10:01:14+00:00,['1399667344088121346'],@MissKingTeach Tomorrow is report day for me as it's due to rain., tomorrow is report day for me as its due to rain,True,False
2098,1.3996630027025613e+18,2021-06-01 09:43:58+00:00,['1399663002702561280'],@MrsBezoari Ditto!, ditto,True,False
2099,1.3996629081965076e+18,2021-06-01 09:43:36+00:00,['1399662908196507650'],@KenilworthBook @mrjamesmayhew @MrEagletonIan @OwletPress @stephenfry @autumnrosewell @IndieBookshopUK @Gardners @WarksPride @Pride @BBCCWR @realvicminett @BBCMidlandsRBX @bouncemarketing @wearefreeradio Oh that's stunning!,               oh thats stunning,True,False
2100,1.3996555892911022e+18,2021-06-01 09:14:31+00:00,['1399655589291102208'],@DarrellWakelam @MrEagletonIan @mrjamesmayhew @OwletPress Darrell is there anything you can't do with cardboard?! This is great!,    darrell is there anything you cant do with cardboard this is great,True,False
2101,1.3996516644838277e+18,2021-06-01 08:58:55+00:00,['1399651664483827714'],@MrsSarahMullin Haha no! I'm doing the rounds again? 🤣, haha no im doing the rounds again ,True,False
2102,1.3994668252100198e+18,2021-05-31 20:44:26+00:00,['1399466825210019847'],@MichaelRosenYes @jonnywalker_edu Perfect! Thank you so much for the help.,  perfect thank you so much for the help,True,False
2103,1.3994653829776056e+18,2021-05-31 20:38:42+00:00,['1399465382977605642'],@joshuaseigal @MrsSTeaches @MichaelRosenYes @PieCorbett @JulieAnnaPoetry We currently do three poetry units in each year group.,     we currently do three poetry units in each year group,True,False
2104,1.399464213786108e+18,2021-05-31 20:34:04+00:00,['1399464213786107905'],@MichaelRosenYes @clpe1 @charliehacking CLPE yes - I need to explore their work properly.,   clpe yes  i need to explore their work properly,True,False
2105,1.399463607574823e+18,2021-05-31 20:31:39+00:00,['1399463607574822912'],@MrsSTeaches @MichaelRosenYes @PieCorbett @JulieAnnaPoetry Definitely in 6 as this is good for transitioning to Ks3.,    definitely in 6 as this is good for transitioning to ks3,True,False
2106,1.3994633205922652e+18,2021-05-31 20:30:31+00:00,['1399463320592265223'],@nealzetterpoet @moses_brian @PieCorbett @MichaelRosenYes @joshuaseigal I think they're often out in lower ks2 but I think they should be higher. They're not easy to do well.,     i think theyre often out in lower ks2 but i think they should be higher theyre not easy to do well,True,False
2107,1.3994624872973025e+18,2021-05-31 20:27:12+00:00,['1399462487297302531'],@MichaelRosenYes @jonnywalker_edu Ooh perfect! Can you tell me where I might find these? I can look online if I know what the book is called.,  ooh perfect can you tell me where i might find these i can look online if i know what the book is called,True,False
2108,1.399460854798721e+18,2021-05-31 20:20:43+00:00,['1399460854798721024'],"Furthermore, what would you say good poetry teaching looks like in ks2? Should there be a range of poetry types? Key poems explored? Language play activities? How would progression be evident? @MichaelRosenYes @PieCorbett @JulieAnnaPoetry (Please retweet) #edutwitter https://t.co/FZkzQefRbz",furthermore what would you say good poetry teaching looks like in ks2 should there be a range of poetry types key poems explored language play activities how would progression be evident    please retweet  ,True,False
2109,1.3994524642067825e+18,2021-05-31 19:47:22+00:00,['1399452464206782464'],@JulieAnnaPoetry @PieCorbett @MichaelRosenYes @nealzetterpoet @joshuaseigal Oh I love it! I think poetry lends itself beautifully to being presented in creative ways.,     oh i love it i think poetry lends itself beautifully to being presented in creative ways,True,False
2110,1.399452111461626e+18,2021-05-31 19:45:58+00:00,['1399452111461625860'],@nealzetterpoet @moses_brian @PieCorbett @MichaelRosenYes @joshuaseigal I'm thinking of using them in Y6 for this very reason. 😉,     im thinking of using them in y6 for this very reason ,True,False
2111,1.399444620879319e+18,2021-05-31 19:16:12+00:00,['1399444620879319042'],@moses_brian @PieCorbett @MichaelRosenYes @nealzetterpoet @joshuaseigal Thank you!,     thank you,True,False
2112,1.3994378524595528e+18,2021-05-31 18:49:18+00:00,['1399437852459552769'],@TheLisaOHare @Peanutpower4 @MichaelRosenYes @PieCorbett @nealzetterpoet @joshuaseigal Thank you!,      thank you,True,False
2113,1.3994378053239685e+18,2021-05-31 18:49:07+00:00,['1399437805323968517'],@nealzetterpoet @MissSykesMP @PieCorbett @MichaelRosenYes @joshuaseigal @moses_brian @JulieAnnaPoetry @JosephACoelho @SueHardyDawson Thank you!,         thank you,True,False
2114,1.3994377319866163e+18,2021-05-31 18:48:50+00:00,['1399437731986616320'],@JulieAnnaPoetry @PieCorbett @MichaelRosenYes @nealzetterpoet @joshuaseigal Love this! Though my bank balance may not. 😅😆,     love this though my bank balance may not ,True,False
2115,1.3994360059718287e+18,2021-05-31 18:41:58+00:00,['1399436005971828741'],@PieCorbett @MichaelRosenYes @nealzetterpoet @joshuaseigal Thank you!,    thank you,True,False
2116,1.399432065964286e+18,2021-05-31 18:26:19+00:00,['1399432065964285957'],@TheLisaOHare @Peanutpower4 @MichaelRosenYes @PieCorbett @nealzetterpoet @joshuaseigal I can't see the message you are replying to. Which book are you referring to?,      i cant see the message you are replying to which book are you referring to,True,False
2117,1.3994239798368215e+18,2021-05-31 17:54:11+00:00,['1399423979836821504'],@chrisdysonHT Unfortunately seems inevitable because our government are too slow to act yet again. I'm so deflated about it. I don't want yet another disrupted school year. 😫 This is a merry-go-round and I want to get off!, unfortunately seems inevitable because our government are too slow to act yet again im so deflated about it i dont want yet another disrupted school year  this is a merrygoround and i want to get off,True,False
2118,1.399423335755309e+18,2021-05-31 17:51:37+00:00,['1399423335755309058'],@joshuaseigal @PieCorbett @MichaelRosenYes @nealzetterpoet LOVE this one!,    love this one,True,False
2119,1.399420401470554e+18,2021-05-31 17:39:58+00:00,['1399420401470554114'],"I'm looking for good poetry to add to our curriculum. I'm looking for different poetry types (e.g acrostic, kenning &amp; cinquain poems) &amp; any must-explore poems. Any ideas? I already have The Lost Words. #edutwitter @PieCorbett @MichaelRosenYes @nealzetterpoet @joshuaseigal https://t.co/38F1gNAOYO",im looking for good poetry to add to our curriculum im looking for different poetry types eg acrostic kenning amp cinquain poems amp any mustexplore poems any ideas i already have the lost words      ,True,False
2120,1.399107861452673e+18,2021-05-30 20:58:02+00:00,['1399107861452673025'],@early_miss @Mr_B_Morgan @smithsmm @KarlDuke8 Oh that's brilliant.,    oh thats brilliant,True,False
2121,1.3990904196910326e+18,2021-05-30 19:48:44+00:00,['1399090419691032576'],@BadSchoolparent @smithsmm @KarlDuke8 I think I've found it now.,   i think ive found it now,True,False
2122,1.3990327718054216e+18,2021-05-30 15:59:40+00:00,['1399032771805421568'],@LBDulwich He has one but he hasn't worked this out. It was too fun watching him create this run. 😅, he has one but he hasnt worked this out it was too fun watching him create this run ,True,False
2123,1.3990084547532718e+18,2021-05-30 14:23:02+00:00,['1399008454753271809'],@MissBTeaches_ @UnofficialOA @MrCaseyBailey @PelePerformer @MrsSarahMullin Garden envy!,     garden envy,True,False
2124,1.3989776453254758e+18,2021-05-30 12:20:37+00:00,['1398977645325475843'],@KayFoster83 @twinklresources Oooh good tip,  oooh good tip,True,False
2125,1.3989745664085893e+18,2021-05-30 12:08:22+00:00,['1398974566408589314'],@twinklresources Hours of filling only for them to spent 20 minutes in it before claiming they're cold., hours of filling only for them to spent 20 minutes in it before claiming theyre cold,True,False
2126,1.398933883090096e+18,2021-05-30 09:26:43+00:00,['1398933883090096130'],@eaglethwack @MPboro2 Oh how amazing!,  oh how amazing,True,False
2128,1.3987322254667448e+18,2021-05-29 20:05:24+00:00,['1398732225466744839'],@mrsrook_Belgium Isn't it just!, isnt it just,True,False
2129,1.3986044888780063e+18,2021-05-29 11:37:49+00:00,['1398604488878006281'],@vwallop Do you alternate Art &amp; D&amp;T then?, do you alternate art amp dampt then,True,False
2130,1.3985884685492716e+18,2021-05-29 10:34:10+00:00,['1398588468549271553'],@joshuaseigal Always! Any good ones you'd recommend...🤔, always any good ones youd recommend,True,False
2131,1.3985588944991887e+18,2021-05-29 08:36:39+00:00,['1398558894499188738'],@MorgsEd My school do this., my school do this,True,False
2132,1.398543756572377e+18,2021-05-29 07:36:29+00:00,['1398543756572377091'],@Teacherglitter @UnofficialOA The one who thinks they're a pupil is so true! 🤣 I'm number 6.,  the one who thinks theyre a pupil is so true  im number 6,True,False
2133,1.3985347919187272e+18,2021-05-29 07:00:52+00:00,['1398534791918727173'],@SarahFarrellKS2 @candacemccolgan Ah yes. Then it was me. 😅,  ah yes then it was me ,True,False
2134,1.3985338175357706e+18,2021-05-29 06:57:00+00:00,['1398533817535770624'],@SarahFarrellKS2 @candacemccolgan I unfortunately can't see the tweet above as the owner protects their tweets. 😅,  i unfortunately cant see the tweet above as the owner protects their tweets ,True,False
2135,1.398412151799353e+18,2021-05-28 22:53:32+00:00,['1398412151799353349'],@UnofficialOA Number 6 killed me! This is me. 🤣, number 6 killed me this is me ,True,False
2141,1.397966956943319e+18,2021-05-27 17:24:30+00:00,['1397966956943319041'],@Teacherglitter @jonnybid @RobCrossley4 @SerenaKPatel @Zendibble @ThomasHTaylor @OpenUni_RfP @TeresaCremin @teacher_mr_r @son1bun @rumena_aktar @one_to_read This is my thinking Ceri. Start afresh in September. Any tips on how to get the scrapbook going would be much appreciated!,            this is my thinking ceri start afresh in september any tips on how to get the scrapbook going would be much appreciated,True,False
