Unnamed: 0,id,created_at,edit_history_tweet_ids,text,clean_text,non_english,whitespace
2022,1.40452568637159e+18,2021-06-14 19:46:33+00:00,['1404525686371590147'],First episode of #SweetTooth I'm not sure I can handle it. I've got something in my eye...😢 Though I would really like a hybrid baby owl.,first episode of  im not sure i can handle it ive got something in my eye though i would really like a hybrid baby owl,True,False
2024,1.4044864496013883e+18,2021-06-14 17:10:38+00:00,['1404486449601388545'],Brilliant. https://t.co/J8ZTwNO0l3,brilliant ,True,False
2025,1.4044823531672207e+18,2021-06-14 16:54:21+00:00,['1404482353167220745'],"If you ever feel a bit wobbly or sad, I recommend a PE session with Reception children pretending to be cows and horses. ❤️",if you ever feel a bit wobbly or sad i recommend a pe session with reception children pretending to be cows and horses ,True,False
2026,1.4044817554705736e+18,2021-06-14 16:51:59+00:00,['1404481755470573569'],Very clear and dignified. https://t.co/toKZVrUm5A,very clear and dignified ,True,False
2027,1.4036419658545275e+18,2021-06-12 09:14:57+00:00,['1403641965854527491'],@chas_dave A perfect photo for @stu73, a perfect photo for ,True,False
2028,1.4036405141556265e+18,2021-06-12 09:09:11+00:00,['1403640514155626498'],@katkin20 Do love a ghost sign. Was talkimg about these last night while wandering around Brighton. It pays to look up., do love a ghost sign was talkimg about these last night while wandering around brighton it pays to look up,True,False
2029,1.403486923411411e+18,2021-06-11 22:58:52+00:00,['1403486923411410945'],"I had good intentions of ordering the rainbow salad bowl from @wahaca. Then I realised I could order ""small"" delicious tacos. And then kept on ordering them. https://t.co/cZfsnFCqut",i had good intentions of ordering the rainbow salad bowl from  then i realised i could order small delicious tacos and then kept on ordering them ,True,False
2030,1.4034685580012298e+18,2021-06-11 21:45:54+00:00,['1403468558001229826'],@MisterLarky @GeorgePointon_ @misscsussex Brilliant 😂,   brilliant ,True,False
2031,1.4030855605546555e+18,2021-06-10 20:24:00+00:00,['1403085560554655751'],@bilbo983 That looks lovely!, that looks lovely,True,False
2032,1.4030306263961477e+18,2021-06-10 16:45:43+00:00,['1403030626396147715'],"I love that I think I'm the sort of person to have box set restraint. ""Oh no, only 19 days left to watch Mare of EastTown"" 😂 Come on Lou. That'll be done in one evening.",i love that i think im the sort of person to have box set restraint oh no only 19 days left to watch mare of easttown  come on lou thatll be done in one evening,True,False
2033,1.4023423642624164e+18,2021-06-08 19:10:48+00:00,['1402342364262416388'],Whole class collaboration on a giant map showing towns and the countryside. Future town planners I think! #EYFS #Reception https://t.co/DhwA9syxBK,whole class collaboration on a giant map showing towns and the countryside future town planners i think   ,True,False
2034,1.4023413276358902e+18,2021-06-08 19:06:41+00:00,['1402341327635890184'],"The best bit of the lesson was probably when a keen little hand shot up, but only because they wanted to tell me they were going to their cousins for tea. 😂",the best bit of the lesson was probably when a keen little hand shot up but only because they wanted to tell me they were going to their cousins for tea ,True,False
2035,1.4023409339334042e+18,2021-06-08 19:05:07+00:00,['1402340933933404179'],"Discussed the features of towns and the countryside today and some interesting points were made including, ""Santa lives in a town""  and ""unicorns probably live in the country."" Valid thoughts when you are 5. #EYFS #primaryschool",discussed the features of towns and the countryside today and some interesting points were made including santa lives in a town  and unicorns probably live in the country valid thoughts when you are 5  ,True,False
2036,1.4016084800127795e+18,2021-06-06 18:34:36+00:00,['1401608480012779527'],The @phoenixcomicuk completely changed my son's attitude to both reading and art. https://t.co/9hotRkQYoO,the  completely changed my sons attitude to both reading and art ,True,False
2037,1.4016068750413906e+18,2021-06-06 18:28:14+00:00,['1401606875041390594'],"Just home from a brief but lovely trip to see family I've not seen for nearly two years! So happy they finally met @stu73 
Tired and a bit sad to be south again 😔","just home from a brief but lovely trip to see family ive not seen for nearly two years so happy they finally met  
tired and a bit sad to be south again ",True,False
2039,1.400904529743319e+18,2021-06-04 19:57:22+00:00,['1400904529743319041'],Couldn't have asked for a more beautiful day to visit my home city with @stu73 It looks good in the sun (a rarity!). ☀️ https://t.co/mlOFZIHwpw,couldnt have asked for a more beautiful day to visit my home city with  it looks good in the sun a rarity  ,True,False
2040,1.4001168166981345e+18,2021-06-02 15:47:16+00:00,['1400116816698134528'],"I'd never heard of Gravenhurst before, but I love this album and this perfect folk horror track, Cities Beneath The Sea. Sad to hear he's not longer with us. #folkhorror 

https://t.co/HMZ9zNoWYk","id never heard of gravenhurst before but i love this album and this perfect folk horror track cities beneath the sea sad to hear hes not longer with us  

",True,False
2042,1.3997552082558034e+18,2021-06-01 15:50:22+00:00,['1399755208255803395'],"@mjrsumption The Invention of Lying and Daredevil. I left during both. Both have Jennifer Garner in them and she seems lovely, but my god they were both stinkers.", the invention of lying and daredevil i left during both both have jennifer garner in them and she seems lovely but my god they were both stinkers,True,False
2043,1.3997544606714552e+18,2021-06-01 15:47:24+00:00,['1399754460671455236'],I'm really glad it's hot because now I can complain all day about how hot it is.,im really glad its hot because now i can complain all day about how hot it is,True,False
2045,1.3991213560678482e+18,2021-05-30 21:51:40+00:00,['1399121356067848195'],Count me in. https://t.co/clIXpwzxS4,count me in ,True,False
2046,1.3991198161626972e+18,2021-05-30 21:45:33+00:00,['1399119816162697218'],This made me laugh out loud but it's a huge disservice to Worzel. https://t.co/wTfwYybxHi,this made me laugh out loud but its a huge disservice to worzel ,True,False
2047,1.3990918353735926e+18,2021-05-30 19:54:22+00:00,['1399091835373592577'],"@misscsussex @chimenesuleyman 😂 Well, seeing as we can't go on holiday, make the most of the jab!",   well seeing as we cant go on holiday make the most of the jab,True,False
2048,1.39905357202586e+18,2021-05-30 17:22:19+00:00,['1399053572025860098'],"@stu73 @tweeklyfm For once, this band listing makes perfect sense. 😁",  for once this band listing makes perfect sense ,True,False
2050,1.399043808692736e+18,2021-05-30 16:43:31+00:00,['1399043808692736000'],"@chimenesuleyman Yep. Shivers, sweating, headache, nausea and a dead arm. Felt like I'd been on a hen do to Benidorm and woken up in a bin. 24 hours, it was ok!", yep shivers sweating headache nausea and a dead arm felt like id been on a hen do to benidorm and woken up in a bin 24 hours it was ok,True,False
2051,1.3990423391050875e+18,2021-05-30 16:37:41+00:00,['1399042339105087493'],"@stu73 and I walked around Westminster and the cathedral yesterday. We wondered why police were stationed around the area . Then I commented ""oh look a wedding party!"" Now I'm mostly wondering which Tory donor financed it. #boriswedding", and i walked around westminster and the cathedral yesterday we wondered why police were stationed around the area  then i commented oh look a wedding party now im mostly wondering which tory donor financed it ,True,False
2052,1.399041294693974e+18,2021-05-30 16:33:32+00:00,['1399041294693974018'],@stu73 It was delicious!, it was delicious,True,False
2053,1.397988953509319e+18,2021-05-27 18:51:54+00:00,['1397988953509318658'],Bought some new design Salt Water Sandals and that's basically me living on beans for a month. This auto fill online shopping stuff is dangerous. 🙈,bought some new design salt water sandals and thats basically me living on beans for a month this auto fill online shopping stuff is dangerous ,True,False
2054,1.3977916684143903e+18,2021-05-27 05:47:58+00:00,['1397791668414390273'],We will have to read 🐛 in tribute today. https://t.co/UnEXqAOZdD,we will have to read  in tribute today ,True,False
2055,1.3976345919225285e+18,2021-05-26 19:23:48+00:00,['1397634591922528262'],"I'm really enjoying using stories in my maths lessons and this is our new favourite book. Great for addition and subtraction. The scenes of mild peril also help 😂
🐁🐍 #mousecount #EYFS https://t.co/EzjPZ1nLQA","im really enjoying using stories in my maths lessons and this is our new favourite book great for addition and subtraction the scenes of mild peril also help 
   ",True,False
2056,1.3976251624560845e+18,2021-05-26 18:46:20+00:00,['1397625162456084488'],"On the one hand, I've been entertained by the prime minister's former top advisor throwing him under a bus, but...
A story of liars told by a liar encapsulates it perfectly. Which is also quite bleak. https://t.co/Uc0HUDtGrT","on the one hand ive been entertained by the prime ministers former top advisor throwing him under a bus but
a story of liars told by a liar encapsulates it perfectly which is also quite bleak ",True,False
2058,1.3967338543632916e+18,2021-05-24 07:44:35+00:00,['1396733854363291650'],"Had a great weekend with @stu73 in a little cottage in the country. Of course that means that this morning is the most Monday of Mondays. Started with cat vomit, blocked roads and broken down buses. 🙄",had a great weekend with  in a little cottage in the country of course that means that this morning is the most monday of mondays started with cat vomit blocked roads and broken down buses ,True,False
2060,1.3963206743822336e+18,2021-05-23 04:22:45+00:00,['1396320674382233602'],@misscsussex Oh no! 🙈 xx, oh no  xx,True,False
2061,1.395471566306222e+18,2021-05-20 20:08:42+00:00,['1395471566306222086'],"I'd like to write a piece for @tes on 'Hessian in the Early Years.'  It's seemingly taking over. 
#eyfs","id like to write a piece for  on hessian in the early years  its seemingly taking over 
",True,False
2062,1.395459855989756e+18,2021-05-20 19:22:10+00:00,['1395459855989755907'],So far so good.,so far so good,True,False
2063,1.3954574150307471e+18,2021-05-20 19:12:28+00:00,['1395457415030747142'],About to watch The Nevers and I'm dubious. Don't disappoint me and make me go back to The Real Housewives of Orange County. 🙈,about to watch the nevers and im dubious dont disappoint me and make me go back to the real housewives of orange county ,True,False
2064,1.3951213440403497e+18,2021-05-19 20:57:03+00:00,['1395121344040349702'],Unequivocally #IStandWithAlexeiSayle I travelled all the way to Edinburgh on my own to see his stand up show. His books kept me going through some dark times. https://t.co/3QZRHef6Pw,unequivocally  i travelled all the way to edinburgh on my own to see his stand up show his books kept me going through some dark times ,True,False
2066,1.3950681318617498e+18,2021-05-19 17:25:36+00:00,['1395068131861749761'],@ergopropterhoc1 Good luck., good luck,True,False
2067,1.395048610455343e+18,2021-05-19 16:08:02+00:00,['1395048610455343114'],@Andr6wMale I should give it a try again., i should give it a try again,True,False
2068,1.3950477421756498e+18,2021-05-19 16:04:35+00:00,['1395047742175649795'],"@Andr6wMale Should I get back to Motherland? The first season I found so..well.. Guardian. That's  probably the best way I can describe it. Sometimes that's not a bad thing, but very middle class sitcoms can make my toes curl.", should i get back to motherland the first season i found sowell guardian thats  probably the best way i can describe it sometimes thats not a bad thing but very middle class sitcoms can make my toes curl,True,False
2069,1.395046738583507e+18,2021-05-19 16:00:35+00:00,['1395046738583506945'],"Me: I can't seem to shift this extra lockdown weight. 
Also me: A packet of Wotsits and 2 Mint Clubs seems like a reasonable starter.","me i cant seem to shift this extra lockdown weight 
also me a packet of wotsits and 2 mint clubs seems like a reasonable starter",True,False
2070,1.394717477855277e+18,2021-05-18 18:12:13+00:00,['1394717477855277057'],He's the H I hoped for. https://t.co/quZVPuuo5P,hes the h i hoped for ,True,False
2071,1.394681435454382e+18,2021-05-18 15:49:00+00:00,['1394681435454382087'],"Do not agree. A miserable look back at Shrek. 🙄

The Guardian: Shrek at 20: an unfunny and overrated low for blockbuster animation.
https://t.co/CyXxtdRVuM","do not agree a miserable look back at shrek 

the guardian shrek at 20 an unfunny and overrated low for blockbuster animation
",True,False
2072,1.3943837742978253e+18,2021-05-17 20:06:12+00:00,['1394383774297825280'],Can always rely on Arena to deliver. I feel like we should be teaching about Delia Derbyshire in schools. https://t.co/PDJV82Dxim,can always rely on arena to deliver i feel like we should be teaching about delia derbyshire in schools ,True,False
2073,1.3943295090049925e+18,2021-05-17 16:30:34+00:00,['1394329509004992520'],@hb_heather Oh no! I'm home now but staring at the piles of washing and dishes. 🥺, oh no im home now but staring at the piles of washing and dishes ,True,False
2074,1.3943012838640435e+18,2021-05-17 14:38:25+00:00,['1394301283864043522'],This 💯 Have not enjoyed today. Nothing went right. #wellgrumpy https://t.co/lw1RxnHELF,this  have not enjoyed today nothing went right  ,True,False
2076,1.393313508746535e+18,2021-05-14 21:13:21+00:00,['1393313508746534912'],"Watched Porridge the movie tonight and I'm obsessed with the theme song, Free Inside by Joe Brown.

Yes, I'm here all week for your up to date music and movie recommendations! 👍","watched porridge the movie tonight and im obsessed with the theme song free inside by joe brown

yes im here all week for your up to date music and movie recommendations ",True,False
2077,1.392871346409988e+18,2021-05-13 15:56:21+00:00,['1392871346409988099'],Absolutely exhausted today. Could that be post jab or the fact that I'm 42 next week and this is just me from now on? https://t.co/wGWTRjjBtf,absolutely exhausted today could that be post jab or the fact that im 42 next week and this is just me from now on ,True,False
2078,1.3928674681887334e+18,2021-05-13 15:40:57+00:00,['1392867468188733447'],One to read later. #RE #RElead https://t.co/49bdF9eH2j,one to read later   ,True,False
2079,1.3925686550121472e+18,2021-05-12 19:53:34+00:00,['1392568655012147202'],@MissC_EY Mucking out might be my favourite. 😂, mucking out might be my favourite ,True,False
2080,1.3925680631831634e+18,2021-05-12 19:51:13+00:00,['1392568063183163393'],@beccadeltest Popsy or Joanie Clothing. Both good for the busty lass., popsy or joanie clothing both good for the busty lass,True,False
2081,1.392565948520018e+18,2021-05-12 19:42:49+00:00,['1392565948520017929'],@MisterLarky Thank you ☺️, thank you ,True,False
2082,1.3925443930102948e+18,2021-05-12 18:17:10+00:00,['1392544393010294790'],@mccardigan I'm livid., im livid,True,False
2084,1.3925441020597617e+18,2021-05-12 18:16:00+00:00,['1392544102059761668'],@Peston Well...you did cause offence. I'm a newly qualified teacher and single parent. I don't get paid a lot. Were we meant to teach for free while going into school at the height of a pandemic? Great way to insult an entire profession., wellyou did cause offence im a newly qualified teacher and single parent i dont get paid a lot were we meant to teach for free while going into school at the height of a pandemic great way to insult an entire profession,True,False
2085,1.39254313125879e+18,2021-05-12 18:12:09+00:00,['1392543131258789890'],This is outrageous. Schools didn't close. We worked during the height of a pandemic IN school with keyworker classes and managed remote learning. Should that have been for free? https://t.co/v63TCGLsQH,this is outrageous schools didnt close we worked during the height of a pandemic in school with keyworker classes and managed remote learning should that have been for free ,True,False
2086,1.392541722832511e+18,2021-05-12 18:06:33+00:00,['1392541722832510982'],@IamRichWilson Aw thanks Rich. There's always one teacher that sticks with you. ❤️, aw thanks rich theres always one teacher that sticks with you ,True,False
2087,1.3925412166722642e+18,2021-05-12 18:04:32+00:00,['1392541216672264196'],@watsoncomedian Food and Drink was on the telly and I think it inspired them 😂. Around 1990 for me (I'm 41)., food and drink was on the telly and i think it inspired them  around 1990 for me im 41,True,False
2088,1.392540554878202e+18,2021-05-12 18:01:55+00:00,['1392540554878201856'],"Best thing about parents evening has been hearing how happy/amazed parents are that their children have started to read and write and that they do it for fun at home. It's pretty cool. It's like you've taught them something a bit magic.
#EYFS #Reception","best thing about parents evening has been hearing how happyamazed parents are that their children have started to read and write and that they do it for fun at home its pretty cool its like youve taught them something a bit magic
 ",True,False
2089,1.3925045321108808e+18,2021-05-12 15:38:46+00:00,['1392504532110880772'],@ginquinn Don't over do it and you'll be right as rain! xx, dont over do it and youll be right as rain xx,True,False
2090,1.3924981327145e+18,2021-05-12 15:13:20+00:00,['1392498132714500100'],@ginquinn Sorry you're going through it. I couldn't control my temperature and I ached all over too. The day after I felt hungover and today back to normal. You'll be fine in no time! Plenty of rest today xxx, sorry youre going through it i couldnt control my temperature and i ached all over too the day after i felt hungover and today back to normal youll be fine in no time plenty of rest today xxx,True,False
2092,1.392183369627226e+18,2021-05-11 18:22:35+00:00,['1392183369627226112'],@rcscribbler I didn't know there was a new one!, i didnt know there was a new one,True,False
2093,1.3918756684645786e+18,2021-05-10 21:59:53+00:00,['1391875668464578563'],"No! I read this story in a fevered state this morning, hoping for a happier ending. How sad. 

BBC News - River Thames whale: Stranded baby minke is put down
https://t.co/maGyKjcxTo","no i read this story in a fevered state this morning hoping for a happier ending how sad 

bbc news  river thames whale stranded baby minke is put down
",True,False
2094,1.3917697869216645e+18,2021-05-10 14:59:09+00:00,['1391769786921664513'],@TCHCollins Every cloud and all that 😂😉, every cloud and all that ,True,False
2095,1.3917696150516736e+18,2021-05-10 14:58:28+00:00,['1391769615051673601'],@JGebbie That's exactly it. 🔥, thats exactly it ,True,False
2096,1.3917694606174536e+18,2021-05-10 14:57:51+00:00,['1391769460617453576'],@thatgirl_cecio I can't believe I feel this rough. 😰, i cant believe i feel this rough ,True,False
2097,1.391726642918314e+18,2021-05-10 12:07:43+00:00,['1391726642918313984'],@JohnRands_TMTL Well that's good news! Immune systems in overdrive., well thats good news immune systems in overdrive,True,False
2098,1.3917199839279923e+18,2021-05-10 11:41:15+00:00,['1391719983927992323'],@wisetuna @MusicalYouth30 Ah this cheered me up @stu73,  ah this cheered me up ,True,False
2100,1.3917196448562135e+18,2021-05-10 11:39:54+00:00,['1391719644856213504'],@thenok1 This lass forgot to buy any 🙈, this lass forgot to buy any ,True,False
2101,1.391719575478227e+18,2021-05-10 11:39:38+00:00,['1391719575478226950'],@TCHCollins Yes! I'm very shivery and felt nauseous today. I hope it doesn't last 2 weeks! Poor thing. x, yes im very shivery and felt nauseous today i hope it doesnt last 2 weeks poor thing x,True,False
2102,1.3917191379284378e+18,2021-05-10 11:37:54+00:00,['1391719137928437764'],@wendlen All the pain but none of the fun., all the pain but none of the fun,True,False
2103,1.391668658406056e+18,2021-05-10 08:17:18+00:00,['1391668658406055936'],@ginquinn Stock up on paracetamol. 👍, stock up on paracetamol ,True,False
2104,1.3916677497771827e+18,2021-05-10 08:13:42+00:00,['1391667749777182720'],"The jab has knocked me on my arse today. I expected some reaction, but not this. All for the greater good but for today, I feel like I've woken up in a very hot skip after a 3 day bender.",the jab has knocked me on my arse today i expected some reaction but not this all for the greater good but for today i feel like ive woken up in a very hot skip after a 3 day bender,True,False
2105,1.3915528507115315e+18,2021-05-10 00:37:08+00:00,['1391552850711531521'],Feeling both freezing and hot. Realised I only have 2 paracetamol left. Amateur move 💉,feeling both freezing and hot realised i only have 2 paracetamol left amateur move ,True,False
2108,1.3914184406075392e+18,2021-05-09 15:43:02+00:00,['1391418440607539202'],@The_Theme_Scene Preparing myself for possible side effects. Hope they're not too bad., preparing myself for possible side effects hope theyre not too bad,True,False
2109,1.3913813637403566e+18,2021-05-09 13:15:42+00:00,['1391381363740356610'],"@bilbo983 😂 I don't know why, but this really made me laugh.",  i dont know why but this really made me laugh,True,False
2110,1.3913789815182991e+18,2021-05-09 13:06:14+00:00,['1391378981518299137'],First jab. Efficiently done and with very kind nurses. Thank you 💙 Thanks @stu73 for taking us up there. @EpsomRacecourse https://t.co/CqR7EWgu6Z,first jab efficiently done and with very kind nurses thank you  thanks  for taking us up there  ,True,False
2111,1.3913784104888812e+18,2021-05-09 13:03:58+00:00,['1391378410488881155'],@stu73 I'm all jabbed up 💉 Thank you!, im all jabbed up  thank you,True,False
2112,1.3910392141632717e+18,2021-05-08 14:36:07+00:00,['1391039214163271683'],"@LynnCorinBTN Nobody trusts Johnson, not even his own MPs. It's baffling. Maybe people don't care about personal integrity anymore.", nobody trusts johnson not even his own mps its baffling maybe people dont care about personal integrity anymore,True,False
2114,1.3909381042031534e+18,2021-05-08 07:54:21+00:00,['1390938104203153409'],"The shed of dreams, filled with original 🐞 books. https://t.co/3qsoUd7Nqx",the shed of dreams filled with original  books ,True,False
2115,1.3907039258761708e+18,2021-05-07 16:23:48+00:00,['1390703925876170753'],@The_Theme_Scene Can't see that's the problem with Hartlepool. Brexit is a factor here somehow., cant see thats the problem with hartlepool brexit is a factor here somehow,True,False
2116,1.3906270107545846e+18,2021-05-07 11:18:10+00:00,['1390627010754584585'],I grew up in Tyne and Wear and I will never understand why anyone in the north east would vote Conservative. Why do they think Johnson and co will give a damn about them? #HartlepoolByElection,i grew up in tyne and wear and i will never understand why anyone in the north east would vote conservative why do they think johnson and co will give a damn about them ,True,False
2117,1.3901758583636746e+18,2021-05-06 05:25:27+00:00,['1390175858363674624'],Absolutely brilliant 👏 Do not watch @stu73 until you have finished the series. https://t.co/y9rO268QQM,absolutely brilliant  do not watch  until you have finished the series ,True,False
2118,1.3894483183890063e+18,2021-05-04 05:14:28+00:00,['1389448318389006336'],Wide wake since 4 so naturally I want to go to sleep *now* just as the alarm goes off.,wide wake since 4 so naturally i want to go to sleep now just as the alarm goes off,True,False
2119,1.3894231233390223e+18,2021-05-04 03:34:21+00:00,['1389423123339022337'],I think this will be my last (well Bruce's) words on it. https://t.co/Gmre7mpy0m,i think this will be my last well bruces words on it ,True,False
2120,1.389421885507711e+18,2021-05-04 03:29:26+00:00,['1389421885507710976'],@WillHay108 @flawleafclover @lottelydia This is an incredibly snobby thread. If you want a documentary on bent coppers there's a brilliant one currently on the iPlayer. The whole series has had *ridiculous* yet thrilling moments. No amount of LoD-splaining will make that ending good TV.,   this is an incredibly snobby thread if you want a documentary on bent coppers theres a brilliant one currently on the iplayer the whole series has had ridiculous yet thrilling moments no amount of lodsplaining will make that ending good tv,True,False
2121,1.3891108008670167e+18,2021-05-03 06:53:18+00:00,['1389110800867016706'],"@Andr6wMale Thank you 👏 Feeling like Twitter is one massive mansplain this morning. We get it, but it wasn't good telly.", thank you  feeling like twitter is one massive mansplain this morning we get it but it wasnt good telly,True,False
2122,1.389097788412154e+18,2021-05-03 06:01:35+00:00,['1389097788412153860'],"@Steve__Pepper Makes a good tweet but terrible TV.
Most of the episode was spent in Occupational ""H""ealth."," makes a good tweet but terrible tv
most of the episode was spent in occupational health",True,False
2123,1.389093560511877e+18,2021-05-03 05:44:47+00:00,['1389093560511877122'],@MisterLarky @misscsussex @LynnCorinBTN I've been watching a documentary series on iPlayer about the original AC10 in the 60s/70s. The Chief of Police at the time (his name was Hugh) was suspected of running all the bent coppers in the Met but they couldn't get to him. So a stooge detective ended up in prison.,   ive been watching a documentary series on iplayer about the original ac10 in the 60s70s the chief of police at the time his name was hugh was suspected of running all the bent coppers in the met but they couldnt get to him so a stooge detective ended up in prison,True,False
