Unnamed: 0,id,created_at,edit_history_tweet_ids,text,clean_text,non_english,whitespace
752,1.4979834732393472e+18,2022-02-27 17:14:25+00:00,['1497983473239347208'],@stu73 Did we find out what that means?, did we find out what that means,True,False
753,1.4979714279196795e+18,2022-02-27 16:26:34+00:00,['1497971427919679494'],"Such a lovely weekend, but why are they so short?! 📷 @stu73 https://t.co/VPykyYlPS2",such a lovely weekend but why are they so short   ,True,False
754,1.4979388459245732e+18,2022-02-27 14:17:05+00:00,['1497938845924573184'],"@LOZZISTEVENS It was great. Not a lot happens exactly, but the performances are lovely and there's just a very definite feel to the whole thing. Ace soundtrack, which you'd expect of Paul Thomas Anderson movies.", it was great not a lot happens exactly but the performances are lovely and theres just a very definite feel to the whole thing ace soundtrack which youd expect of paul thomas anderson movies,True,False
755,1.4979373682124554e+18,2022-02-27 14:11:13+00:00,['1497937368212455424'],"Goodbye and thanks to Nicky Tesco from The Members. Punk legend. Sound of the Suburbs is one of the greatest punk/new wave singles. Christ, they're all going 💔",goodbye and thanks to nicky tesco from the members punk legend sound of the suburbs is one of the greatest punknew wave singles christ theyre all going ,True,False
756,1.4979026794015867e+18,2022-02-27 11:53:23+00:00,['1497902679401586689'],Really loved #LicoricePizza ❤️,really loved  ,True,False
758,1.4978292314804838e+18,2022-02-27 07:01:31+00:00,['1497829231480483843'],And yet he's risen to the challenge of a war time leader. I think he's been incredibly brave. https://t.co/FcqCPxAvhV,and yet hes risen to the challenge of a war time leader i think hes been incredibly brave ,True,False
759,1.497667495582384e+18,2022-02-26 20:18:50+00:00,['1497667495582384128'],@TheAlmightyWord It's a massager ball. You can lie on it and rub your shoulder. They bloody hurt!, its a massager ball you can lie on it and rub your shoulder they bloody hurt,True,False
761,1.497091313124229e+18,2022-02-25 06:09:18+00:00,['1497091313124229122'],"@Nigel_Farage @GBNEWS @CPAC You're a ghoul, looking for whatever angle keeps you relevant.",   youre a ghoul looking for whatever angle keeps you relevant,True,False
762,1.496961247681593e+18,2022-02-24 21:32:28+00:00,['1496961247681593348'],"@RetirementTales I'm back to school but as it's Friday I'll have a lunchtime G&amp;T anyway, a Ploughman's and No More Heroes by The Stranglers please. See you then. 👍", im back to school but as its friday ill have a lunchtime gampt anyway a ploughmans and no more heroes by the stranglers please see you then ,True,False
763,1.496935832170951e+18,2022-02-24 19:51:28+00:00,['1496935832170950657'],"The story of Elvis inspired 'popstar' Orion, is on @BBCiPlayer and I could not be happier. https://t.co/DPm61PMOBh",the story of elvis inspired popstar orion is on  and i could not be happier ,True,False
764,1.4969344412891955e+18,2022-02-24 19:45:57+00:00,['1496934441289195526'],@misscsussex Haha. Let us know when so we can get some ear plugs ordered., haha let us know when so we can get some ear plugs ordered,True,False
765,1.49693213934191e+18,2022-02-24 19:36:48+00:00,['1496932139341910025'],"Because of mum guilt and always feeling too busy, I made a stupid roast dinner on a Thursday night AFTER WORK. He would have been as happy with a burger. 🙄 #kitchencleanup",because of mum guilt and always feeling too busy i made a stupid roast dinner on a thursday night after work he would have been as happy with a burger  ,True,False
766,1.496898788429996e+18,2022-02-24 17:24:16+00:00,['1496898788429996054'],@stu73 Yeah it's really haunting. Wonder if we can get a copy of it?, yeah its really haunting wonder if we can get a copy of it,True,False
767,1.496740807654654e+18,2022-02-24 06:56:31+00:00,['1496740807654653953'],"Me heading in today, with the haunted look of someone who was awake from 4am. https://t.co/UJUSRBBWRC",me heading in today with the haunted look of someone who was awake from 4am ,True,False
769,1.4963659664643318e+18,2022-02-23 06:07:02+00:00,['1496365966464331779'],"@_jessghost @HopeJonthi @moylato Yep, Knocky Nine Doors. I'm from the North East.",   yep knocky nine doors im from the north east,True,False
770,1.496229811278209e+18,2022-02-22 21:06:00+00:00,['1496229811278209025'],@Neenoo @LBFlyawayhome Never thought of that before!,  never thought of that before,True,False
771,1.4962276146163917e+18,2022-02-22 20:57:16+00:00,['1496227614616391689'],"And thank you Mark Lanegan. 💔 
I was a big QOTSA fan (before Josh Homme seemingly lost his mind). Also loved the Lanegan/Isobel Campbell collaborations. 
https://t.co/lwgHoySsdb","and thank you mark lanegan  
i was a big qotsa fan before josh homme seemingly lost his mind also loved the laneganisobel campbell collaborations 
",True,False
772,1.4962244473926246e+18,2022-02-22 20:44:41+00:00,['1496224447392624640'],"This is the song that my mam says captures the 60s for her and takes her right back as it was played everywhere. 

Thank you Gary Brooker. 💔

https://t.co/l94uP8IRoz","this is the song that my mam says captures the 60s for her and takes her right back as it was played everywhere 

thank you gary brooker 

",True,False
773,1.4961859630259446e+18,2022-02-22 18:11:46+00:00,['1496185963025944579'],@katkin20 And now it's in mine! 👂🪱, and now its in mine ,True,False
774,1.4958283495156654e+18,2022-02-21 18:30:44+00:00,['1495828349515665411'],Leave Hank the Tank to eat his pizza. https://t.co/GoSeNyDbDx,leave hank the tank to eat his pizza ,True,False
775,1.495807476431827e+18,2022-02-21 17:07:47+00:00,['1495807476431826946'],Great thread. Thanks for sending it on @stu73 https://t.co/Ug5pi13hIZ,great thread thanks for sending it on  ,True,False
777,1.4956607571990692e+18,2022-02-21 07:24:47+00:00,['1495660757199069186'],Happy birthday to our one time producer and old friend JJ. Though I didn't realise he was quite that old! I sent him a birthday card for his 40th via the fanclub when I was a kid. 💘 https://t.co/sOjnVNfAwx,happy birthday to our one time producer and old friend jj though i didnt realise he was quite that old i sent him a birthday card for his 40th via the fanclub when i was a kid  ,True,False
778,1.4955249196936888e+18,2022-02-20 22:25:01+00:00,['1495524919693688839'],@AdeleTurner72 I need to call my...Mum 🥁, i need to call mymum ,True,False
779,1.4954880380336292e+18,2022-02-20 19:58:27+00:00,['1495488038033629188'],@ailsa_xx @onelastwin I think that's very reasonable. 🌎 Quickly before Putin ruins it all.,  i think thats very reasonable  quickly before putin ruins it all,True,False
780,1.495485530062086e+18,2022-02-20 19:48:29+00:00,['1495485530062086146'],@ailsa_xx As long as they do pizza with it., as long as they do pizza with it,True,False
782,1.4954845220702618e+18,2022-02-20 19:44:29+00:00,['1495484522070261762'],👏 From the bits and pieces I saw (and enjoyed) I think curling is like a massive game of Shuffleboard. Therefore let's aim for the next ❄️ Olympics. @ailsa_xx https://t.co/FQBVHOKb0c, from the bits and pieces i saw and enjoyed i think curling is like a massive game of shuffleboard therefore lets aim for the next  olympics  ,True,False
784,1.495462445535662e+18,2022-02-20 18:16:46+00:00,['1495462445535662080'],@adele_pascale Where does one find the zip up top please?, where does one find the zip up top please,True,False
786,1.4954576910068122e+18,2022-02-20 17:57:52+00:00,['1495457691006812165'],"The wind has suddenly become as bad as Friday. Recycling bins and tree branches have been spotted flying by my flat window. And randomly, a can of deodorant.",the wind has suddenly become as bad as friday recycling bins and tree branches have been spotted flying by my flat window and randomly a can of deodorant,True,False
787,1.4954345367081943e+18,2022-02-20 16:25:52+00:00,['1495434536708194304'],"@SammyRevill Utterly. And hugely controlling, delusional and just not very nice.", utterly and hugely controlling delusional and just not very nice,True,False
788,1.4954308916105175e+18,2022-02-20 16:11:22+00:00,['1495430891610517504'],@ianeditz I retweeted Shappi., i retweeted shappi,True,False
789,1.4954298749070705e+18,2022-02-20 16:07:20+00:00,['1495429874907070466'],"The Daily Mail hate Brighton, teachers and different types of families anyway. So this is their perfect little foot stampy piece. https://t.co/svn2r0WfgH",the daily mail hate brighton teachers and different types of families anyway so this is their perfect little foot stampy piece ,True,False
790,1.4954287237550735e+18,2022-02-20 16:02:46+00:00,['1495428723755073536'],@ShappiKhorsandi Agreed! It's always been parents and carers/grown ups since I was at primary school a hundred million years ago. I'm a single parent and teacher (in Brighton funnily enough) and Daily Fail hate all of those things., agreed its always been parents and carersgrown ups since i was at primary school a hundred million years ago im a single parent and teacher in brighton funnily enough and daily fail hate all of those things,True,False
791,1.4954124529007084e+18,2022-02-20 14:58:06+00:00,['1495412452900708354'],How I love my home town 💛 https://t.co/bwnAsriNkC,how i love my home town  ,True,False
792,1.4954118720944333e+18,2022-02-20 14:55:48+00:00,['1495411872094433288'],Are people panic buying again and is this due to the winds or the threat of WW3? The only available bag of pasta cost the earth and was made of organic spelt and probably gold.,are people panic buying again and is this due to the winds or the threat of ww3 the only available bag of pasta cost the earth and was made of organic spelt and probably gold,True,False
793,1.495159096584065e+18,2022-02-19 22:11:21+00:00,['1495159096584065026'],"The next time I think I'm going mad, just drive me to a quaint hotel for two days of doing nothing. At most, take me to a country pub and feed me chips and beer.

I feel much better. 🌈 @stu73","the next time i think im going mad just drive me to a quaint hotel for two days of doing nothing at most take me to a country pub and feed me chips and beer

i feel much better  ",True,False
796,1.494714398937686e+18,2022-02-18 16:44:17+00:00,['1494714398937686021'],"@Sue_Cowley I was 8 years old and living in the north east. We barely got anything, maybe a fence blew over. But I do remember that Gordon Kaye from Allo Allo had a tree fall on his car!", i was 8 years old and living in the north east we barely got anything maybe a fence blew over but i do remember that gordon kaye from allo allo had a tree fall on his car,True,False
799,1.4943728062508114e+18,2022-02-17 18:06:55+00:00,['1494372806250811393'],Phil the Chinchilla. This is the content I need today. https://t.co/c87Ef5wD5X,phil the chinchilla this is the content i need today ,True,False
800,1.4943700950905692e+18,2022-02-17 17:56:09+00:00,['1494370095090569217'],"@TheAlmightyWord With an 11 year old gamer in the house, this is a constant worry. Did you watch the new Louis Theroux? These nut jobs chat via Fortnite and post You Tubes under the guise of gamers. 😫", with an 11 year old gamer in the house this is a constant worry did you watch the new louis theroux these nut jobs chat via fortnite and post you tubes under the guise of gamers ,True,False
801,1.494369543564714e+18,2022-02-17 17:53:57+00:00,['1494369543564713988'],We've booked a weekend away right in the middle of a dangerous storm. 😬 There will be no long romantic walks by the sea @stu73,weve booked a weekend away right in the middle of a dangerous storm  there will be no long romantic walks by the sea ,True,False
804,1.4942671971700982e+18,2022-02-17 11:07:16+00:00,['1494267197170098181'],"@weonlyneed11 @Chris_Creature @TPOTD I third this. Incredibly bleak, miscast and dull. 2 hours I'll never get back! However I'm rooting for Dunst and Plemons, but they were wasted here.",   i third this incredibly bleak miscast and dull 2 hours ill never get back however im rooting for dunst and plemons but they were wasted here,True,False
805,1.4941921903518925e+18,2022-02-17 06:09:13+00:00,['1494192190351892486'],Yes please! https://t.co/wQ1gPQc5q1,yes please ,True,False
806,1.4941884778224722e+18,2022-02-17 05:54:28+00:00,['1494188477822472194'],@Andr6wMale I had to look up what an antimacassar was. Now I realise my grandmother had them on her sofas., i had to look up what an antimacassar was now i realise my grandmother had them on her sofas,True,False
807,1.4941880256596746e+18,2022-02-17 05:52:40+00:00,['1494188025659674624'],"@Andr6wMale Cocktail biscuits, Liberace, nerves and soap-vouchers. If it was cocktails *and* biscuits it would be perfect.", cocktail biscuits liberace nerves and soapvouchers if it was cocktails and biscuits it would be perfect,True,False
808,1.494072949317456e+18,2022-02-16 22:15:24+00:00,['1494072949317455875'],@theraven1979 Yes 🍓, yes ,True,False
809,1.4940214975638938e+18,2022-02-16 18:50:57+00:00,['1494021497563893768'],@ergopropterhoc1 My cat agrees with you. He's hiding under a towel., my cat agrees with you hes hiding under a towel,True,False
810,1.4940051437711688e+18,2022-02-16 17:45:58+00:00,['1494005143771168769'],"There goes my plan for a run along the seafront!

*Heavy wink* 😉 https://t.co/Glt87kZoWx","there goes my plan for a run along the seafront

heavy wink  ",True,False
811,1.493949510485168e+18,2022-02-16 14:04:54+00:00,['1493949510485168130'],#InventingAnna was at least 3 episodes too long., was at least 3 episodes too long,True,False
812,1.4939489451098153e+18,2022-02-16 14:02:39+00:00,['1493948945109815296'],@misscsussex Pliars and superglue it is. 😂, pliars and superglue it is ,True,False
813,1.493946766139474e+18,2022-02-16 13:53:59+00:00,['1493946766139473927'],@misscsussex Well done all! I haven't been able to find a dentist who will take us on since I moved here. Not willing to take NHS. Any recommendations? 😬, well done all i havent been able to find a dentist who will take us on since i moved here not willing to take nhs any recommendations ,True,False
814,1.4939102822210191e+18,2022-02-16 11:29:01+00:00,['1493910282221019137'],Whoever runs The Mary Rose social media account is brilliant. 👏 https://t.co/FjWlyUZH86,whoever runs the mary rose social media account is brilliant  ,True,False
815,1.493909740891558e+18,2022-02-16 11:26:52+00:00,['1493909740891557893'],"@MisterLarky If hadn't guessed ""fault"" I would have been there all day.", if hadnt guessed fault i would have been there all day,True,False
816,1.4938673322419569e+18,2022-02-16 08:38:21+00:00,['1493867332241956866'],Today's Wordle was annoying. That is all. Now on to Rightmove for my morning routine to really start!,todays wordle was annoying that is all now on to rightmove for my morning routine to really start,True,False
817,1.4936968283988337e+18,2022-02-15 21:20:50+00:00,['1493696828398833664'],This is super cute 😍 https://t.co/L8kDNoZ91X,this is super cute  ,True,False
818,1.4936890616760934e+18,2022-02-15 20:49:58+00:00,['1493689061676093442'],"Me and Ma Carr in my Grandma's garden near Hexham in 1980. 
I'm still often found with a biscuit in hand. https://t.co/PFja9brH9L","me and ma carr in my grandmas garden near hexham in 1980 
im still often found with a biscuit in hand ",True,False
819,1.4936542518720307e+18,2022-02-15 18:31:39+00:00,['1493654251872030722'],@RetirementTales Great memories of doing these!, great memories of doing these,True,False
820,1.493593199704748e+18,2022-02-15 14:29:03+00:00,['1493593199704748035'],@Andr6wMale The only reason to watch. She holds the whole thing together., the only reason to watch she holds the whole thing together,True,False
821,1.4935930060705014e+18,2022-02-15 14:28:16+00:00,['1493593006070501379'],Braved the weather to find new school shoes but we've been blown into a Wagamama instead. 🤷‍♀️,braved the weather to find new school shoes but weve been blown into a wagamama instead ,True,False
822,1.4935483273125356e+18,2022-02-15 11:30:44+00:00,['1493548327312535553'],"Why was he is an open prison? 

BBC News - Paul Robson hunt: On-the-run sex offender refused parole five times
https://t.co/eI3RCaBIb2","why was he is an open prison 

bbc news  paul robson hunt ontherun sex offender refused parole five times
",True,False
823,1.4934792166749143e+18,2022-02-15 06:56:07+00:00,['1493479216674914305'],@stu73 @cafedenata I would like to go back!,  i would like to go back,True,False
825,1.4933166485641093e+18,2022-02-14 20:10:08+00:00,['1493316648564109313'],@missmteach16 @MrTs_NQTs Yes! I always feel a bit low in the holidays. I think it's partly learning how to really relax and put work worries on hold. I have not worked out how to manage this yet.,  yes i always feel a bit low in the holidays i think its partly learning how to really relax and put work worries on hold i have not worked out how to manage this yet,True,False
826,1.4933137717455503e+18,2022-02-14 19:58:42+00:00,['1493313771745550343'],@thatgirl_cecio I hear you 👏, i hear you ,True,False
828,1.4933135582472806e+18,2022-02-14 19:57:51+00:00,['1493313558247280640'],@misscsussex Oh no 😂, oh no ,True,False
829,1.493311617286746e+18,2022-02-14 19:50:08+00:00,['1493311617286746114'],"We walked a LOT today. All around Hyde Park which was amazingly peaceful. Happy Valentine's Day. I used to hate it and feel left out, but now it's rather nice. ❤️ https://t.co/Z2yNfeMV4u",we walked a lot today all around hyde park which was amazingly peaceful happy valentines day i used to hate it and feel left out but now its rather nice  ,True,False
830,1.492929652960211e+18,2022-02-13 18:32:21+00:00,['1492929652960210945'],@nalaknip What does he even do? I'm pretty sure he wasn't this right wing some years ago., what does he even do im pretty sure he wasnt this right wing some years ago,True,False
831,1.4929148125311386e+18,2022-02-13 17:33:22+00:00,['1492914812531138561'],@JegardUK And I would watch both of those film adaptations., and i would watch both of those film adaptations,True,False
832,1.49285804526481e+18,2022-02-13 13:47:48+00:00,['1492858045264809985'],@timkeyperson Caramel custards from Greggs are outstanding., caramel custards from greggs are outstanding,True,False
833,1.4928247794050703e+18,2022-02-13 11:35:37+00:00,['1492824779405070336'],@stu73 @WinterRunUK Well done 🤗🎊,  well done ,True,False
835,1.492820057608663e+18,2022-02-13 11:16:51+00:00,['1492820057608663041'],"Took a bit of getting into but I've really enjoyed this. Great lead performance, but I hated all of the rich friends. Just accept that you're watching through a smudged lens until the end. #Chloe https://t.co/Kgv7rRnrFB",took a bit of getting into but ive really enjoyed this great lead performance but i hated all of the rich friends just accept that youre watching through a smudged lens until the end  ,True,False
836,1.4926017669234565e+18,2022-02-12 20:49:27+00:00,['1492601766923456516'],Matthew Kelly would be turning in his grave if he was dead.  #Starstruck,matthew kelly would be turning in his grave if he was dead  ,True,False
838,1.4925807633170227e+18,2022-02-12 19:25:59+00:00,['1492580763317022721'],"Having watched several 1992 TOTP back to back now, I'm really over Stay by Shakespears Sister. But I've got a horrible feeling that Right Said Fred knocked them off the top spot. 🤢 Deeply Creepy.",having watched several 1992 totp back to back now im really over stay by shakespears sister but ive got a horrible feeling that right said fred knocked them off the top spot  deeply creepy,True,False
839,1.492556085273809e+18,2022-02-12 17:47:55+00:00,['1492556085273808897'],Lovely day @drusillaspark with the lad and @stu73 ❤️ https://t.co/4xBy4q9WlC,lovely day  with the lad and   ,True,False
840,1.4925499389741793e+18,2022-02-12 17:23:30+00:00,['1492549938974179328'],@nolittleman No problem 😀👻, no problem ,True,False
841,1.4925490960197427e+18,2022-02-12 17:20:09+00:00,['1492549096019742722'],@nolittleman Please report any ghostly Roman centurions immediately., please report any ghostly roman centurions immediately,True,False
842,1.4918951719900488e+18,2022-02-10 22:01:41+00:00,['1491895171990048776'],@nalaknip And absolutely not real., and absolutely not real,True,False
844,1.4918760811289395e+18,2022-02-10 20:45:50+00:00,['1491876081128939523'],@stu73 @PropertySports @AndrewLink That's what the hat was! You refused to explain that last night 😂🧢,   thats what the hat was you refused to explain that last night ,True,False
845,1.4918750704904274e+18,2022-02-10 20:41:49+00:00,['1491875070490427393'],@eliistender10 Yeah sure @nalaknip 🙄, yeah sure  ,True,False
846,1.4918429974110945e+18,2022-02-10 18:34:22+00:00,['1491842997411094534'],"@misscsussex Hopefully they're a while away yet, but always nice to be reminded you're getting old!", hopefully theyre a while away yet but always nice to be reminded youre getting old,True,False
847,1.4918420252804506e+18,2022-02-10 18:30:30+00:00,['1491842025280450562'],@misscsussex Oh no! Did the doctor also give you a Mini Eggs? If so where do I sign up! If it makes you feel any better I was told I'm probably heading for menopause today. 👌, oh no did the doctor also give you a mini eggs if so where do i sign up if it makes you feel any better i was told im probably heading for menopause today ,True,False
848,1.491825671420719e+18,2022-02-10 17:25:31+00:00,['1491825671420719110'],To top today off I've been told by the optometrist that I have the driest eyes they have ever seen and little to no tear production. And that explains a lot 😃,to top today off ive been told by the optometrist that i have the driest eyes they have ever seen and little to no tear production and that explains a lot ,True,False
850,1.491477657959162e+18,2022-02-09 18:22:38+00:00,['1491477657959161859'],@stu73 @CamdenBrewery @greeneking The best pre-run beverage 😁,   the best prerun beverage ,True,False
851,1.4914638794566124e+18,2022-02-09 17:27:53+00:00,['1491463879456612355'],I can recommend #Murderville on #Netflix to completely switch off and escape the bin fire that is the current state of...everything. Improvised comedy with the brilliant Will Arnett.,i can recommend  on  to completely switch off and escape the bin fire that is the current state ofeverything improvised comedy with the brilliant will arnett,True,False
852,1.491138716630659e+18,2022-02-08 19:55:48+00:00,['1491138716630659072'],Haha @stu73 https://t.co/lREkwXTsqe,haha  ,True,False
853,1.4911256187672044e+18,2022-02-08 19:03:45+00:00,['1491125618767204356'],@MrsMummypennyUK We bought as part of a scheme that was encouraging young families to buy new builds in the area. We were lucky that our ages and circumstances qualified us to join and we borrowed the small deposit from my parents (who were paid back monthly). I was 33., we bought as part of a scheme that was encouraging young families to buy new builds in the area we were lucky that our ages and circumstances qualified us to join and we borrowed the small deposit from my parents who were paid back monthly i was 33,True,False
854,1.4911231815535985e+18,2022-02-08 18:54:04+00:00,['1491123181553598464'],"Loving #starstruck on @BBCiPlayer 
Not really sure how I missed series one. But Rose Matafeo is awesome!","loving  on  
not really sure how i missed series one but rose matafeo is awesome",True,False
855,1.4911225796206346e+18,2022-02-08 18:51:41+00:00,['1491122579620634625'],"I felt absolutely exhausted this afternoon, to the point where I thought I might have Covid. Turns out it's just working with small children.",i felt absolutely exhausted this afternoon to the point where i thought i might have covid turns out its just working with small children,True,False
856,1.4907565096760197e+18,2022-02-07 18:37:03+00:00,['1490756509676019716'],Monday can get in the bin!,monday can get in the bin,True,False
858,1.4904062935589888e+18,2022-02-06 19:25:25+00:00,['1490406293558988800'],@katkin20 Went the previous night. My god the beer was rough. Worst hangover ever 🤣, went the previous night my god the beer was rough worst hangover ever ,True,False
859,1.490405516232831e+18,2022-02-06 19:22:20+00:00,['1490405516232830976'],"@rcscribbler I have actually had a comedian say that to me, about civilians.", i have actually had a comedian say that to me about civilians,True,False
862,1.4900842739609313e+18,2022-02-05 22:05:49+00:00,['1490084273960931339'],@Baddiel I await the Jerry Sadowitz Netflix special., i await the jerry sadowitz netflix special,True,False
863,1.4900782689172726e+18,2022-02-05 21:41:58+00:00,['1490078268917272576'],@misscsussex Always satisfying to get a certificate. 👍, always satisfying to get a certificate ,True,False
866,1.4900118165037916e+18,2022-02-05 17:17:54+00:00,['1490011816503791622'],@malcmorton @StranglersSite Teasing LuLu. We supported them a few times and JJ produced us.,  teasing lulu we supported them a few times and jj produced us,True,False
867,1.489925272799482e+18,2022-02-05 11:34:01+00:00,['1489925272799481859'],"@LOZZISTEVENS Loads of fun. Very, very drunk. How about you?", loads of fun very very drunk how about you,True,False
868,1.4897684148770038e+18,2022-02-05 01:10:43+00:00,['1489768414877003778'],@bookthesp1 It's fair to say I'm in some pain. I would not be surprised if a nail fell off. 😩, its fair to say im in some pain i would not be surprised if a nail fell off ,True,False
869,1.489762870439166e+18,2022-02-05 00:48:41+00:00,['1489762870439165959'],Jammed my finger in a train carriage door and now I'm convinced I might die of jammed finger 😩,jammed my finger in a train carriage door and now im convinced i might die of jammed finger ,True,False
870,1.489751690484097e+18,2022-02-05 00:04:15+00:00,['1489751690484097027'],@stu73 It did fill up!, it did fill up,True,False
