Unnamed: 0,id,created_at,edit_history_tweet_ids,text,clean_text,non_english
0,1.5650858258675876e+18,2022-08-31 21:15:13+00:00,['1565085825867587584'],"@Acephilouse @Kateliveco1G I feel exactly the same. I dreaded getting it before, but even more so now.",  i feel exactly the same i dreaded getting it before but even more so now,False
1,1.5650723643538637e+18,2022-08-31 20:21:43+00:00,['1565072364353863685'],@Kateliveco1G Enough about me…how are you now?, enough about mehow are you now,False
2,1.5650722862181622e+18,2022-08-31 20:21:25+00:00,['1565072286218162176'],@Kateliveco1G IT TRASHED HALF OF MY SUMMER HOLIDAYS!! 🤬, it trashed half of my summer holidays ,False
3,1.5650708980629217e+18,2022-08-31 20:15:54+00:00,['1565070898062921730'],"@BecWorth @JackWorthNFER 15 years ago, I would’ve encouraged anyone &amp; everyone to consider teaching. Not anymore.",   years ago i wouldve encouraged anyone amp everyone to consider teaching not anymore,False
4,1.5650673092150886e+18,2022-08-31 20:01:38+00:00,['1565067309215088640'],@MrsHKeal @KKNTeachLearn The struggle is real!!,  the struggle is real,False
5,1.5650651273717023e+18,2022-08-31 19:52:58+00:00,['1565065127371702276'],@MichaelT1979 Sticky-back plastic., stickyback plastic,False
6,1.5650443402835558e+18,2022-08-31 18:30:22+00:00,['1565044340283555845'],@msantigone @JG_Ocean Whooop!!,  whooop,False
8,1.5650408988109783e+18,2022-08-31 18:16:41+00:00,['1565040898810978304'],@KKNTeachLearn Wise move. If it were a real Aloe it would’ve had 63 babies by now &amp; outgrown its pot!!, wise move if it were a real aloe it wouldve had  babies by now amp outgrown its pot,False
11,1.5650356239535964e+18,2022-08-31 17:55:44+00:00,['1565035623953596416'],@AndJBa5 Me too. 😖, me too ,False
12,1.56503233363123e+18,2022-08-31 17:42:39+00:00,['1565032333631229952'],@REfenteacher @JG_Ocean I won’t be going in unless I’m paid to!,  i wont be going in unless im paid to,False
13,1.565032111085699e+18,2022-08-31 17:41:46+00:00,['1565032111085699074'],Has anyone else had a sore mouth (small mouth ulcers &amp; peeling inside of cheeks) post-Covid??,has anyone else had a sore mouth small mouth ulcers amp peeling inside of cheeks postcovid,False
14,1.5650305174178363e+18,2022-08-31 17:35:26+00:00,['1565030517417836548'],@JG_Ocean I’m going to 0.8 from tomorrow &amp; won’t be working Fridays this year (yay!) &amp; will ask tomorrow re this Friday as it’s INSET day 2., im going to  from tomorrow amp wont be working fridays this year yay amp will ask tomorrow re this friday as its inset day ,False
15,1.565010016934953e+18,2022-08-31 16:13:59+00:00,['1565010016934952965'],@MonsieurDisney Mainly because my PPA are well scattered., mainly because my ppa are well scattered,False
16,1.5650037840230728e+18,2022-08-31 15:49:13+00:00,['1565003784023072769'],@zebranda67 I’m really feeling this today!!, im really feeling this today,False
17,1.5650035870670193e+18,2022-08-31 15:48:26+00:00,['1565003587067019264'],@MonsieurDisney Mine is SO much better than last year! And not just because Fridays are BLANK!, mine is so much better than last year and not just because fridays are blank,False
18,1.5650032217556255e+18,2022-08-31 15:46:59+00:00,['1565003221755625472'],@Gileragirl @glooface I’d be interested to know how you get on!,  id be interested to know how you get on,False
20,1.5649816571316795e+18,2022-08-31 14:21:17+00:00,['1564981657131679751'],@teafairy79 I went to Paperchase…Xmas decs., i went to paperchasexmas decs,False
22,1.5649290375119217e+18,2022-08-31 10:52:12+00:00,['1564929037511921664'],@MadameMfl How lovely!, how lovely,False
25,1.5648914723605135e+18,2022-08-31 08:22:55+00:00,['1564891472360513538'],"@NicJaJo And we had disaggregated INSETs on Monday 25 &amp; Tuesday 26 (thanks to me pointing out that the head hadn’t included breaks in our directed time…), otherwise it would’ve been even worse!!", and we had disaggregated insets on monday  amp tuesday  thanks to me pointing out that the head hadnt included breaks in our directed time otherwise it wouldve been even worse,False
26,1.564890556521644e+18,2022-08-31 08:19:17+00:00,['1564890556521644032'],⁦@HSBC_UK⁩ I would but you’ve closed all the branches near me… Why can’t you use a scan/check of my child’s passport like the gov website did for my son’s provisional licence application?? https://t.co/6H3boFAKw8, i would but youve closed all the branches near me why cant you use a scancheck of my childs passport like the gov website did for my sons provisional licence application ,False
28,1.5648895332080517e+18,2022-08-31 08:15:13+00:00,['1564889533208051712'],@cbradbee Any bit of greenery is lovely!!, any bit of greenery is lovely,False
29,1.564889410159743e+18,2022-08-31 08:14:44+00:00,['1564889410159742976'],"@NicJaJo Yep, INSET tomorrow &amp; Friday.", yep inset tomorrow amp friday,False
30,1.5648877966948923e+18,2022-08-31 08:08:19+00:00,['1564887796694892545'],Last breakfast on the patio before the madness begins… https://t.co/pzjTDzRxBc,last breakfast on the patio before the madness begins ,False
31,1.5648816296754872e+18,2022-08-31 07:43:49+00:00,['1564881629675487232'],@SciRiggsy Cool!!, cool,False
32,1.564724767348953e+18,2022-08-30 21:20:30+00:00,['1564724767348953094'],"@johnwenger9 Meanwhile, business managers across the land will be insisting windows are closed as soon as the heating goes on.", meanwhile business managers across the land will be insisting windows are closed as soon as the heating goes on,False
34,1.5646745321196503e+18,2022-08-30 18:00:53+00:00,['1564674532119650305'],@clairesaintee He’s so not involved in YF!!, hes so not involved in yf,False
36,1.5646699708182528e+18,2022-08-30 17:42:45+00:00,['1564669970818252800'],@Bottoms_bray We’ve always done a lot of meteor shower &amp; comet spotting as it’s so dark where we live. Glad he’s introduced his friends to the joys!, weve always done a lot of meteor shower amp comet spotting as its so dark where we live glad hes introduced his friends to the joys,False
38,1.5646691917892037e+18,2022-08-30 17:39:40+00:00,['1564669191789203459'],@BreamGeorge They have their moments…occasionally!, they have their momentsoccasionally,False
39,1.5646684009111224e+18,2022-08-30 17:36:31+00:00,['1564668400911122434'],@clairesaintee This is rural Somerset 🤣🤣🤣, this is rural somerset ,False
40,1.5646680027248968e+18,2022-08-30 17:34:56+00:00,['1564668002724896768'],@Bottoms_bray Eh?, eh,False
42,1.564665534465155e+18,2022-08-30 17:25:08+00:00,['1564665534465155077'],"Middle teen went to a party last night: Mum, I saw the coolest thing ever last night; 4 of us were lying on the trampoline looking up at the stars &amp; we saw a meteorite! We could see its tail &amp; it lasted about 10 seconds!!",middle teen went to a party last night mum i saw the coolest thing ever last night  of us were lying on the trampoline looking up at the stars amp we saw a meteorite we could see its tail amp it lasted about  seconds,False
44,1.5646636831245476e+18,2022-08-30 17:17:46+00:00,['1564663683124547585'],@Kateliveco1G I just feel like I’m treading water now., i just feel like im treading water now,False
45,1.5646473330144297e+18,2022-08-30 16:12:48+00:00,['1564647333014429699'],@growteach Both barrels?, both barrels,False
46,1.5646467223698964e+18,2022-08-30 16:10:23+00:00,['1564646722369896448'],@CharletonOonagh It is. We have loads of them in our house. They’re ‘scaredy spiders’ &amp; not the baddies the tabloids would have you believe them to be., it is we have loads of them in our house theyre scaredy spiders amp not the baddies the tabloids would have you believe them to be,False
49,1.564641457818026e+18,2022-08-30 15:49:27+00:00,['1564641457818025989'],@BryanPHarrison You look forward to a good night’s sleep!, you look forward to a good nights sleep,False
50,1.5646410520358748e+18,2022-08-30 15:47:51+00:00,['1564641052035874816'],@byeverhopeful I’m sure I’ll feel the same way once I’m back!!, im sure ill feel the same way once im back,False
51,1.564611362927661e+18,2022-08-30 13:49:52+00:00,['1564611362927661066'],"@Paws4thought42 @MadameMfl You really enjoyed it before, didn’t you?",  you really enjoyed it before didnt you,False
52,1.564609073668039e+18,2022-08-30 13:40:46+00:00,['1564609073668038671'],"Okay, I just want to get on with the first day back now… 🙄",okay i just want to get on with the first day back now ,False
53,1.5646077938349998e+18,2022-08-30 13:35:41+00:00,['1564607793834999817'],@SimplyySonyaa Or someone is dating your ex &amp; is also on the receiving end of his abuse 😕, or someone is dating your ex amp is also on the receiving end of his abuse ,False
54,1.564588165171712e+18,2022-08-30 12:17:41+00:00,['1564588165171712000'],@Kateliveco1G Leon: My boy got up AND gave me ham! https://t.co/rSlaceBGc3, leon my boy got up and gave me ham ,False
55,1.5645878979861957e+18,2022-08-30 12:16:38+00:00,['1564587897986195458'],@AndJBa5 Eldest son did ask if he could take him with him…, eldest son did ask if he could take him with him,False
56,1.5645818132883128e+18,2022-08-30 11:52:27+00:00,['1564581813288312832'],@AndJBa5 Eldest!, eldest,False
57,1.5645807798915072e+18,2022-08-30 11:48:21+00:00,['1564580779891507200'],"@SchroedesGS @HSBC_UK @MartinSLewis @MandSBank Ah, I had no idea.",    ah i had no idea,False
58,1.5645793890938634e+18,2022-08-30 11:42:49+00:00,['1564579389093863426'],"I applied for an @HSBC_UK credit card via the @MartinSLewis website, purely to use for a balance transfer from an @MandSBank credit card. The card arrived, with £10K limit, but I was not able to transfer the balance so it was a complete waste of time!",i applied for an  credit card via the  website purely to use for a balance transfer from an  credit card the card arrived with k limit but i was not able to transfer the balance so it was a complete waste of time,False
59,1.564578018651259e+18,2022-08-30 11:37:22+00:00,['1564578018651258880'],@Kateliveco1G Leon: Screw him! I’m now in pole position for HoC!! https://t.co/oOc5C7bt2u, leon screw him im now in pole position for hoc ,False
60,1.564574738202169e+18,2022-08-30 11:24:20+00:00,['1564574738202169353'],Leon: Why won’t my boy let me in?? https://t.co/2TzjBF0BBL,leon why wont my boy let me in ,False
61,1.564572984635007e+18,2022-08-30 11:17:22+00:00,['1564572984635006980'],@groovybrewster Aw!, aw,False
62,1.5645414082327347e+18,2022-08-30 09:11:54+00:00,['1564541408232734721'],"@groovybrewster @EngTweet21 I was blown away by it, which doesn’t happen very often, so I enjoyed it in that respect.",  i was blown away by it which doesnt happen very often so i enjoyed it in that respect,False
64,1.5645384449442284e+18,2022-08-30 09:00:07+00:00,['1564538444944228354'],@hebe_jane So chatty!! 😻, so chatty ,False
67,1.564533339054383e+18,2022-08-30 08:39:50+00:00,['1564533339054383105'],"@AndJBa5 Yep! And although I can speak numerous languages, as soon as I have to speak on the phone, in my native tongue, I gabble a load of nonsense!!", yep and although i can speak numerous languages as soon as i have to speak on the phone in my native tongue i gabble a load of nonsense,False
68,1.5645317354334536e+18,2022-08-30 08:33:27+00:00,['1564531735433453569'],"I have lots of phone calls to make. I hate making phone calls. Give me a tricky year 9 on a Friday last lesson, over making a load of phone calls, any day!",i have lots of phone calls to make i hate making phone calls give me a tricky year  on a friday last lesson over making a load of phone calls any day,False
69,1.564531277725946e+18,2022-08-30 08:31:38+00:00,['1564531277725945857'],@DaveB22664400 They shouldn’t be allowed anyway!!, they shouldnt be allowed anyway,False
70,1.5645310982768312e+18,2022-08-30 08:30:56+00:00,['1564531098276831232'],Banjo feels the same way… https://t.co/QevcbUa74Y,banjo feels the same way ,False
71,1.564530784102482e+18,2022-08-30 08:29:41+00:00,['1564530784102481925'],@cbradbee Already spent an hour drinking coffee on the patio!, already spent an hour drinking coffee on the patio,False
73,1.564529293274792e+18,2022-08-30 08:23:45+00:00,['1564529293274791936'],"I have such a long list of things to do, none of them school-related, but I just want to sit on the patio &amp; drink coffee. 🙄",i have such a long list of things to do none of them schoolrelated but i just want to sit on the patio amp drink coffee ,False
74,1.5645283766683648e+18,2022-08-30 08:20:07+00:00,['1564528376668364800'],@EngTweet21 Lullaby - Leila Slimani, lullaby  leila slimani,False
75,1.564528100062421e+18,2022-08-30 08:19:01+00:00,['1564528100062420992'],@OnlineMathsT @EngTweet21 @melissacreate15 That’s lovely!,   thats lovely,False
76,1.564386282331054e+18,2022-08-29 22:55:29+00:00,['1564386282331054080'],@AndJBa5 Very!, very,False
77,1.5643660197533983e+18,2022-08-29 21:34:58+00:00,['1564366019753398272'],@kitandrew1 My son said Dave &amp; Stormzy said be grateful to teachers!, my son said dave amp stormzy said be grateful to teachers,False
78,1.564365495989674e+18,2022-08-29 21:32:53+00:00,['1564365495989673988'],Strange bedfellows… https://t.co/Rvg0aTalpS,strange bedfellows ,False
79,1.564362062175912e+18,2022-08-29 21:19:14+00:00,['1564362062175911936'],@slhattersley I just read that. Made my blood run cold. 😢, i just read that made my blood run cold ,False
80,1.5643596888877015e+18,2022-08-29 21:09:48+00:00,['1564359688887701505'],So glad eldest teen is home safe &amp; sound from Reading! It sounded completely mad this year. That’s him in the yellow bucket hat!! https://t.co/JU8vJWQ3ee,so glad eldest teen is home safe amp sound from reading it sounded completely mad this year thats him in the yellow bucket hat ,False
81,1.5643428013237248e+18,2022-08-29 20:02:42+00:00,['1564342801323724805'],@wendyk101 I was the biggest Housemartins’ fan in the eighties!!, i was the biggest housemartins fan in the eighties,False
83,1.5643172538684375e+18,2022-08-29 18:21:11+00:00,['1564317253868437504'],@Acephilouse I took them for many days! They did seem to help., i took them for many days they did seem to help,False
87,1.5643091347948012e+18,2022-08-29 17:48:55+00:00,['1564309134794801152'],"@BreamGeorge @PhoenixEdSarah I have 3 sons. The number of people who actually asked me, ‘Didn’t you want a girl?’ when I had my third baby boy, was astounding. Possibly even worse was, ‘Isn’t it a shame it’s not a girl?’ as they peered down at my beautiful, healthy baby boy!",  i have  sons the number of people who actually asked me didnt you want a girl when i had my third baby boy was astounding possibly even worse was isnt it a shame its not a girl as they peered down at my beautiful healthy baby boy,False
88,1.564308299922772e+18,2022-08-29 17:45:36+00:00,['1564308299922771968'],"@theomanic @LEBassett I remember chatting to some Americans in St.Petersburg; they asked where they could buy decent caviar. So I told them the name of a shop, one asked if it began with a ‘Y’. They had no idea there was a different alphabet.",  i remember chatting to some americans in stpetersburg they asked where they could buy decent caviar so i told them the name of a shop one asked if it began with a y they had no idea there was a different alphabet,False
89,1.5643070213939692e+18,2022-08-29 17:40:31+00:00,['1564307021393969153'],@Ottojizzmark Coffey-Mate, coffeymate,False
90,1.564289567615746e+18,2022-08-29 16:31:10+00:00,['1564289567615746050'],Youngest teen got the giggles! 🙄,youngest teen got the giggles ,False
91,1.5642894899247557e+18,2022-08-29 16:30:52+00:00,['1564289489924755458'],@JeremyClarkson just learnt how to dowse for water on whatever nonsense prog youngest teen is watching. So I just tried to teach youngest teen to dowse. My uncle was well-known for his water divining skills… https://t.co/isQq7kt00b, just learnt how to dowse for water on whatever nonsense prog youngest teen is watching so i just tried to teach youngest teen to dowse my uncle was wellknown for his water divining skills ,False
92,1.5642885556561224e+18,2022-08-29 16:27:09+00:00,['1564288555656122368'],"@RussInCheshire My dad had his own business. Always paid his tax/NI. Worked until he was 72, died 5 years later. My mum was a special needs teacher. She worked until she was 68. Thankfully she has no idea how much the care home is costing. Both she &amp; my dad would be horrified.", my dad had his own business always paid his taxni worked until he was  died  years later my mum was a special needs teacher she worked until she was  thankfully she has no idea how much the care home is costing both she amp my dad would be horrified,False
93,1.5642877394445312e+18,2022-08-29 16:23:54+00:00,['1564287739444531201'],@RussInCheshire We did the same earlier this year. £1K per week for the care home. My dad had helped design &amp; build the house the year before I was born. Such a wrench., we did the same earlier this year k per week for the care home my dad had helped design amp build the house the year before i was born such a wrench,False
94,1.5642873586898452e+18,2022-08-29 16:22:24+00:00,['1564287358689845250'],@rebeccajsmithw1 @JamesCWarne Definitely no. Not for any amount of money…or cats.,  definitely no not for any amount of moneyor cats,False
96,1.564277873615278e+18,2022-08-29 15:44:42+00:00,['1564277873615278081'],@stammer_teacher My husband gave up rugby at around age 32. He realised he didn’t bounce as well anymore., my husband gave up rugby at around age  he realised he didnt bounce as well anymore,False
98,1.5642763270411428e+18,2022-08-29 15:38:33+00:00,['1564276327041142786'],"@BracewellMr @helenmcpherson @Gwenelope @benniekara Hear, hear!",    hear hear,False
99,1.5642762538378936e+18,2022-08-29 15:38:16+00:00,['1564276253837893636'],"@BracewellMr @helenmcpherson @Gwenelope @benniekara Ooh, good call.",    ooh good call,False
100,1.5642733249890263e+18,2022-08-29 15:26:38+00:00,['1564273324989026304'],"Covonia - £4.50, Bonjela - £4, soothing eyedrops - £2.50. I feel loads better, just some annoying covidy-niggles left. Already spent a fortune on Max Strength Cold &amp; Flu, paracetamol, Soothers, Covonia. People will get poorly this winter but won’t be able to afford medicine etc.",covonia   bonjela   soothing eyedrops   i feel loads better just some annoying covidyniggles left already spent a fortune on max strength cold amp flu paracetamol soothers covonia people will get poorly this winter but wont be able to afford medicine etc,False
101,1.5642585759287542e+18,2022-08-29 14:28:01+00:00,['1564258575928754176'],"@MadameMfl Rufus likes something one day, but not the next. 🤷‍♀️", rufus likes something one day but not the next ,False
102,1.5642581800955249e+18,2022-08-29 14:26:27+00:00,['1564258180095524870'],"@MadameMfl Rufus, being the fussy fart that he is, turned down the ham today. He had cheese instead", rufus being the fussy fart that he is turned down the ham today he had cheese instead,False
103,1.5642494662946406e+18,2022-08-29 13:51:49+00:00,['1564249466294640642'],@BradHellyer1 @AlisonHoneybone @MrTs_NQTs * for,    for,False
105,1.5642468618500588e+18,2022-08-29 13:41:28+00:00,['1564246861850058753'],https://t.co/ae1PHKzUrB,,False
106,1.564246711517778e+18,2022-08-29 13:40:52+00:00,['1564246711517777924'],"@heather_learnin @WelliesIn Grow from seed yourself, you end up with much hardier plants.",  grow from seed yourself you end up with much hardier plants,False
107,1.5642462712919654e+18,2022-08-29 13:39:08+00:00,['1564246271291965441'],"@lzbthcx_ @TreasuryMog Ginger girls are quite unusual, I think.",  ginger girls are quite unusual i think,False
108,1.5642458954697974e+18,2022-08-29 13:37:38+00:00,['1564245895469797378'],@TreasuryMog This is Rufus. https://t.co/wOwHmPerMq, this is rufus ,False
109,1.564244667818025e+18,2022-08-29 13:32:45+00:00,['1564244667818024972'],"@BradHellyer1 @AlisonHoneybone @MrTs_NQTs Time for yourself, exercise, adequate sleep, steer clear of booze, learn to say ‘no’, ask gif help when you’re struggling.",   time for yourself exercise adequate sleep steer clear of booze learn to say no ask gif help when youre struggling,False
110,1.564243913673671e+18,2022-08-29 13:29:45+00:00,['1564243913673670656'],"@groovybrewster Our wedding cost next to nothing as it was just us, &amp; our son. My dress was £35 reduced from about £200 &amp; my sandals were reduced to a fiver. We paid for our loft conversion with the money a traditional wedding would’ve cost us!", our wedding cost next to nothing as it was just us amp our son my dress was  reduced from about  amp my sandals were reduced to a fiver we paid for our loft conversion with the money a traditional wedding wouldve cost us,False
111,1.5642373444289864e+18,2022-08-29 13:03:39+00:00,['1564237344428986369'],@MorganBroadcast @santanderuk @VirginActiveUK I’m so sorry this has happened to you.,   im so sorry this has happened to you,False
112,1.5642256451141796e+18,2022-08-29 12:17:10+00:00,['1564225645114179585'],@wotsinername Nooooooooooooooo!, nooooooooooooooo,False
113,1.5641624956983132e+18,2022-08-29 08:06:14+00:00,['1564162495698313217'],@MadameMfl Fab!, fab,False
114,1.564151745852457e+18,2022-08-29 07:23:31+00:00,['1564151745852456961'],@catslaveto4 @DaveB22664400 I think the Greens are the only decent human beings amongst them.,  i think the greens are the only decent human beings amongst them,False
115,1.5641507980487885e+18,2022-08-29 07:19:45+00:00,['1564150798048788480'],"Banjo: I love you so much, Boris! https://t.co/N79hlCOp9d",banjo i love you so much boris ,False
116,1.5641504655788974e+18,2022-08-29 07:18:26+00:00,['1564150465578897413'],@MadameMfl @meredithfox22 @Kateliveco1G Same with Leon. Boris likes to pretend by finding already dead creatures.,   same with leon boris likes to pretend by finding already dead creatures,False
118,1.5641494599482737e+18,2022-08-29 07:14:26+00:00,['1564149459948273664'],@MadameMfl @meredithfox22 @Kateliveco1G Charlie was one of those cats who was very skilful at catching small creatures but then he’d drop them! We used to often have to chase mice around the sitting room…,   charlie was one of those cats who was very skilful at catching small creatures but then hed drop them we used to often have to chase mice around the sitting room,False
120,1.564040447277863e+18,2022-08-29 00:01:15+00:00,['1564040447277862913'],"@ballater6 @sencymraeg I so enjoyed doing my kids’ projects, until I got a full time job!!",  i so enjoyed doing my kids projects until i got a full time job,False
122,1.56401831315132e+18,2022-08-28 22:33:18+00:00,['1564018313151320066'],It was so interesting when I went to a conference in Latvia made up of teachers from all over Europe; the Brits were the worst behaved. Followed by the Germans. https://t.co/q7uGdBx14n,it was so interesting when i went to a conference in latvia made up of teachers from all over europe the brits were the worst behaved followed by the germans ,False
123,1.564017862607528e+18,2022-08-28 22:31:31+00:00,['1564017862607527937'],"@MrBenWard @SmcDolan @teacherhead As I always say to each class as I put them into my seating plan,’If I sat next to my mate in a meeting, I’d struggle to resist the urge to chat…’",   as i always say to each class as i put them into my seating planif i sat next to my mate in a meeting id struggle to resist the urge to chat,False
124,1.5639862982805463e+18,2022-08-28 20:26:05+00:00,['1563986298280546304'],@Kateliveco1G @wendyk101 Leon: zzzzzzzzzzzz https://t.co/xfqEhClcZQ,  leon zzzzzzzzzzzz ,False
125,1.5639861182149263e+18,2022-08-28 20:25:22+00:00,['1563986118214926338'],I went to see ET 6 times when it first came out… https://t.co/VIIJWndQxe,i went to see et  times when it first came out ,False
128,1.5639064024977326e+18,2022-08-28 15:08:36+00:00,['1563906402497732609'],"@GaloresCircus Stay away from your own children, as well as other people’s children!! Little bio-hazards!", stay away from your own children as well as other peoples children little biohazards,False
129,1.5639061282322885e+18,2022-08-28 15:07:31+00:00,['1563906128232288256'],"@Kateliveco1G We need to live with it MORE, goddamit!!", we need to live with it more goddamit,False
130,1.5638838929517322e+18,2022-08-28 13:39:10+00:00,['1563883892951732226'],"Leon, with a belly full of ham, is going to just chill with his best mate, Sock. https://t.co/RTz7nlHx0M",leon with a belly full of ham is going to just chill with his best mate sock ,False
132,1.5638820807606354e+18,2022-08-28 13:31:58+00:00,['1563882080760635393'],"50,000 Ukrainian refugees in UK facing homelessness ‘disaster’ next year https://t.co/SNtPQTP11c", ukrainian refugees in uk facing homelessness disaster next year ,False
133,1.563880258058834e+18,2022-08-28 13:24:43+00:00,['1563880258058833920'],"I received a WhatsApp from my husband’s Australian cousin who lives in Florida, asking if this headline was true. He was astounded when I said it was. https://t.co/VhO6nacyEG",i received a whatsapp from my husbands australian cousin who lives in florida asking if this headline was true he was astounded when i said it was ,False
136,1.5638728036859003e+18,2022-08-28 12:55:06+00:00,['1563872803685900288'],"@wendyk101 Quite a late ham o’clock today, much to his annoyance!", quite a late ham oclock today much to his annoyance,False
137,1.5638723001176556e+18,2022-08-28 12:53:06+00:00,['1563872300117655552'],Guess what time it is… https://t.co/lJcDRlWwTp,guess what time it is ,False
138,1.563847039024259e+18,2022-08-28 11:12:43+00:00,['1563847039024259072'],@TrundleAlong They’re all here!!, theyre all here,False
