Unnamed: 0,id,created_at,edit_history_tweet_ids,text,clean_text,non_english
264,1.5629063884429926e+18,2022-08-25 20:54:55+00:00,['1562906388442992645'],@AndJBa5 I guess you wouldn’t really expect a cat to not have a tail so you wouldn’t necessarily notice he didn’t have one! He had to have it amputated after he went missing for 12 days &amp; came back with a ‘degloved tail’. 😬, i guess you wouldnt really expect a cat to not have a tail so you wouldnt necessarily notice he didnt have one he had to have it amputated after he went missing for  days amp came back with a degloved tail ,False
265,1.5629043559758643e+18,2022-08-25 20:46:50+00:00,['1562904355975864325'],@AndJBa5 Look at that little stump!! https://t.co/WVmufBSAUB, look at that little stump ,False
266,1.5628966638991647e+18,2022-08-25 20:16:16+00:00,['1562896663899164673'],"@BreamGeorge Nah, he’s Team PlayStation!", nah hes team playstation,False
267,1.5628963358500536e+18,2022-08-25 20:14:58+00:00,['1562896335850053639'],@BreamGeorge And he has thumbs… https://t.co/H4OvA75tp1, and he has thumbs ,False
268,1.562894088608723e+18,2022-08-25 20:06:02+00:00,['1562894088608722944'],@BreamGeorge Ted just doesn’t do that! He’s too chill., ted just doesnt do that hes too chill,False
269,1.5628938515760046e+18,2022-08-25 20:05:06+00:00,['1562893851576004610'],@AndJBa5 Or thumbs!, or thumbs,False
270,1.5628938027966464e+18,2022-08-25 20:04:54+00:00,['1562893802796646400'],@AndJBa5 Boris doesn’t have a tail…, boris doesnt have a tail,False
271,1.5628861857430446e+18,2022-08-25 19:34:38+00:00,['1562886185743044608'],@Kateliveco1G @MadameMfl Hamfusion!,  hamfusion,False
272,1.562877357202887e+18,2022-08-25 18:59:33+00:00,['1562877357202886660'],"@AndJBa5 My taste &amp; smell are back to normal, but it’s definitely upset my asthma now.", my taste amp smell are back to normal but its definitely upset my asthma now,False
273,1.562877160683348e+18,2022-08-25 18:58:46+00:00,['1562877160683347969'],@meredithfox22 He LOVES having his tummy tickled!!, he loves having his tummy tickled,False
274,1.5628731839001764e+18,2022-08-25 18:42:58+00:00,['1562873183900176384'],I can’t tell if he’s living his best life or needs immediate assistance. https://t.co/UbFk7l5g4P,i cant tell if hes living his best life or needs immediate assistance ,False
275,1.562872832975319e+18,2022-08-25 18:41:34+00:00,['1562872832975319041'],"2 weeks in, I have a very tickly cough &amp; tight chest. Covid, the virus that just keeps on giving…", weeks in i have a very tickly cough amp tight chest covid the virus that just keeps on giving,False
276,1.562780972013142e+18,2022-08-25 12:36:33+00:00,['1562780972013142017'],"@mrgmbrighton @neileley It’s always a difficult call to make but this year even more so, as we really had no idea what to expect.",  its always a difficult call to make but this year even more so as we really had no idea what to expect,False
278,1.5627707338261176e+18,2022-08-25 11:55:52+00:00,['1562770733826117632'],@mrgmbrighton Which board?, which board,False
279,1.5627706821610373e+18,2022-08-25 11:55:40+00:00,['1562770682161037315'],@neileley @mrgmbrighton It’s ridiculous!,  its ridiculous,False
280,1.5627341939434168e+18,2022-08-25 09:30:40+00:00,['1562734193943416832'],@Baggiepr @staffroomcoffee @jenhawk6248 If that happens we really will be descending into fascist rule!,   if that happens we really will be descending into fascist rule,False
281,1.562718891037827e+18,2022-08-25 08:29:52+00:00,['1562718891037827072'],@staffroomcoffee @Baggiepr @jenhawk6248 We need to strike à la française.,   we need to strike  la franaise,False
283,1.5627139073196687e+18,2022-08-25 08:10:03+00:00,['1562713907319668736'],"@cathsbruv In years gone by, French was hammered into pupils with loads of grammar &amp; rote learning. My older brother’s French exercise book is evidence of that! No wonder it stuck. None of the fun, fluffy stuff we do today!", in years gone by french was hammered into pupils with loads of grammar amp rote learning my older brothers french exercise book is evidence of that no wonder it stuck none of the fun fluffy stuff we do today,False
284,1.562686805975376e+18,2022-08-25 06:22:22+00:00,['1562686805975375872'],@NicholaHowroyd I think they might be mobilising., i think they might be mobilising,False
287,1.5625451424140657e+18,2022-08-24 20:59:27+00:00,['1562545142414065664'],@Kateliveco1G @NAWT_updates Aeroplane chasing earlier! https://t.co/3fhU1weGmc,  aeroplane chasing earlier ,False
288,1.562544319248343e+18,2022-08-24 20:56:11+00:00,['1562544319248343043'],@Kateliveco1G @NAWT_updates He’s such a sweet boy. Not a bad bone in his body.,  hes such a sweet boy not a bad bone in his body,False
290,1.562543028388053e+18,2022-08-24 20:51:03+00:00,['1562543028388053000'],https://t.co/Wsc4T52zTr,,False
291,1.562534233985274e+18,2022-08-24 20:16:06+00:00,['1562534233985273857'],7 years ago we went back to Spello town hall where we were married… https://t.co/5hi4HYSyKI, years ago we went back to spello town hall where we were married ,False
292,1.5625338620683387e+18,2022-08-24 20:14:37+00:00,['1562533862068338693'],"17 years!! We eloped to Italy, with eldest son as best man! ❤️ https://t.co/ukXgDoxYLB", years we eloped to italy with eldest son as best man  ,False
293,1.5625332932577976e+18,2022-08-24 20:12:22+00:00,['1562533293257797632'],We’ve had Banjo 10 years!! He came from ⁦@NAWT_updates⁩ Somerset https://t.co/4onUM6sqfh,weve had banjo  years he came from  somerset ,False
294,1.562531516625797e+18,2022-08-24 20:05:18+00:00,['1562531516625797120'],@someotherfella1 Take a look at @ThisNakedMind, take a look at ,False
295,1.562531248467497e+18,2022-08-24 20:04:14+00:00,['1562531248467496960'],@queenkarenclyne Great pic!, great pic,False
296,1.56251672100028e+18,2022-08-24 19:06:31+00:00,['1562516721000280065'],"@Carter65Michael My son was seriously injured in a car accident in January, resulting in polytrauma necessitating surgery &amp; a week in ICU. His friend knows I worry!", my son was seriously injured in a car accident in january resulting in polytrauma necessitating surgery amp a week in icu his friend knows i worry,False
298,1.5624586922256837e+18,2022-08-24 15:15:55+00:00,['1562458692225683456'],@gingercatsareok Do you think there’s something going on in the cat community that we should be concerned about?, do you think theres something going on in the cat community that we should be concerned about,False
299,1.5624585074081915e+18,2022-08-24 15:15:11+00:00,['1562458507408191495'],@wishilikedmaths It’s because I’ve asked him to look after him on nights-out! He knows I worry!!, its because ive asked him to look after him on nightsout he knows i worry,False
300,1.5624581048343183e+18,2022-08-24 15:13:35+00:00,['1562458104834318339'],He’s exhausted after pondering all the big questions. https://t.co/TljU1MhLKq,hes exhausted after pondering all the big questions ,False
301,1.5624408649492193e+18,2022-08-24 14:05:05+00:00,['1562440864949219329'],"@joannemlloyd @the_smudgy @MadameMfl No, sorry, I did Edexcel.",   no sorry i did edexcel,False
302,1.5624176591232205e+18,2022-08-24 12:32:52+00:00,['1562417659123220480'],@oumadogmesloub * pastry,  pastry,False
303,1.562416996565803e+18,2022-08-24 12:30:14+00:00,['1562416996565803009'],@oumadogmesloub She wanted rolls of chilled pastries. I knew exactly what she wanted. Good thing she didn’t ask you., she wanted rolls of chilled pastries i knew exactly what she wanted good thing she didnt ask you,False
304,1.562414939104596e+18,2022-08-24 12:22:04+00:00,['1562414939104595968'],"@oumadogmesloub Wrong! It was in the chilled section, near the butter!", wrong it was in the chilled section near the butter,False
307,1.5624095698963374e+18,2022-08-24 12:00:44+00:00,['1562409569896337408'],"I didn’t, but I found it for her!",i didnt but i found it for her,False
308,1.562409425419346e+18,2022-08-24 12:00:09+00:00,['1562409425419345920'],Random lady in Lidl: I know you don’t work here but do you know where the pastry is?,random lady in lidl i know you dont work here but do you know where the pastry is,False
310,1.562404387246465e+18,2022-08-24 11:40:08+00:00,['1562404387246465024'],@queenkarenclyne So satisfying!, so satisfying,False
311,1.5624041898332406e+18,2022-08-24 11:39:21+00:00,['1562404189833240576'],"Eldest, still slightly broken son is on his way to Reading festival with a huge group of friends. His lovely friend who I gave a lift to the station, told me he’ll look after him!!",eldest still slightly broken son is on his way to reading festival with a huge group of friends his lovely friend who i gave a lift to the station told me hell look after him,False
312,1.562403115701248e+18,2022-08-24 11:35:05+00:00,['1562403115701248000'],@Petrooka_ I’m so sorry., im so sorry,False
314,1.5623761073196114e+18,2022-08-24 09:47:46+00:00,['1562376107319611392'],@poshbird555 @meredithfox22 That face! 🤣😻,  that face ,False
315,1.562354265829548e+18,2022-08-24 08:20:58+00:00,['1562354265829548032'],@EducatingSooty Are you a cat?, are you a cat,False
317,1.5623532452590223e+18,2022-08-24 08:16:55+00:00,['1562353245259022336'],@AndJBa5 Yes!, yes,False
319,1.5623507852076114e+18,2022-08-24 08:07:08+00:00,['1562350785207611393'],Is my cat having an existential crisis? He’s just sitting in a field in the rain. https://t.co/0SUNMVqYjn,is my cat having an existential crisis hes just sitting in a field in the rain ,False
320,1.5623292051525632e+18,2022-08-24 06:41:23+00:00,['1562329205152563200'],@toosweettwoo @dgurdasani1 @kjblogs1984 I’m sorry. I sincerely hope things improve for you soon.,   im sorry i sincerely hope things improve for you soon,False
321,1.5621978557247857e+18,2022-08-23 21:59:27+00:00,['1562197855724785664'],@HeadSurrey @global_educator It’s just awful. My mum said today ‘Why do you want to leave me? Why won’t anyone stay with me?’ And there was no reasoning with her.,  its just awful my mum said today why do you want to leave me why wont anyone stay with me and there was no reasoning with her,False
322,1.5621951689375089e+18,2022-08-23 21:48:47+00:00,['1562195168937508865'],@HeadSurrey @global_educator I’m sorry.,  im sorry,False
323,1.5621905993813893e+18,2022-08-23 21:30:37+00:00,['1562190599381389314'],"@global_educator It’s really hard. Try to make the most of her. My mum still recognises me &amp; other family members, but it feels like the ‘essence’ of my mum is no longer there. She’s gone from being fiercely independent with a great sense of humour to being like a disgruntled toddler.", its really hard try to make the most of her my mum still recognises me amp other family members but it feels like the essence of my mum is no longer there shes gone from being fiercely independent with a great sense of humour to being like a disgruntled toddler,False
324,1.5621896489859973e+18,2022-08-23 21:26:51+00:00,['1562189648985997319'],"@kjblogs1984 @dgurdasani1 I’ll check it out. I bought Taffix a long time ago, but UK no longer allowed to sell it.",  ill check it out i bought taffix a long time ago but uk no longer allowed to sell it,False
325,1.5621893283101573e+18,2022-08-23 21:25:34+00:00,['1562189328310157313'],@dgurdasani1 @kjblogs1984 I’ve been wearing N95 for a long time now - are they the same as FFP2??,  ive been wearing n for a long time now  are they the same as ffp,False
327,1.5621854876029092e+18,2022-08-23 21:10:18+00:00,['1562185487602909185'],"@dgurdasani1 @kjblogs1984 I recently caught covid from my son, having managed to dodge it at school for over 2 years. I’ll soon be back in my classroom, teaching around 500 students every week. I’ll have my windows open throughout the winter, I’ll teach wearing a mask. I do not want to catch this again.",  i recently caught covid from my son having managed to dodge it at school for over  years ill soon be back in my classroom teaching around  students every week ill have my windows open throughout the winter ill teach wearing a mask i do not want to catch this again,False
328,1.5621846783623045e+18,2022-08-23 21:07:05+00:00,['1562184678362304512'],@global_educator Thank you. We’ve got PoAs in place; they are such a good idea., thank you weve got poas in place they are such a good idea,False
329,1.562180906177237e+18,2022-08-23 20:52:06+00:00,['1562180906177236993'],@dominickevans Heating. Friends’ houses weren’t as cold as mine., heating friends houses werent as cold as mine,False
330,1.5621806441379922e+18,2022-08-23 20:51:04+00:00,['1562180644137992192'],I think the writing is on the wall.,i think the writing is on the wall,False
331,1.5621768288061522e+18,2022-08-23 20:35:54+00:00,['1562176828806152194'],@Paws4thought42 He was great., he was great,False
332,1.5621629650251162e+18,2022-08-23 19:40:49+00:00,['1562162965025116160'],My eldest son &amp; I went to see my mum this afternoon. She wasn’t in the best shape; very sleepy &amp; very fed up. Her careworker asked about DNR order…,my eldest son amp i went to see my mum this afternoon she wasnt in the best shape very sleepy amp very fed up her careworker asked about dnr order,False
333,1.5621615811479552e+18,2022-08-23 19:35:19+00:00,['1562161581147955202'],"@buitengebieden @oumadogmesloub Never mind my beer-swilling hamster, this one is on the hard stuff…",  never mind my beerswilling hamster this one is on the hard stuff,False
335,1.5620932596436664e+18,2022-08-23 15:03:50+00:00,['1562093259643666432'],"@NicJaJo @kookieangeluk Call 101 &amp; log it with the police, so a picture can be built up, &amp; a case if necessary.",  call  amp log it with the police so a picture can be built up amp a case if necessary,False
336,1.5620508902358712e+18,2022-08-23 12:15:28+00:00,['1562050890235871232'],@oumadogmesloub @BeeClaudia00 He was a party animal! Used to love beer!!,  he was a party animal used to love beer,False
337,1.5620500929322353e+18,2022-08-23 12:12:18+00:00,['1562050092932235266'],@NicJaJo @kookieangeluk ASBO?,  asbo,False
339,1.5620492959515648e+18,2022-08-23 12:09:08+00:00,['1562049295951564801'],"@oumadogmesloub @BeeClaudia00 I had one at uni, called Squidgy.",  i had one at uni called squidgy,False
340,1.5620227522818376e+18,2022-08-23 10:23:39+00:00,['1562022752281837570'],"@dominic_mcg Not pleasant! After I’d dealt with the moth, youngest teen (who was busy cooking himself a pie 🙄) asked me to remove a huge spider from the kitchen as it was ‘stopping him from getting to the oven’!!", not pleasant after id dealt with the moth youngest teen who was busy cooking himself a pie  asked me to remove a huge spider from the kitchen as it was stopping him from getting to the oven,False
341,1.5620171775527526e+18,2022-08-23 10:01:30+00:00,['1562017177552752640'],Unsafe Schools: Who are Us For Them? https://t.co/QG92rJF1Qd,unsafe schools who are us for them ,False
342,1.5620109360382607e+18,2022-08-23 09:36:42+00:00,['1562010936038260736'],"@Kateliveco1G @MadameMfl Always good to be alert to such dangers. You never know what next summer might bring to Bristol, what with global warming etc.",  always good to be alert to such dangers you never know what next summer might bring to bristol what with global warming etc,False
343,1.5620105761628897e+18,2022-08-23 09:35:16+00:00,['1562010576162889730'],"@DeputyDiverse @GregorRebecca @MrsPTeach Fab, thanks.",   fab thanks,False
344,1.5620101074368307e+18,2022-08-23 09:33:25+00:00,['1562010107436830722'],"@DeputyDiverse @GregorRebecca @MrsPTeach Is this the one you’ve got? Ninja Foodi Dual Zone Air Fryer [AF300UK] 2 Drawers, 6 Cooking Functions, 7.6L, Black https://t.co/vsUacnEvGE",   is this the one youve got ninja foodi dual zone air fryer afuk  drawers  cooking functions l black ,False
345,1.562009377862713e+18,2022-08-23 09:30:31+00:00,['1562009377862713344'],@DeputyDiverse @GregorRebecca @MrsPTeach I’m now wondering if I should ask my husband to get me one for my 50th next month. Or is that a bit sad?,   im now wondering if i should ask my husband to get me one for my th next month or is that a bit sad,False
346,1.5620092003891364e+18,2022-08-23 09:29:48+00:00,['1562009200389136384'],"@Kateliveco1G @MadameMfl I will never forget walking in some sand dunes in France with 4 friends when we were teens, all with long hair, &amp; we were ambushed by may bugs!! Our screams were heard for miles around as we picked them out if each other’s hair!",  i will never forget walking in some sand dunes in france with  friends when we were teens all with long hair amp we were ambushed by may bugs our screams were heard for miles around as we picked them out if each others hair,False
348,1.5620085182360123e+18,2022-08-23 09:27:06+00:00,['1562008518236012544'],@Kateliveco1G @Acephilouse @MadameMfl Yup! I’d downed my Covonia &amp; was drifting off nicely!!,   yup id downed my covonia amp was drifting off nicely,False
349,1.5620054604457943e+18,2022-08-23 09:14:57+00:00,['1562005460445794304'],@Acephilouse @MadameMfl @Kateliveco1G I convinced myself it was a ghost playing with my hair initially. 👻,   i convinced myself it was a ghost playing with my hair initially ,False
350,1.5620018578574254e+18,2022-08-23 09:00:38+00:00,['1562001857857425409'],"@MadameMfl I like moths, just not in my hair, at night!!", i like moths just not in my hair at night,False
351,1.5619791877785354e+18,2022-08-23 07:30:33+00:00,['1561979187778535425'],"@oumadogmesloub 3rd class citizen, after the British Short Hairs &amp; polydactyl. https://t.co/OEzoueijjF", rd class citizen after the british short hairs amp polydactyl ,False
352,1.5619788286243635e+18,2022-08-23 07:29:07+00:00,['1561978828624363520'],"@Paws4thought42 He was quietly having his supper in the utility room. You know him, he’s not one to beg!", he was quietly having his supper in the utility room you know him hes not one to beg,False
353,1.561977474845655e+18,2022-08-23 07:23:44+00:00,['1561977474845655041'],@FINALLEVEL @strackers74 Why didn’t they intervene??,  why didnt they intervene,False
354,1.5619769891789087e+18,2022-08-23 07:21:49+00:00,['1561976989178908672'],@kassieperlongo @pups_Puppies1 Did he?? I’m desperate to know what happened next!,  did he im desperate to know what happened next,False
355,1.5619766601189335e+18,2022-08-23 07:20:30+00:00,['1561976660118933505'],@Chelsea_Fagan My 3 teenage sons are great at putting the seat &amp; lid down. The issues are lack of aim control &amp; skidmarks., my  teenage sons are great at putting the seat amp lid down the issues are lack of aim control amp skidmarks,False
356,1.5618444354823004e+18,2022-08-22 22:35:05+00:00,['1561844435482300417'],I just had a moth flapping around in my hair. 😱,i just had a moth flapping around in my hair ,False
357,1.561830807601402e+18,2022-08-22 21:40:56+00:00,['1561830807601401856'],@blondebonce It kind of does it for you., it kind of does it for you,False
358,1.5618303431660708e+18,2022-08-22 21:39:05+00:00,['1561830343166070784'],@thefish64 Nothing for them! It was middle son getting his supper., nothing for them it was middle son getting his supper,False
359,1.5618192384651592e+18,2022-08-22 20:54:58+00:00,['1561819238465159169'],United we stand… https://t.co/OUqKsBtk8y,united we stand ,False
360,1.5617928735902925e+18,2022-08-22 19:10:12+00:00,['1561792873590292480'],"@Kateliveco1G @oumadogmesloub Last night I felt really warm &amp; today I’ve been coughing again, plus I feel wiped out. I may ask the asthma nurse to listen to my chest tomorrow/day after tomorrow just to be on the safe side @MadameMfl",  last night i felt really warm amp today ive been coughing again plus i feel wiped out i may ask the asthma nurse to listen to my chest tomorrowday after tomorrow just to be on the safe side ,False
361,1.5617860750261862e+18,2022-08-22 18:43:11+00:00,['1561786075026186240'],@Kateliveco1G @oumadogmesloub I have felt dreadful today. 😖,  i have felt dreadful today ,False
362,1.561785439299801e+18,2022-08-22 18:40:39+00:00,['1561785439299801093'],@oumadogmesloub I’m feeling too poorly to get stuck in 😕, im feeling too poorly to get stuck in ,False
364,1.5617427539560407e+18,2022-08-22 15:51:02+00:00,['1561742753956040705'],@oumadogmesloub No., no,False
365,1.561742273750106e+18,2022-08-22 15:49:08+00:00,['1561742273750106120'],@Iraq_n_roll You don’t have to go., you dont have to go,False
366,1.5617413182289428e+18,2022-08-22 15:45:20+00:00,['1561741318228942850'],"‘If people have the option to work at home when they feel mildly unwell, or take time off, it could help to reduce the spread of illness and the risk for young and vulnerable people.’       Don’t be a martyr!!  https://t.co/H0UgRRDWyh",if people have the option to work at home when they feel mildly unwell or take time off it could help to reduce the spread of illness and the risk for young and vulnerable people       dont be a martyr  ,False
367,1.5617109142939607e+18,2022-08-22 13:44:31+00:00,['1561710914293960704'],@oumadogmesloub Is it though? https://t.co/OtXD8lT43I, is it though ,False
368,1.5617103839325225e+18,2022-08-22 13:42:25+00:00,['1561710383932522496'],@oumadogmesloub Obvs £9K a year! We will have to pay for his accommodation which is about £6K a year., obvs k a year we will have to pay for his accommodation which is about k a year,False
369,1.5617098592963953e+18,2022-08-22 13:40:20+00:00,['1561709859296395270'],"@oumadogmesloub Just to pay for the course, maintenance loan on top.", just to pay for the course maintenance loan on top,False
370,1.5617091998722007e+18,2022-08-22 13:37:43+00:00,['1561709199872200704'],@oumadogmesloub It’s the same at every uni., its the same at every uni,False
371,1.561708452245799e+18,2022-08-22 13:34:44+00:00,['1561708452245798913'],"@oumadogmesloub He will get £9K as a loan to pay for his course, £4.5K as a maintenance loan to live off.", he will get k as a loan to pay for his course k as a maintenance loan to live off,False
373,1.5616641443482542e+18,2022-08-22 10:38:40+00:00,['1561664144348254213'],@Kateliveco1G @oumadogmesloub Unfortunately not! 🤣,  unfortunately not ,False
374,1.5616581245028147e+18,2022-08-22 10:14:45+00:00,['1561658124502814720'],@oumadogmesloub He can only get the minimum maintenance loan which is about £4500… He still has to eat etc!, he can only get the minimum maintenance loan which is about  he still has to eat etc,False
375,1.5616538617015337e+18,2022-08-22 09:57:49+00:00,['1561653861701533696'],@MoreMorrow Karma is a beautiful thing., karma is a beautiful thing,False
376,1.561653603856679e+18,2022-08-22 09:56:47+00:00,['1561653603856678912'],@GoodhopeNot I couldn’t sleep last night (bloody covid!) so made the mistake of checking to see how much his accommodation will be…£6200!! Didn’t sleep much after that!, i couldnt sleep last night bloody covid so made the mistake of checking to see how much his accommodation will be didnt sleep much after that,False
377,1.561649454544978e+18,2022-08-22 09:40:18+00:00,['1561649454544977922'],"@augieray I tested positive after flying back from Spain. Fortunately, I was wearing an N95 mask on the plane but very few others were, so unfortunately I may have given it to them.", i tested positive after flying back from spain fortunately i was wearing an n mask on the plane but very few others were so unfortunately i may have given it to them,False
378,1.561648015793918e+18,2022-08-22 09:34:35+00:00,['1561648015793917954'],"Secondhand kidney, anyone?? 😬",secondhand kidney anyone ,False
379,1.5616479359133368e+18,2022-08-22 09:34:16+00:00,['1561647935913336834'],I may be able to afford for my son to go to uni after all! 🤣,i may be able to afford for my son to go to uni after all ,False
380,1.561647497839272e+18,2022-08-22 09:32:32+00:00,['1561647497839271937'],"For those of you who recommended Vinted, thank you! Much easier to use than eBay!! And I’ve just made my first sale 😊",for those of you who recommended vinted thank you much easier to use than ebay and ive just made my first sale ,False
381,1.5616457442049477e+18,2022-08-22 09:25:34+00:00,['1561645744204947457'],@DrSPORTY76 @sbrionyc Cholera was only eradicated because they realised people needed clean water to drink. I wonder how long it will take the gov to realise we can get on top of covid with good ventilation…,  cholera was only eradicated because they realised people needed clean water to drink i wonder how long it will take the gov to realise we can get on top of covid with good ventilation,False
382,1.5614636314511278e+18,2022-08-21 21:21:54+00:00,['1561463631451127813'],@LittleGreyRab * smallest,  smallest,False
383,1.5614633066946642e+18,2022-08-21 21:20:37+00:00,['1561463306694664194'],@LittleGreyRab Interesting. I take cetirizine everyday anyway as I’m allergic to the shakiest amounts of dust., interesting i take cetirizine everyday anyway as im allergic to the shakiest amounts of dust,False
384,1.5614586516212e+18,2022-08-21 21:02:07+00:00,['1561458651621199873'],"@Kateliveco1G @markandersonrun As the parent of 3 boys, I think they all struggled with the having to sit still &amp; use fine motor skills for hours at a time. They needed to be outside, running around &amp; playing for half the day.",  as the parent of  boys i think they all struggled with the having to sit still amp use fine motor skills for hours at a time they needed to be outside running around amp playing for half the day,False
385,1.5614583239959224e+18,2022-08-21 21:00:49+00:00,['1561458323995922432'],@AndJBa5 Yup., yup,False
386,1.5614474522550968e+18,2022-08-21 20:17:37+00:00,['1561447452255096832'],@Sankarasson Being brought up to consider others., being brought up to consider others,False
387,1.5614471561579151e+18,2022-08-21 20:16:26+00:00,['1561447156157915136'],@Kateliveco1G @markandersonrun Totally agree.,  totally agree,False
