id,created_at,edit_history_tweet_ids,text,clean_text,nouns
1.5650318846057513e+18,2022-08-31 17:40:52+00:00,['1565031884605751297'],@Dunkiecan My lawyers will be in touch imminently., my lawyers will be in touch imminently,lawyer
1.5581205491586253e+18,2022-08-12 15:57:42+00:00,['1558120549158625283'],@Football__Tweet Nobby Solano., nobby solano,nobby solano
1.5566851489423688e+18,2022-08-08 16:53:55+00:00,['1556685148942368771'],Land of the free! https://t.co/BukWrJvs10,land of the free ,land
1.556376282119684e+18,2022-08-07 20:26:36+00:00,['1556376282119684098'],@CharlieBlake_ @jackfifield @lxthrdg Don't do it it's a trap,   don't do it it's a trap,trap
1.5548274338695987e+18,2022-08-03 13:52:02+00:00,['1554827433869598720'],@Zack3O12 Justice 4 Gamu, justice gamu,justice gamu
1.5530963602028012e+18,2022-07-29 19:13:22+00:00,['1553096360202801152'],I think my favourite thing about being in America is the readily available supply of Mountain Dew and Dr Pepper.,i think my favourite thing about being in america is the readily available supply of mountain dew and dr pepper,thing america supply mountain pepper
1.5526928341673e+18,2022-07-28 16:29:53+00:00,['1552692834167300098'],Excited to fly off to America tomorrow for two weeks (and see Gaga in Washington!!) before heading over to Canada for the Bingham Cup with the @KXSteelers https://t.co/VdnfOtKTme,excited to fly off to america tomorrow for two weeks and see gaga in washington before heading over to canada for the bingham cup with the  ,tomorrow week gaga washington
1.5502181333818245e+18,2022-07-21 20:36:19+00:00,['1550218133381824512'],@CharlieBlake_ 6th form forms are the BEST, form forms are the best,form form
1.5498152556012175e+18,2022-07-20 17:55:25+00:00,['1549815255601217540'],"To be fair Nadine, Boris hasn't had any achievements to applaud.. https://t.co/YzmHQnw2kG",to be fair nadine boris hasn't had any achievements to applaud ,boris achievement
1.5490454432667402e+18,2022-07-18 14:56:28+00:00,['1549045443266740224'],Costa Del Romford 🌞 https://t.co/e3jALiXmdE,costa del romford  ,costa romford
1.5465317627084022e+18,2022-07-11 16:28:00+00:00,['1546531762708402176'],@harrydotcom_ Game changer haha https://t.co/2X8sM6tImG, game changer haha ,game changer
1.545771745021395e+18,2022-07-09 14:07:57+00:00,['1545771745021394944'],Oh I do like to be by the seaside.. https://t.co/zK7qg4KVPJ,oh i do like to be by the seaside ,seaside
1.5422470774298706e+18,2022-06-29 20:42:11+00:00,['1542247077429870592'],@Dan_Cymru I mean the serve is the most important shot in tennis.. it's admittedly not great viewing but he used what he has., i mean the serve is the most important shot in tennis it's admittedly not great viewing but he used what he has,serve shot tennis
1.5418902230759014e+18,2022-06-28 21:04:10+00:00,['1541890223075901440'],Serena's passion (literally in tears and on her knees) at breaking her opponents serve in Round 1 of Wimbledon is the same as the passion she shows in Grand Slam finals. That's what great champions do. #Wimbledon2022,serena's passion literally in tears and on her knees at breaking her opponents serve in round of wimbledon is the same as the passion she shows in grand slam finals that's what great champions do ,passion tear knee opponent round wimbledon passion slam final champion
1.5407887028965253e+18,2022-06-25 20:07:07+00:00,['1540788702896525312'],@adebradley @FluffehAdam Happened to me with my trip to Southampton for my birthday. Only thing left in price range is crap but just had to do it.,  happened to me with my trip to southampton for my birthday only thing left in price range is crap but just had to do it,trip birthday thing price range
1.5404018311170294e+18,2022-06-24 18:29:50+00:00,['1540401831117029379'],@dylanhm @ShadyPinesSam Never met anyone who could understand the rules,  never met anyone who could understand the rules,anyone rule
1.5389087189344092e+18,2022-06-20 15:36:44+00:00,['1538908718934409216'],@daisyrichards Congratulations!, congratulations,congratulation
1.537746576021631e+18,2022-06-17 10:38:48+00:00,['1537746576021630976'],@JoshAlexCairo @scottygb Haven't Brighton had it? May be mistaken.,  haven't brighton had it may be mistaken,brighton
1.536733563487408e+18,2022-06-14 15:33:27+00:00,['1536733563487408128'],I can't remember the last time I was excited as today after I fixed the toilet. Is this what middle age is like?,i can't remember the last time i was excited as today after i fixed the toilet is this what middle age is like,time today toilet
1.5363287383208182e+18,2022-06-13 12:44:49+00:00,['1536328738320818178'],@londonhotelso14 Hey! coming down for my Birthday in July. What time does cabaret start/finish on Saturdays? X https://t.co/rSa2TR8Qku, hey coming down for my birthday in july what time does cabaret startfinish on saturdays x ,birthday july time saturday
1.5344160837461688e+18,2022-06-08 06:04:37+00:00,['1534416083746168832'],@youngbuckeen Oh exciting! I'm sure we will be there then!, oh exciting i'm sure we will be there then,sure
1.5342915521465797e+18,2022-06-07 21:49:46+00:00,['1534291552146579456'],@youngbuckeen Yeah my first one. Canada here I come!! What's union??, yeah my first one canada here i come what's union,yeah canada union
1.5342803876351672e+18,2022-06-07 21:05:24+00:00,['1534280387635167236'],"@youngbuckeen Legit so happy to be back, getting ready for Bingham!", legit so happy to be back getting ready for bingham,legit ready bingham
1.5342779548507628e+18,2022-06-07 20:55:44+00:00,['1534277954850762753'],First rugby training session back. I cannot feel my limbs. https://t.co/DhjemWffeY,first rugby training session back i cannot feel my limbs ,training session cannot limb
1.532343600918446e+18,2022-06-02 12:49:18+00:00,['1532343600918446082'],Trying to teach the cats to use the cat flap. They are so little we had to get them a step! https://t.co/aQqn5QUAla,trying to teach the cats to use the cat flap they are so little we had to get them a step ,flap step
1.5313653895942472e+18,2022-05-30 20:02:14+00:00,['1531365389594247170'],"In less glamorous news I slipped over twice at tennis in front of everyone. 🎾 Graceful as ever, only I could come away from tennis with bloodied knees.",in less glamorous news i slipped over twice at tennis in front of everyone  graceful as ever only i could come away from tennis with bloodied knees,news tennis front everyone graceful tennis knee
1.531330369487786e+18,2022-05-30 17:43:05+00:00,['1531330369487785990'],@benjaminbutter Hope you're okay. Sorry this happened, hope you're okay sorry this happened,sorry
1.5312662102178284e+18,2022-05-30 13:28:08+00:00,['1531266210217828359'],@Zack3O12 Thanks!, thanks,thanks
1.5312635070013932e+18,2022-05-30 13:17:24+00:00,['1531263507001393153'],@DanEv Thanks!, thanks,thanks
1.5312285943992156e+18,2022-05-30 10:58:40+00:00,['1531228594399215616'],Just accepted a new job for September as a Head of Year! Excited to get back into Pastoral and teach PE in a new setting. Bring on September!,just accepted a new job for september as a head of year excited to get back into pastoral and teach pe in a new setting bring on september,september head year bring september
1.529857168031228e+18,2022-05-26 16:09:06+00:00,['1529857168031227905'],@benjaminbutter @ABBAVoyage Cannot wait for tomorrow!!,  cannot wait for tomorrow,cannot wait tomorrow
1.5224604005787034e+18,2022-05-06 06:17:00+00:00,['1522460400578703361'],I LOVE British politics. https://t.co/UaEBoEjsGM,i love british politics ,politics
1.5135902491543962e+18,2022-04-11 18:50:11+00:00,['1513590249154396162'],@rhysrmann @hnjsamuels We were front row literally less than 20cm away and oh my god you will never see anything as good. See it whatever the price honestly you will not regret it!,  we were front row literally less than away and oh my god you will never see anything as good see it whatever the price honestly you will not regret it,anything price
1.5123636291019205e+18,2022-04-08 09:36:02+00:00,['1512363629101920256'],Stoned to death or beheaded? Choices. https://t.co/054uXx94vl,stoned to death or beheaded choices ,death choice
1.5115856719699722e+18,2022-04-06 06:04:42+00:00,['1511585671969972227'],Starting the morning with a float in the dead sea and dip in infinity pool 🌞 https://t.co/Zv4HPNEsh1,starting the morning with a float in the dead sea and dip in infinity pool  ,morning float infinity pool
1.5092009627574764e+18,2022-03-30 16:08:43+00:00,['1509200962757476357'],@alexjb24 Going Jordan next week. Any must sees?, going jordan next week any must sees,jordan week
1.50624220951074e+18,2022-03-22 12:11:42+00:00,['1506242209510739970'],Shock. https://t.co/uIsj3xQ4k9 https://t.co/GBcPa9CaDN,shock  ,shock
1.505578545283846e+18,2022-03-20 16:14:32+00:00,['1505578545283846144'],@SecretScot Read that as shag, read that as shag,read shag
1.5052140154333184e+18,2022-03-19 16:06:01+00:00,['1505214015433318408'],Amazing scenes as Italy beat Wales in the dying seconds! #6nations2022,amazing scenes as italy beat wales in the dying seconds ,scene beat wale second
1.503476646338257e+18,2022-03-14 21:02:20+00:00,['1503476646338256899'],@CharlieBlake_ Call the police, call the police,police
1.502700930193576e+18,2022-03-12 17:39:55+00:00,['1502700930193575936'],@Dunkiecan Can we have some onion rings? Thanks, can we have some onion rings thanks,onion ring thanks
1.502567149482791e+18,2022-03-12 08:48:19+00:00,['1502567149482790913'],People doing pre park run laps. Why? Have some respect for us little tubsters.,people doing pre park run laps why have some respect for us little tubsters,people park respect tubsters
1.502345310391124e+18,2022-03-11 18:06:48+00:00,['1502345310391123970'],@CharlieBlake_ London supporting our NHS https://t.co/C8xaUswgkI, london supporting our nhs ,london
1.5013150577114194e+18,2022-03-08 21:52:57+00:00,['1501315057711419394'],I seem to be the only person that thought Baga should have got the win against Mo?,i seem to be the only person that thought baga should have got the win against mo,person
1.498597797708374e+18,2022-03-01 09:55:32+00:00,['1498597797708374017'],@SecretScot I guess it stops when they attack a NATO country?, i guess it stops when they attack a nato country,country
1.4980444290929377e+18,2022-02-27 21:16:38+00:00,['1498044429092937740'],@mikey_QC @alexjb24 They regularly have like 12+ officers at Romford station. Don't see the point.,  they regularly have like officers at romford station don't see the point,officer romford station point
1.4966079099874304e+18,2022-02-23 22:08:26+00:00,['1496607909987430400'],"@Huwniverse @FluffehAdam Also got one E but went on to get a 2:1, PGCE and a decent career. Everyones journey is different. Blanket approaches don't really seem suitable. https://t.co/sJsuWpFpfG",  also got one e but went on to get a pgce and a decent career everyones journey is different blanket approaches don't really seem suitable ,pgce career everyones journey blanket approach
1.4962355307485798e+18,2022-02-22 21:28:43+00:00,['1496235530748579842'],"@ScottEmery92 @DanEv I mean, I hope LDs take take more than a handful of seats from the Conservatives but I see nothing to change the fact we just haven't in a significant amount of time. Labour is clearly the only option to get rid of them. Very much hope Labour and LDs work together 🙂",  i mean i hope lds take take more than a handful of seats from the conservatives but i see nothing to change the fact we just haven't in a significant amount of time labour is clearly the only option to get rid of them very much hope labour and lds work together ,handful seat conservative nothing fact amount time labour option hope labour
1.4962332724221583e+18,2022-02-22 21:19:45+00:00,['1496233272422158346'],"@CJLittlemore There's only so many times you can ask yourself ""what's the point?"" before leaving I just want to put this govt into the garbage of history. But I'm sure I shall return at some point, but not under Ed Davey. https://t.co/rhtTpLJvwp", there's only so many times you can ask yourself whats the point before leaving i just want to put this govt into the garbage of history but i'm sure i shall return at some point but not under ed davey ,time point govt garbage history sure point davey
1.496233068029522e+18,2022-02-22 21:18:56+00:00,['1496233068029521925'],"@DanEv There's only so many times you can ask yourself ""what's the point?"" before leaving I just want to put this govt into the garbage of history. But I'm sure I shall return at some point, but not under Ed Davey.", there's only so many times you can ask yourself whats the point before leaving i just want to put this govt into the garbage of history but i'm sure i shall return at some point but not under ed davey,time point govt garbage history sure point
1.496229946569732e+18,2022-02-22 21:06:32+00:00,['1496229946569732103'],My Labour membership has finally been approved yay! https://t.co/x2QyItqvep,my labour membership has finally been approved yay ,labour membership
1.4962090568470815e+18,2022-02-22 19:43:32+00:00,['1496209056847081474'],@JoshMitte @rhysrmann @CharlieBlake_ is clearly used to provoke this sort of response. Which I find quite strange and clearly this woman is a huge narcissist.,   is clearly used to provoke this sort of response which i find quite strange and clearly this woman is a huge narcissist,sort response woman narcissist
1.4962087713952973e+18,2022-02-22 19:42:23+00:00,['1496208771395297281'],@JoshMitte @rhysrmann @CharlieBlake_ The SEN support is clearly strong in her school. The point she is trying to make is that pupils with certain educational needs won't receive certain supports when they leave school so she is trying to give them tools now that they can use when they leave. The language she uses,   the sen support is clearly strong in her school the point she is trying to make is that pupils with certain educational needs won't receive certain supports when they leave school so she is trying to give them tools now that they can use when they leave the language she uses,support school point pupil need support school tool language
1.4954637541123236e+18,2022-02-20 18:21:58+00:00,['1495463754112323586'],Cabaret tomorrow! https://t.co/UqAS2nCSIa,cabaret tomorrow ,cabaret tomorrow
1.4943075207264215e+18,2022-02-17 13:47:30+00:00,['1494307520726421508'],Don’t want to come home ☹️ https://t.co/P2fjlDKnUd,don’t want to come home  ,home
1.493322800458875e+18,2022-02-14 20:34:34+00:00,['1493322800458874887'],Valentines in Barcelona with this one 💓 https://t.co/KlyPNhl45g,valentines in barcelona with this one  ,valentine barcelona
1.491065282387116e+18,2022-02-08 15:04:00+00:00,['1491065282387116033'],Wimbledon tickets for 4th year in a row yaas. 🎾,wimbledon tickets for year in a row yaas ,ticket year yaas
1.4877379683160678e+18,2022-01-30 10:42:27+00:00,['1487737968316067840'],@hnjsamuels Cricket., cricket,cricket
1.4877069613281935e+18,2022-01-30 08:39:14+00:00,['1487706961328193536'],@Dobbln This is absolutely the energy., this is absolutely the energy,energy
1.487703434048512e+18,2022-01-30 08:25:13+00:00,['1487703434048512003'],I was so wise at 15. The fuck am i saying?? https://t.co/lUnMrB4G8E,i was so wise at the fuck am i saying ,fuck
1.4856367713041613e+18,2022-01-24 15:33:02+00:00,['1485636771304161285'],"Buzzing for this years holidays to Barcelona 🇪🇸, Jordan 🇯🇴 and Canada 🇨🇦 I’m sure some mutant variant on steroids will come along and ruin it 👀",buzzing for this years holidays to barcelona  jordan  and canada  i’m sure some mutant variant on steroids will come along and ruin it ,year jordan variant steroid
1.484869681139921e+18,2022-01-22 12:44:54+00:00,['1484869681139920897'],A lovely welcome to Birmingham. https://t.co/Yll69Y6gDp,a lovely welcome to birmingham ,welcome
1.4835700849374454e+18,2022-01-18 22:40:46+00:00,['1483570084937445383'],@JSHiggins_ One rumour is he could call a House of Commons vote of confidence in himself which would be public., one rumour is he could call a house of commons vote of confidence in himself which would be public,rumour house common vote confidence
1.4835693074518917e+18,2022-01-18 22:37:40+00:00,['1483569307451891717'],@JSHiggins_ Tory triggered one is private., tory triggered one is private,tory
1.4806258724534886e+18,2022-01-10 19:41:31+00:00,['1480625872453488640'],@Josh__B_xx Make it make sense., make it make sense,sense
1.4805893301964063e+18,2022-01-10 17:16:18+00:00,['1480589330196406280'],@CharlieBlake_ Link?, link,link
1.4802332777179914e+18,2022-01-09 17:41:29+00:00,['1480233277717991428'],0-18 Leicester 19-21 Royal Leamington Spa 21-26+ London 🤷‍♂️ https://t.co/CE6xlwhz87, leicester royal leamington spa london  ,leicester leamington london
1.4798868132968407e+18,2022-01-08 18:44:45+00:00,['1479886813296840705'],@CJLittlemore Haha tbf we planned to go Soho but there are central line strikes which would be irritating., haha tbf we planned to go soho but there are central line strikes which would be irritating,line strike
1.479886553723945e+18,2022-01-08 18:43:44+00:00,['1479886553723944966'],@CJLittlemore You’re in Wales?! 😂, you’re in wales ,wale
1.4798657979841126e+18,2022-01-08 17:21:15+00:00,['1479865797984112651'],Dominos and wine night. https://t.co/TGTWOiUB31,dominos and wine night ,domino night
1.479593593845293e+18,2022-01-07 23:19:36+00:00,['1479593593845293062'],@rhysrmann This brings my great sadness., this brings my great sadness,sadness
1.4776998337586913e+18,2022-01-02 17:54:29+00:00,['1477699833758691337'],"Sugar daddy, wealth, money. Here’s hoping! 💰 https://t.co/2abO8A3wtL",sugar daddy wealth money here’s hoping  ,sugar daddy wealth money
1.477696530236719e+18,2022-01-02 17:41:21+00:00,['1477696530236719108'],@CharlieBlake_ What’s the video lol, what’s the video lol,video
1.477613287441326e+18,2022-01-02 12:10:35+00:00,['1477613287441326080'],@LeicesterTigers Is it on any tv channel live? Can’t seem to find a channel that is., is it on any tv channel live can’t seem to find a channel that is,channel channel
1.4762632230369444e+18,2021-12-29 18:45:54+00:00,['1476263223036944390'],@J_Holliss Choices. Choices were made., choices choices were made,choice choice
1.4762621638745252e+18,2021-12-29 18:41:42+00:00,['1476262163874525187'],@J_Holliss Talk about glow down 😉, talk about glow down ,talk
1.4762619902303724e+18,2021-12-29 18:41:00+00:00,['1476261990230372352'],@harrydotcom_ Obsessed with those candles, obsessed with those candles,candle
1.476177730454569e+18,2021-12-29 13:06:11+00:00,['1476177730454568970'],"Ocado delivery man just asked if the shopping was for my mum. Still got it, never lost it.",ocado delivery man just asked if the shopping was for my mum still got it never lost it,delivery shopping
1.4746542474468844e+18,2021-12-25 08:12:24+00:00,['1474654247446884355'],Presents opened. Now time for some bubbly in the hot tub with some tunes.,presents opened now time for some bubbly in the hot tub with some tunes,present time tune
1.4740362015522363e+18,2021-12-23 15:16:31+00:00,['1474036201552236551'],@dylanhm I forgot your heart is overflowing with hatred. *whispers* I love it.., i forgot your heart is overflowing with hatred whispers i love it,heart whisper
1.4740359247868887e+18,2021-12-23 15:15:25+00:00,['1474035924786888716'],@dylanhm Why do you hate Christmas?, why do you hate christmas,christmas
1.4737825104380436e+18,2021-12-22 22:28:26+00:00,['1473782510438043648'],@Dunkiecan Moved in then ffs. Debby downer., moved in then ffs debby downer,downer
1.4737354162432778e+18,2021-12-22 19:21:18+00:00,['1473735416243277841'],@harrydotcom_ Living for your domestic vibes, living for your domestic vibes,vibe
1.4737352144846643e+18,2021-12-22 19:20:30+00:00,['1473735214484664329'],1. Bought a house 🏡 2. Promotion at work 🏫 3. Rescued two adorable cats 🐈 https://t.co/PMwwVwRTQv,bought a house  promotion at work  rescued two adorable cats  ,house promotion work
1.471836816743481e+18,2021-12-17 13:36:57+00:00,['1471836816743481347'],I’m so hungover I didn’t have the brain capacity to do 22+25 so loaded my calculator.,i’m so hungover i didn’t have the brain capacity to do so loaded my calculator,brain capacity calculator
1.4711695295313224e+18,2021-12-15 17:25:23+00:00,['1471169529531322369'],"@gavindrawsstuff Omicron, apparently.", omicron apparently,omicron
1.470096965308498e+18,2021-12-12 18:23:24+00:00,['1470096965308497922'],@harrydotcom_ He’s not announcing new restrictions don’t worry., he’s not announcing new restrictions don’t worry,restriction worry
1.4697978470086984e+18,2021-12-11 22:34:48+00:00,['1469797847008698380'],"He is clearly just going to give some bullshit response and just say he’s committed to tackling the pandemic and the matter is closed. He is not going to go quietly, torys need to oust him. Not sure they will 🤷‍♂️",he is clearly just going to give some bullshit response and just say he’s committed to tackling the pandemic and the matter is closed he is not going to go quietly torys need to oust him not sure they will ,bullshit response pandemic matter
1.4683274008491704e+18,2021-12-07 21:11:47+00:00,['1468327400849170438'],Jesus Christ. https://t.co/M8h8PVZJJJ,jesus christ ,jesus christ
1.4658100726097306e+18,2021-11-30 22:28:49+00:00,['1465810072609730560'],I’ve been watching Duncan try and open a drumstick lolly for 7 minutes. (I wish I was joking). Still not open.,i’ve been watching duncan try and open a drumstick lolly for minutes i wish i was joking still not open,drumstick minute
1.464897876656595e+18,2021-11-28 10:04:04+00:00,['1464897876656594949'],@LeydenLisa @BBCFergusWalsh @fact_covid But old guidance wasn’t to isolate so im presuming we don’t have to still? Nothing says we have to. I’m a teacher so WFH not an option.,   but old guidance wasn’t to isolate so im presuming we don’t have to still nothing says we have to i’m a teacher so wfh not an option,guidance presuming nothing teacher option
1.4648898605069883e+18,2021-11-28 09:32:13+00:00,['1464889860506988546'],@adebradley @thatjohn @WhichUK Lateral flow on day 2. But I don’t know if we isolate until that?,   lateral flow on day but i don’t know if we isolate until that,flow
1.4648891009939743e+18,2021-11-28 09:29:12+00:00,['1464889100993974280'],@thatjohn @adebradley @WhichUK If we arrive on Monday do we isolate until negative lateral flow?,   if we arrive on monday do we isolate until negative lateral flow,monday flow
1.464888645605892e+18,2021-11-28 09:27:24+00:00,['1464888645605892097'],@BBCFergusWalsh @fact_covid So if we arrive on Monday we don’t need to isolate?,  so if we arrive on monday we don’t need to isolate,monday
1.46486091432747e+18,2021-11-28 07:37:12+00:00,['1464860914327470091'],@Garrett__Jon @grantshapps Let us know if you get an answer!!,  let us know if you get an answer,answer
1.464270735275397e+18,2021-11-26 16:32:02+00:00,['1464270735275397122'],Strangers have complimented my jumper and scarf today. https://t.co/KBogoxZMr0,strangers have complimented my jumper and scarf today ,stranger jumper scarf today
1.463771109271163e+18,2021-11-25 07:26:42+00:00,['1463771109271162883'],@gavindrawsstuff @Olliez0r We have this Friday and Monday off. Not for Black Friday though haha. Not sure why to be honest.. I wasn’t willing to question it 😂,  we have this friday and monday off not for black friday though haha not sure why to be honest i wasn’t willing to question it ,friday monday
1.4623686764186706e+18,2021-11-21 10:33:56+00:00,['1462368676418670593'],Can’t wait for our trip to Amsterdam on Thursday 😂 https://t.co/J36jQtXifX,can’t wait for our trip to amsterdam on thursday  ,wait trip
1.453655202557571e+18,2021-10-28 09:29:42+00:00,['1453655202557571073'],Gold Circle for Adele!!,gold circle for adele,gold circle adele
1.4522271333093253e+18,2021-10-24 10:55:04+00:00,['1452227133309325313'],@cumkinggg Snap https://t.co/Y1Mq3TW5ro, snap ,snap
1.448371816171516e+18,2021-10-13 19:35:25+00:00,['1448371816171515907'],@WorrallJack Errrr should we?!, errrr should we,errrr
1.446555081902592e+18,2021-10-08 19:16:21+00:00,['1446555081902592018'],Why does Duncan keep taking me to the wrong venue at every event we go to? Which results in manic Uber rides to make it on time?!,why does duncan keep taking me to the wrong venue at every event we go to which results in manic uber rides to make it on time,venue event result ride time
1.4425460906084024e+18,2021-09-27 17:46:03+00:00,['1442546090608402436'],It took me 2.5 hours to do my usual 30 min drive to work this morning then I absolutely stacked it in front of all the kids on the way to my A Level class because I was running to be on time. Finally home and poured myself a disaranno.,it took me hours to do my usual min drive to work this morning then i absolutely stacked it in front of all the kids on the way to my a level class because i was running to be on time finally home and poured myself a disaranno,hour drive morning front level class time home disaranno
1.4421584511032525e+18,2021-09-26 16:05:43+00:00,['1442158451103252481'],Can always rely on Spurs lifting my mood. #AFC,can always rely on spurs lifting my mood ,spur mood
1.4405938222625792e+18,2021-09-22 08:28:26+00:00,['1440593822262579205'],Jurgen and Maggie are my favourites. Sorry not sorry. #BakeOff,jurgen and maggie are my favourites sorry not sorry ,jurgen maggie favourite
1.4401977310042604e+18,2021-09-21 06:14:31+00:00,['1440197731004260359'],"Officially 2 years since my last flight, to Kenya ☹️ https://t.co/gHf98LoiPC",officially years since my last flight to kenya  ,year flight
