id,created_at,edit_history_tweet_ids,text,clean_text
1.4893607200472635e+18,2022-02-03 22:10:41+00:00,['1489360720047263750'],@tonyprinciotti Not to mention the more than 5000 beautifully handwritten letters that he wrote.,mention beautifully handwritten letter wrote
1.4893593505609687e+18,2022-02-03 22:05:14+00:00,['1489359350560968704'],@DGclassics Die erste Walpurgisnacht.,die erste walpurgisnacht
1.4893554188497551e+18,2022-02-03 21:49:37+00:00,['1489355418849755136'],"@JRubinBlogger Do we have to wait for @RollingStone to unmask his Russian ""oiligarch"" funder?",wait unmask russian oiligarch funder
1.4893548784220283e+18,2022-02-03 21:47:28+00:00,['1489354878422028292'],"R.I.P. James Maraniss, Beloved professor at @AmherstCollege and  Librettist of Long-Silent Opera by colleague and composer Lewis Spratlan, 76. https://t.co/teWy0aRp01",rip james maraniss beloved professor librettist longsilent opera colleague composer lewis spratlan
1.4888273260581478e+18,2022-02-02 10:51:10+00:00,['1488827326058147840'],How some San Antonio Symphony musicians are keeping their lights on during the ongoing strike https://t.co/MzZ1EpZHKz,san antonio symphony musician keeping light ongoing strike
1.4886800309432566e+18,2022-02-02 01:05:52+00:00,['1488680030943256578'],Thank you @FabienLamaison and the whole team at @thebunnymoney for this wonderful feature on your #StrongerTogether series on the work and mission of @music4lifeintl . #MusicForImpact #FintechForSocialImpact https://t.co/obhHymr7LJ,thank whole team wonderful feature series work mission
1.4883203901999227e+18,2022-02-01 01:16:47+00:00,['1488320390199922689'],"Do the @January6thCmte and the @TheJusticeDept require a whole lot more? How is he not immediately indicted after a public televised confession? 
------
Trump Confesses To The Whole Plot To Overturn The 2020 Election https://t.co/n3NAecRuzx",require whole lot immediately indicted public televised confession trump confesses whole plot overturn election
1.4874485162345185e+18,2022-01-29 15:32:16+00:00,['1487448516234518533'],"He has been gone for a month but we need his voice and his fearless laugh more than ever -

Archbishop Desmond Tutu - the staunch and steadfast healer of a nation - BBC News https://t.co/S8opRnXQme",gone month need voice fearless laugh ever archbishop desmond tutu staunch steadfast healer nation bbc news
1.4872422427629855e+18,2022-01-29 01:52:36+00:00,['1487242242762985476'],@POTUS Send Willow in to slap down the filibuster! She has the right attitude!,send willow slap filibuster right attitude
1.487228235066794e+18,2022-01-29 00:56:57+00:00,['1487228235066793988'],‘This Is No Accident’: Biden Takes Credit For Soaring Economic Growth https://t.co/cHUZZ6T2CS via @YouTube,accident biden take credit soaring economic growth via
1.4871822068460462e+18,2022-01-28 21:54:03+00:00,['1487182206846046211'],"@hairygit After conducting lots of Così performances over the years, I’m inclined to say it’s up there with Figaro with the very finest of Mozart’s entire output. Cynical and misogynistic ? Not really. Mozart’s sympathies are always with the social underdog.",conducting lot performance year inclined say figaro finest mozart entire output cynical misogynistic really mozart sympathy always social underdog
1.487132598463828e+18,2022-01-28 18:36:55+00:00,['1487132598463827969'],"Review: Philip Glass and the Bangles, Mashed at the Symphony https://t.co/u9zFidV0Dp",review philip glass bangle mashed symphony
1.4870990407645143e+18,2022-01-28 16:23:34+00:00,['1487099040764514306'],Indian family who died in freezing cold by US-Canada border identified - BBC News https://t.co/C0GXiYeffP,indian family died freezing cold uscanada border identified bbc news
1.487098789311783e+18,2022-01-28 16:22:34+00:00,['1487098789311782919'],Ethiopia civil war: Doctors among those begging for food in Tigray - BBC News https://t.co/XT1grBHnRc,ethiopia civil war doctor among begging food tigray bbc news
1.4868190120257618e+18,2022-01-27 21:50:50+00:00,['1486819012025761796'],@musicologyman Phil.,phil
1.4867391932083937e+18,2022-01-27 16:33:40+00:00,['1486739193208393731'],Remembering the composer of Le Nozze di Figaro and Die Zauberflöte on his 266th Birthday. https://t.co/DJGuZqSayT,remembering composer nozze figaro die zauberflte birthday
1.4867050231909786e+18,2022-01-27 14:17:53+00:00,['1486705023190978568'],"Thursday marks the second anniversary of Virginia’s ratification, meaning the ERA should become the 28th Amendment of the U.S. Constitution today. 

But a memo from the Trump administration’s Department of Justice stands in the way. 

https://t.co/4CVD1W4vhW # via @HuffPostPol",thursday mark second anniversary virginia ratification meaning era become amendment constitution today memo trump administration department justice stand way via
1.4865448770264883e+18,2022-01-27 03:41:32+00:00,['1486544877026488322'],Watch | 'US Congress Must Pass Resolution Warning India On Genocide': Gregory Stanton of ⁦⁦@GenocideWatch1⁩  https://t.co/zaYCtGU6Sf,watch 'us congress must pas resolution warning india genocide' gregory stanton
1.4862574280900037e+18,2022-01-26 08:39:18+00:00,['1486257428090003459'],https://t.co/sz7dVOfScw,
1.4860152829635338e+18,2022-01-25 16:37:06+00:00,['1486015282963533827'],Trump’s Travel Ban Forever Changed The Lives Of Muslims Around The World | HuffPost Latest News https://t.co/cbJueoegsM,trump travel ban forever changed life muslim around world huffpost latest news
1.485639069736444e+18,2022-01-24 15:42:10+00:00,['1485639069736443904'],"This could be a template for us in the US as well as for governments everywhere.

National Endowment for the Arts 
National Endowment for the Humanities https://t.co/WOMJFrsf9m",could template well government everywhere national endowment art national endowment humanity
1.4856384147624837e+18,2022-01-24 15:39:34+00:00,['1485638414762483718'],Hope governments and cultural policy makers are watching and taking notes. https://t.co/dV2ue1FeZO,hope government cultural policy maker watching taking note
1.4854509173778063e+18,2022-01-24 03:14:31+00:00,['1485450917377806337'],"And 16 years ago today...
 
 BBC News carried the story in English on their ASIA TODAY programme to the same broadcast catchment area across South,  Central and East Asia. 

https://t.co/2J73ZE4IQx https://t.co/hjQsTEb0KP",year ago today bbc news carried story english asia today programme broadcast catchment area across south central east asia
1.4848861112143585e+18,2022-01-22 13:50:11+00:00,['1484886111214358531'],Well past time to expand the #SCOTUS https://t.co/sTjPQUoiFE,well past time expand
1.4848856360458404e+18,2022-01-22 13:48:18+00:00,['1484885636045840389'],"Everett Lee, Who Broke Color Barriers on the Conductor’s Podium, Dies at 105 https://t.co/WqmZVRytK5",everett lee broke color barrier conductor podium
1.4845721164313805e+18,2022-01-21 17:02:29+00:00,['1484572116431380482'],@Nate_Cohn Who’s paying you to sabotage #BuildBackBetter ? #ChildTaxCredit is unpopular? Higher taxes for the wealthy are unpopular? Support for working lass families is unpopular?,paying sabotage unpopular higher tax wealthy unpopular support working lass family unpopular
1.484367262047826e+18,2022-01-21 03:28:28+00:00,['1484367262047825923'],@realLizUSA @January6thCmte,
1.4843663298931876e+18,2022-01-21 03:24:45+00:00,['1484366329893187585'],@MaryLTrump No words needed. https://t.co/qJoOyICexD,word needed
1.4843173989371822e+18,2022-01-21 00:10:19+00:00,['1484317398937182208'],29 years ago today at the ⁦@WhiteHouse⁩ https://t.co/F0QJnXj8L7,year ago today
1.4841561534918615e+18,2022-01-20 13:29:35+00:00,['1484156153491861505'],"Tories who want PM to resign 'facing intimidation and blackmail', UK MP warns - YouTube https://t.co/YnvKB5Nfxy",tory want resign 'facing intimidation blackmail' warns youtube
1.4841006583158129e+18,2022-01-20 09:49:04+00:00,['1484100658315812865'],@HawleyMO #subpoenaHawley,
1.4840961602226586e+18,2022-01-20 09:31:12+00:00,['1484096160222658561'],America must take steps now to avoid a slide into authoritarianism | Thomas Zimmer https://t.co/ZZLRJOG8mr,america must take step avoid slide authoritarianism thomas zimmer
1.4840928093889536e+18,2022-01-20 09:17:53+00:00,['1484092809388953602'],I didn’t spend 32 years waiting to become an American voter to have #MoscowMitch and his #DarkMoney donors try to sabotage my right to vote. #EndTheFilibuster #PassVotingRights https://t.co/VS5qeV79tB,didnt spend year waiting become american voter donor try sabotage right vote
1.4839487079765563e+18,2022-01-19 23:45:17+00:00,['1483948707976556549'],"Why is DeJoy being allowed to sabotage this critical service? 

Free Covid tests: USPS on the hook for deliveries - CNNPolitics https://t.co/uSURB8jQrr",dejoy allowed sabotage critical service free covid test usps hook delivery cnnpolitics
1.4839288631934157e+18,2022-01-19 22:26:25+00:00,['1483928863193415682'],A Slaughter of Wolves Like This Hasn’t Been Seen in a Century https://t.co/GmtDLruKVI,slaughter wolf like hasnt seen century
1.4839286658681897e+18,2022-01-19 22:25:38+00:00,['1483928665868189703'],We Know the Real Cause of the Crisis in Our Hospitals. It’s Greed. https://t.co/HP1ab6WO7y,know real cause crisis hospital greed
1.4838201745706312e+18,2022-01-19 15:14:32+00:00,['1483820174570631175'],Happy Birthday Sir Simon Rattle! https://t.co/laWZ2szWFi,happy birthday sir simon rattle
1.4836191321427558e+18,2022-01-19 01:55:40+00:00,['1483619132142755845'],@CREWcrew Bit late but better late than never.,bit late better late never
1.4836122706556396e+18,2022-01-19 01:28:24+00:00,['1483612270655639562'],"It looks increasingly as if  ⁦@RishiSunak⁩ will be the first Indian Prime Minister of the United Kingdom by the end of the week. 
—
Even under the mask, Johnson looked like someone who knew the game was up | John Crace | The Guardian https://t.co/r0PrViTBei",look increasingly first indian prime minister united kingdom end week even mask johnson looked like someone knew game john crace guardian
1.4834373822339604e+18,2022-01-18 13:53:27+00:00,['1483437382233960449'],It’s well past time to prosecute @pritipatel for crimes against humanity. The #PartyGate scandal is just the glacé cherry of arrogance sitting atop her disdain for the citizens of her country. https://t.co/7SvFxrGmBT,well past time prosecute crime humanity scandal glac cherry arrogance sitting atop disdain citizen country
1.4834353073662935e+18,2022-01-18 13:45:12+00:00,['1483435307366293512'],"End of an era. Another titan leaves the stage.

 R.I.P. Pandit Birju Maharaj.

https://t.co/6LSqNYVPzf",end era another titan leaf stage rip pandit birju maharaj
1.4830238564282696e+18,2022-01-17 10:30:15+00:00,['1483023856428269569'],"Wealth of world's 10 richest has doubled - Oxfam
The pandemic has made the world's wealthiest far richer but has led to more people living in poverty.
Lower incomes for the world's poorest contributed to the death of 21,000 people each day, Oxfam report  https://t.co/5BMseqG973",wealth world's richest doubled oxfam pandemic made world's wealthiest far richer led people living poverty lower income world's poorest contributed death people day oxfam report
1.4829218135166935e+18,2022-01-17 03:44:46+00:00,['1482921813516693507'],@fafnerthekite That’s wonderful. Great forgotten titan and a humane one too.,thats wonderful great forgotten titan humane one
1.4828604319916114e+18,2022-01-16 23:40:51+00:00,['1482860431991611397'],@pianistmagazine Get all those Chopin etudes in your fingers before you’re old enough to drink.,get chopin etude finger youre old enough drink
1.4827258058684252e+18,2022-01-16 14:45:54+00:00,['1482725805868425223'],@fafnerthekite Waiting for your pieces on Dimitri Mitropoulos and Robert Kajanus.,waiting piece dimitri mitropoulos robert kajanus
1.482545552936026e+18,2022-01-16 02:49:38+00:00,['1482545552936026114'],"@realLizUSA How long, Liz, until he throws you under the bus? Good luck!",long liz throw bus good luck
1.4825433575157678e+18,2022-01-16 02:40:55+00:00,['1482543357515767808'],@griffincandey You get even better air circulation (and chops) if you copy out the Lohengrin by hand and use the copy to prop the window open.,get even better air circulation chop copy lohengrin hand use copy prop window open
1.4824795625670738e+18,2022-01-15 22:27:25+00:00,['1482479562567073797'],Beavers Without Borders: a short documentary https://t.co/vjH6eHSm5c via @YouTube,beaver without border short documentary via
1.4820068065788436e+18,2022-01-14 15:08:51+00:00,['1482006806578843650'],@LeaderMcConnell Just to refresh your memory. https://t.co/X771gR6zC3,refresh memory
1.4820065469261578e+18,2022-01-14 15:07:49+00:00,['1482006546926157827'],@LeaderMcConnell That’s what you have been working on for the past decade. Projection of yourself ?,thats working past decade projection
1.481960139162886e+18,2022-01-14 12:03:25+00:00,['1481960139162886149'],@hairygit Bravo! It really is a matter of familiarity at the end of the day. Have a listen to Gunter Wand’s Bruckner 8 with the NDR orchestra Hamburg too. And the great Karajan recording with Vienna made just before he died.,bravo really matter familiarity end day listen gunter wand bruckner ndr orchestra hamburg great karajan recording vienna made died
1.4818310930746327e+18,2022-01-14 03:30:38+00:00,['1481831093074632704'],@fafnerthekite Sinema is fine with fascism. Rosbaud was never. Those two names have no place in a single sentence.,sinema fine fascism rosbaud never two name place single sentence
1.4818283687692943e+18,2022-01-14 03:19:48+00:00,['1481828368769294336'],@nytdavidbrooks From the man who has now made peace with the “centrist”notion that it’s ok to prosecute people for bringing food and water to voters standing in line for 6 hours.,man made peace centristnotion prosecute people bringing food water voter standing line hour
1.4817721435579845e+18,2022-01-13 23:36:23+00:00,['1481772143557984263'],Who paid for it? #InvestigateSinemaDonors https://t.co/MTmijrLB9U,paid
1.4817636005240095e+18,2022-01-13 23:02:26+00:00,['1481763600524009476'],Sen. Kyrsten Sinema defended the filibuster in a floor speech that was completely delusional and divorced from where the country and the political system currently are. https://t.co/iIy5CgwwMp # via @HuffPostPol,sen kyrsten sinema defended filibuster floor speech completely delusional divorced country political system currently via
1.4816639498589143e+18,2022-01-13 16:26:28+00:00,['1481663949858914305'],"He Was an Important Conductor. Also a Great One. Maybe the greatest one you've never heard of. Should be required reading and listening for every conductor under the age of 60 today.
 https://t.co/BZuTEjEEHw",important conductor also great one maybe greatest one never heard required reading listening every conductor age today
1.4816515761585807e+18,2022-01-13 15:37:18+00:00,['1481651576158580747'],"Was @IngrahamAngle so afraid of antifa violence that she was texting antifa chief of staff Mark Meadows to beg Trump to intervene?

Fox News' Laura Ingraham messaged Mark Meadows a week after the insurrection with some advice for Donald Trump. https://t.co/iHPNyTy2ow @HuffPostPol",afraid antifa violence texting antifa chief staff mark meadow beg trump intervene fox news' laura ingraham messaged mark meadow week insurrection advice donald trump
1.4816432073854405e+18,2022-01-13 15:04:02+00:00,['1481643207385440263'],@maddow New Mexico??? The great “swing state” of New Mexico where Biden won by more than 10% ??? Were they trying this insanity in other blue states too?,new mexico great swing state new mexico biden trying insanity blue state
1.4816151246287544e+18,2022-01-13 13:12:27+00:00,['1481615124628754436'],"UK PM ⁦@BorisJohnson⁩ tries to emulate Henry II, but may not be as successful. 
—
What next for Boris Johnson after his party apology? - BBC News https://t.co/IDlIOvbMas",try emulate henry may successful next boris johnson party apology bbc news
1.4816118745463685e+18,2022-01-13 12:59:32+00:00,['1481611874546368516'],German court finds Syrian colonel guilty of crimes against humanity - BBC News https://t.co/huw3qBCf6C,german court find syrian colonel guilty crime humanity bbc news
1.4816117518880768e+18,2022-01-13 12:59:03+00:00,['1481611751888076805'],UK cabinet Ministers playing roulette (Russian or otherwise) with their own futures as they rally round PM as he faces calls to quit - BBC News https://t.co/h91X3IqCyy,cabinet minister playing roulette russian otherwise future rally round face call quit bbc news
1.4816021522127053e+18,2022-01-13 12:20:54+00:00,['1481602152212705281'],@LeaderMcConnell What about the millions of voters whom you personally silenced by blocking more than 100 judges whom President Obama nominated?,million voter personally silenced blocking judge president obama nominated
1.4810244490256138e+18,2022-01-11 22:05:19+00:00,['1481024449025613826'],"@BrundibarF Her mother was Justine Mahler, sister of Gustav Mahler and her father was Arnold Rosé, the legendary concertmaster of the Vienna Philharmonic and the Bayreuth Festival Orchestra, who worked closely with Brahms, Mahler and Schoenberg.",mother justine mahler sister gustav mahler father arnold legendary concertmaster vienna philharmonic bayreuth festival orchestra worked closely brahms mahler schoenberg
1.4808236435172065e+18,2022-01-11 08:47:23+00:00,['1480823643517206530'],@Silpayamanant @MetOpera @glyndebourne @santafeopera @operamagazine @LyricOpera @SFOpera @bastilleopera @StaatsoperBLN @bay_staatsoper @RoyalOperaHouse @staatsoperHH @GOpera @TheAtlantaOpera @cincinnatiopera @ChautOpera @SeattleOpera,
1.480810246528508e+18,2022-01-11 07:54:09+00:00,['1480810246528507906'],"@GOPLeader⁩ McCarthy establishes that he is not fit to serve as ⁦@GOPLeader⁩ or as Speaker of the House. 

Kevin McCarthy vows to remove Democrats from committees if Republicans win House - CNNPolitics https://t.co/A2irNwVeBN",mccarthy establishes fit serve speaker house kevin mccarthy vow remove democrat committee republican win house cnnpolitics
1.4807347212524134e+18,2022-01-11 02:54:02+00:00,['1480734721252413442'],"@AmbLindnerIndia Parry’s Corner in Chennai used to be called “Emden Corner” after being hit by a bombardment from the German light cruiser SMS Emden which quietly sneaked into Madras Harbor on September 22, 1914 and shelled the British oil depot belonging to Burmah Shell! 
How far we have come! https://t.co/9Ii6Wyjo3D",parry corner chennai used called emden corner hit bombardment german light cruiser emden quietly sneaked madras harbor september shelled british oil depot belonging burmah shell far come
1.4806556924785295e+18,2022-01-10 21:40:00+00:00,['1480655692478529542'],"@AmbLindnerIndia @prahladkumar98 Frohe Hindi Diwas, geehrter Herr Botschafter!",frohe hindi diwas geehrter herr botschafter
1.4806543071462318e+18,2022-01-10 21:34:30+00:00,['1480654307146231808'],Mourning one of the giants of American opera and American opera pedagogy. R.I.P. John Moriarty. https://t.co/iPy0KaoO6x,mourning one giant american opera american opera pedagogy rip john moriarty
1.4805568718619156e+18,2022-01-10 15:07:20+00:00,['1480556871861915651'],@PriyamvadaGopal Congratulations. I’m sure it’s a better place for your presence.,congratulation sure better place presence
1.4804002746238075e+18,2022-01-10 04:45:04+00:00,['1480400274623807488'],Trump’s cable cabinet: New texts reveal the influence of Fox hosts on previous White House https://t.co/rRmhETBaNH,trump cable cabinet new text reveal influence fox host previous white house
1.4803187858905334e+18,2022-01-09 23:21:16+00:00,['1480318785890533381'],"Všechno nejlepší k narozeninám Maestro! A Very Happy 86th Birthday to my beloved old teacher Maestro #ZdenekMacal a great 20th century master and distinguished former Chief Conductor of the @CzechPhil, @NJSymphony, @sydsymph, @MilwSymphOrch and professor of conducting at @MSMnyc. https://t.co/SYyPPN6FWN",vechno nejlep narozeninm maestro happy birthday beloved old teacher maestro great century master distinguished former chief conductor professor conducting
1.4802127124960174e+18,2022-01-09 16:19:46+00:00,['1480212712496017410'],@BenPonniah https://t.co/1Z3VYjnLp8,
1.4801068184541348e+18,2022-01-09 09:18:59+00:00,['1480106818454134787'],@BenPonniah Someone has transcribed them. Recently.,someone transcribed recently
1.4801014477484933e+18,2022-01-09 08:57:38+00:00,['1480101447748493314'],@BenPonniah Have you heard the five Elgar piano improvisations? Astonishing pieces. He recorded them to fill up space on a record.,heard five elgar piano improvisation astonishing piece recorded fill space record
1.4800956629602673e+18,2022-01-09 08:34:39+00:00,['1480095662960267269'],"@LyricOpera I don't want to live a life that hasn't included hearing @SusanneMentzer singing Urlicht, Shéhérazade or Béatrice or...fill in the blank.",want live life included hearing singing urlicht shhrazade batrice orfill blank
1.480091881463849e+18,2022-01-09 08:19:37+00:00,['1480091881463848963'],Jimmy Carter: I Fear for Our Democracy https://t.co/0QN1bUu83S,jimmy carter fear democracy
1.4798558508440494e+18,2022-01-08 16:41:43+00:00,['1479855850844049408'],"Rest in peace Sidney Poitier. He gave so many of us courage and strength...and great art.
---
Trailblazing Actor Sidney Poitier Dies At 94 https://t.co/Aba66Z6XL3 via @YouTube",rest peace sidney poitier gave many courage strengthand great art trailblazing actor sidney poitier via
1.479660067502887e+18,2022-01-08 03:43:45+00:00,['1479660067502886912'],"Lani Guinier, voting rights champion and former assistant attorney general nominee, dies at 71 - CNNPolitics https://t.co/AalYxdKwor",lani guinier voting right champion former assistant attorney general nominee cnnpolitics
1.479551839121154e+18,2022-01-07 20:33:41+00:00,['1479551839121154052'],"R.I.P.  Sidney Poitier | Black acting pioneer, dies aged 94 | Sidney Poitier | The Guardian https://t.co/JaE4tcth85",rip sidney poitier black acting pioneer aged sidney poitier guardian
1.479417669422039e+18,2022-01-07 11:40:33+00:00,['1479417669422039042'],"Hundreds of thousands of test kits expire as DeSantis struggles for breath in press conference
-
800,000 to 1 million rapid test kits expired in a Florida warehouse as COVID-19 skyrocketed in Gov. Ron DeSantis' state, officials admitted. https://t.co/Qf8t818LCe @HuffPostPol",hundred thousand test kit expire desantis struggle breath press conference million rapid test kit expired florida warehouse covid skyrocketed gov ron desantis' state official admitted
1.479230924407677e+18,2022-01-06 23:18:29+00:00,['1479230924407676937'],One part of 2021 that I am taking into 2022. https://t.co/pKmDteqA74,one part taking
1.4791958894325023e+18,2022-01-06 20:59:16+00:00,['1479195889432502279'],"R.I.P. #DaleClevenger, legendary French Hornist and teacher of generations of horn players. https://t.co/Kx5cPH1eDc",rip legendary french hornist teacher generation horn player
1.478950502616519e+18,2022-01-06 04:44:12+00:00,['1478950502616518656'],"R.I.P. ⁦Shillong Chamber Choir⁩ Founder and Pioneering Indian Conductor, Padma Shri Neil Nongkynrih - Uncle Neil, 51 . 
Deep Condolences and Sympathy to the ⁦@shgchmbrchoir⁩  https://t.co/1KaWyb3gR6",rip shillong chamber choir founder pioneering indian conductor padma shri neil nongkynrih uncle neil deep condolence sympathy
1.478856401057366e+18,2022-01-05 22:30:16+00:00,['1478856401057366018'],"The @FBI @DHSgov @TheJusticeDept &amp; @CIA should show up &amp; go after every single one of these orgs at their “commemoration” events.
———
Nearly two dozen pro-insurrectionist events are planned across the country for the anniversary of the U.S. Capitol riot. https://t.co/MjsKcJseXe",amp show amp every single one orgs commemoration event nearly two dozen proinsurrectionist event planned across country anniversary capitol riot
1.4787224044783288e+18,2022-01-05 13:37:49+00:00,['1478722404478328832'],It is way past time for @Twitter and @paraga to ban @realLizUSA the surrogate account for the insurrectionist former President before they incite more deadly violence against the US government on the anniversary of the first #Jan6thInsurrection. #BanLizHarrington now.,way past time ban surrogate account insurrectionist former president incite deadly violence government anniversary first
1.4785092761047409e+18,2022-01-04 23:30:55+00:00,['1478509276104740865'],@realLizUSA Why is @twitter permitting this open call to fascism?,permitting open call fascism
1.478508451995304e+18,2022-01-04 23:27:38+00:00,['1478508451995303939'],"Trump Tried A Coup In Plain Sight — And Has, So Far, Gotten Away With It | HuffPost Latest News https://t.co/951J9nY3Yv",trump tried coup plain sight far gotten away huffpost latest news
1.4784772061710991e+18,2022-01-04 21:23:29+00:00,['1478477206171099143'],https://t.co/I4EjaaOVO1,
1.4784549275004027e+18,2022-01-04 19:54:57+00:00,['1478454927500402690'],Trump ‘Doesn’t Have A Right To The Nation's Airwaves’ https://t.co/fVeP3IXkQX via @YouTube,trump doesnt right nation's airwave via
1.4784067419352433e+18,2022-01-04 16:43:29+00:00,['1478406741935243268'],"@hairygit @musicologyman Those NDRSO recordings with Wand in Lubeck Cathedral are quite closely aligned with the kind of acoustic that Bruckner had in mind. And a great learned orchestra as well as a wise, supremely experienced and thoughtful conductor. A wonderful place to start.",ndrso recording wand lubeck cathedral quite closely aligned kind acoustic bruckner mind great learned orchestra well wise supremely experienced thoughtful conductor wonderful place start
