id,created_at,edit_history_tweet_ids,text,clean_text
1.525669136587686e+18,2022-05-15 02:47:22+00:00,['1525669136587685889'],Shireen Abu Aqleh: UN security council unanimously condemns killing of Palestinian American journalist https://t.co/MNdm1cHJYn,shireen abu aqleh security council unanimously condemns killing palestinian american journalist
1.5254743343614935e+18,2022-05-14 13:53:17+00:00,['1525474334361493505'],"@RepChipRoy @GTOprofreedom Did you read the GOP tax cut bill in 2018? If you want a reduction of expenses, how about a $10K salary cut for members of Congress including yourself? Surely you can manage with $169K plus speaking fees?",read gop tax cut bill want reduction expense salary cut member congress including surely manage plus speaking fee
1.525057009703342e+18,2022-05-13 10:14:59+00:00,['1525057009703342081'],"It's well past time for the  @TheJusticeDept to investigate Rand Paul's finances and his financial links to the Putin/Trump Axis. The late John McCain even laid it out in public.

Senator Rand Paul single-handedly holds up $40bn US aid for Ukraine https://t.co/mPXXZDZjhk",well past time investigate rand paul's finance financial link putintrump axis late john mccain even laid public senator rand paul singlehandedly hold aid ukraine
1.524943445411758e+18,2022-05-13 02:43:44+00:00,['1524943445411758081'],"@TuckerCarlson That last bit of Clause 1 is there to address actions like yours. 

Article III of the US Constitution SECTION 3. Clause 1. Treason against the United States, shall consist only in levying War against them, or in adhering to their Enemies, giving them Aid and Comfort.",last bit clause address action like article iii constitution section clause treason united state shall consist levying war adhering enemy giving aid comfort
1.5249393131877908e+18,2022-05-13 02:27:18+00:00,['1524939313187790884'],https://t.co/lwBQIQzqwn,
1.5246662495439217e+18,2022-05-12 08:22:15+00:00,['1524666249543921667'],US fracking boom could tip world to edge of climate disaster | Oil | The Guardian https://t.co/hCJc8R2KKn,fracking boom could tip world edge climate disaster oil guardian
1.524567551371526e+18,2022-05-12 01:50:03+00:00,['1524567551371526144'],@DrDavidVernon Emerson Quartet if you haven't already.,emerson quartet already
1.5244464143649874e+18,2022-05-11 17:48:42+00:00,['1524446414364987394'],@realLizUSA https://t.co/wm95GKBY74,
1.5242064819979796e+18,2022-05-11 01:55:18+00:00,['1524206481997979649'],"@SenRickScott This is what you mean, of course? https://t.co/ltLhJozKLC",mean course
1.5241783159925228e+18,2022-05-11 00:03:23+00:00,['1524178315992522752'],"The Senate has confirmed Lisa Cook for the Federal Reserve, making her the first Black woman to have a seat on the board of governors. #FirstBlackWomanOnTheFED

https://t.co/uyiwKshk0J # via @HuffPostPol",senate confirmed lisa cook federal reserve making first black woman seat board governor via
1.5240588263658783e+18,2022-05-10 16:08:34+00:00,['1524058826365878277'],"R.i.P. Pandit Shiv Kumar Sharma - the #Santoor icon who brought his instrument to the world's ear. Gone too soon.

Shiv Kumar Sharma: The maestro who straddled Indian classical and popular music - BBC News https://t.co/sqPdCMYn7F",rip pandit shiv kumar sharma icon brought instrument world's ear gone soon shiv kumar sharma maestro straddled indian classical popular music bbc news
1.523981549011624e+18,2022-05-10 11:01:30+00:00,['1523981549011623936'],"@AAKSarod My condolences to you and whole music community on this painful loss. Pandit Shiv Kumar Sharmaji was one of greatest giants of our art. 
Om Shanti.",condolence whole music community painful loss pandit shiv kumar sharmaji one greatest giant art shanti
1.5236449728175923e+18,2022-05-09 12:44:04+00:00,['1523644972817592320'],‘Canaries in the coalmine’: loss of birds signals changing planet https://t.co/pV9srPiTOl,canary coalmine loss bird signal changing planet
1.5235991854756782e+18,2022-05-09 09:42:07+00:00,['1523599185475678208'],"""Alito’s leaked opinion cites Matthew Hale, a 17th-century jurist who conceived the notion that husbands can’t be prosecuted for raping their wives, who sentenced women to death as “witches,” and whose misogyny stood out even in his time."" - @propublica 
  https://t.co/IM6nmNx3rv",alitos leaked opinion cite matthew hale thcentury jurist conceived notion husband cant prosecuted raping wife sentenced woman death witch whose misogyny stood even time
1.5235962902019525e+18,2022-05-09 09:30:37+00:00,['1523596290201952256'],"Who was Matthew Hale, the 17th-century jurist that Samuel Alito invokes in his draft overturning Roe vs Wade? - The Boston Globe https://t.co/L2o1vbH3EA",matthew hale thcentury jurist samuel alito invokes draft overturning roe wade boston globe
1.5234860921539584e+18,2022-05-09 02:12:44+00:00,['1523486092153958400'],"@elonmusk How can you die if you are only a virtual reality projection of a superior civilization sitting somewhere far,far away and quite possibly long, long ago? They could just as easily turn you into Q, as in Star Trek, not as in QAnon.",die virtual reality projection superior civilization sitting somewhere farfar away quite possibly long long ago could easily turn star trek qanon
1.5233257184527483e+18,2022-05-08 15:35:27+00:00,['1523325718452748288'],"Sanction Rupert Murdoch and the Tucker-Sean-Laura conspiracy trio now. 
#sanctionMurdoch

Fox News deals in Kremlin propaganda. So why not freeze Rupert Murdoch’s assets? | Nick Cohen https://t.co/zEx1pevdIZ",sanction rupert murdoch tuckerseanlaura conspiracy trio fox news deal kremlin propaganda freeze rupert murdoch asset nick cohen
1.5230991326503936e+18,2022-05-08 00:35:05+00:00,['1523099132650393600'],"Leonard Peltier To @JoeBiden: ‘I’m Not Guilty. I Would Like To Go Home In a rare interview with HuffPost, the imprisoned Native American rights activist said he is also “grateful” that @POTUS is giving tribes their sovereignty back. https://t.co/ZtPiABgIAf # via @HuffPostPol",leonard peltier guilty would like home rare interview huffpost imprisoned native american right activist said also grateful giving tribe sovereignty back via
1.5230746255251456e+18,2022-05-07 22:57:42+00:00,['1523074625525145602'],Expand the court before they end the United States.,expand court end united state
1.5229767775466537e+18,2022-05-07 16:28:53+00:00,['1522976777546653702'],"@sullydish Take three minutes and listen to @SenGillibrand. Your Y chromosome is quietly begging you.

https://t.co/xIZlF5rOlK",take three minute listen chromosome quietly begging
1.5226580669021716e+18,2022-05-06 19:22:27+00:00,['1522658066902171653'],@fafnerthekite Hoping you’ll do a retrospective on Eduard van Beinum too some day. The profession really needs to know about these people who contributed so much.,hoping youll retrospective eduard van beinum day profession really need know people contributed much
1.522657442395476e+18,2022-05-06 19:19:58+00:00,['1522657442395475968'],"@fafnerthekite Bravo on a beautiful portrait! Still remember hearing stories of Mitropoulos from Gunther Schuller and Robert Mann who counted him as a mentor. Also remember finding in the early 90s, his (and Ormandy’s) old “office”in the basement of Northrop Auditorium at the Univ. of Minn.",bravo beautiful portrait still remember hearing story mitropoulos gunther schuller robert mann counted mentor also remember finding early ormandy old officein basement northrop auditorium univ minn
1.5225573267078103e+18,2022-05-06 12:42:09+00:00,['1522557326707810304'],@briantylercohen That should have quite an effect on tourism and out of state tuition in Louisiana. Wonder if they thought about that.,quite effect tourism state tuition louisiana wonder thought
1.5222707437190267e+18,2022-05-05 17:43:22+00:00,['1522270743719026689'],131 years of @carnegiehall today! Happy Birthday to my favorite concert hall! https://t.co/P4TybBUaHt,year today happy birthday favorite concert hall
1.5222665693044244e+18,2022-05-05 17:26:47+00:00,['1522266569304424449'],@tonyprinciotti Even the secondo part by itself is a miracle!,even secondo part miracle
1.5221918523588444e+18,2022-05-05 12:29:53+00:00,['1522191852358844416'],"Justice Alito’s crazy draft establishes that it is not abortion but the fanatic Federalist Society that should be restricted from the influence it has on  judiciary selection in the US.

The Supreme Court's Leaked Draft Is Full Of Mystifying Arguments  https://t.co/T4n84Cg0Cj",justice alitos crazy draft establishes abortion fanatic federalist society restricted influence judiciary selection supreme court's leaked draft full mystifying argument
1.522156659572945e+18,2022-05-05 10:10:02+00:00,['1522156659572944896'],Looks like Samuel Alito is going after the protesters who waved this sign in 2018 by citing as his legal precedent Matthew Hale who came up with a legal doctrine for burning witches 400 years ago. https://t.co/R48CgTXDII,look like samuel alito going protester waved sign citing legal precedent matthew hale came legal doctrine burning witch year ago
1.522155749551616e+18,2022-05-05 10:06:25+00:00,['1522155749551616002'],"@statesman Do the republicans just want to turn the US into another country ravaged by the greed of the international military industrial complex like Somalia, Afghanistan, Syria, Ukraine? Today it’s no education for immigrants, tomorrow it’s no education for women. And the day after that?",republican want turn another country ravaged greed international military industrial complex like somalia afghanistan syria ukraine today education immigrant tomorrow education woman day
1.5221465578769736e+18,2022-05-05 09:29:54+00:00,['1522146557876973569'],Donald Trump's shocking behavior sadly no longer shocks a traumatized nation. https://t.co/r6zR4mUTyW,donald trump's shocking behavior sadly longer shock traumatized nation
1.5221462725720187e+18,2022-05-05 09:28:46+00:00,['1522146272572018690'],"Mainstream media doesn’t seem to understand that getting vaporized is not clever marketing strategy.
—
Democrats and Republicans have become wary of war. The media hasn't.
In recent years, both parties have become less interventionist. The media hasn't. https://t.co/8n0egdwr6Y",mainstream medium doesnt seem understand getting vaporized clever marketing strategy democrat republican become wary war medium recent year party become interventionist medium
1.5220348007307223e+18,2022-05-05 02:05:49+00:00,['1522034800730722309'],"Sotomayor : “Why do we now say that Roe and Casey are so unusual that they must be overturned?” She noted that the sponsors of the Mississippi law at hand said they were doing it “because we have new justices on the Supreme Court.”
 https://t.co/9fOYIkQQAq",sotomayor say roe casey unusual must overturned noted sponsor mississippi law hand said new justice supreme court
1.5218932200405563e+18,2022-05-04 16:43:13+00:00,['1521893220040556544'],"@MollyJongFast Say the frightened Venmo predator, during time off between dodging jail and stalking underage prey.",say frightened venmo predator time dodging jail stalking underage prey
1.5218740877395927e+18,2022-05-04 15:27:12+00:00,['1521874087739592707'],@Acyn There is a God and She is pissed!,god pissed
1.5218695316894925e+18,2022-05-04 15:09:05+00:00,['1521869531689492482'],#VoteBlueIn2022 #RegisterDemocrats https://t.co/awfH3I2Vhj,
1.5218543026120704e+18,2022-05-04 14:08:35+00:00,['1521854302612070400'],"Contraception could come under fire next if #RoeVWade is overturned. Meanwhile there’s #mattgaetz and his Venmo. #VoteBlueIn2022 

https://t.co/0YSiRiNvTn",contraception could come fire next overturned meanwhile venmo
1.521853158762369e+18,2022-05-04 14:04:02+00:00,['1521853158762369024'],Overturning #RoeVsWade and the #RightToChoose is an act of #ViolenceAgainstWomen.,overturning act
1.5218519110785638e+18,2022-05-04 13:59:04+00:00,['1521851911078563842'],"If you are terrified or even concerned about yourself or your daughter, sister, niece being forced into motherhood by a cabal of justices appointed by a con-man, now is the time to register to vote in the midterms and #makeaplan to #vote. #VoteBlueIn2022 #RoeVWade #WomensRights",terrified even concerned daughter sister niece forced motherhood cabal justice appointed conman time register vote midterm
1.5217584056434156e+18,2022-05-04 07:47:31+00:00,['1521758405643415552'],https://t.co/JrLMrkgxnd,
1.5215992623789343e+18,2022-05-03 21:15:08+00:00,['1521599262378934272'],"British Home Secretary @pritipatel , already under fire for her cruel refugee policies, now faces legal action threat over Ukraine visas https://t.co/s6E4R6PxZy via @BBCNews",british home secretary already fire cruel refugee policy face legal action threat ukraine visa via
1.521534651831042e+18,2022-05-03 16:58:24+00:00,['1521534651831042049'],@Newsweek It’s time for @FOXnews and Rupert Murdoch to topple Tucker Carlson. #FireTuckerCarlson today!,time rupert murdoch topple tucker carlson today
1.52139195653811e+18,2022-05-03 07:31:23+00:00,['1521391956538109952'],Kavanaugh: Roe v. Wade is 'entitled to respect' (2018) - CNN Video #KavanaughLied https://t.co/o4aVCUkwub,kavanaugh roe wade 'entitled respect' cnn video
1.5212416069883044e+18,2022-05-02 21:33:57+00:00,['1521241606988304384'],"Bravo to David Allen ⁦@fafnerthekite⁩ for this masterful piece on one of the greatest giants of our craft to walk the earth.

A Monkish Conductor Who Expressed His Faith Through Music - The New York Times https://t.co/shCc1JVVJ3",bravo david allen masterful piece one greatest giant craft walk earth monkish conductor expressed faith music new york time
1.5212124476249416e+18,2022-05-02 19:38:04+00:00,['1521212447624941568'],"David Allen @fafnerthekite ‘s retrospective on Hans Rosbaud, like its subject, melds brilliant handling of the craft with substance and a certain absence of flashy sensationalism. Well worth many readings.
—
He Was an Important Conductor. Also a Great One. https://t.co/BZuTEjEEHw",david allen retrospective han rosbaud like subject meld brilliant handling craft substance certain absence flashy sensationalism well worth many reading important conductor also great one
1.5211053882418831e+18,2022-05-02 12:32:39+00:00,['1521105388241883136'],@NadineDorries #resignNadineDorries. The lies always catch up with you.,lie always catch
1.5205580647972086e+18,2022-05-01 00:17:47+00:00,['1520558064797208576'],There is a real trombone section sitting behind @jenpsaki’s ears. Are there GOP media operatives doing the seating at  #whitehousecorrespondentsdinner ?,real trombone section sitting behind ear gop medium operative seating
1.5205502841996165e+18,2022-04-30 23:46:52+00:00,['1520550284199616512'],Global heating risks most cataclysmic extinction of marine life in 250m years https://t.co/2HyjPWx07B,global heating risk cataclysmic extinction marine life year
1.519271813922136e+18,2022-04-27 11:06:41+00:00,['1519271813922136064'],@AmbLindnerIndia Sounds like Indo-German relations these days. Always cheerful and positive when in public even though in some need of regulation. Sometimes nostalgic for the “good old days.” And with deep intentions and hopes in the Generalbass always understated below the surface of discourse.,sound like indogerman relation day always cheerful positive public even though need regulation sometimes nostalgic good old day deep intention hope generalbass always understated surface discourse
1.5192672734244823e+18,2022-04-27 10:48:39+00:00,['1519267273424482306'],"Humanity stuck in ‘spiral of self-destruction’, UN says as global disasters rise https://t.co/rH5cLPYOy8",humanity stuck spiral selfdestruction say global disaster rise
1.519140593586385e+18,2022-04-27 02:25:16+00:00,['1519140593586384897'],@realLizUSA https://t.co/99zdcUYyhF,
1.5178217697171003e+18,2022-04-23 11:04:44+00:00,['1517821769717100544'],"Looking forward to returning to Boston and @Wellesley College on 4/25 to teach/speak about Beethoven, Sonata-form, @music4lifeintl, our mission and why a #LiberalArts approach matters so much in our troubled time and place. #empoweringwomenscholars  #socialimpact #musicforimpact https://t.co/s6r7VgixDQ",looking forward returning boston college teachspeak beethoven sonataform mission approach matter much troubled time place
1.517516988691669e+18,2022-04-22 14:53:38+00:00,['1517516988691668995'],"@realLizUSA How about you @realLizUSA?

Mark Meadows Was Simultaneously Registered To Vote In 3 Different States-
Donald Trump's top aide was registered to vote in North Carolina, South Carolina and Virginia - all while promoting lies that the 2020 election was rigged
https://t.co/nNINxB7TbS",mark meadow simultaneously registered vote different state donald trump's top aide registered vote north carolina south carolina virginia promoting lie election rigged
1.5173281504889242e+18,2022-04-22 02:23:16+00:00,['1517328150488924160'],"Fact Check-
Contrary to social media posts, recounts of the 2020 U.S. presidential election were not conducted ‘in 46 states’ https://t.co/1dJdQuYMwE",fact check contrary social medium post recount presidential election conducted state
1.5172605570485944e+18,2022-04-21 21:54:40+00:00,['1517260557048594432'],"@realLizUSA @realLizUSA get out from under Trump while you still can.
—-
Top two Republicans blamed Trump for Capitol attack, book says https://t.co/6WWEymierv",get trump still top two republican blamed trump capitol attack book say
1.5162419825024123e+18,2022-04-19 02:27:13+00:00,['1516241982502412294'],It’s well past time to ban the Federalist Society.,well past time ban federalist society
1.515512497297625e+18,2022-04-17 02:08:30+00:00,['1515512497297625093'],One wonders what Archbishop Desmond Tutu would have said. Welby needs to condemn in much stronger terms this inhumane criminal plan against humanity. https://t.co/zH0Oty5E6s,one wonder archbishop desmond tutu would said welby need condemn much stronger term inhumane criminal plan humanity
1.515511894437675e+18,2022-04-17 02:06:07+00:00,['1515511894437675011'],Patel personally approved criminal Rwanda plan launch after civil servant concerns - BBC News  https://t.co/74ZyXWF9T5,patel personally approved criminal rwanda plan launch civil servant concern bbc news
1.5149700262305628e+18,2022-04-15 14:12:55+00:00,['1514970026230562820'],@elonmusk learn a couple of Asian and African languages before you talk about civilization(s).,learn couple asian african language talk civilization
1.5147621987778314e+18,2022-04-15 00:27:05+00:00,['1514762198777831426'],@realLizUSA https://t.co/qGhv8tFMrK,
1.5139394064361554e+18,2022-04-12 17:57:36+00:00,['1513939406436155402'],"Bit of a doozy for the Indian National Pride project.
—
British Prime Minister ⁦@BorisJohnson⁩ and  Chancellor of the Exchequer ⁦@RishiSunak⁩ to be fined by law enforcement for breaking the law over lockdown parties - BBC News https://t.co/HNsZ65yZ7t",bit doozy indian national pride project british prime minister chancellor exchequer fined law enforcement breaking law lockdown party bbc news
1.5136744003101243e+18,2022-04-12 00:24:34+00:00,['1513674400310124545'],https://t.co/24X6I83sxT,
1.513673908561531e+18,2022-04-12 00:22:37+00:00,['1513673908561530880'],"Shouldn’t the ⁦@TheJusticeDept⁩ be able to@do something about this?

Ukrainian orphans with former WA state Rep. Matt Shea in Poland get legal guardians | The Seattle Times https://t.co/phg7W1tq2P",shouldnt able something ukrainian orphan former state rep matt shea poland get legal guardian seattle time
1.513653405700436e+18,2022-04-11 23:01:08+00:00,['1513653405700435968'],@sree @pennlaw @Penn How many incidents of racist violence have to be incited by #AmyWax before  @pennlaw and @Penn fire her?,many incident racist violence incited fire
1.5136528693413274e+18,2022-04-11 22:59:01+00:00,['1513652869341327365'],@NikkiMcR Shouldn’t this be enough for @pennlaw to #FireAmyWax ?,shouldnt enough
1.5133363882337116e+18,2022-04-11 02:01:26+00:00,['1513336388233711619'],@realLizUSA https://t.co/4BnI7kFhJJ,
1.5132055601534523e+18,2022-04-10 17:21:34+00:00,['1513205560153452568'],Happy Ram Navami to all celebrating!,happy ram navami celebrating
1.5129673170088305e+18,2022-04-10 01:34:52+00:00,['1512967317008830465'],Imran Khan #LBW after close to 4 years at the crease. Shabaz Sharif may be the new man to bat. #ImranKhanOut,imran khan close year crease shabaz sharif may new man bat
1.5129651271039877e+18,2022-04-10 01:26:10+00:00,['1512965127103987714'],Imran Khan ousted as Pakistan's PM after key vote - BBC News https://t.co/ql2kKmprVE,imran khan ousted pakistan's key vote bbc news
1.5129549344294257e+18,2022-04-10 00:45:40+00:00,['1512954934429425669'],A jury acquitted two men and was hung on two more who were accused of plotting to kidnap the Michigan governor in 2020. https://t.co/gEit7Rc5AL # via @HuffPostPol,jury acquitted two men hung two accused plotting kidnap michigan governor via
1.5129502547185746e+18,2022-04-10 00:27:04+00:00,['1512950254718574595'],"Britain is one of Putin's “fiercest”critics. Its Tory party politicians still get millions in Russia-linked cash.

""You do have to ask yourself what the motivation is for these donations,"" Britain's former attorney general said.

#ToryBloodMoney https://t.co/qajxawZiWd",britain one putin's fiercestcritics tory party politician still get million russialinked cash ask motivation donation britain's former attorney general said
1.5125096301649633e+18,2022-04-08 19:16:11+00:00,['1512509630164963328'],"Remembering my dear friend and teacher, the distinguished American conductor, pianist, teacher and wise man of music, Lawrence Leighton Smith (1936-2013) today on what would have been his 86th birthday. Happy Birthday dear Larry! https://t.co/ucuOh22gYM",remembering dear friend teacher distinguished american conductor pianist teacher wise man music lawrence leighton smith today would birthday happy birthday dear larry
1.5124996602749952e+18,2022-04-08 18:36:34+00:00,['1512499660274995200'],"@SusanneMentzer @SteveSchmidtSES @jonathanvswan Contrast that with KBJ, who quoted Maya Angelou : ""Bringing the gifts that my ancestors gave, I am the dream and the hope of the slave.”

There really is a dividing line in the struggle for the soul of this country.",contrast kbj quoted maya angelou bringing gift ancestor gave dream hope slave really dividing line struggle soul country
1.5124844591483167e+18,2022-04-08 17:36:10+00:00,['1512484459148316674'],@musicologyman Guessing that you are not talking about Fidelio.,guessing talking fidelio
1.5124833895714038e+18,2022-04-08 17:31:55+00:00,['1512483389571403776'],"So moving to hear one of the most profound utterances from a public servant when SCOTUS Justice-designate #KetanjiBrownJackson quoted Maya Angelou. “Bringing the gifts that my ancestors gave, I am the dream and the hope of the slave.” 
She knows the weight of the #responsibility.",moving hear one profound utterance public servant scotus justicedesignate quoted maya angelou bringing gift ancestor gave dream hope slave know weight
1.5122393752324751e+18,2022-04-08 01:22:17+00:00,['1512239375232475145'],"‘This is a crazy, unjust attack’: Pink Floyd re-form to support Ukraine https://t.co/HQte3KsYVs",crazy unjust attack pink floyd reform support ukraine
1.51223861321975e+18,2022-04-08 01:19:16+00:00,['1512238613219749892'],"Give credit where it is due. President @JoeBiden and the @WhiteHouse team did a near perfect job in getting #KetanjiBrownJackson nominated and confirmed. Perfect discipline, no leaks, thorough vetting. Hope the @WhiteHouse and media will contrast that with the #Kavanaugh madness. https://t.co/oCioRiFF51",give credit due president team near perfect job getting nominated confirmed perfect discipline leak thorough vetting hope medium contrast madness
1.512135113492025e+18,2022-04-07 18:27:59+00:00,['1512135113492025349'],Beyond moving! The first Black woman to serve as vice president went to the Senate to preside over a vote confirming the first Black woman Supreme Court justice. https://t.co/9rbZ7k0yEv via @HuffPostPol,beyond moving first black woman serve vice president went senate preside vote confirming first black woman supreme court justice via
1.5116465658820813e+18,2022-04-06 10:06:40+00:00,['1511646565882081284'],"Shrewsbury, Partygate, Covid loans: Where is the accountability? | Salma Shah https://t.co/mcJdqnSS6c",shrewsbury partygate covid loan accountability salma shah
1.5116433757616005e+18,2022-04-06 09:54:00+00:00,['1511643375761600516'],‘I didn’t win the election’: Trump admits defeat in session with historians https://t.co/AebYzjlBRt,didnt win election trump admits defeat session historian
1.51152549995631e+18,2022-04-06 02:05:36+00:00,['1511525499956310021'],Review: Gustavo Dudamel Could Be the New York Philharmonic’s Future https://t.co/cTOQqS80dD,review gustavo dudamel could new york philharmonic future
1.511333516340048e+18,2022-04-05 13:22:44+00:00,['1511333516340047877'],@hairygit Great Trombone parts in No. 8 too.,great trombone part
1.5111131840269722e+18,2022-04-04 22:47:12+00:00,['1511113184026972162'],@LindseyGrahamSC Good luck! https://t.co/SqhY5BcAIo,good luck
1.5110896547030385e+18,2022-04-04 21:13:43+00:00,['1511089654703038465'],#FireBrandonJudd now. https://t.co/4udxruJvcn,
1.5110890975988122e+18,2022-04-04 21:11:30+00:00,['1511089097598812168'],".@GOP senators have just tarnished their own histories forever for blocking Jackson after approving unqualified judges during the last admin. 
Biden's nominee is one step closer to becoming the first Black woman on the nation's highest court. https://t.co/62EE2NJjaz",senator tarnished history forever blocking jackson approving unqualified judge last admin biden's nominee one step closer becoming first black woman nation's highest court
