id,created_at,edit_history_tweet_ids,text,clean_text
1.467475392692904e+18,2021-12-05 12:46:12+00:00,['1467475392692903938'],Pope condemns inhuman treatment of migrants in Europe - BBC News https://t.co/RMOpIT4JqQ,pope condemns inhuman treatment migrant europe bbc news
1.4674336282338714e+18,2021-12-05 10:00:15+00:00,['1467433628233871360'],Abortion rights are human rights. That doesn’t change with a single period of a GOP-Federalist Society engineered SCOTUS in the United States or anywhere else.,abortion right human right doesnt change single period gopfederalist society engineered scotus united state anywhere else
1.4674267961446277e+18,2021-12-05 09:33:06+00:00,['1467426796144627720'],"@AmbLindnerIndia आप असली बोटशाफ्टर हैं ! 
Sohn aus Elysium!",sohn elysium
1.466934580473221e+18,2021-12-04 00:57:12+00:00,['1466934580473221121'],Jailed for 51 weeks for protesting? Britain is becoming a police state by stealth | George Monbiot https://t.co/w9AMEXNHT7,jailed week protesting britain becoming police state stealth george monbiot
1.466934251459334e+18,2021-12-04 00:55:54+00:00,['1466934251459334144'],https://t.co/0UBT0GQfbG,
1.466934112036475e+18,2021-12-04 00:55:21+00:00,['1466934112036474883'],Six months ago… https://t.co/WkhCLfvIn5,six month ago
1.4668343794398454e+18,2021-12-03 18:19:03+00:00,['1466834379439845382'],Wishing Sir Simon all the best for a quick recovery. https://t.co/I44ymCEWjj,wishing sir simon best quick recovery
1.466603192985133e+18,2021-12-03 03:00:24+00:00,['1466603192985133060'],"Deeply honored to serve as Global Ambassador for ABWCI - Association of Business Women in Commerce and Industry. Thank you ABWCI for creating this new possibility for amazing cross-sector collaboration, empowerment and yet unimaginable new impact. Excited…https://t.co/vaBxreMUUm",deeply honored serve global ambassador abwci association business woman commerce industry thank abwci creating new possibility amazing crosssector collaboration empowerment yet unimaginable new impact excited
1.4665794028845384e+18,2021-12-03 01:25:52+00:00,['1466579402884538370'],@tonyprinciotti @AmherstCollege I graduated and left in 1991. I remember hearing that the position had been created and that you were the inaugural appointee. 30 years ago now.,graduated left remember hearing position created inaugural appointee year ago
1.466538232091394e+18,2021-12-02 22:42:16+00:00,['1466538232091394051'],@tonyprinciotti @AmherstCollege It was actually part of my senior honors recital as a graduating student. I was actually your predecessor (leave replacement conductor for Lew Spratlan) some years even before that! @AmherstCollege was never that into conventional teleology!,actually part senior honor recital graduating student actually predecessor leave replacement conductor lew spratlan year even never conventional teleology
1.4664610439039304e+18,2021-12-02 17:35:33+00:00,['1466461043903930369'],"@tonyprinciotti Remember it like yesterday. I was in the middle of conducting rehearsals of Appalachian Spring at @AmherstCollege with the Asparagus Valley Ensemble when the news came. It was a tough year, Bernstein, Copland, Martha Graham all within a few months of each other. https://t.co/Q1Lf2zGp5h",remember like yesterday middle conducting rehearsal appalachian spring asparagus valley ensemble news came tough year bernstein copland martha graham within month
1.4663892534457958e+18,2021-12-02 12:50:16+00:00,['1466389253445795840'],@Clerkenwill @annalapwood @GabrieliCandP @wigmore_hall Ooh! I smell a sesquialtera under your armpit!,ooh smell sesquialtera armpit
1.4662447124074373e+18,2021-12-02 03:15:55+00:00,['1466244712407437323'],"Trump tested positive for COVID-19 a week prior to admitting he was sick, meaning he potentially infected Gold Star families, business leaders visiting the White House, Joe Biden, White House staff, the crews of Air Force One, and many others. https://t.co/iPvTXOzCTW - @HuffPost",trump tested positive covid week prior admitting sick meaning potentially infected gold star family business leader visiting white house joe biden white house staff crew air force one many others
1.4661727413342208e+18,2021-12-01 22:29:56+00:00,['1466172741334220804'],R.I.P. Alvin Lucier. https://t.co/U3QeX51S1M,rip alvin lucier
1.4661723906862735e+18,2021-12-01 22:28:32+00:00,['1466172390686273536'],"R.I.P. @alvinlucier, last of the John Cage, David Tudor cohort.

https://t.co/gHm6PJLSUv",rip last john cage david tudor cohort
1.466079199320494e+18,2021-12-01 16:18:14+00:00,['1466079199320494085'],The US House of Representatives passed the Build Back Better Act. Now the Senate must pass it as well. Please call &amp; tell your Senators to pass #BuildBackBetterAct ! 855-912-2982 .,house representative passed build back better act senate must pas well please call amp tell senator pas
1.4660468215711703e+18,2021-12-01 14:09:34+00:00,['1466046821571170304'],@nytimes His new book’s out. Testimony is going to boost book sales. Timing is good for money not sudden shift of morality.,new book testimony going boost book sale timing good money sudden shift morality
1.466025853444399e+18,2021-12-01 12:46:15+00:00,['1466025853444399113'],@GOP https://t.co/etIqGl9faw,
1.466025702587728e+18,2021-12-01 12:45:39+00:00,['1466025702587727880'],@jacobkschneider @GOP https://t.co/etIqGkRDLW,
1.4660060454536602e+18,2021-12-01 11:27:32+00:00,['1466006045453660160'],"Days Before Dying, Stephen Sondheim Reflected: ‘I’ve Been Lucky’ https://t.co/GBYvbGVH30",day dying stephen sondheim reflected ive lucky
1.4654683621595013e+18,2021-11-29 23:50:59+00:00,['1465468362159501317'],"Deer are consuming the world's largest organism, killing off its opportunity for growth - CNN https://t.co/X4hNzVNWb3",deer consuming world's largest organism killing opportunity growth cnn
1.4653658431860122e+18,2021-11-29 17:03:36+00:00,['1465365843186012164'],"#oneconductoraday
Beatrice Jona Affron, Music Director of the Pennsylvania Ballet (Photo: PA Ballet) https://t.co/JYChEirPzj",beatrice jona affron music director pennsylvania ballet photo ballet
1.4653626635930993e+18,2021-11-29 16:50:58+00:00,['1465362663593099267'],"WHO spokesperson: South Africa should get ""gold medal"" for transparency on Omicron variant, not travel bans https://t.co/B8arHZDtNp",spokesperson south africa get gold medal transparency omicron variant travel ban
1.46530512748569e+18,2021-11-29 13:02:21+00:00,['1465305127485689862'],"@MozartMostly @music4lifeintl @shmulikviola @METOrchestra Happy Hanukkah to you @shmulikviola , @MozartMostly and @METOrchestra ! You keep the light going for us all!",happy hanukkah keep light going
1.465303342402478e+18,2021-11-29 12:55:15+00:00,['1465303342402478084'],‘Her Heart Was Beating Too’: The Women Who Died After Abortion Bans https://t.co/Fd1jPlZ7e9,heart beating woman died abortion ban
1.465122602691797e+18,2021-11-29 00:57:03+00:00,['1465122602691796994'],חַג חֲנוּכָּה שַׂמֵחַ !    !Hanukkah Sameach https://t.co/Iuxrp6t85F,hanukkah sameach
1.4649176280577884e+18,2021-11-28 11:22:34+00:00,['1464917628057788424'],The bustling hidden world of hedgerows https://t.co/JmRTZIGbmi via @BBC_Future,bustling hidden world hedgerow via
1.464434819757228e+18,2021-11-27 03:24:03+00:00,['1464434819757228032'],"Stephen Sondheim, Titan of the American Musical, Is Dead at 91 https://t.co/izt19mMWfZ",stephen sondheim titan american musical dead
1.4643808901680538e+18,2021-11-26 23:49:45+00:00,['1464380890168053774'],“I have nothing left to sell to help feed my children; nothing left of myself to give” https://t.co/QTHkMh6WP3,nothing left sell help feed child nothing left give
1.4643771817364234e+18,2021-11-26 23:35:01+00:00,['1464377181736423427'],"R.I.P. Stephen Sondheim, master of musical theater, 91, who gave us so many musical masterpieces and the immortal words of West Side Story.  https://t.co/AzRwyThbY8",rip stephen sondheim master musical theater gave many musical masterpiece immortal word west side story
1.4642905710994555e+18,2021-11-26 17:50:52+00:00,['1464290571099455495'],Editorial from @Independent : The risk of drowning is not enough to deter people from coming to Britain https://t.co/ZGBWvm0dp9,editorial risk drowning enough deter people coming britain
1.4642552566074737e+18,2021-11-26 15:30:32+00:00,['1464255256607473714'],@_nilanjana_ Blessings to your curry leaves from ours! https://t.co/NxUGsHnZbR,blessing curry leaf
1.4640925077472788e+18,2021-11-26 04:43:50+00:00,['1464092507747278848'],Scientists warn of new Covid variant with high number of mutations https://t.co/K3fAJ2mmNw,scientist warn new covid variant high number mutation
1.463708968988074e+18,2021-11-25 03:19:47+00:00,['1463708968988073985'],"@Qlittlevoices @thenitinsawhney Asylum is not a subject for cost benefit analysis. It is a humanitarian principle derived from moral understanding, the ostensible result of “civilization.”",asylum subject cost benefit analysis humanitarian principle derived moral understanding ostensible result civilization
1.4637077897176556e+18,2021-11-25 03:15:06+00:00,['1463707789717655558'],"Just a reminder that #45 continues as he did for four years, to embezzle funds from the Secret Service by charging them rent and other fees while they protect him and his family.
—
Helicopters, Clipboards, Crew Cuts: The President Must Be in Town https://t.co/rOUBk4P7rS",reminder continues four year embezzle fund secret service charging rent fee protect family helicopter clipboard crew cut president must town
1.4627888726104064e+18,2021-11-22 14:23:39+00:00,['1462788872610406400'],"“From the minute a child is taught how to play an instrument, he’s no longer poor”: Maestro José António Abreu (1939-2018)    – Luis Dias, Founder of @childsplayindia an @elsistema-inspired music education social enterprise in Goa, India https://t.co/PKNo82ADJY",minute child taught play instrument longer poor maestro jos antnio abreu luis dia founder inspired music education social enterprise goa india
1.4617222616401224e+18,2021-11-19 15:45:19+00:00,['1461722261640122379'],The ingenious living bridges of India https://t.co/I5h4vKWboV via @BBC_Future,ingenious living bridge india via
1.4617097283593626e+18,2021-11-19 14:55:31+00:00,['1461709728359362560'],"The second half of President @JoeBiden’s legislative agenda took a big step forward, with  passage in the US House. https://t.co/h6KX3reL2J via @HuffPostPol",second half president legislative agenda took big step forward passage house via
1.461708586556473e+18,2021-11-19 14:50:58+00:00,['1461708586556473346'],"And not a moment too soon! 
—
Biden expected to replace Ron Bloom, USPS board chair and key DeJoy ally, on postal board - The Washington Post https://t.co/4NDMoCXuHm",moment soon biden expected replace ron bloom usps board chair key dejoy ally postal board washington post
1.461676458921894e+18,2021-11-19 12:43:19+00:00,['1461676458921893893'],"New bill quietly gives powers to remove British citizenship without notice.
https://t.co/LPvSWvOgFe",new bill quietly give power remove british citizenship without notice
1.461498752171225e+18,2021-11-19 00:57:10+00:00,['1461498752171225095'],"@arunNYC @hullaballumallu “Bandhgala” jacket in several of the vernaculars, I believe. Literally “closed neck.”",bandhgala jacket several vernacular believe literally closed neck
1.4614344722604237e+18,2021-11-18 20:41:44+00:00,['1461434472260423689'],"Watching one of our greatest and most beloved masters Sir Roger Norrington in his final concert as conductor with an all-Haydn concert, a recreation of one of “Dr. Haydn’s Academies” with the stunning Royal Northern @RNSinfonia Sinfonia. Breathtaking music making as always! https://t.co/fD0zNdgNmR",watching one greatest beloved master sir roger norrington final concert conductor allhaydn concert recreation one haydn academy stunning royal northern sinfonia breathtaking music making always
1.4614198474228204e+18,2021-11-18 19:43:38+00:00,['1461419847422820352'],"Listening to Sir Roger Norrington introducing, with his customary charm and twinkling humour, what he says will be his last public concert as a conductor - a recreation of one of “Dr. Haydn’s academies” https://t.co/ldHdDQcmXS",listening sir roger norrington introducing customary charm twinkling humour say last public concert conductor recreation one haydn academy
1.4611714216154767e+18,2021-11-18 03:16:28+00:00,['1461171421615476742'],A Very Happy 91st Birthday to one of the great musical and moral icons of America @David_Amram_ Wishing you a wonderful year ahead! https://t.co/Yq8TbJtb8p,happy birthday one great musical moral icon america wishing wonderful year ahead
1.4609017468013158e+18,2021-11-17 09:24:53+00:00,['1460901746801315841'],"""Authorities in the Indian capital, Delhi, have shut all schools and colleges indefinitely amid the worsening levels of air pollution.""

Delhi smog: Schools and colleges shut as pollution worsens - BBC News https://t.co/GPIlEMSiEv",authority indian capital delhi shut school college indefinitely amid worsening level air pollution delhi smog school college shut pollution worsens bbc news
1.460900924403159e+18,2021-11-17 09:21:37+00:00,['1460900924403159044'],Op-Ed: The failure at Glasgow and what needs to happen next - Los Angeles Times https://t.co/GLc4euJCu9,oped failure glasgow need happen next los angeles time
1.4608109601852662e+18,2021-11-17 03:24:08+00:00,['1460810960185266178'],"@WHCommsDir please tell America and the media that the Biden administration has brought about a huge decline in US Child Poverty in with the Child Tax Credit program. People need to hear this in the Midwest, in the South, in upstate NY. #BuildBackBetter 
https://t.co/7kWRgG5ieS",please tell america medium biden administration brought huge decline child poverty child tax credit program people need hear midwest south upstate
1.460735916855767e+18,2021-11-16 22:25:56+00:00,['1460735916855767042'],Terrorists continuing to endanger the lives of those who work in the US Capitol. https://t.co/63RXpISmIT,terrorist continuing endanger life work capitol
1.4607351019527455e+18,2021-11-16 22:22:42+00:00,['1460735101952745475'],"The Biggest Thing Happening In The Economy Right Now - (and ⁦@TuckerCarlson⁩ ⁦@IngrahamAngle⁩, this is for you)

“Family poverty has substantially declined thanks to the ⁦@JoeBiden⁩ child tax credit. “ - ⁦@HuffPost⁩ #BuildBackBetter https://t.co/nk1f3RZZpw",biggest thing happening economy right family poverty substantially declined thanks child tax credit
1.4605647346761974e+18,2021-11-16 11:05:43+00:00,['1460564734676197380'],New Collaborative Solar Facility Goes Online | Press Releases |  Created by ⁦@AmherstCollege⁩ ⁦@WilliamsCollege⁩ ⁦@hampshirecolg⁩ ⁦@smithcollege⁩ ⁦@BowdoinCollege⁩  https://t.co/SUhc8BZPhO,new collaborative solar facility online press release created
1.460455901383512e+18,2021-11-16 03:53:15+00:00,['1460455901383512071'],"A Coda, and Many Bravos, for Anthony Tommasini ⁦@TommasiniNYT⁩ | The New York Times Company https://t.co/E5G8Xs04y4",coda many bravo anthony tommasini new york time company
1.4604215780014694e+18,2021-11-16 01:36:52+00:00,['1460421578001469446'],@_nilanjana_ The Deleted Tweet exit aria with the hashtag cabaletta. Can’t wait.,deleted tweet exit aria hashtag cabaletta cant wait
1.4602202645123768e+18,2021-11-15 12:16:55+00:00,['1460220264512376835'],@Molson691 The question should be who is @CNN’s holding company and how will they profit from misinformation?,question holding company profit misinformation
1.459879285536301e+18,2021-11-14 13:41:59+00:00,['1459879285536301067'],"Two giants who may or may not have known each other or even known much of each other. Jawaharlal Nehru and Aaron Copland both born OTD November 14th, eleven years and a couple of worlds apart. https://t.co/z2JltQ8fya",two giant may may known even known much jawaharlal nehru aaron copland born otd november eleven year couple world apart
1.459473822558663e+18,2021-11-13 10:50:49+00:00,['1459473822558662658'],Indian women guarding ‘refugee’ species | Phnom Penh Post https://t.co/LRWa8TTe0A,indian woman guarding refugee specie phnom penh post
1.4592575933025526e+18,2021-11-12 20:31:36+00:00,['1459257593302552592'],@JenniferJJacobs @VP The former President was on record defending the terrorists who were trying to murder his Vice President but I guess the current @VP’s vowels are a priority today.,former president record defending terrorist trying murder vice president guess current vowel priority today
1.4587507077046804e+18,2021-11-11 10:57:25+00:00,['1458750707704680455'],Why the lack of Indian and African faces in portrayals of Dunkirk matters | Sunny Singh | The Guardian https://t.co/BWm5m0l1qj,lack indian african face portrayal dunkirk matter sunny singh guardian
1.4586608238119936e+18,2021-11-11 05:00:15+00:00,['1458660823811993600'],"Review: ⁦@mtilsonthomas⁩ Michael  Tilson Thomas, a Podium Hero, Returns to the ⁦@nyphil⁩ - The New York Times https://t.co/4BWPRVS16S",review michael tilson thomas podium hero return new york time
1.4584873706433536e+18,2021-11-10 17:31:01+00:00,['1458487370643353613'],@funder Someone should bring charges. Being allowed to resign and slink away sends the wrong message. He should be prosecuted for inciting violence. @CREWcrew ?? @RepSwalwell,someone bring charge allowed resign slink away sends wrong message prosecuted inciting violence
1.458205142587781e+18,2021-11-09 22:49:32+00:00,['1458205142587781124'],@tedlieu @CREWcrew @TheJusticeDept,
1.4576754001344102e+18,2021-11-08 11:44:32+00:00,['1457675400134410244'],"Remembering the more than 750,000 people in the US and the 5 million  worldwide who have lost their lives to COVID-19 since the pandemic began. #InMemoriam",remembering people million worldwide lost life covid since pandemic began
1.4576699583814738e+18,2021-11-08 11:22:54+00:00,['1457669958381473792'],Opinion: Battling election misinformation is key for democracy in 2022 - CNN https://t.co/jq9VFLVTQI,opinion battling election misinformation key democracy cnn
1.457512456566329e+18,2021-11-08 00:57:03+00:00,['1457512456566329348'],@ndtv @PrannoyRoyNDTV https://t.co/4TN2tpDiaH,
1.4575122642154455e+18,2021-11-08 00:56:17+00:00,['1457512264215445507'],@PrannoyRoyNDTV @ndtv https://t.co/8GfoFYXTwz,
1.457328597505659e+18,2021-11-07 12:46:28+00:00,['1457328597505658880'],#Beethoven is trending. Hoping he is ok.,trending hoping
1.4573078520208466e+18,2021-11-07 11:24:02+00:00,['1457307852020846597'],"“Biden is on to something important. 
Competence means governance and problem-solving. It means getting things done, so voters can see tangible results. “- CNN https://t.co/oXJVuswsyU",biden something important competence mean governance problemsolving mean getting thing done voter see tangible result cnn
1.457042779033555e+18,2021-11-06 17:50:43+00:00,['1457042779033554950'],"Democrats and others should stop saying “Biden is no FDR.” The fact is he has done more than FDR already in this first year and FDR was not facing an insane GOP morphing gradually into a violent, resurgence of the Confederacy.#BidenDelivers #BIdenRevivesAmerica",democrat others stop saying biden fdr fact done fdr already first year fdr facing insane gop morphing gradually violent resurgence confederacy
1.4569796141909524e+18,2021-11-06 13:39:44+00:00,['1456979614190952454'],Conductor Victor Yampolsky to Retire From Northwestern University After 38 Years https://t.co/8FRSWcE9Lt via @theviolinchannel,conductor victor yampolsky retire northwestern university year via
1.4569176044807332e+18,2021-11-06 09:33:19+00:00,['1456917604480733190'],Singapore: Halt Execution of Man with Intellectual Disability | Human Rights Watch https://t.co/LRAPSjHxDD,singapore halt execution man intellectual disability human right watch
1.4567968153875128e+18,2021-11-06 01:33:21+00:00,['1456796815387512833'],Why is it that it’s always Republicans who get caught perpetrating or trying to perpetrate #VoterFraud? https://t.co/gNvvuApD7c,always republican get caught perpetrating trying perpetrate
1.4567959957155512e+18,2021-11-06 01:30:05+00:00,['1456795995715551233'],Important to be fragile… https://t.co/wnCnYEdTvu,important fragile
1.4565572245375631e+18,2021-11-05 09:41:18+00:00,['1456557224537563137'],"@taliailan @Baerenreiter Quietly open a @Baerenreiter score of K.453, to a place where the thickness of the two halves of score is about the same as what 🐈 is sleeping on and gently slide it under her. Avoid the last movement for the obvious reasons.",quietly open score place thickness two half score sleeping gently slide avoid last movement obvious reason
1.4557322768017162e+18,2021-11-03 03:03:15+00:00,['1455732276801716233'],Michelle Wu ⁦@wutrain⁩ Will Be the Next Mayor of Boston!  https://t.co/7qr1ETAPxc,michelle next mayor boston
1.45559655000508e+18,2021-11-02 18:03:55+00:00,['1455596550005080065'],Gurukula Botanical Sanctuary - And the forest came back! https://t.co/50BRqhH8xK via @YouTube,gurukula botanical sanctuary forest came back via
1.4555960825079562e+18,2021-11-02 18:02:04+00:00,['1455596082507956225'],@EmeraldRobinson Oops!,oops
1.4554835768673444e+18,2021-11-02 10:35:00+00:00,['1455483576867344386'],‘They deserve a place in history’: music teacher makes map of female composers https://t.co/BaMGQHey3V,deserve place history music teacher make map female composer
1.4551252654835016e+18,2021-11-01 10:51:12+00:00,['1455125265483501573'],"“ Her life is dedicated to plant conservation, habitat restoration and education, and she looks at reforestation as a multi-dimensional relationship between plant and animal species, human beings, and the land we all inhabit.” - @KodaiChronicle 

https://t.co/qszUZij3RX",life dedicated plant conservation habitat restoration education look reforestation multidimensional relationship plant animal specie human land inhabit
1.4549180145462026e+18,2021-10-31 21:07:40+00:00,['1454918014546202629'],"After Jan. 6, threats and disinformation take hold across the U.S. - Washington Post https://t.co/AU4arWCPFj",jan threat disinformation take hold across washington post
1.454750746512081e+18,2021-10-31 10:03:00+00:00,['1454750746512080896'],Cop26: Antarctic glacier named Glasgow as ‘stark reminder’ of climate crisis  https://t.co/K1GG3qnQWO,cop antarctic glacier named glasgow stark reminder climate crisis
1.4547479110326477e+18,2021-10-31 09:51:44+00:00,['1454747911032647680'],Failure to stem temperatures 'unimaginable' for Marshall Islands https://t.co/pM5ONySwQA via @BBCNews,failure stem temperature 'unimaginable' marshall island via
1.4547384899715113e+18,2021-10-31 09:14:18+00:00,['1454738489971511297'],COP26: What is the Glasgow climate conference and why is it important? - BBC News https://t.co/6ng2daPcgp,cop glasgow climate conference important bbc news
1.4547382898570732e+18,2021-10-31 09:13:30+00:00,['1454738289857073153'],https://t.co/EVyjVusteD,
1.4545160599235215e+18,2021-10-30 18:30:26+00:00,['1454516059923521539'],"Thrilling to hear this fantastic new Concerto for Soprano Saxophone and Orchestra, at once mystical, moving and expansive, by my friend and distinguished composer Mark Kuss @mkftek1. Written for saxophone giant Branford Marsalis and performed here by him.
https://t.co/U118z86pEp",thrilling hear fantastic new concerto soprano saxophone orchestra mystical moving expansive friend distinguished composer mark kuss written saxophone giant branford marsalis performed
1.4540475661533637e+18,2021-10-29 11:28:49+00:00,['1454047566153363463'],"Happy Birthday dear friend, wise man of Twitter, and fellow traveler from 695003, @sree Sreenivasan! Many more happies to you! https://t.co/oOPUnTPneb",happy birthday dear friend wise man twitter fellow traveler sreenivasan many happies
1.4540318233197527e+18,2021-10-29 10:26:15+00:00,['1454031823319752708'],The everyday ingredient that harms the climate - BBC Future https://t.co/vaztELalVD,everyday ingredient harm climate bbc future
1.4537464117077688e+18,2021-10-28 15:32:08+00:00,['1453746411707768832'],"Proud to be an #NJwala —

New Jersey is the best-run state state in America. https://t.co/jq7dZwZmLl",proud new jersey bestrun state state america
1.4537196271884984e+18,2021-10-28 13:45:42+00:00,['1453719627188498432'],NJ and VA please don’t forget to vote or assume that @GovMurphy and @TerryMcAuliffe will win. That’s how 2016 and the ensuing nightmare happened.,please dont forget vote assume win thats ensuing nightmare happened
1.4537168072740864e+18,2021-10-28 13:34:30+00:00,['1453716807274086400'],"Ambassador - 
She aced independent India's first civil services examination. Then she made history by exposing the misogyny of the country's elite diplomatic corps. https://t.co/Lu2KbkLhlY",ambassador aced independent india's first civil service examination made history exposing misogyny country's elite diplomatic corp
1.4537143164028723e+18,2021-10-28 13:24:36+00:00,['1453714316402872320'],"“Over 50,000 Indians die of snakebite every year. We know how to save these lives—but producing the cure is easier said than done.” - ⁦@FiftyTwoDotIn⁩  https://t.co/XG0RGzdlpc",indian die snakebite every year know save livesbut producing cure easier said done
1.453666541040513e+18,2021-10-28 10:14:45+00:00,['1453666541040513029'],"'He was high-brow, low-brow, every-brow!' – the genius of Leonard Bernstein https://t.co/5DNIkzK8hh",'he highbrow lowbrow everybrow' genius leonard bernstein
