id,created_at,edit_history_tweet_ids,text,clean_text,nouns
1.5642142190877737e+18,2022-08-29 11:31:46+00:00,['1564214219087773701'],Wait until he sees his first energy bill. https://t.co/DTNbe0C3R6,wait until he sees his first energy bill ,wait energy bill
1.5621949638356746e+18,2022-08-23 21:47:58+00:00,['1562194963835674624'],"Absolutely blown away by the new @crashfaceuk tunes, can’t wait to get them in your ears 🖤",absolutely blown away by the new  tunes can’t wait to get them in your ears ,tune wait
1.5580233823435858e+18,2022-08-12 09:31:35+00:00,['1558023382343585792'],You’ll be taxing those profits this time then Liz? 🤔 https://t.co/dMOFqUrjb9,you’ll be taxing those profits this time then liz  ,profit time
1.5522987771883848e+18,2022-07-27 14:24:03+00:00,['1552298777188384769'],"@MusicWeek @ShootMusic Tom Lynam, Warner Music, Dulwich Hamlet FC",  tom lynam warner music dulwich hamlet fc,lynam warner music hamlet
1.5431847687911877e+18,2022-07-02 10:48:14+00:00,['1543184768791187456'],"@LeeBurgessPSR Smashed it mate, thanks for all your hard work! 🖤", smashed it mate thanks for all your hard work ,thanks work
1.5367955493362235e+18,2022-06-14 19:39:45+00:00,['1536795549336223746'],@CorinneDinDin Snap! Gonna be so fresh 💁‍♂️, snap gonna be so fresh ,snap gonna
1.522685399235285e+18,2022-05-06 21:11:03+00:00,['1522685399235284997'],@WesternLadies will you be operating tomorrow - Sat 7th between Brixham and Torquay? 😊, will you be operating tomorrow  sat between brixham and torquay ,tomorrow brixham torquay
1.5067856848367903e+18,2022-03-24 00:11:16+00:00,['1506785684836790281'],Always nice to end the night with a big kiss from @LewisCapaldi 😂,always nice to end the night with a big kiss from  ,night kiss
1.494105186763264e+18,2022-02-17 00:23:30+00:00,['1494105186763264001'],"Virginia Guiffre, paid off by Royal. Jennifer Arcuri, paid off by PM. No wonder women don’t feel safe.",virginia guiffre paid off by royal jennifer arcuri paid off by pm no wonder women don’t feel safe,virginia guiffre royal jennifer arcuri woman
1.4940196016713728e+18,2022-02-16 18:43:25+00:00,['1494019601671372802'],@TheGarageHQ what time are De Staat on tonight please?, what time are de staat on tonight please,time tonight please
1.4790904684368118e+18,2022-01-06 14:00:22+00:00,['1479090468436811784'],The national anthem being ‘Welcome to the Black Parade’ right? https://t.co/Wp4lNM919R,the national anthem being welcome to the black parade right ,anthem parade right
1.4762330817659085e+18,2021-12-29 16:46:08+00:00,['1476233081765908492'],"Absolutely loving the new @delairetheliar EP, but I can’t help thinking that @Ffin_Colley is the voice of Steve Smith singing? https://t.co/dDRN8zOrVB",absolutely loving the new  ep but i can’t help thinking that  is the voice of steve smith singing ,help thinking voice steve smith singing
1.4718984030304174e+18,2021-12-17 17:41:40+00:00,['1471898403030417411'],Who’s taking bets on how many pigs in blankets @LeeBurgessPSR is going to cook this year?,who’s taking bets on how many pigs in blankets  is going to cook this year,blanket year
1.4718211962159227e+18,2021-12-17 12:34:52+00:00,['1471821196215922699'],"The only gig we put on this year and it was an absolute belter! Big thanks to @TFFTSband, was an absolute pleasure, also @bsr_uk @LastHounds we’re ace! The @BostonMusicRoom made us feel so welcome and couldn’t do enough for us, such a great venue and lovely staff. 🖤 https://t.co/UZNsqvLn1z",the only gig we put on this year and it was an absolute belter big thanks to  was an absolute pleasure also   we’re ace the  made us feel so welcome and couldn’t do enough for us such a great venue and lovely staff  ,year belter thanks pleasure venue staff
1.4677993466577715e+18,2021-12-06 10:13:29+00:00,['1467799346657771524'],"Can’t wait to see Colin from @hundredreasons and Mikey from @MalloryKnoxband in a tiny venue, gonna be class! https://t.co/7sn0MpuMmV",can’t wait to see colin from  and mikey from  in a tiny venue gonna be class ,wait colin mikey venue gonna class
1.46679751951881e+18,2021-12-03 15:52:35+00:00,['1466797519518810116'],You know you’ve made it when you get the Facebook msg from Raey telling you to call him.,you know you’ve made it when you get the facebook msg from raey telling you to call him,facebook raey
1.4609359700948173e+18,2021-11-17 11:40:52+00:00,['1460935970094817287'],@TFFTSband Absolutely love ‘Birth of Stars’, absolutely love birth of stars,birth star
1.4588166298911212e+18,2021-11-11 15:19:22+00:00,['1458816629891121154'],"So proud of this release on @SaySomethingRec I remember hearing this album for the first time and being absolutely blown away, it’s been a privilege to release and a pleasure to work with the band and the awesome team behind the scenes. Congratulations @TFFTSband 🤘 https://t.co/fMdAgNtIRm",so proud of this release on  i remember hearing this album for the first time and being absolutely blown away it’s been a privilege to release and a pleasure to work with the band and the awesome team behind the scenes congratulations   ,release album time privilege pleasure band team scene congratulation
1.4530407798243574e+18,2021-10-26 16:48:12+00:00,['1453040779824357378'],"Good news everyone, circle line still smells of fart 😩",good news everyone circle line still smells of fart ,news everyone circle line fart
1.4514756250222674e+18,2021-10-22 09:08:50+00:00,['1451475625022267393'],So much new music today! New @DONBROCO @BiffyClyro @WOOZEBAND @dthblms @Slash https://t.co/8HY4S2nN9v,so much new music today new      ,music today
1.4476622841180488e+18,2021-10-11 20:35:59+00:00,['1447662284118048769'],"@TinieTinah @kierondonoghue @PlaylistAlert @Leopoldobrien Currently pending approval, can’t wait to try! 👍",    currently pending approval can’t wait to try ,approval wait
1.4461443597920543e+18,2021-10-07 16:04:18+00:00,['1446144359792054279'],"@JoeAppleford @KerrangMagazine Excellent tune, well done young man! 👏",  excellent tune well done young man ,excellent tune
1.4444260991408005e+18,2021-10-02 22:16:32+00:00,['1444426099140800528'],"@tompullenphoto Also, LNER doesn’t go to Manchester. Sorry, I’m a train geek 🤓", also lner doesn’t go to manchester sorry i’m a train geek ,train geek
1.443966557365969e+18,2021-10-01 15:50:29+00:00,['1443966557365968906'],"Very proud to be a part of @TFFTSband debut album ‘Decade’ which is out today on @SaySomethingRec Stream @ https://t.co/HyaDCvu6Vq Thanks to @voltadave , Colin, Lee, @jason_bowld, Oly, @Leopoldobrien, @jademperry, James @SaviourMGMT @plectrummsocial 🖤 https://t.co/2lVi20SbCt",very proud to be a part of  debut album decade which is out today on  stream   thanks to   colin lee  oly   james    ,part debut album decade today stream thanks colin
1.4425176664475894e+18,2021-09-27 15:53:07+00:00,['1442517666447589377'],Awesome show from @bmthofficial and caught up with the loveliest people. LIVE MUSIC IS BACK!! 🤘 https://t.co/Qfw4DMYhSe,awesome show from  and caught up with the loveliest people live music is back  ,show people music
1.4409924242019615e+18,2021-09-23 10:52:20+00:00,['1440992424201961477'],"@jonmahonn you should check out @TFFTSband featuring Colin from Hundred Reasons and Jase from Bullet For My Valentine. New bands, check out @crashfaceuk huge tunes! 🖤", you should check out  featuring colin from hundred reasons and jase from bullet for my valentine new bands check out  huge tunes ,colin reason jase bullet band tune
1.4409876977624187e+18,2021-09-23 10:33:34+00:00,['1440987697762418693'],@jonmahonn has to be the rock n roll anthem that is ‘You Shook Me All Night Long’ 🍻🤘, has to be the rock n roll anthem that is you shook me all night long ,rock anthem night
1.4406119818037453e+18,2021-09-22 09:40:36+00:00,['1440611981803745296'],@devilmatt Gotta get @TFFTSband with Colin from Hundred Reasons 🤘, gotta get  with colin from hundred reasons ,gotta colin reason
1.4389374466502042e+18,2021-09-17 18:46:36+00:00,['1438937446650204163'],Happy 10 Years of Black Junk to @exit_int_music 🖤 https://t.co/9zh5iIvSlb,happy years of black junk to   ,year junk
1.438877945687429e+18,2021-09-17 14:50:09+00:00,['1438877945687429126'],10 years since we lived like this every night 💔 Pegasus Bridge - Heartstrings (Live in Manchester) - LAB Records https://t.co/Egy7h7VBqG,years since we lived like this every night  pegasus bridge  heartstrings live in manchester  lab records ,year night pegasus bridge heartstrings manchester record
1.435961703070638e+18,2021-09-09 13:42:03+00:00,['1435961703070638083'],Hello Photographer friends!! Looking for someone who is either available or already at @BurnItDownFest tomorrow for @crashfaceuk - set time 5.30. Gimme a shout if you’re about?! 🖤,hello photographer friends looking for someone who is either available or already at  tomorrow for   set time gimme a shout if you’re about ,hello photographer friend someone tomorrow time shout
1.4355543613132186e+18,2021-09-08 10:43:25+00:00,['1435554361313218561'],"This band continue to blow me away, this version of latest single ‘Loading Screen Infinity’ is stunning! 🖤 https://t.co/u00tLAmvVd",this band continue to blow me away this version of latest single loading screen infinity is stunning  ,band version loading screen infinity
1.429025442909016e+18,2021-08-21 10:19:50+00:00,['1429025442909016065'],How big is ‘Sabotage’ on the new @PresstoMECO album?! 🤘 Incredible record lads!,how big is sabotage on the new  album  incredible record lads,sabotage album record
1.4286719129311764e+18,2021-08-20 10:55:02+00:00,['1428671912931176456'],@CrossCountryUK So you don’t want people to stand for catering for a couple of minutes but expect people to stand for the duration of their journey while the seats go unoccupied? 🤔, so you don’t want people to stand for catering for a couple of minutes but expect people to stand for the duration of their journey while the seats go unoccupied ,people couple minute people duration journey seat
1.42867090330343e+18,2021-08-20 10:51:01+00:00,['1428670903303430146'],@CrossCountryUK No queue from the catering area and it was your team member in Coach F that insisted we couldn’t sit there. No common sense, no queue from the catering area and it was your team member in coach f that insisted we couldn’t sit there no common sense,queue area team member coach sense
1.4286690673979433e+18,2021-08-20 10:43:43+00:00,['1428669067397943299'],"@CrossCountryUK awful situation on the 11.36 from York to Banbury, forcing elderly to stand while 10 seats available at the back of the train - no explanation.", awful situation on the from york to banbury forcing elderly to stand while seats available at the back of the train  no explanation,situation york seat back train explanation
1.423959725822124e+18,2021-08-07 10:50:29+00:00,['1423959725822124032'],@crashfaceuk What a night! Congratulations lads 🖤, what a night congratulations lads ,night congratulation
1.4228814922886144e+18,2021-08-04 11:25:58+00:00,['1422881492288614401'],"Huge album from @TFFTSband out on @SaySomethingRec 01.10.21!! Been an absolute pleasure to work with these guys, can’t wait to get my hands on a copy of the vinyl 😍 https://t.co/2gLzIzVmEn",huge album from  out on   been an absolute pleasure to work with these guys can’t wait to get my hands on a copy of the vinyl  ,album pleasure wait hand copy vinyl
1.422570719880401e+18,2021-08-03 14:51:04+00:00,['1422570719880400906'],"@joshmeatsix Have you heard @crashfaceuk?! Also, if you like Hundred Reason, Colin’s for a new project @TFFTSband 🤘", have you heard  also if you like hundred reason colin’s for a new project  ,reason project
1.422245420856656e+18,2021-08-02 17:18:27+00:00,['1422245420856655873'],Absolutely disgusting behaviour from @UPS / @UPS_UK Been waiting on a duty refund - that I was charged twice for - since the start of June. Been told 4 times now it’s being refunded. Awful customer service. #ups #customerexperience,absolutely disgusting behaviour from    been waiting on a duty refund  that i was charged twice for  since the start of june been told times now it’s being refunded awful customer service  ,behaviour duty refund start june time customer service
1.4203501911740416e+18,2021-07-28 11:47:29+00:00,['1420350191174041606'],"Proud to be a part of this, celebrating 10 years of ‘Black Junk’ by @exit_int_music 🖤 https://t.co/VMgDKIxkNW",proud to be a part of this celebrating years of black junk by   ,proud part year junk
1.4088773439433157e+18,2021-06-26 19:58:29+00:00,['1408877343943315459'],"What I find most unsettling about Hancock’s resignation is the amount of people who are more upset/angry at the person/person’s who leaked the footage than at the weasel for his affair, ineptness and general self serving career as health secretary. 🤯",what i find most unsettling about hancock’s resignation is the amount of people who are more upsetangry at the personpersons who leaked the footage than at the weasel for his affair ineptness and general self serving career as health secretary ,resignation amount people personpersons footage weasel affair ineptness self career health secretary
1.4074585585103544e+18,2021-06-22 22:00:44+00:00,['1407458558510354433'],"@h_bun09 Dude, stay calm, don’t over think it, you’re great, you can do this. I believe in you!", dude stay calm don’t over think it you’re great you can do this i believe in you,dude stay
1.407306075469226e+18,2021-06-22 11:54:49+00:00,['1407306075469225986'],"Go get this album, it’s fucking ace! For the vinyl heads, @BanquetRecords have still got some of the indie exclusives. Just go buy stream this album now! 🖤 https://t.co/KvdWCpd0Xp",go get this album it’s fucking ace for the vinyl heads  have still got some of the indie exclusives just go buy stream this album now  ,album vinyl head exclusive stream album
1.4059112297350513e+18,2021-06-18 15:32:12+00:00,['1405911229735051265'],"This incredible record is out today, get it in your ears! https://t.co/D2C2W559nc",this incredible record is out today get it in your ears ,record today
1.4058983513929974e+18,2021-06-18 14:41:01+00:00,['1405898351392997377'],So happy for everyone attending @DownloadFest Pilot this weekend! Congratulations to @Angry_Copping @kamcore and the many others at @LiveNationUK for making it happen! 🤘 https://t.co/5h9OUvdzYT,so happy for everyone attending  pilot this weekend congratulations to   and the many others at  for making it happen  ,everyone pilot weekend congratulation others
1.4018555357214638e+18,2021-06-07 10:56:19+00:00,['1401855535721463809'],"@devilmatt Hundred Reasons, Ideas Above Our Station", hundred reasons ideas above our station,reason idea station
1.398246997019218e+18,2021-05-28 11:57:16+00:00,['1398246997019217927'],@kamcore Incredible! Congratulations in pulling this together mate 🤘, incredible congratulations in pulling this together mate ,congratulation together mate
1.3867089445470904e+18,2021-04-26 15:49:10+00:00,['1386708944547090442'],Should have done a UK Acts special option for this year! Gutted 😞 https://t.co/9bhm60wq8M,should have done a uk acts special option for this year gutted  ,option year
1.385877401222226e+18,2021-04-24 08:44:55+00:00,['1385877401222225923'],Paying footballers 0.007p per touch https://t.co/duwVYTzuua,paying footballers p per touch ,footballer touch
1.380564245012738e+18,2021-04-09 16:52:20+00:00,['1380564245012738057'],@MPStevenson You a time traveller?, you a time traveller,time traveller
1.3768173328326287e+18,2021-03-30 08:43:26+00:00,['1376817332832628742'],Incredible response to @TFFTSband debut single 🤘 https://t.co/z15qfOAYCP,incredible response to  debut single  ,response debut
1.3754799830832292e+18,2021-03-26 16:09:17+00:00,['1375479983083229186'],Thanks for the support @tasmintaylor_dj https://t.co/NZdISNqNfv,thanks for the support  ,thanks support
1.3750666156336046e+18,2021-03-25 12:46:43+00:00,['1375066615633604610'],"@bengibsonphoto @juliettecarton The Brockley Rock, outstanding chippy! 👌",  the brockley rock outstanding chippy ,brockley rock
1.3750627032077765e+18,2021-03-25 12:31:10+00:00,['1375062703207776259'],"Huge track, give it a spin! https://t.co/nwBgp8dsoQ",huge track give it a spin ,track spin
1.3722352919441736e+18,2021-03-17 17:16:03+00:00,['1372235291944173573'],Last week everyone!!! https://t.co/QcytvkPgJx,last week everyone ,week everyone
1.3663789068493332e+18,2021-03-01 13:24:52+00:00,['1366378906849333250'],You’re next @BorisJohnson Sarkozy: Former French president sentenced to jail for corruption https://t.co/mZyQ8xwo8U,you’re next  sarkozy former french president sentenced to jail for corruption ,sarkozy president jail corruption
1.3591810534124012e+18,2021-02-09 16:43:10+00:00,['1359181053412401156'],This week at work... Been a pleasure working with the team on this 🖤 https://t.co/QWHbo6LcEq,this week at work been a pleasure working with the team on this  ,week work pleasure team
1.3569377824684892e+18,2021-02-03 12:09:12+00:00,['1356937782468489216'],Stop clapping @BorisJohnson and do something!!,stop clapping  and do something,clapping something
1.3552795805888922e+18,2021-01-29 22:20:06+00:00,['1355279580588892161'],"Fantastic to see @youmeatsix @bmthofficial smash no.1’s this year already! To rock artists, your fanbase is key! Rock fans are the most loyal fans and will support you every step, they make your career! They also buy product, so 250 vinyls = the same income as 1 million steams",fantastic to see   smash nos this year already to rock artists your fanbase is key rock fans are the most loyal fans and will support you every step they make your career they also buy product so vinyls  the same income as million steams,smash year artist fanbase rock step career product income steam
1.33998598114816e+18,2020-12-18 17:28:48+00:00,['1339985981148160003'],Good for @RitaOra stepping in at short notice 😂 https://t.co/iyzpT3erpj,good for  stepping in at short notice  ,stepping notice
1.3396105108708516e+18,2020-12-17 16:36:49+00:00,['1339610510870851585'],And winner of ‘Cunt of the Year’ goes to.... https://t.co/vEeIavuQ3P,and winner of cunt of the year goes to ,winner cunt year
1.3331012441733898e+18,2020-11-29 17:31:19+00:00,['1333101244173389825'],@Jshilst Does a superpower include being able to air drum to the album in its entirety? 🤘 https://t.co/Oy0SAYp1Nr, does a superpower include being able to air drum to the album in its entirety  ,superpower drum album entirety
1.3322985752089805e+18,2020-11-27 12:21:47+00:00,['1332298575208980480'],O yeah!! @Vukoviband debut on vinyl arrived today 🤘 Great job @Jshilst @HamishVUKOVI @LABRecords 💛 https://t.co/jBx81To8kJ,o yeah  debut on vinyl arrived today  great job     ,yeah debut vinyl today
1.3279934612540826e+18,2020-11-15 15:14:48+00:00,['1327993461254082560'],Having a trip down nostalgia lane and picking up some CD’s of awesome bands/albums that aren’t on streamers. Looks like the dash of the old Keiko van 😂 https://t.co/eb9flMeozV,having a trip down nostalgia lane and picking up some cd’s of awesome bandsalbums that aren’t on streamers looks like the dash of the old keiko van  ,trip lane bandsalbums streamer look dash keiko
1.3265042273053532e+18,2020-11-11 12:37:07+00:00,['1326504227305353217'],"@LABRecords Got mine! Fantastic album, up there with the PB one I reckon 😜", got mine fantastic album up there with the pb one i reckon ,album reckon
1.3112533642949427e+18,2020-09-30 10:35:38+00:00,['1311253364294942721'],Big tune dropped today from the @novatines lads! 💛 https://t.co/eWNW7bL0Ka,big tune dropped today from the  lads  ,tune today
1.3069968863149015e+18,2020-09-18 16:41:55+00:00,['1306996886314901505'],Like that the start of the new @deftones track sounds like something out of Stranger Things,like that the start of the new  track sounds like something out of stranger things,start track sound something stranger thing
1.306995437254185e+18,2020-09-18 16:36:09+00:00,['1306995437254184962'],Feels like a lifetime ago 🖤 https://t.co/Xa8o2g9d4s,feels like a lifetime ago  ,feel lifetime
1.3058619569104118e+18,2020-09-15 13:32:06+00:00,['1305861956910411776'],@Hermesparcels terrible customer service. No update to an order that was supposed to be delivered on Sunday. Phoned and used App with no support just “we will get it delivered ASAP”. Where is my package?!, terrible customer service no update to an order that was supposed to be delivered on sunday phoned and used app with no support just we will get it delivered asap where is my package,customer service update order sunday support asap package
1.30220340308761e+18,2020-09-05 11:14:19+00:00,['1302203403087609858'],@h_bun01 Happy Birthday mayteee!!!! Miss you long time, happy birthday mayteee miss you long time,birthday miss time
1.3015527423941018e+18,2020-09-03 16:08:50+00:00,['1301552742394101765'],Worst England side ever https://t.co/vqqffGZAcd,worst england side ever ,england side
1.3007659330872156e+18,2020-09-01 12:02:20+00:00,['1300765933087215616'],Hi @Travel_Up Still waiting for a refund for flights on @VirginAtlantic London - LA RTN from 1st May. It’s been 4 months and still no refund! You keep saying payment is being processed but no confirmation. #airlines #refunds #COVID19 #CustomerExperience,hi  still waiting for a refund for flights on  london  la rtn from may it’s been months and still no refund you keep saying payment is being processed but no confirmation    ,refund flight london month refund payment confirmation
1.2962420972012626e+18,2020-08-20 00:26:13+00:00,['1296242097201262598'],A beautifully poignant interview with Simon from @BiffyClyro for @NME https://t.co/frOMTgBlYN,a beautifully poignant interview with simon from  for  ,interview simon
1.2960325287977083e+18,2020-08-19 10:33:28+00:00,['1296032528797708288'],"Hancock doing his job and removing any potential treat of how badly the Tories handled Covid-19 by axing PHE, disgraceful! https://t.co/lnteN9ia3K",hancock doing his job and removing any potential treat of how badly the tories handled covid by axing phe disgraceful ,hancock treat tory covid
1.2947551960279695e+18,2020-08-15 21:57:48+00:00,['1294755196027969537'],So @BiffyClyro just set the bar for live streaming shows 🤘 https://t.co/qSYFY1Mv1z,so  just set the bar for live streaming shows  ,streaming show
1.289618316286288e+18,2020-08-01 17:45:41+00:00,['1289618316286287872'],Liking Arsenals metal font on the shirts 🤘 #facup #FACupFinal #ArsvChe,liking arsenals metal font on the shirts    ,arsenal font shirt
1.2790275148248965e+18,2020-07-03 12:21:37+00:00,['1279027514824896515'],"Man who does nothing but gesture, doesn’t believe in gestures https://t.co/2MPohA9tLd",man who does nothing but gesture doesn’t believe in gestures ,nothing gesture gesture
1.2717875105790405e+18,2020-06-13 12:52:25+00:00,['1271787510579040257'],@CroftonParkTav Can’t wait for a Sunday Lunch! When are you opening?, can’t wait for a sunday lunch when are you opening,wait lunch
1.2635951700978196e+18,2020-05-21 22:18:59+00:00,['1263595170097819649'],@mattwalker57 Thought you’d go for Ciffy Clyro, thought you’d go for ciffy clyro,ciffy clyro
1.2635564013072343e+18,2020-05-21 19:44:56+00:00,['1263556401307234305'],"Loving having a guitar again, been jamming along to @Aerosmith while sippin a G&amp;T with skull ice cubes, so extra 💁‍♂️",loving having a guitar again been jamming along to  while sippin a gampt with skull ice cubes so extra ,guitar sippin gampt cube
1.2621542141486203e+18,2020-05-17 22:53:09+00:00,['1262154214148620291'],"Watching ‘Trial by Media’ and just heard the best giggidy, “He needed dick but resented dick at the same time” 😂",watching trial by media and just heard the best giggidy he needed dick but resented dick at the same time ,trial medium giggidy dick dick time
1.2410575189456978e+18,2020-03-20 17:42:24+00:00,['1241057518945697794'],“Deferred” being the key work of today’s announcements,deferred being the key work of today’s announcements,work announcement
1.2406810251241226e+18,2020-03-19 16:46:21+00:00,['1240681025124122625'],Live Stream review of @sickjoyband 🖤 https://t.co/fCb2tDSsas,live stream review of   ,stream review
1.2402640270010286e+18,2020-03-18 13:09:21+00:00,['1240264027001028609'],Tune in tonight! https://t.co/ZsZS7KKJML,tune in tonight ,tune tonight
1.239623579681067e+18,2020-03-16 18:44:27+00:00,['1239623579681067008'],"@alexbakerman Notice how they used the term “avoid” rather than closing venues, pubs, theatres...etc distancing themselves from any responsibility to support/help them during these terrible times.", notice how they used the term avoid rather than closing venues pubs theatresetc distancing themselves from any responsibility to supporthelp them during these terrible times,notice term venue responsibility time
1.2381834391799603e+18,2020-03-12 19:21:50+00:00,['1238183439179960321'],"Off to @TheUnderworld to see @employedtoserve tonight. After today, it is exactly what I need 🤘",off to  to see  tonight after today it is exactly what i need ,tonight today
1.2370234914315018e+18,2020-03-09 14:32:37+00:00,['1237023491431501825'],Loving this record! Give it a spin and support new UK Alt rock cuz it’s fucking ace. https://t.co/s6LKSYhZE0,loving this record give it a spin and support new uk alt rock cuz it’s fucking ace ,record spin rock
1.236962277775102e+18,2020-03-09 10:29:23+00:00,['1236962277775101952'],First band to cover ‘My Sharona’ and change the lyrics to “My Corona” wins #COVID2019,first band to cover my sharona and change the lyrics to my corona wins ,band lyric corona
