id,created_at,edit_history_tweet_ids,text,clean_text,nouns
1.1076850758591898e+18,2019-03-18 16:47:56+00:00,['1107685075859189760'],"@TheAlanWells I agree with you, but you’ll find that the fees for UK artists - especially smaller artists - are better because the local councils support promoters with funding when they bring in artists from the UK, some even return with a profit!", i agree with you but you’ll find that the fees for uk artists  especially smaller artists  are better because the local councils support promoters with funding when they bring in artists from the uk some even return with a profit,artist artist council support promoter funding artist profit
1.1073958305233142e+18,2019-03-17 21:38:35+00:00,['1107395830523314181'],Remember when people liked Staind? Dark times,remember when people liked staind dark times,people time
1.104724073429586e+18,2019-03-10 12:41:58+00:00,['1104724073429585925'],@KirstieHopper @jackwrogerss An announcement about an announcement about an announcement,  an announcement about an announcement about an announcement,announcement announcement announcement
1.1045094157833216e+18,2019-03-09 22:29:00+00:00,['1104509415783321602'],Only 5 episodes into After Life and I’m up and down like an emotional yo-yo. 👏 @rickygervais,only episodes into after life and i’m up and down like an emotional yoyo  ,life yoyo
1.1040775690229678e+18,2019-03-08 17:52:59+00:00,['1104077569022967808'],"@MillieAkeroyd I’m so sorry to hear about your situation. Remember, you’re allowed to take a time out, take some time for yourself and enjoy it. This will give you chance to rejuvenate yourself and realise where and what you want to do. Here for a chat anytime 😊", i’m so sorry to hear about your situation remember you’re allowed to take a time out take some time for yourself and enjoy it this will give you chance to rejuvenate yourself and realise where and what you want to do here for a chat anytime ,situation time time chance chat anytime
1.1025462176728636e+18,2019-03-04 12:27:57+00:00,['1102546217672863744'],The @sickjoyband lads are back in London with @bigspringmusic @heavyheartmusic @moralebanduk at @CamdenAssembly next month! https://t.co/yn02KW2VjV,the  lads are back in london with    at  next month ,london month
1.1008106885518828e+18,2019-02-27 17:31:34+00:00,['1100810688551882752'],"Music Industry friends, have any of you started putting Brexit clauses in contracts?? Getting a few mixed responses so far, especially cuz nobody knows what’s going to happen at the end of March, but just wanted to see what people are thinking. #brexit #musicindustry #hivemind",music industry friends have any of you started putting brexit clauses in contracts getting a few mixed responses so far especially cuz nobody knows what’s going to happen at the end of march but just wanted to see what people are thinking   ,music industry friend brexit clause contract response nobody march people
1.1007076165845976e+18,2019-02-27 10:42:00+00:00,['1100707616584597504'],"And can you believe, these 5 young lads from Redditch went on to become The Backstreet Boys. https://t.co/O8tviQQrqr",and can you believe these young lads from redditch went on to become the backstreet boys ,redditch backstreet
1.100526912017965e+18,2019-02-26 22:43:57+00:00,['1100526912017965056'],Can’t wait to hear @wearelazybones_ tonight on @jackxsaunders show!! 💛 https://t.co/o08sqJs17Y,can’t wait to hear  tonight on  show  ,wait tonight
1.1000493983509094e+18,2019-02-25 15:06:29+00:00,['1100049398350909445'],Preparing myself for a pop punk boyband https://t.co/hSkFio5XVK,preparing myself for a pop punk boyband ,punk boyband
1.099082546577584e+18,2019-02-22 23:04:33+00:00,['1099082546577584128'],"I know I have a lot of Music Industry people following me on here. This isn’t the first time this has happened to @KirstieHopper and it is totally ridiculous. If you have any work for her or want to reach out, show Kirstie that this industry is better than this. https://t.co/Vwd3q9aFez",i know i have a lot of music industry people following me on here this isn’t the first time this has happened to  and it is totally ridiculous if you have any work for her or want to reach out show kirstie that this industry is better than this ,music industry people time work show industry
1.097932447046615e+18,2019-02-19 18:54:28+00:00,['1097932447046615041'],"@KirstieHopper @pinsandknuckles Shouldn’t even be an option, they should take responsibility",  shouldn’t even be an option they should take responsibility,option responsibility
1.0979262068283023e+18,2019-02-19 18:29:40+00:00,['1097926206828302336'],.@pinsandknuckles stop putting your T-shirt’s in individual plastic bags or I’ll blame you for death or every sea dwelling mammal, stop putting your tshirts in individual plastic bags or i’ll blame you for death or every sea dwelling mammal,tshirts plastic blame death
1.097533582812332e+18,2019-02-18 16:29:31+00:00,['1097533582812332033'],"@anthony_ntl I ordered a ‘duck in a suit’ once and got a yellow rubber duck with a suit drawn on, it was very sweet.", i ordered a duck in a suit once and got a yellow rubber duck with a suit drawn on it was very sweet,duck suit rubber duck suit drawn
1.0974392828207596e+18,2019-02-18 10:14:49+00:00,['1097439282820759552'],See @sickjoyband from Sunday on tour with @DemobHappy 🙌 https://t.co/otWgXcapU6,see  from sunday on tour with   ,sunday tour
1.096390127310508e+18,2019-02-15 12:45:50+00:00,['1096390127310508032'],Big thanks to @Martian_PR for all their hard work on this campaign! https://t.co/uBq1FcsH1e,big thanks to  for all their hard work on this campaign ,thanks work campaign
1.0959902698104832e+18,2019-02-14 10:16:57+00:00,['1095990269810483204'],More radio waves for @sickjoyband https://t.co/3sk7hrHdHB,more radio waves for  ,radio wave
1.0954894864342548e+18,2019-02-13 01:07:01+00:00,['1095489486434254849'],@Alison_Lamb Salt in the wound 🤯🔫, salt in the wound ,salt wound
1.091405468159959e+18,2019-02-01 18:38:35+00:00,['1091405468159959041'],Maybe they should break up their assets and start their own Pledge Campaign? 😜 https://t.co/XE3GUMAjms,maybe they should break up their assets and start their own pledge campaign  ,asset pledge campaign
1.0913165148741468e+18,2019-02-01 12:45:07+00:00,['1091316514874146817'],"I’ve heard that R Kelly is planning on dropping a surprise album, if this is a plot to manipulate the resent “press” he’s been getting, his team deserve to be lined up and shot.",i’ve heard that r kelly is planning on dropping a surprise album if this is a plot to manipulate the resent press he’s been getting his team deserve to be lined up and shot,heard surprise album plot resent press team deserve shot
1.0913078288815718e+18,2019-02-01 12:10:36+00:00,['1091307828881571841'],On my way to @BIMMBrighton to take part in a panel/Q&amp;A on freelancing in the music industry. Questioning how many Fyre Festival quotes I can get in 🤔,on my way to  to take part in a panelqampa on freelancing in the music industry questioning how many fyre festival quotes i can get in ,part panelqampa music industry festival quote
