id,created_at,edit_history_tweet_ids,text,clean_text,nouns
1.235957072711299e+18,2020-03-06 15:55:03+00:00,['1235957072711299072'],Mum Stevenson getting the old photos out 😂 https://t.co/BvgIZMUZaf,mum stevenson getting the old photos out  ,stevenson photo
1.234909083834159e+18,2020-03-03 18:30:43+00:00,['1234909083834159105'],@TfL sort the circle line out will ya!, sort the circle line out will ya,sort circle line
1.2333571456404398e+18,2020-02-28 11:43:52+00:00,['1233357145640439810'],Great night with @vexredband at @exchangebristol. Managed to pop into @specialistsub to pick up a vinyl too 🖤 #supportyourlocalrecordshop #supportyourlocalvenue https://t.co/rQupX7hIKM,great night with  at  managed to pop into  to pick up a vinyl too    ,night vinyl
1.2315320408451727e+18,2020-02-23 10:51:33+00:00,['1231532040845172736'],"Either, someone is having a shave in the cubical at a service station or.... https://t.co/bBXa8rppw1",either someone is having a shave in the cubical at a service station or ,someone shave cubical service station
1.2315052626972058e+18,2020-02-23 09:05:09+00:00,['1231505262697205760'],"Heard the words every artist manager dreams of hearing from their artist this morning, “you were right”",heard the words every artist manager dreams of hearing from their artist this morning you were right,word artist manager dream artist morning
1.2308538095530025e+18,2020-02-21 13:56:31+00:00,['1230853809553002496'],"Good friends doing good things, these guys are going places 🖤 https://t.co/q65vq6fr3a",good friends doing good things these guys are going places  ,friend thing place
1.2305646803739443e+18,2020-02-20 18:47:37+00:00,['1230564680373944323'],One thing I love about being in Leeds is how friendly people are.,one thing i love about being in leeds is how friendly people are,thing leeds people
1.228258589376209e+18,2020-02-14 10:04:02+00:00,['1228258589376208901'],Awesome night seeing @sickjoyband rip up @o2sbe last night! Big thanks to @itbagency @alandayrocks the Kili Team 🖤 https://t.co/Iyi39J2DwE,awesome night seeing  rip up  last night big thanks to   the kili team  ,night night thanks kili team
1.2271705104396206e+18,2020-02-11 10:00:24+00:00,['1227170510439620608'],Poor lad trying to defend himself after this out-rage against the machine-ous comment 😂 https://t.co/7pKT24PsAN,poor lad trying to defend himself after this outrage against the machineous comment  ,outrage comment
1.226108059577135e+18,2020-02-08 11:38:36+00:00,['1226108059577135110'],Bristol tonight with @Leopoldobrien watching @sickjoyband at @theklabristol and then @novatines at @LouisianaBris 🖤 https://t.co/XTW3V5JLoQ,bristol tonight with  watching  at  and then  at   ,bristol tonight
1.2259033217702298e+18,2020-02-07 22:05:02+00:00,['1225903321770229760'],Check out @novatines hitting the @AppleMusic Rock Charts top 40!! https://t.co/7H6BOKAf1f,check out  hitting the  rock charts top ,rock chart
1.225736638971728e+18,2020-02-07 11:02:42+00:00,['1225736638971727875'],Fantastic release from a great bunch of lads! 🖤 https://t.co/tXdvZg1ea9,fantastic release from a great bunch of lads  ,release bunch
1.2255380770384325e+18,2020-02-06 21:53:41+00:00,['1225538077038432257'],"@hotmilkhan Well done tonight mate, yous were ace!", well done tonight mate yous were ace,tonight mate
1.2255321587831276e+18,2020-02-06 21:30:10+00:00,['1225532158783127552'],@MPStevenson Same pose you did driving Betty 💁‍♂️, same pose you did driving betty ,pose betty
1.2231788536879268e+18,2020-01-31 09:38:58+00:00,['1223178853687926784'],Love the smell of the circle line in the morning ☹️,love the smell of the circle line in the morning ,smell circle line morning
1.22173047463424e+18,2020-01-27 09:43:38+00:00,['1221730474634240000'],Who am I gonna see at DryJanFest this weekend?? https://t.co/7TJFXyoVlg,who am i gonna see at dryjanfest this weekend ,gonna weekend
1.2207982481825833e+18,2020-01-24 19:59:18+00:00,['1220798248182583301'],Not enough people talking about this. Could really damage the music industry freelancers. #freelancers https://t.co/gBWicWGM3D,not enough people talking about this could really damage the music industry freelancers  ,people music industry freelancer
1.219377718766293e+18,2020-01-20 21:54:37+00:00,['1219377718766293001'],@HickieMouse Amazing! Dunno what’s gonna top it this year. Cats 2 maybe?, amazing dunno what’s gonna top it this year cats maybe,dunno gonna year
1.214526377086587e+18,2020-01-07 12:37:07+00:00,['1214526377086586880'],"Nearly put on a DM, Converse combo this morning. Hello 2020!",nearly put on a dm converse combo this morning hello,converse combo morning hello
1.2011569853050962e+18,2019-12-01 15:11:56+00:00,['1201156985305096192'],“I touched it once then I touched it a second time” Delirium by Motion City Soundtrack https://t.co/b5dWHqhmKe,i touched it once then i touched it a second time delirium by motion city soundtrack ,time delirium motion city soundtrack
1.1975457769117243e+18,2019-11-21 16:02:17+00:00,['1197545776911724545'],Congratulations @ilovealcopop @ditzband ❤️ Great to see our @wearelazybones_ joining the party 💛 https://t.co/ZfoCGG776b,congratulations    great to see our  joining the party  ,congratulation party
1.197170565775274e+18,2019-11-20 15:11:19+00:00,['1197170565775273984'],Tottenham have announced new manager is @Leopoldobrien https://t.co/3zv9DyUx1D,tottenham have announced new manager is  ,tottenham manager
1.1963647209467945e+18,2019-11-18 09:49:11+00:00,['1196364720946794496'],"Tired to use my work pass to get on the tube this morning, happy Monday!",tired to use my work pass to get on the tube this morning happy monday,work tube morning monday
1.1953477631790162e+18,2019-11-15 14:28:09+00:00,['1195347763179016192'],"On route to Bath to catch up with @jademperry and @novatines 🍻 Need some bar recommendations. Internet, do your thing?! #bars #bathspa #drinks #recommend",on route to bath to catch up with  and   need some bar recommendations internet do your thing    ,route recommendation thing
1.1860027206348718e+18,2019-10-20 19:34:18+00:00,['1186002720634871809'],#chandosquiz camels stay hydrated by recycling the co2 in their breath, camels stay hydrated by recycling the co in their breath,camel breath
1.1819455794689884e+18,2019-10-09 14:52:40+00:00,['1181945579468988427'],Dream team! 🖤 https://t.co/JLE24Y7jrZ,dream team  ,dream team
1.180121191736107e+18,2019-10-04 14:03:12+00:00,['1180121191736107008'],@TaniaKawalit @TinieTinah @JordanStatham29 @Leopoldobrien Rock n Roll!!,    rock n roll,rock roll
1.179003036385104e+18,2019-10-01 12:00:03+00:00,['1179003036385103872'],"The new @vexredband EP lands Friday! Been such a pleasure working on this release, it’s an absolutely fantastic record and one I’m immensely proud to be a part of. Onwards and upwards @SaySomethingRec @Leopoldobrien 🖤 https://t.co/S3Tm4juql9",the new  ep lands friday been such a pleasure working on this release it’s an absolutely fantastic record and one i’m immensely proud to be a part of onwards and upwards    ,land pleasure release record part onwards upwards
1.1738995419401994e+18,2019-09-17 10:00:35+00:00,['1173899541940199424'],Very happy that this vinyl landed on my desk today 😍 https://t.co/uwDiybM5ft,very happy that this vinyl landed on my desk today  ,vinyl desk today
1.1714640692927775e+18,2019-09-10 16:42:53+00:00,['1171464069292777474'],"Lovely review of the new @sickjoyband release, out Friday! https://t.co/BqO9yLREHa",lovely review of the new  release out friday ,review release
1.1692608198986752e+18,2019-09-04 14:47:57+00:00,['1169260819898675200'],"So close to selling out, final tickets on general sale! https://t.co/r9BN3eaQy7",so close to selling out final tickets on general sale ,ticket sale
1.1672372527638487e+18,2019-08-30 00:47:01+00:00,['1167237252763848709'],"What is it about London people that listen to phones on full sound on public transport. I don’t wanna hear your shitty tunes mate, fuck off and get some headphones!",what is it about london people that listen to phones on full sound on public transport i don’t wanna hear your shitty tunes mate fuck off and get some headphones,people phone sound transport tune headphone
1.1664438783140618e+18,2019-08-27 20:14:26+00:00,['1166443878314061830'],"It’s ok, he needs to go top up petrol. Can’t wait to get my cold meal 👎 https://t.co/JIJXiLUWUf",it’s ok he needs to go top up petrol can’t wait to get my cold meal  ,petrol wait meal
1.1652627619008758e+18,2019-08-24 14:01:06+00:00,['1165262761900875778'],"Set up a label, it’ll be fun! Just spent over £100 in the post office, happy bank holiday! Bring on @OfficialRandL tomorrow . . . . . #diy #label #bands #music #life #record #release #rock #alt #business #Independent #living https://t.co/RUjvN9iDVH",set up a label it’ll be fun just spent over  in the post office happy bank holiday bring on  tomorrow                  ,label post office bank holiday tomorrow
1.1649226536160911e+18,2019-08-23 15:29:38+00:00,['1164922653616091136'],@remfrydedman How does one contain such talent? Bravo sir, how does one contain such talent bravo sir,contain talent bravo
1.164581921797673e+18,2019-08-22 16:55:41+00:00,['1164581921797672961'],"@Ffin_Colley O no, hope they feel better in time for tonight 🤪", o no hope they feel better in time for tonight ,hope time tonight
1.1641073431493263e+18,2019-08-21 09:29:53+00:00,['1164107343149326336'],@GabyAndrea317 It used to be a british institution until it’s owner turned into a Brexit supporting knobhead., it used to be a british institution until it’s owner turned into a brexit supporting knobhead,institution owner brexit knobhead
1.1627075689947668e+18,2019-08-17 12:47:41+00:00,['1162707568994766849'],Have a new found love for Leeds. Everyone is so friendly!,have a new found love for leeds everyone is so friendly,love leeds everyone
1.162378890230358e+18,2019-08-16 15:01:38+00:00,['1162378890230358016'],Massive result for @vexredband Amazing work from @wilfulpublicity https://t.co/jHhZlbEp1a,massive result for  amazing work from  ,result work
1.1622818437999124e+18,2019-08-16 08:36:00+00:00,['1162281843799912452'],"Got to watch a Q&amp;A with @nilerodgers yesterday, amazing stories and an absolute gent. https://t.co/j1iinGy0Qu",got to watch a qampa with  yesterday amazing stories and an absolute gent ,qampa yesterday story gent
1.160988659400761e+18,2019-08-12 18:57:21+00:00,['1160988659400761349'],"Looking for a house mate, no knobs please 😜 https://t.co/qFQPg7SfQp . . . . #housemate #london #roomtorent #tolet #brixton #houseshare",looking for a house mate no knobs please            ,house mate knob
1.1594781547020698e+18,2019-08-08 14:55:08+00:00,['1159478154702069767'],"@missvanspronsen That old trick, to make people drink more", that old trick to make people drink more,trick people
1.159054162124071e+18,2019-08-07 10:50:21+00:00,['1159054162124070912'],Vex Red show only has 20 tickets left! https://t.co/bshLX2yC4X,vex red show only has tickets left ,show ticket
1.1573119332568023e+18,2019-08-02 15:27:21+00:00,['1157311933256802305'],"@LynamTerry Hi Terry! Thanks for the follow, hope you’re well fellow Lynam’er", hi terry thanks for the follow hope you’re well fellow lynam’er,terry thanks hope
1.1572980132803092e+18,2019-08-02 14:32:02+00:00,['1157298013280309248'],How was work today Tom? FREE ICE CREAM!!!!!!!,how was work today tom free ice cream,work today cream
1.1572885242379346e+18,2019-08-02 13:54:20+00:00,['1157288524237934592'],Feeling the love from all the new Lynam’s I’m meeting today! ❤️,feeling the love from all the new lynam’s i’m meeting today ,love meeting today
1.1568966989685473e+18,2019-08-01 11:57:21+00:00,['1156896698968547328'],The motivation the nation needs! 🍗 https://t.co/JzwrElFvvU,the motivation the nation needs  ,motivation nation
1.1562293451884175e+18,2019-07-30 15:45:32+00:00,['1156229345188417537'],"@Pursehouse So many good bands from the 2000-2006 touring scene. ThisGIRL, Adzuki, Blakfish, One Toy Soldier...etc", so many good bands from the touring scene thisgirl adzuki blakfish one toy soldieretc,band scene thisgirl soldieretc
1.154092342321791e+18,2019-07-24 18:13:51+00:00,['1154092342321790976'],Just cycled 5.5 miles from work to pub. Time to refuel... https://t.co/heBUQbcbcs,just cycled miles from work to pub time to refuel ,mile work time
1.153769669205123e+18,2019-07-23 20:51:39+00:00,['1153769669205123074'],@senabmusic You tried the passion fruit ones from Wahaca?! https://t.co/TkqtsDnmqm, you tried the passion fruit ones from wahaca ,passion fruit wahaca
1.1537348649166643e+18,2019-07-23 18:33:21+00:00,['1153734864916664320'],"On days like today, I just wanna sit in a bath full of frozen margaritas 😩",on days like today i just wanna sit in a bath full of frozen margaritas ,today bath margarita
1.1536286230620897e+18,2019-07-23 11:31:11+00:00,['1153628623062089729'],"Great band, go see them at your local venue! https://t.co/qbymvmk0il",great band go see them at your local venue ,band venue
1.1529986592582738e+18,2019-07-21 17:47:56+00:00,['1152998659258273793'],@ilovealcopop Its the free shipping that’s makes it a bargain, its the free shipping that’s makes it a bargain,shipping bargain
1.149309456896934e+18,2019-07-11 13:28:22+00:00,['1149309456896933888'],"Gutted to not be at @2000trees this year, but looking forward to a birthday weekend of seaside walks and chillin da fuk out 👌",gutted to not be at  this year but looking forward to a birthday weekend of seaside walks and chillin da fuk out ,year weekend walk chillin
1.1457835799951892e+18,2019-07-01 19:57:47+00:00,['1145783579995189248'],"WTF! @DukeSW9 #brixton is being targeted by residents for “antisocial behaviour” “breaches” to their licence. As one of the closest residents, I have seen no such thing and will be emailing to tell them otherwise. #savetheduke Join me in emailing Brixtonferndaleroad@gmail.com",wtf   is being targeted by residents for antisocial behaviour breaches to their licence as one of the closest residents i have seen no such thing and will be emailing to tell them otherwise  join me in emailing brixtonferndaleroadcom,resident behaviour breach licence resident thing brixtonferndaleroadcom
1.1457530425386312e+18,2019-07-01 17:56:27+00:00,['1145753042538631168'],More radio spins for @sickjoyband 🤙 https://t.co/HSuAG5bIk9,more radio spins for   ,radio spin
1.1450551962356736e+18,2019-06-29 19:43:27+00:00,['1145055196235673600'],"Surprised at how many Janet Jackson songs I don’t know, and glad I don’t. #GlastonburyFestival",surprised at how many janet jackson songs i don’t know and glad i dont ,janet jackson song know
1.1421096587878318e+18,2019-06-21 16:38:56+00:00,['1142109658787831808'],Work buddies!! https://t.co/7MrTIp7D3U,work buddies ,work buddy
1.1409148140065464e+18,2019-06-18 09:31:03+00:00,['1140914814006546432'],Another festival announcement for @sickjoyband 🤙 https://t.co/a8DVEZ1KM3,another festival announcement for   ,festival announcement
1.1391019362491268e+18,2019-06-13 09:27:19+00:00,['1139101936249126913'],Huge tour announcement for @rewsmusic !! 🖤 https://t.co/xwTRBEzTJH,huge tour announcement for    ,tour announcement
1.1373996094987716e+18,2019-06-08 16:42:53+00:00,['1137399609498771459'],"We’re gonna need a lot more milkshake, he’s clearly not getting the message. https://t.co/r0h9drCR9V",we’re gonna need a lot more milkshake he’s clearly not getting the message ,gonna message
1.137328705674666e+18,2019-06-08 12:01:08+00:00,['1137328705674665984'],"I’ve been inspired by @michaelgove and would like to admit that, when I was a kid I was given bread to feed the ducks, but instead of feeding them, I ate the bread myself. #inspiredbygove",i’ve been inspired by  and would like to admit that when i was a kid i was given bread to feed the ducks but instead of feeding them i ate the bread myself ,bread duck bread
1.1344250319063328e+18,2019-05-31 11:42:58+00:00,['1134425031906332672'],The beauts in @wearelazybones_ in good company on @KerrangRadio playlist 💛 Thanks @johnnydoom https://t.co/NsgNEtz5Xr,the beauts in  in good company on  playlist  thanks  ,beaut company playlist thanks
1.1338489963201084e+18,2019-05-29 21:34:01+00:00,['1133848996320108544'],"The bands I manage have given me my chance @sickjoyband @vexredband @wearelazybones_ But if anyone wants any advice, help, support or just a chat, I’d be more than happy to help. Great idea @missvanspronsen https://t.co/iMWzkexH70",the bands i manage have given me my chance    but if anyone wants any advice help support or just a chat i’d be more than happy to help great idea  ,band chance anyone advice help support chat idea
1.131983466768339e+18,2019-05-24 18:01:04+00:00,['1131983466768338944'],"Absolutely loving the new @Petrol_Girls album, what a band!! 🖤 https://t.co/q9kmnyjGaY",absolutely loving the new  album what a band  ,album band
1.130056562834387e+18,2019-05-19 10:24:14+00:00,['1130056562834386944'],@Ffin_Colley Strong product placement game, strong product placement game,product placement game
1.1293466200411588e+18,2019-05-17 11:23:11+00:00,['1129346620041158657'],"Very impressed with this new surprise @BiffyClyro album, happy days! 🖤 https://t.co/krJkfQf05X",very impressed with this new surprise  album happy days  ,surprise album
1.1290373702197944e+18,2019-05-16 14:54:20+00:00,['1129037370219794434'],"I may have got a little sunburnt yesterday, but it was worth it for this shot. https://t.co/pKGlqLTY7A",i may have got a little sunburnt yesterday but it was worth it for this shot ,sunburnt yesterday shot
1.1276144423662182e+18,2019-05-12 16:40:07+00:00,['1127614442366218240'],Thank you @thegreatescape @boggis1 for an amazing 3 days! 4 gigs from @sickjoyband 2 from @wearelazybones_ 🤙 plus some fantastic meetings and a “few” beers. See you next year!! https://t.co/3KKUddUTHP,thank you   for an amazing days gigs from  from   plus some fantastic meetings and a few beers see you next year ,thank meeting beer year
1.1253243690630308e+18,2019-05-06 09:00:11+00:00,['1125324369063030784'],Another @wearelazybones_ spin by @DanielPCarter on the @BBCR1 Rock Show! 🤘 https://t.co/gxHNFCOSk1,another  spin by  on the  rock show  ,spin rock show
1.1235407768630436e+18,2019-05-01 10:52:50+00:00,['1123540776863043584'],"@CEOleeparsons I thought this was the case, include them in the picture next time bud 👍", i thought this was the case include them in the picture next time bud ,case picture time
1.1233579728879534e+18,2019-04-30 22:46:26+00:00,['1123357972887953408'],@CEOleeparsons Exciting times for you Lee! Hope this means you’ll be hiring some amazing women?, exciting times for you lee hope this means you’ll be hiring some amazing women,time woman
1.122596125347844e+18,2019-04-28 20:19:07+00:00,['1122596125347844097'],You heard! 🤘 @wearelazybones_ spin on @DanielPCarter tonight 💛 https://t.co/nN2WxCNCuE,you heard   spin on  tonight  ,spin tonight
1.121798994777129e+18,2019-04-26 15:31:37+00:00,['1121798994777128961'],Just been informed that “wank” in Italian is “sega”. Makes for interesting conversation when you tell an Italian how much you loved your SEGA Mega Drive as a kid,just been informed that wank in italian is sega makes for interesting conversation when you tell an italian how much you loved your sega mega drive as a kid,wank conversation drive
1.1192510226800886e+18,2019-04-19 14:46:53+00:00,['1119251022680088576'],Feeling sorry for all of goth club today 😓 https://t.co/go9FpwpeEH,feeling sorry for all of goth club today  ,sorry goth club today
1.1192152849325016e+18,2019-04-19 12:24:52+00:00,['1119215284932501504'],These dance routine birds from Our Planet reminded me of what I used to see in the local club as a teen 😂 https://t.co/GMWwiatRZO,these dance routine birds from our planet reminded me of what i used to see in the local club as a teen  ,dance routine bird planet club
1.1162849885955032e+18,2019-04-11 10:20:55+00:00,['1116284988595503105'],"@bucksmusicgroup Known Trev all my life, such a massive part of the Birmingham scene and no one deserves this more than him. 🙌", known trev all my life such a massive part of the birmingham scene and no one deserves this more than him ,life part scene
1.116018359479558e+18,2019-04-10 16:41:26+00:00,['1116018359479558145'],@laylaparch Name shame!, name shame,name shame
1.1160110025737994e+18,2019-04-10 16:12:12+00:00,['1116011002573799424'],"Looking for a UK based PR/Plugger in the folk rock, country, Americana world? Twitter, do your thing! . . . . . . #pr #plugger #country #rock #radioplugger #press #MusicIndustry #americana #uk #help #tag",looking for a uk based prplugger in the folk rock country americana world twitter do your thing                 ,prplugger folk rock country world twitter thing
1.1141598440581734e+18,2019-04-05 13:36:21+00:00,['1114159844058173440'],"@weareYONAKA lovely meeting you guys at Bingo last night, gutted we didn’t win the Kayak", lovely meeting you guys at bingo last night gutted we didn’t win the kayak,bingo night kayak
1.1134412298056376e+18,2019-04-03 14:00:50+00:00,['1113441229805637633'],Looking forward to hitting up @CamdenAssembly tonight to see the babes in @Orchardslive @soeursoeursoeur,looking forward to hitting up  tonight to see the babes in  ,tonight babe
1.1133311468494888e+18,2019-04-03 06:43:24+00:00,['1113331146849488896'],@CKleines Unisex is the way to go. Can always do XS for tiny friends like Emma. Happy to chat over email if you’d like some advice?, unisex is the way to go can always do xs for tiny friends like emma happy to chat over email if you’d like some advice,unisex friend emma email advice
1.1130107691158732e+18,2019-04-02 09:30:20+00:00,['1113010769115873282'],Pre @thegreatescape dates for @sickjoyband on sale now! https://t.co/NVmAxGlkRH,pre  dates for  on sale now ,date sale
1.111286214051672e+18,2019-03-28 15:17:34+00:00,['1111286214051672064'],@TheAlanWells You telling me you weren’t drinking and/or smoking at 16? 😜, you telling me you weren’t drinking andor smoking at ,andor smoking
1.1112731361572782e+18,2019-03-28 14:25:36+00:00,['1111273136157278208'],"@TheAlanWells If they’re paying working taxes at 16, they should have a say in where that money goes. Drinking, smoking and driving has nothing to do with it, give them something to look forward too.", if they’re paying working taxes at they should have a say in where that money goes drinking smoking and driving has nothing to do with it give them something to look forward too,money driving nothing something
1.1102043244314378e+18,2019-03-25 15:38:32+00:00,['1110204324431437824'],Any bands interested in this? I’d be happy to chat @KhloefromMARS from a Mgmt perspective 😊 https://t.co/NSzGc5ZOpO,any bands interested in this i’d be happy to chat  from a mgmt perspective  ,band mgmt perspective
1.110202222024016e+18,2019-03-25 15:30:10+00:00,['1110202222024015872'],"@LeanderMG Might get a meal out of it, good luck!", might get a meal out of it good luck,meal luck
1.109576762126676e+18,2019-03-23 22:04:49+00:00,['1109576762126675971'],"@longwaveromesh hello mate! Long time, hope you’re well", hello mate long time hope you’re well,hello mate time hope
1.1094791587726254e+18,2019-03-23 15:36:59+00:00,['1109479158772625408'],Great work from @AppleMusic and exciting to see the album being the focus of their music development. Is “pre-add” the new pre-order? I hope so! https://t.co/cnNXzm9xnr #savethealbum #musicindustry #musicbusiness #album,great work from  and exciting to see the album being the focus of their music development is preadd the new preorder i hope so     ,work album focus music development preorder
1.109059674190594e+18,2019-03-22 11:50:06+00:00,['1109059674190594049'],@LaraKBaker The world is your lobster 🦞, the world is your lobster ,world lobster
1.1077131616905994e+18,2019-03-18 18:39:32+00:00,['1107713161690599424'],"@TheAlanWells I believe DSP’s can provide sustainable income for artists, just not based on the old industry model, it’s to complicated. Would have to be a Netflix style direct deal to show its worth. As for artists who start out on the live circuit, that will become increasingly challenging.", i believe dsp’s can provide sustainable income for artists just not based on the old industry model it’s to complicated would have to be a netflix style direct deal to show its worth as for artists who start out on the live circuit that will become increasingly challenging,income artist industry model style deal worth artist circuit
1.1077010671381135e+18,2019-03-18 17:51:29+00:00,['1107701067138113537'],"@TheAlanWells Maybe it’ll come from all that money we’re going to save when we leave the EU? 😜 We also have the problem of independent venues closing at an alarming rate. While the gov funding for the arts leans very heavily towards classical and theatre, is their any hope?", maybe it’ll come from all that money we’re going to save when we leave the eu  we also have the problem of independent venues closing at an alarming rate while the gov funding for the arts leans very heavily towards classical and theatre is their any hope,money problem venue rate funding theatre hope
