id,created_at,edit_history_tweet_ids,text,clean_text,nouns
1.522129254728835e+18,2022-05-05 08:21:08+00:00,['1522129254728835075'],Exercise your right to vote. But for the country's sake don't vote Tory. #VoteLabour #VoteToryCouncilsOut #vote https://t.co/UnxspOT6YR,exercise your right to vote but for the country's sake don't vote tory    ,right vote tory
1.5218758966422938e+18,2022-05-04 15:34:23+00:00,['1521875896642293760'],@WritesBright @BylineTimes He's not a great leader let alone a great war leader!,  he's not a great leader let alone a great war leader,leader leader
1.521201552593195e+18,2022-05-02 18:54:47+00:00,['1521201552593195008'],"These companies advertise 24/7 plumbing services.I rang them as I had a leak in my bathroom.I rang the left one-2hrs later was told plumber was ""sick."" So I rang the https://t.co/4jiCiBjmZu is now 1952hrs and several calls later-no https://t.co/NsLdgE6q5C not use them! https://t.co/JGwCSaNv2M",these companies advertise plumbing servicesi rang them as i had a leak in my bathroomi rang the left onehrs later was told plumber was sick so i rang the  is now and several calls laterno  not use them ,company servicesi leak bathroomi left onehrs later plumber call
1.5210827793705042e+18,2022-05-02 11:02:49+00:00,['1521082779370504192'],"@tulyardave Sadly,that seems typical of that railway.Use something until it breaks then dump it.", sadlythat seems typical of that railwayuse something until it breaks then dump it,railwayuse something
1.5210814769048945e+18,2022-05-02 10:57:39+00:00,['1521081476904894470'],@tulyardave I was part of the team who helped to save this unit.Some of us even put our own money into https://t.co/fomLT0m2uL say we are angry to see the unit like this is an understatement., i was part of the team who helped to save this unitsome of us even put our own money into  say we are angry to see the unit like this is an understatement,part team unitsome money unit
1.5210604893080863e+18,2022-05-02 09:34:15+00:00,['1521060489308086273'],"2/ two hours later no callback so I ring them again to be told the plumber (only one?) has rung in sick on a bank holiday so I'd have to ring someone else. Which I did. Thanks a bunch @DrainDoctorLtd ,you have let me down badly. I will never use your services in future.",two hours later no callback so i ring them again to be told the plumber only one has rung in sick on a bank holiday so i'd have to ring someone else which i did thanks a bunch  you have let me down badly i will never use your services in future,hour callback plumber sick bank holiday someone bunch service
1.521060487928103e+18,2022-05-02 09:34:14+00:00,['1521060487928102912'],"Woke up to sound of rushing water today,thinking my neighbour was having a shower.Oh no,turned out a tap in my bathroom had failed water was gushing out.Result one flooded bathroom a call to a plumber ( @DrainDoctorLtd ) who said a plumber would be in touch. 1/",woke up to sound of rushing water todaythinking my neighbour was having a showeroh noturned out a tap in my bathroom had failed water was gushing outresult one flooded bathroom a call to a plumber    who said a plumber would be in touch,water neighbour showeroh bathroom water outresult bathroom call plumber plumber
1.520843898456838e+18,2022-05-01 19:13:35+00:00,['1520843898456838145'],Fine selection of Bradford buses at Sandtoft today for the 50th anniversary of the end of trolleybuses in the city. https://t.co/GQGNs2OHXs,fine selection of bradford buses at sandtoft today for the anniversary of the end of trolleybuses in the city ,selection bradford today anniversary trolleybus city
1.5196640359853425e+18,2022-04-28 13:05:14+00:00,['1519664035985342464'],"@LeedsCivicTrust @LeedsCC_News @LeedsMarkets @Jonathan_Pryor @RememberOluwale Just heard on @BBCLeeds that this plaque has been vandalised,just a day after being erected. People can be utterly vile.",     just heard on  that this plaque has been vandalisedjust a day after being erected people can be utterly vile,plaque people
1.5196425585608786e+18,2022-04-28 11:39:54+00:00,['1519642558560878595'],@BBCRadio2 This couldn't just be a rouse to deflect attention from Angela Raynors' legs could it?, this couldn't just be a rouse to deflect attention from angela raynors legs could it,rouse attention raynors
1.5195781184822354e+18,2022-04-28 07:23:50+00:00,['1519578118482235393'],"@PeterStefanovi2 Well, I've not been unfollowed thank goodness.Nothing to do with a recent announcement re Mr Musks' takeover I'm sure.....", well i've not been unfollowed thank goodnessnothing to do with a recent announcement re mr musks takeover i'm sure,thank announcement musk takeover sure
1.5192314482381537e+18,2022-04-27 08:26:17+00:00,['1519231448238153735'],@BBCLeeds Didn't think it would cause such a debate. But they're still buns NOT cupcakes! (We are not Americans!) 😉, didn't think it would cause such a debate but they're still buns not cupcakes we are not americans ,debate american
1.519215594733777e+18,2022-04-27 07:23:18+00:00,['1519215594733776896'],"@JanekLasocki @BarristerSecret Seems like the usual ""throw money at it"" response.",  seems like the usual throw money at it response,throw money response
1.518916490560516e+18,2022-04-26 11:34:46+00:00,['1518916490560516097'],@BBCRadio2 Elon Musk obviously sees something we all don't which is why he's bought Twitter for such an exorbitant sum!, elon musk obviously sees something we all don't which is why he's bought twitter for such an exorbitant sum,elon musk something twitter
1.5181677861823898e+18,2022-04-24 09:59:41+00:00,['1518167786182389760'],"@AngelaRayner @MoS_Politics @AngelaRayner I think you are amazing, tough and totally fearless.I bet Boris quakes in his boots when you take https://t.co/jM0pBsrAB2 me,you always look smart professional.Don't let the misogynists get to you.Keep up the good work.",   i think you are amazing tough and totally fearlessi bet boris quakes in his boots when you take  meyou always look smart professionaldont let the misogynists get to youkeep up the good work,boris quake boot meyou professionaldont misogynist work
1.5181658154298982e+18,2022-04-24 09:51:51+00:00,['1518165815429898240'],@JamesMelville Not in a million bloody years!, not in a million bloody years,bloody year
1.5181374204951388e+18,2022-04-24 07:59:01+00:00,['1518137420495138817'],@addict_car I saw this rather nice series 2 model last week. If you listen carefully you'll hear the tappets from here! https://t.co/UCYzxSOvhF, i saw this rather nice series model last week if you listen carefully you'll hear the tappets from here ,series model week tappet
1.5174007955739402e+18,2022-04-22 07:11:56+00:00,['1517400795573940224'],"@PeterStefanovi2 I think we all know the answer to this question. Boris has no honour which is why he his cabinet (most notably Priti Patel) are still in office. If they were honourable people, they would do the decent thing.", i think we all know the answer to this question boris has no honour which is why he his cabinet most notably priti patel are still in office if they were honourable people they would do the decent thing,answer question boris honour cabinet patel office people thing
1.5171493954724454e+18,2022-04-21 14:32:57+00:00,['1517149395472445445'],@TweetForTheMany @Keir_Starmer Have I missed something here? Did @Keir_Starmer give @Jeremycorbyn the whip back??,  have i missed something here did  give  the whip back,something whip
1.5170713419371151e+18,2022-04-21 09:22:48+00:00,['1517071341937115137'],I reckon the knives are being sharpened and the vultures are circling. #BorisJohnsonResign #BorisTheLiar #BorisJohnsonOut,i reckon the knives are being sharpened and the vultures are circling   ,knife vulture
1.517043532439212e+18,2022-04-21 07:32:18+00:00,['1517043532439212032'],"@David39133380 The thing that has tipped me over the edge was my mother's passing in February. Still raw recent. But thank you for your comments, it helps to know people care.", the thing that has tipped me over the edge was my mother's passing in february still raw recent but thank you for your comments it helps to know people care,thing edge passing comment people
1.5170351485035684e+18,2022-04-21 06:58:59+00:00,['1517035148503568384'],"Got up around 6, went downstairs made a coffee. Been laid on the couch since. No motivation at all. Need to shake it off but can't. #depressed",got up around went downstairs made a coffee been laid on the couch since no motivation at all need to shake it off but cant ,downstairs coffee motivation need
1.5159713794677965e+18,2022-04-18 08:31:56+00:00,['1515971379467796481'],I know it's a day late but I've lit the Easter candle in memory of mum. https://t.co/3U6vtbcGGX,i know it's a day late but i've lit the easter candle in memory of mum ,easter candle memory
1.515697881684099e+18,2022-04-17 14:25:09+00:00,['1515697881684099077'],"For the Nasher bashers, a smart Leyland National! https://t.co/dxC3cP0XaA",for the nasher bashers a smart leyland national ,nasher leyland
1.515679407993766e+18,2022-04-17 13:11:45+00:00,['1515679407993765890'],Former Stagecoach Volvo B10M seen after arrival at Kirkby Stephen Station. https://t.co/zyRnmnSaJb,former stagecoach volvo bm seen after arrival at kirkby stephen station ,stagecoach volvo arrival kirkby stephen station
1.5156678294916465e+18,2022-04-17 12:25:44+00:00,['1515667829491646465'],Two generations of Leyland Titans seen here at Kirkby Stephen Station today. https://t.co/60BnE1aLTP,two generations of leyland titans seen here at kirkby stephen station today ,generation leyland titan kirkby stephen station today
1.51566573283883e+18,2022-04-17 12:17:25+00:00,['1515665732838830082'],Blackpool Atlantean a RML Routemaster seen at Brough today. https://t.co/NgxaPq3YIP,blackpool atlantean a rml routemaster seen at brough today ,blackpool routemaster today
1.5156260933482783e+18,2022-04-17 09:39:54+00:00,['1515626093348278275'],Happy Easter Everyone! 🐇🥚,happy easter everyone ,easter everyone
1.5154063334236365e+18,2022-04-16 19:06:39+00:00,['1515406333423636481'],@eltomas87 Join the Dewsbury bus museum lot. A guy there has a Mk2. I've driven it a couple of times., join the dewsbury bus museum lot a guy there has a mk i've driven it a couple of times,dewsbury museum couple time
1.515394621198807e+18,2022-04-16 18:20:07+00:00,['1515394621198807048'],"@eltomas87 You're on! Saw your dad in the bus stn yesterday. When you've passed your PSV test, you might get a go in something vintage. That will open your eyes lol.", you're on saw your dad in the bus stn yesterday when you've passed your psv test you might get a go in something vintage that will open your eyes lol,yesterday test something vintage
1.5153911550134026e+18,2022-04-16 18:06:20+00:00,['1515391155013402629'],@eltomas87 Kirkby Stephen. First time it's been on for a couple of years thanks to covid. Usually a good day. I'll post some pics., kirkby stephen first time it's been on for a couple of years thanks to covid usually a good day i'll post some pics,kirkby stephen time couple year thanks post
1.5153879180172493e+18,2022-04-16 17:53:28+00:00,['1515387918017249280'],@eltomas87 Right. I've swapped a rest day so I can attend a bus rally tomorrow., right i've swapped a rest day so i can attend a bus rally tomorrow,rest rally tomorrow
1.515383533530927e+18,2022-04-16 17:36:03+00:00,['1515383533530927110'],@eltomas87 On Easter Sunday? Thought you had to close then?, on easter sunday thought you had to close then,easter sunday
1.5145789266806538e+18,2022-04-14 12:18:50+00:00,['1514578926680653827'],"@matthud59 Priti Patel is doing this purely to keep the blue votes. (""They're not coming here!"") I hate that woman and her sneering arrogance!", priti patel is doing this purely to keep the blue votes theyre not coming here i hate that woman and her sneering arrogance,priti patel vote woman sneering arrogance
1.514440093620183e+18,2022-04-14 03:07:09+00:00,['1514440093620183047'],@pritipatel @BorisJohnson Other countries eg Poland are taking refugees without question. Why aren't we? You soulless woman.,  other countries eg poland are taking refugees without question why aren't we you soulless woman,country poland refugee question woman
1.5139661310563615e+18,2022-04-12 19:43:48+00:00,['1513966131056361474'],@BBCRadio2 Heyyyy Edith!! Just listening in cos I can't find anything decent on the telly! Keep up the good work luv., heyyyy edith just listening in cos i can't find anything decent on the telly keep up the good work luv,heyyyy edith anything work
1.5138494963917947e+18,2022-04-12 12:00:20+00:00,['1513849496391794696'],@BBCRadio2 It took me TWO HOURS to get through to a hospital before Xmas to enquire about my sick mother who has since passed away. That was typical., it took me two hours to get through to a hospital before xmas to enquire about my sick mother who has since passed away that was typical,hour hospital xmas mother
1.5138032485992817e+18,2022-04-12 08:56:34+00:00,['1513803248599281666'],@MrTimDunn My favourite bit of railway line. Only Blue Anchor to Minehead on the West Somerset Railway comes close in my opinion., my favourite bit of railway line only blue anchor to minehead on the west somerset railway comes close in my opinion,railway line anchor west railway opinion
1.5138014698411008e+18,2022-04-12 08:49:30+00:00,['1513801469841100808'],"@JamesMelville If they did bring one in, no one would listen. For the very reasons you've just said. As usual,one rule for them-another for us.", if they did bring one in no one would listen for the very reasons you've just said as usualone rule for themanother for us,reason usualone rule themanother
1.513794342674174e+18,2022-04-12 08:21:10+00:00,['1513794342674173955'],@MahboobDad Trying my best buddy. Thanks take care yourself., trying my best buddy thanks take care yourself,thanks care
1.5137719147114783e+18,2022-04-12 06:52:03+00:00,['1513771914711478273'],"Well,the early night didn't work. I slept OK but still feel tired this morning. It remains to be seen if the day gets better. I'm trying to think positive, trying to look ahead but it's tough. Hope you all have a good day.",wellthe early night didn't work i slept ok but still feel tired this morning it remains to be seen if the day gets better i'm trying to think positive trying to look ahead but it's tough hope you all have a good day,night work morning hope
1.5136228683572593e+18,2022-04-11 20:59:48+00:00,['1513622868357259271'],Have an early night. Try to relax. Clear your mind and things will be better in the morning. That's the theory. Let's see if it works. Goodnight everyone.,have an early night try to relax clear your mind and things will be better in the morning that's the theory let's see if it works goodnight everyone,night mind thing morning theory everyone
1.512350862160634e+18,2022-04-08 08:45:18+00:00,['1512350862160633858'],@LBCNews I'm a Labour voter but I don't hate rich people. What the heck is this guy on about!?, i'm a labour voter but i don't hate rich people what the heck is this guy on about,voter people heck
1.5123491576541512e+18,2022-04-08 08:38:31+00:00,['1512349157654151169'],"@WarmongerHodges Rachel Riley should stick to countdown. As for Pickles, his performance at the @grenfellinquiry should mean no one would go near him. As for the others,who are they exactly?", rachel riley should stick to countdown as for pickles his performance at the  should mean no one would go near him as for the otherswho are they exactly,rachel riley pickle performance otherswho
1.512348428713529e+18,2022-04-08 08:35:38+00:00,['1512348428713529345'],I see Extinction Rebellion are up to their old tricks again..... #towerbridge,i see extinction rebellion are up to their old tricks again ,extinction rebellion trick
1.5123325206328156e+18,2022-04-08 07:32:25+00:00,['1512332520632815617'],@David39133380 Decency the Tory party are alien to one another., decency the tory party are alien to one another,decency tory party
1.5119688395249254e+18,2022-04-07 07:27:17+00:00,['1511968839524925442'],Fun to hear the tories crawling up Rishi Sunaks' backside on @BBCr4today Would we expect anything else?,fun to hear the tories crawling up rishi sunaks backside on  would we expect anything else,tory sunaks anything
1.5119636409325814e+18,2022-04-07 07:06:37+00:00,['1511963640932581376'],"@seventiesuk @JedKendray I certainly do.His familiar cry of ""Prawns,cockles,mussels,whelks,prawn cocktail?"" interrupted many a bingo game in my local WMC!",  i certainly dohis familiar cry of prawnscocklesmusselswhelksprawn cocktail interrupted many a bingo game in my local wmc,prawnscocklesmusselswhelksprawn cocktail game
1.511705925891068e+18,2022-04-06 14:02:33+00:00,['1511705925891067914'],"I'm just wondering if a certain Australian media mogul has been having secret discussions with a certain scruffy haired Prime minister. Or am I just cynical? ""Channel 4,here on Sky!""",i'm just wondering if a certain australian media mogul has been having secret discussions with a certain scruffy haired prime minister or am i just cynical channel on sky,medium mogul discussion scruffy minister channel
1.5107074092489974e+18,2022-04-03 19:54:48+00:00,['1510707409248997376'],Rode this lovely AEC Swift today. Rather muted for my taste but a very nice ride. https://t.co/Yuphb8oxom,rode this lovely aec swift today rather muted for my taste but a very nice ride ,rode swift today taste ride
1.5107070708526408e+18,2022-04-03 19:53:27+00:00,['1510707070852640781'],@supertanskiii There's some fiery opinions behind that very pretty face., there's some fiery opinions behind that very pretty face,fiery opinion face
1.5103379627053957e+18,2022-04-02 19:26:45+00:00,['1510337962705395726'],"Sometimes, I get a hangover before I've stopped drinking! Where's my bloody takeaway!?",sometimes i get a hangover before i've stopped drinking where's my bloody takeaway,hangover bloody takeaway
1.5098316445633577e+18,2022-04-01 09:54:50+00:00,['1509831644563357730'],@JamesMelville If this isn't an April fool (!) I suggest you should lie down in a darkened room for a while. Where some men in white coats will soon come and take you away....., if this isn't an april fool  i suggest you should lie down in a darkened room for a while where some men in white coats will soon come and take you away,fool room coat
1.5098311260551086e+18,2022-04-01 09:52:46+00:00,['1509831126055108624'],@supertanskiii I think most people are. Sad thing is the joke is on us., i think most people are sad thing is the joke is on us,people thing joke
1.5090948791456932e+18,2022-03-30 09:07:11+00:00,['1509094879145693185'],Facebook is woke. Official.,facebook is woke official,facebook official
1.508354225541161e+18,2022-03-28 08:04:05+00:00,['1508354225541160960'],This makes for an interesting read. Now we know how out of touch upper class Tories really are. https://t.co/dSXC4srSxp,this makes for an interesting read now we know how out of touch upper class tories really are ,read class tory
1.5083527778603622e+18,2022-03-28 07:58:20+00:00,['1508352777860362242'],@domjoly Cos somebody got slapped at the oscars!, cos somebody got slapped at the oscars,somebody oscar
1.5083447483140915e+18,2022-03-28 07:26:26+00:00,['1508344748314091520'],Is Will Smith's career fading? Is Chris Rock's? Could this be a publicity stunt? I don't really care.,is will smith's career fading is chris rocks could this be a publicity stunt i don't really care,career fading rock publicity stunt
1.5081785892876534e+18,2022-03-27 20:26:10+00:00,['1508178589287653381'],A photo to calm your nerves..... https://t.co/rqXcr64DkC,a photo to calm your nerves ,photo nerve
1.5074112316650537e+18,2022-03-25 17:36:58+00:00,['1507411231665053698'],"@Mandoline_Blue I bet the arabs laughed him out of their country when they saw the state of him. Scruffy suit,hair a mess. On first impressions what would you think?", i bet the arabs laughed him out of their country when they saw the state of him scruffy suithair a mess on first impressions what would you think,arab country state mess impression
1.5047279790956462e+18,2022-03-18 07:54:41+00:00,['1504727979095646251'],@johnredwood @Rob_Kimbell Brexit-the gift that keeps on taking. (Now it's the food from our mouths!),  brexitthe gift that keeps on taking now it's the food from our mouths,brexitthe gift food mouth
1.5045528714461676e+18,2022-03-17 20:18:52+00:00,['1504552871446167556'],"My heart goes out to all the P+O workers who have lost their jobs today.I really feel for you.Our Labour laws in this country are pathetic,the Tories have yet again allowed loyal workers to be sold down the river.I wish you all good luck in the future.",my heart goes out to all the po workers who have lost their jobs todayi really feel for youour labour laws in this country are patheticthe tories have yet again allowed loyal workers to be sold down the riveri wish you all good luck in the future,heart worker labour country tory worker riveri wish luck future
1.5037392771585352e+18,2022-03-15 14:25:56+00:00,['1503739277158535178'],"@eltomas87 Excellent job, well done! If you pass your medical etc it should be no problem. Welcome to the asylum! 🤯", excellent job well done if you pass your medical etc it should be no problem welcome to the asylum ,problem welcome asylum
1.5036830559150817e+18,2022-03-15 10:42:32+00:00,['1503683055915081733'],Check out Yahoo News's video! #TikTok https://t.co/ydI6FTkkrO,check out yahoo news's video  ,yahoo video
1.5034314959769887e+18,2022-03-14 18:02:55+00:00,['1503431495976988680'],@teddybusz Drive safe stay safe. This is a very noble brave thing you are doing. Give my regards to Adam Smith! Home safe all., drive safe stay safe this is a very noble brave thing you are doing give my regards to adam smith home safe all,drive stay thing regard home
1.5029790152037745e+18,2022-03-13 12:04:55+00:00,['1502979015203774464'],"@eltomas87 You're still going for it then? Good luck, be steady above all listen to the instructor!", you're still going for it then good luck be steady above all listen to the instructor,luck listen instructor
1.502942874656252e+18,2022-03-13 09:41:19+00:00,['1502942874656251905'],"@MrTimDunn @BFI Class 405 units, class 73 74 electro-diesels, blue blue/grey stock. Southern Region heaven!",  class units class electrodiesels blue bluegrey stock southern region heaven,class unit class electrodiesels stock region heaven
1.5026788448174326e+18,2022-03-12 16:12:09+00:00,['1502678844817432579'],Having a pint watching the rugby!,having a pint watching the rugby,pint rugby
1.5026675629366843e+18,2022-03-12 15:27:19+00:00,['1502667562936684551'],@Filrd I've often wondered how long it will take for the Premier league bubble to burst., i've often wondered how long it will take for the premier league bubble to burst,league bubble
1.5026539039130337e+18,2022-03-12 14:33:03+00:00,['1502653903913033730'],@34020seaton @ossettbrewery We're going out for the rugby later so I've no doubt we will. Take care mate.,  we're going out for the rugby later so i've no doubt we will take care mate,rugby doubt care mate
1.502651361950933e+18,2022-03-12 14:22:57+00:00,['1502651361950932992'],@HubNutVids Sorry to hear your sad news. My deepest condolences mate., sorry to hear your sad news my deepest condolences mate,sorry news deepest condolence
1.502651085592445e+18,2022-03-12 14:21:51+00:00,['1502651085592444929'],"@34020seaton @ossettbrewery My brother's house lol. Wokingham, just down the road.",  my brother's house lol wokingham just down the road,house wokingham road
1.5026445155046277e+18,2022-03-12 13:55:44+00:00,['1502644515504627713'],Drinking @ossettbrewery Yorkshire Blonde in the heart of Berkshire! https://t.co/m5bu6JgyCw,drinking  yorkshire blonde in the heart of berkshire ,yorkshire blonde heart berkshire
1.502602214103257e+18,2022-03-12 11:07:39+00:00,['1502602214103257094'],Back in Facebook jail again. Guess I'll just have to annoy people on here instead! 🖕,back in facebook jail again guess i'll just have to annoy people on here instead ,facebook jail people
1.500937942986068e+18,2022-03-07 20:54:26+00:00,['1500937942986067968'],Found on Facebook. No idea where. We are so ripped off in this country. https://t.co/R9mIkZqRql,found on facebook no idea where we are so ripped off in this country ,facebook idea country
1.5008723821684165e+18,2022-03-07 16:33:55+00:00,['1500872382168416257'],@LatestAnonPress This is brilliant. A bunch of ordinary guys taking on the might of Russia. They and the rest of the world will prevail., this is brilliant a bunch of ordinary guys taking on the might of russia they and the rest of the world will prevail,bunch russia rest world
1.5006295900956344e+18,2022-03-07 00:29:09+00:00,['1500629590095634434'],"@eltomas87 Good luck with that.I rang for a sicknote other day,was told to go online or I could have an appointment a wk on Tuesday at 0900.That was a wk ago.", good luck with thati rang for a sicknote other daywas told to go online or i could have an appointment a wk on tuesday at that was a wk ago,luck thati sicknote daywas appointment tuesday
1.5006282342617334e+18,2022-03-07 00:23:46+00:00,['1500628234261733379'],@acgrayling Typical. The British government is sitting on its hands hoping the problem will go away. I've got news for them-it won't., typical the british government is sitting on its hands hoping the problem will go away i've got news for themit wont,government hand problem news themit wont
1.5002352054619095e+18,2022-03-05 22:22:00+00:00,['1500235205461909508'],"@BBCRadio2 Hi Craig, Please say hi to me, I tried last week you ignored me! All the best mate!", hi craig please say hi to me i tried last week you ignored me all the best mate,craig please week mate
