id,created_at,edit_history_tweet_ids,text,clean_text,nouns
1.4721382577313096e+18,2021-12-18 09:34:46+00:00,['1472138257731309568'],@BBCRadio2 What utter crap! Bing Crosby must be spinning in his grave!!, what utter crap bing crosby must be spinning in his grave,crap crosby grave
1.4716157885242163e+18,2021-12-16 22:58:39+00:00,['1471615788524216321'],@mikeroebuck53 @OldSheffield My brother told me he nearly got his arms yanked off as he jumped on a Routemaster at the lights in London as it pulled away!,  my brother told me he nearly got his arms yanked off as he jumped on a routemaster at the lights in london as it pulled away,brother routemaster light london
1.4714828246036234e+18,2021-12-16 14:10:18+00:00,['1471482824603623431'],That's my Xmas ale in. @ossettbrewery have done well out of me this year! Happy Christmas all!! https://t.co/kaEHPwPChU,that's my xmas ale in  have done well out of me this year happy christmas all ,year christmas
1.4713893960416174e+18,2021-12-16 07:59:03+00:00,['1471389396041617410'],@duncanpoundcake @ollyo9 @jeremycorbyn @Jackiew80333500 @Keir_Starmer And so the mud slinging starts.....,     and so the mud slinging starts,slinging start
1.471033415520641e+18,2021-12-15 08:24:31+00:00,['1471033415520641032'],A MILLION INFECTIONS A WEEK!,a million infections a week,infection week
1.470680521168634e+18,2021-12-14 09:02:14+00:00,['1470680521168633861'],Someone really needs to tell people that putting a facemask over your mouth not over their nose as well is like putting a condom round yer gonads but not over yer dick! Wear it properly ffs!!,someone really needs to tell people that putting a facemask over your mouth not over their nose as well is like putting a condom round yer gonads but not over yer dick wear it properly ffs,someone people facemask mouth condom round gonad dick
1.4699591245909934e+18,2021-12-12 09:15:40+00:00,['1469959124590993411'],@JamesMelville Did I deserve him? And all the others who didn't vote for him??, did i deserve him and all the others who didn't vote for him,deserve others vote
1.46916396267989e+18,2021-12-10 04:35:59+00:00,['1469163962679889926'],Just heard on @BBCRadio4 @bbclaurak saying there's talk of Boris resigning..... Some hope..... #teflonboris,just heard on   saying there's talk of boris resigning some hope ,talk boris hope
