id,created_at,edit_history_tweet_ids,text,clean_text,nouns
1.4998945984869622e+18,2022-03-04 23:48:33+00:00,['1499894598486962176'],"@BlacktopMagazin @thecarfactoids @neilmbriscoe @t2stu @DarraghMcKenna @TopOfTheTower @StvCr Not sure I agree with that,the Stratos was surely another level entirely.The X1/9 was much more humble.But of course,there could have been a range of them.",       not sure i agree with thatthe stratos was surely another level entirelythe x was much more humblebut of coursethere could have been a range of them,thatthe stratos level entirelythe humblebut coursethere range
1.4998594659522437e+18,2022-03-04 21:28:57+00:00,['1499859465952243714'],"@thecarfactoids @neilmbriscoe @t2stu @DarraghMcKenna @TopOfTheTower @StvCr Such a shame FIAT never developed this car fully. A big twin-cam, fuel injected engine and uprated suspension would have made it a serious contender.",      such a shame fiat never developed this car fully a big twincam fuel injected engine and uprated suspension would have made it a serious contender,shame fiat twincam fuel engine suspension contender
1.4993417806927012e+18,2022-03-03 11:11:51+00:00,['1499341780692701191'],"@BBCLeeds Kylie,Jason et al should all return for a reunion.Just as a gas main explodes! Good riddance Neighbours!! (But make sure Daphne can't come, I always fancied her!)", kyliejason et al should all return for a reunionjust as a gas main explodes good riddance neighbours but make sure daphne can't come i always fancied her,kyliejason reunionjust explodes riddance neighbour daphne
1.499154961216774e+18,2022-03-02 22:49:30+00:00,['1499154961216774148'],@maybezabe @supertanskiii A lifetime of whisky venison there.,  a lifetime of whisky venison there,lifetime venison
1.4991075933311345e+18,2022-03-02 19:41:16+00:00,['1499107593331134472'],"@PeterStefanovi2 @campbellclaret Don't be silly. They'll all be too busy quaking in their boots hoping they don't get caught in the ""oligarchy-gate"" of the future. They'll be right behind Boris-carefully hiding.",  don't be silly they'll all be too busy quaking in their boots hoping they don't get caught in the oligarchygate of the future they'll be right behind boriscarefully hiding,boot oligarchygate future
1.499106350323884e+18,2022-03-02 19:36:20+00:00,['1499106350323884038'],"@terrychristian They might be seizing their own assets that's why. A lot of tories (jrm, Boris et al) are well in the oligarchs' pockets. I bet their backsides are twitching.....", they might be seizing their own assets that's why a lot of tories jrm boris et al are well in the oligarchs pockets i bet their backsides are twitching,asset tory pocket backside
1.4986293552867697e+18,2022-03-01 12:00:56+00:00,['1498629355286769666'],@mrjamesob Our sanctions are poorer because of all the Russian money swilling around in London.Oligarchs own lots of empty properties in exclusive areas of the capital.Boris etc al are in these people's pockets worried about their own interests first., our sanctions are poorer because of all the russian money swilling around in londonoligarchs own lots of empty properties in exclusive areas of the capitalboris etc al are in these people's pockets worried about their own interests first,sanction money property area capitalboris pocket interest
1.4985832288815063e+18,2022-03-01 08:57:38+00:00,['1498583228881506305'],"@RosieisaHolt @wtfisgoingonpod Well, we can't upset the major donors to the tory party can we?",  well we can't upset the major donors to the tory party can we,donor tory party
1.4984677335073014e+18,2022-03-01 01:18:42+00:00,['1498467733507301382'],@CarolineLucas Don't worry about it. There aren't enough police to enforce the rules anyway., don't worry about it there aren't enough police to enforce the rules anyway,police rule
1.4984665011536732e+18,2022-03-01 01:13:48+00:00,['1498466501153673220'],"@Brian_Tibbels @MaxFRobespierre @Nigel_Farage Will we ever be free of this prick? As my mum used to say,""If he fell in a bucket of shite he'd come up smelling of roses!""",   will we ever be free of this prick as my mum used to sayif he fell in a bucket of shite he'd come up smelling of roses,prick bucket smelling rose
1.498465017443799e+18,2022-03-01 01:07:54+00:00,['1498465017443799044'],@Jeffrey62093861 @KevinPascoe Great stuff. Shame I don't actually drink the stuff.....,  great stuff shame i don't actually drink the stuff,stuff shame stuff
1.4984626776891146e+18,2022-03-01 00:58:37+00:00,['1498462677689114631'],"This is nice to see but wouldn't stronger sanctions be a better idea? But who knows how much much Russian money is swilling around in London these days? Wouldn't want to lose that would you Boris,Jacob et al..... https://t.co/UuPlW9eQjD",this is nice to see but wouldn't stronger sanctions be a better idea but who knows how much much russian money is swilling around in london these days wouldn't want to lose that would you borisjacob et al ,sanction idea money
1.4977120377151898e+18,2022-02-26 23:15:50+00:00,['1497712037715189761'],"@BBCRadio2 Hi Craig, loving the tunes. Great music. Say hi to me please 'cos no-one else will!", hi craig loving the tunes great music say hi to me please cos noone else will,craig tune music noone
1.4965199946576282e+18,2022-02-23 16:19:05+00:00,['1496519994657628169'],@supertanskiii He cared about ordinary people. And he was utterly vilified for it. He was the reason I joined the Labour Party., he cared about ordinary people and he was utterly vilified for it he was the reason i joined the labour party,people reason labour party
1.496517921618731e+18,2022-02-23 16:10:51+00:00,['1496517921618731016'],@supertanskiii Bercow was like a wet fish. He let the Tories hammer Corbyn. Don't want him back thanks., bercow was like a wet fish he let the tories hammer corbyn don't want him back thanks,bercow fish tory thanks
1.4964657053735158e+18,2022-02-23 12:43:21+00:00,['1496465705373515778'],"@mikegalsworthy Well, he is a tory. Probably thinks the Green Party is a joke. Bercow was the same with Jeremy Corbyn.", well he is a tory probably thinks the green party is a joke bercow was the same with jeremy corbyn,tory party joke bercow jeremy corbyn
1.4964180477201408e+18,2022-02-23 09:33:59+00:00,['1496418047720140802'],@GeorgeMonbiot @mikegalsworthy Boris knows the Tory party would probably go bankrupt if he did! (And what dirt do they have on him.....),  boris knows the tory party would probably go bankrupt if he did and what dirt do they have on him,boris tory party dirt
1.496400656638296e+18,2022-02-23 08:24:52+00:00,['1496400656638296065'],"Jeez, Liz Truss is as thick as two short planks!",jeez liz truss is as thick as two short planks,jeez truss plank
1.4962487293467077e+18,2022-02-22 22:21:10+00:00,['1496248729346707470'],This twit is our PM. Like retweet if you think he looks better without hair. https://t.co/NAtm72bqHR,this twit is our pm like retweet if you think he looks better without hair ,twit retweet hair
1.495908576090538e+18,2022-02-21 23:49:31+00:00,['1495908576090537995'],"@bhandel58 @EricIdle ""Do they do an extra large size?"" (Asking for a friend.....)",  do they do an extra large size asking for a friend,size friend
1.4959054321368187e+18,2022-02-21 23:37:02+00:00,['1495905432136818691'],"@6TownsMart The Castle looks like a lovely, traditional pub. And that pint looked lovely!", the castle looks like a lovely traditional pub and that pint looked lovely,look pint
1.495707335347655e+18,2022-02-21 10:29:52+00:00,['1495707335347654656'],@mrjamesob Just watched this clip as you started on about this idiot. https://t.co/3gGqaIL1s3, just watched this clip as you started on about this idiot ,clip idiot
1.49445419179597e+18,2022-02-17 23:30:19+00:00,['1494454191795970050'],"An excellent evening in the local @HeavyWoolyCamra pub of the season. Come here, it is a brilliant pub. Great ale, friendly staff and a fantastic atmosphere. https://t.co/HI7WdOC0zP",an excellent evening in the local  pub of the season come here it is a brilliant pub great ale friendly staff and a fantastic atmosphere ,evening season come staff atmosphere
1.4944535613961912e+18,2022-02-17 23:27:49+00:00,['1494453561396191232'],No surprise there. Brexit is shit-official. https://t.co/6Bn0YvMTSd,no surprise there brexit is shitofficial ,surprise brexit
1.4944527645455892e+18,2022-02-17 23:24:39+00:00,['1494452764545589248'],@guardian Does The Queen have the power to dismiss Boris? Asking for a friend., does the queen have the power to dismiss boris asking for a friend,queen power boris friend
1.4942155069744497e+18,2022-02-17 07:41:52+00:00,['1494215506974449665'],It's windy in Blackpool! https://t.co/bVvRsUHLec,it's windy in blackpool ,windy blackpool
1.4933716505067356e+18,2022-02-14 23:48:41+00:00,['1493371650506735617'],"Read, and inwardly digest. This guy speaks so much sense. https://t.co/eR9aBWpDtG",read and inwardly digest this guy speaks so much sense ,read sense
1.4931493395307684e+18,2022-02-14 09:05:18+00:00,['1493149339530768386'],"I bet Putin is quaking in his boots at the West. He'll do whatever he pleases. ""Sanctions comrade, like we care! We have oil, gas, agriculture industry!""",i bet putin is quaking in his boots at the west he'll do whatever he pleases sanctions comrade like we care we have oil gas agriculture industry,putin boot west sanction agriculture industry
1.493146954972414e+18,2022-02-14 08:55:50+00:00,['1493146954972413954'],Seems I'm locked out of Facebook for 24 hrs. A comment about someone kissing me cos it's Valentines day didn't go down well with the Facebook gestapo. How will I cope!,seems i'm locked out of facebook for hrs a comment about someone kissing me cos it's valentines day didn't go down well with the facebook gestapo how will i cope,facebook comment someone valentine facebook gestapo cope
1.4923997937291633e+18,2022-02-12 07:26:52+00:00,['1492399793729163271'],"@BBCRadio2 Hi Tony, good morning to you. Can you please play any track by Billy Fury? My mum passed away yesterday she was a big fan when she was younger. Many thanks.", hi tony good morning to you can you please play any track by billy fury my mum passed away yesterday she was a big fan when she was younger many thanks,tony morning track yesterday thanks
1.4918013047960412e+18,2022-02-10 15:48:42+00:00,['1491801304796041217'],@EJ_Burrows @trussliz I'm sure Putin is quaking in his boots. No wonder this country is now a laughing stock throughout the world.,  i'm sure putin is quaking in his boots no wonder this country is now a laughing stock throughout the world,putin boot wonder country stock world
1.4917272552397292e+18,2022-02-10 10:54:27+00:00,['1491727255239729153'],@SusanlLawson @David39133380 @DanielJHannan My mother is in a similar condition.I was not able to visit her for a good while.I feel heartbroken.This is why Boris must go.,   my mother is in a similar conditioni was not able to visit her for a good whilei feel heartbrokenthis is why boris must go,mother conditioni whilei heartbrokenthis boris
1.490908701376774e+18,2022-02-08 04:41:48+00:00,['1490908701376774144'],@supertanskiii @brexit_sham I think this woman is amazing. I look forward to her rantings every day.,  i think this woman is amazing i look forward to her rantings every day,woman ranting
1.489255384544006e+18,2022-02-03 15:12:07+00:00,['1489255384544006149'],@christinetalbot @scalpcooling I never knew you'd suffered with breast cancer until now! (I'm not a watcher of the news) hope you're well doing ok luv.,  i never knew you'd suffered with breast cancer until now im not a watcher of the news hope you're well doing ok luv,breast cancer watcher news hope
1.4889061317874688e+18,2022-02-02 16:04:19+00:00,['1488906131787468805'],"@AdamJSchwarz @fascinatorfun We know! No HS2, Northern Powerhouse a joke..... People like Gove think the north ends at Watford Gap!",  we know no hs northern powerhouse a joke people like gove think the north ends at watford gap,joke people gove watford
1.4885906139184005e+18,2022-02-01 19:10:33+00:00,['1488590613918400517'],@BBCRadio2 Well well well..... it seems that giving your radio a thumb when it refuses to operate DOES work!, well well well it seems that giving your radio a thumb when it refuses to operate does work,radio thumb
1.488186376214438e+18,2022-01-31 16:24:15+00:00,['1488186376214437892'],Sure I've just heard Boris Johnson belch on the radio! Just shows his contempt for parliament. But he's saying nothing. Which shows it even more. #BorisOut #BorisJohnsonOut,sure i've just heard boris johnson belch on the radio just shows his contempt for parliament but he's saying nothing which shows it even more  ,boris johnson belch radio contempt parliament nothing
1.4879998580238418e+18,2022-01-31 04:03:06+00:00,['1487999858023841799'],@pipdunn @N_Amberfield Maybe to do with engine cooling? If the rads were facing each other cooling would be minimal.,  maybe to do with engine cooling if the rads were facing each other cooling would be minimal,engine cooling
1.4875201666740634e+18,2022-01-29 20:16:59+00:00,['1487520166674063365'],@ianvisits No way is that the 1950s.The bus is either a LT or STL class dating from the 1930s.Pretty sure they were all gone by the 50s although some were converted to SRT class using RT style https://t.co/F6sW2ghXAf's likely late 30s or 40s., no way is that the bus is either a lt or stl class dating from the sure they were all gone by the although some were converted to srt class using rt style  likely late or,class sure class style
1.4874281306210386e+18,2022-01-29 14:11:16+00:00,['1487428130621038592'],"@LBC @mrjamesob This guy hasn't a clue. I don't understand ""wokeness"" so can anyone explain it to me or shall I Google it?",  this guy hasn't a clue i don't understand wokeness so can anyone explain it to me or shall i google it,clue wokeness anyone google
1.4873457673711862e+18,2022-01-29 08:43:59+00:00,['1487345767371186180'],@HubNutVids Me too. I had a Mini for around 6 months it spent one of those in a garage with a major electrical fault which cost £600 to fix. I was glad to see the back of it!, me too i had a mini for around months it spent one of those in a garage with a major electrical fault which cost  to fix i was glad to see the back of it,mini month garage fault cost back
1.4866229242410476e+18,2022-01-27 08:51:39+00:00,['1486622924241047553'],"""England lifts COVID-19 Plan B restrictions"" https://t.co/3w3GveGQtw",england lifts covid plan b restrictions ,england lift plan restriction
1.4863292310261473e+18,2022-01-26 13:24:37+00:00,['1486329231026147328'],@nw_nicholas I've not heard anything from Priti Patel yet. Do you think she's quietly plotting in the wings??, i've not heard anything from priti patel yet do you think she's quietly plotting in the wings,anything patel wing
1.4863287678910587e+18,2022-01-26 13:22:47+00:00,['1486328767891058692'],@HubNutVids No one wants to fund it or manage it properly that is why. Things aren't much better in towns cities., no one wants to fund it or manage it properly that is why things aren't much better in towns cities,thing city
1.486327993064698e+18,2022-01-26 13:19:42+00:00,['1486327993064697857'],@gawuffy @AlexHynes @LNER Wonder if the Highland Chieftain or The Clansman will make a reappearance.,   wonder if the highland chieftain or the clansman will make a reappearance,wonder highland chieftain clansman reappearance
1.4859253301162967e+18,2022-01-25 10:39:40+00:00,['1485925330116296708'],"When I was in the scouts, I had to whittle a tent peg to pass my 'knife axe' test for a badge. Against all odds I managed it without chopping off a finger or two! Sadly, the tent peg was lost years ago.",when i was in the scouts i had to whittle a tent peg to pass my knife axe test for a badge against all odds i managed it without chopping off a finger or two sadly the tent peg was lost years ago,scout tent knife test badge odds finger tent year
1.4856073165862093e+18,2022-01-24 13:36:00+00:00,['1485607316586209288'],"Julian Assange in the news again..... Can I just say I really don't care? We have a pandemic going on, much worse things in the country so I really don't see why we are worrying about a guy who isn't even a British national. Good bye Mr A!",julian assange in the news again can i just say i really don't care we have a pandemic going on much worse things in the country so i really don't see why we are worrying about a guy who isn't even a british national good bye mr a,assange news care thing country
1.48557055020655e+18,2022-01-24 11:09:54+00:00,['1485570550206550027'],"@BBCLeeds Eyup Gayle, say hi to me (cos no-one else will!) I've been absent for a while it's good to hear your dulcet tones again as I clean up! Have a good one luv!", eyup gayle say hi to me cos noone else will i've been absent for a while it's good to hear your dulcet tones again as i clean up have a good one luv,eyup gayle noone dulcet tone
1.4830120453814518e+18,2022-01-17 09:43:19+00:00,['1483012045381451780'],@LBCNews I think we need to get a grip. Kier Starmer had a drink and some food whilst WORKING with colleagues. Boris had party after party. No doubt our unbiased media will report it properly. Remember who is behind our media....., i think we need to get a grip kier starmer had a drink and some food whilst working with colleagues boris had party after party no doubt our unbiased media will report it properly remember who is behind our media,grip kier starmer drink food colleague boris party party doubt medium medium
1.4827077130586522e+18,2022-01-16 13:34:00+00:00,['1482707713058652164'],"@eltomas87 @TracyBrabin @MetroTravelNews @WYP_Dewsbury On Friday night the police finally did turn up as some of the scroats were carrying knives! They (well,pcsos) turned up last night also.Most of them seem to jump on either 126/7 or 280.Police need to start following those buses seeing who's on them.",    on friday night the police finally did turn up as some of the scroats were carrying knives they wellpcsos turned up last night alsomost of them seem to jump on either or need to start following those buses seeing who's on them,night police scroats knife night alsomost
1.48270656472952e+18,2022-01-16 13:29:27+00:00,['1482706564729520133'],"@addict_car This car of course,became the LADA,beloved of cheap motorists https://t.co/n2HmSVTAnW neighbours (but not thankfully my dad!) had several examples.", this car of coursebecame the ladabeloved of cheap motorists  neighbours but not thankfully my dad had several examples,coursebecame ladabeloved motorist neighbour example
1.4827059144487772e+18,2022-01-16 13:26:52+00:00,['1482705914448777216'],"How about some action @TracyBrabin ? As WY mayor it is up to you to act.People are not going to use the buses (especially at night) if they don't feel safe.I suggest you liase with @MetroTravelNews @WYP_Dewsbury about https://t.co/kLsvqyZLXK,thanks.",how about some action   as wy mayor it is up to you to actpeople are not going to use the buses especially at night if they don't feel safei suggest you liase with   about ,action mayor night suggest
1.482507290821501e+18,2022-01-16 00:17:36+00:00,['1482507290821500933'],Dewsbury bus stn is a scary place at night recently. Gangs of angry youths roaming around causing (cont) https://t.co/f7yEFdqDTl,dewsbury bus stn is a scary place at night recently gangs of angry youths roaming around causing cont ,dewsbury place night gang youth cont
1.4824481634243256e+18,2022-01-15 20:22:39+00:00,['1482448163424325637'],@RichOllerenshaw @mark4dewsbury So that's what he looks like! First time I've seen him. Any comment @mark4dewsbury ??,  so that's what he looks like first time i've seen him any comment  ,time comment
1.4819105865229722e+18,2022-01-14 08:46:31+00:00,['1481910586522972163'],"Just heard Boris Johnson described as a ""historic"" prime minister. Well,he's certainly that. @LBCNews @NickFerrariLBC But not for the reasons this guy is ranting about.",just heard boris johnson described as a historic prime minister wellhes certainly that   but not for the reasons this guy is ranting about,boris johnson minister wellhes reason
1.4819075149880156e+18,2022-01-14 08:34:18+00:00,['1481907514988015617'],@EdwardJDavey @SimonUbsdell Someone told me (dunno if it's true) that Dick's father was a lecturer at Oxford when Boris was there. That would be a remarkable coincidence wouldn't it??,  someone told me dunno if it's true that dick's father was a lecturer at oxford when boris was there that would be a remarkable coincidence wouldn't it,someone father lecturer oxford boris coincidence
1.4812408124700836e+18,2022-01-12 12:25:04+00:00,['1481240812470083587'],Boris is a dead PM walking. It is merely a matter of time..... #BorisResign #BorisTheLiar,boris is a dead pm walking it is merely a matter of time  ,boris matter time
1.4810113937385144e+18,2022-01-11 21:13:26+00:00,['1481011393738514432'],@VickiExplores I want one!! (As long as someone else does the digging!), i want one as long as someone else does the digging,someone digging
1.481007685847896e+18,2022-01-11 20:58:42+00:00,['1481007685847896066'],@ProjWeToldYouSo @metpoliceuk The establishment is closing ranks.,  the establishment is closing ranks,establishment rank
1.4809734941711852e+18,2022-01-11 18:42:50+00:00,['1480973494171185152'],"@mrjamesob This govt stinks,but they are all well leeward of the smell. It's us who need nose pegs.", this govt stinksbut they are all well leeward of the smell it's us who need nose pegs,govt stinksbut leeward smell
1.4805842485789532e+18,2022-01-10 16:56:07+00:00,['1480584248578953219'],"@will_perryy Just watched you on @BBCNews and I cannot believe people can be so unkind. Bravo for speaking up and all the very best for the future,in sport as with life.", just watched you on  and i cannot believe people can be so unkind bravo for speaking up and all the very best for the futurein sport as with life,cannot people bravo futurein sport life
1.47954748369297e+18,2022-01-07 20:16:23+00:00,['1479547483692969990'],"@BBCRadio2 Garry, can you please play anything by Debbie Gibson? I had such a crush on her back in the day! Cheers HNY 2022!!", garry can you please play anything by debbie gibson i had such a crush on her back in the day cheers hny,garry anything gibson crush back cheer
1.4793805717175255e+18,2022-01-07 09:13:08+00:00,['1479380571717525506'],@BBCLeeds The moons of Jupiter!, the moons of jupiter,moon jupiter
1.4788154597137203e+18,2022-01-05 19:47:35+00:00,['1478815459713720320'],"@BusSafetyRep @TfL I thought all companies were desperate for drivers down there? As with other parts of the country. I think they want faceless ""yes sir no sir"" candidates they can use abuse as they please. Good luck in your quest,I hope you find employment soon.",  i thought all companies were desperate for drivers down there as with other parts of the country i think they want faceless yes sir no sir candidates they can use abuse as they please good luck in your questi hope you find employment soon,company driver part country candidate abuse luck questi employment
1.477338303586259e+18,2022-01-01 17:57:53+00:00,['1477338303586258946'],@DaneTank656 Brilliant. Imagine that on Network Rail!, brilliant imagine that on network rail,imagine network rail
1.4770693666423644e+18,2022-01-01 00:09:14+00:00,['1477069366642364417'],Happy New Year everyone!,happy new year everyone,year everyone
1.4761517405967237e+18,2021-12-29 11:22:55+00:00,['1476151740596723714'],@PeterStefanovi2 @reece_dinsdale @reid6peter @NevilleSouthall @CAA_Official @RealGaryWebster @masato_jones @BarringtonMole @campbellclaret Boris is a liar. He's corrupt and rapidly becoming a liability. The sooner the Conservative party oust him the better.,         boris is a liar he's corrupt and rapidly becoming a liability the sooner the conservative party oust him the better,boris corrupt liability party
1.4750280798400512e+18,2021-12-26 08:57:53+00:00,['1475028079840051201'],"Good morning all. I hope you enjoyed your Christmas, whatever you did. If you're heading to the sales,chilling with family friends or heading to the pub have a safe steady day. And if you're driving a bus,keep your cool treat everyone as an idiot you won't go wrong!",good morning all i hope you enjoyed your christmas whatever you did if you're heading to the saleschilling with family friends or heading to the pub have a safe steady day and if you're driving a buskeep your cool treat everyone as an idiot you won't go wrong,morning christmas heading family friend treat everyone idiot
1.47472022516582e+18,2021-12-25 12:34:35+00:00,['1474720225165819909'],@eltomas87 Work isn't the problem mate. There's plenty of vacancies if you fancy giving it a go., work isn't the problem mate there's plenty of vacancies if you fancy giving it a go,work problem mate plenty vacancy
1.474519934059303e+18,2021-12-24 23:18:42+00:00,['1474519934059302912'],@eltomas87 I'd swap you for my life right now. Merry Christmas., i'd swap you for my life right now merry christmas,swap life christmas
1.472624302239408e+18,2021-12-19 17:46:08+00:00,['1472624302239408132'],"@34020seaton Of course not. I do believe respect has to be earned though,I show it to other people and hope it is reciprocated.", of course not i do believe respect has to be earned thoughi show it to other people and hope it is reciprocated,course respect show people
1.4724818700300288e+18,2021-12-19 08:20:09+00:00,['1472481870030028802'],I think I've heard it all now..... Apparently the Beano comic is changing the names of some of The Bash Street Kids to make them politically correct. Fatty is now Freddie Spotty is now Scotty. I give up! 🙄,i think i've heard it all now apparently the beano comic is changing the names of some of the bash street kids to make them politically correct fatty is now freddie spotty is now scotty i give up ,beano comic name street fatty spotty
