id,created_at,edit_history_tweet_ids,text,clean_text,nouns
1.5647257474529894e+18,2022-08-30 21:24:24+00:00,['1564725747452989440'],Hmm. No mention of @eiecampaign at Manchester on @BBCRadio4 news tonight. I wonder why. #biasedmedia,hmm no mention of  at manchester on  news tonight i wonder why ,mention manchester news tonight
1.5636574519074734e+18,2022-08-27 22:39:22+00:00,['1563657451907473409'],@snowleopardess @acgrayling She doesn't give a f*ck about anything about becoming pm. I'm wondering how many diehard tories are wishing JRM or Patel had thrown their hats in the ring!,  she doesn't give a fck about anything about becoming pm i'm wondering how many diehard tories are wishing jrm or patel had thrown their hats in the ring,anything diehard tory patel ring
1.5636570124661228e+18,2022-08-27 22:37:37+00:00,['1563657012466122752'],@BBCRadio2 I'm old enough to remember mullet haircuts first time round; now they're coming back! Recently I turned 51....., i'm old enough to remember mullet haircuts first time round now they're coming back recently i turned,mullet haircut time round
1.562406121041789e+18,2022-08-24 11:47:02+00:00,['1562406121041788928'],"@Normanjam671 So the govt can say,""look how many new doctors we've employed!"" Vote for us!!", so the govt can saylook how many new doctors we've employed vote for us,govt doctor vote
1.561912855296983e+18,2022-08-23 03:06:58+00:00,['1561912855296983041'],"@PeterStefanovi2 Her snooty, sneering arrogance and haughty manner make her the most hated amongst politicians. I hope she's proud of herself.", her snooty sneering arrogance and haughty manner make her the most hated amongst politicians i hope she's proud of herself,snooty arrogance haughty manner amongst politician proud
1.5617933114212024e+18,2022-08-22 19:11:56+00:00,['1561793311421202432'],@LordAshcroft The party faithful must feel they are caught between a rock a hard place. I wonder how many wish JRM or Patel had stood for leadership., the party faithful must feel they are caught between a rock a hard place i wonder how many wish jrm or patel had stood for leadership,party faithful rock place patel leadership
1.5617727084966584e+18,2022-08-22 17:50:04+00:00,['1561772708496658434'],He spoke the truth. People need to listen. https://t.co/IvDPacQgkG,he spoke the truth people need to listen ,truth people
1.5613260875310203e+18,2022-08-21 12:15:21+00:00,['1561326087531020296'],@eltomas87 Right.Good luck!, rightgood luck,rightgood luck
1.5613073553499095e+18,2022-08-21 11:00:55+00:00,['1561307355349909504'],@eltomas87 Usual farce.I had to get special exemption from them to keep working when my licence expired.A whole hour on the phone! Good luck., usual farcei had to get special exemption from them to keep working when my licence expireda whole hour on the phone good luck,farcei exemption licence hour phone luck
1.5612787074608742e+18,2022-08-21 09:07:05+00:00,['1561278707460874241'],"@eltomas87 You not trying buses again? Got to be careful with promotion,usually more stress without the reward.", you not trying buses again got to be careful with promotionusually more stress without the reward,stress reward
1.5612444123568292e+18,2022-08-21 06:50:49+00:00,['1561244412356829193'],"Jeez. Feel shite right now.Can't tell anyone on Facebook that though,close family will basically tell me to man up,as they are suffering too. Hate it when I feel I can't even talk to them without them having a go at me. Families can be awful sometimes.",jeez feel shite right nowcant tell anyone on facebook that thoughclose family will basically tell me to man upas they are suffering too hate it when i feel i can't even talk to them without them having a go at me families can be awful sometimes,jeez nowcant anyone facebook family family
1.5605612941507338e+18,2022-08-19 09:36:21+00:00,['1560561294150733824'],Why oh why are @UKLabour being so quiet over the recent @RMTunion strikes? Is it because they're ashamed of the working class?,why oh why are  being so quiet over the recent  strikes is it because they're ashamed of the working class,strike class
1.5602248938950738e+18,2022-08-18 11:19:36+00:00,['1560224893895073793'],"Well after todays announcement from the Bank of England , there is something very very very wrong (cont) https://t.co/eRUsv7vc16",well after todays announcement from the bank of england  there is something very very very wrong cont ,today announcement bank england something cont
1.558825476319232e+18,2022-08-14 14:38:49+00:00,['1558825476319232002'],@WestRidingLRR Thank you for responding. I'll be back in the West very soon. It will always remain one of my favourite pubs., thank you for responding i'll be back in the west very soon it will always remain one of my favourite pubs,thank west
1.558824701769785e+18,2022-08-14 14:35:45+00:00,['1558824701769785344'],@eltomas87 @WestRidingLRR Nail on head Tom!,  nail on head tom,nail head
1.5588245519366636e+18,2022-08-14 14:35:09+00:00,['1558824551936663557'],"@WestRidingLRR I tried the dark ""coffee"" mild last night which was ok but not outstanding.I don't like Landlord (never have) but would like to see more traditional ales.Thank you for your response.", i tried the dark coffee mild last night which was ok but not outstandingi don't like landlord never have but would like to see more traditional alesthank you for your response,coffee mild night landlord alesthank response
1.558716386872103e+18,2022-08-14 07:25:20+00:00,['1558716386872102913'],@virgosam70 @ollyo9 Never happen. Truss would be taken to the cleaners by Martin Lewis Mick Lynch would wipe the floor with Rishi. And they know it.,  never happen truss would be taken to the cleaners by martin lewis mick lynch would wipe the floor with rishi and they know it,truss cleaner martin lewis mick lynch floor rishi
1.5587085768976955e+18,2022-08-14 06:54:18+00:00,['1558708576897695745'],Had a few ales in @WestRidingLRR last night. A bar full of beer most people have never heard of.None very rateable but in good condition.Why can't they get some more mainstream ales on instead of flowery IPAs that smell like a hip garden?,had a few ales in  last night a bar full of beer most people have never heard ofnone very rateable but in good conditionwhy can't they get some more mainstream ales on instead of flowery ipas that smell like a hip garden,night beer people ofnone conditionwhy flowery ipas garden
1.5583783769178194e+18,2022-08-13 09:02:12+00:00,['1558378376917819392'],"""Politicians diapers should be changed frequently and for the same reason."" Mark Twain.",politicians diapers should be changed frequently and for the same reason mark twain,politician diaper reason mark twain
1.5583508839261798e+18,2022-08-13 07:12:58+00:00,['1558350883926179840'],"Seriously, why all the talk about Salman Rushdie? The country is in a right mess this is top of the news?! There are far worse things going on in the world.",seriously why all the talk about salman rushdie the country is in a right mess this is top of the news there are far worse things going on in the world,talk salman country mess news thing world
1.557351279793705e+18,2022-08-10 13:00:53+00:00,['1557351279793704963'],So whilst I sit here contemplating the sad state of the UK railways at the moment The Truth Behind (cont) https://t.co/11wzJYmElY,so whilst i sit here contemplating the sad state of the uk railways at the moment the truth behind cont ,state railway moment truth cont
1.557275010036912e+18,2022-08-10 07:57:49+00:00,['1557275010036912128'],"Funny, but this is the way we are going... A man calls Pizza hut to order a pizza... CALLER: Is (cont) https://t.co/IwKS7RudkS",funny but this is the way we are going a man calls pizza hut to order a pizza caller is cont ,order pizza caller
1.5570093302511206e+18,2022-08-09 14:22:06+00:00,['1557009330251120641'],"@Joker7797965060 @JedKendray @ColasRailUK Same loco, same train. Only yesterday! Thornhill LNW Jct. My photo. https://t.co/XMegcMOZhI",   same loco same train only yesterday thornhill lnw jct my photo ,loco train yesterday photo
1.5546001906817966e+18,2022-08-02 22:49:03+00:00,['1554600190681796608'],"@thecarfactoids @neilmbriscoe @t2stu @DarraghMcKenna @TopOfTheTower @StvCr @TalbotGroupe @Rootes_Group @jertownsend @mrtn76 @PracticalClass @classicretromod Shh,are those the tappets rattling I hear? Or is it the corrosion?",            shhare those the tappets rattling i hear or is it the corrosion,tappet hear corrosion
1.5545998586438203e+18,2022-08-02 22:47:44+00:00,['1554599858643820544'],Just been told (indirectly) that I'm the worst bus driver ever. (I didn't think anyone else knew that!) But..... I remember faces-always. And the next time I see this piece of monkey sh*t at a bus stop; I'll show him what the worst bus driver ever is capable of! 😡,just been told indirectly that i'm the worst bus driver ever i didn't think anyone else knew that but i remember facesalways and the next time i see this piece of monkey sht at a bus stop i'll show him what the worst bus driver ever is capable of ,driver anyone facesalways time piece stop show driver
1.5543690692012114e+18,2022-08-02 07:30:39+00:00,['1554369069201211394'],@christianwolmar They have said in the past that they have so much money they don't know what to do with it. I can think of a few ideas., they have said in the past that they have so much money they don't know what to do with it i can think of a few ideas,past money idea
1.554157596910801e+18,2022-08-01 17:30:20+00:00,['1554157596910800896'],The only useful Tory is a LavaTory!,the only useful tory is a lavatory,tory lavatory
1.554017630603944e+18,2022-08-01 08:14:10+00:00,['1554017630603943936'],A bit of light reading about the Network Rail deal on offer... THE TRUTH ABOUT THE NETWORK RAIL (cont) https://t.co/1kzG39WqgZ,a bit of light reading about the network rail deal on offer the truth about the network rail cont ,network rail deal offer truth network rail cont
1.553851049160622e+18,2022-07-31 21:12:13+00:00,['1553851049160622080'],@KevinPascoe I thought that when Blair was in charge. I think it now sometimes. I never thought it under @jeremycorbyn, i thought that when blair was in charge i think it now sometimes i never thought it under ,blair charge
1.552572398360318e+18,2022-07-28 08:31:19+00:00,['1552572398360317955'],Doctor Who star and The Wombles narrator Bernard Cribbins dies aged 93 https://t.co/qIBiCprixv Sent via @updayUK,doctor who star and the wombles narrator bernard cribbins dies aged  sent via ,doctor star wombles cribbins sent
1.5525546442405683e+18,2022-07-28 07:20:46+00:00,['1552554644240568320'],@TracyBrabin Both she Ritchie Sunak promised the moon on a stick. We'll see what actually happens. (Which won't be much!), both she ritchie sunak promised the moon on a stick we'll see what actually happens which won't be much,sunak moon
1.551891484445741e+18,2022-07-26 11:25:37+00:00,['1551891484445741058'],@ScanlanWithAnA @Normanjam671 This man is shaping up to be another Blair. A Tory in @UKLabour clothing.,  this man is shaping up to be another blair a tory in  clothing,blair tory clothing
1.5516628585591685e+18,2022-07-25 20:17:08+00:00,['1551662858559168513'],@paulasherriff I'm not watching. Just another Tory PM. Nothing will change., i'm not watching just another tory pm nothing will change,tory nothing
1.55076134884121e+18,2022-07-23 08:34:51+00:00,['1550761348841209857'],"@GarethJenkins6 @kilsman_14 @AngelaRayner Any Tory in the last 12 years,""Because of the mistakes of the previous Labour govt....."" Funny how they forget it was their banking friends who actually caused the crash needed bailing out.....",   any tory in the last yearsbecause of the mistakes of the previous labour govt funny how they forget it was their banking friends who actually caused the crash needed bailing out,tory yearsbecause mistake labour govt banking friend crash
1.5488836296354734e+18,2022-07-18 04:13:28+00:00,['1548883629635473409'],"What happens to a piece of paper if the sun is shining on it through the glass? It will burn, (cont) https://t.co/Vj6OwKvn50",what happens to a piece of paper if the sun is shining on it through the glass it will burn cont ,piece paper glass
1.5466097314810757e+18,2022-07-11 21:37:49+00:00,['1546609731481075717'],@reece_dinsdale @SuellaBraverman The old tory excuse again.,  the old tory excuse again,tory excuse
1.5461496451094036e+18,2022-07-10 15:09:36+00:00,['1546149645109403653'],"@GBNEWS Can't I vote for ""none of the above?""", can't i vote for none of the above,vote none
1.5460499107846267e+18,2022-07-10 08:33:17+00:00,['1546049910784626690'],"@idriveaclassic @car_british I had a Chevette as my first car.A black estate nicknamed the ""Hearse"" lol.FCK 698Y.I shall look forward to watching it.",  i had a chevette as my first cara black estate nicknamed the hearse lolfck shall look forward to watching it,chevette estate hearse
1.545289832120963e+18,2022-07-08 06:13:00+00:00,['1545289832120963076'],Boris Johnson needs to go (and comb his hair) now!,boris johnson needs to go and comb his hair now,boris johnson hair
1.5447760834631025e+18,2022-07-06 20:11:33+00:00,['1544776083463102465'],"No mention of Jacob Rees-Mogg on the 9pm @BBCNews ..... Wonder how he feels. Or is he, like the others quietly plotting.....",no mention of jacob reesmogg on the   wonder how he feels or is he like the others quietly plotting,mention jacob reesmogg others
1.5446921392751903e+18,2022-07-06 14:37:59+00:00,['1544692139275190272'],I wonder how many Tory MPs are secretly wishing they'd voted against Boris in the recent no confidence vote and are now silently kicking themselves.,i wonder how many tory mps are secretly wishing they'd voted against boris in the recent no confidence vote and are now silently kicking themselves,boris confidence vote
1.544686719362105e+18,2022-07-06 14:16:27+00:00,['1544686719362105345'],Grant Shapps hasn't resigned because he's too busy watching Thomas the Tank Engine to learn how trains work. 😅,grant shapps hasn't resigned because he's too busy watching thomas the tank engine to learn how trains work ,grant shapps tank engine train
1.5443700536631337e+18,2022-07-05 17:18:08+00:00,['1544370053663133699'],'You have lost my confidence': Sajid Javid resigns as health secretary in letter to PM https://t.co/NKqBbzCiEQ Sent via @updayUK,you have lost my confidence sajid javid resigns as health secretary in letter to pm  sent via ,confidence sajid javid health secretary letter sent
1.5438392013089505e+18,2022-07-04 06:08:43+00:00,['1543839201308950531'],@Rob_Kimbell Tune Tunnel??, tune tunnel,tune tunnel
1.5432076698044498e+18,2022-07-02 12:19:14+00:00,['1543207669804449792'],"@David__Osland My parents had little spare cash back then.But there was always food on the table,clothes on our backs a bit of pocket money on a Friday.The word foodbank didn't exist then.", my parents had little spare cash back thenbut there was always food on the tableclothes on our backs a bit of pocket money on a fridaythe word foodbank didn't exist then,parent cash thenbut food tableclothes back pocket money fridaythe word foodbank
1.54282218223718e+18,2022-07-01 10:47:27+00:00,['1542822182237179905'],"@AnnoGalactic @UKChange Won't make any difference. The Beeb is biased, no matter who's presenting.",  won't make any difference the beeb is biased no matter who's presenting,difference beeb matter
1.5428219394205614e+18,2022-07-01 10:46:29+00:00,['1542821939420561410'],@BBCLeeds Morecambe Wise did a send up of Singin' in the rain. Where Ern danced perfectly Eric got wet! Search YouTube for it!, morecambe wise did a send up of singin in the rain where ern danced perfectly eric got wet search youtube for it,morecambe wise send singin rain search youtube
1.542417236727632e+18,2022-06-30 07:58:20+00:00,['1542417236727631873'],@stonehurstoil Les Dawson was a comedy legend-much missed.Rusty Lee is still off her rocker today!, les dawson was a comedy legendmuch missedrusty lee is still off her rocker today,dawson comedy missedrusty rocker today
1.5424166484387471e+18,2022-06-30 07:56:00+00:00,['1542416648438747138'],@Belinda34106799 @JedKendray My late mother loved that stuff.,  my late mother loved that stuff,mother stuff
1.541527159696769e+18,2022-06-27 21:01:29+00:00,['1541527159696769024'],@IanByrneMP @RMTunion Damn right.,  damn right,damn right
1.5404469580615557e+18,2022-06-24 21:29:09+00:00,['1540446958061555719'],@KevinJo49953887 @ba_bostock @RMTunion How very true. They run this country as though it were a business.,   how very true they run this country as though it were a business,country business
1.540396579232039e+18,2022-06-24 18:08:58+00:00,['1540396579232038912'],"""If you put a monkey in a palace, that palace then becomes a circus."" The best description of Boris Johnson I've heard yet.",if you put a monkey in a palace that palace then becomes a circus the best description of boris johnson i've heard yet,monkey palace palace circus description boris johnson heard
1.540091351479591e+18,2022-06-23 21:56:06+00:00,['1540091351479590913'],That woman hasn't a bloody clue! #bbcqt,that woman hasn't a bloody clue ,woman clue
1.5398541317409423e+18,2022-06-23 06:13:28+00:00,['1539854131740942337'],"Rail workers view on the current strikes…. Three years ago we accepted a 0% pay rise, two years (cont) https://t.co/ncUPfhzKdB",rail workers view on the current strikes three years ago we accepted a  pay rise two years cont ,worker strike year rise year
1.539504456659882e+18,2022-06-22 07:03:59+00:00,['1539504456659881991'],@PeterStefanovi2 Bloody snowflakes need to grow up., bloody snowflakes need to grow up,bloody snowflake
1.5392108353730437e+18,2022-06-21 11:37:14+00:00,['1539210835373043713'],"Getting fed up of the biased coverage by BBC radio of the rail strikes. Disruption, inconvenience (cont) https://t.co/zB8objY28k",getting fed up of the biased coverage by bbc radio of the rail strikes disruption inconvenience cont ,coverage radio rail strike disruption inconvenience cont
1.5391442437756682e+18,2022-06-21 07:12:38+00:00,['1539144243775668224'],"Yet again, totally unbiased coverage of @RMTunion dispute on @BBCr4today All talk of disruption and effects on commuters. No mention of workers fighting for their working lives-again.",yet again totally unbiased coverage of  dispute on  all talk of disruption and effects on commuters no mention of workers fighting for their working livesagain,coverage dispute talk disruption effect commuter mention worker working livesagain
1.5369687518449377e+18,2022-06-15 07:08:00+00:00,['1536968751844937728'],@Otto_English Who the heck is Tom Harwood??, who the heck is tom harwood,heck harwood
1.5337092057602703e+18,2022-06-06 07:15:44+00:00,['1533709205760270338'],So there will be a vote of no confidence in Boris after all..... We wait with bated breath.,so there will be a vote of no confidence in boris after all we wait with bated breath,vote confidence boris breath
1.5329886607774597e+18,2022-06-04 07:32:32+00:00,['1532988660777459712'],@David__Osland Michael Eavis would surely sling him in a sileage pit!, michael eavis would surely sling him in a sileage pit,michael eavis sileage
1.5329866162219254e+18,2022-06-04 07:24:25+00:00,['1532986616221925377'],"@PeterStefanovi2 @NadineDorries Fair dos,at least he flattened his hair down for the occasion!",  fair dosat least he flattened his hair down for the occasion,fair hair occasion
1.532407673446183e+18,2022-06-02 17:03:54+00:00,['1532407673446182917'],Am I the only person who thinks it's just a bit convenient that Randy Andy has caught covid the day before mummy's big do? #RoyalFamily #princeandrew,am i the only person who thinks it's just a bit convenient that randy andy has caught covid the day before mummy's big do  ,person randy andy covid
1.5320548173001523e+18,2022-06-01 17:41:47+00:00,['1532054817300152320'],Seems the Monkeypox has been with us for some time..... https://t.co/rn59EDVSZi,seems the monkeypox has been with us for some time ,monkeypox time
1.5319664177461576e+18,2022-06-01 11:50:31+00:00,['1531966417746157569'],@TimothyTaylors @mikeroebuck53 @eltomas87 @nwoodhouse1961 I'd call my lodge Dorothy's Place after my late mother.,    i'd call my lodge dorothy's place after my late mother,call lodge place mother
1.5319212782815887e+18,2022-06-01 08:51:09+00:00,['1531921278281588736'],"Well,the chickens have finally come home to roost.People's holidays are being cancelled due to (cont) https://t.co/RF12MZeDjA",wellthe chickens have finally come home to roostpeoples holidays are being cancelled due to cont ,wellthe chicken home holiday
1.5308679945235784e+18,2022-05-29 11:05:46+00:00,['1530867994523578368'],@martindvz @terrychristian Britain isn't breaking international law. Its government is. Don't blame the people for its governments' failings.,  britain isn't breaking international law its government is don't blame the people for its governments failings,britain government people government failing
1.5298730566671606e+18,2022-05-26 17:12:15+00:00,['1529873056667160577'],@BBCRadio2 My instructor had me fill the car with petrol (he paid of course!) And we would regularly drop off groceries at his mum's house! Passed 2nd time btw., my instructor had me fill the car with petrol he paid of course and we would regularly drop off groceries at his mum's house passed time btw,instructor petrol course grocery house time
1.5298251545319383e+18,2022-05-26 14:01:54+00:00,['1529825154531938305'],Well I booked off work today for only the second time in 24 years. The previous time was around 14 (cont) https://t.co/A7efM7ngCc,well i booked off work today for only the second time in years the previous time was around cont ,work today time year time
1.529824890139734e+18,2022-05-26 14:00:51+00:00,['1529824890139734016'],@BBCRadio2 Hi Steve. Please say hi to me to cheer me up as I'm in considerable pain with a bad back waiting for the doctor to ring! A shout would be a big boost. Cheers!!, hi steve please say hi to me to cheer me up as i'm in considerable pain with a bad back waiting for the doctor to ring a shout would be a big boost cheers,please pain doctor shout boost cheer
1.5284221597894656e+18,2022-05-22 17:06:54+00:00,['1528422159789465602'],I'm not much of a footballist but Well Done Leeds Utd! #LeedsUnited #football,i'm not much of a footballist but well done leeds utd  ,footballist leeds
1.5283770914268652e+18,2022-05-22 14:07:49+00:00,['1528377091426865154'],@eltomas87 Oh right! I guess you could try again in the future., oh right i guess you could try again in the future,guess future
1.5283743371196047e+18,2022-05-22 13:56:52+00:00,['1528374337119604738'],@eltomas87 Saw one once featuring one of our old buses in a demolition derby! Any news on your application yet?, saw one once featuring one of our old buses in a demolition derby any news on your application yet,demolition news application
1.5283658043786404e+18,2022-05-22 13:22:58+00:00,['1528365804378640384'],Formula one is really boring! (I'm in someone else's house so I can't turn it off!) #SpanishGP #Formula1 #fallingasleep,formula one is really boring im in someone else's house so i can't turn it off   ,formula someone house
1.5279451269071913e+18,2022-05-21 09:31:20+00:00,['1527945126907191297'],@LozzaFox @thereclaimparty You make a very good point sir. We'll have people identifying as vegetables or fruit before long. I give up!,  you make a very good point sir we'll have people identifying as vegetables or fruit before long i give up,point people vegetable fruit
1.527915750912057e+18,2022-05-21 07:34:36+00:00,['1527915750912057346'],@paulwaugh @Hardeep216 @BorisJohnson Could have told them that before the election. You couldn't pay me to vote tory.,   could have told them that before the election you couldn't pay me to vote tory,election tory
1.523632821893763e+18,2022-05-09 11:55:47+00:00,['1523632821893763074'],"A couple of pics of @Southern_Vectis buses in Yarmouth bus stn today. What struck me was how smart the buses are,inside out. Other companies could take a leaf out of their book. https://t.co/8iAu5Gu72j",a couple of pics of  buses in yarmouth bus stn today what struck me was how smart the buses areinside out other companies could take a leaf out of their book ,couple yarmouth today company leaf book
1.523181714289619e+18,2022-05-08 06:03:14+00:00,['1523181714289618944'],@tomhfh Are we not making a mountain out of a molehill? @BBCr4today making it top of news again., are we not making a mountain out of a molehill  making it top of news again,mountain molehill news
1.522487590921855e+18,2022-05-06 08:05:02+00:00,['1522487590921854976'],@JeremyVineOn5 No bias there Jezza eh? Think you need to open your eyes a bit matey., no bias there jezza eh think you need to open your eyes a bit matey,bias think matey
1.5224872082923643e+18,2022-05-06 08:03:31+00:00,['1522487208292364293'],"Seen on a local estate and sporting a local reg, was this rather nice Moggie. https://t.co/ADfXPjpdi4",seen on a local estate and sporting a local reg was this rather nice moggie ,estate moggie
1.5224718361388524e+18,2022-05-06 07:02:26+00:00,['1522471836138852352'],One can only ponder what @UKLabour might have achieved if @Jeremycorbyn was still party leader. #whatmighthavebeen,one can only ponder what  might have achieved if  was still party leader ,party leader
1.5224676731453317e+18,2022-05-06 06:45:54+00:00,['1522467673145331712'],So.... The Tories have had a right a*se kicking in the local elections. Labour have done well but could have done better. They need to fear the challenge from the LibDems the Greens. (And also the independents) #LocalElections22 #labourparty,so the tories have had a right ase kicking in the local elections labour have done well but could have done better they need to fear the challenge from the libdems the greens and also the independents  ,tory election challenge libdems green independent
