id,created_at,edit_history_tweet_ids,text,clean_text,nouns
1.4737455478907658e+18,2021-12-22 20:01:34+00:00,['1473745547890765832'],@Smiler_Quinn @LNER @flowergirl_lon @penaltyfare Sponge base=CAKE! https://t.co/cFa0lWhKyJ,    sponge basecake ,sponge basecake
1.4737268731632476e+18,2021-12-22 18:47:21+00:00,['1473726873163247621'],"@alexs1790 Welcome to the grade, you'll never want to leave! https://t.co/1X3YbBgHUc", welcome to the grade you'll never want to leave ,welcome grade
1.4737264140756992e+18,2021-12-22 18:45:32+00:00,['1473726414075699207'],@Tringonometry Pfizer yesterday and headache is starting., pfizer yesterday and headache is starting,pfizer yesterday headache
1.4736978193117143e+18,2021-12-22 16:51:54+00:00,['1473697819311714312'],@BorderAdventure Welcome to the 15G club!, welcome to the club,welcome club
1.4736715567904645e+18,2021-12-22 15:07:33+00:00,['1473671556790464514'],@archer_rs It isn't Christmas until we see Professor Snape being thrown off a skyscraper! https://t.co/lmDrrZ2bq8, it isn't christmas until we see professor snape being thrown off a skyscraper ,christmas snape skyscraper
1.4733228950027717e+18,2021-12-21 16:02:05+00:00,['1473322895002771460'],"@BorderAdventure @CarolineJosephs Not sure ANYONE deserves that...but for those morons, I'll make an exception. https://t.co/CpWh7P492O",  not sure anyone deserves thatbut for those morons i'll make an exception ,anyone thatbut moron exception
1.4732405640994363e+18,2021-12-21 10:34:56+00:00,['1473240564099436554'],@CarolineJosephs @BorderAdventure Also just seen Aldi have chainsaws in the middle aisle... https://t.co/gvDs2AkrGU,  also just seen aldi have chainsaws in the middle aisle ,aldi aisle
1.4732256010917806e+18,2021-12-21 09:35:29+00:00,['1473225601091780608'],"@BorderAdventure I need names, addresses, an axe and a large wooded area for an unnamed reason... https://t.co/mz07AgRQUB", i need names addresses an axe and a large wooded area for an unnamed reason ,name area reason
1.4729582239299912e+18,2021-12-20 15:53:01+00:00,['1472958223929991170'],"@BorderAdventure Nasty sharp pointy things wielded by sadistic maniacs who enjoy stabbing and inflicting pain on victims... ...YES, I'M A WUSS! https://t.co/BruFAWiHZ6", nasty sharp pointy things wielded by sadistic maniacs who enjoy stabbing and inflicting pain on victims yes i'm a wuss ,thing maniac pain victim wuss
1.4729504994607514e+18,2021-12-20 15:22:19+00:00,['1472950499460751372'],"@archer_rs You're very jovial today Mr Archer, is it cocktail hour in the Dordogne?", you're very jovial today mr archer is it cocktail hour in the dordogne,today archer hour dordogne
1.4729141272994324e+18,2021-12-20 12:57:48+00:00,['1472914127299432465'],"@BorderAdventure I didn't realise you had a tattoo, the merest hint of a needle and I'm a quivering mess.", i didn't realise you had a tattoo the merest hint of a needle and i'm a quivering mess,realise tattoo hint quivering mess
1.4712752886885663e+18,2021-12-16 00:25:38+00:00,['1471275288688566273'],"@BorderAdventure I didn't get much choice, granted she wouldn't stay still in one place long enough to get a decent cuddle or two.", i didn't get much choice granted she wouldn't stay still in one place long enough to get a decent cuddle or two,choice place cuddle
1.4712743208444475e+18,2021-12-16 00:21:47+00:00,['1471274320844447749'],@BorderAdventure I had a young one make a dash towards me for fuss and attention yesterday despite her Dad's clear frustration at her for acting deaf. Strangers must be better than family for her., i had a young one make a dash towards me for fuss and attention yesterday despite her dad's clear frustration at her for acting deaf strangers must be better than family for her,dash fuss attention yesterday frustration deaf stranger family
1.471273215746052e+18,2021-12-16 00:17:24+00:00,['1471273215746052101'],@BorderAdventure Surely 3 collies is automatic qualification for being bonkers... I think I'm going to get the pointy man in a hat shout at me again aren't I?, surely collies is automatic qualification for being bonkers i think i'm going to get the pointy man in a hat shout at me again aren't i,qualification bonkers pointy shout
1.4712602118097715e+18,2021-12-15 23:25:43+00:00,['1471260211809771525'],"@la_riviere @Thunderbirds65 Bugger, loved that spacecraft, hated seeing destroyed twice. Are you able to say if the same puppet was used for Captain Grey? I swear they looked identical when I was a kid.",  bugger loved that spacecraft hated seeing destroyed twice are you able to say if the same puppet was used for captain grey i swear they looked identical when i was a kid,bugger spacecraft puppet captain grey
1.4711879851818598e+18,2021-12-15 18:38:43+00:00,['1471187985181859848'],"@Juppopovic Heard he had finger issues, was seen being taped up at weekend.", heard he had finger issues was seen being taped up at weekend,heard issue weekend
1.471126386257576e+18,2021-12-15 14:33:57+00:00,['1471126386257575937'],"@NaughtySeat Having overnighted in Brighton once, I know your pain...and thanks for Hughes by the way!", having overnighted in brighton once i know your painand thanks for hughes by the way,brighton painand thanks hughes
1.471125980043526e+18,2021-12-15 14:32:20+00:00,['1471125980043526148'],"@archer_rs Unless of course, she's been to the hat shop.", unless of course she's been to the hat shop,course shop
1.4707457925750702e+18,2021-12-14 13:21:36+00:00,['1470745792575070215'],"@BorderAdventure White? In the countryside? Is that wise, o wise one? https://t.co/xJTQdhauvH", white in the countryside is that wise o wise one ,countryside wise
1.4706959896106926e+18,2021-12-14 10:03:42+00:00,['1470695989610692608'],"@snaisenoul With us yes, I've actually got an ex Paddington TM with me from Thursday route learning and she's been telling me the difference between GWR and our way of doing things.", with us yes i've actually got an ex paddington tm with me from thursday route learning and she's been telling me the difference between gwr and our way of doing things,paddington route learning difference thing
1.4705014463911567e+18,2021-12-13 21:10:40+00:00,['1470501446391156740'],"@snaisenoul That's roughly what it takes at my depot with a mix of classroom and handling, 150 or so route miles and 3 types of traction.", that's roughly what it takes at my depot with a mix of classroom and handling or so route miles and types of traction,depot classroom handling mile type traction
1.4704761301468242e+18,2021-12-13 19:30:04+00:00,['1470476130146824198'],@snaisenoul Know that feeling when going back from mentoring someone for 12 weeks or so to going back to working solo., know that feeling when going back from mentoring someone for weeks or so to going back to working solo,someone week solo
1.4704334943209636e+18,2021-12-13 16:40:39+00:00,['1470433494320963588'],"@archer_rs One was a twit and forgot to get the chicken out of the freezer for roasting, so making do with pan fried beef mince in a tomato sauce served on a bed of bouled durum wheat.", one was a twit and forgot to get the chicken out of the freezer for roasting so making do with pan fried beef mince in a tomato sauce served on a bed of bouled durum wheat,twit chicken freezer beef mince tomato sauce durum wheat
1.4704305717132493e+18,2021-12-13 16:29:02+00:00,['1470430571713249286'],@RMcCarthy86 what a magnificent Distraction Duck. https://t.co/PYcokC2g2z, what a magnificent distraction duck ,distraction duck
1.4703834894260677e+18,2021-12-13 13:21:56+00:00,['1470383489426067459'],"@archer_rs As much as I hate nasty sharp pointy things, and those that seem to enjoy stabbing people with them, I'll happily go along.", as much as i hate nasty sharp pointy things and those that seem to enjoy stabbing people with them i'll happily go along,thing people
1.4701439957037056e+18,2021-12-12 21:30:17+00:00,['1470143995703705604'],"@mattingham Is it me, or can I see parts of our 390's in the photos? Hope everyone is OK.", is it me or can i see parts of our in the photos hope everyone is ok,part photo everyone
1.4701436728597422e+18,2021-12-12 21:29:00+00:00,['1470143672859742216'],"@TeatimeWithMatt 8 letter word, begins with B and ends with S.", letter word begins with b and ends with s,letter word
1.4701078935591444e+18,2021-12-12 19:06:49+00:00,['1470107893559144450'],"@RMcCarthy86 What we need, is the Red Baron von Ricthoven to invite the BumbleBuffoon to a night in the old chateaux.", what we need is the red baron von ricthoven to invite the bumblebuffoon to a night in the old chateaux,baron ricthoven bumblebuffoon night chateau
1.470089474776486e+18,2021-12-12 17:53:38+00:00,['1470089474776485892'],"@CTuckey99 @cjbearcpfc He reminds me of Scowcroft in a way, not a goalscorer, but someone who can lead to goals for others.",  he reminds me of scowcroft in a way not a goalscorer but someone who can lead to goals for others,scowcroft goalscorer someone goal others
1.4700680440514028e+18,2021-12-12 16:28:28+00:00,['1470068044051402753'],"@KevsXe When I did that, I par boiled mine for 5 minutes then baked for 30 mins.", when i did that i par boiled mine for minutes then baked for mins,mine minute
1.4700017471376015e+18,2021-12-12 12:05:02+00:00,['1470001747137601536'],"@NatWest_Help Hi, it wasn't in a branch, but Milton Keynes Central rail station. I got my cash out on the machine on the right, but the one on the left told me my PIN was wrong twice, despite knowing I entered correctly.", hi it wasn't in a branch but milton keynes central rail station i got my cash out on the machine on the right but the one on the left told me my pin was wrong twice despite knowing i entered correctly,branch milton keynes station cash machine right left
1.4699915811807396e+18,2021-12-12 11:24:38+00:00,['1469991581180739591'],"@NatWest_Help hi, just tried to use your machines at Milton Keynes Central with my HSBC card. Machine on left told me my PIN was wrong twice, but one on right worked fine. I saw the machine on left had a different card slot, is this a scanning device?", hi just tried to use your machines at milton keynes central with my hsbc card machine on left told me my pin was wrong twice but one on right worked fine i saw the machine on left had a different card slot is this a scanning device,machine milton keynes card machine left right machine left card slot device
1.469727099137237e+18,2021-12-11 17:53:41+00:00,['1469727099137236997'],"@archer_rs A Harley, or is that following the crowd?", a harley or is that following the crowd,harley crowd
1.469350545081213e+18,2021-12-10 16:57:23+00:00,['1469350545081212937'],"@BorderAdventure respect your elders they say, listen to your elders they say...I'M NOT ENTIRELY SURE WHAT I'VE JUST SEEN AND LISTENED TO! https://t.co/9KiRBhRkSb", respect your elders they say listen to your elders they sayim not entirely sure what i've just seen and listened to ,elder elder
1.4690506953661932e+18,2021-12-09 21:05:54+00:00,['1469050695366193152'],@GrahamMuz I just remembered one layout at my first Wycrail (must be about 15 years ago). It had a black box surrounding the fiddle yard entrance taking inspiration from Japanese theatre where stagehands wear all black in the hope of not being seen by the audience., i just remembered one layout at my first wycrail must be about years ago it had a black box surrounding the fiddle yard entrance taking inspiration from japanese theatre where stagehands wear all black in the hope of not being seen by the audience,layout wycrail year yard entrance inspiration theatre stagehand hope audience
1.4690462554520535e+18,2021-12-09 20:48:15+00:00,['1469046255452053506'],"The reason is, due to the folding design I've planned based on Freezer's Minories, the height of the portal can only be 70mm, which is incredibly tight given most OO models are 60mm standing on rails.",the reason is due to the folding design i've planned based on freezer's minories the height of the portal can only be which is incredibly tight given most oo models are standing on rails,reason design minories height portal model rail
1.469046253870887e+18,2021-12-09 20:48:15+00:00,['1469046253870886914'],"Modelling railways is all about compromise. It seems my latest compromise will be rather than having a tunnel as a scenic break, going the way of Fisherton Sarum (built by @GrahamMuz) and just have holes in the scenic break.",modelling railways is all about compromise it seems my latest compromise will be rather than having a tunnel as a scenic break going the way of fisherton sarum built by  and just have holes in the scenic break,railway compromise compromise tunnel break fisherton sarum hole break
1.46901103235815e+18,2021-12-09 18:28:17+00:00,['1469011032358150155'],"@BorderAdventure @tedbearrobbo1 Seconded, we need your potty mouth to brighten our day, just don't mention ice cream trucks our I shall change my mind!",  seconded we need your potty mouth to brighten our day just don't mention ice cream trucks our i shall change my mind,mouth mention cream truck mind
1.4689370195481764e+18,2021-12-09 13:34:11+00:00,['1468937019548176396'],@BorderAdventure Fuck Trumpet?! I've just erupted into a giggling fit on the train! 😂😂 Could we get a recording then if the girls are not available? https://t.co/Gkj26zy9Iv, fuck trumpet i've just erupted into a giggling fit on the train  could we get a recording then if the girls are not available ,fuck trumpet train recording girl
1.4689356947059917e+18,2021-12-09 13:28:55+00:00,['1468935694705991687'],"@MKDarlo Why on earth did they pick us? I know we're both south London, but there's better games out there.", why on earth did they pick us i know we're both south london but there's better games out there,earth london game
1.4689354557061652e+18,2021-12-09 13:27:58+00:00,['1468935455706165251'],@BorderAdventure Nobody deserves more than to be locked in a room with indestructible SGP's and your 3 fur babies than that utter cockwomble of a bumbling buffoon!, nobody deserves more than to be locked in a room with indestructible sgp's and your fur babies than that utter cockwomble of a bumbling buffoon,nobody room baby cockwomble bumbling buffoon
1.4685059611743846e+18,2021-12-08 09:01:19+00:00,['1468505961174384641'],"@Scotty_CPFC Same with my 2, my eldest is always pouring over my diagrams when I get in.", same with my my eldest is always pouring over my diagrams when i get in,eldest diagram
1.4683246717372416e+18,2021-12-07 21:00:56+00:00,['1468324671737241601'],"There are times I dislike N Gauge as I think I'd get frustrated with the size and fiddlyness of it, but I'm very jealous of the space saving it offers. A 70mm high overbridge seems too low in OO gauge. #TMRGUK",there are times i dislike n gauge as i think i'd get frustrated with the size and fiddlyness of it but i'm very jealous of the space saving it offers a high overbridge seems too low in oo gauge ,time gauge size fiddlyness space overbridge gauge
1.4679512954872177e+18,2021-12-06 20:17:16+00:00,['1467951295487217664'],"#whammageddon got had very early this year. 13:05 on the way home from work today, so thank you #JeremyVine, thank you very much you goit!", got had very early this year on the way home from work today so thank you  thank you very much you goit,year home work today
1.4679316588715745e+18,2021-12-06 18:59:14+00:00,['1467931658871574530'],@Champs707007 @bessbbe @RMcCarthy86 Someone took the wrong route at Strasbourg it seems.,   someone took the wrong route at strasbourg it seems,someone route strasbourg
1.4679162519135437e+18,2021-12-06 17:58:01+00:00,['1467916251913543680'],"@Tringonometry I once took a penalty on a professional pitch, but like true wheezy unfit kids, I put it over the bar and immediately retired from penalty duties.", i once took a penalty on a professional pitch but like true wheezy unfit kids i put it over the bar and immediately retired from penalty duties,penalty pitch wheezy penalty duty
1.4678543677264855e+18,2021-12-06 13:52:07+00:00,['1467854367726485507'],@5impleSteph Wheeled TOC bag to the ankles normally sorts that sort of bumbling about., wheeled toc bag to the ankles normally sorts that sort of bumbling about,ankle sort
1.4675446594886164e+18,2021-12-05 17:21:27+00:00,['1467544659488616448'],@5impleSteph @CountDankulaTV Glad I wasn't the only one who thought I heard Sandstorm!,  glad i wasn't the only one who thought i heard sandstorm,glad sandstorm
1.4674824128589414e+18,2021-12-05 13:14:06+00:00,['1467482412858941440'],@BorderAdventure And the specialist subject please?, and the specialist subject please,specialist please
1.4670361224549335e+18,2021-12-04 07:40:42+00:00,['1467036122454933507'],"@BorderAdventure I'm normally a tea drinker, but a quadruple super strong expresso or whatever they call it is needed. In at midnight and up at 5 with youngest. https://t.co/4vDe75Otim", i'm normally a tea drinker but a quadruple super strong expresso or whatever they call it is needed in at midnight and up at with youngest ,drinker super expresso midnight
1.4664993881387868e+18,2021-12-02 20:07:55+00:00,['1466499388138786817'],@DriverPotter @NSE_Latchmere @GordonDudman Remind me to shoot the water tower later.,   remind me to shoot the water tower later,water tower
1.4654531629120102e+18,2021-11-29 22:50:35+00:00,['1465453162912010250'],"@levett_laura I bought similar for a housemove 4 years ago, still got loads left.", i bought similar for a housemove years ago still got loads left,year load
1.4652115926525133e+18,2021-11-29 06:50:40+00:00,['1465211592652513284'],"@NSE_Latchmere Thank you very much for that, I shall try that next time.", thank you very much for that i shall try that next time,thank time
1.4650704977424302e+18,2021-11-28 21:30:01+00:00,['1465070497742430210'],"@NSE_Latchmere This stuff, gloss first and matt to seal, but I've just seen that I think I've been a twit. It's water based acrylic, so assuming more artist than modeller. Didn't use Decal fix, is that similar to Microset/Sel? Which again like an idiot I didn't think to use. https://t.co/tKkWYGg9GJ", this stuff gloss first and matt to seal but i've just seen that i think i've been a twit it's water based acrylic so assuming more artist than modeller didn't use decal fix is that similar to microsetsel which again like an idiot i didn't think to use ,stuff gloss twit water modeller idiot
1.465067040528552e+18,2021-11-28 21:16:16+00:00,['1465067040528551948'],"How annoying! Varnish has clouded and done the exact opposite of masking the film, it's made it more prominent! Guess it means stripping the varnish and starting again! #TMRGUK https://t.co/zJ6Z5O8Ni9",how annoying varnish has clouded and done the exact opposite of masking the film it's made it more prominent guess it means stripping the varnish and starting again  ,varnish opposite film guess varnish
1.4650595552897434e+18,2021-11-28 20:46:32+00:00,['1465059555289743366'],@JohnCleese I will in exchange for a gannet on a stick., i will in exchange for a gannet on a stick,exchange gannet stick
1.4645680896060703e+18,2021-11-27 12:13:37+00:00,['1464568089606070279'],"@redmanpe @Kelly_Mason_ My first shirt, now worn by my monkeh.",  my first shirt now worn by my monkeh,shirt monkeh
1.4643149353584968e+18,2021-11-26 19:27:40+00:00,['1464314935358496775'],"@BorderAdventure Wot? No steak pie and plain chips?! Meg, you're a wrongun!", wot no steak pie and plain chips meg you're a wrongun,steak chip wrongun
1.4642600030958838e+18,2021-11-26 15:49:24+00:00,['1464260003095883786'],@gingerdavemk Looks like it's limited capacity at Euston as 12-16 are blocked all weekend and only Lines B and C available. Doesn't help it's 2 tracks between West London and Park Street., looks like it's limited capacity at euston as are blocked all weekend and only lines b and c available doesn't help it's tracks between west london and park street,look capacity euston weekend line help track london park street
1.4642440528203776e+18,2021-11-26 14:46:01+00:00,['1464244052820377623'],"@AmazonHelp not impressed Amazon, both parcels soaked from being in rain, no attempt to ring doorbell as wife has been in. I only noticed because I came home from work. Doorbell and knocker both by door. https://t.co/pQqAIuqwYY", not impressed amazon both parcels soaked from being in rain no attempt to ring doorbell as wife has been in i only noticed because i came home from work doorbell and knocker both by door ,parcel rain attempt doorbell wife home work doorbell door
1.4641684624907835e+18,2021-11-26 09:45:39+00:00,['1464168462490783755'],@gingerdavemk I think it's 2 tracks south of Watford over the weekend. Will know more when I book off at 1400 so will check for you then., i think it's tracks south of watford over the weekend will know more when i book off at so will check for you then,track south watford weekend book
1.4634370039665336e+18,2021-11-24 09:19:05+00:00,['1463437003966533633'],"@BorderAdventure It is, couldn't find a gif of Thomas getting stuck with Terence dragging him out.", it is couldn't find a gif of thomas getting stuck with terence dragging him out,thomas terence
1.463436888778363e+18,2021-11-24 09:18:38+00:00,['1463436888778362880'],".@BorisJohnson morning Prime Minister, I was hoping you could tell me if this was your kind of show? Does it have safe streets? Does Daddy Pig still support Mass Transit Systems in it? https://t.co/NqQsRpq7ex", morning prime minister i was hoping you could tell me if this was your kind of show does it have safe streets does daddy pig still support mass transit systems in it ,morning minister kind show street mass transit system
1.4631601660068536e+18,2021-11-23 14:59:02+00:00,['1463160166006853633'],"@CocaCola_GB I might do, if you bring back vanilla zero multipacks! It's impossible to find and I miss my vanilla goodness!", i might do if you bring back vanilla zero multipacks it's impossible to find and i miss my vanilla goodness,vanilla zero multipacks vanilla goodness
1.463148841625174e+18,2021-11-23 14:14:02+00:00,['1463148841625174019'],"@SamsungUK hi, my employer uses you for company phones, I've requested a new handset which I was expecting Monday but still hasn't arrived. Who can I speak to about this?", hi my employer uses you for company phones i've requested a new handset which i was expecting monday but still hasn't arrived who can i speak to about this,employer company phone handset monday
1.4628438549991995e+18,2021-11-22 18:02:08+00:00,['1462843854999199753'],"@AvantiWestCoast @RMcCarthy86 @Ste_Jones75 Beans? Beans?! BEANS?! Beans are the work of Beelzebub and all his devil friends. They should be banned not only from tilting trains, but the entire planet. I hope that settles the matter. https://t.co/PynIqd7TRS",   beans beans beans beans are the work of beelzebub and all his devil friends they should be banned not only from tilting trains but the entire planet i hope that settles the matter ,bean bean bean bean work beelzebub friend train planet matter
1.4627853133324698e+18,2021-11-22 14:09:30+00:00,['1462785313332469773'],"@RexKram55112378 I wish I wasn't as young as I was as I'd have loved to have had a 50 for haulage. It's strange how having never ridden one, that I have a fondness for them.", i wish i wasn't as young as i was as i'd have loved to have had a for haulage it's strange how having never ridden one that i have a fondness for them,haulage fondness
1.461809910212137e+18,2021-11-19 21:33:36+00:00,['1461809910212136962'],"@MikeODonnell5 You always seem to know when it's soon after my payday. Doing it purely to hear the revamped Viaduct theme, one of my all-time favs.", you always seem to know when it's soon after my payday doing it purely to hear the revamped viaduct theme one of my alltime favs,payday viaduct theme alltime favs
1.4609922959736627e+18,2021-11-17 15:24:41+00:00,['1460992295973662727'],"@1701aStarship @redleaderwright I'm stunned, had the utmost repect for him, even though I sadly didn't get the chance to work with him. His guidance helped me a lot with my first trainee guard. Hope yourself and other LNER colleagues are ok.",  i'm stunned had the utmost repect for him even though i sadly didn't get the chance to work with him his guidance helped me a lot with my first trainee guard hope yourself and other lner colleagues are ok,repect chance guidance guard hope lner colleague
1.4607479489297326e+18,2021-11-16 23:13:45+00:00,['1460747948929732617'],"@BorderAdventure If she has chips and scones au naturale, then I might be possibly interested.", if she has chips and scones au naturale then i might be possibly interested,chip scone
1.4599293936236134e+18,2021-11-14 17:01:06+00:00,['1459929393623613449'],@CarolineJosephs I had that from a family of 4 with two young kids. What sort of example are the parents setting?, i had that from a family of with two young kids what sort of example are the parents setting,family sort example parent
1.459928760078279e+18,2021-11-14 16:58:35+00:00,['1459928760078278658'],@RMcCarthy86 Myself and some others think you're the author of this. https://t.co/1dI8MQyylZ, myself and some others think you're the author of this ,others author
1.45989246504192e+18,2021-11-14 14:34:21+00:00,['1459892465041920000'],"@mattymidland Sadly not for us all, but still, needs must to pay for Dapol wagons, paints, transfers, varnishes...oops, I've said too much! https://t.co/ecDjBJ7LTL", sadly not for us all but still needs must to pay for dapol wagons paints transfers varnishesoops i've said too much ,wagon paint transfer
1.4598129705994322e+18,2021-11-14 09:18:28+00:00,['1459812970599432192'],"Glad for the lad, but it makes it a lot harder now to secure him on a permanent deal. https://t.co/j9exHEJhiB",glad for the lad but it makes it a lot harder now to secure him on a permanent deal ,glad deal
