id,created_at,edit_history_tweet_ids,text,clean_text,nouns
1.3729474756324188e+18,2021-03-19 16:26:00+00:00,['1372947475632418818'],"@BeingJarley As it the orange side of my wage providers, one cannot vote the other way can I?", as it the orange side of my wage providers one cannot vote the other way can i,side wage provider cannot
1.3728227452270838e+18,2021-03-19 08:10:22+00:00,['1372822745227083779'],"@archer_rs Clearly a floozy of a dog, anything for a bit of attention and play.", clearly a floozy of a dog anything for a bit of attention and play,floozy anything attention play
1.3722300523190067e+18,2021-03-17 16:55:13+00:00,['1372230052319006724'],"@4Scotsman I remember having an Ertl Percy as a child, I'm guessing Adams removed the wheels and used a Lima chassis under the body. https://t.co/69oUBZRUtC", i remember having an ertl percy as a child i'm guessing adams removed the wheels and used a lima chassis under the body ,percy child adam wheel chassis body
1.3722217915575214e+18,2021-03-17 16:22:24+00:00,['1372221791557521414'],@IronHorseProd @Legobyteyoshi Chapter 5 of Nigel Adams' Layouts for Limited Space. https://t.co/roxUwpN2wD,  chapter of nigel adams layouts for limited space ,chapter adam layout space
1.3722215322698998e+18,2021-03-17 16:21:22+00:00,['1372221532269899781'],"@wrduckdog Chapter 5 of Layouts Limited Spaces. If you cannot read it, author said ""An Atlas diesel chassis is used to power a scratchbuilt loco based on a Wisbech and Upwell Tramway prototype...Toby with his face on each end made with Milliput."" https://t.co/rwigRMrOxs", chapter of layouts limited spaces if you cannot read it author said an atlas diesel chassis is used to power a scratchbuilt loco based on a wisbech and upwell tramway prototypetoby with his face on each end made with milliput ,chapter layout space diesel chassis power scratchbuilt loco wisbech prototypetoby face milliput
1.3721483795480123e+18,2021-03-17 11:30:41+00:00,['1372148379548012550'],@drdoak Was the vaccine delivered by Dostovei or syringe?, was the vaccine delivered by dostovei or syringe,vaccine dostovei syringe
1.3721466948681114e+18,2021-03-17 11:23:59+00:00,['1372146694868111362'],"@redleaderwright Sat impatiently waiting my turn. As much as I hate needles, I need some semblance of normality with trains full of passengers ready for tickets to be clipped.", sat impatiently waiting my turn as much as i hate needles i need some semblance of normality with trains full of passengers ready for tickets to be clipped,turn needle semblance normality train passenger ticket
1.3720902131960422e+18,2021-03-17 07:39:33+00:00,['1372090213196042242'],"@EchoesAyThGlen @wrduckdog It's from Nigel Adams' book Layouts For Limited Spaces. It's the author's model, not the BBC.",  it's from nigel adams book layouts for limited spaces it's the author's model not the bbc,adam book space model
1.3720899052879913e+18,2021-03-17 07:38:20+00:00,['1372089905287991297'],"@wrduckdog No it isn't, this is from Nigel Adams' book Layouts For Limited Spaces.", no it isnt this is from nigel adams book layouts for limited spaces,adam book space
1.3715497684937687e+18,2021-03-15 19:52:01+00:00,['1371549768493768705'],@Dr_RaulDuke @JeSuisUnDan I had no idea you'd left GWR for the purple neighbours.,  i had no idea you'd left gwr for the purple neighbours,idea purple neighbour
1.3715491992763845e+18,2021-03-15 19:49:45+00:00,['1371549199276384261'],"@rednbluegreg @JIMBOGOON I'm sure when i return to work after my long weekend, normal service will resume.",  i'm sure when i return to work after my long weekend normal service will resume,sure weekend service
1.3714409436064604e+18,2021-03-15 12:39:35+00:00,['1371440943606460417'],"@Cpfc1905Dh @akiriihilahti @MikaelForssell Yes, both started in the away game at Stockport, Mikael's last game for us. https://t.co/6HHJxaf3qC",   yes both started in the away game at stockport mikael's last game for us ,game stockport game
1.371354950505263e+18,2021-03-15 06:57:53+00:00,['1371354950505263108'],"@Nevardmedia Braver man than I painting the bell, I'm terrified I'll get paint on on the roof.", braver man than i painting the bell i'm terrified i'll get paint on on the roof,braver bell paint roof
1.371200909447897e+18,2021-03-14 20:45:47+00:00,['1371200909447897088'],"@Expl_Cookie He reminds me of Skarloey, needs a trailing axle to stabilse him.", he reminds me of skarloey needs a trailing axle to stabilse him,skarloey trailing axle
1.370707621917905e+18,2021-03-13 12:05:38+00:00,['1370707621917904897'],@ProD_Keepers Nico Vaesen for Crystal Palace against West Ham in play off final. Still amazed it got it., nico vaesen for crystal palace against west ham in play off final still amazed it got it,nico vaesen palace play
1.3699410230241075e+18,2021-03-11 09:19:26+00:00,['1369941023024107523'],"@archer_rs Well as Morgan doesn't have a platform at present, I'm not sure it's British Wind anyway.", well as morgan doesn't have a platform at present i'm not sure it's british wind anyway,morgan platform wind anyway
1.3699020113958093e+18,2021-03-11 06:44:25+00:00,['1369902011395809281'],"@redleaderwright @ndainsworth @LNER A safety brief for me, so might take big coat for solidarity.",   a safety brief for me so might take big coat for solidarity,safety brief coat solidarity
1.3696455505015726e+18,2021-03-10 13:45:20+00:00,['1369645550501572614'],"@No7Sammy Having saved Palace, I'm sure Susanna would welcome him with open arms.", having saved palace i'm sure susanna would welcome him with open arms,palace susanna
1.3696432363949916e+18,2021-03-10 13:36:08+00:00,['1369643236394991617'],@archer_rs Hope you send via carrier swan., hope you send via carrier swan,carrier swan
1.369635769460134e+18,2021-03-10 13:06:28+00:00,['1369635769460133889'],"@theterracelife @CadburyUK Mini Eggs, simply I despise both, but mini eggs the least of the two.",  mini eggs simply i despise both but mini eggs the least of the two,mini mini
1.3696284729943163e+18,2021-03-10 12:37:29+00:00,['1369628472994316288'],"@BorderAdventure Here is my mouth, please insert potato based crispy letter shapes in it. K, Thanx, BYE!", here is my mouth please insert potato based crispy letter shapes in it k thanx bye,please potato letter shape
1.3695779273571942e+18,2021-03-10 09:16:38+00:00,['1369577927357194242'],"@katytoms1 @amyjayem I agree, you need it for your health and safety and to comply with Rule Book. Shouldn't come out of your pocket.",  i agree you need it for your health and safety and to comply with rule book shouldn't come out of your pocket,health safety rule book pocket
1.3695420906785628e+18,2021-03-10 06:54:13+00:00,['1369542090678562819'],"@CatFankles Thank you, it's the morons who wear chin hammocks as soon as they step onboard that really rile me up. Wish we'd get issued with cattle prods to sort them out.", thank you it's the morons who wear chin hammocks as soon as they step onboard that really rile me up wish we'd get issued with cattle prods to sort them out,thank moron hammock cattle prod
1.3695403306101228e+18,2021-03-10 06:47:14+00:00,['1369540330610122753'],"@CatFankles Having lost 3 colleagues in a week, I know how you feel.", having lost colleagues in a week i know how you feel,colleague week
1.3693818258697093e+18,2021-03-09 20:17:23+00:00,['1369381825869709325'],"@DennisHaysbert I'm refreshing myself on the UK Disney+ service, although I have all the DVD's under the TV. Even have a piece of your costume. https://t.co/TmhLJ8wUkv", i'm refreshing myself on the uk disney service although i have all the dvd's under the tv even have a piece of your costume ,disney service piece costume
1.369355379667243e+18,2021-03-09 18:32:18+00:00,['1369355379667243012'],Rapido announce Titfield Thunderbolt the day after Hornby announce Lion? Something tells me Hornby were wanting to be first past the post. #TMRGUK,rapido announce titfield thunderbolt the day after hornby announce lion something tells me hornby were wanting to be first past the post ,rapido announce hornby announce lion something tell post
1.3692519404844564e+18,2021-03-09 11:41:16+00:00,['1369251940484456450'],@archer_rs Alpaca breeding for beginners?, alpaca breeding for beginners,alpaca breeding beginner
1.369019739230638e+18,2021-03-08 20:18:35+00:00,['1369019739230638085'],"@deedee10780561 You haven't screwed anyone, you've done the right thing for you and your passengers safety. Hope you get well soon.", you haven't screwed anyone you've done the right thing for you and your passengers safety hope you get well soon,anyone thing passenger safety
1.368892127812391e+18,2021-03-08 11:51:30+00:00,['1368892127812390921'],"@CountBinface Iain Dowie? The manager who was released from contract to return to the north but yet found his way to Charlton? I'm afraid Count, my vote is now firmly with Lord Buckethead.", iain dowie the manager who was released from contract to return to the north but yet found his way to charlton i'm afraid count my vote is now firmly with lord buckethead,iain manager contract north count vote lord buckethead
1.3688894881985004e+18,2021-03-08 11:41:01+00:00,['1368889488198500353'],"@CountBinface As a Palace fan who is considering voting for you, may I ask if you consulted us Palace fans, your electorate if we wanted The Firm running our club?", as a palace fan who is considering voting for you may i ask if you consulted us palace fans your electorate if we wanted the firm running our club,palace firm club
1.367441993240961e+18,2021-03-04 11:49:11+00:00,['1367441993240961030'],"@BorderAdventure Walls! I mean sausages, probably baked with some pasta and garlic bread.", walls i mean sausages probably baked with some pasta and garlic bread,wall sausage pasta bread
1.3674406529680955e+18,2021-03-04 11:43:52+00:00,['1367440652968095760'],"@BorderAdventure Alas, not on the meal plan for today...or in my freezer. Tomorrow be shopping day so I might go hunting.", alas not on the meal plan for todayor in my freezer tomorrow be shopping day so i might go hunting,meal plan todayor freezer tomorrow
1.36741317037414e+18,2021-03-04 09:54:39+00:00,['1367413170374139905'],@DKebabmeat Wouldn't fancy that with the high voltage wire above the train. In the end they coaxed it down by putting a large flip top bin next to the train., wouldn't fancy that with the high voltage wire above the train in the end they coaxed it down by putting a large flip top bin next to the train,voltage wire train flip train
1.3673928401170637e+18,2021-03-04 08:33:52+00:00,['1367392840117063694'],"@RMcCarthy86 Just googled them, not sure what's worse. The livery or the loco front end!", just googled them not sure what's worse the livery or the loco front end,livery loco
1.367391348052091e+18,2021-03-04 08:27:56+00:00,['1367391348052090880'],@RMcCarthy86 Presenting The Enterprise HST! Reminds me a lot of the DART livery., presenting the enterprise hst reminds me a lot of the dart livery,enterprise dart livery
1.3671870696935342e+18,2021-03-03 18:56:13+00:00,['1367187069693534209'],"@kernowmodelrail @NSE_Latchmere I see it as a TC at full price with a 33 thrown in, so DO IT!",  i see it as a tc at full price with a thrown in so do it,price thrown
1.367185797468799e+18,2021-03-03 18:51:09+00:00,['1367185797468798981'],@c1_cunningham @HHvonBlumenthal @Hey_Lori I have seen evidence from an Avanti guard that the cat was retrieved safely.,   i have seen evidence from an avanti guard that the cat was retrieved safely,evidence guard
1.367143524928471e+18,2021-03-03 16:03:11+00:00,['1367143524928471042'],@RAIL @SirPeterHendy Said exactly the same when I went through for the first time. Stupid idea.,  said exactly the same when i went through for the first time stupid idea,time idea
1.3671422123840266e+18,2021-03-03 15:57:58+00:00,['1367142212384026629'],@SamYTFC Does it have forward facing machine guns and an ejector seat?, does it have forward facing machine guns and an ejector seat,machine ejector seat
1.3671347066643743e+18,2021-03-03 15:28:08+00:00,['1367134706664374274'],"@Hey_Lori Above that train is a 25Kv electric wire, I wouldn't fancy waving a broom at at, even a wooden one.", above that train is a electric wire i wouldn't fancy waving a broom at at even a wooden one,train wire broom
1.3671344619142144e+18,2021-03-03 15:27:10+00:00,['1367134461914214402'],"@archer_rs Mr Archer, this was from last night.", mr archer this was from last night,archer night
1.3665045561552732e+18,2021-03-01 21:44:09+00:00,['1366504556155273218'],"#TMRGUK have I just ruined a £115 model? Not in my eyes, but I'm sure there'll be some questioning why a 35 year old is making models of children's book characters. https://t.co/OA6bMt018n", have i just ruined a  model not in my eyes but i'm sure there'll be some questioning why a year old is making models of children's book characters ,model year model book character
1.3665032764647342e+18,2021-03-01 21:39:04+00:00,['1366503276464734210'],@AmazonHelp Just been informed on app it's delayed to either 2nd/3rd March. Not impressed as it said guaranteed today when I ordered., just been informed on app it's delayed to either march not impressed as it said guaranteed today when i ordered,march today
1.366024382058029e+18,2021-02-28 13:56:06+00:00,['1366024382058029057'],"Alex Scott says ""stale"", I say Alex we've gone beyond stale and are now firmly in the mouldy period. #CPFC",alex scott says stale i say alex we've gone beyond stale and are now firmly in the mouldy period ,scott stale stale period
1.3660233479901225e+18,2021-02-28 13:52:00+00:00,['1366023347990122498'],"@BackOfTheNest Disgusting, shocking home performance.", disgusting shocking home performance,home performance
1.365802684331221e+18,2021-02-27 23:15:09+00:00,['1365802684331220997'],"@deedee10780561 @LeeRender @CaptScarlet Annoyingly, ive got a very nice piece of pork in fridge for dinner tomorrow, I don't want to waste it, and roast spuds are my favourite.",   annoyingly ive got a very nice piece of pork in fridge for dinner tomorrow i don't want to waste it and roast spuds are my favourite,piece pork fridge dinner tomorrow spud
1.3658016517355725e+18,2021-02-27 23:11:03+00:00,['1365801651735572480'],@deedee10780561 @LeeRender @CaptScarlet Beginning to think same at my end. Even regular coke now disgusts me having been on Zero for around 18 months.,   beginning to think same at my end even regular coke now disgusts me having been on zero for around months,coke zero month
1.36578107607817e+18,2021-02-27 21:49:18+00:00,['1365781076078170115'],"@deedee10780561 @LeeRender @CaptScarlet Strangely I do also having had chips earlier today, really bloated and what I'd call over full.",   strangely i do also having had chips earlier today really bloated and what i'd call over full,chip today call
1.3654158293456077e+18,2021-02-26 21:37:56+00:00,['1365415829345607683'],"@CollieTrio Thanks, it took a lot to just walk away and not blow off at them. We've been told for our safety not to confront them.", thanks it took a lot to just walk away and not blow off at them we've been told for our safety not to confront them,thanks safety
1.365415114271322e+18,2021-02-26 21:35:06+00:00,['1365415114271322113'],"@CollieTrio Had two over last two days, what majorly peeved me is brother in law is a Covid nurse, and my sister is an office manager covering vaccination centres. MIL is also NHS working in doctor reception.", had two over last two days what majorly peeved me is brother in law is a covid nurse and my sister is an office manager covering vaccination centres mil is also nhs working in doctor reception,nurse sister office manager vaccination centre doctor reception
1.3654128188461056e+18,2021-02-26 21:25:58+00:00,['1365412818846105602'],@LeeRender Booked Bletchley job as the unit forms the 22:14 Euston when it gets to New Street which we work home., booked bletchley job as the unit forms the euston when it gets to new street which we work home,unit euston street home
1.3654113582217503e+18,2021-02-26 21:20:10+00:00,['1365411358221750274'],"@LeeRender No chance of Ledburn this time, working a firmly Orange land train. Feels wrong announcing WMR train. https://t.co/xWeD7XI2fe", no chance of ledburn this time working a firmly orange land train feels wrong announcing wmr train ,chance ledburn time orange land train feel train
1.3654110937666355e+18,2021-02-26 21:19:07+00:00,['1365411093766635524'],"@CollieTrio Busy pressing buttons for morons who like to keep their chins warm rather than their germs to themselves and also happen to work for the organisation fighting to keep people alive! Yes, I'm still majorly peeved at them. https://t.co/TuvgkHJHlc", busy pressing buttons for morons who like to keep their chins warm rather than their germs to themselves and also happen to work for the organisation fighting to keep people alive yes i'm still majorly peeved at them ,button moron chin germ organisation people
1.3654096848244572e+18,2021-02-26 21:13:31+00:00,['1365409684824457221'],"@timblazey @TheFactCompiler Massively changed now, changed First Class to match our other units and full internal refit.",  massively changed now changed first class to match our other units and full internal refit,class unit refit
1.3654086521826468e+18,2021-02-26 21:09:25+00:00,['1365408652182646785'],@TheFactCompiler It's the only one's we can do that with now as PIS upgrades mean we can't change displays., it's the only one's we can do that with now as pis upgrades mean we can't change displays,upgrade display
1.3654080147155476e+18,2021-02-26 21:06:53+00:00,['1365408014715547650'],#TMRGUK #PointyPencil the pencil is excited to point at something. https://t.co/lakGCrejf7,  the pencil is excited to point at something ,pencil something
1.3653792986900111e+18,2021-02-26 19:12:46+00:00,['1365379298690011145'],"@Virgos_Haircut Haven't done Britbox yet, but I'm tempted as I've always meant to try Doc Martin, but never caught it on TV.", haven't done britbox yet but i'm tempted as i've always meant to try doc martin but never caught it on tv,britbox martin
1.365378741975855e+18,2021-02-26 19:10:34+00:00,['1365378741975855108'],"@Virgos_Haircut I'm working my way through 24 on Disney (as you well know), but it does emphasise my laziness as the DVD sets are under the TV.", i'm working my way through on disney as you well know but it does emphasise my laziness as the dvd sets are under the tv,disney laziness
1.3653784861484892e+18,2021-02-26 19:09:33+00:00,['1365378486148489217'],Very hard to not rip the two heads of the morons I've seen the last two days sporting elasticated blue chin hammocks on my train wearing NHS lanyards given I have friends and family on the frontline fighting the virus. Really had to bite my tongue.,very hard to not rip the two heads of the morons i've seen the last two days sporting elasticated blue chin hammocks on my train wearing nhs lanyards given i have friends and family on the frontline fighting the virus really had to bite my tongue,head moron blue chin hammock train lanyard friend family frontline virus tongue
1.365371889066066e+18,2021-02-26 18:43:20+00:00,['1365371889066065921'],"@RAF_Luton Hang on, isn't that the USS Boaty McBoatface?", hang on isn't that the uss boaty mcboatface,hang boaty mcboatface
1.3645573371267113e+18,2021-02-24 12:46:36+00:00,['1364557337126711296'],@CottonTreeRail @mattymidland This has given me an idea for mischief on my late shift today. https://t.co/CCW7g6h2Aw,  this has given me an idea for mischief on my late shift today ,idea mischief shift today
1.3639718472226652e+18,2021-02-22 22:00:04+00:00,['1363971847222665218'],"@OfficialBHAFC Bing bong, bing bong. Bing bong, bing BONG! https://t.co/d2kXgw8ssT", bing bong bing bong bing bong bing bong ,bing bing bong
1.3639702792450335e+18,2021-02-22 21:53:50+00:00,['1363970279245033475'],"I hereby would like a very large hat, medium rare with fries and mushrooms please! https://t.co/4Anfh80pBQ",i hereby would like a very large hat medium rare with fries and mushrooms please ,medium rare mushroom
1.3639697640335032e+18,2021-02-22 21:51:47+00:00,['1363969764033503232'],"Dreadful, dreary and disgraceful. We cannot and should not play to avoid losing, especially against Brighton. It has been nothing short of shambolic tonight.",dreadful dreary and disgraceful we cannot and should not play to avoid losing especially against brighton it has been nothing short of shambolic tonight,brighton nothing tonight
1.363965326250152e+18,2021-02-22 21:34:09+00:00,['1363965326250151936'],"Well Roy, that sub makes NO SENSE! MORON! IDIOT! Just leave now. #CPFC",well roy that sub makes no sense moron idiot just leave now ,sense idiot
1.3639552301284147e+18,2021-02-22 20:54:02+00:00,['1363955230128414722'],"@BlackCatMini @RMcCarthy86 I must be the exception, there have been times I've ended up in someone's lap, or headbutting the vestibule handrails.",  i must be the exception there have been times i've ended up in someone's lap or headbutting the vestibule handrails,exception time vestibule handrail
1.3639548381707018e+18,2021-02-22 20:52:29+00:00,['1363954838170701831'],@deedee10780561 I thought the latest one had ladies teams., i thought the latest one had ladies teams,lady team
1.3639540011428372e+18,2021-02-22 20:49:09+00:00,['1363954001142837257'],"Let's not kid outselves, we are massively riding our luck, we need to kill them off with another goal. #CPFC",let's not kid outselves we are massively riding our luck we need to kill them off with another goal ,luck goal
1.3639497852465562e+18,2021-02-22 20:32:24+00:00,['1363949785246556173'],@danholling Got him on a 18 month loan from Mainz., got him on a month loan from mainz,month loan mainz
1.3638695858045665e+18,2021-02-22 15:13:43+00:00,['1363869585804566530'],"@NetworkRailEUS hi Euston, been made aware by a Conductor colleague that there is no hot water working in the male staff toilets by the LNR management offices.", hi euston been made aware by a conductor colleague that there is no hot water working in the male staff toilets by the lnr management offices,euston conductor colleague water staff toilet management office
1.363839493636313e+18,2021-02-22 13:14:08+00:00,['1363839493636313088'],@burkin_n @PdannyH @railexpress @NSE_Latchmere @Gordon_3417 @hornby I didn't have room for 4 cars on layout so was hoping to exhibit some modelling licence to run a 3 car unit.,      i didn't have room for cars on layout so was hoping to exhibit some modelling licence to run a car unit,room layout licence unit
1.3635950166529393e+18,2021-02-21 21:02:40+00:00,['1363595016652939267'],@BeingJarley But I must show loyalty to my wage provider!, but i must show loyalty to my wage provider,loyalty wage provider
1.3635936155833713e+18,2021-02-21 20:57:06+00:00,['1363593615583371269'],@PdannyH @burkin_n @railexpress @NSE_Latchmere @Gordon_3417 @hornby Would have been a miles better model had they allowed it to run as a 3 car and used thicker wires. Glad I got shot of mine years ago.,      would have been a miles better model had they allowed it to run as a car and used thicker wires glad i got shot of mine years ago,mile model thicker wire shot year
1.3635528637634642e+18,2021-02-21 18:15:10+00:00,['1363552863763464199'],"@TheStourbridge I had no idea Stourbridge was that big or popular, that must come close to MKC in terms of capacity.", i had no idea stourbridge was that big or popular that must come close to mkc in terms of capacity,idea stourbridge term capacity
1.3635451377339146e+18,2021-02-21 17:44:28+00:00,['1363545137733914624'],"@TheStourbridge You've got 4 legs George, use them. Will make you appreciate the pouches of goodness even more.", you've got legs george use them will make you appreciate the pouches of goodness even more,george pouch goodness
1.3632241018092257e+18,2021-02-20 20:28:48+00:00,['1363224101809225728'],"@mattymidland I think we will now need ""The Most Unusual Place for Pointy Pencil Tournament""! https://t.co/7LZU5NlBOv", i think we will now need the most unusual place for pointy pencil tournament ,place pointy pencil tournament
1.3632070074912645e+18,2021-02-20 19:20:52+00:00,['1363207007491264514'],@CollieTrio I thought he was the king of the potato people., i thought he was the king of the potato people,king potato people
1.362484550396506e+18,2021-02-18 19:30:05+00:00,['1362484550396506114'],"@AskeBay Hi ebay, been involved for an item that didn't sell as buyer backed out. Tried to cancel completly, but it was relisted without my knowledge, can you help please? https://t.co/nJiYcbgqSM", hi ebay been involved for an item that didn't sell as buyer backed out tried to cancel completly but it was relisted without my knowledge can you help please ,ebay item buyer knowledge
1.3620791800794522e+18,2021-02-17 16:39:17+00:00,['1362079180079452161'],"@archer_rs Told my eldest it's duck billed platypus, whereas it's sausage pasta bake.", told my eldest it's duck billed platypus whereas it's sausage pasta bake,duck whereas sausage pasta bake
1.3619325400183808e+18,2021-02-17 06:56:35+00:00,['1361932540018380800'],@mattymidland I hope the policeman has a nice pointy pencil to note this heinous crime in his notebook!, i hope the policeman has a nice pointy pencil to note this heinous crime in his notebook,policeman pointy pencil crime notebook
1.3616418916835942e+18,2021-02-16 11:41:39+00:00,['1361641891683594247'],"@redleaderwright And let's not forget The Scottish *** for its horrific Headline ""Death Express"" last year. Tabloids are beyond scum now.", and let's not forget the scottish  for its horrific headline death express last year tabloids are beyond scum now,headline death express year tabloid scum
