id,created_at,edit_history_tweet_ids,text,clean_text,nouns
1.273680587698684e+18,2020-06-18 18:14:50+00:00,['1273680587698683904'],@MattyMiller14 Fond memories of uni come flooding back with that episode. The room the armed police storm was the old computer room in the library., fond memories of uni come flooding back with that episode the room the armed police storm was the old computer room in the library,fond memory room police storm computer room library
1.273657976923005e+18,2020-06-18 16:44:59+00:00,['1273657976923004929'],@BeingCharley The boots look like ankle snappers. Hope you didn't tumble over in them., the boots look like ankle snappers hope you didn't tumble over in them,look ankle snapper
1.273518365219459e+18,2020-06-18 07:30:13+00:00,['1273518365219459072'],"@Virgos_Haircut Seen that we're getting branded reusable ones from work soon, so hoping there will be a difference with that.", seen that we're getting branded reusable ones from work soon so hoping there will be a difference with that,work difference
1.2735121092053156e+18,2020-06-18 07:05:22+00:00,['1273512109205315584'],@Virgos_Haircut It wasn't easy working trains for first time wearing one. Couldn't see front or back of train in some cases. Have heard washing in soapy water helps before putting mask on., it wasn't easy working trains for first time wearing one couldn't see front or back of train in some cases have heard washing in soapy water helps before putting mask on,train time front back train case washing water mask
1.2732326952634614e+18,2020-06-17 12:35:04+00:00,['1273232695263461381'],"@JakeNeill98 @ScotRail @northernassist From my experience, they add to ticketless travel. I found people on the train when I used to walk through would buy a ticket from last stop when they saw me, or buy tickets discounted with a railcard when they didn't have one. Personally, a very bad decision.",   from my experience they add to ticketless travel i found people on the train when i used to walk through would buy a ticket from last stop when they saw me or buy tickets discounted with a railcard when they didn't have one personally a very bad decision,experience travel people train ticket stop ticket railcard decision
1.273217815554728e+18,2020-06-17 11:35:57+00:00,['1273217815554727938'],"Holly, ever since my gran bought me the first two books, nearly 20 years ago, I've longed for a film adaptation. https://t.co/inFFzQwSFD",holly ever since my gran bought me the first two books nearly years ago i've longed for a film adaptation ,gran book year film adaptation
1.273217341380268e+18,2020-06-17 11:34:04+00:00,['1273217341380268040'],@RMcCarthy86 I have shouted a few of those when a dreaded CSL2 message comes through on phone., i have shouted a few of those when a dreaded csl message comes through on phone,message phone
1.2732169785394831e+18,2020-06-17 11:32:37+00:00,['1273216978539483136'],"@Tone7x20 It'll be fine, his name isn't Conrad, with any luck, they'd adopt him.", it'll be fine his name isn't conrad with any luck they'd adopt him,name conrad
1.2729760728633713e+18,2020-06-16 19:35:21+00:00,['1272976072863371264'],"@KatyMontgomerie My favourite was Vulpix, at least she'd keep me warm on a cold night.", my favourite was vulpix at least she'd keep me warm on a cold night,favourite night
1.2728459304259666e+18,2020-06-16 10:58:12+00:00,['1272845930425966593'],@DriverPotter @TheGasMan1985 I can think of a couple for this thread.,  i can think of a couple for this thread,couple thread
1.2725057965978583e+18,2020-06-15 12:26:38+00:00,['1272505796597858305'],"@TheThomasCritic It's strange, because I know I had the toys and a video with episodes taped from CITV, but my first memory is Thomas The Tanked Up Engine! Thanks Bobby Davro.", it's strange because i know i had the toys and a video with episodes taped from citv but my first memory is thomas the tanked up engine thanks bobby davro,strange video episode citv memory engine thanks davro
1.2723876851397427e+18,2020-06-15 04:37:18+00:00,['1272387685139742728'],"@That_Train_Guy It's your hobby, thus part of you. Keep it with one account.", it's your hobby thus part of you keep it with one account,hobby part account
1.272138192855208e+18,2020-06-14 12:05:55+00:00,['1272138192855207936'],"@paul_winginit Pork, roast potatoes and stuffing for tea!", pork roast potatoes and stuffing for tea,pork roast potato
1.2715266234147594e+18,2020-06-12 19:35:45+00:00,['1271526623414759425'],@Tringonometry Fieldmarshall Nutsack appears to have fully recovered from his attempted ball digestion., fieldmarshall nutsack appears to have fully recovered from his attempted ball digestion,nutsack ball digestion
1.270803634947752e+18,2020-06-10 19:42:51+00:00,['1270803634947751943'],@RMcCarthy86 There is an NSE bin in the Watford messroom area that I've got my eyes on. It will be coming home with me one day., there is an nse bin in the watford messroom area that i've got my eyes on it will be coming home with me one day,watford messroom area home
1.2706406933928796e+18,2020-06-10 08:55:23+00:00,['1270640693392879616'],"@AskPayPal hi, a transaction I made yesterday is showing as pending. Any idea why this is at all?", hi a transaction i made yesterday is showing as pending any idea why this is at all,transaction yesterday idea
1.2706050177923525e+18,2020-06-10 06:33:37+00:00,['1270605017792352256'],"@Virgos_Haircut I would say as an American actor and martial artist, he's never heard of them.", i would say as an american actor and martial artist he's never heard of them,actor artist
1.2705312153853788e+18,2020-06-10 01:40:21+00:00,['1270531215385378819'],"@Virgos_Haircut Austin St. John, who played Jason in the original Power Rangers.", austin st john who played jason in the original power rangers,austin john jason power ranger
1.2703187616698e+18,2020-06-09 11:36:08+00:00,['1270318761669799936'],@That_Train_Guy I think I've just had a trouser accident. We need a rake of Mk IV's in Intercity now., i think i've just had a trouser accident we need a rake of mk iv's in intercity now,accident rake intercity
1.2702226263934116e+18,2020-06-09 05:14:08+00:00,['1270222626393411584'],Go and stand in the corner of wrongness and think about all the suffering and wrongness you have brought into the world you wronguns! https://t.co/iIFSAwUPcp,go and stand in the corner of wrongness and think about all the suffering and wrongness you have brought into the world you wronguns ,corner wrongness suffering wrongness world
1.2701652182079035e+18,2020-06-09 01:26:01+00:00,['1270165218207903744'],"@RMcCarthy86 Our 150's used to occasionally have Shirley via Shirley, and yes, I am serious. I'll get my coat.", our used to occasionally have shirley via shirley and yes i am serious i'll get my coat,shirley shirley coat
1.268087511882117e+18,2020-06-03 07:49:57+00:00,['1268087511882117121'],"@RMcCarthy86 I've got my En Route and badge in a box under my bed. Never used the En Route guide, and badge never stayed right way up. A manager kept turning it the right way every time she saw me.", i've got my en route and badge in a box under my bed never used the en route guide and badge never stayed right way up a manager kept turning it the right way every time she saw me,route badge route guide badge manager time
1.267526499336323e+18,2020-06-01 18:40:41+00:00,['1267526499336323075'],@5impleSteph I nearly missed booking on because of a crash needing two fire engines. Had to head back home and use my back up route. Waiting for petrol to go back up now., i nearly missed booking on because of a crash needing two fire engines had to head back home and use my back up route waiting for petrol to go back up now,booking crash fire engine home back route petrol
1.2670501608839373e+18,2020-05-31 11:07:53+00:00,['1267050160883937281'],@RMcCarthy86 FYI I won't accept cup warmers as payment., fyi i won't accept cup warmers as payment,warmer payment
1.2669552080111985e+18,2020-05-31 04:50:35+00:00,['1266955208011198470'],"@Scotthendry7 Ringo was first two series, Michael replaced him.", ringo was first two series michael replaced him,ringo series michael
1.266759417049088e+18,2020-05-30 15:52:34+00:00,['1266759417049088000'],"#TMRGUK Before putting them on ebay, is there any interest in a Hornby Connex Networker EMU and a Hornby EWS 92?", before putting them on ebay is there any interest in a hornby connex networker emu and a hornby ews,ebay interest hornby connex networker hornby
1.2666876537030287e+18,2020-05-30 11:07:25+00:00,['1266687653703028737'],@PacerCommander @TheGasMan1985 @Woof1972 The Zero-X! I'd recognise that pointy nosecone anywhere!,   the zerox i'd recognise that pointy nosecone anywhere,zerox recognise
1.2665997325263176e+18,2020-05-30 05:18:03+00:00,['1266599732526317570'],"@That_Train_Guy Having had the CPS throw a case out of mine where I was threatened with a broken arm and being cut up because I clipped a ticket, I sadly k know the story all too well.", having had the cps throw a case out of mine where i was threatened with a broken arm and being cut up because i clipped a ticket i sadly k know the story all too well,case mine ticket story
1.2659992518317425e+18,2020-05-28 13:31:57+00:00,['1265999251831742466'],@CarolineJosephs @paul_winginit Sounds similar to us. Been told to work trains from cabs and our machines have been taken away.,  sounds similar to us been told to work trains from cabs and our machines have been taken away,train machine
1.2651682780051333e+18,2020-05-26 06:29:57+00:00,['1265168278005133312'],@That_Train_Guy @LNER Wouldn't a return portion be valid until 25th June?,  wouldn't a return portion be valid until june,return portion june
1.2650189036353782e+18,2020-05-25 20:36:24+00:00,['1265018903635378178'],"@RMcCarthy86 Let's faces it, you only watch it for the 43's in the first one and Tornado in the second... ...yes, I'm hiding behind my securely locked Buckinghamshire door.", let's faces it you only watch it for the in the first one and tornado in the second yes i'm hiding behind my securely locked buckinghamshire door,buckinghamshire door
1.264834942028206e+18,2020-05-25 08:25:24+00:00,['1264834942028206081'],"@SkyBlueStacey A from the top, E from the bottom, hold the middle.", a from the top e from the bottom hold the middle,bottom middle
1.2641943223600865e+18,2020-05-23 13:59:48+00:00,['1264194322360086529'],@CopleyHill I need to rejoin the bachmann club to get more boxes after seeing this., i need to rejoin the bachmann club to get more boxes after seeing this,bachmann club
1.2635070415046328e+18,2020-05-21 16:28:48+00:00,['1263507041504632838'],"@TheNightTrain3 We haven't a guard, we haven't a guard! At least, I think that's what the UK version is.", we haven't a guard we haven't a guard at least i think that's what the uk version is,guard guard version
1.2630161523404964e+18,2020-05-20 07:58:11+00:00,['1263016152340496385'],"@paul_winginit @RMcCarthy86 Halfway there next month, where has my life gone?!",  halfway there next month where has my life gone,halfway month life
1.2626554265392497e+18,2020-05-19 08:04:47+00:00,['1262655426539249665'],"@RMcCarthy86 If I'm kept fed and having HST rides, then I'm anyone's!", if i'm kept fed and having hst rides then i'm anyones,ride anyones
1.262266973477626e+18,2020-05-18 06:21:12+00:00,['1262266973477625858'],"@_SteveAB @NetworkRailEUS That news doesn't fill me with confidence, I've got a PM Peak out of New Street later, as much as I don't enjoy it, might work solely from rear cab instead of the middle of that one.",  that news doesn't fill me with confidence i've got a pm peak out of new street later as much as i don't enjoy it might work solely from rear cab instead of the middle of that one,news confidence peak street middle
1.262072168189485e+18,2020-05-17 17:27:07+00:00,['1262072168189485057'],"@NSE_KentLink Ashridge, sort of freelance but roughly off the Ardingly branch on the Bluebell Line.", ashridge sort of freelance but roughly off the ardingly branch on the bluebell line,ashridge sort freelance branch bluebell line
1.261649730901287e+18,2020-05-16 13:28:30+00:00,['1261649730901286912'],@jameshepburn91 Bit early in the week for roast pork., bit early in the week for roast pork,week roast pork
1.261313605791867e+18,2020-05-15 15:12:52+00:00,['1261313605791866883'],@LeeRender @Tringonometry He started it by talking about the forbidden film this morning! It cannot be just a coincident! https://t.co/fkt08ffUIM,  he started it by talking about the forbidden film this morning it cannot be just a coincident ,forbidden film morning coincident
1.261167249144103e+18,2020-05-15 05:31:18+00:00,['1261167249144102912'],@Tringonometry Question 1: Who is Mr Dogg? Question 2: Have we checked his sanity? Point 1: I reject his reality and substitute my own! https://t.co/n4WUWPI6rq, question who is mr dogg question have we checked his sanity point i reject his reality and substitute my own ,question question sanity point reality
1.260850211477508e+18,2020-05-14 08:31:30+00:00,['1260850211477508096'],@DrHilaryJones where did you get the tie from this morning Doctor?, where did you get the tie from this morning doctor,morning doctor
1.2605660408844575e+18,2020-05-13 13:42:18+00:00,['1260566040884457478'],@RMcCarthy86 @herguestridge Do a Bachmann and keep it in the car park!,  do a bachmann and keep it in the car park,bachmann park
1.2599317778729042e+18,2020-05-11 19:41:58+00:00,['1259931777872904197'],"@purpleMash hi, I've noticed some of my sons marked work has different coloured trophies beside it. Can you explain what they mean please?", hi i've noticed some of my sons marked work has different coloured trophies beside it can you explain what they mean please,work trophy
1.2591884389617377e+18,2020-05-09 18:28:13+00:00,['1259188438961737728'],"@DriverPotter @TheGasMan1985 @WCMLSimon @TheFactCompiler Spare only in the glorious sense, I love de 750DC rail!",    spare only in the glorious sense i love de rail,sense rail
1.259157300025135e+18,2020-05-09 16:24:28+00:00,['1259157300025135109'],@DriverPotter @WCMLSimon @TheGasMan1985 @TheFactCompiler Glory be to the spare sparky rail!,    glory be to the spare sparky rail,glory spare rail
1.257620098040377e+18,2020-05-05 10:36:11+00:00,['1257620098040377353'],"@BackOfTheNest Sadly not, but not helped by management not knowing if he was a winger or a midfielder. Dowie sticking him on the left wing wasn't his finest moment.", sadly not but not helped by management not knowing if he was a winger or a midfielder dowie sticking him on the left wing wasn't his finest moment,management winger midfielder dowie left moment
1.2573890836739768e+18,2020-05-04 19:18:13+00:00,['1257389083673976833'],"@NSE_Latchmere 1:Daniel 2: HST 3: had track laid on boards between 2017-recently 4: Thomas, he was my first successful DCC Hardwire 5: Sash! I Believe 6: right now, Killing Eve 7: I do like a nice bit of roast beef 8: partially my grandad, and partially growing up next to the WCML", hst had track laid on boards between thomas he was my first successful dcc hardwire sash i believe right now killing eve i do like a nice bit of roast beef partially my grandad and partially growing up next to the wcml,track board thomas hardwire sash right roast beef grandad wcml
1.2572316192467354e+18,2020-05-04 08:52:30+00:00,['1257231619246735360'],"@AdamHai63626497 No, 172's are on Leamington-Nuneaton via Kenilworth. 230's are on Bletchley-Bletchley.", no are on leamingtonnuneaton via kenilworth are on bletchleybletchley,leamingtonnuneaton kenilworth bletchleybletchley
1.256550491192021e+18,2020-05-02 11:45:57+00:00,['1256550491192020993'],"@CrossCountryUK A mere hint of my collection, I still have the box set of the Rev.'s 26 books, and anthology of Christopher's books which has all bar one of his.", a mere hint of my collection i still have the box set of the revs books and anthology of christopher's books which has all bar one of his,hint collection book anthology book
1.2560953875360358e+18,2020-05-01 05:37:32+00:00,['1256095387536035843'],@Virgos_Haircut Glenn Murray and Stephen Dobbie!, glenn murray and stephen dobbie,glenn murray stephen dobbie
1.2555833562611958e+18,2020-04-29 19:42:54+00:00,['1255583356261195778'],"@Jessmegandmum @CarolineJosephs That happened to me once, was sat with a few friends when a King Charles came and sat on lap demanding attention.",  that happened to me once was sat with a few friends when a king charles came and sat on lap demanding attention,friend king charles attention
1.2550169703465124e+18,2020-04-28 06:12:17+00:00,['1255016970346512385'],"@Sidekickjason Sadly I think BWBA is the death of Thomas as we know it. I can't stand watching it with my son, retiring Henry and Edward was the start of a downhill slope in my opinion.", sadly i think bwba is the death of thomas as we know it i can't stand watching it with my son retiring henry and edward was the start of a downhill slope in my opinion,bwba death thomas stand henry edward start downhill slope opinion
1.2547699767975322e+18,2020-04-27 13:50:49+00:00,['1254769976797532160'],"@S_Thomas1990 I'm in same boat after scrapping layout, hoping interest returns in 12/18 months.", i'm in same boat after scrapping layout hoping interest returns in months,boat interest return month
1.2546649942492037e+18,2020-04-27 06:53:39+00:00,['1254664994249203713'],"@Tringonometry It's good, but it's not a saddleback piggy!", it's good but it's not a saddleback piggy,saddleback piggy
1.2546639153484145e+18,2020-04-27 06:49:22+00:00,['1254663915348414464'],"@Virgos_Haircut @deedee10780561 My god man, where are the Custard Creams?!",  my god man where are the custard creams,custard cream
1.254018243523641e+18,2020-04-25 12:03:42+00:00,['1254018243523641344'],"@LEGO_Group hi guys, I realise we are in an unprecedented situation, but do you know when Pick a Brick will be open again? Got an old castle that I'm restoring and need a few pieces for it.", hi guys i realise we are in an unprecedented situation but do you know when pick a brick will be open again got an old castle that i'm restoring and need a few pieces for it,situation brick castle piece
1.2539476144558326e+18,2020-04-25 07:23:03+00:00,['1253947614455832576'],"Could someone ask Donald if I'm supposed to inject this before standing in UV light, or during the light treatment please? His advice was a little sketchy. https://t.co/QR97jLjGZ7",could someone ask donald if i'm supposed to inject this before standing in uv light or during the light treatment please his advice was a little sketchy ,someone donald light treatment advice
1.253702450063782e+18,2020-04-24 15:08:51+00:00,['1253702450063781890'],"@MrTimDunn Are you aware Tim, that there is an open source download version out there?", are you aware tim that there is an open source download version out there,source download version
1.2525505312953915e+18,2020-04-21 10:51:32+00:00,['1252550531295391745'],"@Tringonometry Well, pork, mushrooms and potato based food is always good...right?", well pork mushrooms and potato based food is always goodright,pork mushroom potato food
1.252490500231385e+18,2020-04-21 06:53:00+00:00,['1252490500231385088'],"@RMcCarthy86 At least you are being a Really Useful Controller today, was spare at home yesterday and was climbing the walls.", at least you are being a really useful controller today was spare at home yesterday and was climbing the walls,controller today home yesterday wall
1.2524890853584282e+18,2020-04-21 06:47:22+00:00,['1252489085358428165'],@Tringonometry Full English minus beans and egg will sort pupper out., full english minus beans and egg will sort pupper out,minus bean pupper
1.2522042706881083e+18,2020-04-20 11:55:37+00:00,['1252204270688108545'],"@FYPFanzine Benteke, woefully short of goalscorers.", benteke woefully short of goalscorers,benteke goalscorers
1.2516136700749169e+18,2020-04-18 20:48:47+00:00,['1251613670074916865'],"@Suburban_Jogger I had a 12 car where there were 4 people on board. Myself, driver, a driver for another TOC travelling into work and a random. Hoping message has finally got through.", i had a car where there were people on board myself driver a driver for another toc travelling into work and a random hoping message has finally got through,people board driver work random message
1.2507322026498908e+18,2020-04-16 10:26:09+00:00,['1250732202649890816'],"@dalek2150 @RailwayWanderer As a guard based on the WCML, I sadly have contradict Gordon to agree with you there.",  as a guard based on the wcml i sadly have contradict gordon to agree with you there,guard wcml gordon
1.2506676644957798e+18,2020-04-16 06:09:42+00:00,['1250667664495779840'],@Tringonometry And this is why all bugs and beasties need to be introduced to a slipper or rolled up broadsheet., and this is why all bugs and beasties need to be introduced to a slipper or rolled up broadsheet,beasties slipper broadsheet
1.2505149306856776e+18,2020-04-15 20:02:47+00:00,['1250514930685677569'],"@RailwayWanderer I should have remembered that, as Gordon Goes Foreign is one of my favourites, especially with a few of Christopher's stories featuring engines going to the Other Railway and vice versa.", i should have remembered that as gordon goes foreign is one of my favourites especially with a few of christopher's stories featuring engines going to the other railway and vice versa,gordon favourite story engine railway vice versa
1.250512467924525e+18,2020-04-15 19:53:00+00:00,['1250512467924525057'],"@RailwayWanderer I was surprised by the scale map in Christopher's anthology showing the mainline is roughly 60 miles, not entirely sure the express needs 15 coaches for such a relative short distance.", i was surprised by the scale map in christopher's anthology showing the mainline is roughly miles not entirely sure the express needs coaches for such a relative short distance,scale anthology mainline mile express coach distance
1.2496015826117837e+18,2020-04-13 07:33:28+00:00,['1249601582611783682'],"@NSE_hastings92 @TheGasMan1985 If I remember rightly, model companies have to ask permission to recreate the livery of current operators.",  if i remember rightly model companies have to ask permission to recreate the livery of current operators,company permission livery operator
1.249411837948461e+18,2020-04-12 18:59:29+00:00,['1249411837948461058'],"@MattwicksBMR It is most likely going to be around 12 months at earliest. I'm friends with the daughter of the owner of Berkshire Dolls House who does baseboards, so if I can't get laser ones, I'll see what he can do.", it is most likely going to be around months at earliest i'm friends with the daughter of the owner of berkshire dolls house who does baseboards so if i can't get laser ones i'll see what he can do,month friend daughter owner berkshire doll house baseboard
1.2494083981621125e+18,2020-04-12 18:45:49+00:00,['1249408398162112519'],"@MattwicksBMR Plan is 8ft 2ft split on two boards to fold over itself and be portable like Minories, but my bad carpentry didn't work. Hence either professional made boards, or laser cut. However, my limited research of laser boards shows I can't get the dimensions I want.", plan is split on two boards to fold over itself and be portable like minories but my bad carpentry didn't work hence either professional made boards or laser cut however my limited research of laser boards shows i can't get the dimensions i want,plan board minories carpentry work hence made board laser research laser board dimension
1.249386798339539e+18,2020-04-12 17:19:59+00:00,['1249386798339538944'],"@MrTimDunn Mine has lost its entire back end, only the boiler and smoke box left.", mine has lost its entire back end only the boiler and smoke box left,mine boiler smoke
1.2493729494901432e+18,2020-04-12 16:24:58+00:00,['1249372949490143232'],@007 New Q telling Bond he's had 20 watches in Die Another Day., new q telling bond he's had watches in die another day,bond watch
1.249368733140779e+18,2020-04-12 16:08:12+00:00,['1249368733140779008'],"@MattwicksBMR I am looking to go down that route when I have the time to sort it out, I've got a plan drawn up and all the track I need, expect possibly going down route of Peco points.", i am looking to go down that route when i have the time to sort it out i've got a plan drawn up and all the track i need expect possibly going down route of peco points,route time plan track route peco point
1.2493673672657797e+18,2020-04-12 16:02:47+00:00,['1249367367265779712'],"@MattwicksBMR Wonky misaligned baseboards, it's also trying to find the time to correct the mistakes.", wonky misaligned baseboards it's also trying to find the time to correct the mistakes,wonky baseboard time mistake
1.2493534131435192e+18,2020-04-12 15:07:20+00:00,['1249353413143519233'],"Thank you all for your advice and interaction within the community, I still wish to be part of you, but for now, there will be no layout from my end to show. #TMRGUK",thank you all for your advice and interaction within the community i still wish to be part of you but for now there will be no layout from my end to show ,thank advice interaction community part layout
1.2493534070617702e+18,2020-04-12 15:07:18+00:00,['1249353407061770240'],"I know what I want to achieve for my model, and I hope the boards will get me there. But for now, the Southern Railway Preservation Society will like many other heritage railways, will be closed for some time.",i know what i want to achieve for my model and i hope the boards will get me there but for now the southern railway preservation society will like many other heritage railways will be closed for some time,model board railway preservation society heritage railway time
