id,created_at,edit_history_tweet_ids,text,clean_text,nouns
1.5600284307915448e+18,2022-08-17 22:18:56+00:00,['1560028430791544837'],@sheilaMol1 Love it when they dream and yelp and bark and their trotters start going !, love it when they dream and yelp and bark and their trotters start going ,yelp bark trotter
1.5600244265818358e+18,2022-08-17 22:03:01+00:00,['1560024426581835778'],@1980sRewind I still have my mums old bowl along with her Kenwood Chef from the 1960's and it still works perfectly, i still have my mums old bowl along with her kenwood chef from the and it still works perfectly,bowl kenwood chef
1.559790691932414e+18,2022-08-17 06:34:15+00:00,['1559790691932413954'],@sheilaMol1 Someone looks comfy having mum snuggles !, someone looks comfy having mum snuggles ,someone snuggle
1.559645378437419e+18,2022-08-16 20:56:49+00:00,['1559645378437419008'],@JohnWil12363553 @jon_trickett Says the man who lives in Spain c/o the EU ? and freedom of movement which the Tories have binned ? ROFL More Tory lies,  says the man who lives in spain co the eu  and freedom of movement which the tories have binned  rofl more tory lies,spain freedom movement tory rofl
1.5596362005327135e+18,2022-08-16 20:20:21+00:00,['1559636200532713478'],@Ann_TanseyK I was looking for a Warrenby local to Dumfries but the only one I can find is near Redcar in Teeside? Could he have been working away https://t.co/Ky2WLwZogb, i was looking for a warrenby local to dumfries but the only one i can find is near redcar in teeside could he have been working away ,dumfries redcar teeside
1.559632656484139e+18,2022-08-16 20:06:16+00:00,['1559632656484139009'],@Dave_Lifelines Your journey can be a bumpy one as the more you dig the more you find and often the more questions you have and not always the answers you want or thought you knew., your journey can be a bumpy one as the more you dig the more you find and often the more questions you have and not always the answers you want or thought you knew,journey question answer
1.5596301333167882e+18,2022-08-16 19:56:14+00:00,['1559630133316788225'],@donnasr @ancestryhour Can you compare some of the letters on the left of the card to try and match them up but I see what you are saying re Mc Cordly or Cardly ? just a guess.,  can you compare some of the letters on the left of the card to try and match them up but i see what you are saying re mc cordly or cardly  just a guess,letter left card guess
1.5596293036079596e+18,2022-08-16 19:52:57+00:00,['1559629303607959553'],@donnasr @ancestryhour These things like census records etc are notoriously difficult to read and interpret.,  these things like census records etc are notoriously difficult to read and interpret,thing census record
1.5596071277479854e+18,2022-08-16 18:24:50+00:00,['1559607127747985408'],@donnasr @ancestryhour Surname looks like Melody or Peabody to me? https://t.co/1o0ebejXbN,  surname looks like melody or peabody to me ,surname melody peabody
1.5595750297041797e+18,2022-08-16 16:17:17+00:00,['1559575029704179712'],@kennethtwist @MillerMattu @Colpessimismus @BzzzzFTU @TheScotsman Says the man from Merseyside that sewer of corruption from Labour.,     says the man from merseyside that sewer of corruption from labour,merseyside sewer corruption labour
1.5594907098199818e+18,2022-08-16 10:42:13+00:00,['1559490709819981825'],@Barb_Drummond @robkb2 @countrymousie Look at the ones that do it alongside somewhere like the A38 in Devon etc. They are just idiots.,   look at the ones that do it alongside somewhere like the a in devon etc they are just idiots,look devon idiot
1.5594903257098363e+18,2022-08-16 10:40:42+00:00,['1559490325709836288'],@countrymousie He wants to be thankful they were not muck spreading. Then the shit would have really hit the fan (I mean face) 😀😀😀😀😀😀😀😀😀😀, he wants to be thankful they were not muck spreading then the shit would have really hit the fan i mean face ,shit face
1.5592852441629368e+18,2022-08-15 21:05:46+00:00,['1559285244162936832'],@keithpp Bit rich coming from a Tory MP who are in charge of railways oh yes the Tories and Grant Shapps remember him Mr 4 names. who will not meet with trade unions as he is a coward., bit rich coming from a tory mp who are in charge of railways oh yes the tories and grant shapps remember him mr names who will not meet with trade unions as he is a coward,charge railway tory grant shapps name trade union coward
1.559221341362e+18,2022-08-15 16:51:51+00:00,['1559221341361999875'],@cambridgedavid7's account is temporarily unavailable because it violates the Twitter Media Policy. Learn more.,s account is temporarily unavailable because it violates the twitter media policy learn more,account medium policy
1.5592210138498007e+18,2022-08-15 16:50:33+00:00,['1559221013849800705'],@Daddy__c0o1 Lot of daft tweets supporting Starmer as well when he is just a blue in a red tie., lot of daft tweets supporting starmer as well when he is just a blue in a red tie,daft tweet starmer blue
1.5591241966844475e+18,2022-08-15 10:25:50+00:00,['1559124196684447748'],"@obbsie Na he still drives for 2 miles before pulling over in a ""safe place"" what a prize pratt he is", na he still drives for miles before pulling over in a safe place what a prize pratt he is,mile place prize pratt
1.5591031051863736e+18,2022-08-15 09:02:01+00:00,['1559103105186373634'],@MarkMiddleton37 @RailDeliveryGrp They also need to stop the them and us rhetoric. without the driver at the front and the TM/guard/signaller/track worker etc there is no service period. Just a government mouthpiece,  they also need to stop the them and us rhetoric without the driver at the front and the tmguardsignallertrack worker etc there is no service period just a government mouthpiece,driver front tmguardsignallertrack worker service period government mouthpiece
1.558938044409041e+18,2022-08-14 22:06:08+00:00,['1558938044409040900'],@CharlieRWalker @JamesLArnott There used to be a Derby crew book on at about 0100 (or thereabouts) booked taxi to Newcastle to work the first up Virgin XC train back to Derby! and that was daily.,  there used to be a derby crew book on at about  or thereabouts booked taxi to newcastle to work the first up virgin xc train back to derby and that was daily,crew book thereabouts taxi virgin
1.5589339324894413e+18,2022-08-14 21:49:47+00:00,['1558933932489441281'],@countrymousie Have they no idea how the countryside works or how crops are harvested and when ? Must be a townie then? lol, have they no idea how the countryside works or how crops are harvested and when  must be a townie then lol,idea countryside crop townie
1.55892887447339e+18,2022-08-14 21:29:41+00:00,['1558928874473390080'],@mrmissm @MeaninglessMud @LNER @1701aStarship Well done that man. Made a young chaps day ! But would I want my nipper so close (yes behind the yellow line I know) and I would have to say no.,    well done that man made a young chaps day  but would i want my nipper so close yes behind the yellow line i know and i would have to say no,chap nipper line
1.5585568091196375e+18,2022-08-13 20:51:14+00:00,['1558556809119637505'],@MaxAttakz @joncoopertweets Facts please they are either divorced now or divorcing !,  facts please they are either divorced now or divorcing ,fact please
1.558556431498072e+18,2022-08-13 20:49:44+00:00,['1558556431498072064'],@NeverBorg1 @joncoopertweets Now he is not shagging a Texan (Jerry Hall) take his dual nationality off him !,  now he is not shagging a texan jerry hall take his dual nationality off him ,texan jerry hall nationality
1.5585560767059722e+18,2022-08-13 20:48:19+00:00,['1558556076705972225'],@sheilaMol1 Yes they are I have seen them live and complete with Christine back in the line-up as well. Sadly it will never happen again now as Lyndsey has split from the band for ever., yes they are i have seen them live and complete with christine back in the lineup as well sadly it will never happen again now as lyndsey has split from the band for ever,christine lineup lyndsey band
1.5585540708556513e+18,2022-08-13 20:40:21+00:00,['1558554070855651329'],@GretchenCarlson They should go after Tucker while they are at it his head is a mine of useless lies and misinformation, they should go after tucker while they are at it his head is a mine of useless lies and misinformation,tucker head mine misinformation
1.558552419386155e+18,2022-08-13 20:33:47+00:00,['1558552419386155008'],@sheilaMol1 The live concert featuring this is just the best. And will forever be the F1 theme tune., the live concert featuring this is just the best and will forever be the f theme tune,concert theme tune
1.558410926751191e+18,2022-08-13 11:11:33+00:00,['1558410926751191041'],@countrymousie Are you sure you don't run a safari park and he is one of the wardens ? lmao, are you sure you don't run a safari park and he is one of the wardens  lmao,safari park warden
1.558385718187131e+18,2022-08-13 09:31:23+00:00,['1558385718187130882'],@chrisdiacon @LBC @mrjamesob Well you managed it in one short sentence talking nonsense that is so maybe you should do the show and bore the rest of us for the day now bore off,   well you managed it in one short sentence talking nonsense that is so maybe you should do the show and bore the rest of us for the day now bore off,sentence nonsense show rest
1.5583779725366804e+18,2022-08-13 09:00:36+00:00,['1558377972536680454'],@ashleyjameslee @NJ_Timothy Typical Tory rhetoric and evasion as usual from the Torygraph,  typical tory rhetoric and evasion as usual from the torygraph,tory rhetoric evasion torygraph
1.557795564691112e+18,2022-08-11 18:26:19+00:00,['1557795564691111939'],@markandcharlie And so it started again with a daisy chain behind me and no room to overtake safely. Cyclists also need to have a bit of respect for other road users as well or massive infrastructure changes are needed to segregate users., and so it started again with a daisy chain behind me and no room to overtake safely cyclists also need to have a bit of respect for other road users as well or massive infrastructure changes are needed to segregate users,daisy chain room cyclist respect road user infrastructure change user
1.5577950789319762e+18,2022-08-11 18:24:23+00:00,['1557795078931976196'],@markandcharlie Mark I completely agree re the bus but today I saw the otherside of the coin. a cyclist who I had followed for nearly 2 miles due to oncoming traffic and eventually got room and passed him only for thing to catchup at lights by skimming down theside of cars waiting at the lights, mark i completely agree re the bus but today i saw the otherside of the coin a cyclist who i had followed for nearly miles due to oncoming traffic and eventually got room and passed him only for thing to catchup at lights by skimming down theside of cars waiting at the lights,mark today otherside coin cyclist mile traffic room thing light theside light
1.5577942087312507e+18,2022-08-11 18:20:56+00:00,['1557794208731250688'],@mowermanjimmy Looks delicious if you like that sort of thing !, looks delicious if you like that sort of thing ,sort thing
1.5577845138491963e+18,2022-08-11 17:42:24+00:00,['1557784513849196552'],@JDrvr Yes that is why we picked it the drive up from Ayr is superb and the pub which is fairly new is right on the waterfront and sitting outside has stunning views better than Spoons at Largs and that view is pretty good., yes that is why we picked it the drive up from ayr is superb and the pub which is fairly new is right on the waterfront and sitting outside has stunning views better than spoons at largs and that view is pretty good,drive waterfront view spoon largs view
1.5577833802294886e+18,2022-08-11 17:37:54+00:00,['1557783380229488640'],@eddieclarke2 @catskiv I don't know you from Adam but well done for what you have achieved in this very negative world we now live in. A credit to yourself and those who have probably helped you on your way. You have my respect and shows what can be done.,  i don't know you from adam but well done for what you have achieved in this very negative world we now live in a credit to yourself and those who have probably helped you on your way you have my respect and shows what can be done,adam world credit respect
1.557782881233158e+18,2022-08-11 17:35:55+00:00,['1557782881233158144'],Hungry Horse pub at Greenock for pre-birthday lunch today and that was just the starter and sweet ! lol I feel as big as a house now and don't wan to eat till at least breakfast tomorrow ! https://t.co/RTDGHlUfF8 https://t.co/bJzFWLhPLN,hungry horse pub at greenock for prebirthday lunch today and that was just the starter and sweet  lol i feel as big as a house now and don't wan to eat till at least breakfast tomorrow   ,horse greenock lunch today starter house till breakfast tomorrow
1.5577822071497933e+18,2022-08-11 17:33:15+00:00,['1557782207149793284'],@JDrvr Cheers Matey. If you saw what I ate at lunchtime you wouldn't think sharing was caring. Hungy Horse at Greenock and I am still stuffed now some 6 1/2 hrs later ! And that was just my starter ! https://t.co/PWSG05KXKM, cheers matey if you saw what i ate at lunchtime you wouldn't think sharing was caring hungy horse at greenock and i am still stuffed now some hrs later  and that was just my starter  ,cheer lunchtime sharing horse greenock starter
1.5574383919477637e+18,2022-08-10 18:47:03+00:00,['1557438391947763713'],@FABSITEUK Never had a Domino's in my life am I missing something🍕🇮🇹😀?, never had a domino's in my life am i missing something,life something
1.557401845718569e+18,2022-08-10 16:21:49+00:00,['1557401845718568960'],@polscothorses @Dumfries_House Sorry we missed you. we had forgotten about this and would love to have seen you all as we are only up the road.,  sorry we missed you we had forgotten about this and would love to have seen you all as we are only up the road,sorry road
1.5573145924638884e+18,2022-08-10 10:35:07+00:00,['1557314592463888384'],@ConsForChrist You as a group of Conservatives would not know the truth if it stood in front of you after all you have been worshipping satan in the shape of Boris for years !, you as a group of conservatives would not know the truth if it stood in front of you after all you have been worshipping satan in the shape of boris for years ,group conservative truth front satan shape boris year
1.5572974449033912e+18,2022-08-10 09:26:58+00:00,['1557297444903391232'],@JamesMelville Thewre is no government nor an effective opposition. they are all totally useless and are fiddling (usually Tory MP's) while Rome burns We are in the shite basically and no one cares at all., thewre is no government nor an effective opposition they are all totally useless and are fiddling usually tory mps while rome burns we are in the shite basically and no one cares at all,thewre government opposition burn shite
1.5572926885584077e+18,2022-08-10 09:08:04+00:00,['1557292688558407680'],@angel_jones_aj @quangels I don't often see eye to eye with Richard Madeley but he was right they are evasive and crap at their job and merely deflecting we need answers now not in the Autumn but of course the leader is skiving yet again,  i don't often see eye to eye with richard madeley but he was right they are evasive and crap at their job and merely deflecting we need answers now not in the autumn but of course the leader is skiving yet again,madeley crap answer autumn course leader
1.5572896600738406e+18,2022-08-10 08:56:02+00:00,['1557289660073840640'],@gingertotty Saturday Night Fever would be a good start with lots of the tracks on the album that get you motivated. !, saturday night fever would be a good start with lots of the tracks on the album that get you motivated ,saturday night fever start track album
1.5569545828357775e+18,2022-08-09 10:44:34+00:00,['1556954582835777538'],@ben1987 Rattled past that box many a time behind a class 44 or 2x20's Taking coal to Corby/Lloyds sidings and coming back with 100slu of empties I was the pratt at the back :-), rattled past that box many a time behind a class or taking coal to corbylloyds sidings and coming back with of empties i was the pratt at the back ,time class coal siding empty pratt back
1.5569084029823877e+18,2022-08-09 07:41:03+00:00,['1556908402982387715'],@CopWellbeing @Graham_Goulden The trouble is a Chief Superintendent backed it up apparently and said due to poor management live on tv !,  the trouble is a chief superintendent backed it up apparently and said due to poor management live on tv ,trouble superintendent management
1.5569037866139894e+18,2022-08-09 07:22:43+00:00,['1556903786613989376'],@andycastle46587 @scroggie17 At least Andrew and William have done their bit in combat. Edward must have got his for origami!,  at least andrew and william have done their bit in combat edward must have got his for origami,andrew william combat edward origami
1.5567746087994982e+18,2022-08-08 22:49:24+00:00,['1556774608799498242'],@scroggie17 Could he be called a Walter Mitty ? asking for a friend, could he be called a walter mitty  asking for a friend,walter mitty friend
1.5566886341280727e+18,2022-08-08 17:07:46+00:00,['1556688634128072704'],You have to wonder Where these people get this info from then you see the union jack and the answer is right there https://t.co/UG9LTGUZdV,you have to wonder where these people get this info from then you see the union jack and the answer is right there ,people info union jack answer
1.5565873296068813e+18,2022-08-08 10:25:14+00:00,['1556587329606881280'],@sheilaMol1 Ok here thanks and you ? I don't get to see your posts now as Twitter seems to edit people's timelines but I keep looking for your vids with the boys !, ok here thanks and you  i don't get to see your posts now as twitter seems to edit people's timelines but i keep looking for your vids with the boys ,thanks post twitter timeline vids
1.556586414925615e+18,2022-08-08 10:21:35+00:00,['1556586414925615104'],@sheilaMol1 Morning missus !, morning missus ,morning missus
1.55658575553903e+18,2022-08-08 10:18:58+00:00,['1556585755539030019'],@Ryan_Laccohee @ukiswitheu Since the Tories took power 12 years ago.,  since the tories took power years ago,tory power year
1.5562328539937915e+18,2022-08-07 10:56:40+00:00,['1556232853993791488'],@BBCScotlandNews Ha ha and then reverse it again when elected. We are not stupid she changes her policies so often and is just clueless and aimless., ha ha and then reverse it again when elected we are not stupid she changes her policies so often and is just clueless and aimless,policy aimless
1.555848621408637e+18,2022-08-06 09:29:52+00:00,['1555848621408636929'],@Blackarachnia13 This the one that killed 6 including a pregnant woman and child ? Apparently a nurse on her phone and drinking while driving her Mercedes and having a row with her boyfriend. she survived others did not so sad., this the one that killed including a pregnant woman and child  apparently a nurse on her phone and drinking while driving her mercedes and having a row with her boyfriend she survived others did not so sad,woman child nurse phone drinking mercedes boyfriend others
1.5555218035183534e+18,2022-08-05 11:51:12+00:00,['1555521803518353409'],@BabyBoomer1960 @trussliz Just same old same old rolled over from Boris no new ideas unfunded sweeteners and the usual getting on with the job ! All liars and charlatans every one of them,  just same old same old rolled over from boris no new ideas unfunded sweeteners and the usual getting on with the job  all liars and charlatans every one of them,idea sweetener liar charlatan
1.5555212759545938e+18,2022-08-05 11:49:07+00:00,['1555521275954593792'],@trussliz How long will this last you couldn't unite 2 pieces of rope, how long will this last you couldn't unite pieces of rope,piece rope
1.5555210015633244e+18,2022-08-05 11:48:01+00:00,['1555521001563324416'],@trussliz @Conservatives You cannot trust Truss fact !,  you cannot trust truss fact ,truss fact
1.555314392723587e+18,2022-08-04 22:07:02+00:00,['1555314392723587072'],@StarmerSupreme @PeterStefanovi2 @campbellclaret Can we have that in English please? Just so it makes sense?,   can we have that in english please just so it makes sense,please sense
1.5553140360187822e+18,2022-08-04 22:05:37+00:00,['1555314036018782208'],@LucyTrims Liz Truss was useless clueless and a total wet., liz truss was useless clueless and a total wet,truss clueless
1.555313107798528e+18,2022-08-04 22:01:55+00:00,['1555313107798528007'],I love how all the flag shagging Tories are blaming anyone but their own candidates for the appalling performance from Sunak and Truss tonight calling Kay Burley biased and the audience rigged in favour of Sunak. They were Conservative voters for gods sake !,i love how all the flag shagging tories are blaming anyone but their own candidates for the appalling performance from sunak and truss tonight calling kay burley biased and the audience rigged in favour of sunak they were conservative voters for gods sake ,flag tory anyone candidate performance sunak truss tonight burley audience favour sunak voter
1.555296980728955e+18,2022-08-04 20:57:50+00:00,['1555296980728954883'],@micksturbs43 @OxfordDiplomat You mean your hero got cooked of course?,  you mean your hero got cooked of course,hero course
1.5551123168401695e+18,2022-08-04 08:44:03+00:00,['1555112316840169473'],@DavidHorne And that is why trains have toughened windscreens but even that would be a massive shock to the driver. I know having had a brick lobbed at the cab of a 37 what it feels like., and that is why trains have toughened windscreens but even that would be a massive shock to the driver i know having had a brick lobbed at the cab of a what it feels like,train windscreen shock driver brick lobbed
1.5551112133564252e+18,2022-08-04 08:39:40+00:00,['1555111213356425216'],@ConductorHarry @Elwick70 Glad that made you titter Harry. I am not sure Superman at the front would agree though 🚃🚆🚂🛤️🚉🚄🚅,  glad that made you titter harry i am not sure superman at the front would agree though ,glad superman front
1.555107929858138e+18,2022-08-04 08:26:37+00:00,['1555107929858138113'],@ConductorHarry @Elwick70 Blimey the dynamic duo on this this morning then ! Batman and Throbbin ! 🤣🌈🏳️‍🌈,  blimey the dynamic duo on this this morning then  batman and throbbin  ,morning batman throbbin
1.5549605823899935e+18,2022-08-03 22:41:07+00:00,['1554960582389993474'],Ex-Met Police chief Dame Cressida Dick 'may have breached standards' in Daniel Morgan case https://t.co/ktRu9OJJKp,exmet police chief dame cressida dick may have breached standards in daniel morgan case ,police chief dame cressida dick standard daniel case
1.5548984937472e+18,2022-08-03 18:34:24+00:00,['1554898493747200001'],@mattprescott Sounds rather like when Boris was at the dispatch box and Hoyle would not tackle him for his lies we need more of this type of person taking politicians etc to task in the UK !, sounds rather like when boris was at the dispatch box and hoyle would not tackle him for his lies we need more of this type of person taking politicians etc to task in the uk ,boris dispatch hoyle type person politician
1.5547587834397e+18,2022-08-03 09:19:14+00:00,['1554758783439699968'],@RailDeliveryGrp Stop being Grant Shapps puppets you are just a mouthpiece for the government, stop being grant shapps puppets you are just a mouthpiece for the government,shapps puppet mouthpiece government
1.5545621511713833e+18,2022-08-02 20:17:53+00:00,['1554562151171383297'],@CarolD56682335 @RestIsPolitics @RoryStewartUK He is a real ale and hush puppies sort of guy and by the current conservative party very middle of the road so not what they want sadly those days are long gone.,   he is a real ale and hush puppies sort of guy and by the current conservative party very middle of the road so not what they want sadly those days are long gone,hush puppy sort party road
1.5545612446104044e+18,2022-08-02 20:14:17+00:00,['1554561244610404354'],@mercede72928186 Why not I am sure the show would do well compared to some of the wooden bimbo's on the current (now finished) show. Call it Milf Island lol, why not i am sure the show would do well compared to some of the wooden bimbo's on the current now finished show call it milf island lol,show show call island
1.554557978879185e+18,2022-08-02 20:01:19+00:00,['1554557978879184896'],@mercede72928186 You look like you are on Love Island the three of you !, you look like you are on love island the three of you ,love island
1.5545547384143913e+18,2022-08-02 19:48:26+00:00,['1554554738414391297'],@mercede72928186 @TaffMet Ooh I will warn the border guards to expect you ! (I nearly said inspect you but thought better of it lol),  ooh i will warn the border guards to expect you  i nearly said inspect you but thought better of it lol,border guard
1.5545543443259064e+18,2022-08-02 19:46:52+00:00,['1554554344325906440'],@sheilaMol1 Having a stag do by the looks of it ?, having a stag do by the looks of it ,stag look
1.5545526736466575e+18,2022-08-02 19:40:14+00:00,['1554552673646657540'],@DerbyshireRPU @DerbysRPUBikers @PoliceScotland @polscotrpu I hope they left some stale haggis in the pannier as well !,    i hope they left some stale haggis in the pannier as well ,haggis pannier
1.5545522148610908e+18,2022-08-02 19:38:24+00:00,['1554552214861090817'],@TaffMet @mercede72928186 Even worse up here in Scotland a lot of kerbstones are granite and very tough as I found out to my cost when I first moved up here ! They bite back.,  even worse up here in scotland a lot of kerbstones are granite and very tough as i found out to my cost when i first moved up here  they bite back,scotland kerbstone cost
