id,created_at,edit_history_tweet_ids,text,clean_text,nouns
1.565066476842795e+18,2022-08-31 19:58:20+00:00,['1565066476842795011'],@MrsAstronaut At the wedding we were at 2 weeks ago they were charging £5.50 a pint and card only bar ! No cash at all., at the wedding we were at weeks ago they were charging  a pint and card only bar  no cash at all,wedding week pint card cash
1.564950258781753e+18,2022-08-31 12:16:31+00:00,['1564950258781753344'],@DonnaMariaAllen @gmpolice Can you imagine being on patrol in a metro now ! Compared with a beemer estate.,  can you imagine being on patrol in a metro now  compared with a beemer estate,patrol metro beemer estate
1.5649095376641106e+18,2022-08-31 09:34:43+00:00,['1564909537664110592'],@KateWilton1 Yes they are A lot less effort and the food tastes much better and less gas used so more efficient than a chip pan etc also food much less greasy., yes they are a lot less effort and the food tastes much better and less gas used so more efficient than a chip pan etc also food much less greasy,effort food taste chip food
1.5646768815087002e+18,2022-08-30 18:10:13+00:00,['1564676881508700165'],@Elwick70 Used to be known as Doncaster St James junction when I was in control., used to be known as doncaster st james junction when i was in control,doncaster james junction control
1.5646757632903987e+18,2022-08-30 18:05:46+00:00,['1564675763290398721'],@sheilaMol1 Spud doing his happy dance !, spud doing his happy dance ,spud dance
1.5646720427749704e+18,2022-08-30 17:50:59+00:00,['1564672042774970373'],@traceyb78 While you are in the area get off at Castellmmare di stabia and take the cable car up to the top the views are superb., while you are in the area get off at castellmmare di stabia and take the cable car up to the top the views are superb,area castellmmare stabia cable view
1.56467157149039e+18,2022-08-30 17:49:07+00:00,['1564671571490390018'],@traceyb78 Only choice Circumversuviana, only choice circumversuviana,choice circumversuviana
1.5641955730491963e+18,2022-08-29 10:17:40+00:00,['1564195573049196546'],@countrymousie @BBCRadio4 A similarthing happened to me when I got a rescue cat from cats Protection. She escaped the box they had given me and went mad in the car just as I drove off. I had to turn around and go back to the centre and beep my horn till help arrived to get her in a carrier !,  a similarthing happened to me when i got a rescue cat from cats protection she escaped the box they had given me and went mad in the car just as i drove off i had to turn around and go back to the centre and beep my horn till help arrived to get her in a carrier ,similarthing rescue protection centre horn till help carrier
1.5639776574355374e+18,2022-08-28 19:51:45+00:00,['1563977657435537409'],@AkamKevin Stevie Nicks, stevie nicks,stevie nick
1.5638355187392594e+18,2022-08-28 10:26:56+00:00,['1563835518739259393'],@ResponsePS I use a triangular pillow now and have so much better sleep than I used to. And as my other half has sleep apnea i can bury my lugs in it as well as her machine can be noisy if it comes off her face ! So win win., i use a triangular pillow now and have so much better sleep than i used to and as my other half has sleep apnea i can bury my lugs in it as well as her machine can be noisy if it comes off her face  so win win,pillow sleep half machine face
1.563834513616167e+18,2022-08-28 10:22:57+00:00,['1563834513616166913'],@traceyb78 You will love it but its like a sun trap and you will be exhausted if you do a lot of walking around the site it is massive and absolutely fascinating. And all the time in the shadow of Versuvious., you will love it but its like a sun trap and you will be exhausted if you do a lot of walking around the site it is massive and absolutely fascinating and all the time in the shadow of versuvious,trap site time shadow
1.563833858549842e+18,2022-08-28 10:20:21+00:00,['1563833858549841923'],@PaulMBigland Not just Glasgow it is all over Scotland sadly. ! I have even seen Buckfast bottles at the top of very big hills !, not just glasgow it is all over scotland sadly  i have even seen buckfast bottles at the top of very big hills ,buckfast bottle hill
1.563591301588607e+18,2022-08-27 18:16:31+00:00,['1563591301588606976'],@ChimeWhistle @JenWilliamsMEN @drjennings Nah but the heating pools will bugger up Sunak !,   nah but the heating pools will bugger up sunak ,heating pool sunak
1.5635750036435313e+18,2022-08-27 17:11:45+00:00,['1563575003643531266'],@1701aStarship Cracking shots there but was it only a small shed or has the rest not been excavated ?, cracking shots there but was it only a small shed or has the rest not been excavated ,shot shed rest
1.563504541886075e+18,2022-08-27 12:31:45+00:00,['1563504541886074881'],@AwTroon @Dizzy7Honey @William07491650 @rosariamelo033 What a lovely gesture for Bob. I already miss his posts and photographs of the birds etc.,    what a lovely gesture for bob i already miss his posts and photographs of the birds etc,gesture post photograph bird
1.5634812970701496e+18,2022-08-27 10:59:23+00:00,['1563481297070149632'],@JohnWaddo Thought as much as I have walked the opposite bank (The Greenock cut) from Greenock back to Clyde Muirishiel park, thought as much as i have walked the opposite bank the greenock cut from greenock back to clyde muirishiel park,bank greenock greenock muirishiel park
1.563475505776857e+18,2022-08-27 10:36:23+00:00,['1563475505776857089'],@ChimeWhistle @chris_railway Yes I noted the Devon and Cornwall bit. What about Colin Marsden he lived or worked down that bit back then ? Maybe he would know?,  yes i noted the devon and cornwall bit what about colin marsden he lived or worked down that bit back then  maybe he would know,devon colin marsden
1.5634618961617428e+18,2022-08-27 09:42:18+00:00,['1563461896161742851'],@ChimeWhistle @chris_railway Would you have any ideas as you were on the photographic circuit soon after then? I must admit I had not heard of him before?,  would you have any ideas as you were on the photographic circuit soon after then i must admit i had not heard of him before,idea circuit
1.5634532586264044e+18,2022-08-27 09:07:59+00:00,['1563453258626404352'],@ChimeWhistle Looks to have worked with Norman Preedy ? https://t.co/tIReZWDGj6, looks to have worked with norman preedy  ,look preedy
1.563419252874695e+18,2022-08-27 06:52:51+00:00,['1563419252874694656'],@JohnWaddo Morning JohnCertainly cold and damp this morning here in Ayrshire. Where is that view taken please?, morning johncertainly cold and damp this morning here in ayrshire where is that view taken please,morning morning ayrshire view please
1.5630633187385098e+18,2022-08-26 07:18:30+00:00,['1563063318738509824'],@mrst43 Butter wouldn't melt in their mouths the poor creatures !, butter wouldn't melt in their mouths the poor creatures ,butter mouth creature
1.5630630000385188e+18,2022-08-26 07:17:14+00:00,['1563063000038518784'],@weeworld50 There has been a CATastrophe on the railway this morning ! 🤣🚂🐈, there has been a catastrophe on the railway this morning  ,catastrophe railway morning
1.5630624827549942e+18,2022-08-26 07:15:10+00:00,['1563062482754994176'],@sheilaMol1 Morning Missus fi only I could do that trick first thing in the morning ! (or any time for that matter) 🤣☕️😀, morning missus fi only i could do that trick first thing in the morning  or any time for that matter ,morning missus thing morning time matter
1.5630620491311063e+18,2022-08-26 07:13:27+00:00,['1563062049131106304'],@sheilaMol1 Glad to see you have your thermal blanket on already ! AKA Spud !, glad to see you have your thermal blanket on already  aka spud ,glad blanket
1.5629461500593766e+18,2022-08-25 23:32:54+00:00,['1562946150059376640'],@SteveKi51489547 @andrewp538 You could park a double-decker bus in that space !,  you could park a doubledecker bus in that space ,doubledecker space
1.5629447783961354e+18,2022-08-25 23:27:27+00:00,['1562944778396135424'],@davenewworld_2 The fact she is a Mexican-American is lost on herself obviously. And that sometime in her family they moved from Mexico for a better life. She needs locking up for sure., the fact she is a mexicanamerican is lost on herself obviously and that sometime in her family they moved from mexico for a better life she needs locking up for sure,fact family mexico life
1.5627631632671375e+18,2022-08-25 11:25:47+00:00,['1562763163267137537'],@teagirlofsteel Just like black people and all the other stereotypes these people call out. They are just narrow minded bigots, just like black people and all the other stereotypes these people call out they are just narrow minded bigots,people people bigot
1.5627619560118477e+18,2022-08-25 11:20:59+00:00,['1562761956011847682'],@Fran115MW Why would you think that are you saying all trans and gay people are sex offenders because if you are you are a narrow-minded bigot. And I bet you go to church every Sunday worshipping a fake god when more priests etc have been sex offenders than any other., why would you think that are you saying all trans and gay people are sex offenders because if you are you are a narrowminded bigot and i bet you go to church every sunday worshipping a fake god when more priests etc have been sex offenders than any other,trans people offender bigot sunday priest offender
1.5627613821429555e+18,2022-08-25 11:18:42+00:00,['1562761382142955526'],"@jofwise @marksandspencer Too right, Some people (many it seems) think gay people are all paedophiles and sex offenders ! Back to the victorian era along with the back pedalling on trans and gay rights by the government",  too right some people many it seems think gay people are all paedophiles and sex offenders  back to the victorian era along with the back pedalling on trans and gay rights by the government,people people paedophile offender pedalling trans right government
1.5627607373736223e+18,2022-08-25 11:16:09+00:00,['1562760737373622277'],@MrsMaryOB So where will trans people buy their clothes ? 🤣, so where will trans people buy their clothes  ,people clothes
1.5627001508745994e+18,2022-08-25 07:15:24+00:00,['1562700150874599429'],@sheilaMol1 That is why you couldn't find them you did a search and got your worms mixed up ROFL, that is why you couldn't find them you did a search and got your worms mixed up rofl,search worm rofl
1.5626994329020252e+18,2022-08-25 07:12:33+00:00,['1562699432902025216'],@sheilaMol1 Or even the brakes. that's why it has taken so long for a woman to do it !, or even the brakes that's why it has taken so long for a woman to do it ,brake woman
1.5621976926334607e+18,2022-08-23 21:58:48+00:00,['1562197692633460736'],@katiec1314 Totally do not understand British humour. Probably vetted by someone in outer Mongolia. Makes me laugh community standards when they let scammers who are clearly fake keep trolling women in groups even when reported., totally do not understand british humour probably vetted by someone in outer mongolia makes me laugh community standards when they let scammers who are clearly fake keep trolling women in groups even when reported,humour someone mongolia community standard scammer woman group
1.5621572783624847e+18,2022-08-23 19:18:13+00:00,['1562157278362484736'],@AwTroon That will be on my list for a visit soon., that will be on my list for a visit soon,list visit
1.562007144161067e+18,2022-08-23 09:21:38+00:00,['1562007144161067008'],"@N_Amberfield Probably the local trip working we had the same at Toton T47 was 1x20 and a brakevan work as required 0600 Monday-1400 Saturday shunting and tripping wagons all over the place including Butterley, Ratcliffe PS etc etc Used to love working that job just like that guard in my smock", probably the local trip working we had the same at toton t was and a brakevan work as required  monday saturday shunting and tripping wagons all over the place including butterley ratcliffe ps etc etc used to love working that job just like that guard in my smock,trip toton brakevan work saturday shunting wagon place butterley ratcliffe guard smock
1.5620063151567667e+18,2022-08-23 09:18:20+00:00,['1562006315156766721'],@FABSITEUK And now a 9 year old has been shot dead in Liverpool ! no leadership aimless rudderless and no moral compass at all., and now a year old has been shot dead in liverpool  no leadership aimless rudderless and no moral compass at all,year leadership aimless rudderless compass
1.5620060660906148e+18,2022-08-23 09:17:21+00:00,['1562006066090614785'],@flyabout7 Happy birthday big Lenny boy I hope the boss has brought you some treats and a cake!, happy birthday big lenny boy i hope the boss has brought you some treats and a cake,birthday lenny treat cake
1.561983938763137e+18,2022-08-23 07:49:25+00:00,['1561983938763137024'],@sheilaMol1 Yes thank you Pixie is currently asleep in one of the cat beds with her ass hanging out ! Rain incoming here so its a stay in day today. Still catching up from the wedding we were at over the weekend down on the Wirral and Runcorn., yes thank you pixie is currently asleep in one of the cat beds with her ass hanging out  rain incoming here so its a stay in day today still catching up from the wedding we were at over the weekend down on the wirral and runcorn,rain incoming stay today wedding weekend
1.5619833220117135e+18,2022-08-23 07:46:58+00:00,['1561983322011713537'],@mr_w_snapper @AirTanker Great airside shot there. Like the airport is just waking up for the day and the aircraft is having s stretch before its journey.,  great airside shot there like the airport is just waking up for the day and the aircraft is having s stretch before its journey,airport aircraft stretch journey
1.5619826811220173e+18,2022-08-23 07:44:26+00:00,['1561982681122017283'],@MrsAstronaut Must be all the shit that comes out of their mouths and out the sewer pipes, must be all the shit that comes out of their mouths and out the sewer pipes,shit mouth pipe
1.5619824647419986e+18,2022-08-23 07:43:34+00:00,['1561982464741998592'],@sheilaMol1 Good morning loveliness and the boys 😀☕️☕️☕️, good morning loveliness and the boys ,morning loveliness
1.561815185630892e+18,2022-08-22 20:38:52+00:00,['1561815185630892033'],@MrsAstronaut Not only is she ignorant of facts but she lives in Englandshire that land of sunlit uplands and raw sewerage effluent !, not only is she ignorant of facts but she lives in englandshire that land of sunlit uplands and raw sewerage effluent ,ignorant fact englandshire land upland sewerage effluent
1.5618058651449672e+18,2022-08-22 20:01:49+00:00,['1561805865144967169'],This is the demented Tory supporter who cannot say exactly what Boris has actually done for this country god help us ! https://t.co/GXXcsxbo6l,this is the demented tory supporter who cannot say exactly what boris has actually done for this country god help us  ,tory supporter boris country help
1.5618043802901422e+18,2022-08-22 19:55:55+00:00,['1561804380290142209'],@sheilaMol1 One of the two brothers went on to win Crufts with I think an Afghan hound (Another stupid fact I keep in this empty head of mine!), one of the two brothers went on to win crufts with i think an afghan hound another stupid fact i keep in this empty head of mine,brother crufts afghan hound fact head mine
1.5617716909332316e+18,2022-08-22 17:46:02+00:00,['1561771690933231617'],@sheilaMol1 That shows what gentle giants they are and that nature and animals are such wonderful things., that shows what gentle giants they are and that nature and animals are such wonderful things,giant nature animal thing
1.561751434806313e+18,2022-08-22 16:25:32+00:00,['1561751434806312962'],@sheilaMol1 Hurry up mum I am starving I have had nothing to eat all day as the maid this morning forgot to feed me !, hurry up mum i am starving i have had nothing to eat all day as the maid this morning forgot to feed me ,nothing maid morning
1.5617509323412603e+18,2022-08-22 16:23:32+00:00,['1561750932341260288'],@JDrvr Or in other words sheer brute force and a good shove !, or in other words sheer brute force and a good shove ,word force shove
1.5616695515694694e+18,2022-08-22 11:00:10+00:00,['1561669551569469440'],@FABSITEUK Congratulations John We were at my stepsons wedding on the Wirral over the weekend., congratulations john we were at my stepsons wedding on the wirral over the weekend,congratulation stepson wirral weekend
1.561654121324847e+18,2022-08-22 09:58:51+00:00,['1561654121324847107'],@EphemeralArc @davesumnersmith Well go then nothing stopping you joining the mad party down south on your bike,  well go then nothing stopping you joining the mad party down south on your bike,nothing party bike
1.561648331323048e+18,2022-08-22 09:35:50+00:00,['1561648331323047936'],@railnews The only person doing long-term damage is to himself and the Tory party and that is Grant Shapps, the only person doing longterm damage is to himself and the tory party and that is grant shapps,person damage tory party shapps
1.5616479438070784e+18,2022-08-22 09:34:18+00:00,['1561647943807078403'],@gangouskhan @ChrisNoNumbers @brianboyle73 @dizzy9491 @LouHaigh @grantshapps @RMTunion Really you know zero obviously if you thin noone is supporting these strikes ! Public support is behind the likes of @RMTunion and Mick Lynch far more than @granshapps belive me,       really you know zero obviously if you thin noone is supporting these strikes  public support is behind the likes of  and mick lynch far more than  belive me,strike support like mick lynch
1.561647217118777e+18,2022-08-22 09:31:25+00:00,['1561647217118777346'],@ChimeWhistle @RealJohnWynne So paying lip service to climate change while encouraging car use as opposed to electrification and train travel ! Typical Tories.,  so paying lip service to climate change while encouraging car use as opposed to electrification and train travel  typical tories,service change electrification train travel tory
1.561613696576721e+18,2022-08-22 07:18:13+00:00,['1561613696576720896'],@WYSIW @DieselDragonUK @shaf_1990 That is why there is a reminder the same as a lorry driver who should know the height of his vehicle and trailer (some dont hence bridge bashes),   that is why there is a reminder the same as a lorry driver who should know the height of his vehicle and trailer some dont hence bridge bashes,reminder lorry driver height vehicle hence bridge bash
1.561612637888303e+18,2022-08-22 07:14:00+00:00,['1561612637888303105'],@MadScientistFF Key Lime because I have tasted the real thing in the Florida Keys and they are divine., key lime because i have tasted the real thing in the florida keys and they are divine,lime thing florida
1.5615813742969733e+18,2022-08-22 05:09:47+00:00,['1561581374296973318'],@sheilaMol1 @Chris_Alex Spud is a Yam-Yam then rofl,  spud is a yamyam then rofl,spud yamyam
1.5614096150568305e+18,2022-08-21 17:47:16+00:00,['1561409615056830466'],@AwTroon No a big wedding 100 guests at a country hotel in the middle of nowhere (or it felt like that) a very long day after staying near Liverpool Friday wedding Saturday and then a late breakfast Sunday the disco was on till 1am and they also had a singer from The Voice at night., no a big wedding guests at a country hotel in the middle of nowhere or it felt like that a very long day after staying near liverpool friday wedding saturday and then a late breakfast sunday the disco was on till and they also had a singer from the voice at night,wedding guest country hotel middle liverpool friday saturday breakfast disco till singer voice night
1.5613886014302167e+18,2022-08-21 16:23:46+00:00,['1561388601430216706'],@AwTroon Sorry been away at a big wedding on the Wirral for the weekend, sorry been away at a big wedding on the wirral for the weekend,wedding wirral weekend
1.5604931161001656e+18,2022-08-19 05:05:26+00:00,['1560493116100165638'],@AwTroon OMG So sorry I did not know until now. Sad that you lost a friend and everything but you have rebuilt your life which shows how resilient you are. Sending big hugs, omg so sorry i did not know until now sad that you lost a friend and everything but you have rebuilt your life which shows how resilient you are sending big hugs,friend everything life
1.5603125282903245e+18,2022-08-18 17:07:50+00:00,['1560312528290324480'],@highfieldsherdy That shows the love and trust of an animal and the bond between you. So precious, that shows the love and trust of an animal and the bond between you so precious,love trust animal bond
1.5603093436604252e+18,2022-08-18 16:55:11+00:00,['1560309343660425219'],@AwTroon @BrianBengal That is probably in the freezer ready for the onslaught ROFL,  that is probably in the freezer ready for the onslaught rofl,freezer onslaught rofl
1.560303000052179e+18,2022-08-18 16:29:58+00:00,['1560303000052178945'],@AwTroon Aye I know the one next to the snack cabin where all the cops go for breakfast 😀, aye i know the one next to the snack cabin where all the cops go for breakfast ,snack cabin breakfast
1.5603003148296724e+18,2022-08-18 16:19:18+00:00,['1560300314829672449'],@WornOutMumster @AwTroon Yes Morrisons also in town with no real competition will be rubbing their hands with glee. And they are quite expensive.,  yes morrisons also in town with no real competition will be rubbing their hands with glee and they are quite expensive,morrison town competition hand glee
1.5603000745503662e+18,2022-08-18 16:18:21+00:00,['1560300074550366209'],@AwTroon Oh the Troon one is closing damn ? Thats not good I shop there quite a bit but nott been for a few weeks now very sad., oh the troon one is closing damn  thats not good i shop there quite a bit but nott been for a few weeks now very sad,troon thats week
1.5602520018706596e+18,2022-08-18 13:07:19+00:00,['1560252001870659584'],@a378driver @Bkasparas @JDrvr That is what route knowledge is all about though imagine the old drivers with only a small lamp in a semaphore signal and smoke down the boiler and doing the ton ! Now they earned their crust including my dad who started in 1948 as a clearer/Fireman/driver,   that is what route knowledge is all about though imagine the old drivers with only a small lamp in a semaphore signal and smoke down the boiler and doing the ton  now they earned their crust including my dad who started in as a clearerfiremandriver,route knowledge imagine driver lamp signal boiler crust clearerfiremandriver
1.5602514979711263e+18,2022-08-18 13:05:19+00:00,['1560251497971126275'],@JDrvr Congratulations Jamie. You will probably have seen this before but here is my dad at Nottingham awaiting the tip before a trip to London and back later before he retired I rode footplate with him and a traction inspector on one of his last days https://t.co/ABbCinr0qD, congratulations jamie you will probably have seen this before but here is my dad at nottingham awaiting the tip before a trip to london and back later before he retired i rode footplate with him and a traction inspector on one of his last days ,congratulation trip rode footplate traction inspector
1.5602505863978107e+18,2022-08-18 13:01:42+00:00,['1560250586397810700'],@a378driver @JDrvr Power cars were matched wherever possible to even out performance but no two were the same at all. In the old Cross country days quite a few had technical riding inspectors with them to keep them going.,  power cars were matched wherever possible to even out performance but no two were the same at all in the old cross country days quite a few had technical riding inspectors with them to keep them going,power performance country riding inspector
1.5601948451546767e+18,2022-08-18 09:20:12+00:00,['1560194845154676738'],This is what being part of @Labour used to be till the Tory party infiltrated the workers party. https://t.co/Db3QbHKryP,this is what being part of  used to be till the tory party infiltrated the workers party ,part tory party worker party
1.5601818314541343e+18,2022-08-18 08:28:30+00:00,['1560181831454134272'],@marieca66585944 @MailOnline You believe that crap It is the Daily fail after all spouted from the mouths of its Tory backers. ! Harry Potter is less a work of fiction than the DailyFail.,  you believe that crap it is the daily fail after all spouted from the mouths of its tory backers  harry potter is less a work of fiction than the dailyfail,crap fail mouth tory backer potter work fiction dailyfail
1.5601813153324564e+18,2022-08-18 08:26:26+00:00,['1560181315332456448'],@JamesSm79356044 @toryboypierce @JeremyVineOn5 Ah diddums serves you right for supporting Farage,   ah diddums serves you right for supporting farage,diddums farage
1.560166796275114e+18,2022-08-18 07:28:45+00:00,['1560166796275113986'],That beat the Germans to putting a towel on it ! https://t.co/4KjHZB9SH3,that beat the germans to putting a towel on it  ,german towel
1.560166085772677e+18,2022-08-18 07:25:55+00:00,['1560166085772677120'],The audacity and brass neck of this cretin knows no bounds she is in the shit (literally) and she knows it. https://t.co/wtgFHDLOez,the audacity and brass neck of this cretin knows no bounds she is in the shit literally and she knows it ,audacity brass neck cretin bound shit
1.560165440177029e+18,2022-08-18 07:23:22+00:00,['1560165440177029122'],I am sure Mr Cleverley is not as clever as he thinks he is and my railway friends will have something to say about this. https://t.co/3RFvahaNqX,i am sure mr cleverley is not as clever as he thinks he is and my railway friends will have something to say about this ,cleverley clever railway friend something
1.5601648578063073e+18,2022-08-18 07:21:03+00:00,['1560164857806307335'],@sheilaMol1 Morning sunshine Pixie walked for the second day in a row now curled up snoring ! Coffee on the go. Have a lovely day., morning sunshine pixie walked for the second day in a row now curled up snoring  coffee on the go have a lovely day,morning sunshine pixie coffee
