Unnamed: 0,Unnamed: 0.1,Unnamed: 0.1.1,id,created_at,edit_history_tweet_ids,text,clean_text,non_english,whitespace
1428,1428,1428,1.4487092487964795e+18,2021-10-14 17:56:15+00:00,['1448709248796479494'],'We have to think about our next generation of leaders in all sorts of levels. How can we get those social care nurses at the table?' @sturdy_deborah #qni2021,we have to think about our next generation of leaders in all sorts of levels how can we get those social care nurses at the table  ,True,False
1429,1429,1429,1.4487082998309888e+18,2021-10-14 17:52:29+00:00,['1448708299830988803'],"'One of the positive things in terms of #covid and moving forward, is the work I've seen of district nurses and community nurses supporting colleagues in social care. It's brought about some fantastic relationships that I know will work into the future.' @sturdy_deborah #qni2021",one of the positive things in terms of  and moving forward is the work ive seen of district nurses and community nurses supporting colleagues in social care its brought about some fantastic relationships that i know will work into the future  ,True,False
1430,1430,1430,1.448707812956287e+18,2021-10-14 17:50:32+00:00,['1448707812956286982'],@sturdy_deborah speaking at #qni2021 'Social care nursing is not for the faint-hearted.' https://t.co/KKQTWDN41x, speaking at  social care nursing is not for the fainthearted ,True,False
1431,1431,1431,1.4487068789435023e+18,2021-10-14 17:46:50+00:00,['1448706878943502341'],"'I want to thank all of our nurses working in the community. I know how hard you have worked. I have been overwhelmed by what I've seen nurses do during this pandemic, the commitment and professionalism is second to none.' @charlottemcardl #qni2021",i want to thank all of our nurses working in the community i know how hard you have worked i have been overwhelmed by what ive seen nurses do during this pandemic the commitment and professionalism is second to none  ,True,False
1432,1432,1432,1.4487062464969974e+18,2021-10-14 17:44:19+00:00,['1448706246496997377'],'As nurses we have a significant role in building back fairer. That must be our collective ambition' @charlottemcardl #qni2021,as nurses we have a significant role in building back fairer that must be our collective ambition  ,True,False
1433,1433,1433,1.4487052836777288e+18,2021-10-14 17:40:29+00:00,['1448705283677728771'],The report from Northern Ireland: Nurses for Health Equity @charlottemcardl #qni2021 https://t.co/WH36S3JUBk https://t.co/vIcOVqxN0T,the report from northern ireland nurses for health equity    ,True,False
1434,1434,1434,1.4487046589528842e+18,2021-10-14 17:38:00+00:00,['1448704658952884232'],@charlottemcardl How Northern Ireland is building back fairer with 3 themes #qni2021 https://t.co/bYdr99itF1, how northern ireland is building back fairer with 3 themes  ,True,False
1435,1435,1435,1.448704371341017e+18,2021-10-14 17:36:52+00:00,['1448704371341017095'],"Good evening from Northern Ireland @charlottemcardl #qni2021 'It's clear that the pandemic is amplifying inequalities in the world, including Northern Ireland. Reducing inequalities in health is a huge challenge.' https://t.co/4gy0jZAxXz",good evening from northern ireland   its clear that the pandemic is amplifying inequalities in the world including northern ireland reducing inequalities in health is a huge challenge ,True,False
1436,1436,1436,1.448703473957081e+18,2021-10-14 17:33:18+00:00,['1448703473957081095'],"'A massive thank you, I look forward to working with our community nurses, to support you to deliver outstanding service for the people of #Wales. I need to hear you and listen to you. Diolch for everything you do.' @suenaidoo73 #qni2021",a massive thank you i look forward to working with our community nurses to support you to deliver outstanding service for the people of  i need to hear you and listen to you diolch for everything you do  ,True,False
1437,1437,1437,1.4487030498752143e+18,2021-10-14 17:31:37+00:00,['1448703049875214350'],"'Workforce continues to be a priority. We've maintained the bursary but there is more to do. We've increased the funding for our pre-reg funding, for education in training. It's a record level of funding and it's right that we continue to fund the services.' #qni2021 @suenaidoo73",workforce continues to be a priority weve maintained the bursary but there is more to do weve increased the funding for our prereg funding for education in training its a record level of funding and its right that we continue to fund the services  ,True,False
1438,1438,1438,1.4487016568839455e+18,2021-10-14 17:26:05+00:00,['1448701656883945472'],'We have put in mental health support for our staff in and students in Wales and we have had quite a lot of people take up that service which I am delighted they are doing.' @suenaidoo73 #qni2021,we have put in mental health support for our staff in and students in wales and we have had quite a lot of people take up that service which i am delighted they are doing  ,True,False
1439,1439,1439,1.4487009311602934e+18,2021-10-14 17:23:12+00:00,['1448700931160293378'],"'The frail elderly, those from deprived areas, have felt the impact of this pandemic more so than others, our community nurses in Wales have been delivering care despite the very difficult 18 months. As your CNO I'm so very proud of you for the amazing job you do.' @suenaidoo73",the frail elderly those from deprived areas have felt the impact of this pandemic more so than others our community nurses in wales have been delivering care despite the very difficult 18 months as your cno im so very proud of you for the amazing job you do ,True,False
1440,1440,1440,1.4487004357627167e+18,2021-10-14 17:21:14+00:00,['1448700435762716678'],"@suenaidoo73 'Thank you for your hard work, meeting the huge challenges of the covid pandemic, a heartfelt thank you and to the teams that support you. The commitment you have shown in delivering care in your communities, is nothing short of outstanding.' #qni2021 https://t.co/a7dpp0OccY", thank you for your hard work meeting the huge challenges of the covid pandemic a heartfelt thank you and to the teams that support you the commitment you have shown in delivering care in your communities is nothing short of outstanding  ,True,False
1441,1441,1441,1.448700083411751e+18,2021-10-14 17:19:50+00:00,['1448700083411750913'],"Jenni Middleton, QNI Trustee, welcoming @suenaidoo73 #qni2021 https://t.co/XT0nfbGM2O",jenni middleton qni trustee welcoming   ,True,False
1442,1442,1442,1.448699792922751e+18,2021-10-14 17:18:40+00:00,['1448699792922750977'],"Our next session, 'A Conversation with Chief Nurses of the UK' @suenaidoo73 @charlottemcardl @sturdy_deborah @profalexmcmahon and @CNOEngland #qni2021 https://t.co/jeziu8uOZn",our next session a conversation with chief nurses of the uk     and   ,True,False
1443,1443,1443,1.448699469659263e+18,2021-10-14 17:17:23+00:00,['1448699469659262981'],Thank you @GeorgePlumptre for your wonderful session this evening #qni2021 @NGSOpenGardens https://t.co/u0C4G12YvQ,thank you  for your wonderful session this evening   ,True,False
1444,1444,1444,1.4486989889794376e+18,2021-10-14 17:15:29+00:00,['1448698988979437572'],"'Rather than hero worship, the healthcare systems would most benefit from supportive and innovative scrutiny and radical development, often demonstrated by the QNI which has kept them relevant and efficient.' Thank you @GeorgePlumptre #qni2021",rather than hero worship the healthcare systems would most benefit from supportive and innovative scrutiny and radical development often demonstrated by the qni which has kept them relevant and efficient thank you  ,True,False
1445,1445,1445,1.4486984022592225e+18,2021-10-14 17:13:09+00:00,['1448698402259222528'],"'Nothing would have shortened Judy's decline or her death, but a very small amount of the right care would have improved her final weeks and days.' @GeorgePlumptre recounting his mother in law Judy's very upsetting patient journey #qni2021",nothing would have shortened judys decline or her death but a very small amount of the right care would have improved her final weeks and days  recounting his mother in law judys very upsetting patient journey ,True,False
1447,1447,1447,1.4486964924123177e+18,2021-10-14 17:05:33+00:00,['1448696492412317697'],'#Covid highlighted inequalities in the UK. It hit not only lower socio-economic groups hardest but the economic impact of policies to tackle the virus was borne most heavily by low paid workers least able to work from home.' @GeorgePlumptre #qni2021, highlighted inequalities in the uk it hit not only lower socioeconomic groups hardest but the economic impact of policies to tackle the virus was borne most heavily by low paid workers least able to work from home  ,True,False
1448,1448,1448,1.448696205769388e+18,2021-10-14 17:04:25+00:00,['1448696205769388032'],'Charities play a leading part in tackling inequality and the burdens of disease and disability.' @GeorgePlumptre #qni2021,charities play a leading part in tackling inequality and the burdens of disease and disability  ,True,False
1449,1449,1449,1.448695174524285e+18,2021-10-14 17:00:19+00:00,['1448695174524284941'],The @NGSOpenGardens report 'Health Charities and the NHS: A Vital Partnership in Peril' can be found here: https://t.co/PPzT9HyM29 #qni2021 @GeorgePlumptre https://t.co/3eZ20sYH5L,the  report health charities and the nhs a vital partnership in peril can be found here    ,True,False
1450,1450,1450,1.448694115391189e+18,2021-10-14 16:56:07+00:00,['1448694115391188994'],"Some examples of the kind of projects for the @NGSOpenGardens Elsie Wagg Scholarship now available, to find out more: https://t.co/khxClxT0OI #qni2021 @GeorgePlumptre https://t.co/eOfJYllWkO",some examples of the kind of projects for the  elsie wagg scholarship now available to find out more    ,True,False
1451,1451,1451,1.448692638023045e+18,2021-10-14 16:50:14+00:00,['1448692638023045124'],@GeorgePlumptre The NGS Elsie Wagg Scholarship launched this year with @NGSOpenGardens . The scholarship is open to projects that promote the health benefits of gardening and garden visiting among a group of people. To find out more and to apply: https://t.co/khxClxT0OI #qni2021 https://t.co/yuN5Q7OgmI, the ngs elsie wagg scholarship launched this year with   the scholarship is open to projects that promote the health benefits of gardening and garden visiting among a group of people to find out more and to apply   ,True,False
1452,1452,1452,1.4486911675252244e+18,2021-10-14 16:44:24+00:00,['1448691167525224449'],@GeorgePlumptre speaking at #qni2021 'Health Charities and The NHS: A Vital Partnership in Peril?' https://t.co/MgtumUGMnB, speaking at  health charities and the nhs a vital partnership in peril ,True,False
1453,1453,1453,1.448690261211689e+18,2021-10-14 16:40:48+00:00,['1448690261211688973'],"@CrystalOldman 'It was a privilege for me to have known Ursula. Her teaching. her values, her legacy will live on with all of us. She has taught us all so much. She was a true nursing giant. Thank you Ursula you're gone way too soon, your legacy shines on brightly.' #qni2021 https://t.co/zv5GP1PF0d", it was a privilege for me to have known ursula her teaching her values her legacy will live on with all of us she has taught us all so much she was a true nursing giant thank you ursula youre gone way too soon your legacy shines on brightly  ,True,False
1454,1454,1454,1.448689648948101e+18,2021-10-14 16:38:22+00:00,['1448689648948101125'],"@CrystalOldman making a tribute to Professor Ursula Gallagher MBE FQNI, 'Ursula told students to challenge those who told them they were 'just' a nurse. She was a hard act to follow and a trailblazer. She was fabulously supportive as a Fellow of the QNI.' #qni2021 https://t.co/sznUyi9OFO", making a tribute to professor ursula gallagher mbe fqni ursula told students to challenge those who told them they were just a nurse she was a hard act to follow and a trailblazer she was fabulously supportive as a fellow of the qni  ,True,False
1455,1455,1455,1.448688363335258e+18,2021-10-14 16:33:15+00:00,['1448688363335258118'],"@CrystalOldman 'We want you to all to be re energised by the conference and to return to work with a spring in your step, we all need that right now.' #qni2021 https://t.co/roLuoG2H8l", we want you to all to be re energised by the conference and to return to work with a spring in your step we all need that right now  ,True,False
1456,1456,1456,1.4486854274314568e+18,2021-10-14 16:21:35+00:00,['1448685427431456781'],"To watch the amazing animation that the QNI made in collaboration with @Hallam_Medical to celebrate the Year of the Nurse and Midwife, narrated by the wonderful @StephenMcGann from #CallTheMidwife please go to: https://t.co/KmftghFBEf #qni2021",to watch the amazing animation that the qni made in collaboration with  to celebrate the year of the nurse and midwife narrated by the wonderful  from  please go to  ,True,False
1457,1457,1457,1.448683805930365e+18,2021-10-14 16:15:09+00:00,['1448683805930364932'],"'Since 2019 our clinicians have worked a massive 778,212 hours, they've seen 3.1 million patients: our nurses make a difference and we are here to make a difference to your patients' lives.' @Hallam_Medical #qni2021",since 2019 our clinicians have worked a massive 778212 hours theyve seen 31 million patients our nurses make a difference and we are here to make a difference to your patients lives  ,True,False
1459,1459,1459,1.4486828306413855e+18,2021-10-14 16:11:16+00:00,['1448682830641385478'],"'We've noticed a change over the last year, we're seeing an increase in demand for school nurses, occupational therapists, dental care nurses and much more, showing that keeping patients in the community is becoming more and more important.' @Hallam_Medical #qni2021",weve noticed a change over the last year were seeing an increase in demand for school nurses occupational therapists dental care nurses and much more showing that keeping patients in the community is becoming more and more important  ,True,False
1460,1460,1460,1.4486823608123187e+18,2021-10-14 16:09:24+00:00,['1448682360812318721'],"Our sponsor @Hallam_Medical #qni2021 'At @Hallam_Medical we are not on the front line, however  I wholeheartedly believe we are  making a difference to the services you work in and the patients you look after.'",our sponsor   at  we are not on the front line however  i wholeheartedly believe we are  making a difference to the services you work in and the patients you look after,True,False
1461,1461,1461,1.4486807862243738e+18,2021-10-14 16:03:09+00:00,['1448680786224373761'],"#Welcome to Day 4 of #qni2021 from @CrystalOldman we are looking forward to some inspiring sessions, thank you for joining us! https://t.co/MMhraTtIBG https://t.co/KPJIr5VbkK", to day 4 of  from  we are looking forward to some inspiring sessions thank you for joining us  ,True,False
1462,1462,1462,1.4486704809117125e+18,2021-10-14 15:22:12+00:00,['1448670480911712258'],"Less than an hour till Day 4 of our #qni2021 conference, Building Back Fairer. Today's theme is 'The Nurses' Role in Building Back Fairer: A UK Perspective'. Thank you to our sponsor @Hallam_Medical https://t.co/m0m0YWsqZS",less than an hour till day 4 of our  conference building back fairer todays theme is the nurses role in building back fairer a uk perspective thank you to our sponsor  ,True,False
1464,1464,1464,1.4486407538701148e+18,2021-10-14 13:24:04+00:00,['1448640753870114827'],"Will you be affected by the fall in Universal Credit allowance announced recently? The QNI may be able to help. Full post on our Facebook page here, or email us at mail@qni.org.uk for more information: https://t.co/pyCfbKpZO6 @CHSA_org",will you be affected by the fall in universal credit allowance announced recently the qni may be able to help full post on our facebook page here or email us at mailorguk for more information  ,True,False
1466,1466,1466,1.448341346306216e+18,2021-10-13 17:34:20+00:00,['1448341346306215938'],Thank you to all our speakers today! Thank you to today's sponsor @AllocateS  See you tomorrow! A reminder that we have a very special guest His Royal Highness The Prince of Wales @clarencehouse with a special message to all community nurses on Friday at 10am #qni2021,thank you to all our speakers today thank you to todays sponsor   see you tomorrow a reminder that we have a very special guest his royal highness the prince of wales  with a special message to all community nurses on friday at 10am ,True,False
1467,1467,1467,1.4483409070325228e+18,2021-10-13 17:32:35+00:00,['1448340907032522754'],Thank you for giving us our mojo back @suzannecgordon #qni2021 https://t.co/9kDRQxo1XE,thank you for giving us our mojo back   ,True,False
1468,1468,1468,1.4483387581059604e+18,2021-10-13 17:24:03+00:00,['1448338758105960453'],"'It's the voices of the frontline care giver that is critical and that's what we have done here. We want more to speak up and articulate the work that community nurses do, so in the next pandemic, people are not caught off guard.' @suzannegordon #qni2021 https://t.co/4SNWgubn1V",its the voices of the frontline care giver that is critical and thats what we have done here we want more to speak up and articulate the work that community nurses do so in the next pandemic people are not caught off guard   ,True,False
1469,1469,1469,1.4483382316033843e+18,2021-10-13 17:21:57+00:00,['1448338231603384323'],"'When you speak, you are a vehicle, not for just yourself, and btw there's nothing wrong with you getting praise for what you do, but you are speaking for patients too.' @suzannecgordon #qni2021",when you speak you are a vehicle not for just yourself and btw theres nothing wrong with you getting praise for what you do but you are speaking for patients too  ,True,False
1470,1470,1470,1.448337863947559e+18,2021-10-13 17:20:30+00:00,['1448337863947558916'],"'Support nurses who use their voice, read this book, text those nurses, thank these nurses, they are speaking for you. It's not boasting. They are speaking for nursing.' @suzannegordon #qni2021 https://t.co/4SNWgubn1V",support nurses who use their voice read this book text those nurses thank these nurses they are speaking for you its not boasting they are speaking for nursing   ,True,False
1471,1471,1471,1.4483375075785318e+18,2021-10-13 17:19:05+00:00,['1448337507578531844'],"'When you're a community nurse, and you go into those settings, it's like you're taking a CT of the patient's life, you are understanding why this couple as one story showed called an ambulance 141 times in one year. You find out why.' Read the story here: https://t.co/JwWPRKefTl",when youre a community nurse and you go into those settings its like youre taking a ct of the patients life you are understanding why this couple as one story showed called an ambulance 141 times in one year you find out why read the story here ,True,False
1472,1472,1472,1.448336921529303e+18,2021-10-13 17:16:45+00:00,['1448336921529303043'],"'You have an amazing system of community nursing.  I spent a day with @alderton_liz shadowing her. You go into the homes of people who have cancer, who have all kinds of problems and it was extraordinary to watch this nurse in action doing home care.' @suzannecgordon #qni2021",you have an amazing system of community nursing  i spent a day with  shadowing her you go into the homes of people who have cancer who have all kinds of problems and it was extraordinary to watch this nurse in action doing home care  ,True,False
1473,1473,1473,1.4483348170792755e+18,2021-10-13 17:08:23+00:00,['1448334817079275532'],'This project was designed to articulate the kind of work that nurses to and to overcome this silencing of the self and covering the critical important work that nurses do no matter where they are. ' @suzannecgordon #qni2021,this project was designed to articulate the kind of work that nurses to and to overcome this silencing of the self and covering the critical important work that nurses do no matter where they are   ,True,False
1474,1474,1474,1.4483344189643284e+18,2021-10-13 17:06:48+00:00,['1448334418964328452'],"'I'm a kind person, I can be nice and caring. I would kill your patients in a matter of hours! You want somebody who's learned on the job, who's gone to school (university) not just somebody who's nice and kind!' @suzannecgordon #qni2021",im a kind person i can be nice and caring i would kill your patients in a matter of hours you want somebody whos learned on the job whos gone to school university not just somebody whos nice and kind  ,True,False
1475,1475,1475,1.4483338648757248e+18,2021-10-13 17:04:36+00:00,['1448333864875724807'],"'The workshops focused on what nurses did, the skills they had. I wanted to help nurses talk in lay language so people would understand them, and to help them overcome their tendency to minimise their work.' @suzannecgordon #qni2021",the workshops focused on what nurses did the skills they had i wanted to help nurses talk in lay language so people would understand them and to help them overcome their tendency to minimise their work  ,True,False
1476,1476,1476,1.448332827607683e+18,2021-10-13 17:00:29+00:00,['1448332827607683080'],"'Nurses have been taught not to talk about their work, to be silent and silence each other. That's one of the biggest problems and this project reverses this dynamic' @suzannecgordon #qni2021 https://t.co/JwWPRKefTl",nurses have been taught not to talk about their work to be silent and silence each other thats one of the biggest problems and this project reverses this dynamic   ,True,False
1477,1477,1477,1.4483325912796242e+18,2021-10-13 16:59:33+00:00,['1448332591279624197'],We had to persuade people to tell their stories and teach them how to tell their stories.' @suzannecgordon launching the QNI's new Community Nurse Stories #qni2021 https://t.co/4SNWgubn1V,we had to persuade people to tell their stories and teach them how to tell their stories  launching the qnis new community nurse stories  ,True,False
1478,1478,1478,1.4483318352520397e+18,2021-10-13 16:56:32+00:00,['1448331835252039686'],'Nurses must explain that the system doesn't work without them. It's absolutely critical to have every single nurse on message about helping people understand about the critical importance of community nursing.' #qni2021 @suzannecgordon,nurses must explain that the system doesnt work without them its absolutely critical to have every single nurse on message about helping people understand about the critical importance of community nursing  ,True,False
1479,1479,1479,1.4483313111528653e+18,2021-10-13 16:54:27+00:00,['1448331311152865286'],'Getting nurses to talk is kind of like getting people to vote or be vaccinated. Because nurses have been fed a message: you should say little and do a lot and just soldier on.' @suzannecgordon #qni2021,getting nurses to talk is kind of like getting people to vote or be vaccinated because nurses have been fed a message you should say little and do a lot and just soldier on  ,True,False
1480,1480,1480,1.4483308890045235e+18,2021-10-13 16:52:47+00:00,['1448330889004523525'],'Too many times nurses in senior positions are content to just sit at the table but not shake up the table. The whole point is to get them to make a change to patient care.' #qni2021 @suzannecgordon,too many times nurses in senior positions are content to just sit at the table but not shake up the table the whole point is to get them to make a change to patient care  ,True,False
1481,1481,1481,1.4483299816339046e+18,2021-10-13 16:49:10+00:00,['1448329981633904649'],"Welcome to @suzannecgordon, International Author and Journalist speaking from California.  #qni2021 https://t.co/01p8FOC0Ym",welcome to  international author and journalist speaking from california   ,True,False
1482,1482,1482,1.448326937357734e+18,2021-10-13 16:37:05+00:00,['1448326937357733889'],Standing ovation for @annaperng  @ladywignall and @walterdellinger for a fascinating session on Global Nursing Leadership #qni2021 https://t.co/2A8Y8AkfNN,standing ovation for    and  for a fascinating session on global nursing leadership  ,True,False
1483,1483,1483,1.4483234535101972e+18,2021-10-13 16:23:14+00:00,['1448323453510197253'],"'Policy is everywhere, nurses must get comfortable with public administration, policy science and politics to be effective in the policy arena.' @ladywignall #qni2021 https://t.co/vvriSCA4M9",policy is everywhere nurses must get comfortable with public administration policy science and politics to be effective in the policy arena   ,True,False
1484,1484,1484,1.4483210151556792e+18,2021-10-13 16:13:33+00:00,['1448321015155679238'],"'The region I work in, which is approximately the size of England, serves about 1 million people and has 26,000 staff members, 180 different health care sites.' @ladywignall #qni2021 https://t.co/ElRIyn1j9C",the region i work in which is approximately the size of england serves about 1 million people and has 26000 staff members 180 different health care sites   ,True,False
1485,1485,1485,1.448319942386987e+18,2021-10-13 16:09:17+00:00,['1448319942386987011'],Healthy public policy: a branch of social policy @ladywignall #qni2021 https://t.co/Xrdsu8MxOC,healthy public policy a branch of social policy   ,True,False
1486,1486,1486,1.448319646621446e+18,2021-10-13 16:08:06+00:00,['1448319646621446148'],"@ladywignall speaking from Canada, 'A policy scientist who became a nurse.' #qni2021 https://t.co/6U5OfLbO8X", speaking from canada a policy scientist who became a nurse  ,True,False
