Unnamed: 0,Unnamed: 0.1,Unnamed: 0.1.1,id,created_at,edit_history_tweet_ids,text,clean_text,non_english,whitespace
1891,1891,1891,1.4337031700022764e+18,2021-09-03 08:07:27+00:00,['1433703170002276368'],'Reflecting on a year of being a Community Nursing Associate' : read our brilliant new blog by Bryony Fordham https://t.co/VyyZbBMl2S,reflecting on a year of being a community nursing associate  read our brilliant new blog by bryony fordham ,True,False
1892,1892,1892,1.4334411655845724e+18,2021-09-02 14:46:20+00:00,['1433441165584572421'],The Ward Round: An untested theory https://t.co/zvX0zNXQSE,the ward round an untested theory ,True,False
1893,1893,1893,1.433428996759294e+18,2021-09-02 13:57:59+00:00,['1433428996759293971'],"Are you a community nurse in the UK who qualified abroad? We are looking for internationally recruited nurses to write blogs for our website. If you can help, pls email joanna.sagnella@qni.org.uk or DM us. Thank you! https://t.co/UlzGBsBNZl",are you a community nurse in the uk who qualified abroad we are looking for internationally recruited nurses to write blogs for our website if you can help pls email joannasagnellaorguk or dm us thank you ,True,False
1894,1894,1894,1.433412624763523e+18,2021-09-02 12:52:55+00:00,['1433412624763523074'],Thanks to a major donation from @CHSA_org we are able to support more community nurses in financial need this year. To find out more please visit: https://t.co/jjTod4cqyi and please do share with colleagues. Thx!,thanks to a major donation from  we are able to support more community nurses in financial need this year to find out more please visit  and please do share with colleagues thx,True,False
1896,1896,1896,1.433369516109611e+18,2021-09-02 10:01:38+00:00,['1433369516109611008'],International Recruitment in Community Nursing - join us on 17 Sept to find out about latest initiatives and regional pilots. Register free and pls share! https://t.co/mIAVbi1XPu @teamCNO_ @NurseEstherM @alisonleary1 @johnunsworth10 @CrystalOldman @kirby_esther,international recruitment in community nursing  join us on 17 sept to find out about latest initiatives and regional pilots register free and pls share       ,True,False
1897,1897,1897,1.4333655097985147e+18,2021-09-02 09:45:42+00:00,['1433365509798514689'],"Call for Personalised Care Innovation Projects in the Community! We are looking for five nurse-led projects to fund, in collaboration with @NHSEngland. Find out more and apply: https://t.co/7diKR5D5oS @Pers_Care @MSHMello @BoranSue @Pers_Care_Inst #personalisedcare #Nursing",call for personalised care innovation projects in the community we are looking for five nurseled projects to fund in collaboration with  find out more and apply       ,True,False
1898,1898,1898,1.4333540820482212e+18,2021-09-02 09:00:18+00:00,['1433354082048221187'],Excited to announce the launch of our new scholarship programme with @NGSOpenGardens - applications are OPEN for community nursing projects that improve health through gardens and gardening. Read more: https://t.co/HToHiwonUv @BoranSue @GeorgePlumptre @NASPTweets,excited to announce the launch of our new scholarship programme with   applications are open for community nursing projects that improve health through gardens and gardening read more    ,True,False
1899,1899,1899,1.4333468583032955e+18,2021-09-02 08:31:35+00:00,['1433346858303295488'],Reflecting on a Year of Being a Community Nursing Associate https://t.co/VyyZbBMl2S @CrystalOldman @SamSherrington @Liz_HEE,reflecting on a year of being a community nursing associate    ,True,False
1903,1903,1903,1.4329891954553774e+18,2021-09-01 08:50:22+00:00,['1432989195455377408'],Community Nurses - check out the diabetes webinars this month with the Professional Record Standards Board and follow them for future updates 👍👍 https://t.co/mLWJ39iGM5,community nurses  check out the diabetes webinars this month with the professional record standards board and follow them for future updates  ,True,False
1905,1905,1905,1.4326456528702054e+18,2021-08-31 10:05:15+00:00,['1432645652870205443'],"Have you already booked your FREE place for the QNI conference 2021 that takes place online on 11-15 October? Tag in comments who should attend with you! 🧑‍🤝‍🧑

More info and bookings: https://t.co/zdA1BIQfi5","have you already booked your free place for the qni conference 2021 that takes place online on 1115 october tag in comments who should attend with you 

more info and bookings ",True,False
1906,1906,1906,1.4326434429586022e+18,2021-08-31 09:56:28+00:00,['1432643442958602246'],"@joan_myers @GSTTnhs @LG_NHS @theRCN @6cs2be @FNightingaleF @nmcnews @seacolestatue @NHSEngland @MiddlesexUni @Bruneluni @CalvinMoorley @fernandof1974 @SheilaSobrany @MarshaLTJones @RuthOshikanlu @SteveJFord @AkenkideE @CrystalOldman @LoveYourGarden2 @f_barlas Thank you! And wow, the garden looks amazing! 😍",                     thank you and wow the garden looks amazing ,True,False
1907,1907,1907,1.4326358662546186e+18,2021-08-31 09:26:22+00:00,['1432635866254618626'],Our sister charity @QNI_Scotland holds its online event on 1&amp;2 September. Find out more and register here ⬇️ https://t.co/9KiU23CYxs,our sister charity  holds its online event on 1amp2 september find out more and register here  ,True,False
1908,1908,1908,1.4326352267323105e+18,2021-08-31 09:23:49+00:00,['1432635226732310529'],International Recruitment in Community Nursing - join us on Friday 17th September! Booking link and draft programme: https://t.co/mIAVbi1XPu @NHSEngland,international recruitment in community nursing  join us on friday 17th september booking link and draft programme  ,True,False
1910,1910,1910,1.4326271331474555e+18,2021-08-31 08:51:40+00:00,['1432627133147455494'],"@warnetony @StockportNHS A great insight into the origins and value of District Nursing, thank you!",  a great insight into the origins and value of district nursing thank you,True,False
1912,1912,1912,1.4326237560070676e+18,2021-08-31 08:38:14+00:00,['1432623756007067649'],@VickiJNurse @WeNurses @WeDistrictNurse @RCNWales @CwmTafMorgannwg @CTMUHBDNs Those look fantastic - Vicky you should write a DN cookery book ;-),      those look fantastic  vicky you should write a dn cookery book ,True,False
1914,1914,1914,1.432621912191033e+18,2021-08-31 08:30:55+00:00,['1432621912191033346'],@joan_myers @GSTTnhs @LG_NHS @theRCN @6cs2be @FNightingaleF @nmcnews @seacolestatue @NHSEngland @MiddlesexUni @Bruneluni @CalvinMoorley @fernandof1974 @SheilaSobrany @MarshaLTJones @RuthOshikanlu @SteveJFord @AkenkideE A real testament to your many achievements over the years - loving the Queen's Nurse badge and the DN one! #extraordinaryQNs,                  a real testament to your many achievements over the years  loving the queens nurse badge and the dn one ,True,False
1915,1915,1915,1.4326210628822712e+18,2021-08-31 08:27:32+00:00,['1432621062882271232'],Community nurses in Wales - this looks like a great opportunity if you are not working that day! https://t.co/saBoj9M18h,community nurses in wales  this looks like a great opportunity if you are not working that day ,True,False
1918,1918,1918,1.4312186863759114e+18,2021-08-27 11:35:00+00:00,['1431218686375911428'],"Join us for our free online conference #qni2021. The theme for Day 5 is: 'Expert by Experience', 11-15 Oct. Come and hear from an inspiring range of speakers! To see the full programme and to book: https://t.co/S4vnHECwmt @CrystalOldman @johnunsworth10 https://t.co/wxhvupiyQp",join us for our free online conference  the theme for day 5 is expert by experience 1115 oct come and hear from an inspiring range of speakers to see the full programme and to book    ,True,False
1920,1920,1920,1.4309257394702295e+18,2021-08-26 16:10:56+00:00,['1430925739470229507'],ICYMI - our short animation will boost your spirits if you've had a long day working in the community https://t.co/g99Z5fB8Bb @Hallam_Medical @StephenMcGann #Nursing,icymi  our short animation will boost your spirits if youve had a long day working in the community    ,True,False
1921,1921,1921,1.430898018073543e+18,2021-08-26 14:20:46+00:00,['1430898018073542666'],"@NGSOpenGardens Congratulations from us all at @TheQNI, Vanessa, it's a great achievement @nessaredhed 🌼🫖🍰", congratulations from us all at  vanessa its a great achievement  ,True,False
1923,1923,1923,1.4308962136294318e+18,2021-08-26 14:13:36+00:00,['1430896213629431818'],@NHSEngland @teamCNO_ @SamSherrington @duncan_CNSE @CrystalOldman @kirby_esther @NurseEstherM Registrations are now open for our first International Recruitment event on 17 September. Find out more here: https://t.co/mIAVbijyH2,       registrations are now open for our first international recruitment event on 17 september find out more here ,True,False
1924,1924,1924,1.43085604694852e+18,2021-08-26 11:34:00+00:00,['1430856046948519937'],"Join us for our free online conference #qni2021. The theme for Day 4 is: 'The Nurses' Role in Building Back Fairer: A UK Perspective', 11-15 Oct. Come and hear from an inspiring range of speakers!To see the full programme and to book: https://t.co/S4vnHECwmt @CrystalOldman https://t.co/UNaP3VghuJ",join us for our free online conference  the theme for day 4 is the nurses role in building back fairer a uk perspective 1115 oct come and hear from an inspiring range of speakersto see the full programme and to book   ,True,False
1926,1926,1926,1.4308261325558415e+18,2021-08-26 09:35:08+00:00,['1430826132555841537'],Join us on 17th September to find out more about our new International Recruitment in Community Nursing project. Book your free online place here: https://t.co/mIAVbi1XPu @teamCNO_ @kirby_esther @NurseEstherM,join us on 17th september to find out more about our new international recruitment in community nursing project book your free online place here    ,True,False
1928,1928,1928,1.4308220320448676e+18,2021-08-26 09:18:50+00:00,['1430822032044867584'],@VbintleyVicky @rcn @nmc Wow what a fabulous discovery! It's great to see the Roll of Queen's Nurses in digitised form via @WellcomeLibrary - cc @RCNLibraries @QNI_Scotland,   wow what a fabulous discovery its great to see the roll of queens nurses in digitised form via   cc  ,True,False
1930,1930,1930,1.4304934073869312e+18,2021-08-25 11:33:00+00:00,['1430493407386931205'],"Join us for our free online conference #qni2021. The theme for Day 3 is: 'Learning from Nurses Worldwide', 11-15 Oct. Come and hear from an inspiring range of speakers! To see the full programme and to book: https://t.co/S4vnHECwmt @CrystalOldman https://t.co/17kJ132YCg",join us for our free online conference  the theme for day 3 is learning from nurses worldwide 1115 oct come and hear from an inspiring range of speakers to see the full programme and to book   ,True,False
1931,1931,1931,1.430491033578709e+18,2021-08-25 11:23:34+00:00,['1430491033578708992'],@nursingPUNC18 @HannahPeck @WoolfElisha @WeNurses @WeDistrictNurse @RCNNRN We'll retweet and hope we can get some more advice!,      well retweet and hope we can get some more advice,True,False
1934,1934,1934,1.4301758390193152e+18,2021-08-24 14:31:06+00:00,['1430175839019315208'],@hattierocket @DorsetHealth Brilliant! So glad you are making it work. How about a blog on the QNI website too?!,  brilliant so glad you are making it work how about a blog on the qni website too,True,False
1936,1936,1936,1.4301511766081577e+18,2021-08-24 12:53:06+00:00,['1430151176608157729'],"@nazarose_ @joan_myers @RuthOshikanlu @SheilaSobrany @CalvinMoorley @CNOBME_SAG @cisanim @callender01 @nurseprenure @McIntoshNichole @MarshaLTJones @joycefletcher18 @mshmjohnson @joan_nelson2 Thank you, Rose!",              thank you rose,True,False
1937,1937,1937,1.4301307679385231e+18,2021-08-24 11:32:00+00:00,['1430130767938523143'],"Join us for our free online conference #qni2021. The theme for Day 2 is: 'Healthcare for All', 11-15 Oct. Come and hear from an inspiring range of speakers! To see the full programme and to book:https://t.co/S4vnHEkUXT @CrystalOldman @johnunsworth10 https://t.co/XM2DZg62gy",join us for our free online conference  the theme for day 2 is healthcare for all 1115 oct come and hear from an inspiring range of speakers to see the full programme and to book   ,True,False
1938,1938,1938,1.4301183005881672e+18,2021-08-24 10:42:27+00:00,['1430118300588167168'],"Did you know that we offer academic prizes for post-registration students of specialist community nursing qualifications? #PhilipGoodeveDockerPrize, #EllenMaryPrize, #DoraRoylancePrize",did you know that we offer academic prizes for postregistration students of specialist community nursing qualifications   ,True,False
1940,1940,1940,1.4301096294895575e+18,2021-08-24 10:08:00+00:00,['1430109629489557510'],Home First: Act Now - the updated programme supporting safe and timely discharge from hospital can be accessed at: https://t.co/jTXGzxcNd9 @teamCNO_ @AudreyAdamah @Liz_HEE @SamSherrington @BoranSue @DHSCmedia,home first act now  the updated programme supporting safe and timely discharge from hospital can be accessed at       ,True,False
1941,1941,1941,1.4301083350644283e+18,2021-08-24 10:02:51+00:00,['1430108335064428556'],"The Dora Roylance Memorial Prize is offered to the most outstanding #HealthVisitor student and is named in memory of Dora Roylance, a Queen’s Nurse and Health Visitor who endowed the prize in her will. 
https://t.co/rvqDZVFkKp","the dora roylance memorial prize is offered to the most outstanding  student and is named in memory of dora roylance a queen’s nurse and health visitor who endowed the prize in her will 
",True,False
1942,1942,1942,1.4301083327869215e+18,2021-08-24 10:02:51+00:00,['1430108332786921488'],"Nominations for the Ellen Mary Memorial Prize are invited from each university in England, Wales and Northern Ireland delivering a #GeneralPracticeNursing SPQ programme approved by the NMC.
https://t.co/7vjML1xacX","nominations for the ellen mary memorial prize are invited from each university in england wales and northern ireland delivering a  spq programme approved by the nmc
",True,False
1943,1943,1943,1.4301083299977093e+18,2021-08-24 10:02:50+00:00,['1430108329997709324'],"Philip Goodeve-Docker Prize is offered to the top-performing student of the #DistrictNursing SPQ programme in every university in England, Wales &amp; NI. It is named in memory of a young man who lost his life while crossing the Greenland Ice Sheet in 2013.
https://t.co/oeo4imbZvN","philip goodevedocker prize is offered to the topperforming student of the  spq programme in every university in england wales amp ni it is named in memory of a young man who lost his life while crossing the greenland ice sheet in 2013
",True,False
1944,1944,1944,1.4301083276866396e+18,2021-08-24 10:02:50+00:00,['1430108327686639619'],"Great news! We have doubled the amount of our three academic prizes for post-registration students of specialist #communitynursing! 🎖️🙌
https://t.co/GWUlHo0jJ0","great news we have doubled the amount of our three academic prizes for postregistration students of specialist  
",True,False
1945,1945,1945,1.4301073814223462e+18,2021-08-24 09:59:04+00:00,['1430107381422346242'],"Nominations for the Ellen Mary Memorial Prize are invited from each university in England, Wales and Northern Ireland delivering a #GeneralPracticeNursing SPQ programme approved by the NMC.
https://t.co/7vjML1xacX","nominations for the ellen mary memorial prize are invited from each university in england wales and northern ireland delivering a  spq programme approved by the nmc
",True,False
1946,1946,1946,1.4301068119532954e+18,2021-08-24 09:56:48+00:00,['1430106811953295362'],"The researchers would also like to get your views about using the resources. To register, go to: https://t.co/wLICEJMtOL",the researchers would also like to get your views about using the resources to register go to ,True,False
1947,1947,1947,1.4301042067829678e+18,2021-08-24 09:46:27+00:00,['1430104206782967810'],"Some really useful Covid vaccination resources for health and care professionals and students, from @UniofNottingham #COVID19 #CoVE https://t.co/Qs3HGfAl1h",some really useful covid vaccination resources for health and care professionals and students from    ,True,False
1948,1948,1948,1.4301025872950108e+18,2021-08-24 09:40:01+00:00,['1430102587295010817'],@lamb_donna @nhs_scft @CNOEngland @duncan_CNSE @BeccyMaslin A warm welcome to them all and we hope to meet them soon too @CrystalOldman @kirby_esther,     a warm welcome to them all and we hope to meet them soon too  ,True,False
1950,1950,1950,1.429767878396502e+18,2021-08-23 11:30:00+00:00,['1429767878396502016'],"Join us for our free online conference #qni2021. The theme for Day 1 is: 'Inequalities in Health', 11-15 Oct. Come and hear from an inspiring range of speakers! To see the full programme and to book: https://t.co/S4vnHECwmt 
@ClareHawkinsHCT @katerinakolyva @RivkahMiar
 @CERINOC https://t.co/eah1Wl9kri","join us for our free online conference  the theme for day 1 is inequalities in health 1115 oct come and hear from an inspiring range of speakers to see the full programme and to book  
  
  ",True,False
1951,1951,1951,1.4297619081739018e+18,2021-08-23 11:06:17+00:00,['1429761908173901826'],The QNI is joining with @NHSEngland on a new project to support international recruitment of Registered Nurses to community services. Read more: https://t.co/x0M1joyk8U @teamCNO_ @SamSherrington @duncan_CNSE @CrystalOldman @kirby_esther @NurseEstherM,the qni is joining with  on a new project to support international recruitment of registered nurses to community services read more       ,True,False
1952,1952,1952,1.4297607648401408e+18,2021-08-23 11:01:44+00:00,['1429760764840140805'],Community nurses - can you host a garden party and raise vital funds for nursing charities including @TheQNI ? We'd love to hear from you if you do 🫖🥮🧁 https://t.co/sIRDE1t5u5,community nurses  can you host a garden party and raise vital funds for nursing charities including   wed love to hear from you if you do  ,True,False
1953,1953,1953,1.429760133668737e+18,2021-08-23 10:59:14+00:00,['1429760133668737032'],"@alisonleary1 @CNOEngland @charlottemcardl @NHSEngland @teamCNO_ Congratulations, Charlotte, from all of us @TheQNI !",     congratulations charlotte from all of us  ,True,False
1954,1954,1954,1.429741432785539e+18,2021-08-23 09:44:55+00:00,['1429741432785539073'],Calling community nurses - can you help @NHSX with this important research into electronic patient records? Closes 10 September. Thanks! @Ethicalhealthuk https://t.co/MFTebkTlOe,calling community nurses  can you help  with this important research into electronic patient records closes 10 september thanks  ,True,False
1955,1955,1955,1.4297303476929864e+18,2021-08-23 09:00:52+00:00,['1429730347692986379'],Join the EU Primary Care Forum online next month: https://t.co/Mh2f7r5Sh1,join the eu primary care forum online next month ,True,False
1958,1958,1958,1.4290579486474527e+18,2021-08-21 12:29:00+00:00,['1429057948647452682'],"Join us for our free online conference #qni2021. The theme for Day 5 is: 'Expert by Experience', 11-15 Oct. Come and hear from an inspiring range of speakers! To see the full programme and to book: https://t.co/S4vnHEkUXT https://t.co/iglgF56aYi",join us for our free online conference  the theme for day 5 is expert by experience 1115 oct come and hear from an inspiring range of speakers to see the full programme and to book  ,True,False
1959,1959,1959,1.428719563500368e+18,2021-08-20 14:04:22+00:00,['1428719563500367874'],Social prescribing and holistic approaches to public health - including new work by @TheQNI and @NGSOpenGardens in the latest @IndyNurseMag: https://t.co/WkwkF7m0wn @CrystalOldman  @GeorgePlumptre @BoranSue @NASPTweets @Howarth2L,social prescribing and holistic approaches to public health  including new work by  and  in the latest        ,True,False
1960,1960,1960,1.428705129956528e+18,2021-08-20 13:07:01+00:00,['1428705129956528132'],"The QNI and @QNI_Scotland contributed to this beautiful new book, 'Queen's in their Name' by royal photographer Julian Calder - it has some superb photos of amazing people at work including Queen's Nurses - save by buying direct: https://t.co/ifWkc50kXV",the qni and  contributed to this beautiful new book queens in their name by royal photographer julian calder  it has some superb photos of amazing people at work including queens nurses  save by buying direct ,True,False
1961,1961,1961,1.4287044688084746e+18,2021-08-20 13:04:24+00:00,['1428704468808474632'],"@BurdettTrust @StephenMcGann For those who haven't seen it yet, we really hope you like it - take two minutes and let us know :-)",  for those who havent seen it yet we really hope you like it  take two minutes and let us know ,True,False
1963,1963,1963,1.4286648585185608e+18,2021-08-20 10:27:00+00:00,['1428664858518560771'],"Join us for our free online conference #qni2021. The theme for Day 4 is: 'The Nurses' Role in Building Back Fairer: A UK Perspective', 11-15 Oct. Come and hear from an inspiring range of speakers!To see the full programme and to book: https://t.co/S4vnHEkUXT https://t.co/3tZVPxqr5P",join us for our free online conference  the theme for day 4 is the nurses role in building back fairer a uk perspective 1115 oct come and hear from an inspiring range of speakersto see the full programme and to book  ,True,False
1964,1964,1964,1.4286466280811438e+18,2021-08-20 09:14:33+00:00,['1428646628081143819'],"This looks like a great event for LD practitioners - a range of expert speakers including Gerard Wainwright, one of the project leaders on the QNI's Learning Disability innovation programme @BoranSue @AngieHack10 @GerardW68 @BurdettTrust https://t.co/0R1jHBwHY2",this looks like a great event for ld practitioners  a range of expert speakers including gerard wainwright one of the project leaders on the qnis learning disability innovation programme     ,True,False
1970,1970,1970,1.4283017156237148e+18,2021-08-19 10:24:00+00:00,['1428301715623714818'],"Join us for our free online conference #qni2021. The theme for Day 3 is: 'Learning from Nurses Worldwide', 11-15 Oct. Come and hear from an inspiring range of speakers! To see the full programme and to book: https://t.co/S4vnHEkUXT https://t.co/c35JSnxsLo",join us for our free online conference  the theme for day 3 is learning from nurses worldwide 1115 oct come and hear from an inspiring range of speakers to see the full programme and to book  ,True,False
1971,1971,1971,1.4282999689016812e+18,2021-08-19 10:17:03+00:00,['1428299968901681160'],Can you inspire a former colleague to re-join nursing? There are fully funded Return to Practice courses at universities across the country. Pls RT/tag someone!👩‍⚕️📚👩‍🎓 https://t.co/bV3e1DxkkY #WeAreTheNHS #WeAreReturningNurses @CrystalOldman @teamCNO_ @NHS_HealthEdEng,can you inspire a former colleague to rejoin nursing there are fully funded return to practice courses at universities across the country pls rttag someone      ,True,False
1973,1973,1973,1.428284528058118e+18,2021-08-19 09:15:42+00:00,['1428284528058118144'],@NICEComms We hope that many community nurses will take time to engage with this important review and add their expert views, we hope that many community nurses will take time to engage with this important review and add their expert views,True,False
1975,1975,1975,1.4279849804420342e+18,2021-08-18 13:25:24+00:00,['1427984980442034178'],"Exciting advance news about the Diamond Jubilee of our Patron, Her Majesty the Queen, next year 👑 https://t.co/RUUQJWHCKD",exciting advance news about the diamond jubilee of our patron her majesty the queen next year  ,True,False
1976,1976,1976,1.4279262419280486e+18,2021-08-18 09:32:00+00:00,['1427926241928048643'],"Join us for our free online conference #qni2021. The theme for Day 2 is: 'Healthcare for All', 11-15 Oct. Come and hear from an inspiring range of speakers! To see the full programme and to book:https://t.co/S4vnHEkUXT @ClareHawkinsHCT @katerinakolyva @RivkahMiar @CERINOC https://t.co/T8EXuLndY7",join us for our free online conference  the theme for day 2 is healthcare for all 1115 oct come and hear from an inspiring range of speakers to see the full programme and to book     ,True,False
1977,1977,1977,1.4279244538251305e+18,2021-08-18 09:24:54+00:00,['1427924453825130496'],ICYMI take a couple of minutes to watch our new animated film - we hope it will raise your spirits this Wednesday! With @StephenMcGann @Hallam_Medical @CrystalOldman https://t.co/TzDETdy7Z5,icymi take a couple of minutes to watch our new animated film  we hope it will raise your spirits this wednesday with    ,True,False
1982,1982,1982,1.4276477392450806e+18,2021-08-17 15:05:20+00:00,['1427647739245080578'],"Congratulations to #extraordinaryQN @Reuben_QN for his Silver Social Care Award, for exceptional work during the pandemic at @MilestonesTrust 👏@sturdy_deborah @CrystalOldman @johnunsworth10 @saldri01 https://t.co/FEeV41Buwa",congratulations to   for his silver social care award for exceptional work during the pandemic at      ,True,False
1983,1983,1983,1.4276444754264517e+18,2021-08-17 14:52:21+00:00,['1427644475426451475'],The Professional Records Standards Body @ProfRecordSB is hosting Diabetes information standard webinars during September. Pls email info@theprsb.org to get involved. More info via @PiFonline; dates subject to change: https://t.co/Nhq7pkAUT0,the professional records standards body  is hosting diabetes information standard webinars during september pls email infoorg to get involved more info via  dates subject to change ,True,False
