id,created_at,edit_history_tweet_ids,text,clean_text,nouns
1.564993709405573e+18,2022-08-31 15:09:11+00:00,['1564993709405573122'],"Retired Queen's Nurse Allyson Kent has a really inspiring message for anyone living with cancer - walking, campaigning and fundraising with others for physical and mental health. Follow and walk with her! https://t.co/osiP5I7xTN",retired queen's nurse allyson kent has a really inspiring message for anyone living with cancer  walking campaigning and fundraising with others for physical and mental health follow and walk with her ,allyson kent message anyone living cancer campaigning others health follow walk
1.5649725420577587e+18,2022-08-31 13:45:04+00:00,['1564972542057758725'],Amanda is one of an amazing 86 Queen's Nurses who wrote chapters for this book! Published by @wiley_nursing in 2022 and edited by @mattbradby #districtnursing https://t.co/psmrXZDnfr,amanda is one of an amazing queen's nurses who wrote chapters for this book published by  in and edited by   ,amanda nurse chapter book
1.564947541111849e+18,2022-08-31 12:05:43+00:00,['1564947541111848962'],"Super pics from our visit to Frogmore gardens yesterday: our wonderful QNs, the QNI team including @BoranSue @saldri01 @AngieHack10 @BecksBDaniels @nich_bull @mattbradby, and @heatherngs with Nick and head gardener Neil Dodds https://t.co/mEZcJaGKS7",super pics from our visit to frogmore gardens yesterday our wonderful qns the qni team including       and  with nick and head gardener neil dodds ,pic visit garden yesterday qns qni team head gardener dodds
1.564701072991703e+18,2022-08-30 19:46:21+00:00,['1564701072991703041'],"We had a fabulous day at Frogmore today thanks to @NGSOpenGardens @BerksNGS and the staff of @RoyalFamily. So many Queen's Nurses gathered together again, what a reunion! https://t.co/LRrP7CXHXV",we had a fabulous day at frogmore today thanks to   and the staff of  so many queen's nurses gathered together again what a reunion ,day today thanks staff nurse reunion
1.5646979291636736e+18,2022-08-30 19:33:51+00:00,['1564697929163673602'],@SimonLittlefie1 @saldri01 Wonderful! So glad to see you and so many great connections today :-),  wonderful so glad to see you and so many great connections today ,wonderful connection today
1.5645893500710257e+18,2022-08-30 12:22:24+00:00,['1564589350071025665'],📢Our bespoke leadership programme for Executive Nurses is now open for applications! ✅Are you a senior #nurse working in the community or primary care? ✅Do you want to develop your #leadership skills your career? Find out more apply by 18 Sep! https://t.co/yVg9cwpocY,our bespoke leadership programme for executive nurses is now open for applications are you a senior  working in the community or primary care do you want to develop your  skills your career find out more apply by sep ,bespoke leadership programme executive nurse application community care career apply sep
1.5645887456760136e+18,2022-08-30 12:20:00+00:00,['1564588745676013568'],"Book your place at our conference #QNI2022 10-14 October. Details of Day 3 below, to view the programme in full or book your place, go to https://t.co/ksTVRGgzbn @elizabeth_iro @HowardCatton @fernandof1974 @NurseEstherM @greenekaren06 @johnunsworth10 https://t.co/u68phD3gRi",book your place at our conference  october details of day below to view the programme in full or book your place go to        ,book place conference october detail day programme book place
1.5645603506950144e+18,2022-08-30 10:27:10+00:00,['1564560350695014400'],"We're looking forward to welcoming Queen's Nurses coming to Frogmore Gardens in Windsor today! Open for @NGSOpenGardens @BerksNGS today by kind permission of the QNI's Patron, HM the Queen",we're looking forward to welcoming queen's nurses coming to frogmore gardens in windsor today open for   today by kind permission of the qni's patron hm the queen,nurse garden windsor today today kind permission patron queen
1.564554479315329e+18,2022-08-30 10:03:50+00:00,['1564554479315329024'],Our Executive Nurse Leadership Programme is a life-changing opportunity for #nurses who: ✅work as an Executive or Associate Director Nurse in the community ✅want to develop leadership skills. Find out more and apply by 23.59 on 18 September 2022. (8/8) https://t.co/rlOJ0LaS5V,our executive nurse leadership programme is a lifechanging opportunity for  who work as an executive or associate director nurse in the community want to develop leadership skills find out more and apply by on september  ,executive leadership programme opportunity executive director nurse community leadership skill september
1.5645544776250327e+18,2022-08-30 10:03:50+00:00,['1564554477625032706'],Our Aspiring Leaders programme is open to any #nurse who: ✅ works in a Community or Primary Care setting ✅ aspires to take the next step in their #leadership career. Find out more and apply on our website by 23.59 on 7 September 2022. (7/8) https://t.co/Sq9eTQfXRP,our aspiring leaders programme is open to any  who  works in a community or primary care setting  aspires to take the next step in their  career find out more and apply on our website by on september  ,leader work community care aspires step career website september
1.564554476131844e+18,2022-08-30 10:03:49+00:00,['1564554476131844096'],"Based on feedback from participants, as many as 50% of those undertaking our programmes move to a more responsible or more senior role before the end of the programme. #QNILeaders (6/8)",based on feedback from participants as many as of those undertaking our programmes move to a more responsible or more senior role before the end of the programme  ,feedback participant programme role end programme
1.5645544747183882e+18,2022-08-30 10:03:49+00:00,['1564554474718388224'],"We offer personal support throughout your progress with us, including mentorship from a matched mentor after a personal needs assessment is undertaken with you. (5/8)",we offer personal support throughout your progress with us including mentorship from a matched mentor after a personal needs assessment is undertaken with you ,support progress mentorship mentor need assessment
1.564554473267143e+18,2022-08-30 10:03:49+00:00,['1564554473267142659'],"All our leadership programmes are bespoke and personalised for the individuals taking part, and the particular challenges and opportunities that are most relevant within community healthcare at the time. (4/8)",all our leadership programmes are bespoke and personalised for the individuals taking part and the particular challenges and opportunities that are most relevant within community healthcare at the time ,leadership programme individual part challenge opportunity community healthcare time
1.5645544718201242e+18,2022-08-30 10:03:48+00:00,['1564554471820124160'],We currently offer two different Leadership programmes for #CommunityNurses: 1⃣ Aspiring Leaders Programme that is open to any nurse. 2⃣ Executive Nurse Leadership Programme for those nurses already working at a senior level. (3/8),we currently offer two different leadership programmes for  aspiring leaders programme that is open to any nurse executive nurse leadership programme for those nurses already working at a senior level ,leadership programme leader executive leadership programme nurse level
1.5645544703227576e+18,2022-08-30 10:03:48+00:00,['1564554470322757633'],"Our Leadership programmes are open to all #nurses working in the community and primary care setting, including adult social care and care home nurses. #QNILeaders (2/8)",our leadership programmes are open to all  working in the community and primary care setting including adult social care and care home nurses  ,leadership programme community care adult care care home nurse
1.5645544687792456e+18,2022-08-30 10:03:48+00:00,['1564554468779245568'],"🧵About the QNI Leadership programmes for nurses working in the community. #QNILeaders Over the last six years, we have created bespoke transformational leadership programmes that offer career-changing learning to nurses. (1/8)",about the qni leadership programmes for nurses working in the community  over the last six years we have created bespoke transformational leadership programmes that offer careerchanging learning to nurses ,leadership programme nurse community year leadership programme nurse
1.564176034186072e+18,2022-08-29 09:00:02+00:00,['1564176034186072064'],"Book your place at our conference #QNI2022 10-14 October. Details of Day 2 below, to view the programme in full or book your place, go to https://t.co/ksTVRGgzbn @alisonleary1 @SamSherrington @saldri01 @Ben_Bowers__ @Sspreadbury1 @neem_young https://t.co/h5IsE1BuWA",book your place at our conference  october details of day below to view the programme in full or book your place go to        ,book place conference october detail day programme book place
1.5638936654323425e+18,2022-08-28 14:18:00+00:00,['1563893665432342528'],"Book your place at our conference #QNI2022 10-14 October. Details of Day 1 below, to view the programme in full or book your place, go to https://t.co/ksTVRFYXMN @KentonCool @GeorgePlumptre @NursingEmma @ChantrySu @NickiAnn30 https://t.co/EsnLl9EMHR",book your place at our conference  october details of day below to view the programme in full or book your place go to       ,book place conference october detail day programme book place
1.563473900259971e+18,2022-08-27 10:30:00+00:00,['1563473900259971072'],"Book your place at our conference #QNI2022 10-14 October. Details of Day 5 below, to view the programme in full or book your place, go to https://t.co/ksTVRGgzbn https://t.co/Uzsp9XEYGf",book your place at our conference  october details of day below to view the programme in full or book your place go to  ,book place conference october detail day programme book place
1.5631756176084296e+18,2022-08-26 14:44:44+00:00,['1563175617608429568'],📢Book your free place at our Annual Conference #QNI2022 that is taking place online on 10-14 October! We have an amazing lineup of inspiring and uplifting speakers - view the programme and book your place now: https://t.co/ksTVRGh70V #CommunityNursing #Nursing https://t.co/dLYRyNQTEq,book your free place at our annual conference  that is taking place online on october we have an amazing lineup of inspiring and uplifting speakers  view the programme and book your place now    ,book place conference place online lineup inspiring speaker programme book place
1.5631592982045082e+18,2022-08-26 13:39:53+00:00,['1563159298204508160'],📢The QNI International Community Nurse of the Year Award 2022 is now open for nominations!🌍 Do you know an outstanding nurse who you would like to nominate? Find out more on our website and submit your nomination by 30 September 2022. #QNIawards https://t.co/sqT3yQ3qiM,the qni international community nurse of the year award is now open for nominations do you know an outstanding nurse who you would like to nominate find out more on our website and submit your nomination by september  ,community nurse year award nomination nurse website nomination september
1.5631492713391268e+18,2022-08-26 13:00:02+00:00,['1563149271339126786'],"Book your place at our online conference #QNI2022 10-14 October. Details of Day 4 below, to view the programme in full or book your place, go to https://t.co/ksTVRFYXMN https://t.co/idy7b9qdJx",book your place at our online conference  october details of day below to view the programme in full or book your place go to  ,book place conference october detail day programme book place
1.563110270624764e+18,2022-08-26 10:25:04+00:00,['1563110270624763905'],"A super blog for @JoTrust by Queen's Nurse Melissa Civale - case study in how to engage with a group of people with no prior knowledge of cervical screening, and who speak a number of different languages @qnihih @BoranSue @MelissaCivale https://t.co/SIKWzllXLD",a super blog for  by queen's nurse melissa civale  case study in how to engage with a group of people with no prior knowledge of cervical screening and who speak a number of different languages    ,blog melissa civale case study group people knowledge screening number language
1.563088872342438e+18,2022-08-26 09:00:02+00:00,['1563088872342437888'],Did you know you can raise FREE donations for the QNI when shopping online via #Amazon? @AmazonSmile donates 0.5% of the price of your eligible purchases to the charity of your choice. Choose us as the charity of your choice in just one click⬇️,did you know you can raise free donations for the qni when shopping online via   donates  of the price of your eligible purchases to the charity of your choice choose us as the charity of your choice in just one click,donation qni online price purchase charity choice charity choice click
1.5628323257210716e+18,2022-08-25 16:00:37+00:00,['1562832325721071618'],@Rosy_roo_roo @NCHC_NHS Congratulations from everyone at the QNI! Good luck in your new role! https://t.co/QkliNyNeCL,  congratulations from everyone at the qni good luck in your new role ,congratulation everyone qni luck role
1.5627340267580375e+18,2022-08-25 09:30:00+00:00,['1562734026758037505'],"Book your place at our conference #QNI2022 10-14 October. Details of Day 3 below, to view the programme in full or book your place, go to https://t.co/ksTVRFYXMN https://t.co/QeM6cHBmAm",book your place at our conference  october details of day below to view the programme in full or book your place go to  ,book place conference october detail day programme book place
1.562379191655481e+18,2022-08-24 10:00:01+00:00,['1562379191655481344'],"Book your place at our conference #QNI2022 10-14 October. Details of Day 2 below, to view the programme in full or book your place, go to https://t.co/ksTVRGgzbn https://t.co/oogLxO4DIO",book your place at our conference  october details of day below to view the programme in full or book your place go to  ,book place conference october detail day programme book place
1.5620960827583775e+18,2022-08-23 15:15:03+00:00,['1562096082758377472'],"📢Applications are now open for our bespoke Aspiring Leaders Programme! Any #nurse working in a community or primary care setting, including the charity or independent sector, can apply. #QNILeaders 🗓️Closing date: 7 September 2022. https://t.co/O8WuKAsMY3",applications are now open for our bespoke aspiring leaders programme any  working in a community or primary care setting including the charity or independent sector can apply  closing date september ,application bespoke leader working community care charity sector closing date september
1.5619984914377482e+18,2022-08-23 08:47:15+00:00,['1561998491437748224'],Community nurses - what do you think of this? 🤓🤔 https://t.co/gRyGYBLyJF,community nurses  what do you think of this  ,community
1.5619954174196613e+18,2022-08-23 08:35:02+00:00,['1561995417419661313'],"Sharing this exciting and innovative nursing opportunity in Norfolk, part of a research project with UEA and supported by HEE. Full details on the website link below: https://t.co/zeZ1zHGd4I",sharing this exciting and innovative nursing opportunity in norfolk part of a research project with uea and supported by hee full details on the website link below ,exciting nursing opportunity part research project hee detail link
1.5619941490748047e+18,2022-08-23 08:30:00+00:00,['1561994149074804738'],"Book your free place at our conference #QNI2022 10-14 October. Details of Day 1 below, to view the programme in full or book your place, go to https://t.co/ksTVRGgzbn https://t.co/OqVGpnxDIZ",book your free place at our conference  october details of day below to view the programme in full or book your place go to  ,book place conference october detail day programme book place
1.56174630109986e+18,2022-08-22 16:05:08+00:00,['1561746301099859969'],@StN_Freda You might be interested in joining the new Community Nurses Research Forum / Community of Practice ⬇️ @Ben_Bowers__ @CatherineJanee1 https://t.co/5Gbu7ZjSz4, you might be interested in joining the new community nurses research forum  community of practice    ,community research forum community practice
1.5616798307808788e+18,2022-08-22 11:41:00+00:00,['1561679830780878848'],Leaving the EU means that some programme standards for pre-reg nursing and midwifery courses must now be updated. Health and social care professionals - please give your views to @nmcnews by 21 September: https://t.co/DQpgPpxnSq,leaving the eu means that some programme standards for prereg nursing and midwifery courses must now be updated health and social care professionals  please give your views to  by september ,programme standard nursing midwifery course health care professional view september
1.5616667464902656e+18,2022-08-22 10:49:01+00:00,['1561666746490265600'],Another upcoming conference with a strong line up of speakers including a number of #ExtraordinaryQNs https://t.co/tcFVJBRzUW,another upcoming conference with a strong line up of speakers including a number of  ,conference line speaker number
1.5616520688672686e+18,2022-08-22 09:50:41+00:00,['1561652068867268609'],NHS England and @ICCHNR want to hear about your community nursing research work. Awards of £500 are offered - apply by 30th September @CrystalOldman @NHSEnglandCHS @Ben_Bowers__ @DrAmandaYoung @BoranSue https://t.co/kev43Hluxy,nhs england and  want to hear about your community nursing research work awards of  are offered  apply by september      ,england community nursing research work award apply september
1.561631761083269e+18,2022-08-22 08:30:00+00:00,['1561631761083269121'],"Book your place at our conference, #QNI2022, 10-14 October. Details of Day 5 below, featuring @NHS_RobW @kayla_meikle @SchnellerKendra @BecksBDaniels @EveThrupp @agnes_fanning @cfry_ @AngieHack10 and more. To view the programme or book your place, go to https://t.co/ksTVRGgzbn https://t.co/4Y9QXsVnyq",book your place at our conference  october details of day below featuring         and more to view the programme or book your place go to  ,book place conference october detail day programme book place
1.5613083807482552e+18,2022-08-21 11:05:00+00:00,['1561308380748255232'],"Book your place at our conference, #QNI2022, 10-14 October. Details of Day 4 below, featuring @CNOEngland @CNO_NI @sturdy_deborah @profalexmcmahon @Crouchendtiger7 @stephlawrence5 @helenwhyley and more. To view the programme or book your place, go to https://t.co/ksTVRGgzbn https://t.co/ZjGzc0zzmN",book your place at our conference  october details of day below featuring        and more to view the programme or book your place go to  ,book place conference october detail day programme book place
1.5609301385057649e+18,2022-08-20 10:02:00+00:00,['1560930138505764865'],"Book your place at our conference, #QNI2022, 10-14 October. Details of Day 3 below, featuring @elizabeth_iro @HowardCatton @fernandof1974 @NurseEstherM @greenekaren06 @johnunsworth10 and more. To view the programme or book your place, go to https://t.co/ksTVRGgzbn https://t.co/L0vzg4E90Z",book your place at our conference  october details of day below featuring       and more to view the programme or book your place go to  ,book place conference october detail day programme book place
1.5605383074228677e+18,2022-08-19 08:05:00+00:00,['1560538307422867457'],"Booking is now open for our conference, #QNI2022, 10-14 October. Details of Day 2 below, featuring @alisonleary1 @SamSherrington @saldri01 @Ben_Bowers__ @Sspreadbury1 @neem_young and more. To view the programme or book your place, go to https://t.co/ksTVRFYXMN https://t.co/7b87zn4fzf",booking is now open for our conference  october details of day below featuring       and more to view the programme or book your place go to  ,booking conference october detail day programme book place
1.5602950812985098e+18,2022-08-18 15:58:30+00:00,['1560295081298509826'],@ResearchNurseD @louisebrady17 @DrNeenaJha @SteveBarclay @AmandaPritchard @NHSEmployers @DHSCgovuk @theRCN @rcgp We have put some recent examples of employer support on our website here re #fuelcrisis: https://t.co/LuIYnAYLYg,         we have put some recent examples of employer support on our website here re  ,example employer support website
1.5602643513484698e+18,2022-08-18 13:56:24+00:00,['1560264351348469769'],"We are delighted to announce bookings are now open for our conference #QNI2022, 10-14 October. Details of Day 1 below. To view the programme or book your place, go to https://t.co/ksTVRFYXMN @KentonCool @GeorgePlumptre @NursingEmma @ChantrySu @NickiAnn30 https://t.co/akmXDbrZNk",we are delighted to announce bookings are now open for our conference  october details of day below to view the programme or book your place go to       ,booking conference october detail day programme book place
1.5602388328086282e+18,2022-08-18 12:15:00+00:00,['1560238832808628225'],"#ALevelResultsDay Did you know nursing is the UK’s most employable type of degree, with 94% of students getting a job within six months of finishing their course? If you're eligible you can also receive financial support every year of your degree. https://t.co/38BokUnfoL", did you know nursing is the uk’s most employable type of degree with of students getting a job within six months of finishing their course if you're eligible you can also receive financial support every year of your degree ,nursing type degree student job month course support year degree
1.5601938605459538e+18,2022-08-18 09:16:18+00:00,['1560193860545953792'],"A nursing degree opens up a world of possibilities. Community nurses work with people of all ages everywhere, and you can progress into many different specialisms. Read student blogs and find out more here: https://t.co/cpwUxJmMDN #ALevelResultsDay @NHS_HealthEdEng",a nursing degree opens up a world of possibilities community nurses work with people of all ages everywhere and you can progress into many different specialisms read student blogs and find out more here   ,nursing degree world possibility community work people age specialism student blog
1.5598570373701837e+18,2022-08-17 10:57:53+00:00,['1559857037370183680'],@sarahhall167 @CrystalOldman @SamSherrington @kerry_bareham @ne55hao @alisonleary1 @LouisePatten1 @Alison_Morton2 @BrenJMcinerney Hi Sarah it's not on our website quite yet but we'll be linking it soon and will share :-),         hi sarah it's not on our website quite yet but we'll be linking it soon and will share ,sarah share
1.5598205485108183e+18,2022-08-17 08:32:53+00:00,['1559820548510818309'],"We would like to showcase good practice around caring for people with #LongCovid. If you cared for a patient with Long Covid and would to share your experience, please get in touch with @EveThrupp at eve.thrupp@qni.org.uk 📧 #CommunityNursing https://t.co/4LGbr1sSIR",we would like to showcase good practice around caring for people with  if you cared for a patient with long covid and would to share your experience please get in touch with  at evethrupporguk   ,practice people patient covid share experience please touch
1.5595007393570488e+18,2022-08-16 11:22:05+00:00,['1559500739357048833'],Our survey of pre-reg nursing students show they value high quality placements in #community healthcare settings and are attracted to the community's diverse careers after graduation https://t.co/EwTscQfDNR,our survey of prereg nursing students show they value high quality placements in  healthcare settings and are attracted to the community's diverse careers after graduation ,survey prereg nursing student value quality placement healthcare setting diverse career graduation
1.559488495772729e+18,2022-08-16 10:33:25+00:00,['1559488495772729344'],Join @UKHealthClimate on Wednesday 24 August and follow them for updates about sustainability in healthcare; cc @GreenerPractice @GreenerNHS @NGSOpenGardens @SusHealthcare https://t.co/uYyTeflFbF,join  on wednesday august and follow them for updates about sustainability in healthcare cc     ,join wednesday august update sustainability healthcare
1.5580906322872074e+18,2022-08-12 13:58:49+00:00,['1558090632287207428'],"WE ARE #HIRING! 📢We currently have an exciting opportunity for a Programme, Networks Events #Coordinator to join our super friendly team. Closing date: 5 Sep 2022. If this job sounds like anyone you know, please share this opportunity with them! 🙏 https://t.co/j3ZRLwXjRi",we are  we currently have an exciting opportunity for a programme networks events  to join our super friendly team closing date sep if this job sounds like anyone you know please share this opportunity with them  ,opportunity event super date sep job anyone share opportunity
1.557771396469629e+18,2022-08-11 16:50:17+00:00,['1557771396469628928'],@maria_tvlns Spectacular and inspiring view - thanks for sharing!, spectacular and inspiring view  thanks for sharing,spectacular view thanks
1.5576772404391526e+18,2022-08-11 10:36:09+00:00,['1557677240439152641'],"We've just published a new report on #PreRegistration #CommunityNursing #Placements in England. With increasingly #complex healthcare now delivered in the #community, it's vital #StudentNurses gain a wider range of experiences. Read more here: https://t.co/C0hzpTrXmP https://t.co/F3EgwpSwo2",we've just published a new report on    in england with increasingly  healthcare now delivered in the  it's vital  gain a wider range of experiences read more here  ,report england healthcare gain range experience
