id,created_at,edit_history_tweet_ids,text,clean_text,nouns
1.43085604694852e+18,2021-08-26 11:34:00+00:00,['1430856046948519937'],"Join us for our free online conference #qni2021. The theme for Day 4 is: 'The Nurses' Role in Building Back Fairer: A UK Perspective', 11-15 Oct. Come and hear from an inspiring range of speakers!To see the full programme and to book: https://t.co/S4vnHECwmt @CrystalOldman https://t.co/UNaP3VghuJ",join us for our free online conference  the theme for day is the nurses role in building back fairer a uk perspective oct come and hear from an inspiring range of speakersto see the full programme and to book   ,join online conference theme day nurse role fairer perspective oct come hear range speakersto programme book
1.4308261325558415e+18,2021-08-26 09:35:08+00:00,['1430826132555841537'],Join us on 17th September to find out more about our new International Recruitment in Community Nursing project. Book your free online place here: https://t.co/mIAVbi1XPu @teamCNO_ @kirby_esther @NurseEstherM,join us on september to find out more about our new international recruitment in community nursing project book your free online place here    ,join september recruitment community nursing project book place
1.4308220320448676e+18,2021-08-26 09:18:50+00:00,['1430822032044867584'],@VbintleyVicky @rcn @nmc Wow what a fabulous discovery! It's great to see the Roll of Queen's Nurses in digitised form via @WellcomeLibrary - cc @RCNLibraries @QNI_Scotland,   wow what a fabulous discovery it's great to see the roll of queen's nurses in digitised form via   cc  ,discovery roll nurse form
1.4304934073869312e+18,2021-08-25 11:33:00+00:00,['1430493407386931205'],"Join us for our free online conference #qni2021. The theme for Day 3 is: 'Learning from Nurses Worldwide', 11-15 Oct. Come and hear from an inspiring range of speakers! To see the full programme and to book: https://t.co/S4vnHECwmt @CrystalOldman https://t.co/17kJ132YCg",join us for our free online conference  the theme for day is learning from nurses worldwide oct come and hear from an inspiring range of speakers to see the full programme and to book   ,join online conference theme day nurse come hear range speaker programme book
1.430491033578709e+18,2021-08-25 11:23:34+00:00,['1430491033578708992'],@nursingPUNC18 @HannahPeck @WoolfElisha @WeNurses @WeDistrictNurse @RCNNRN We'll retweet and hope we can get some more advice!,      we'll retweet and hope we can get some more advice,retweet hope advice
1.4301758390193152e+18,2021-08-24 14:31:06+00:00,['1430175839019315208'],@hattierocket @DorsetHealth Brilliant! So glad you are making it work. How about a blog on the QNI website too?!,  brilliant so glad you are making it work how about a blog on the qni website too,brilliant blog website
1.4301511766081577e+18,2021-08-24 12:53:06+00:00,['1430151176608157729'],"@nazarose_ @joan_myers @RuthOshikanlu @SheilaSobrany @CalvinMoorley @CNOBME_SAG @cisanim @callender01 @nurseprenure @McIntoshNichole @MarshaLTJones @joycefletcher18 @mshmjohnson @joan_nelson2 Thank you, Rose!",              thank you rose,thank
1.4301307679385231e+18,2021-08-24 11:32:00+00:00,['1430130767938523143'],"Join us for our free online conference #qni2021. The theme for Day 2 is: 'Healthcare for All', 11-15 Oct. Come and hear from an inspiring range of speakers! To see the full programme and to book:https://t.co/S4vnHEkUXT @CrystalOldman @johnunsworth10 https://t.co/XM2DZg62gy",join us for our free online conference  the theme for day is healthcare for all oct come and hear from an inspiring range of speakers to see the full programme and to book   ,join online conference theme day come hear range speaker programme book
1.4301183005881672e+18,2021-08-24 10:42:27+00:00,['1430118300588167168'],"Did you know that we offer academic prizes for post-registration students of specialist community nursing qualifications? #PhilipGoodeveDockerPrize, #EllenMaryPrize, #DoraRoylancePrize",did you know that we offer academic prizes for postregistration students of specialist community nursing qualifications   ,prize postregistration student specialist community nursing qualification
1.4301096294895575e+18,2021-08-24 10:08:00+00:00,['1430109629489557510'],Home First: Act Now - the updated programme supporting safe and timely discharge from hospital can be accessed at: https://t.co/jTXGzxcNd9 @teamCNO_ @AudreyAdamah @Liz_HEE @SamSherrington @BoranSue @DHSCmedia,home first act now  the updated programme supporting safe and timely discharge from hospital can be accessed at       ,home programme discharge hospital
1.4301083350644283e+18,2021-08-24 10:02:51+00:00,['1430108335064428556'],"The Dora Roylance Memorial Prize is offered to the most outstanding #HealthVisitor student and is named in memory of Dora Roylance, a Queen’s Nurse and Health Visitor who endowed the prize in her will. https://t.co/rvqDZVFkKp",the dora roylance memorial prize is offered to the most outstanding  student and is named in memory of dora roylance a queen’s nurse and health visitor who endowed the prize in her will ,dora roylance prize student memory roylance nurse health visitor prize
1.4301083327869215e+18,2021-08-24 10:02:51+00:00,['1430108332786921488'],"Nominations for the Ellen Mary Memorial Prize are invited from each university in England, Wales and Northern Ireland delivering a #GeneralPracticeNursing SPQ programme approved by the NMC. https://t.co/7vjML1xacX",nominations for the ellen mary memorial prize are invited from each university in england wales and northern ireland delivering a  spq programme approved by the nmc ,nomination ellen prize university england wale ireland spq programme nmc
1.4301083299977093e+18,2021-08-24 10:02:50+00:00,['1430108329997709324'],"Philip Goodeve-Docker Prize is offered to the top-performing student of the #DistrictNursing SPQ programme in every university in England, Wales NI. It is named in memory of a young man who lost his life while crossing the Greenland Ice Sheet in 2013. https://t.co/oeo4imbZvN",philip goodevedocker prize is offered to the topperforming student of the  spq programme in every university in england wales ni it is named in memory of a young man who lost his life while crossing the greenland ice sheet in ,philip goodevedocker prize student spq programme university england wale memory man life greenland ice sheet
1.4301083276866396e+18,2021-08-24 10:02:50+00:00,['1430108327686639619'],Great news! We have doubled the amount of our three academic prizes for post-registration students of specialist #communitynursing! 🎖️🙌 https://t.co/GWUlHo0jJ0,great news we have doubled the amount of our three academic prizes for postregistration students of specialist   ,news amount prize postregistration student specialist
1.4301073814223462e+18,2021-08-24 09:59:04+00:00,['1430107381422346242'],"Nominations for the Ellen Mary Memorial Prize are invited from each university in England, Wales and Northern Ireland delivering a #GeneralPracticeNursing SPQ programme approved by the NMC. https://t.co/7vjML1xacX",nominations for the ellen mary memorial prize are invited from each university in england wales and northern ireland delivering a  spq programme approved by the nmc ,nomination ellen prize university england wale ireland spq programme nmc
1.4301068119532954e+18,2021-08-24 09:56:48+00:00,['1430106811953295362'],"The researchers would also like to get your views about using the resources. To register, go to: https://t.co/wLICEJMtOL",the researchers would also like to get your views about using the resources to register go to ,researcher view resource
1.4301042067829678e+18,2021-08-24 09:46:27+00:00,['1430104206782967810'],"Some really useful Covid vaccination resources for health and care professionals and students, from @UniofNottingham #COVID19 #CoVE https://t.co/Qs3HGfAl1h",some really useful covid vaccination resources for health and care professionals and students from    ,covid vaccination resource health care professional student
1.4301025872950108e+18,2021-08-24 09:40:01+00:00,['1430102587295010817'],@lamb_donna @nhs_scft @CNOEngland @duncan_CNSE @BeccyMaslin A warm welcome to them all and we hope to meet them soon too @CrystalOldman @kirby_esther,     a warm welcome to them all and we hope to meet them soon too  ,welcome
1.429767878396502e+18,2021-08-23 11:30:00+00:00,['1429767878396502016'],"Join us for our free online conference #qni2021. The theme for Day 1 is: 'Inequalities in Health', 11-15 Oct. Come and hear from an inspiring range of speakers! To see the full programme and to book: https://t.co/S4vnHECwmt @ClareHawkinsHCT @katerinakolyva @RivkahMiar @CERINOC https://t.co/eah1Wl9kri",join us for our free online conference  the theme for day is inequalities in health oct come and hear from an inspiring range of speakers to see the full programme and to book      ,join online conference theme day inequality health oct come hear range speaker programme book
1.4297619081739018e+18,2021-08-23 11:06:17+00:00,['1429761908173901826'],The QNI is joining with @NHSEngland on a new project to support international recruitment of Registered Nurses to community services. Read more: https://t.co/x0M1joyk8U @teamCNO_ @SamSherrington @duncan_CNSE @CrystalOldman @kirby_esther @NurseEstherM,the qni is joining with  on a new project to support international recruitment of registered nurses to community services read more       ,qni project recruitment nurse community service
1.4297607648401408e+18,2021-08-23 11:01:44+00:00,['1429760764840140805'],Community nurses - can you host a garden party and raise vital funds for nursing charities including @TheQNI ? We'd love to hear from you if you do 🫖🥮🧁 https://t.co/sIRDE1t5u5,community nurses  can you host a garden party and raise vital funds for nursing charities including   we'd love to hear from you if you do  ,community nurse garden party fund charity love
1.429760133668737e+18,2021-08-23 10:59:14+00:00,['1429760133668737032'],"@alisonleary1 @CNOEngland @charlottemcardl @NHSEngland @teamCNO_ Congratulations, Charlotte, from all of us @TheQNI !",     congratulations charlotte from all of us  ,congratulation
1.429741432785539e+18,2021-08-23 09:44:55+00:00,['1429741432785539073'],Calling community nurses - can you help @NHSX with this important research into electronic patient records? Closes 10 September. Thanks! @Ethicalhealthuk https://t.co/MFTebkTlOe,calling community nurses  can you help  with this important research into electronic patient records closes september thanks  ,community nurse research patient record thanks
1.4297303476929864e+18,2021-08-23 09:00:52+00:00,['1429730347692986379'],Join the EU Primary Care Forum online next month: https://t.co/Mh2f7r5Sh1,join the eu primary care forum online next month ,care forum month
1.4290579486474527e+18,2021-08-21 12:29:00+00:00,['1429057948647452682'],"Join us for our free online conference #qni2021. The theme for Day 5 is: 'Expert by Experience', 11-15 Oct. Come and hear from an inspiring range of speakers! To see the full programme and to book: https://t.co/S4vnHEkUXT https://t.co/iglgF56aYi",join us for our free online conference  the theme for day is expert by experience oct come and hear from an inspiring range of speakers to see the full programme and to book  ,join online conference theme day experience oct come hear range speaker programme book
1.428719563500368e+18,2021-08-20 14:04:22+00:00,['1428719563500367874'],Social prescribing and holistic approaches to public health - including new work by @TheQNI and @NGSOpenGardens in the latest @IndyNurseMag: https://t.co/WkwkF7m0wn @CrystalOldman @GeorgePlumptre @BoranSue @NASPTweets @Howarth2L,social prescribing and holistic approaches to public health  including new work by  and  in the latest       ,prescribing approach health work
1.428705129956528e+18,2021-08-20 13:07:01+00:00,['1428705129956528132'],"The QNI and @QNI_Scotland contributed to this beautiful new book, 'Queen's in their Name' by royal photographer Julian Calder - it has some superb photos of amazing people at work including Queen's Nurses - save by buying direct: https://t.co/ifWkc50kXV",the qni and  contributed to this beautiful new book queens in their name by royal photographer julian calder  it has some superb photos of amazing people at work including queen's nurses  save by buying direct ,qni book queen name royal photographer calder photo people work nurse save
1.4287044688084746e+18,2021-08-20 13:04:24+00:00,['1428704468808474632'],"@BurdettTrust @StephenMcGann For those who haven't seen it yet, we really hope you like it - take two minutes and let us know :-)",  for those who haven't seen it yet we really hope you like it  take two minutes and let us know ,minute
1.4286648585185608e+18,2021-08-20 10:27:00+00:00,['1428664858518560771'],"Join us for our free online conference #qni2021. The theme for Day 4 is: 'The Nurses' Role in Building Back Fairer: A UK Perspective', 11-15 Oct. Come and hear from an inspiring range of speakers!To see the full programme and to book: https://t.co/S4vnHEkUXT https://t.co/3tZVPxqr5P",join us for our free online conference  the theme for day is the nurses role in building back fairer a uk perspective oct come and hear from an inspiring range of speakersto see the full programme and to book  ,join online conference theme day nurse role fairer perspective oct come hear range speakersto programme book
1.4286466280811438e+18,2021-08-20 09:14:33+00:00,['1428646628081143819'],"This looks like a great event for LD practitioners - a range of expert speakers including Gerard Wainwright, one of the project leaders on the QNI's Learning Disability innovation programme @BoranSue @AngieHack10 @GerardW68 @BurdettTrust https://t.co/0R1jHBwHY2",this looks like a great event for ld practitioners  a range of expert speakers including gerard wainwright one of the project leaders on the qni's learning disability innovation programme     ,event practitioner range speaker gerard project leader disability innovation programme
1.4283017156237148e+18,2021-08-19 10:24:00+00:00,['1428301715623714818'],"Join us for our free online conference #qni2021. The theme for Day 3 is: 'Learning from Nurses Worldwide', 11-15 Oct. Come and hear from an inspiring range of speakers! To see the full programme and to book: https://t.co/S4vnHEkUXT https://t.co/c35JSnxsLo",join us for our free online conference  the theme for day is learning from nurses worldwide oct come and hear from an inspiring range of speakers to see the full programme and to book  ,join online conference theme day nurse come hear range speaker programme book
1.4282999689016812e+18,2021-08-19 10:17:03+00:00,['1428299968901681160'],Can you inspire a former colleague to re-join nursing? There are fully funded Return to Practice courses at universities across the country. Pls RT/tag someone!👩‍⚕️📚👩‍🎓 https://t.co/bV3e1DxkkY #WeAreTheNHS #WeAreReturningNurses @CrystalOldman @teamCNO_ @NHS_HealthEdEng,can you inspire a former colleague to rejoin nursing there are fully funded return to practice courses at universities across the country pls rttag someone      ,colleague nursing return practice course university country pls someone
1.428284528058118e+18,2021-08-19 09:15:42+00:00,['1428284528058118144'],@NICEComms We hope that many community nurses will take time to engage with this important review and add their expert views, we hope that many community nurses will take time to engage with this important review and add their expert views,community nurse time review view
1.4279849804420342e+18,2021-08-18 13:25:24+00:00,['1427984980442034178'],"Exciting advance news about the Diamond Jubilee of our Patron, Her Majesty the Queen, next year 👑 https://t.co/RUUQJWHCKD",exciting advance news about the diamond jubilee of our patron her majesty the queen next year  ,advance news diamond jubilee patron majesty queen year
1.4279262419280486e+18,2021-08-18 09:32:00+00:00,['1427926241928048643'],"Join us for our free online conference #qni2021. The theme for Day 2 is: 'Healthcare for All', 11-15 Oct. Come and hear from an inspiring range of speakers! To see the full programme and to book:https://t.co/S4vnHEkUXT @ClareHawkinsHCT @katerinakolyva @RivkahMiar @CERINOC https://t.co/T8EXuLndY7",join us for our free online conference  the theme for day is healthcare for all oct come and hear from an inspiring range of speakers to see the full programme and to book     ,join online conference theme day come hear range speaker programme book
1.4279244538251305e+18,2021-08-18 09:24:54+00:00,['1427924453825130496'],ICYMI take a couple of minutes to watch our new animated film - we hope it will raise your spirits this Wednesday! With @StephenMcGann @Hallam_Medical @CrystalOldman https://t.co/TzDETdy7Z5,icymi take a couple of minutes to watch our new animated film  we hope it will raise your spirits this wednesday with    ,icymi couple minute film spirit wednesday
1.4276477392450806e+18,2021-08-17 15:05:20+00:00,['1427647739245080578'],"Congratulations to #extraordinaryQN @Reuben_QN for his Silver Social Care Award, for exceptional work during the pandemic at @MilestonesTrust 👏@sturdy_deborah @CrystalOldman @johnunsworth10 @saldri01 https://t.co/FEeV41Buwa",congratulations to   for his silver social care award for exceptional work during the pandemic at      ,congratulation silver care award work pandemic
1.4276444754264517e+18,2021-08-17 14:52:21+00:00,['1427644475426451475'],The Professional Records Standards Body @ProfRecordSB is hosting Diabetes information standard webinars during September. Pls email info@theprsb.org to get involved. More info via @PiFonline; dates subject to change: https://t.co/Nhq7pkAUT0,the professional records standards body  is hosting diabetes information standard webinars during september pls email infoorg to get involved more info via  dates subject to change ,record standard body diabetes information standard september email infoorg date
1.427559441604436e+18,2021-08-17 09:14:28+00:00,['1427559441604435968'],"Join us for our free online conference #qni2021. The theme for Day 1 is: 'Inequalities in Health', 11-15 Oct. Come and hear from an inspiring range of speakers! To see the full programme and to book: https://t.co/S4vnHECwmt @ClareHawkinsHCT @katerinakolyva @RivkahMiar @CERINOC https://t.co/yjzlLTWA6o",join us for our free online conference  the theme for day is inequalities in health oct come and hear from an inspiring range of speakers to see the full programme and to book      ,join online conference theme day inequality health oct come hear range speaker programme book
1.4275588012475064e+18,2021-08-17 09:11:55+00:00,['1427558801247506433'],"See our press release about the QNI's new animated film, Today's Nurses in the Community, here: https://t.co/KmftghFBEf @CrystalOldman @StephenMcGann @debsap73 @Hallam_Medical @SamSherrington @johnunsworth10 @WHO @ICNurses",see our press release about the qni's new animated film today's nurses in the community here         ,press release film nurse community
1.42754533975885e+18,2021-08-17 08:18:26+00:00,['1427545339758850056'],@ccs_nhst @BedsCHS @CambsPboroCYP @LutonCommNHS @NorfolkCYP @iCaSHgeneral Thank you! :-),      thank you ,thank
1.4275451668151132e+18,2021-08-17 08:17:44+00:00,['1427545166815113226'],@PaulineSeaman7 @Hallam_Medical @StephenMcGann @CrystalOldman @WHO Hi Pauline - it's a lovely idea - probably beyond the QNI's capacity but we'd be glad to advise the NHS if they took it up ;-),     hi pauline  it's a lovely idea  probably beyond the qni's capacity but we'd be glad to advise the nhs if they took it up ,pauline idea capacity
1.427272690025517e+18,2021-08-16 14:15:01+00:00,['1427272690025517068'],"Delighted to announce the launch of our new short animated film, 'Today's Nurses in the Community'. We'd love to know what you think: https://t.co/g99Z5fB8Bb. With thanks to @Hallam_Medical and @StephenMcGann❤️ @CrystalOldman @WHO #IYNM2020",delighted to announce the launch of our new short animated film todays nurses in the community we'd love to know what you think  with thanks to  and    ,launch film today community love thanks
1.4272082631338107e+18,2021-08-16 09:59:00+00:00,['1427208263133810689'],"Join @NGSOpenGardens and host a #GreatBritishGardenParty to celebrate your garden, summer and get togethers, whilst raising vital funds for nursing and health charities - including the QNI. Find out more https://t.co/KrgBDAKffi https://t.co/EMunVYmqsW",join  and host a  to celebrate your garden summer and get togethers whilst raising vital funds for nursing and health charities  including the qni find out more  ,join host garden summer togethers fund nursing health charity qni
1.4265237502294917e+18,2021-08-14 12:39:00+00:00,['1426523750229491718'],"The theme for Day 5 of #qni2021 free online conference is: 'Expert by Experience', 11-15 Oct. Come and hear from an inspiring range of speakers! To see the full programme and to book: https://t.co/S4vnHECwmt https://t.co/ucQsuE1khC",the theme for day of  free online conference is expert by experience oct come and hear from an inspiring range of speakers to see the full programme and to book  ,theme day online conference experience oct come hear range speaker programme book
1.4261611106174523e+18,2021-08-13 12:38:00+00:00,['1426161110617452545'],"The theme for Day 4 of #qni2021 free online conference is: 'The Nurses' Role in Building Back Fairer: A UK Perspective', 11-15 Oct. Come and hear from an inspiring range of speakers! To see the full programme and to book: https://t.co/S4vnHEkUXT https://t.co/qyZVG5bARR",the theme for day of  free online conference is the nurses role in building back fairer a uk perspective oct come and hear from an inspiring range of speakers to see the full programme and to book  ,theme day online conference nurse role fairer perspective oct come hear range speaker programme book
1.426124132786262e+18,2021-08-13 10:11:04+00:00,['1426124132786262017'],#ExtraordinaryQN @nessaredhed opened her garden for the @NGSOpenGardens last weekend and raised an incredible £1845! See the photos of her beautiful garden and read more here: https://t.co/BFhfF48ps5 #ThankYou @DevonNGS @CrystalOldman https://t.co/tA0oeXcIP8,  opened her garden for the  last weekend and raised an incredible  see the photos of her beautiful garden and read more here     ,garden weekend photo garden
1.4258138223890678e+18,2021-08-12 13:38:00+00:00,['1425813822389067782'],"The theme for Day 3 of #qni2021 free online conference is: 'Learning from Nurses Worldwide', 11-15 Oct. Come and hear from an inspiring range of speakers! To see the full programme and to book: https://t.co/S4vnHECwmt https://t.co/tojcfOhuV7",the theme for day of  free online conference is learning from nurses worldwide oct come and hear from an inspiring range of speakers to see the full programme and to book  ,theme day online conference nurse come hear range speaker programme book
1.4257459363876495e+18,2021-08-12 09:08:14+00:00,['1425745936387649539'],@JamieWaterall Some excellent resources here and very relevant for community nursing 👩‍⚕️, some excellent resources here and very relevant for community nursing ,resource community nursing
1.4254434649683804e+18,2021-08-11 13:06:20+00:00,['1425443464968380421'],@NGSOpenGardens @CandideUK What a great opportunity and we hope some community nurses will be able to join you online this evening!,  what a great opportunity and we hope some community nurses will be able to join you online this evening,opportunity community nurse evening
1.4254358318172774e+18,2021-08-11 12:36:00+00:00,['1425435831817277441'],"The theme for Day 2 of #qni2021 free online conference is: 'Healthcare for All', 11-15 Oct. Come and hear from an inspiring range of speakers! To see the full programme and to book: https://t.co/S4vnHEkUXT https://t.co/HvfalZU0MM",the theme for day of  free online conference is healthcare for all oct come and hear from an inspiring range of speakers to see the full programme and to book  ,theme day online conference come hear range speaker programme book
1.4254135838070702e+18,2021-08-11 11:07:35+00:00,['1425413583807070212'],"Pet portrait competition winners announced! The wonderful animal artist @Quailio raised £600 for the QNI's #TalkToUs listening service, see the winning portraits here: https://t.co/MNCPnliBqh @CrystalOldman https://t.co/re76l028zN",pet portrait competition winners announced the wonderful animal artist  raised  for the qni's  listening service see the winning portraits here   ,portrait competition winner artist listening service portrait
1.4254086701799916e+18,2021-08-11 10:48:04+00:00,['1425408670179991553'],A great little animation - if you haven't signed the petition already please join us and sign now! https://t.co/yGrO9eIXk8,a great little animation  if you haven't signed the petition already please join us and sign now ,animation petition
1.4250884453330534e+18,2021-08-10 13:35:36+00:00,['1425088445333053443'],"The theme for Day 1 of #qni2021 free online conference is: 'Inequalities in Health', 11-15 Oct. Come and hear from an inspiring range of speakers! To see the full programme and to book: https://t.co/S4vnHECwmt https://t.co/0bd2uzY3Ry",the theme for day of  free online conference is inequalities in health oct come and hear from an inspiring range of speakers to see the full programme and to book  ,theme day online conference inequality health oct come hear range speaker programme book
