Unnamed: 0,Unnamed: 0.1,Unnamed: 0.1.1,id,created_at,edit_history_tweet_ids,text,clean_text,non_english,whitespace
0,0,0,1.564993709405573e+18,2022-08-31 15:09:11+00:00,['1564993709405573122'],"Retired Queen's Nurse Allyson Kent has a really inspiring message for anyone living with cancer - walking, campaigning and fundraising with others for physical and mental health. Follow and walk with her! https://t.co/osiP5I7xTN",retired queens nurse allyson kent has a really inspiring message for anyone living with cancer  walking campaigning and fundraising with others for physical and mental health follow and walk with her ,True,False
1,1,1,1.5649725420577587e+18,2022-08-31 13:45:04+00:00,['1564972542057758725'],Amanda is one of an amazing 86 Queen's Nurses who wrote chapters for this book! Published by @wiley_nursing in 2022 and edited by @mattbradby #districtnursing https://t.co/psmrXZDnfr,amanda is one of an amazing 86 queens nurses who wrote chapters for this book published by  in 2022 and edited by   ,True,False
3,3,3,1.564947541111849e+18,2022-08-31 12:05:43+00:00,['1564947541111848962'],"Super pics from our visit to Frogmore gardens yesterday: our wonderful QNs, the QNI team including @BoranSue @saldri01 @AngieHack10 @BecksBDaniels @nich_bull @mattbradby, and @heatherngs with Nick and head gardener Neil Dodds https://t.co/mEZcJaGKS7",super pics from our visit to frogmore gardens yesterday our wonderful qns the qni team including       and  with nick and head gardener neil dodds ,True,False
5,5,5,1.564701072991703e+18,2022-08-30 19:46:21+00:00,['1564701072991703041'],"We had a fabulous day at Frogmore today thanks to @NGSOpenGardens @BerksNGS and the staff of @RoyalFamily. So many Queen's Nurses gathered together again, what a reunion! https://t.co/LRrP7CXHXV",we had a fabulous day at frogmore today thanks to   and the staff of  so many queens nurses gathered together again what a reunion ,True,False
7,7,7,1.5646979291636736e+18,2022-08-30 19:33:51+00:00,['1564697929163673602'],@SimonLittlefie1 @saldri01 Wonderful! So glad to see you and so many great connections today :-),  wonderful so glad to see you and so many great connections today ,True,False
9,9,9,1.5645893500710257e+18,2022-08-30 12:22:24+00:00,['1564589350071025665'],"📢Our bespoke leadership programme for Executive Nurses is now open for applications!

✅Are you a senior #nurse working in the community or primary care?
✅Do you want to develop your #leadership skills &amp; your career?

Find out more &amp; apply by 18 Sep! 
https://t.co/yVg9cwpocY","our bespoke leadership programme for executive nurses is now open for applications

are you a senior  working in the community or primary care
do you want to develop your  skills amp your career

find out more amp apply by 18 sep 
",True,False
10,10,10,1.5645887456760136e+18,2022-08-30 12:20:00+00:00,['1564588745676013568'],"Book your place at our conference #QNI2022 10-14 October. Details of Day 3 below, to view the programme in full or book your place, go to https://t.co/ksTVRGgzbn @elizabeth_iro @HowardCatton @fernandof1974 @NurseEstherM @greenekaren06 @johnunsworth10 https://t.co/u68phD3gRi",book your place at our conference  1014 october details of day 3 below to view the programme in full or book your place go to        ,True,False
11,11,11,1.5645603506950144e+18,2022-08-30 10:27:10+00:00,['1564560350695014400'],"We're looking forward to welcoming Queen's Nurses coming to Frogmore Gardens in Windsor today! Open for @NGSOpenGardens @BerksNGS today by kind permission of the QNI's Patron, HM the Queen",were looking forward to welcoming queens nurses coming to frogmore gardens in windsor today open for   today by kind permission of the qnis patron hm the queen,True,False
12,12,12,1.564554479315329e+18,2022-08-30 10:03:50+00:00,['1564554479315329024'],"Our Executive Nurse Leadership Programme is a life-changing opportunity for #nurses who:
✅work as an Executive or Associate Director Nurse in the community
✅want to develop leadership skills.
Find out more and apply by 23.59 on 18 September 2022.   (8/8)
https://t.co/rlOJ0LaS5V","our executive nurse leadership programme is a lifechanging opportunity for  who
work as an executive or associate director nurse in the community
want to develop leadership skills
find out more and apply by 2359 on 18 september 2022   88
",True,False
13,13,13,1.5645544776250327e+18,2022-08-30 10:03:50+00:00,['1564554477625032706'],"Our Aspiring Leaders programme is open to any #nurse who:
✅ works in a Community or Primary Care setting 
✅ aspires to take the next step in their #leadership career. 
Find out more and apply on our website by 23.59 on 7 September 2022.   (7/8)
https://t.co/Sq9eTQfXRP","our aspiring leaders programme is open to any  who
 works in a community or primary care setting 
 aspires to take the next step in their  career 
find out more and apply on our website by 2359 on 7 september 2022   78
",True,False
14,14,14,1.564554476131844e+18,2022-08-30 10:03:49+00:00,['1564554476131844096'],"Based on feedback from participants, as many as 50% of those undertaking our programmes move to a more responsible or more senior role before the end of the programme. #QNILeaders   (6/8)",based on feedback from participants as many as 50 of those undertaking our programmes move to a more responsible or more senior role before the end of the programme    68,True,False
15,15,15,1.5645544747183882e+18,2022-08-30 10:03:49+00:00,['1564554474718388224'],"We offer personal support throughout your progress with us, including mentorship from a matched mentor after a personal needs assessment is undertaken with you.   (5/8)",we offer personal support throughout your progress with us including mentorship from a matched mentor after a personal needs assessment is undertaken with you   58,True,False
16,16,16,1.564554473267143e+18,2022-08-30 10:03:49+00:00,['1564554473267142659'],"All our leadership programmes are bespoke and personalised for the individuals taking part, and the particular challenges and opportunities that are most relevant within community healthcare at the time.   (4/8)",all our leadership programmes are bespoke and personalised for the individuals taking part and the particular challenges and opportunities that are most relevant within community healthcare at the time   48,True,False
17,17,17,1.5645544718201242e+18,2022-08-30 10:03:48+00:00,['1564554471820124160'],"We currently offer two different Leadership programmes for #CommunityNurses: 
1⃣ Aspiring Leaders Programme that is open to any nurse.  
2⃣ Executive Nurse Leadership Programme for those nurses already working at a senior level.   (3/8)","we currently offer two different leadership programmes for  
1⃣ aspiring leaders programme that is open to any nurse  
2⃣ executive nurse leadership programme for those nurses already working at a senior level   38",True,False
18,18,18,1.5645544703227576e+18,2022-08-30 10:03:48+00:00,['1564554470322757633'],"Our Leadership programmes are open to all #nurses working in the community and primary care setting, including adult social care and care home nurses. #QNILeaders   (2/8)",our leadership programmes are open to all  working in the community and primary care setting including adult social care and care home nurses    28,True,False
19,19,19,1.5645544687792456e+18,2022-08-30 10:03:48+00:00,['1564554468779245568'],"🧵About the QNI Leadership programmes for nurses working in the community. #QNILeaders

Over the last six years, we have created bespoke transformational leadership programmes that offer career-changing learning to nurses.   (1/8)","about the qni leadership programmes for nurses working in the community 

over the last six years we have created bespoke transformational leadership programmes that offer careerchanging learning to nurses   18",True,False
20,20,20,1.564176034186072e+18,2022-08-29 09:00:02+00:00,['1564176034186072064'],"Book your place at our conference #QNI2022 10-14 October. Details of Day 2 below, to view the programme in full or book your place, go to https://t.co/ksTVRGgzbn @alisonleary1 @SamSherrington @saldri01 @Ben_Bowers__ @Sspreadbury1 @neem_young https://t.co/h5IsE1BuWA",book your place at our conference  1014 october details of day 2 below to view the programme in full or book your place go to        ,True,False
21,21,21,1.5638936654323425e+18,2022-08-28 14:18:00+00:00,['1563893665432342528'],"Book your place at our conference #QNI2022 10-14 October. Details of Day 1 below, to view the programme in full or book your place, go to https://t.co/ksTVRFYXMN @KentonCool @GeorgePlumptre @NursingEmma @ChantrySu @NickiAnn30 https://t.co/EsnLl9EMHR",book your place at our conference  1014 october details of day 1 below to view the programme in full or book your place go to       ,True,False
24,24,24,1.563473900259971e+18,2022-08-27 10:30:00+00:00,['1563473900259971072'],"Book your place at our conference #QNI2022 10-14 October. Details of Day 5 below, to view the programme in full or book your place, go to https://t.co/ksTVRGgzbn https://t.co/Uzsp9XEYGf",book your place at our conference  1014 october details of day 5 below to view the programme in full or book your place go to  ,True,False
25,25,25,1.5631756176084296e+18,2022-08-26 14:44:44+00:00,['1563175617608429568'],"📢Book your free place at our Annual Conference #QNI2022 that is taking place online on 10-14 October! 

We have an amazing lineup of inspiring and uplifting speakers - view the programme and book your place now: https://t.co/ksTVRGh70V #CommunityNursing #Nursing https://t.co/dLYRyNQTEq","book your free place at our annual conference  that is taking place online on 1014 october 

we have an amazing lineup of inspiring and uplifting speakers  view the programme and book your place now    ",True,False
26,26,26,1.5631592982045082e+18,2022-08-26 13:39:53+00:00,['1563159298204508160'],"📢The QNI International Community Nurse of the Year Award 2022 is now open for nominations!🌍

Do you know an outstanding nurse who you would like to nominate? 

Find out more on our website and submit your nomination by 30 September 2022. #QNIawards
https://t.co/sqT3yQ3qiM","the qni international community nurse of the year award 2022 is now open for nominations

do you know an outstanding nurse who you would like to nominate 

find out more on our website and submit your nomination by 30 september 2022 
",True,False
27,27,27,1.5631492713391268e+18,2022-08-26 13:00:02+00:00,['1563149271339126786'],"Book your place at our online conference #QNI2022 10-14 October. Details of Day 4 below, to view the programme in full or book your place, go to https://t.co/ksTVRFYXMN https://t.co/idy7b9qdJx",book your place at our online conference  1014 october details of day 4 below to view the programme in full or book your place go to  ,True,False
29,29,29,1.563110270624764e+18,2022-08-26 10:25:04+00:00,['1563110270624763905'],"A super blog for @JoTrust by Queen's Nurse Melissa Civale - case study in how to engage with a group of people with no prior knowledge of cervical screening, and who speak a number of different languages @qnihih @BoranSue @MelissaCivale https://t.co/SIKWzllXLD",a super blog for  by queens nurse melissa civale  case study in how to engage with a group of people with no prior knowledge of cervical screening and who speak a number of different languages    ,True,False
30,30,30,1.563088872342438e+18,2022-08-26 09:00:02+00:00,['1563088872342437888'],"Did you know you can raise FREE donations for the QNI when shopping online via #Amazon?

@AmazonSmile donates 0.5% of the price of your eligible purchases to the charity of your choice. Choose us as the charity of your choice in just one click⬇️","did you know you can raise free donations for the qni when shopping online via 

 donates 05 of the price of your eligible purchases to the charity of your choice choose us as the charity of your choice in just one click",True,False
33,33,33,1.5628323257210716e+18,2022-08-25 16:00:37+00:00,['1562832325721071618'],@Rosy_roo_roo @NCHC_NHS Congratulations from everyone at the QNI! Good luck in your new role! https://t.co/QkliNyNeCL,  congratulations from everyone at the qni good luck in your new role ,True,False
34,34,34,1.5627340267580375e+18,2022-08-25 09:30:00+00:00,['1562734026758037505'],"Book your place at our conference #QNI2022 10-14 October. Details of Day 3 below, to view the programme in full or book your place, go to https://t.co/ksTVRFYXMN https://t.co/QeM6cHBmAm",book your place at our conference  1014 october details of day 3 below to view the programme in full or book your place go to  ,True,False
38,38,38,1.562379191655481e+18,2022-08-24 10:00:01+00:00,['1562379191655481344'],"Book your place at our conference #QNI2022 10-14 October. Details of Day 2 below, to view the programme in full or book your place, go to https://t.co/ksTVRGgzbn https://t.co/oogLxO4DIO",book your place at our conference  1014 october details of day 2 below to view the programme in full or book your place go to  ,True,False
39,39,39,1.5620960827583775e+18,2022-08-23 15:15:03+00:00,['1562096082758377472'],"📢Applications are now open for our bespoke Aspiring Leaders Programme! 

Any #nurse working in a community or primary care setting, including the charity or independent sector, can apply. #QNILeaders

🗓️Closing date: 7 September 2022. 
https://t.co/O8WuKAsMY3","applications are now open for our bespoke aspiring leaders programme 

any  working in a community or primary care setting including the charity or independent sector can apply 

closing date 7 september 2022 
",True,False
40,40,40,1.5619984914377482e+18,2022-08-23 08:47:15+00:00,['1561998491437748224'],Community nurses - what do you think of this? 🤓🤔 https://t.co/gRyGYBLyJF,community nurses  what do you think of this  ,True,False
41,41,41,1.5619954174196613e+18,2022-08-23 08:35:02+00:00,['1561995417419661313'],"Sharing this exciting and innovative nursing opportunity in Norfolk, part of a research project with UEA and supported by HEE. Full details on the website link below: https://t.co/zeZ1zHGd4I",sharing this exciting and innovative nursing opportunity in norfolk part of a research project with uea and supported by hee full details on the website link below ,True,False
42,42,42,1.5619941490748047e+18,2022-08-23 08:30:00+00:00,['1561994149074804738'],"Book your free place at our conference #QNI2022 10-14 October. Details of Day 1 below, to view the programme in full or book your place, go to https://t.co/ksTVRGgzbn https://t.co/OqVGpnxDIZ",book your free place at our conference  1014 october details of day 1 below to view the programme in full or book your place go to  ,True,False
43,43,43,1.56174630109986e+18,2022-08-22 16:05:08+00:00,['1561746301099859969'],"@StN_Freda You might be interested in joining the new Community Nurses Research Forum / Community of Practice ⬇️ @Ben_Bowers__
@CatherineJanee1
https://t.co/5Gbu7ZjSz4"," you might be interested in joining the new community nurses research forum  community of practice  

",True,False
44,44,44,1.5617417192212808e+18,2022-08-22 15:46:56+00:00,['1561741719221280770'],@KevinMur10 Also tagging in @WeStudentNurse @agnes_fanning @DrAmandaYoung @BoranSue @Ben_Bowers__, also tagging in     ,True,False
46,46,46,1.5616798307808788e+18,2022-08-22 11:41:00+00:00,['1561679830780878848'],Leaving the EU means that some programme standards for pre-reg nursing and midwifery courses must now be updated. Health and social care professionals - please give your views to @nmcnews by 21 September: https://t.co/DQpgPpxnSq,leaving the eu means that some programme standards for prereg nursing and midwifery courses must now be updated health and social care professionals  please give your views to  by 21 september ,True,False
47,47,47,1.5616667464902656e+18,2022-08-22 10:49:01+00:00,['1561666746490265600'],Another upcoming conference with a strong line up of speakers including a number of #ExtraordinaryQNs https://t.co/tcFVJBRzUW,another upcoming conference with a strong line up of speakers including a number of  ,True,False
48,48,48,1.5616520688672686e+18,2022-08-22 09:50:41+00:00,['1561652068867268609'],NHS England and @ICCHNR want to hear about your community nursing research work. Awards of £500 are offered - apply by 30th September @CrystalOldman @NHSEnglandCHS @Ben_Bowers__  @DrAmandaYoung  @BoranSue https://t.co/kev43Hluxy,nhs england and  want to hear about your community nursing research work awards of £500 are offered  apply by 30th september        ,True,False
49,49,49,1.561631761083269e+18,2022-08-22 08:30:00+00:00,['1561631761083269121'],"Book your place at our conference, #QNI2022, 10-14 October. Details of Day 5 below, featuring @NHS_RobW @kayla_meikle @SchnellerKendra @BecksBDaniels @EveThrupp @agnes_fanning @cfry_ @AngieHack10   and more. To view the programme or book your place, go to https://t.co/ksTVRGgzbn https://t.co/4Y9QXsVnyq",book your place at our conference  1014 october details of day 5 below featuring           and more to view the programme or book your place go to  ,True,False
50,50,50,1.5613083807482552e+18,2022-08-21 11:05:00+00:00,['1561308380748255232'],"Book your place at our conference, #QNI2022, 10-14 October. Details of Day 4 below, featuring @CNOEngland @CNO_NI @sturdy_deborah @profalexmcmahon @Crouchendtiger7 @stephlawrence5 @helenwhyley and more. To view the programme or book your place, go to https://t.co/ksTVRGgzbn https://t.co/ZjGzc0zzmN",book your place at our conference  1014 october details of day 4 below featuring        and more to view the programme or book your place go to  ,True,False
51,51,51,1.5609301385057649e+18,2022-08-20 10:02:00+00:00,['1560930138505764865'],"Book your place at our conference, #QNI2022, 10-14 October. Details of Day 3 below, featuring @elizabeth_iro @HowardCatton @fernandof1974 @NurseEstherM @greenekaren06 @johnunsworth10  and more. To view the programme or book your place, go to https://t.co/ksTVRGgzbn https://t.co/L0vzg4E90Z",book your place at our conference  1014 october details of day 3 below featuring        and more to view the programme or book your place go to  ,True,False
52,52,52,1.5605383074228677e+18,2022-08-19 08:05:00+00:00,['1560538307422867457'],"Booking is now open for our conference, #QNI2022, 10-14 October. Details of Day 2 below, featuring @alisonleary1 @SamSherrington @saldri01 @Ben_Bowers__ @Sspreadbury1 @neem_young and more. To view the programme or book your place, go to https://t.co/ksTVRFYXMN https://t.co/7b87zn4fzf",booking is now open for our conference  1014 october details of day 2 below featuring       and more to view the programme or book your place go to  ,True,False
53,53,53,1.5602950812985098e+18,2022-08-18 15:58:30+00:00,['1560295081298509826'],@ResearchNurseD @louisebrady17 @DrNeenaJha @SteveBarclay @AmandaPritchard @NHSEmployers @DHSCgovuk @theRCN @rcgp We have put some recent examples of employer support on our website here re #fuelcrisis: https://t.co/LuIYnAYLYg,         we have put some recent examples of employer support on our website here re  ,True,False
54,54,54,1.5602643513484698e+18,2022-08-18 13:56:24+00:00,['1560264351348469769'],"We are delighted to announce bookings are now open for our conference #QNI2022, 10-14 October. Details of Day 1 below. To view the programme or book your place, go to https://t.co/ksTVRFYXMN  @KentonCool @GeorgePlumptre @NursingEmma @ChantrySu @NickiAnn30 https://t.co/akmXDbrZNk",we are delighted to announce bookings are now open for our conference  1014 october details of day 1 below to view the programme or book your place go to        ,True,False
55,55,55,1.5602388328086282e+18,2022-08-18 12:15:00+00:00,['1560238832808628225'],"#ALevelResultsDay Did you know nursing is the UK’s most employable type of degree, with 94% of students getting a job within six months of finishing their course? If you're eligible you can also receive financial support every year of your degree. https://t.co/38BokUnfoL", did you know nursing is the uk’s most employable type of degree with 94 of students getting a job within six months of finishing their course if youre eligible you can also receive financial support every year of your degree ,True,False
58,58,58,1.5601938605459538e+18,2022-08-18 09:16:18+00:00,['1560193860545953792'],"A nursing degree opens up a world of possibilities. Community nurses work with people of all ages everywhere, and you can progress into many different specialisms. Read student blogs and find out more here: https://t.co/cpwUxJmMDN #ALevelResultsDay @NHS_HealthEdEng",a nursing degree opens up a world of possibilities community nurses work with people of all ages everywhere and you can progress into many different specialisms read student blogs and find out more here   ,True,False
64,64,64,1.5598570373701837e+18,2022-08-17 10:57:53+00:00,['1559857037370183680'],@sarahhall167 @CrystalOldman @SamSherrington @kerry_bareham @ne55hao @alisonleary1 @LouisePatten1 @Alison_Morton2 @BrenJMcinerney Hi Sarah it's not on our website quite yet but we'll be linking it soon and will share :-),         hi sarah its not on our website quite yet but well be linking it soon and will share ,True,False
65,65,65,1.5598205485108183e+18,2022-08-17 08:32:53+00:00,['1559820548510818309'],"We would like to showcase good practice around caring for people with #LongCovid. 

If you cared for a patient with Long Covid and would to share your experience, please get in touch with @EveThrupp at eve.thrupp@qni.org.uk 📧

#CommunityNursing https://t.co/4LGbr1sSIR","we would like to showcase good practice around caring for people with  

if you cared for a patient with long covid and would to share your experience please get in touch with  at evethrupporguk 

 ",True,False
68,68,68,1.5595007393570488e+18,2022-08-16 11:22:05+00:00,['1559500739357048833'],Our survey of pre-reg nursing students show they value high quality placements in #community healthcare settings and are attracted to the community's diverse careers after graduation https://t.co/EwTscQfDNR,our survey of prereg nursing students show they value high quality placements in  healthcare settings and are attracted to the communitys diverse careers after graduation ,True,False
71,71,71,1.559488495772729e+18,2022-08-16 10:33:25+00:00,['1559488495772729344'],Join @UKHealthClimate on Wednesday 24 August and follow them for updates about sustainability in healthcare; cc @GreenerPractice @GreenerNHS @NGSOpenGardens @SusHealthcare https://t.co/uYyTeflFbF,join  on wednesday 24 august and follow them for updates about sustainability in healthcare cc     ,True,False
74,74,74,1.5580906322872074e+18,2022-08-12 13:58:49+00:00,['1558090632287207428'],"WE ARE #HIRING! 📢We currently have an exciting opportunity for a Programme, Networks &amp; Events #Coordinator to join our super friendly team. Closing date: 5 Sep 2022. 

If this job sounds like anyone you know, please share this opportunity with them! 🙏
https://t.co/j3ZRLwXjRi","we are  we currently have an exciting opportunity for a programme networks amp events  to join our super friendly team closing date 5 sep 2022 

if this job sounds like anyone you know please share this opportunity with them 
",True,False
76,76,76,1.557771396469629e+18,2022-08-11 16:50:17+00:00,['1557771396469628928'],@maria_tvlns Spectacular and inspiring view - thanks for sharing!, spectacular and inspiring view  thanks for sharing,True,False
79,79,79,1.5576772404391526e+18,2022-08-11 10:36:09+00:00,['1557677240439152641'],"We've just published a new report on #PreRegistration #CommunityNursing #Placements in England. With increasingly #complex healthcare now delivered in the #community, it's vital #StudentNurses gain a wider range of experiences. Read more here: https://t.co/C0hzpTrXmP https://t.co/F3EgwpSwo2",weve just published a new report on    in england with increasingly  healthcare now delivered in the  its vital  gain a wider range of experiences read more here  ,True,False
81,81,81,1.5573864074249503e+18,2022-08-10 15:20:29+00:00,['1557386407424950274'],"What is working well in General Practice, where are the challenges and what needs fixing? Please add your views via this workforce survey by 23 Sept⬇️ Thank you! @UniOfSurrey @BoranSue @Ruth_Abrams_ @WeGPNs @RCNGPNForum @BAMEGPNs @gpnreport https://t.co/aoa41n3Qdn",what is working well in general practice where are the challenges and what needs fixing please add your views via this workforce survey by 23 sept thank you        ,True,False
83,83,83,1.5573475221459313e+18,2022-08-10 12:45:58+00:00,['1557347522145931267'],"Huge congratulations to our colleague @SchnellerKendra on receiving the CNO's Silver Award today, presented by @JamieWaterall - and thank you to @GSTTnhs https://t.co/PMWSw5zZCO",huge congratulations to our colleague  on receiving the cnos silver award today presented by   and thank you to  ,True,False
84,84,84,1.5573445927558267e+18,2022-08-10 12:34:19+00:00,['1557344592755826688'],@JamieWaterall @SchnellerKendra @teamCNO_ @CNOEngland @DHSCgovuk @WeNurses @Jeanelleuk @Crouchendtiger7 @avey_bhatia @GSTTnhs @GSTT_ILS @qnihih QNI colleagues were delighted to be there this morning to help celebrate the award. Congratulations Kendra!! @BoranSue @DrAmandaYoung @mattbradby,            qni colleagues were delighted to be there this morning to help celebrate the award congratulations kendra   ,True,False
