id,created_at,edit_history_tweet_ids,text,clean_text,nouns
1.448734856989614e+18,2021-10-14 19:38:00+00:00,['1448734856989614082'],@HeatherFinlay9 speaking at #qni2021 'We have 3 key strategic drivers: 1. Health and Wellbeing 2026; 2. Nursing and Midwifery Task Group and 3. Rebuilding Health and Social Care Services. To read the Health and Wellbeing 2026 report: https://t.co/QX0dzf4peZ https://t.co/Zlj3267l7U, speaking at  we have key strategic drivers health and wellbeing nursing and midwifery task group and rebuilding health and social care services to read the health and wellbeing report  ,speaking driver health nursing midwifery task group health care service health report
1.4487337799678116e+18,2021-10-14 19:33:43+00:00,['1448733779967811587'],'We have to show that nursing has expertise.' @alisonleary1 #qni2021,we have to show that nursing has expertise  ,nursing
1.4487332843017871e+18,2021-10-14 19:31:45+00:00,['1448733284301787136'],"'Dealing with micro aggression is very important. We can see that in bullying and racism and sexism, it all needs to be tackled. We need to think about how we can be good bystanders for each other.' @alisonleary1 #qni2021",dealing with micro aggression is very important we can see that in bullying and racism and sexism it all needs to be tackled we need to think about how we can be good bystanders for each other  ,aggression bullying racism sexism bystander
1.4487325938730967e+18,2021-10-14 19:29:01+00:00,['1448732593873096715'],'Nurses are the Air Traffic Controllers of healthcare.' @alisonleary1 #qni2021,nurses are the air traffic controllers of healthcare  ,nurse air traffic controller healthcare
1.4487318166769664e+18,2021-10-14 19:25:55+00:00,['1448731816676966400'],"'Social justice is very important, the fact that we, as nurses, recognise inequality is a very important thing.' @alisonleary1 #qni2021 https://t.co/Z9DhqOmdHc",social justice is very important the fact that we as nurses recognise inequality is a very important thing   ,justice fact nurse inequality thing
1.44872930353809e+18,2021-10-14 19:15:56+00:00,['1448729303538089985'],What building back fairer means for the @nmcnews @Crouchendtiger7 #qni2021 https://t.co/8vxyts1Xdi,what building back fairer means for the    ,building fairer mean
1.4487287701066097e+18,2021-10-14 19:13:49+00:00,['1448728770106609666'],#ni2021 Building back fairer for @Crouchendtiger7 @nmcnews https://t.co/fomk1G3odB, building back fairer for   ,fairer
1.448728194459259e+18,2021-10-14 19:11:32+00:00,['1448728194459258888'],"@Crouchendtiger7 speaking at #qni2021 ' I know it's been said a lot tonight, but I make no apology for saying again: what you've done has been utterly amazing.' https://t.co/uBVYqqiSQo", speaking at   i know it's been said a lot tonight but i make no apology for saying again what you've done has been utterly amazing ,speaking lot tonight apology
1.4487261433439437e+18,2021-10-14 19:03:23+00:00,['1448726143343943685'],"'A personal thank you to colleagues for the work they are doing during the pandemic, we should celebrate and congratulate all of our community colleagues.' @MRadford_HEECN #qni2021",a personal thank you to colleagues for the work they are doing during the pandemic we should celebrate and congratulate all of our community colleagues  ,thank colleague work community colleague
1.4487257342357258e+18,2021-10-14 19:01:45+00:00,['1448725734235725833'],'It's amazing to see what nurses have achieved.' @MRadford_HEECN https://t.co/OfkQus6eQ4,its amazing to see what nurses have achieved  ,amazing nurse
1.44872516891913e+18,2021-10-14 18:59:30+00:00,['1448725168919130119'],"'The pandemic will redefine our global society forever and future generations will ask us..what did you do? and we will be proud to say, we were nurses, midwives and we worked in the NHS' @MRadford_HEECN #qni2021 https://t.co/V7JnWLcDFz",the pandemic will redefine our global society forever and future generations will ask uswhat did you do and we will be proud to say we were nurses midwives and we worked in the nhs   ,pandemic society generation nurse midwife
1.448724832665936e+18,2021-10-14 18:58:10+00:00,['1448724832665935874'],"@MRadford_HEECN speaking at #qni2021 'How we will be judged after the pandemic, how we learn and build back afterwards, nursing will have such an important role in this.' https://t.co/Ueip8cVh3Y", speaking at  how we will be judged after the pandemic how we learn and build back afterwards nursing will have such an important role in this ,speaking afterwards nursing role
1.4487242661663908e+18,2021-10-14 18:55:55+00:00,['1448724266166390788'],'As nurses we are so adept at finding solutions. Nurses must have a place at every table. Who better to shine a light on what's happening in all settings across the UK?' Jude Diggins @theRCN #qni2021 https://t.co/tX0v14pSHO,as nurses we are so adept at finding solutions nurses must have a place at every table who better to shine a light on what's happening in all settings across the uk jude diggins   ,nurse solution nurse place table light setting jude diggins
1.4487223976123597e+18,2021-10-14 18:48:30+00:00,['1448722397612359681'],'The task is big but we're trying to support the profession in whatever way we can. We need to acknowledge the opportunities the pandemic has given us to do things differently.' Jude Diggins @theRCN #qni2021,the task is big but we're trying to support the profession in whatever way we can we need to acknowledge the opportunities the pandemic has given us to do things differently jude diggins  ,task profession way opportunity pandemic thing diggins
1.4487221504211436e+18,2021-10-14 18:47:31+00:00,['1448722150421143558'],'We need to understand where we are and where we are headed' Jude Diggins @theRCN #qni2021 https://t.co/I6VeUsVgpY,we need to understand where we are and where we are headed jude diggins   ,jude diggins
1.4487217713734738e+18,2021-10-14 18:46:00+00:00,['1448721771373473795'],Jude Diggins @theRCN speaking at #qni2021 'I think certainly at the RCN we've been considering how we can best support the nursing profession as we go forward.' #qni2021 https://t.co/KlRpBeCzJd,jude diggins  speaking at  i think certainly at the rcn we've been considering how we can best support the nursing profession as we go forward  ,jude diggins rcn support nursing profession
1.4487211046720676e+18,2021-10-14 18:43:21+00:00,['1448721104672067584'],@CrystalOldman welcoming the chair @bjw46 for this next session ' Creating and Supporting the Nursing Workforce in 'Building Back Fairer' #qni2021 https://t.co/aNs0HILGJP, welcoming the chair  for this next session  creating and supporting the nursing workforce in building back fairer  ,chair session nursing workforce fairer
1.4487189169607967e+18,2021-10-14 18:34:40+00:00,['1448718916960796676'],Thank you to you all for such wonderful presentations this evening @suenaidoo73 @charlottemcardl @sturdy_deborah @profalexmcmahon @CNOEngland 'We've been been very lucky to have this amazing team steering us through this pandemic.' #qni2021 https://t.co/DEWLv1lCdZ,thank you to you all for such wonderful presentations this evening      weve been been very lucky to have this amazing team steering us through this pandemic  ,thank presentation evening team
1.448715125834371e+18,2021-10-14 18:19:36+00:00,['1448715125834371072'],The community nursing engagement document https://t.co/bcLYWr9pH9 @CNOEngland #qni2021,the community nursing engagement document   ,community nursing engagement document
1.4487146428854313e+18,2021-10-14 18:17:41+00:00,['1448714642885431309'],"'The power of team work, it has got us through this pandemic. Continue to work as teams, and look after each other as teams.' @CNOEngland #qni2021",the power of team work it has got us through this pandemic continue to work as teams and look after each other as teams  ,power team work continue team look team
1.4487141166344028e+18,2021-10-14 18:15:35+00:00,['1448714116634402819'],'This winter is going to be tough. Looking after yourself and looking after your colleagues is hugely important.' @CNOEngland #qni2021,this winter is going to be tough looking after yourself and looking after your colleagues is hugely important  ,winter colleague
1.448712943554769e+18,2021-10-14 18:10:56+00:00,['1448712943554768902'],'Thank you to the nurses in social care and community care that provided me with the opportunity to say goodbye to my mother in law who passed away in January this year. She was a wonderful lady.' @CNOEngland #qni2021,thank you to the nurses in social care and community care that provided me with the opportunity to say goodbye to my mother in law who passed away in january this year she was a wonderful lady  ,thank nurse care community care opportunity goodbye mother law january year lady
1.4487122553240166e+18,2021-10-14 18:08:12+00:00,['1448712255324016643'],"'I'm very proud to be a nurse. I'm not just a nurse, I'm a very proud nurse.' @CNOEngland #qni2021 https://t.co/dYIeSfopm2",im very proud to be a nurse i'm not just a nurse i'm a very proud nurse   ,nurse
1.4487119538331566e+18,2021-10-14 18:07:00+00:00,['1448711953833156614'],"'I'm only 9 days into the role but I'm very much looking forward to working with my colleagues in the UK. Nursing is a global profession, we need to share and learn from each other and create opportunities for nurses to flourish.' @profalexmcmahon #qni2021",im only days into the role but i'm very much looking forward to working with my colleagues in the uk nursing is a global profession we need to share and learn from each other and create opportunities for nurses to flourish  ,day role colleague nursing profession share learn opportunity nurse
1.4487115417890202e+18,2021-10-14 18:05:21+00:00,['1448711541789020165'],@profalexmcmahon the new Interim Chief Nursing Officer for Scotland. 'Tackling child poverty is a nursing opportunity. #qni2021 https://t.co/NpxOuHTQRm, the new interim chief nursing officer for scotland tackling child poverty is a nursing opportunity  ,nursing officer scotland poverty nursing opportunity
1.4487101300575887e+18,2021-10-14 17:59:45+00:00,['1448710130057588742'],"'I feel very excited for a new narrative for social care nursing, we have a very exciting time ahead.' @sturdy_deborah #qni2021",i feel very excited for a new narrative for social care nursing we have a very exciting time ahead  ,narrative care time
1.4487098860287508e+18,2021-10-14 17:58:47+00:00,['1448709886028750856'],'Why wouldn't you want to work in social care? When you can be autonomous in your practice.' @sturdy_deborah #qni2021,why wouldn't you want to work in social care when you can be autonomous in your practice  ,care practice
1.4487092487964795e+18,2021-10-14 17:56:15+00:00,['1448709248796479494'],'We have to think about our next generation of leaders in all sorts of levels. How can we get those social care nurses at the table?' @sturdy_deborah #qni2021,we have to think about our next generation of leaders in all sorts of levels how can we get those social care nurses at the table  ,generation leader sort level care nurse table
1.4487082998309888e+18,2021-10-14 17:52:29+00:00,['1448708299830988803'],"'One of the positive things in terms of #covid and moving forward, is the work I've seen of district nurses and community nurses supporting colleagues in social care. It's brought about some fantastic relationships that I know will work into the future.' @sturdy_deborah #qni2021",one of the positive things in terms of  and moving forward is the work i've seen of district nurses and community nurses supporting colleagues in social care it's brought about some fantastic relationships that i know will work into the future  ,thing term work district nurse community nurse colleague care relationship future
1.448707812956287e+18,2021-10-14 17:50:32+00:00,['1448707812956286982'],@sturdy_deborah speaking at #qni2021 'Social care nursing is not for the faint-hearted.' https://t.co/KKQTWDN41x, speaking at  social care nursing is not for the fainthearted ,speaking care nursing
1.4487068789435023e+18,2021-10-14 17:46:50+00:00,['1448706878943502341'],"'I want to thank all of our nurses working in the community. I know how hard you have worked. I have been overwhelmed by what I've seen nurses do during this pandemic, the commitment and professionalism is second to none.' @charlottemcardl #qni2021",i want to thank all of our nurses working in the community i know how hard you have worked i have been overwhelmed by what i've seen nurses do during this pandemic the commitment and professionalism is second to none  ,nurse community nurse commitment professionalism none
1.4487062464969974e+18,2021-10-14 17:44:19+00:00,['1448706246496997377'],'As nurses we have a significant role in building back fairer. That must be our collective ambition' @charlottemcardl #qni2021,as nurses we have a significant role in building back fairer that must be our collective ambition  ,nurse role fairer ambition
1.4487052836777288e+18,2021-10-14 17:40:29+00:00,['1448705283677728771'],The report from Northern Ireland: Nurses for Health Equity @charlottemcardl #qni2021 https://t.co/WH36S3JUBk https://t.co/vIcOVqxN0T,the report from northern ireland nurses for health equity    ,report ireland nurse health equity
1.4487046589528842e+18,2021-10-14 17:38:00+00:00,['1448704658952884232'],@charlottemcardl How Northern Ireland is building back fairer with 3 themes #qni2021 https://t.co/bYdr99itF1, how northern ireland is building back fairer with themes  ,ireland fairer theme
1.448704371341017e+18,2021-10-14 17:36:52+00:00,['1448704371341017095'],"Good evening from Northern Ireland @charlottemcardl #qni2021 'It's clear that the pandemic is amplifying inequalities in the world, including Northern Ireland. Reducing inequalities in health is a huge challenge.' https://t.co/4gy0jZAxXz",good evening from northern ireland   its clear that the pandemic is amplifying inequalities in the world including northern ireland reducing inequalities in health is a huge challenge ,evening ireland pandemic inequality world ireland inequality health challenge
1.448703473957081e+18,2021-10-14 17:33:18+00:00,['1448703473957081095'],"'A massive thank you, I look forward to working with our community nurses, to support you to deliver outstanding service for the people of #Wales. I need to hear you and listen to you. Diolch for everything you do.' @suenaidoo73 #qni2021",a massive thank you i look forward to working with our community nurses to support you to deliver outstanding service for the people of  i need to hear you and listen to you diolch for everything you do  ,thank community service people everything
1.4487030498752143e+18,2021-10-14 17:31:37+00:00,['1448703049875214350'],"'Workforce continues to be a priority. We've maintained the bursary but there is more to do. We've increased the funding for our pre-reg funding, for education in training. It's a record level of funding and it's right that we continue to fund the services.' #qni2021 @suenaidoo73",workforce continues to be a priority we've maintained the bursary but there is more to do we've increased the funding for our prereg funding for education in training it's a record level of funding and it's right that we continue to fund the services  ,workforce priority funding prereg funding education record level funding service
1.4487016568839455e+18,2021-10-14 17:26:05+00:00,['1448701656883945472'],'We have put in mental health support for our staff in and students in Wales and we have had quite a lot of people take up that service which I am delighted they are doing.' @suenaidoo73 #qni2021,we have put in mental health support for our staff in and students in wales and we have had quite a lot of people take up that service which i am delighted they are doing  ,health support staff student wale lot people service
1.4487009311602934e+18,2021-10-14 17:23:12+00:00,['1448700931160293378'],"'The frail elderly, those from deprived areas, have felt the impact of this pandemic more so than others, our community nurses in Wales have been delivering care despite the very difficult 18 months. As your CNO I'm so very proud of you for the amazing job you do.' @suenaidoo73",the frail elderly those from deprived areas have felt the impact of this pandemic more so than others our community nurses in wales have been delivering care despite the very difficult months as your cno i'm so very proud of you for the amazing job you do ,frail area impact others community wale care month cno job
1.4487004357627167e+18,2021-10-14 17:21:14+00:00,['1448700435762716678'],"@suenaidoo73 'Thank you for your hard work, meeting the huge challenges of the covid pandemic, a heartfelt thank you and to the teams that support you. The commitment you have shown in delivering care in your communities, is nothing short of outstanding.' #qni2021 https://t.co/a7dpp0OccY", thank you for your hard work meeting the huge challenges of the covid pandemic a heartfelt thank you and to the teams that support you the commitment you have shown in delivering care in your communities is nothing short of outstanding  ,thank work challenge covid heartfelt thank team commitment care community nothing
1.448700083411751e+18,2021-10-14 17:19:50+00:00,['1448700083411750913'],"Jenni Middleton, QNI Trustee, welcoming @suenaidoo73 #qni2021 https://t.co/XT0nfbGM2O",jenni middleton qni trustee welcoming   ,jenni middleton qni trustee
1.448699792922751e+18,2021-10-14 17:18:40+00:00,['1448699792922750977'],"Our next session, 'A Conversation with Chief Nurses of the UK' @suenaidoo73 @charlottemcardl @sturdy_deborah @profalexmcmahon and @CNOEngland #qni2021 https://t.co/jeziu8uOZn",our next session a conversation with chief nurses of the uk     and   ,session conversation nurse
1.448699469659263e+18,2021-10-14 17:17:23+00:00,['1448699469659262981'],Thank you @GeorgePlumptre for your wonderful session this evening #qni2021 @NGSOpenGardens https://t.co/u0C4G12YvQ,thank you  for your wonderful session this evening   ,thank session evening
1.4486989889794376e+18,2021-10-14 17:15:29+00:00,['1448698988979437572'],"'Rather than hero worship, the healthcare systems would most benefit from supportive and innovative scrutiny and radical development, often demonstrated by the QNI which has kept them relevant and efficient.' Thank you @GeorgePlumptre #qni2021",rather than hero worship the healthcare systems would most benefit from supportive and innovative scrutiny and radical development often demonstrated by the qni which has kept them relevant and efficient thank you  ,healthcare system scrutiny development qni thank
1.4486984022592225e+18,2021-10-14 17:13:09+00:00,['1448698402259222528'],"'Nothing would have shortened Judy's decline or her death, but a very small amount of the right care would have improved her final weeks and days.' @GeorgePlumptre recounting his mother in law Judy's very upsetting patient journey #qni2021",nothing would have shortened judy's decline or her death but a very small amount of the right care would have improved her final weeks and days  recounting his mother in law judy's very upsetting patient journey ,nothing decline death amount right care week day mother law patient journey
1.4486964924123177e+18,2021-10-14 17:05:33+00:00,['1448696492412317697'],'#Covid highlighted inequalities in the UK. It hit not only lower socio-economic groups hardest but the economic impact of policies to tackle the virus was borne most heavily by low paid workers least able to work from home.' @GeorgePlumptre #qni2021, highlighted inequalities in the uk it hit not only lower socioeconomic groups hardest but the economic impact of policies to tackle the virus was borne most heavily by low paid workers least able to work from home  ,inequality group impact policy virus worker home
1.448696205769388e+18,2021-10-14 17:04:25+00:00,['1448696205769388032'],'Charities play a leading part in tackling inequality and the burdens of disease and disability.' @GeorgePlumptre #qni2021,charities play a leading part in tackling inequality and the burdens of disease and disability  ,charity part inequality burden disease disability
1.448695174524285e+18,2021-10-14 17:00:19+00:00,['1448695174524284941'],The @NGSOpenGardens report 'Health Charities and the NHS: A Vital Partnership in Peril' can be found here: https://t.co/PPzT9HyM29 #qni2021 @GeorgePlumptre https://t.co/3eZ20sYH5L,the  report health charities and the nhs a vital partnership in peril can be found here    ,report health charity partnership peril
1.448694115391189e+18,2021-10-14 16:56:07+00:00,['1448694115391188994'],"Some examples of the kind of projects for the @NGSOpenGardens Elsie Wagg Scholarship now available, to find out more: https://t.co/khxClxT0OI #qni2021 @GeorgePlumptre https://t.co/eOfJYllWkO",some examples of the kind of projects for the  elsie wagg scholarship now available to find out more    ,example kind project elsie wagg scholarship
1.448692638023045e+18,2021-10-14 16:50:14+00:00,['1448692638023045124'],@GeorgePlumptre The NGS Elsie Wagg Scholarship launched this year with @NGSOpenGardens . The scholarship is open to projects that promote the health benefits of gardening and garden visiting among a group of people. To find out more and to apply: https://t.co/khxClxT0OI #qni2021 https://t.co/yuN5Q7OgmI, the ngs elsie wagg scholarship launched this year with   the scholarship is open to projects that promote the health benefits of gardening and garden visiting among a group of people to find out more and to apply   ,scholarship year scholarship project health benefit gardening garden visiting group people
1.4486911675252244e+18,2021-10-14 16:44:24+00:00,['1448691167525224449'],@GeorgePlumptre speaking at #qni2021 'Health Charities and The NHS: A Vital Partnership in Peril?' https://t.co/MgtumUGMnB, speaking at  health charities and the nhs a vital partnership in peril ,speaking health charity partnership peril
1.448690261211689e+18,2021-10-14 16:40:48+00:00,['1448690261211688973'],"@CrystalOldman 'It was a privilege for me to have known Ursula. Her teaching. her values, her legacy will live on with all of us. She has taught us all so much. She was a true nursing giant. Thank you Ursula you're gone way too soon, your legacy shines on brightly.' #qni2021 https://t.co/zv5GP1PF0d", it was a privilege for me to have known ursula her teaching her values her legacy will live on with all of us she has taught us all so much she was a true nursing giant thank you ursula you're gone way too soon your legacy shines on brightly  ,privilege value legacy nursing giant thank way legacy shine
1.448689648948101e+18,2021-10-14 16:38:22+00:00,['1448689648948101125'],"@CrystalOldman making a tribute to Professor Ursula Gallagher MBE FQNI, 'Ursula told students to challenge those who told them they were 'just' a nurse. She was a hard act to follow and a trailblazer. She was fabulously supportive as a Fellow of the QNI.' #qni2021 https://t.co/sznUyi9OFO", making a tribute to professor ursula gallagher mbe fqni ursula told students to challenge those who told them they were just a nurse she was a hard act to follow and a trailblazer she was fabulously supportive as a fellow of the qni  ,tribute gallagher mbe fqni ursula student act trailblazer fellow qni
1.448688363335258e+18,2021-10-14 16:33:15+00:00,['1448688363335258118'],"@CrystalOldman 'We want you to all to be re energised by the conference and to return to work with a spring in your step, we all need that right now.' #qni2021 https://t.co/roLuoG2H8l", we want you to all to be re energised by the conference and to return to work with a spring in your step we all need that right now  ,conference spring step
1.4486854274314568e+18,2021-10-14 16:21:35+00:00,['1448685427431456781'],"To watch the amazing animation that the QNI made in collaboration with @Hallam_Medical to celebrate the Year of the Nurse and Midwife, narrated by the wonderful @StephenMcGann from #CallTheMidwife please go to: https://t.co/KmftghFBEf #qni2021",to watch the amazing animation that the qni made in collaboration with  to celebrate the year of the nurse and midwife narrated by the wonderful  from  please go to  ,animation qni collaboration year nurse midwife please
1.448683805930365e+18,2021-10-14 16:15:09+00:00,['1448683805930364932'],"'Since 2019 our clinicians have worked a massive 778,212 hours, they've seen 3.1 million patients: our nurses make a difference and we are here to make a difference to your patients' lives.' @Hallam_Medical #qni2021",since our clinicians have worked a massive hours they've seen million patients our nurses make a difference and we are here to make a difference to your patients lives  ,clinician hour patient nurse difference difference patient
1.4486828306413855e+18,2021-10-14 16:11:16+00:00,['1448682830641385478'],"'We've noticed a change over the last year, we're seeing an increase in demand for school nurses, occupational therapists, dental care nurses and much more, showing that keeping patients in the community is becoming more and more important.' @Hallam_Medical #qni2021",weve noticed a change over the last year we're seeing an increase in demand for school nurses occupational therapists dental care nurses and much more showing that keeping patients in the community is becoming more and more important  ,weve change year increase demand school nurse therapist care nurse patient community
1.4486823608123187e+18,2021-10-14 16:09:24+00:00,['1448682360812318721'],"Our sponsor @Hallam_Medical #qni2021 'At @Hallam_Medical we are not on the front line, however I wholeheartedly believe we are making a difference to the services you work in and the patients you look after.'",our sponsor   at  we are not on the front line however i wholeheartedly believe we are making a difference to the services you work in and the patients you look after,sponsor front line difference service patient
