id,created_at,edit_history_tweet_ids,text,clean_text,nouns
1.4431757015286825e+18,2021-09-29 11:27:54+00:00,['1443175701528682497'],@PippaCrerar It isn't chaotic. The hecklers do themselves no favours, it isn't chaotic the hecklers do themselves no favours,heckler favour
1.443175449790763e+18,2021-09-29 11:26:54+00:00,['1443175449790763010'],@BenKentish It's not doing them any favours., it's not doing them any favours,favour
1.4431734222809743e+18,2021-09-29 11:18:51+00:00,['1443173422280974341'],@lewis_goodall Didnt come across on the feed., didnt come across on the feed,didnt feed
1.4431024551060972e+18,2021-09-29 06:36:51+00:00,['1443102455106097152'],"@kevharrison_ Happy birthday Daniel, have a lovely day 😊😊", happy birthday daniel have a lovely day ,birthday daniel
1.4429614415820595e+18,2021-09-28 21:16:31+00:00,['1442961441582059524'],"@lloydhardy @EmmaPee36347650 Yes,good call. I had forgotten about this!",  yesgood call i had forgotten about this,yesgood call
1.4429415469411492e+18,2021-09-28 19:57:28+00:00,['1442941546941149185'],@ashcowburn @Katynurse27 Tories are loving this.,  tories are loving this,tory
1.4424439130048635e+18,2021-09-27 11:00:02+00:00,['1442443913004863497'],@Cpass12David And what about Boris Johnson?, and what about boris johnson,boris johnson
1.4420936620877005e+18,2021-09-26 11:48:16+00:00,['1442093662087700489'],@DPJHodges Thing is would Andrew Mare ask Johnson this question?, thing is would andrew mare ask johnson this question,thing mare johnson question
1.4420932615946609e+18,2021-09-26 11:46:41+00:00,['1442093261594660870'],"@Mike_Fabricant She is saying the words, you lots carry out the actions. So shush!", she is saying the words you lots carry out the actions so shush,word action
1.442086857647534e+18,2021-09-26 11:21:14+00:00,['1442086857647534080'],"@EmilieLaurenxx loved just listening to you on @cerysmatthews As a Black Country Woman myself, its wonderful to hear my part of the world being celebrated 😊", loved just listening to you on  as a black country woman myself its wonderful to hear my part of the world being celebrated ,country woman part world
1.4419156928365363e+18,2021-09-26 00:01:05+00:00,['1441915692836536324'],We lost our FOM because of fuckers like The Mail. Now look what they are saying...😡 https://t.co/paI37TCDlZ,we lost our fom because of fuckers like the mail now look what they are saying ,fucker mail
1.4419154315777024e+18,2021-09-26 00:00:03+00:00,['1441915431577702402'],"@PickardJE So if immigration rules are relaxed, does that mean we also get our FOM back?", so if immigration rules are relaxed does that mean we also get our fom back,immigration rule mean
1.4418998148626596e+18,2021-09-25 22:57:59+00:00,['1441899814862659586'],@thelorryist @Evanderstap Stay safe Tom,  stay safe tom,stay
1.441898723328598e+18,2021-09-25 22:53:39+00:00,['1441898723328598017'],@PippaCrerar @MirrorGemma Excellent idea,  excellent idea,excellent idea
1.4418813358453842e+18,2021-09-25 21:44:33+00:00,['1441881335845384199'],"@JuliaHB1 We ran out of commonsense 5 years ago, so that's not an issue.", we ran out of commonsense years ago so that's not an issue,commonsense year issue
1.4418799117743145e+18,2021-09-25 21:38:54+00:00,['1441879911774314497'],@OnlyOneTeeta Because there is a shortage of common sense!, because there is a shortage of common sense,shortage sense
1.4417527431531766e+18,2021-09-25 13:13:35+00:00,['1441752743153176576'],@BloombergUK Meanwhile we have lost our Freedom of Movement! You couldn't make it up., meanwhile we have lost our freedom of movement you couldn't make it up,freedom movement
1.4416965500618424e+18,2021-09-25 09:30:17+00:00,['1441696550061842433'],@BorisJohnson What about the shit you are allowing to be pumped into them?, what about the shit you are allowing to be pumped into them,shit
1.441528922525651e+18,2021-09-24 22:24:12+00:00,['1441528922525650944'],"@DehennaDavison Drove from Harlow to Epsom today, every station dry! You are telling untruths! Oh!", drove from harlow to epsom today every station dry you are telling untruths oh,harlow today station
1.4415267637088952e+18,2021-09-24 22:15:37+00:00,['1441526763708895232'],@trussliz @R_Ramirez_O @COP26 Des..per..ate,   desperate,desperate
1.4415265009692467e+18,2021-09-24 22:14:34+00:00,['1441526500969246726'],"@Parsleybear2010 ""Shudder""", shudder,shudder
1.4415259673993134e+18,2021-09-24 22:12:27+00:00,['1441525967399313410'],"@NadineDorries Drove from Harlow to Epsom today, every petrol station dry.", drove from harlow to epsom today every petrol station dry,harlow today petrol station
1.4414979591499448e+18,2021-09-24 20:21:09+00:00,['1441497959149944836'],"@DPJHodges @KateWilton1 Mate in Spain, no shortages. Stop spreading the bullshit",  mate in spain no shortages stop spreading the bullshit,mate spain shortage bullshit
1.4414977142321193e+18,2021-09-24 20:20:11+00:00,['1441497714232119301'],@DPJHodges No brexit crisis? Bullshit!, no brexit crisis bullshit,brexit crisis bullshit
1.441445543104979e+18,2021-09-24 16:52:52+00:00,['1441445543104978945'],@PippaCrerar They were once again depending on the common sense of the Great British Public!, they were once again depending on the common sense of the great british public,sense public
1.4414368789228298e+18,2021-09-24 16:18:27+00:00,['1441436878922829827'],"@SydesJokes @highwayman7611 @GreenRebelUK @deane258 @AndrewKnight226 @ronniecueball @oxfordtractor @y_evison @PhilH0903 @TomJohnson1965 @wildkippers @fionn114 @tonydf @NZidariu @K2020Cat @fionaheather @philipgcreed @Gepetto2309Fbpe @mazzaVmix Thanks Colin, following all. Good to be in touch 😊",                   thanks colin following all good to be in touch ,thanks
1.4414343517120184e+18,2021-09-24 16:08:24+00:00,['1441434351712018436'],@mikegalsworthy @Omz2468 It's all about the optics Mike 🙄,  it's all about the optics mike ,optic
1.4414272269862584e+18,2021-09-24 15:40:05+00:00,['1441427226986258432'],"@Jonathan_MBanks Just driven from Harlow to Epsom, every petrol station now dry.", just driven from harlow to epsom every petrol station now dry,harlow petrol station
1.4414268965042545e+18,2021-09-24 15:38:47+00:00,['1441426896504254472'],"@DPJHodges Have just driven from Harlow to Epsom,every petrol station is now dry!", have just driven from harlow to epsomevery petrol station is now dry,harlow petrol station
1.4412968124768092e+18,2021-09-24 07:01:52+00:00,['1441296812476809219'],@johnredwood Was it @johnredwood who used to write top tips in Viz magazine?, was it  who used to write top tips in viz magazine,magazine
1.4411652850886943e+18,2021-09-23 22:19:14+00:00,['1441165285088694272'],@BloombergUK Fahkin' ell!, fahkin ell,fahkin
1.4411590742765404e+18,2021-09-23 21:54:33+00:00,['1441159074276540427'],@DavidGHFrost Unbelievable tou have the chutzpah to tweet this. Resign., unbelievable tou have the chutzpah to tweet this resign,chutzpah resign
1.441109396340179e+18,2021-09-23 18:37:09+00:00,['1441109396340178951'],@DominicRaab How can you hold yourself as deputy prime minister to account?, how can you hold yourself as deputy prime minister to account,deputy minister
1.4409334122992804e+18,2021-09-23 06:57:51+00:00,['1440933412299280385'],@afneil @GBNEWS No one gets exempted special treatment in the culture wars.,  no one gets exempted special treatment in the culture wars,treatment culture
1.4404459442736415e+18,2021-09-21 22:40:49+00:00,['1440445944273641478'],@BorisJohnson Sycophancy in extremis., sycophancy in extremis,sycophancy extremis
1.4404344897510646e+18,2021-09-21 21:55:18+00:00,['1440434489751064580'],@JMPSimor Huge bullshit from both newspapers, huge bullshit from both newspapers,bullshit newspaper
1.4404092409679217e+18,2021-09-21 20:14:59+00:00,['1440409240967921669'],@PippaCrerar Par for the course. Why the surprise?, par for the course why the surprise,course surprise
1.4402800826442998e+18,2021-09-21 11:41:45+00:00,['1440280082644299780'],"@perpetuallysed @itsalwayswednes Please take care. One day at a time, thinking of you",  please take care one day at a time thinking of you,please care time thinking
1.440080470184661e+18,2021-09-20 22:28:34+00:00,['1440080470184660993'],@trussliz @SecBlinken Making us a desperate poodle/lapdog! Instead of leading the EU. Pathetic,  making us a desperate poodlelapdog instead of leading the eu pathetic,poodlelapdog
1.4400756695772365e+18,2021-09-20 22:09:29+00:00,['1440075669577236482'],"Great sentiment, zero action by Johnson himself. https://t.co/JN8rfe9luP",great sentiment zero action by johnson himself ,sentiment action johnson
1.4400697096599265e+18,2021-09-20 21:45:48+00:00,['1440069709659926536'],"@JohnnyMercerUK Christ Almighty, this is absolutely appalling.", christ almighty this is absolutely appalling,christ almighty
1.4400652206473503e+18,2021-09-20 21:27:58+00:00,['1440065220647350278'],@tradegovuk You tweeted this 11 hours ago and it has 13 likes! Maybe time to give up!, you tweeted this hours ago and it has likes maybe time to give up,hour time
1.440062508337795e+18,2021-09-20 21:17:11+00:00,['1440062508337795073'],@bbclaurak Anyone asked him about the shit in our rivers?, anyone asked him about the shit in our rivers,anyone shit river
1.4400623137262346e+18,2021-09-20 21:16:25+00:00,['1440062313726234633'],@AwTroon @Wulf_Helm 🤣🤣you win. Have run out of bread puns!,  you win have run out of bread puns,bread
1.4400619777373266e+18,2021-09-20 21:15:05+00:00,['1440061977737326592'],Worth a watch. Martin Lewis explains how to try and manage payments during the UK energy crisis. https://t.co/iYW3rzn7NM,worth a watch martin lewis explains how to try and manage payments during the uk energy crisis ,watch martin lewis payment energy crisis
1.4400589625025577e+18,2021-09-20 21:03:06+00:00,['1440058962502557704'],@SandraDunn1955 @VesperUK @WinstonCProject @Twitter @TwitterSupport Good call. Not seen it active in a while.,     good call not seen it active in a while,call
1.4400566883257098e+18,2021-09-20 20:54:04+00:00,['1440056688325709827'],"@AwTroon @Wulf_Helm Nah,too much bread man!",  nahtoo much bread man,bread
1.4400562480286474e+18,2021-09-20 20:52:19+00:00,['1440056248028647434'],@Wulf_Helm @catherinemginn I am going as my alter ego The Plundering Pirate Queen of the Tempestuous Oceans! https://t.co/F88uVzMPr0,  i am going as my alter ego the plundering pirate queen of the tempestuous oceans ,alter plundering pirate queen ocean
1.4400423546903142e+18,2021-09-20 19:57:06+00:00,['1440042354690314248'],@MoJGovUK @DominicRaab @kitmalthouse @jc4southsuffolk @VotePursglove @DXWQC Pursglove is with the Home Office Team as well. Why so?,      pursglove is with the home office team as well why so,pursglove home office team
1.4399341229028884e+18,2021-09-20 12:47:02+00:00,['1439934122902888450'],"@MrJohnNicolson @CommonsDCMS So, hope you are going to ask those Brexit questions then John!",  so hope you are going to ask those brexit questions then john,hope question
1.4398387511323566e+18,2021-09-20 06:28:03+00:00,['1439838751132356613'],@GarySmithRSA @smokinjoe8487 @deehinja @JuliaHB1 Bleaching!https://t.co/ioUSB3QcCi,    bleaching,bleaching
1.4396018083898532e+18,2021-09-19 14:46:32+00:00,['1439601808389853193'],@Indra68 @SydesJokes @iampetmutton @replarc @jaxyw @Michael57229696 @SimonDolbyKent @lurucinali @gina_fbpe @PhilPinfold @bunnyman48 @localdad1 @Keith22Jelley @VesperUK @Janinem90485041 @Jez_Horrox @PaulBin28497928 @harrietpoland2 @londongus @leegorman35 I have done that and repeat the process regularly. Just a waiting game now.,                    i have done that and repeat the process regularly just a waiting game now,process game
1.4395988129690214e+18,2021-09-19 14:34:38+00:00,['1439598812969021445'],Can you help Joe out and sign his petition please. https://t.co/UTjVfmkXQV,can you help joe out and sign his petition please ,petition please
1.439597937483473e+18,2021-09-19 14:31:09+00:00,['1439597937483472897'],"@SydesJokes @iampetmutton @replarc @jaxyw @Michael57229696 @SimonDolbyKent @lurucinali @gina_fbpe @PhilPinfold @bunnyman48 @localdad1 @Keith22Jelley @VesperUK @Janinem90485041 @Jez_Horrox @PaulBin28497928 @harrietpoland2 @londongus @leegorman35 Thanks Colin, I am stuck at 5000 and unable to follow. Apologies everyone.",                   thanks colin i am stuck at and unable to follow apologies everyone,thanks apology everyone
1.4395563365519606e+18,2021-09-19 11:45:50+00:00,['1439556336551960579'],@BrianRo60569092 @GersoiseMaggie That was an excellent series.,  that was an excellent series,series
1.4395538255227372e+18,2021-09-19 11:35:52+00:00,['1439553825522737157'],"@jane_mclenachan @cerysmatthews @BBC6Music We stayed there for 7 days, such a great place. So much music, everywhere, all the time!!",   we stayed there for days such a great place so much music everywhere all the time,place music time
1.4395485778738668e+18,2021-09-19 11:15:01+00:00,['1439548577873866752'],"Thanks Tom, such an interesting read. Thank you for all you do. Stay safe. https://t.co/xYQL8F66mI",thanks tom such an interesting read thank you for all you do stay safe ,thanks read thank
1.4395457029679145e+18,2021-09-19 11:03:35+00:00,['1439545702967914500'],"Why do politicians say they write these word salad pieces, when it's probably some young intern who has written it? https://t.co/A2La1TnTI3",why do politicians say they write these word salad pieces when it's probably some young intern who has written it ,politician word salad piece intern
1.4395440142026056e+18,2021-09-19 10:56:53+00:00,['1439544014202605570'],@ingridoliver100 @HelenSalmon2 Same in Gregg's at Toddington Services yesterday!!!,  same in gregg's at toddington services yesterday,toddington service yesterday
1.4395432183837655e+18,2021-09-19 10:53:43+00:00,['1439543218383765509'],"@cerysmatthews @BBC6Music Hi @cerysmatthews we were in Cuba in Dec 2019. We stayed in a casa de familia in Trinidad. Next door was a restaurant and when we sat on our roof, the amazing sounds from the band that played on their roof would drift across and we would just have to dance. Sue and Rob.",  hi  we were in cuba in dec we stayed in a casa de familia in trinidad next door was a restaurant and when we sat on our roof the amazing sounds from the band that played on their roof would drift across and we would just have to dance sue and rob,cuba casa trinidad door restaurant roof sound band roof
1.4389282261438996e+18,2021-09-17 18:09:57+00:00,['1438928226143899651'],Twat https://t.co/zHi5sRDhwi,twat ,twat
1.4389095987533332e+18,2021-09-17 16:55:56+00:00,['1438909598753333248'],@YouGov That's bollocks, that's bollocks,bollock
1.4389001276540887e+18,2021-09-17 16:18:18+00:00,['1438900127654088708'],"@Jacob_Rees_Mogg @HelenSalmon2 Well you have fucked that up Jakey Boy! By the way, were is ""cheaper food, clothes and footwear"" you kept banging on about? Or is that in 50 years time too!",  well you have fucked that up jakey boy by the way were is cheaper food clothes and footwear you kept banging on about or is that in years time too,jakey food clothes year time
1.4388617078672712e+18,2021-09-17 13:45:38+00:00,['1438861707867271190'],@educationgovuk @alexburghart @willquince And what do they know about education then?,   and what do they know about education then,education
1.4388603971221463e+18,2021-09-17 13:40:26+00:00,['1438860397122146305'],Great news that Braemar has been appointed. One in the eye for Tory cancel culture. https://t.co/8JUvabyhDG,great news that braemar has been appointed one in the eye for tory cancel culture ,news braemar culture
1.438634358391427e+18,2021-09-16 22:42:14+00:00,['1438634358391427077'],@BHheadlines @SkyNews How does that work then?,  how does that work then,work
1.438628929103929e+18,2021-09-16 22:20:39+00:00,['1438628929103929347'],@nicktolhurst Agree. But how will the uneducated deal with it?, agree but how will the uneducated deal with it,agree deal
1.4386269690973143e+18,2021-09-16 22:12:52+00:00,['1438626969097314304'],@Daria_QT @tomhfh Dont forget a yard of ale.,  dont forget a yard of ale,dont yard
1.438626431777624e+18,2021-09-16 22:10:44+00:00,['1438626431777624068'],@GBNEWS Used to think @SimonMcCoyTV was great on the Beeb. He has lost it., used to think  was great on the beeb he has lost it,beeb
1.4386249960631624e+18,2021-09-16 22:05:02+00:00,['1438624996063162372'],@PaddyBriggs @PaoliMichele I am so fucking bored of this culture war bollocks.,  i am so fucking bored of this culture war bollocks,bored culture bollock
1.4386221312066929e+18,2021-09-16 21:53:39+00:00,['1438622131206692869'],@grantshapps Is that really a BREXIT freesom? 🙄, is that really a brexit freesom ,brexit freesom
1.438598706215936e+18,2021-09-16 20:20:34+00:00,['1438598706215936004'],@BlokeOnWheels It's all culture war bollocks Joe.i am 57 and was a child of 3 or 4 when metric came in. Never used them. Its ridiculous., it's all culture war bollocks joei am and was a child of or when metric came in never used them its ridiculous,culture bollock child
1.438598437285638e+18,2021-09-16 20:19:29+00:00,['1438598437285638148'],@educationgovuk You gonna teach them imperial weights and measures?, you gonna teach them imperial weights and measures,weight measure
1.4385980523574968e+18,2021-09-16 20:17:58+00:00,['1438598052357496834'],@Ferretgrove Johnson doesnt have a clue. Its culture war bollocks., johnson doesnt have a clue its culture war bollocks,johnson doesnt clue culture bollock
1.438596100311724e+18,2021-09-16 20:10:12+00:00,['1438596100311724034'],@debra_fbpr I think in your 80s. But even my mum and dad dont reckon in imperial anymore. It's just bollocks. They are just winding the country up and I so fucking bored of it., i think in your but even my mum and dad dont reckon in imperial anymore it's just bollocks they are just winding the country up and i so fucking bored of it,dont reckon bollock country bored
1.4385762926522573e+18,2021-09-16 18:51:30+00:00,['1438576292652257282'],@JamesHarrisNow @thetimes Err 70 and above. I am 57 and no idea.,  err and above i am and no idea,idea
1.4385677271914455e+18,2021-09-16 18:17:28+00:00,['1438567727191445505'],Beyond pathetic. Can all of this bullshit stop now please. I want peace and quiet. https://t.co/L9wDn3ImhT,beyond pathetic can all of this bullshit stop now please i want peace and quiet ,stop peace
1.4385444277069865e+18,2021-09-16 16:44:53+00:00,['1438544427706986508'],"@DavidLammy @DominicRaab Go anyway. What's he gonna do, arrest you? He is a twat of the highest order",  go anyway what's he gonna do arrest you he is a twat of the highest order,twat order
1.438521972963504e+18,2021-09-16 15:15:39+00:00,['1438521972963504137'],@pjsmith149 @Harryb22 @SocialistPlus Hence The Belt Road initiative. Those countries will always be in Cina's debt.,   hence the belt road initiative those countries will always be in cina's debt,belt road country debt
1.4384031264873964e+18,2021-09-16 07:23:24+00:00,['1438403126487396356'],Thank goodness younger generations are leaving terrestrial TV behind. https://t.co/fmKMDi7txe,thank goodness younger generations are leaving terrestrial tv behind ,thank goodness generation
1.4384018988984156e+18,2021-09-16 07:18:31+00:00,['1438401898898415617'],"Sorry everyone stuck at 5000. Had a clear out, burnout enough to balance ratios.",sorry everyone stuck at had a clear out burnout enough to balance ratios,sorry everyone ratio
1.438400603361882e+18,2021-09-16 07:13:22+00:00,['1438400603361882113'],@SydesJokes Thank you Colin 😊😊, thank you colin ,thank
1.4382089597065052e+18,2021-09-15 18:31:51+00:00,['1438208959706505221'],@BlokeOnWheels He needs someone who can play the idiot card and distract from him., he needs someone who can play the idiot card and distract from him,someone card distract
1.4381448350856438e+18,2021-09-15 14:17:02+00:00,['1438144835085643778'],@RobertJenrick @mhclg Do you have to return the flag?,  do you have to return the flag,flag
1.4380405999160689e+18,2021-09-15 07:22:51+00:00,['1438040599916068865'],WARNING: Do NOT moisturise without specs on and when your moisturiser is next to the Head and Shoulders!,warning do not moisturise without specs on and when your moisturiser is next to the head and shoulders,spec moisturiser head shoulder
1.4380391763777372e+18,2021-09-15 07:17:11+00:00,['1438039176377737221'],"@FabianZuleeg @TerryReintke You knew and we knew, that was always complete bollocks.",  you knew and we knew that was always complete bollocks,bollock
1.438038694485713e+18,2021-09-15 07:15:16+00:00,['1438038694485712896'],"@Beany_1 ""Cheaper food, clothes and footwear""", cheaper food clothes and footwear,food clothes
1.4379079070483497e+18,2021-09-14 22:35:34+00:00,['1437907907048349697'],@BarbaRidhi @nigel_revell @taru_sisko I now want a bowl! Yum!,   i now want a bowl yum,bowl
1.4377582240365036e+18,2021-09-14 12:40:47+00:00,['1437758224036503555'],@ukhomeoffice *piece, piece,piece
1.4377581412240794e+18,2021-09-14 12:40:27+00:00,['1437758141224079363'],@ukhomeoffice How much did that puff price of video cost us?, how much did that puff price of video cost us,puff price video cost
1.4377558129869005e+18,2021-09-14 12:31:12+00:00,['1437755812986900480'],@radishroot2002 @Elizabe98990443 Straight from the Dig for Victory recipe book!,  straight from the dig for victory recipe book,straight victory recipe book
1.437754983403991e+18,2021-09-14 12:27:54+00:00,['1437754983403991042'],@RishiSunak WTAF is this? How much did it cost us? What does it mean?, wtaf is this how much did it cost us what does it mean,wtaf
1.4377329159584604e+18,2021-09-14 11:00:13+00:00,['1437732915958460420'],"Closes at 23.45 tonight, please complete and retweet. https://t.co/qf6Bmd2b6G",closes at tonight please complete and retweet ,close please retweet
1.4377266086815785e+18,2021-09-14 10:35:09+00:00,['1437726608681578496'],Imagine all the crap that could be coming through! https://t.co/S7ich3frmG,imagine all the crap that could be coming through ,imagine crap
1.4375255191809638e+18,2021-09-13 21:16:06+00:00,['1437525519180963852'],@JolyonMaugham The 'cruel face of the northerner!' @michaelgove really? Any comment?, the cruel face of the northerner  really any comment,face northerner comment
1.437493865188102e+18,2021-09-13 19:10:19+00:00,['1437493865188102147'],@BlokeOnWheels What was on @BlokeOnWheels? Missed it as delivering leaflets for the Lab Party!, what was on  missed it as delivering leaflets for the lab party,leaflet party
1.437298959299629e+18,2021-09-13 06:15:50+00:00,['1437298959299629056'],@lloydhardy @jenny_kwest @BorisJohnson Just reported 4 fake accounts.,   just reported fake accounts,account
1.4370302846843003e+18,2021-09-12 12:28:13+00:00,['1437030284684300292'],@SydesJokes @HogneFlat @DiggerDownes @BrexitRage @SrobertsrSimon @hughie_go @MattAntiBrexit @tig_james @DixieRose100 @jaxhampton @davie5456 @Beany_1 @AilsaYouil @PaulDuffy1192 @FbpePiste @douglian @AlisonKMurray @lindat191 @timolarch Thank you Colin. Hi everyone all followed 😊,                   thank you colin hi everyone all followed ,thank everyone
1.4364599980501975e+18,2021-09-10 22:42:06+00:00,['1436459998050197505'],Please sign https://t.co/tRa8rbnP7m,please sign ,sign
1.4362155421473915e+18,2021-09-10 06:30:43+00:00,['1436215542147391490'],"@MatthewStadlen @StoneMunki But its OK, because the new Tory Electoral Bill will mean many of them will become disenfranchised and wont vote.",  but its ok because the new tory electoral bill will mean many of them will become disenfranchised and wont vote,bill vote
1.4360316228733297e+18,2021-09-09 18:19:53+00:00,['1436031622873329672'],@taylordauthor Can you post the link? I am an open water swimmer and wouldlike to share., can you post the link i am an open water swimmer and wouldlike to share,link water swimmer wouldlike share
1.4360083752638382e+18,2021-09-09 16:47:31+00:00,['1436008375263838210'],"@Femi_Sorry @_artesean Dont worry Femi, we don't take any notice of this shit. It's just click bait crap.",  dont worry femi we don't take any notice of this shit it's just click bait crap,dont worry femi notice bait crap
1.4359580376053473e+18,2021-09-09 13:27:29+00:00,['1435958037605347330'],@FranceintheUK Quite right too. I am so sorry you have to deal with out hopeless government. Thanks for pushing back., quite right too i am so sorry you have to deal with out hopeless government thanks for pushing back,government thanks
1.4359004124319007e+18,2021-09-09 09:38:30+00:00,['1435900412431900672'],@IanThom01 @BlueGaynor Her rid of the ridiculous internal market and millions could be saved on admin costs.,  her rid of the ridiculous internal market and millions could be saved on admin costs,market million admin cost
1.4359001925538447e+18,2021-09-09 09:37:38+00:00,['1435900192553844740'],@IanThom01 @BlueGaynor Wow! Indolent and entitled. And on what evidence do you base such judgement?,  wow indolent and entitled and on what evidence do you base such judgement,indolent evidence judgement
1.4358944892441108e+18,2021-09-09 09:14:58+00:00,['1435894489244110857'],@gnrsmiffies @DrJamieFryer @jamie_wallis @DrNeenaJha Blimey! You really have gone down the rabbit hole of nonsense watching this crap.,    blimey you really have gone down the rabbit hole of nonsense watching this crap,blimey rabbit hole crap
1.435894186172158e+18,2021-09-09 09:13:46+00:00,['1435894186172157952'],@gnrsmiffies @DrJamieFryer @jamie_wallis @DrNeenaJha Hyponatremia is low sodium.,    hyponatremia is low sodium,hyponatremia sodium
1.435870379164291e+18,2021-09-09 07:39:10+00:00,['1435870379164291078'],"@Andrew_Adonis A 'reasonable' tax rise? This puts some young adults also paying their Uni tax, on 42% ! How is that reasonable? Plus it hammers the poorest. You have got this wrong.", a reasonable tax rise this puts some young adults also paying their uni tax on  how is that reasonable plus it hammers the poorest you have got this wrong,rise adult
