id,created_at,edit_history_tweet_ids,text,clean_text,nouns
1.4070866604839444e+18,2021-06-21 21:22:56+00:00,['1407086660483944461'],@joelymack Amazing Jo. So many positive vibes to you, amazing jo so many positive vibes to you,vibe
1.4070507174085018e+18,2021-06-21 19:00:07+00:00,['1407050717408501770'],@Ferretgrove It's like being in Cuba!, it's like being in cuba,cuba
1.40704522111701e+18,2021-06-21 18:38:17+00:00,['1407045221117009921'],"@SamanthaMalin Absolutely 100%. Lived in Singapore in the 90s. The Straits Times loved to criticise the UK, the youngsters loved the UK music, theatre and arts scene. Our govt really are very stupid.", absolutely lived in singapore in the the straits times loved to criticise the uk the youngsters loved the uk music theatre and arts scene our govt really are very stupid,singapore strait time youngster music theatre govt
1.407044334407594e+18,2021-06-21 18:34:45+00:00,['1407044334407593993'],First time I have been made aware of this! Good luck @allthecitizens https://t.co/ha75ICZ9oU,first time i have been made aware of this good luck  ,time luck
1.406958537578799e+18,2021-06-21 12:53:50+00:00,['1406958537578799111'],@TomTugendhat Will The Tories follow suit?, will the tories follow suit,tory suit
1.4069545508005724e+18,2021-06-21 12:37:59+00:00,['1406954550800572418'],@ian_hardacre @Keir_Starmer That ship has sailed. This is about removing protections from British industry in the name of free trade. Its madness and will result in the collapse of industry that provides skilled and well paid jobs. Why would any Govt do that to it's citizens?,  that ship has sailed this is about removing protections from british industry in the name of free trade its madness and will result in the collapse of industry that provides skilled and well paid jobs why would any govt do that to it's citizens,ship protection industry name trade madness collapse industry citizen
1.4067570824649892e+18,2021-06-20 23:33:19+00:00,['1406757082464989186'],"Excellent, insightful and incredibly moving. Whantbthe @BBC does best. https://t.co/wzzRje0vd6",excellent insightful and incredibly moving whantbthe  does best ,insightful
1.4067548257029734e+18,2021-06-20 23:24:21+00:00,['1406754825702973453'],Just peeped @GBeebies ..oh dear....,just peeped  oh dear,dear
1.406626218972156e+18,2021-06-20 14:53:19+00:00,['1406626218972155904'],@DehennaDavison @GBNEWS @Nigel_Farage Wow! Farridge! Fancy hooking your horse to that wagon!,   wow farridge fancy hooking your horse to that wagon,farridge horse wagon
1.4062766785659617e+18,2021-06-19 15:44:22+00:00,['1406276678565961731'],Hell YES! https://t.co/EcHOLHi2sl,hell yes ,hell
1.4062750526020155e+18,2021-06-19 15:37:54+00:00,['1406275052602015744'],@Zeus_The_Slayer @MaxLoTweets @grother_leon @carol_casey1 @Gonzo991 @OliveMccully @paulnaisbitt_dk @richpwd Good afternoon @Zeus_The_Slayer lovely to hear from you. Hope yours is purrrfect too 😊,        good afternoon  lovely to hear from you hope yours is purrrfect too ,afternoon
1.4062742284003082e+18,2021-06-19 15:34:38+00:00,['1406274228400308229'],More power grabbing from The Bloviator. https://t.co/rxbvDniQOD,more power grabbing from the bloviator ,power grabbing bloviator
1.4062608213621965e+18,2021-06-19 14:41:21+00:00,['1406260821362196490'],@DavidGHFrost Irony is dead!, irony is dead,irony
1.406260700205486e+18,2021-06-19 14:40:52+00:00,['1406260700205486081'],FFS! So now he needs someone to search for the opportunities! https://t.co/J0oXQKeekI,ffs so now he needs someone to search for the opportunities ,someone opportunity
1.406259617009705e+18,2021-06-19 14:36:34+00:00,['1406259617009704965'],@SydesJokes @daisyduck1954 @JohnTonks @LloydGlyn @Stevemasterson8 @BarbLarder @Dawn83903655 @DarrenCaudle @Paul68958640 @NichStarling @InterSol32 @Dcdefiant1 @chillie31512 @griffins1331 @Keith22Jelley @DentTom666 @John_Lytham @_wbstewart Good afternoon All. Sorry for the delay in following have be a bit busy! Let's boot these feckin gits out!,                  good afternoon all sorry for the delay in following have be a bit busy let's boot these feckin gits out,afternoon sorry delay boot
1.4051839366497403e+18,2021-06-16 15:22:12+00:00,['1405183936649740297'],@MMcminty It's also worrying that Raab seems to be the most competent person in the room🙄, it's also worrying that raab seems to be the most competent person in the room,raab person room
1.4051753863931535e+18,2021-06-16 14:48:13+00:00,['1405175386393153541'],Fucking Hell! This is desperate. https://t.co/l8m8WMyeWN,fucking hell this is desperate ,hell
1.4051714503660175e+18,2021-06-16 14:32:35+00:00,['1405171450366017545'],@CarolineLucas what can we do to put pressure on the Government to prevent this? This needs so much publicity #AustraliaTradeDeal https://t.co/J5QaxdYJRL, what can we do to put pressure on the government to prevent this this needs so much publicity  ,pressure government publicity
1.405170342948225e+18,2021-06-16 14:28:11+00:00,['1405170342948225031'],@BorisJohnson You created the atmosphere which led to her murder. Shut it., you created the atmosphere which led to her murder shut it,atmosphere murder shut
1.4051678870782853e+18,2021-06-16 14:18:25+00:00,['1405167887078285322'],Super depressing and as I thought. https://t.co/J5QaxdYJRL,super depressing and as i thought ,depressing
1.405122519934423e+18,2021-06-16 11:18:09+00:00,['1405122519934423042'],@Kevin_Maguire @GMB My first comments when I heard. Totally right.,  my first comments when i heard totally right,comment
1.4051071411832218e+18,2021-06-16 10:17:02+00:00,['1405107141183221761'],RIP Jo. A real and terrible tragedy 💔 https://t.co/wdqCzUt74b,rip jo a real and terrible tragedy  ,tragedy
1.4051009580870085e+18,2021-06-16 09:52:28+00:00,['1405100958087008262'],@DPJHodges Fits in with your new mates Erdogan and Orban. Well.done., fits in with your new mates erdogan and orban welldone,mate welldone
1.4051007923826893e+18,2021-06-16 09:51:49+00:00,['1405100792382689282'],@johnredwood Fits in with the views of new Tory mates Erdogan and Orban. Well done, fits in with the views of new tory mates erdogan and orban well done,view tory mate
1.404905619728044e+18,2021-06-15 20:56:16+00:00,['1404905619728044033'],Good work Ros https://t.co/oCxmz7pmRZ,good work ros ,work
1.4048488308735836e+18,2021-06-15 17:10:36+00:00,['1404848830873583620'],@montie @GBNEWS What a terrible twisted view of the world you have.,  what a terrible twisted view of the world you have,view world
1.404783915181777e+18,2021-06-15 12:52:39+00:00,['1404783915181776900'],"@trussliz You are destroying our farming as you have destroyed fisheries. You are also destroying the climate with this ridiculous deal. Distance = omissions! Christ Almighty, I detest you both.", you are destroying our farming as you have destroyed fisheries you are also destroying the climate with this ridiculous deal distance  omissions christ almighty i detest you both,farming fishery climate deal distance omission detest
1.404783202229801e+18,2021-06-15 12:49:49+00:00,['1404783202229800963'],Feeling really down. Can't imagine how our farmers feel. This will also massively impact on our countryside. How do @BorisJohnson and @trussliz live with themselves! https://t.co/4igDeQHmVa,feeling really down can't imagine how our farmers feel this will also massively impact on our countryside how do  and  live with themselves ,farmer impact countryside
1.4047464968771584e+18,2021-06-15 10:23:58+00:00,['1404746496877158402'],@MRJKilcoyne @SebastianEPayne Where do you get this data from about what the British people want? Am unaware of any polling!,  where do you get this data from about what the british people want am unaware of any polling,data people polling
1.404743037973115e+18,2021-06-15 10:10:13+00:00,['1404743037973114882'],@Kevin_Maguire @nicholaswatt @metpoliceuk Disturbing to watch..such a nice guy and a good reporter.,   disturbing to watchsuch a nice guy and a good reporter,reporter
1.4047424039915192e+18,2021-06-15 10:07:42+00:00,['1404742403991519232'],@BorisJohnson @ScottMorrisonMP @tradegovuk @trussliz @DanTehanWannon Desperate,     desperate,desperate
1.4047419092733215e+18,2021-06-15 10:05:44+00:00,['1404741909273321473'],Great stuff! Thank you Colin 😊 https://t.co/XA9jSR3Aun,great stuff thank you colin  ,stuff thank
1.4045197158721536e+18,2021-06-14 19:22:49+00:00,['1404519715872153602'],Bloody Hell! This is some serious shit! https://t.co/bwNur1K3wu,bloody hell this is some serious shit ,bloody hell shit
1.4045192168463442e+18,2021-06-14 19:20:50+00:00,['1404519216846344196'],@UB5simon Feckin about time!, feckin about time,feckin time
1.4045014144082289e+18,2021-06-14 18:10:06+00:00,['1404501414408228878'],@DPJHodges Stopping flights incoming from India would have been hugely helpful!, stopping flights incoming from india would have been hugely helpful,flight india
1.4045001718331556e+18,2021-06-14 18:05:09+00:00,['1404500171833155595'],@BorisJohnson It's your fault you massive buffoon., it's your fault you massive buffoon,fault buffoon
1.4044925969661993e+18,2021-06-14 17:35:03+00:00,['1404492596966199296'],@MMcminty Spot on! I couldn't put my finger on it! That's who he reminds me of! Will never unsee it now!, spot on i couldn't put my finger on it that's who he reminds me of will never unsee it now,spot finger
1.4044904809524306e+18,2021-06-14 17:26:39+00:00,['1404490480952430597'],Well done. No more Mr Nice Guy please Mr Speaker. https://t.co/2vAZCejbbL,well done no more mr nice guy please mr speaker ,please speaker
1.4044893789494843e+18,2021-06-14 17:22:16+00:00,['1404489378949484548'],How the actual feck will social distancing be enforced at a wedding?,how the actual feck will social distancing be enforced at a wedding,feck distancing wedding
1.4044425479221166e+18,2021-06-14 14:16:11+00:00,['1404442547922116612'],@AngelaRayner @MarcusRashford @sterling7 Well said. Patel is gross for saying this.,   well said patel is gross for saying this,patel
1.4044415137786266e+18,2021-06-14 14:12:04+00:00,['1404441513778626562'],WTAF? https://t.co/X333sxooar,wtaf ,wtaf
1.4044224602426e+18,2021-06-14 12:56:22+00:00,['1404422460242599944'],@BBCPolitics Any plans to post what Martin Lewis said, any plans to post what martin lewis said,plan martin lewis
1.4044216695156367e+18,2021-06-14 12:53:13+00:00,['1404421669515636744'],@goodclimate He had to vote for it to avoid a No Deal., he had to vote for it to avoid a no deal,deal
1.4043665185619476e+18,2021-06-14 09:14:04+00:00,['1404366518561947649'],Very insightful summary of G7 by @lewis_goodall https://t.co/HEDQ0cbcLF,very insightful summary of g by  ,summary
1.4043376157264325e+18,2021-06-14 07:19:13+00:00,['1404337615726432257'],"@Rozkez67 Norfolk is beautiful and less visited. Amazing wildlife, kayaking,walks etc.", norfolk is beautiful and less visited amazing wildlife kayakingwalks etc,norfolk wildlife kayakingwalks
1.4041808978601042e+18,2021-06-13 20:56:29+00:00,['1404180897860104207'],@Beany_1 @HelenSalmon2 Rubbish swim technique,  rubbish swim technique,swim technique
1.4040850910899855e+18,2021-06-13 14:35:47+00:00,['1404085091089985544'],@Peston Report it far and wide @Peston, report it far and wide ,report
1.404018565146157e+18,2021-06-13 10:11:25+00:00,['1404018565146157057'],@DPJHodges This is what is it's like to possess zero ability in critical analysis., this is what is it's like to possess zero ability in critical analysis,ability analysis
1.4040170091768463e+18,2021-06-13 10:05:15+00:00,['1404017009176846337'],@abbyaug @HelenSalmon2 Awesome,  awesome,awesome
1.404016461400662e+18,2021-06-13 10:03:04+00:00,['1404016461400662018'],@joelymack Thank you Jo and good luck. My thoughts and positivevibes are with you, thank you jo and good luck my thoughts and positivevibes are with you,thank luck thought positivevibes
1.4040154021920932e+18,2021-06-13 09:58:51+00:00,['1404015402192093189'],@BorisJohnson @G7 So what was with the private jet and what is with the new coal mine? You really don't keep your word do you?,  so what was with the private jet and what is with the new coal mine you really don't keep your word do you,coal mine word
1.403790103059878e+18,2021-06-12 19:03:36+00:00,['1403790103059877896'],#greasedpiglet. Harsh on piglets! https://t.co/nzyQe1joPU, harsh on piglets ,harsh piglet
1.403764885104771e+18,2021-06-12 17:23:23+00:00,['1403764885104771072'],@bbclaurak But yeah but no but yeah but no..., but yeah but no but yeah but no,yeah
1.403648048266371e+18,2021-06-12 09:39:07+00:00,['1403648048266371073'],I've just signed the petition demanding a Tory donor is stripped of his peerage. You can sign here https://t.co/C0MTrJGmFF,i've just signed the petition demanding a tory donor is stripped of his peerage you can sign here ,petition donor peerage
1.403400011916923e+18,2021-06-11 17:13:31+00:00,['1403400011916922884'],Good work Goodall. https://t.co/yZLGG1qXVT,good work goodall ,work goodall
1.4033752772505805e+18,2021-06-11 15:35:14+00:00,['1403375277250580482'],@bbclaurak Oh feck off Laura. You know he has slashes overseas aid. How do you live with yourself spouting this crap? You are better than this!, oh feck off laura you know he has slashes overseas aid how do you live with yourself spouting this crap you are better than this,laura crap
1.403373916836569e+18,2021-06-11 15:29:49+00:00,['1403373916836569093'],@BBCPolitics Is there any footage of the other leader's faces?, is there any footage of the other leader's faces,footage
1.4033734977123246e+18,2021-06-11 15:28:09+00:00,['1403373497712324608'],@BBCPolitics What a feckin embarrassment., what a feckin embarrassment,embarrassment
1.403373020065022e+18,2021-06-11 15:26:16+00:00,['1403373020065021953'],Oh My God! That is excruciating. We definitely have the worlds Trump now. How fucking embarrassing. https://t.co/eDwqhC1gqw,oh my god that is excruciating we definitely have the worlds trump now how fucking embarrassing ,world embarrassing
1.4033235324368077e+18,2021-06-11 12:09:37+00:00,['1403323532436807687'],@LBC @TomSwarbrick1 I'm with Gordon.,  i'm with gordon,gordon
1.403322213839868e+18,2021-06-11 12:04:22+00:00,['1403322213839867906'],"@AliMaccers @thetrainline ""Nick...Nick....""",  nicknick,nicknick
1.4033164820339794e+18,2021-06-11 11:41:36+00:00,['1403316482033979398'],"Thanks Colin, all followed if I wasn't already. Great to be in touch 😊 https://t.co/YR32dVtgMA",thanks colin all followed if i wasn't already great to be in touch  ,thanks
1.4032680714652918e+18,2021-06-11 08:29:14+00:00,['1403268071465291778'],"@skiologist @NoIAmTonyGreen My thoughts too. Also a clever pic, as Biden is sharp suited and Johnson looks as though he cant dress himself properly.",  my thoughts too also a clever pic as biden is sharp suited and johnson looks as though he cant dress himself properly,thought clever biden look dress
1.403267748566868e+18,2021-06-11 08:27:57+00:00,['1403267748566867969'],@BorisJohnson @G7 You are a disgrace.,  you are a disgrace,disgrace
1.4032420220273336e+18,2021-06-11 06:45:43+00:00,['1403242022027333634'],@TheTweetOfGod Was Richard Dwarkin on the panel?, was richard dwarkin on the panel,dwarkin panel
1.4030789960032788e+18,2021-06-10 19:57:55+00:00,['1403078996003278856'],I just subscribed to Dominic Cummings substack because I want to hear what he has to say about Hancock and Johnson. https://t.co/YPT8rAvVPM,i just subscribed to dominic cummings substack because i want to hear what he has to say about hancock and johnson ,cummings substack hancock johnson
1.403058565842092e+18,2021-06-10 18:36:44+00:00,['1403058565842092038'],@Jo_WhiteheadUK @HelenSalmon2 Saying exactly the same thing a few hours ago to a mate!,  saying exactly the same thing a few hours ago to a mate,thing hour mate
1.403006849998377e+18,2021-06-10 15:11:14+00:00,['1403006849998376966'],@ThatTimWalker That was brilliant by Dawn., that was brilliant by dawn,dawn
1.4029598546968658e+18,2021-06-10 12:04:29+00:00,['1402959854696865796'],@Andrew_Adonis Good luck. I think this would really engage the young and create a wave of enthusiasm to vote., good luck i think this would really engage the young and create a wave of enthusiasm to vote,luck wave enthusiasm
1.402959583031726e+18,2021-06-10 12:03:24+00:00,['1402959583031726084'],@nigel_revell Spot on! She was excellent., spot on she was excellent,spot
1.402959333885895e+18,2021-06-10 12:02:25+00:00,['1402959333885894659'],@POTUS Only do it if he stops being a lying buffoon who shames us all. He has bought the country to its knees for his own gain. The media are lap dogs and gaslight us all with his lies and nonsense., only do it if he stops being a lying buffoon who shames us all he has bought the country to its knees for his own gain the media are lap dogs and gaslight us all with his lies and nonsense,buffoon country knee gain medium nonsense
1.402957956233273e+18,2021-06-10 11:56:57+00:00,['1402957956233273348'],Go Dawn Butler,go dawn butler,dawn butler
1.402955519250375e+18,2021-06-10 11:47:16+00:00,['1402955519250374656'],"@Wulf_Helm I am so sorry Wulf. So, so sad for you.", i am so sorry wulf so so sad for you,wulf
1.402928289186988e+18,2021-06-10 09:59:03+00:00,['1402928289186988034'],@POTUS Morning Mr President. Please knock some sense into our hopeless buffoon of a PM and his cronys ministers., morning mr president please knock some sense into our hopeless buffoon of a pm and his cronys ministers,morning president please sense buffoon crony minister
1.402923036735574e+18,2021-06-10 09:38:11+00:00,['1402923036735574019'],Matt Hancock thinks he is a super hero 🙄,matt hancock thinks he is a super hero ,matt hancock hero
1.402916326016967e+18,2021-06-10 09:11:31+00:00,['1402916326016966656'],@BorisJohnson Buffoon, buffoon,buffoon
1.4028872953432392e+18,2021-06-10 07:16:10+00:00,['1402887295343239168'],@MarinaHyde @e_casalicchio Gavin Williamson,  gavin williamson,gavin williamson
1.4027437433971057e+18,2021-06-09 21:45:44+00:00,['1402743743397105664'],@DavidGHFrost You assume we are all stupid and buy the lines you feed to the media. Nope!, you assume we are all stupid and buy the lines you feed to the media nope,line medium nope
1.4027426830561485e+18,2021-06-09 21:41:31+00:00,['1402742683056148483'],@mi6rogue Excellent news., excellent news,news
1.4023844397123584e+18,2021-06-08 21:58:00+00:00,['1402384439712358406'],@CPJenkinson1 @BBCFarmingToday @BBCr4today Farming today is excellent. They have been discussing this for weeks now.,   farming today is excellent they have been discussing this for weeks now,today week
1.4023837210225582e+18,2021-06-08 21:55:08+00:00,['1402383721022558209'],That's because your boss refused to close borders to India! You are risking the lives of young people. Fingers crossed we don't get a wave of young people dying because of your incompetence. https://t.co/miXsoW6yr8,that's because your boss refused to close borders to india you are risking the lives of young people fingers crossed we don't get a wave of young people dying because of your incompetence ,border life people finger wave people incompetence
1.4023407873843692e+18,2021-06-08 19:04:32+00:00,['1402340787384369153'],This is because of our idiot PM and his reluctance to close borders. https://t.co/2lm9z4FPUT,this is because of our idiot pm and his reluctance to close borders ,idiot reluctance border
1.4023376542897152e+18,2021-06-08 18:52:05+00:00,['1402337654289715211'],Well done Gareth Southgate. https://t.co/lTH90QEbRK,well done gareth southgate ,gareth southgate
1.4023355942153216e+18,2021-06-08 18:43:54+00:00,['1402335594215321602'],@GavinWilliamson It doesn't matter in a democratic country with free speech., it doesn't matter in a democratic country with free speech,matter country speech
1.4022835671289733e+18,2021-06-08 15:17:10+00:00,['1402283567128973312'],Good work @labourlewis https://t.co/7V1EZaZxZN,good work  ,work
1.4020254622185636e+18,2021-06-07 22:11:33+00:00,['1402025462218563584'],"Good tweet Adil, spot on. https://t.co/JmZk8z1mXN",good tweet adil spot on ,tweet adil spot
1.4020251588739154e+18,2021-06-07 22:10:20+00:00,['1402025158873915400'],@politi_qs No. Bring back BERCOW, no bring back bercow,bring bercow
1.4020246315534664e+18,2021-06-07 22:08:15+00:00,['1402024631553466368'],"@marcolonghi4dn @Bren4Bassetlaw Do you know what, all they are doing is making a gesture to recognise racism still exists.That is all. If you don't get this, I feel sorry for you and you are the divisive policy maker, not England football players.",  do you know what all they are doing is making a gesture to recognise racism still existsthat is all if you don't get this i feel sorry for you and you are the divisive policy maker not england football players,gesture racism sorry policy maker football player
1.4019807963202355e+18,2021-06-07 19:14:04+00:00,['1401980796320235525'],@SandraDunn1955 @SydesJokes @sarahwest2012 @stephanie_fbpe @freeWorld2 @Ger_Rico10 @moggsta01 @joebuchel @sheilamcbirnie @laj1956 @DPB59 @randombigbird @pauljg1956 @SophieCLeighton @Robertboston62 @FbpeNederland @Chrissy_Clarke @Hiroshimalily @HoughAlison All good thank you and you?,                   all good thank you and you,thank
1.4018448137843098e+18,2021-06-07 10:13:43+00:00,['1401844813784309760'],What a view. https://t.co/qhg04x6uIm,what a view ,view
1.4018268410574316e+18,2021-06-07 09:02:18+00:00,['1401826841057431553'],"Thanks Colin, morning everyone, all followed 🥰 https://t.co/D4PamimI2I",thanks colin morning everyone all followed  ,thanks morning everyone
1.4016563540922368e+18,2021-06-06 21:44:50+00:00,['1401656354092236801'],@Beverle43882833 @JolyonMaugham @RobertBuckland @GoodLawProject What Beverley says. You have my support 100%. Kerp going Jo.,    what beverley says you have my support kerp going jo,support
1.401608501802279e+18,2021-06-06 18:34:42+00:00,['1401608501802278914'],"@david_o_gabriel Prefer to take my chances with the vaccine rather than the virus. All medicines carry a risk, so of you want to live your life as per the dark ages feel free.", prefer to take my chances with the vaccine rather than the virus all medicines carry a risk so of you want to live your life as per the dark ages feel free,prefer chance vaccine virus medicine risk life dark
1.4015440812647424e+18,2021-06-06 14:18:43+00:00,['1401544081264742400'],Johnson really doesnt understand relationships does he? https://t.co/wRxFJXMHxV,johnson really doesnt understand relationships does he ,johnson relationship
1.4014636367202386e+18,2021-06-06 08:59:03+00:00,['1401463636720238595'],@colymncolins @BorisJohnson @G7 It isn't his idea and the UK have so far sadly contributed zero. Other countries have donated millions. He is claiming credit for the wotl others have done. I hope vaccines get to Kenya.,   it isn't his idea and the uk have so far sadly contributed zero other countries have donated millions he is claiming credit for the wotl others have done i hope vaccines get to kenya,idea country million credit wotl others vaccine
1.4012913229887775e+18,2021-06-05 21:34:20+00:00,['1401291322988777473'],@colymncolins @BorisJohnson @G7 You mean selfless love for himself.,   you mean selfless love for himself,love
1.401282378761388e+18,2021-06-05 20:58:48+00:00,['1401282378761388037'],@adilray speaks truth. https://t.co/ZvCj8tJq9H, speaks truth ,speaks truth
1.4012609005946348e+18,2021-06-05 19:33:27+00:00,['1401260900594634757'],What about everyone between the ages of 18 and 30 who haven't yet received it? https://t.co/VF0cxXvR0J,what about everyone between the ages of and who haven't yet received it ,everyone
1.4012604646344868e+18,2021-06-05 19:31:43+00:00,['1401260464634486784'],Strummer and Jones = genius. That is all. Playing this on my bass. What a tune. https://t.co/EnUls0jGIF,strummer and jones  genius that is all playing this on my bass what a tune ,strummer jones genius bass tune
1.4012583281273242e+18,2021-06-05 19:23:14+00:00,['1401258328127324163'],@Omz2468 @NeilDotObrien Opposite of woke = twat. #proudtobewoke too,  opposite of woke  twat  too,opposite woke twat
1.4012579241781985e+18,2021-06-05 19:21:37+00:00,['1401257924178198528'],"Opposite of ""woke"" = twat. https://t.co/hwtLlhnB2T",opposite of woke  twat ,opposite woke twat
1.4012310563348849e+18,2021-06-05 17:34:52+00:00,['1401231056334884865'],Worth a read. Have opted out. https://t.co/li48Yq1i8Q,worth a read have opted out ,read
1.4011121653655183e+18,2021-06-05 09:42:26+00:00,['1401112165365518337'],@MMcminty Bill Gates will be pleased., bill gates will be pleased,bill gate
1.400862494529405e+18,2021-06-04 17:10:20+00:00,['1400862494529404929'],@nicktolhurst They are so out of touch., they are so out of touch,touch
1.4008601811064095e+18,2021-06-04 17:01:08+00:00,['1400860181106409474'],"Am genuinely surprised by the huge positive response to my tweet from yesterday. To everyone who has followed I will try and return the favour, in the meantime let's keep on keeping on. https://t.co/2Zb9WjVVSK",am genuinely surprised by the huge positive response to my tweet from yesterday to everyone who has followed i will try and return the favour in the meantime let's keep on keeping on ,response tweet yesterday everyone favour meantime
1.4007873571466936e+18,2021-06-04 12:11:45+00:00,['1400787357146693633'],So the same benefits as when in the EU but without FOM 🙄🙄🙄 https://t.co/wbThLSlo5V,so the same benefits as when in the eu but without fom  ,benefit
