id,created_at,edit_history_tweet_ids,text,clean_text,nouns
1.418520696242819e+18,2021-07-23 10:37:43+00:00,['1418520696242819074'],@DPJHodges All they are doing is categorizing the Tory Smirk. Johnson is a lazy piece of smirk. Rees-Mogg an entitled piece of smirk and so on..., all they are doing is categorizing the tory smirk johnson is a lazy piece of smirk reesmogg an entitled piece of smirk and so on,tory smirk johnson piece smirk reesmogg piece smirk
1.418440879619158e+18,2021-07-23 05:20:33+00:00,['1418440879619158018'],"@chunkymark Me, have been since 4, can't sleep! Off for a river swim.", me have been since can't sleep off for a river swim,river swim
1.418440601922642e+18,2021-07-23 05:19:27+00:00,['1418440601922641924'],"The UK really does punch above its weight in the arts and culture, a huge part of our ever diminishing soft power. Another example of The Tories knowing the price of everything and the value of nothing. https://t.co/ctkajyk4Xl",the uk really does punch above its weight in the arts and culture a huge part of our ever diminishing soft power another example of the tories knowing the price of everything and the value of nothing ,weight culture part power example tory price everything value nothing
1.4182359751558308e+18,2021-07-22 15:46:20+00:00,['1418235975155830790'],@DPJHodges @Staxmartin Is there a rule that lies should not be told in the House?,  is there a rule that lies should not be told in the house,rule house
1.418230929861063e+18,2021-07-22 15:26:17+00:00,['1418230929861062657'],@DawnButlerBrent Well done @DawnButlerBrent worth being asked to leave when you have spoken truth to power #Solidarity, well done  worth being asked to leave when you have spoken truth to power ,truth power
1.417966331551486e+18,2021-07-21 21:54:52+00:00,['1417966331551485957'],"@pritipatel This mentions Sarah Everard, but we see what you did. Please resign.", this mentions sarah everard but we see what you did please resign,mention
1.4178624262011372e+18,2021-07-21 15:01:59+00:00,['1417862426201137160'],@nicktolhurst Both newspapers need to go the same way as the NOTW! Rags of the first order, both newspapers need to go the same way as the notw rags of the first order,newspaper notw order
1.4175960180743496e+18,2021-07-20 21:23:23+00:00,['1417596018074349568'],@MarcusRashford You really dont need to justify yourself @MarcusRashford just keep on keeping on. The @spectator no zilch about real life and hardship. We love you, you really dont need to justify yourself  just keep on keeping on the  no zilch about real life and hardship we love you,need zilch life hardship
1.4175940676349665e+18,2021-07-20 21:15:38+00:00,['1417594067634966531'],"@gehapeters Thank you, it's pretty depressing for sure.", thank you it's pretty depressing for sure,thank
1.4175925586879035e+18,2021-07-20 21:09:38+00:00,['1417592558687903745'],@BarrySheerman No idea!, no idea,idea
1.4175862809516485e+18,2021-07-20 20:44:41+00:00,['1417586280951648261'],"@DebbieMillar11 Fin 3 weeks ago, Josie just yesterday as only recently returned from Portugal. Worrying times", fin weeks ago josie just yesterday as only recently returned from portugal worrying times,week josie yesterday portugal time
1.4175860038843228e+18,2021-07-20 20:43:35+00:00,['1417586003884322817'],"Beautiful North Wales, just now. https://t.co/5K08H1NfR9",beautiful north wales just now ,wale
1.41754577878503e+18,2021-07-20 18:03:45+00:00,['1417545778785030148'],"@DebbieMillar11 Not readily available D, no, but I did see some stats that suggest most deaths are now below 60! Its grim for sure. Goodness only knows what the rest of the world thinks. We have our very own Bolsonaro/Trump in charge. It really is allvery depressing.", not readily available d no but i did see some stats that suggest most deaths are now below its grim for sure goodness only knows what the rest of the world thinks we have our very own bolsonarotrump in charge it really is allvery depressing,stats death grim goodness rest world bolsonarotrump charge
1.4175361826663342e+18,2021-07-20 17:25:37+00:00,['1417536182666334215'],So @DailyMailUK what is your tale on this? https://t.co/VpktJxFY8K,so  what is your tale on this ,tale
1.417514829447897e+18,2021-07-20 16:00:46+00:00,['1417514829447897090'],@ManMadeMoon I think about it all the time...😡, i think about it all the time,time
1.4175141008636682e+18,2021-07-20 15:57:52+00:00,['1417514100863668227'],@taru_sisko Lordy! 😳😳, lordy ,lordy
1.4174225605480817e+18,2021-07-20 09:54:07+00:00,['1417422560548081676'],@Kevin_Maguire @GMB He meant other people's parents.,  he meant other people's parents,parent
1.4172538321412465e+18,2021-07-19 22:43:39+00:00,['1417253832141246465'],The Bloviator is panicking. So he should be. @BorisJohnson should also resign. https://t.co/xjE6Elw7iy,the bloviator is panicking so he should be  should also resign ,bloviator
1.417253092874199e+18,2021-07-19 22:40:43+00:00,['1417253092874199040'],@BorisJohnson How does it feel to be King of the World? Really hopeless leadership. Resign., how does it feel to be king of the world really hopeless leadership resign,king world leadership resign
1.4172240323957023e+18,2021-07-19 20:45:14+00:00,['1417224032395702273'],"@uksciencechief Such a shame,.this will fuel anti vaxxer stance. You have been amazing, but this is a real.problem.", such a shamethis will fuel anti vaxxer stance you have been amazing but this is a realproblem,shamethis vaxxer stance realproblem
1.4170826112945152e+18,2021-07-19 11:23:17+00:00,['1417082611294515203'],@MichaelRosenYes The Lion The Witch and The Wardrobe CS Lewis. I still re read it even now and the other chronicles., the lion the witch and the wardrobe cs lewis i still re read it even now and the other chronicles,lion witch wardrobe lewis chronicle
1.4167770723625452e+18,2021-07-18 15:09:11+00:00,['1416777072362545153'],@allthecitizens 4. And stop smirking, and stop smirking,smirking
1.416775858744877e+18,2021-07-18 15:04:21+00:00,['1416775858744877067'],"@BorisJohnson Words have literally failed me ""shakes head""", words have literally failed me shakes head,word shake
1.416361091798651e+18,2021-07-17 11:36:13+00:00,['1416361091798650882'],@gajido_ian Where you live sounds idyllic. I guess many of the early morning pics you take are a result if your early morning g spring checks? They are a real tonic., where you live sounds idyllic i guess many of the early morning pics you take are a result if your early morning g spring checks they are a real tonic,morning result morning spring check tonic
1.416356443813462e+18,2021-07-17 11:17:45+00:00,['1416356443813462016'],The Daily Express...do people really believe this shite? https://t.co/5zarxthnqC,the daily expressdo people really believe this shite ,expressdo people
1.416295599679357e+18,2021-07-17 07:15:59+00:00,['1416295599679356932'],@gajido_ian What do you check.the spring for? Sounds like a lovely job 😊, what do you checkthe spring for sounds like a lovely job ,spring sound
1.4160233063571538e+18,2021-07-16 13:13:59+00:00,['1416023306357153796'],@IsabelOakeshott @BBCNews I wonder how many bots responded to this tweet?,  i wonder how many bots responded to this tweet,tweet
1.4160222996108616e+18,2021-07-16 13:09:59+00:00,['1416022299610861575'],@miffythegamer Cant believe Simon McCoy joined them TBH!, cant believe simon mccoy joined them tbh,cant simon mccoy
1.4160216750832763e+18,2021-07-16 13:07:30+00:00,['1416021675083276289'],So in touch with the working classes...🙄 https://t.co/gi1VblOgtA,so in touch with the working classes ,touch class
1.4160059840367862e+18,2021-07-16 12:05:09+00:00,['1416005984036786176'],"@SydesJokes @AlbertoLetizia2 @Nattygriffiths8 @TheStephenRalph @villageofsoho @WagonTrain2 @UKEmigration2EU @datchmog @Liberal_Isms @AngelKe71279249 @Marc_Hadley @Mick130160 @sarahwest2012 @OurJax @DelythC @tabooze @fls1067 @routundroulleur Thanks Colin, hi everyone all followed if I wasn't already. Great to be connected 😊",                  thanks colin hi everyone all followed if i wasn't already great to be connected ,thanks everyone
1.4159748842289316e+18,2021-07-16 10:01:34+00:00,['1415974884228931584'],"So I tweeted this because well, I love my mum and dad and want them to have the best life they can in the time they have left. The number of antimask tweets in response beggars belief (th lots of +ve ones). I am astounded by the lack of empathy towards those that are vulnerable! https://t.co/YiDpPesSMn",so i tweeted this because well i love my mum and dad and want them to have the best life they can in the time they have left the number of antimask tweets in response beggars belief th lots of ve ones i am astounded by the lack of empathy towards those that are vulnerable ,life time number tweet response beggar lack towards
1.4159546035402056e+18,2021-07-16 08:40:59+00:00,['1415954603540205569'],@drm148 @IsabelOakeshott And I question that you have any commonsense.,  and i question that you have any commonsense,question commonsense
1.415953797483008e+18,2021-07-16 08:37:47+00:00,['1415953797483008002'],"@sacredeye_ @IsabelOakeshott The author Denis G Rancourt is a discredited professor who was fired for grade inflation on some if his students. He is also a climate change denier. His credentials are at the best, questionable.",  the author denis g rancourt is a discredited professor who was fired for grade inflation on some if his students he is also a climate change denier his credentials are at the best questionable,author denis rancourt professor grade inflation student climate change credential
1.4159474240326085e+18,2021-07-16 08:12:27+00:00,['1415947424032608258'],@LindaJB1921 @IsabelOakeshott Face masks and good hand hygiene mitigate risk of infection. There is loads out there to support that. Out of interest do you support vaccines?,  face masks and good hand hygiene mitigate risk of infection there is loads out there to support that out of interest do you support vaccines,face mask hand hygiene mitigate risk infection load interest vaccine
1.4159457315427492e+18,2021-07-16 08:05:44+00:00,['1415945731542749184'],"@Richard45640886 @ezekiels_tomb @IsabelOakeshott Ash, the Texas data.",   ash the texas data,texas data
1.4159440238487593e+18,2021-07-16 07:58:56+00:00,['1415944023848759296'],@Richard45640886 @ezekiels_tomb @IsabelOakeshott But you are still here. Show me your research.,   but you are still here show me your research,research
1.415943304290648e+18,2021-07-16 07:56:05+00:00,['1415943304290648064'],@LindaJB1921 @Scott_Lymm @just1cewarrior @IsabelOakeshott I agree for people who are hearing impaired masks pose problems. But for virus transmission they work. How would you feel being operated on by a surgeon with no mask?,    i agree for people who are hearing impaired masks pose problems but for virus transmission they work how would you feel being operated on by a surgeon with no mask,people mask problem transmission surgeon mask
1.4159428741103084e+18,2021-07-16 07:54:22+00:00,['1415942874110308354'],"@Richard45640886 @ezekiels_tomb @IsabelOakeshott Before you do, please share your evidence.",   before you do please share your evidence,share evidence
1.4159415990754386e+18,2021-07-16 07:49:18+00:00,['1415941599075438594'],"@Richard45640886 @ezekiels_tomb @IsabelOakeshott Show me your research, I need a link.",   show me your research i need a link,research link
1.4159414667955282e+18,2021-07-16 07:48:47+00:00,['1415941466795528192'],"@Richard45640886 @ezekiels_tomb @IsabelOakeshott Bye then, go and polish your tin helmet.",   bye then go and polish your tin helmet,helmet
1.4159412208833823e+18,2021-07-16 07:47:48+00:00,['1415941220883382273'],"@LindaJB1921 @IsabelOakeshott Show me your research, convince me. Am happy to be corrected.",  show me your research convince me am happy to be corrected,research convince
1.4159408394744013e+18,2021-07-16 07:46:17+00:00,['1415940839474401282'],"@ezekiels_tomb @Richard45640886 @IsabelOakeshott Let's all agree, Richard is just a time waster. Bye Richard.",   let's all agree richard is just a time waster bye richard,richard time waster richard
1.4159364215762534e+18,2021-07-16 07:28:44+00:00,['1415936421576253441'],"@the_boy_olly @IsabelOakeshott https://t.co/IIUrYAfeoa here you go chum. Presented nice and simply so you can understand. Also, how would you feel being operated on by a surgeon who was unmasked?",   here you go chum presented nice and simply so you can understand also how would you feel being operated on by a surgeon who was unmasked,surgeon
1.4159362368297902e+18,2021-07-16 07:28:00+00:00,['1415936236829790212'],"@Richard45640886 @IsabelOakeshott https://t.co/IIUrYAfeoa here you go chum. Presented nice and simply so you can understand. Also, how would you feel being operated on by a surgeon who was unmasked?",   here you go chum presented nice and simply so you can understand also how would you feel being operated on by a surgeon who was unmasked,surgeon
1.415932979415814e+18,2021-07-16 07:15:03+00:00,['1415932979415814144'],@Otto_English Quality viewing. Highly recommend #CrackerTV., quality viewing highly recommend ,quality
1.415927922586792e+18,2021-07-16 06:54:58+00:00,['1415927922586791938'],"@IsabelOakeshott Masks protect others! My elderly mum and dad, who had just started to regain there limited social life are now planning to stay at home again. All because people like you reject a simple act that would help to protect them. Enjoy your freedom, but remove it from others. Thanks!", masks protect others my elderly mum and dad who had just started to regain there limited social life are now planning to stay at home again all because people like you reject a simple act that would help to protect them enjoy your freedom but remove it from others thanks,mask others life home people freedom others thanks
1.4159267580676055e+18,2021-07-16 06:50:20+00:00,['1415926758067605505'],"So much bad economic news is hidden by this Tory Govt and the right wing media fail to hold them to account. See here, a 30% decline in British exports. Truss should resign. Well, they all should to be fair!! https://t.co/ht4vgQG1yJ",so much bad economic news is hidden by this tory govt and the right wing media fail to hold them to account see here a decline in british exports truss should resign well they all should to be fair ,news tory govt wing medium decline export truss
1.4158063869785743e+18,2021-07-15 22:52:01+00:00,['1415806386978574341'],@nicktolhurst Good news, good news,news
1.41580073670169e+18,2021-07-15 22:29:34+00:00,['1415800736701689857'],@IsabelOakeshott @BBCNews The risk associated with the virus is higher than the risk associated with any vaccine. Get real!,  the risk associated with the virus is higher than the risk associated with any vaccine get real,risk virus risk vaccine
1.4157396838967665e+18,2021-07-15 18:26:58+00:00,['1415739683896766470'],Unbelievable. The populus must be asleep. https://t.co/pvu6ggNxx8,unbelievable the populus must be asleep ,populus
1.4157217037165568e+18,2021-07-15 17:15:31+00:00,['1415721703716556806'],"@JohnLewisEU My 25 yr old daughter, just returned from 2 years in Portugal. Not yet vaccinated. So worried.", my yr old daughter just returned from years in portugal not yet vaccinated so worried,daughter year portugal
1.415710686353707e+18,2021-07-15 16:31:44+00:00,['1415710686353707009'],Wow! That's amazing! Thank you Colin 😊 https://t.co/9BeVAegnmF,wow that's amazing thank you colin  ,thank
1.415646935260844e+18,2021-07-15 12:18:25+00:00,['1415646935260844043'],@maartenvda I am so sorry to hear this. You have my thoughts, i am so sorry to hear this you have my thoughts,thought
1.415621614746624e+18,2021-07-15 10:37:48+00:00,['1415621614746624000'],@other_mrs I hear ya. I get told to leave it. Things will get better etc. Reallly tiring!, i hear ya i get told to leave it things will get better etc reallly tiring,thing
1.415620519966167e+18,2021-07-15 10:33:27+00:00,['1415620519966167041'],@BlokeOnWheels So honest and amazing Joe. It is information like this that will ultimately help to.change attitudes and availability of services. Keep on keeping on!, so honest and amazing joe it is information like this that will ultimately help tochange attitudes and availability of services keep on keeping on,information tochange attitude availability service
1.415563130818736e+18,2021-07-15 06:45:24+00:00,['1415563130818736128'],@AlpacaFinlay Happy birthday Finlay 😊😊 https://t.co/zFLTPipOgz, happy birthday finlay  ,birthday
1.4154300401505526e+18,2021-07-14 21:56:33+00:00,['1415430040150552579'],@DPJHodges It really doesnt matter, it really doesnt matter,matter
1.4154043239457792e+18,2021-07-14 20:14:22+00:00,['1415404323945779205'],"@Sanchooo10 No need to apologise, you were fantastic and very courageous. Thank you for giving us such a good run", no need to apologise you were fantastic and very courageous thank you for giving us such a good run,need thank
1.4153703919089254e+18,2021-07-14 17:59:32+00:00,['1415370391908925440'],@SydesJokes @MrsArcanum @harrietpoland2 @paulloli @RhymesRadical @CVN59283571 @kmoorman1968 @Frankie61H @EricaNeustadt @glennathey @mike20490420 @AbhorBrexit @barhambird @Danckh @SusanKelly18 @WhiskeyCat1324 @MinooOsborne @jimbub @codfather Thank you Colin and hii everyone who I have newly followed today. Great to be connected.,                   thank you colin and hii everyone who i have newly followed today great to be connected,thank everyone today
1.4152986177793106e+18,2021-07-14 13:14:20+00:00,['1415298617779310594'],"If politicians think.footballers should stay out of politics, as a nurse, I think politicians should stay out.of the NHS! https://t.co/4uilnn8fAp",if politicians thinkfootballers should stay out of politics as a nurse i think politicians should stay outof the nhs ,politician thinkfootballers politics nurse politician
1.4152981044677878e+18,2021-07-14 13:12:17+00:00,['1415298104467787782'],Good reporting Goodall. https://t.co/iLZRKKlW5Y,good reporting goodall ,reporting goodall
1.4152287882381312e+18,2021-07-14 08:36:51+00:00,['1415228788238131203'],Excellent work team 💪💪 https://t.co/9PB9RRRtHq,excellent work team  ,work team
1.415228115228545e+18,2021-07-14 08:34:10+00:00,['1415228115228545024'],"@DPJHodges Here we go, powerful white bloke with exceptional ideas that are always right! And he doesn't see the problem 🙄", here we go powerful white bloke with exceptional ideas that are always right and he doesn't see the problem ,bloke idea problem
1.4152116097152614e+18,2021-07-14 07:28:35+00:00,['1415211609715261442'],@labourlewis Yes. Was there last year and people really are struggling. Difficult to see., yes was there last year and people really are struggling difficult to see,year people
1.4152112718096056e+18,2021-07-14 07:27:15+00:00,['1415211271809605634'],"@DPJHodges @_a_y How do you know? How many people have you spoken to,or is this your gut feeling?",  how do you know how many people have you spoken toor is this your gut feeling,people toor feeling
1.415210088827138e+18,2021-07-14 07:22:33+00:00,['1415210088827138052'],"@AndrewRosindell You have lost this one @AndrewRosindell Please focus on policies that mean footballers can focus on football, instead of just being a twunt, theres a good chap!", you have lost this one  please focus on policies that mean footballers can focus on football instead of just being a twunt theres a good chap,please policy footballer football twunt chap
1.415209191719981e+18,2021-07-14 07:18:59+00:00,['1415209191719981058'],@GaryLineker @williamnhutton Enjoying your tweets again @GaryLineker keep it up. So many of us have had enough of being told to keep quiet.,  enjoying your tweets again  keep it up so many of us have had enough of being told to keep quiet,tweet enough
1.4150689010550252e+18,2021-07-13 22:01:31+00:00,['1415068901055025156'],No.not yet. Still a way to go I fear. https://t.co/po2Y04FTYn,nonot yet still a way to go i fear ,nonot
1.4150284197551923e+18,2021-07-13 19:20:39+00:00,['1415028419755192321'],@AlpacaFinlay Night night Finlay, night night finlay,night night finlay
1.4150125592671928e+18,2021-07-13 18:17:38+00:00,['1415012559267192836'],Doesn't mean he is morally right though. https://t.co/1H6Dzy7xA0,doesn't mean he is morally right though ,mean
1.4149686185347768e+18,2021-07-13 15:23:02+00:00,['1414968618534776835'],Not in my name. When are we marching? https://t.co/UL2ySmky8A,not in my name when are we marching ,name
1.4149317481489408e+18,2021-07-13 12:56:31+00:00,['1414931748148940801'],@AlpacaFinlay Solidarity Finlay 💪💪, solidarity finlay ,solidarity finlay
1.4149154414919434e+18,2021-07-13 11:51:43+00:00,['1414915441491943427'],"@RoshanaMN Rubbish,it really is. I hope your day is OK", rubbishit really is i hope your day is ok,rubbishit
1.414915261694718e+18,2021-07-13 11:51:00+00:00,['1414915261694717954'],@RoshanaMN Done that many times., done that many times,time
1.414915134791766e+18,2021-07-13 11:50:30+00:00,['1414915134791766020'],@tradegovuk Wow! Some big names and super powers there 🙄😴, wow some big names and super powers there ,name power
1.4148752143920456e+18,2021-07-13 09:11:52+00:00,['1414875214392045574'],"@UKLabour Come on @UKLabour this is hopeless.its about attitudes, social media is the vehicle.", come on  this is hopelessits about attitudes social media is the vehicle,attitude medium vehicle
1.4148739389796966e+18,2021-07-13 09:06:48+00:00,['1414873938979696655'],"@DildoHarding21 Dang, and no correct button! I was on a roll!", dang and no correct button i was on a roll,dang button roll
1.414873420223943e+18,2021-07-13 09:04:45+00:00,['1414873420223942656'],Is @BorisJohnson using the @BBCNews to focus group the country on @pritipatel? @BBC asking for comments on @OfficialTM_3 tweet right now.,is  using the  to focus group the country on   asking for comments on  tweet right now,group country comment tweet
1.4148638309251604e+18,2021-07-13 08:26:38+00:00,['1414863830925160452'],@KarlTurnerMP @SteveBarclay Then he needs to demonstrate his moral backbone and stop selling his soul.,  then he needs to demonstrate his moral backbone and stop selling his soul,backbone soul
1.4148614537655828e+18,2021-07-13 08:17:12+00:00,['1414861453765582849'],@SirRogerGale @mikegalsworthy Well done. A Tory with a moral backbone.,  well done a tory with a moral backbone,tory backbone
1.4148594486030008e+18,2021-07-13 08:09:14+00:00,['1414859448603000833'],Steve Barclay completely tone deaf. https://t.co/TBXQvYtPYE,steve barclay completely tone deaf ,barclay deaf
1.4148571505271562e+18,2021-07-13 08:00:06+00:00,['1414857150527156225'],@marenbennette @taru_sisko @Anna_Soubry @SteveBarclay Well you clearly need to do something to fill your time. What a strange tweet!,    well you clearly need to do something to fill your time what a strange tweet,something time tweet
1.4148544641173957e+18,2021-07-13 07:49:25+00:00,['1414854464117395456'],@AltFactsUK1 @LBC @NickFerrariLBC Woah! So many assumptions in that tweet! I wonder why?🤔🤔,   woah so many assumptions in that tweet i wonder why,assumption tweet
1.4148527817065636e+18,2021-07-13 07:42:44+00:00,['1414852781706563586'],@AlpacaFinlay Morning Finlay 😊, morning finlay ,morning finlay
1.4147236916325458e+18,2021-07-12 23:09:47+00:00,['1414723691632545796'],I hope so too..enough! Not holding my breath though! https://t.co/2Ay3wxFceV,i hope so tooenough not holding my breath though ,breath
1.414723258214142e+18,2021-07-12 23:08:03+00:00,['1414723258214141953'],"@Peston Appalling, but not a surprise..", appalling but not a surprise,surprise
1.4147196706329764e+18,2021-07-12 22:53:48+00:00,['1414719670632976390'],@MarcusRashford And all true Marcus. We are with you ❤, and all true marcus we are with you ,marcus
1.4147091242275348e+18,2021-07-12 22:11:53+00:00,['1414709124227534848'],@JohnnyMercerUK This Tory Party have bought more division to the nation than I can ever remember. More.of you need to stand up to the chinless Cabinet wonders and force an end to these crazy culture wars., this tory party have bought more division to the nation than i can ever remember moreof you need to stand up to the chinless cabinet wonders and force an end to these crazy culture wars,tory party division nation moreof chinless cabinet wonder force culture
1.4147024895222784e+18,2021-07-12 21:45:32+00:00,['1414702489522278405'],"@OfficialTM_3 You are awesome, your team mates are awesome, Gareth is awesome. So proud of you", you are awesome your team mates are awesome gareth is awesome so proud of you,team mate gareth
1.4146991977151324e+18,2021-07-12 21:32:27+00:00,['1414699197715132420'],"@Robertboston62 Well done, is this the same bloke?", well done is this the same bloke,bloke
1.414694976735359e+18,2021-07-12 21:15:40+00:00,['1414694976735358984'],@reecejames_24 Spot on., spot on,spot
1.414694634190672e+18,2021-07-12 21:14:19+00:00,['1414694634190671875'],@OliverDowden This is you and your frickin stupid culture war stoking it. You and your colleagues have ruined the reputation of the English. Please all of you resign., this is you and your frickin stupid culture war stoking it you and your colleagues have ruined the reputation of the english please all of you resign,culture colleague reputation please
1.414693877638996e+18,2021-07-12 21:11:18+00:00,['1414693877638995972'],@pritipatel @England Total lack of self awareness. Resign.,  total lack of self awareness resign,lack self awareness resign
1.4146937328095887e+18,2021-07-12 21:10:44+00:00,['1414693732809588739'],@pritipatel @England Where were you when it was all kicking off in London last night?,  where were you when it was all kicking off in london last night,london night
